index,url,valid,domain,title,description,image,published,archive,content,quote,language,keyword
https://www.stern.de/gesellschaft/regional/berlin-brandenburg/soziales--essen-und-ein-bett--kaeltehilfe-fuer-beduerftige-startet-33960366.html,https://www.stern.de/gesellschaft/regional/berlin-brandenburg/soziales--essen-und-ein-bett--kaeltehilfe-fuer-beduerftige-startet-33960366.html,0,www.stern.de,Soziales: Essen und ein Bett: Kältehilfe für Bedürftige startet,"Der Winter rückt näher. Für Obdachlose kommt mit der Kälte teilweise eine lebensbedrohliche Gefahr. Die Städte wollen ein Angebot machen, um Kältetote zu vermeiden.",https://image.stern.de/33960368/t/JB/v3/w1440/r1.7778/-/01--urnnewsmldpacom2009010123110199779045v3w800h600l638t457r1918b1374jpeg---243eb36bf50fb4b6.jpg,2023-11-01T12:27:08Z,,"Der Winter rückt näher. Für Obdachlose kommt mit der Kälte teilweise eine lebensbedrohliche Gefahr. Die Städte wollen ein Angebot machen, um Kältetote zu vermeiden.
Brandenburgs größte Städte wollen… [+2440 chars]",,de,'Kältebus'
https://www.zeit.de/zeit-magazin/wochenmarkt/2023-10/weine-weihnachten-pinot-noir-cuvee-winter-weinkolumne,https://www.zeit.de/zeit-magazin/wochenmarkt/2023-10/weine-weihnachten-pinot-noir-cuvee-winter-weinkolumne,0,www.zeit.de,Weine zu Weihnachten: Wünsch-dir-Weine,Bald beginnt die Festsaison. Denken Sie frühzeitig an die richtige Weinbegleitung! Unser Kolumnist hat viele Empfehlungen und verbeugt sich vor seinen Jahreslieblingen.,https://img.zeit.de/zeit-magazin/wochenmarkt/2023-10/weine-weihnachten-pinot-noir-cuvee-winter-weinkolumne-teaser/wide__1300x731,2023-11-02T17:29:00Z,https://web.archive.org/web/20231103054742/https://www.zeit.de/zeit-magazin/wochenmarkt/2023-10/weine-weihnachten-pinot-noir-cuvee-winter-weinkolumne,"""Wein doch""
 heißt Gero von Randows ZEIT-ONLINE-Kolumne über Wein. Bis 2020 war er 
ZEIT-Redakteur, einige Jahre lang auch Korrespondent in Frankreich. Er 
ist Mitglied von Verkostungsjurys, organ… [+625 chars]",,de,'Wein'
https://www.stern.de/kultur/musik/albumveroeffentlichung---was-ne-geile-zeit---wolfgang-petry-mit-weihnachtsalbum--33966526.html,https://www.stern.de/kultur/musik/albumveroeffentlichung---was-ne-geile-zeit---wolfgang-petry-mit-weihnachtsalbum--33966526.html,0,www.stern.de,"Albumveröffentlichung: ""Was ne geile Zeit"": Wolfgang Petry mit Weihnachtsalbum","""Schneeflöckschen, Weißröckschen"" - Wolfgang Petry bringt erstmals seit 23 Jahren wieder ein Weihnachtsalbum heraus. Im Interview erzählt der 72-Jährige, wie er das Fest als kleiner Junge erlebt hat.",https://image.stern.de/33966528/t/KV/v1/w1440/r1.7778/-/03--urnnewsmldpacom2009010123110299793602v4w800h600l652t107r1801b1013jpeg---59a470bde5b12f59.jpg,2023-11-03T07:30:59Z,https://web.archive.org/web/20231103075613/https://www.stern.de/kultur/musik/albumveroeffentlichung---was-ne-geile-zeit---wolfgang-petry-mit-weihnachtsalbum--33966526.html,"""Schneeflöckschen, Weißröckschen"" - Wolfgang Petry bringt erstmals seit 23 Jahren wieder ein Weihnachtsalbum heraus. Im Interview erzählt der 72-Jährige, wie er das Fest als kleiner Junge erlebt hat.… [+3125 chars]",,de,'Schnee'
