index,url,valid,domain,title,description,image,published,archive,content,quote,language,keyword
https://www.zeit.de/news/2025-05/06/wie-die-gastronomie-gaeste-ghosting-kontert,https://www.zeit.de/news/2025-05/06/wie-die-gastronomie-gaeste-ghosting-kontert,0,www.zeit.de,"""Walk-in""-Trend: Wie die Gastronomie Gäste-Ghosting kontert","Hier finden Sie Informationen zu dem Thema „""Walk-in""-Trend“. Lesen Sie jetzt „Wie die Gastronomie Gäste-Ghosting kontert“.",https://img.zeit.de/news/2025-05/06/wie-die-gastronomie-gaeste-ghosting-kontert-image-group/wide__1300x731,2025-05-06T16:00:38Z,https://web.archive.org/web/20250507015335/https://www.zeit.de/news/2025-05/06/wie-die-gastronomie-gaeste-ghosting-kontert,"Es war einmal die Spontanität: Früher ging man in Deutschland einfach so ins Wirtshaus oder in die Gaststätte, bekam ohne Reservierung einen Platz, bestellte sein Gericht, hat recht zügig gegessen un… [+5449 chars]",,de,'Gas'
https://www.stern.de/familie/gardena-solar-bewaesserung-fuer-92-statt-140-euro--garten-deals-am-mittwoch-34734620.html,https://www.stern.de/familie/gardena-solar-bewaesserung-fuer-92-statt-140-euro--garten-deals-am-mittwoch-34734620.html,0,www.stern.de,Kraut & Dübel: Gardena Solar-Bewässerung für 92 statt 140 Euro: Top Garten-Deals am Mittwoch,"Ob Hecke schneiden oder Unkraut jäten, Schädlinge bekämpfen oder Grillen: Hier finden Sie täglich wechselnde Deals rund um Haus und Garten, die sich wirklich lohnen.",https://image.stern.de/34905868/t/96/v5/w1440/r1.7778/-/bewaesserungssytem.jpg,2025-05-07T07:13:00Z,,"Kopiere den aktuellen Link
Zur Merkliste hinzufügen
Ob Hecke schneiden oder Unkraut jäten, Schädlinge bekämpfen oder Grillen: Hier finden Sie täglich wechselnde Deals rund um Haus und Garten, die s… [+3404 chars]",,de,'Bewässerung'
https://stadt-bremerhaven.de/clippy-ist-zurueck-nostalgische-ki-assistenz-im-windows-look/,https://stadt-bremerhaven.de/clippy-ist-zurueck-nostalgische-ki-assistenz-im-windows-look/,0,stadt-bremerhaven.de,Clippy ist zurück: Nostalgische KI-Assistenz im Windows-Look,"Manchmal sind es die kleinen Dinge, die uns ein Lächeln ins Gesicht zaubern. Heute stelle ich euch ein Projekt vor, das Nostalgie und moderne Technologie auf charmante Weise verbindet. Die Rede ist von Clippy (hierzulande Karl Klammer), einer Desktop-Anwendun…",https://stadt-bremerhaven.de/wp-content/uploads/2025/05/clippy-screen.jpg,2025-05-07T07:30:48Z,,"Manchmal sind es die kleinen Dinge, die uns ein Lächeln ins Gesicht zaubern. Heute stelle ich euch ein Projekt vor, das Nostalgie und moderne Technologie auf charmante Weise verbindet. Die Rede ist v… [+2022 chars]",,de,'Not'
https://www.tagesspiegel.de/gesellschaft/psychologe-louis-lewitan-im-gesprach-manchmal-spricht-schweigen-lauter-als-jedes-wort-13640989.html,https://www.tagesspiegel.de/gesellschaft/psychologe-louis-lewitan-im-gesprach-manchmal-spricht-schweigen-lauter-als-jedes-wort-13640989.html,0,www.tagesspiegel.de,Psychologe Louis Lewitan im Gespräch: „Manchmal spricht Schweigen lauter als jedes Wort“,"Kälte und Unbehagen in den Familien der Täter und Mitläufer, Alkohol zur Betäubung: Lewitan befragte 100 Deutsche für sein Buch „Der blinde Fleck“ über den Umgang mit der Nazizeit.",https://www.tagesspiegel.de/images/13648441/alternates/BASE_16_9_W1400/1746537661000/hitler-greets-young-hitler-youth-conscripts-guarding-the-reich-chancellery-on-april-20-1945-the-da.jpeg,2025-05-07T07:34:50Z,http://archive.md/20250507080956/https://www.tagesspiegel.de/gesellschaft/psychologe-louis-lewitan-im-gesprach-manchmal-spricht-schweigen-lauter-als-jedes-wort-13640989.html,"Herr Lewitan, Sie haben zusammen mit Ihrem Mitautor Stephan Lebert für Ihr Buch Der blinde Fleck rund 100 Deutsche dazu befragt, wie in ihren Familien mit dem Nationalsozialismus umgegangen wurde. Wo… [+381 chars]",,de,'Kälte'
https://www.welt.de/sport/fussball/champions-league/article256079628/Inter-Mailand-im-Finale-aber-der-Uefa-Praesident-rechnet-mit-Italien-ab.html,https://www.welt.de/sport/fussball/champions-league/article256079628/Inter-Mailand-im-Finale-aber-der-Uefa-Praesident-rechnet-mit-Italien-ab.html,0,www.welt.de,Inter im Finale – aber der Uefa-Präsident rechnet mit Italien ab,"Inter Mailand überrascht die Fußballwelt mit beeindruckenden Leistungen in der Champions League und steht nach einem epischen Sieg über den FC Barcelona im Finale. Uefa-Präsident Ceferin gießt aber Wasser in den Wein, er spricht von „Schande“.",https://img.welt.de/img/sport/fussball/champions-league/mobile256079682/0457931107-ci16x9-w1200/Champions-League-Semi-Final-Second-Leg-Inter-Milan-v-FC-Barcelona.jpg,2025-05-07T07:49:02Z,https://web.archive.org/web/20250507131407/https://www.welt.de/sport/fussball/champions-league/article256079628/Inter-Mailand-im-Finale-aber-der-Uefa-Praesident-rechnet-mit-Italien-ab.html,Inter Mailand überrascht die Fußballwelt mit beeindruckenden Leistungen in der Champions League und steht nach einem epischen Sieg über den FC Barcelona im Finale. Uefa-Präsident Ceferin gießt aber W… [+2429 chars],,de,'Wein'
https://www.diepresse.com/19655281/voest-chef-eibensteiner-fordert-dringend-hilfe-bei-energiekosten,https://www.diepresse.com/19655281/voest-chef-eibensteiner-fordert-dringend-hilfe-bei-energiekosten,0,www.diepresse.com,Voest-Chef Eibensteiner fordert dringend Hilfe bei Energiekosten,"Österreichs größter Stahlerzeuger, die Voestalpine, fordert eine sofortige Verlängerung der Strompreiskompensation. Dass die Politik das Instrument bisher nicht verlängert hat, stößt bei Voest-Chef Herbert Eibensteiner auf völliges Unverständnis.",https://img.diepresse.com/public/incoming/a62fxn-kein-Titel/alternates/DPR_SOCIAL_NACHRICHTEN/kein%20Titel,2025-05-07T08:19:29Z,,"Österreichs größter Stahlerzeuger, die Voestalpine, fordert eine sofortige Verlängerung der Strompreiskompensation. Dass die Politik das Instrument bisher nicht verlängert hat, stößt bei Voest-Chef H… [+3607 chars]",,de,'Energiekosten'
https://www.perlentaucher.de/im-kino/filmkritik-zu-last-breath-von-alex-parkinson.html,https://www.perlentaucher.de/im-kino/filmkritik-zu-last-breath-von-alex-parkinson.html,0,www.perlentaucher.de,"IM KINO: Das Leben, eine bittersüße Frucht","Um drei Anstrengungen kreist Alex Parkinsons ""Last Breath"". Und doch herrscht im Zentrum dieses Films über einen Tauchunfall am Grund der Nordsee völlige Ruhe. 
 Von
 Robert Wagner.",https://www.perlentaucher.de/cdata/tpic/11976.jpg,2025-05-07T09:31:23Z,https://web.archive.org/web/20250507144331/https://www.perlentaucher.de/im-kino/filmkritik-zu-last-breath-von-alex-parkinson.html,"""Last Breath"" ist der Film eines Versprechens. Tiefseetaucher Chris Lemons (Finn Cole) begibt sich zum Grund der Nordsee, um dort Wartungsarbeiten an einer Pipeline durchzuführen. Zu Hause wartet sei… [+6163 chars]",,de,'Tau'
https://snipz.de/2025/kootesday-bewaesserungssystem/,https://snipz.de/2025/kootesday-bewaesserungssystem/,0,snipz.de,"KootesDay 20 m Micro Drip Bewässerungssystem für nur 23,39€ – Prime","Bei Amazon gibt es für die Hobbygärtner aktuell das KootesDay 20 m Micro Drip Bewässerungssystem für nur 23,39€ inkl. Prime-Versand. Um auf den Preis zu kommen, aktiviert ihr zunächst den 40% Rabatt-Coupon auf der Produktseite und nutzt im Warenkorb anschließ…",https://gadgetwelt.de/wp-content/uploads/2025/05/bewaesserungssystem-2.jpg,2025-05-07T10:12:04Z,,"Bei Amazon gibt es für die Hobbygärtner aktuell das KootesDay 20 m Micro Drip Bewässerungssystem für nur 23,39 inkl. Prime-Versand.
Um auf den Preis zu kommen, aktiviert ihr zunächst den 40% Rabatt-… [+1192 chars]",,de,'Bewässerung'
https://www.golem.de/sonstiges/zustimmung/auswahl.html?from=https://www.golem.de/news/zertifizierung-fuer-energieeffizienz-energy-star-soll-abgeschafft-werden-2505-195981.html&referer=https://t.co/c2b3e570ce,https://www.golem.de/sonstiges/zustimmung/auswahl.html?from=https://www.golem.de/news/zertifizierung-fuer-energieeffizienz-energy-star-soll-abgeschafft-werden-2505-195981.html&referer=https://t.co/c2b3e570ce,0,www.golem.de,Zertifizierung für Energieeffizienz: Energy Star soll abgeschafft werden,"Der Energy Star hilft, jährlich 40 Milliarden US-Dollar an Energiekosten einzusparen. US-Unternehmen und -Handelsorganisationen fordern dessen Erhalt. (Umweltschutz, GreenIT)",,2025-05-07T10:15:01Z,,"Besuchen Sie Golem.de wie gewohnt mit Werbung und Tracking,
 indem Sie der Nutzung aller Cookies zustimmen.
 Details zum Tracking finden Sie im Privacy Center.
Skript wurde nicht geladen. Informat… [+607 chars]",,de,'Energiekosten'
https://www.tagesspiegel.de/wissen/die-seefrauen-von-jeju-es-ist-als-hatten-sie-eine-art-superkraft-13652803.html,https://www.tagesspiegel.de/wissen/die-seefrauen-von-jeju-es-ist-als-hatten-sie-eine-art-superkraft-13652803.html,0,www.tagesspiegel.de,"Die Seefrauen von Jeju: „Es ist, als hätten sie eine Art Superkraft“","Ihre genetische Ausstattung könnte den südkoreanischen Taucherinnen helfen, extreme Bedingungen zu überstehen. Forschenden könnte sie neue Ansätze zur Behandlung von Bluthochdruck liefern.",https://www.tagesspiegel.de/images/13652863/alternates/BASE_16_9_W1400/1746612681000/a-group-of-haenyeo-divers-in-jeju-korea.jpeg,2025-05-07T10:15:41Z,https://web.archive.org/web/20250508030922/https://www.tagesspiegel.de/wissen/die-seefrauen-von-jeju-es-ist-als-hatten-sie-eine-art-superkraft-13652803.html,"Sie tauchen ohne Pressluftflasche, bei jedem Wetter und viele bis ins hohe Alter: Die Haenyeo von der südkoreanischen Insel Jeju gelten als außergewöhnlich. Eine neue genetische Analyse könnte nun er… [+5389 chars]",,de,'Tau'
https://www.n-tv.de/auto/Kein-einziger-Offroad-Reifen-kann-ueberzeugen-article25751190.html,https://www.n-tv.de/auto/Kein-einziger-Offroad-Reifen-kann-ueberzeugen-article25751190.html,0,www.n-tv.de,All-Terrain-Reifen im ADAC-Test: Kein einziger Offroad-Reifen kann überzeugen,"Der ADAC hat acht All-Terrain-Reifen einem Vergleichstest unterzogen und zusätzlich einem Pkw-Ganzjahresreifen mit Schneeflockensymbol gegenübergestellt. Das Ergebnis fällt für die AT-Reifen ernüchternd aus: Keiner der Geländereifen erreicht die Note ""gut"".",https://www.n-tv.de/img/incoming/crop25747482/6541329292-cImg_16_9-w1200/Der-ADAC-hat-acht-Offroad-Reifen-unter-die-Lupe-genommen.jpg,2025-05-07T11:01:41Z,https://web.archive.org/web/20250507141006/https://www.n-tv.de/auto/Kein-einziger-Offroad-Reifen-kann-ueberzeugen-article25751190.html,Der ADAC hat acht All-Terrain-Reifen einem Vergleichstest unterzogen und zusätzlich einem Pkw-Ganzjahresreifen mit Schneeflockensymbol gegenübergestellt. Das Ergebnis fällt für die AT-Reifen ernüchte… [+2424 chars],,de,'Schnee'
https://www.perlentaucher.de/buecherschau/2025-05-07.html,https://www.perlentaucher.de/buecherschau/2025-05-07.html,0,www.perlentaucher.de,BÜCHERSCHAU DES TAGES: Das tut den Knochen gut,"Die FAZ lässt sich von Charles Nodiers romantischem Räuber Jean Sbogar den Kopf verdrehen. Außerdem besucht sie mit Chantal Ackermann ""Eine Familie in Brüssel"", in deren emotionaler Kälte nur die Wärme kleiner Dinge bleibt. Dlf ist beeindruckt von Lizzie Doro…",https://www.perlentaucher.de/cdata/buecherschau-twitterbild/7733.png,2025-05-07T12:00:00Z,https://web.archive.org/web/20250507132317/https://www.perlentaucher.de/buecherschau/2025-05-07.html,"Perlentaucher-Fakten
108089
Rezensionsnotizen
65725
Bücher
37343
Buchautoren
Bücherschau des Tages
Das tut den Knochen gut
Notizen zu den Buchkritiken des Tages aus FAZ, FR, NZZ, SZ, taz, Ze… [+721 chars]",,de,'Kälte'
https://www.bild.de/unterhaltung/tv-fernsehformate/shopping-queen-das-duell-alle-infos-zu-konzept-und-sendeterminen-6818ceb66255e217f6c1a54b,https://www.bild.de/unterhaltung/tv-fernsehformate/shopping-queen-das-duell-alle-infos-zu-konzept-und-sendeterminen-6818ceb66255e217f6c1a54b,0,www.bild.de,"Handlung, Moderator, Sendezeit - Alle Infos zu „Shopping Queen – Das Duell“",Wer hat das bessere Gespür für Trends und Stil? Neue Idee bringt frischen Wind in das Format,"https://images.bild.de/6818ceb66255e217f6c1a54b/19697f9e8428236b30cb5e7e2fca2fe2,8a21975?w=1280",2025-05-07T12:18:54Z,https://web.archive.org/web/20250507230317/https://www.bild.de/unterhaltung/tv-fernsehformate/shopping-queen-das-duell-alle-infos-zu-konzept-und-sendeterminen-6818ceb66255e217f6c1a54b,TV-Liebling Guido Maria Kretschmer bringt frischen Wind in seine bekannte Styling-Show Shopping Queen: In der neuen Staffel wartet ein neues Konzept auf die Kandidaten und Zuschauer. Was bleibt: Unte… [+1885 chars],,de,'Wind'
https://www.welt.de/debatte/article256081174/Merz-und-Macron-Einen-diktierten-Frieden-werden-wir-niemals-akzeptieren.html,https://www.welt.de/debatte/article256081174/Merz-und-Macron-Einen-diktierten-Frieden-werden-wir-niemals-akzeptieren.html,0,www.welt.de,Einen diktierten Frieden werden wir niemals akzeptieren,Deutschland und Frankreich werden die Ukraine weiter bei ihrer Verteidigung unterstützen – schreiben Emmanuel Macron und Friedrich Merz im gemeinsamen WELT-Gastbeitrag. Auch bei der Migration setzen sie auf deutsch-französische Zusammenarbeit.,https://img.welt.de/img/debatte/mobile256081538/8657937387-ci16x9-w1200/Merz-Makes-First-Foreign-Trip-As-German-Chancellor.jpg,2025-05-07T12:36:19Z,http://archive.md/20250507135856/https://www.welt.de/debatte/article256081174/Merz-und-Macron-Einen-diktierten-Frieden-werden-wir-niemals-akzeptieren.html,Deutschland und Frankreich werden die Ukraine weiter bei ihrer Verteidigung unterstützen schreiben Emmanuel Macron und Friedrich Merz im gemeinsamen WELT-Gastbeitrag. Auch bei der Migration setzen si… [+9528 chars],,de,'Energiekosten'
https://hallespektrum.de/aktuelles/tief-in-der-flaute-wirtschaft-in-sachsen-anhalt-weiter-in-jammerlaune/470997/,https://hallespektrum.de/aktuelles/tief-in-der-flaute-wirtschaft-in-sachsen-anhalt-weiter-in-jammerlaune/470997/,0,hallespektrum.de,Tief in der Flaute: Wirtschaft in Sachsen-Anhalt weiter in Jammerlaune,"Die Hoffnung war zart, beinahe schon trotzig: Nach dem Wechsel im Bundestag, vollzogen mit der Neuwahl im Februar, mochten manche Unternehmer in Sachsen-Anhalt auf frischen Wind aus Berlin setzen. Doch mit dem Beginn des neuen Jahres ist auch diese Erwartung …",https://hallespektrum.de/wp-content/uploads/2025/04/pipeline.jpg,2025-05-07T12:48:16Z,,"Die Hoffnung war zart, beinahe schon trotzig: Nach dem Wechsel im Bundestag, vollzogen mit der Neuwahl im Februar, mochten manche Unternehmer in Sachsen-Anhalt auf frischen Wind aus Berlin setzen. Do… [+3167 chars]",,de,'Wind'
https://www.sueddeutsche.de/muenchen/tanja-kinkel-roman-revolution-1848-frauenrechte-li.3246976,https://www.sueddeutsche.de/muenchen/tanja-kinkel-roman-revolution-1848-frauenrechte-li.3246976,0,www.sueddeutsche.de,"Ein Roman von Tanja Kinkel über die Anfänge der Demokratie 1848/49: Frauen, die sich empören",Tanja Kinkel erzählt in ihrem Roman „Im Wind der Freiheit“ vom Ringen um die Demokratie in den Revolutionsjahren 1848/49 – und nimmt dabei mit Figuren wie der frühen Feministin Louise Otto insbesondere den Kampf um Frauenrechte in den Blick.,https://www.sueddeutsche.de/2025/05/06/85369423-7662-45b6-b4a0-a5f63caa02a0.jpeg?q=60&fm=webp&width=1200&rect=0%2C0%2C4000%2C2250,2025-05-07T12:51:57Z,,"Wie erzählt man vom schwierigen Ringen um die Demokratie vor knapp 200 Jahren? Wie vom Kampf mutiger Frauen, die bei Menschenrechten nicht nur an die Rechte von Männern denken, sondern mitgemeint sei… [+4100 chars]",,de,'Wind'
https://www.googlewatchblog.de/2025/05/android-google-bringt-ganz-neues-akku-icon-auf-die-pixel-smartphones-expressive-design-screenshots/,https://www.googlewatchblog.de/2025/05/android-google-bringt-ganz-neues-akku-icon-auf-die-pixel-smartphones-expressive-design-screenshots/,0,www.googlewatchblog.de,Android: Google bringt ganz neues Akku-Icon auf die Pixel-Smartphones – Expressive Design (Screenshots),"Google wird schon bald das neue Material 3 Expressive Design für Android einführen, das bereits auf zahlreichen Screenshots und Hands-on-Videos geleakt worden ist. Der frische Wind für die Smartphone-Oberfläche wird aber nicht nur die Apps und Betriebssystem-…",https://www.googlewatchblog.de/wp-content/uploads/google-pixel-akku-batterie.jpg,2025-05-07T13:00:20Z,,"Google wird schon bald das neue Material 3 Expressive Design für Android einführen, das bereits auf zahlreichen Screenshots und Hands-on-Videos geleakt worden ist. Der frische Wind für die Smartphone… [+3340 chars]",,de,'Wind'
https://www.focus.de/immobilien/netzdienlichkeit-deutschland-auf-blackout-kurs-nur-so-retten-wir-unsere-stromversorgung_68ad18fb-2258-40de-b041-a7d4f00537da.html,https://www.focus.de/immobilien/netzdienlichkeit-deutschland-auf-blackout-kurs-nur-so-retten-wir-unsere-stromversorgung_68ad18fb-2258-40de-b041-a7d4f00537da.html,0,www.focus.de,Netzdienlichkeit: Deutschland auf Blackout-Kurs: Nur so retten wir unsere Stromversorgung,"Die Politik setzt auf publikumstaugliche Solar-Anlagen und Windkraft. Doch das eigentliche Rückgrat der Energiewende – Speicher, Netze, Steuerung – blieb weitgehend unmodernisiert. Die Folgen sind ein überlastetes Netz und ein steigendes Risiko für Stromausfä…",https://quadro.burda-forward.de/ctf/56902749-14f7-4fe2-aade-dee188c25ca7.eeb50aee-c5fb-4f07-8c6f-033c2b60f2ff.jpeg?im=RegionOfInterestCrop%3D%281200%2C630%29%2CregionOfInterest%3D%28693%2C390%29&hash=ba3d43ca42f86bcd8168e773f8e031ebba619c47b62abebbebbda493d8227f36,2025-05-07T14:11:58Z,,"Deutschland rühmt sich für seine Vorreiterrolle in der Energiewende doch die Realität sieht düster aus. Der Anteil erneuerbarer Energien am Bruttoendenergieverbrauch (Strom, Wärme und Mobilität) lieg… [+9101 chars]",,de,'Wind'
https://steiermark.orf.at/stories/3304354/,https://steiermark.orf.at/stories/3304354/,0,steiermark.orf.at,KAGes-Klimaprojekt mit Preis ausgezeichnet,Die KAGes darf sich über einen Preis für eine klimafreundliche Anlage freuen. Ausgezeichnet wurde die neue Wärme-Kälte-Kopplungsanlage am Landeskrankenhaus Graz. Dabei wird vorhandene Abwärme des Spitals zur Erzeugung von Energie genutzt.,https://ibs.orf.at/stm?image=https%3A%2F%2Foekastatic.orf.at%2Fmims%2F2025%2F19%2F02%2Fcrops%2Fw%3D1200%2Ch%3D627%2Cq%3D75%2F2615862_master_1004502_neue_waerme-kaelte-anlage_am_lkh_univ._klinikum_1__c_kages.jpg%3Fs%3D485867f2da3b28b37a0b7b1d03ec5f6746eb38e8,2025-05-07T15:19:00Z,https://web.archive.org/web/20250507232243/https://steiermark.orf.at/stories/3304354/,"In Krankenhäusern besteht das ganze Jahr über ein großer Bedarf an Kälte und an Wärme. OP-Bereiche und medizintechnische Großgeräte müssen, unabhängig von der Jahreszeit, gekühlt werden, während die … [+1663 chars]",,de,'Kälte'
https://www.jungewelt.de/artikel/499591.ein-fest-mit-tränen-in-den-augen.html,https://www.jungewelt.de/artikel/499591.ein-fest-mit-tränen-in-den-augen.html,0,www.jungewelt.de,Kommentar: Ein Fest mit Tränen in den Augen,Gastkommentar des russischen Botschafters Sergej J. Netschajew zum 80. Jahrestag des Sieges im Großen Vaterländischen Krieg und der Befreiung Deutschlands und Europas vom Nazismus.,https://www.jungewelt.de/img/1100/208518.jpg,2025-05-07T17:37:24Z,https://web.archive.org/web/20250507204214/https://www.jungewelt.de/artikel/499591.ein-fest-mit-tr%25C3%25A4nen-in-den-augen.html,Am 9. Mai wird in unserem Land der 80. Jahrestag des Sieges im Großen Vaterländischen Krieg und der Befreiung Deutschlands und Europas vom Nazismus gefeiert. Für alle Völker der ehemaligen Sowjetunio… [+6174 chars],,de,'Kälte'
https://www.stern.de/kultur/-kampf-der-realitystars---frischer--darm--wind-in-der-sala-35703852.html,https://www.stern.de/kultur/-kampf-der-realitystars---frischer--darm--wind-in-der-sala-35703852.html,0,www.stern.de,"""Kampf der Realitystars"": Frischer (Darm-)Wind in der Sala","Mit neuer Moderatorin und teils neuen Regeln: So startete ""Kampf der Realitystars"" in die sechste Staffel.",https://image.stern.de/35703856/t/qs/v1/w1440/r1.7778/-/07--frischer--darm--wind-in-der-sala---16-9---spoton-article-1096448.jpg,2025-05-07T21:33:00Z,https://web.archive.org/web/20250508020235/https://www.stern.de/kultur/-kampf-der-realitystars---frischer--darm--wind-in-der-sala-35703852.html,"Kopiere den aktuellen Link
Zur Merkliste hinzufügen
Mit neuer Moderatorin und teils neuen Regeln: So startete ""Kampf der Realitystars"" in die sechste Staffel.
Alles neu beim ""Kampf der Realitystar… [+6739 chars]",,de,'Wind'
https://www.brigitte.de/aktuell/-kampf-der-realitystars---dieser-kandidat-bringt-frischen--darm--wind-in-die-sala-13986112.html,https://www.brigitte.de/aktuell/-kampf-der-realitystars---dieser-kandidat-bringt-frischen--darm--wind-in-die-sala-13986112.html,0,www.brigitte.de,"""Kampf der Realitystars"": Dieser Kandidat bringt frischen (Darm-)Wind in die Sala","Mit neuer Moderatorin und teils neuen Regeln: So startete ""Kampf der Realitystars"" in die sechste Staffel.",https://image.brigitte.de/13986114/t/KE/v1/w1440/r1.7778/-/07--dieser-kandidat-bringt-frischen--darm--wind-in-die-sala---1-1---spoton-article-1096448.jpg,2025-05-07T21:36:00Z,https://web.archive.org/web/20250507224349/https://www.brigitte.de/aktuell/-kampf-der-realitystars---dieser-kandidat-bringt-frischen--darm--wind-in-die-sala-13986112.html,"Mit neuer Moderatorin und teils neuen Regeln: So startete ""Kampf der Realitystars"" in die sechste Staffel.
Alles neu beim ""Kampf der Realitystars"" (Mittwoch 20:15 bei RTLzwei und vorab bei RTL+)? In… [+6966 chars]",,de,'Wind'
https://www.stern.de/familie/gardena-solar-bewaesserung-fuer-92-statt-140-euro--garten-deals-am-donnerstag-34734620.html,https://www.stern.de/familie/gardena-solar-bewaesserung-fuer-92-statt-140-euro--garten-deals-am-donnerstag-34734620.html,0,www.stern.de,Kraut & Dübel: Gardena Solar-Bewässerung für 92 statt 140 Euro: Top Garten-Deals am Donnerstag,"Ob Hecke schneiden oder Unkraut jäten, Schädlinge bekämpfen oder Grillen: Hier finden Sie täglich wechselnde Deals rund um Haus und Garten, die sich wirklich lohnen.",https://image.stern.de/34905868/t/96/v5/w1440/r1.7778/-/bewaesserungssytem.jpg,2025-05-08T07:35:00Z,https://web.archive.org/web/20250508082300/https://www.stern.de/familie/gardena-solar-bewaesserung-fuer-92-statt-140-euro--garten-deals-am-donnerstag-34734620.html,"Kopiere den aktuellen Link
Zur Merkliste hinzufügen
Ob Hecke schneiden oder Unkraut jäten, Schädlinge bekämpfen oder Grillen: Hier finden Sie täglich wechselnde Deals rund um Haus und Garten, die s… [+3404 chars]",,de,'Bewässerung'
https://www.urlaubspiraten.de/hotels/mont-royal-mosel,https://www.urlaubspiraten.de/hotels/mont-royal-mosel,0,www.urlaubspiraten.de,Der perfekte Moselblick ,"Ein Gläschen Wein und dazu dieser Ausblick – einfach traumhaft! Ob mit Freunden oder Familie – im Ferienpark Mont Royal verbringt ihr mit Sicherheit eine gute Zeit! Hier wird für Groß und Klein einiges geboten.

3 Nächte mit dieser herrlichen Aussicht bekommt…",https://image.urlaubspiraten.de/720/image/upload/v1746514617/Impressions%20and%20Other%20Assets/Bildschirmfoto_2025-05-05_um_17.19.35_u2gq6k.png,2025-05-08T09:15:00Z,,"Zusätzliche Informationen
Ferienhäuser in den Mosel-Weinbergen
Mitten im windungsreichsten Teil des Mosellaufes, umgeben von rebenbewachsenen Hängen, befindet sich das Weindorf Kröv. Oberhalb thron… [+1303 chars]",,de,'Wein'
https://www.sueddeutsche.de/bayern/bayern-wetter-neuschnee-alpen-sonne-li.3249301,https://www.sueddeutsche.de/bayern/bayern-wetter-neuschnee-alpen-sonne-li.3249301,0,www.sueddeutsche.de,Wetter in Bayern: Aprilwetter im Mai - Neuschnee in den Bergen,"In den höheren Lagen der Alpen kann es weiteren Schnee geben, überwiegend wird es zum Muttertagswochenende aber schön und wieder wärmer im Freistaat.",https://www.sueddeutsche.de/2025/05/08/b804bf23-e1db-429a-93a9-215a7f36773d.jpeg?q=60&fm=webp&width=1200&rect=0%2C149%2C3000%2C1687,2025-05-08T10:42:33Z,,"Am Wochenende können sich die Menschen in Bayern dann aber auf viel Sonne einstellen, am Samstag an den Alpen mit vereinzelten Schauern und Gewittern. Die Temperaturen steigen am Wochenende auf bis z… [+303 chars]",,de,'Schnee'
https://www.tagesspiegel.de/berlin/bezirke/berliner-winzerfest-rheingauer-weinbrunnen-sprudelt-bald-wieder--aber-mit-mehr-auflagen-13650901.html,https://www.tagesspiegel.de/berlin/bezirke/berliner-winzerfest-rheingauer-weinbrunnen-sprudelt-bald-wieder--aber-mit-mehr-auflagen-13650901.html,0,www.tagesspiegel.de,Berliner Winzerfest: „Rheingauer Weinbrunnen“ sprudelt bald wieder – aber mit mehr Auflagen,"Der traditionsreiche Freiluft-Ausschank am Rüdesheimer Platz in Wilmersdorf startet in die neue Saison. Diesmal müssen die Veranstalter stärker darauf achten, dass es nicht zu voll wird.",https://www.tagesspiegel.de/images/11702429/alternates/BASE_16_9_W1400/1716453449000/weinbrunnen-rudesheimer-platz-wilmersdorf-berlin-deutschland-wine-fountain-rudesheimer-platz-wilmersdorf-berl.jpeg,2025-05-08T16:37:04Z,http://archive.md/20250509065158/https://www.tagesspiegel.de/berlin/bezirke/berliner-winzerfest-rheingauer-weinbrunnen-sprudelt-bald-wieder--aber-mit-mehr-auflagen-13650901.html,Schon seit 1967 servieren Winzer aus dem Landkreis Rheingau-Taunus ihren Wein und Sekt auf dem Plateau über dem Siegfriedbrunnen am Rüdesheimer Platz. In diesem Jahr dauert die Saison des Rheingauer … [+145 chars],,de,'Wein'
