index,url,valid,domain,title,description,image,published,archive,content,quote,language,keyword
https://www.welt.de/politik/deutschland/article243536271/Gegenwind-fuer-Gruene-Modernes-Fracking-laut-Karlsruher-Institut-fuer-Technologie-absolut-vertretbar.html,https://www.welt.de/politik/deutschland/article243536271/Gegenwind-fuer-Gruene-Modernes-Fracking-laut-Karlsruher-Institut-fuer-Technologie-absolut-vertretbar.html,0,www.welt.de,Modernes Fracking laut Karlsruher Institut für Technologie „absolut vertretbar“,"Fracking-Gas könnte bei ausreichender Vorerkundung technisch innerhalb von sechs bis neun Monaten gefördert werden. Frank Schilling, Professor für Technische Petrophysik am Karlsruher Institut für Technologie (KIT), widerspricht grünen Umweltpolitikern.",https://img.welt.de/img/politik/deutschland/mobile243536281/1441354387-ci16x9-w1200/Umstrittenes-Thema-Fracking.jpg,2023-02-01T04:44:21Z,http://archive.md/20230201073530/https://www.welt.de/politik/deutschland/article243536271/Gegenwind-fuer-Gruene-Modernes-Fracking-laut-Karlsruher-Institut-fuer-Technologie-absolut-vertretbar.html,Fracking zur Förderung von heimischem Gas in tiefen Gesteinsschichten ist aus Sicht eines Experten beim Karlsruher Institut für Technologie (KIT) zu Unrecht ein Tabu. Modernes Fracking ist in der akt… [+5127 chars],,de,'Gas'
https://burgenland.orf.at/stories/3192754/,https://burgenland.orf.at/stories/3192754/,0,burgenland.orf.at,Gemüsebauern zittern vor Grüner Reiswanze,Der heimischen Landwirtschaft droht eine neue Plage: Die Grüne Reiswanze ist durch den Klimawandel auch in unseren Breiten auf dem Vormarsch. Experten befürchten wegen des eher milden Winters für heuer ein größeres Problem für Gemüsebauern.,https://ibs.orf.at/bgl?image=https%3A%2F%2Foekastatic.orf.at%2Fmims%2F2023%2F05%2F66%2Fcrops%2Fw%3D1200%2Ch%3D627%2Cq%3D75%2F1660383_master_610866_gruene_reiswanze_imago_moyses.jpg%3Fs%3D4913ec0b805035d5a2e0ed83ccb36d250bc4fd22,2023-02-01T05:20:00Z,https://web.archive.org/web/20230201063740/https://burgenland.orf.at/stories/3192754/,Die Grüne Reiswanze ist eigentlich im Mittelmeerraum zu Hause durch die Klimaerwärmung kommt sie nun auch in Ostösterreich vor. 2015 wurden die ersten dieser Wanzen gesichtet. Heuer wird nach dem lan… [+1432 chars],,de,'Landwirtschaft'
https://www.stern.de/gesellschaft/regional/niedersachsen-bremen/wissenschaft--millionenfoerderung-fuer-autonome-landwirtschaftsprojekte-33155560.html,https://www.stern.de/gesellschaft/regional/niedersachsen-bremen/wissenschaft--millionenfoerderung-fuer-autonome-landwirtschaftsprojekte-33155560.html,0,www.stern.de,Wissenschaft: Millionenförderung für autonome Landwirtschaftsprojekte,"Osnabrücker Forschungseinrichtungen werden mit zehn Millionen Euro gefördert. Die Einrichtungen wollen an Projekten mit Künslicher Intelligenz für die Landwirtschaft forschen, wie die Universität Osnabrück als einer der Partner mitteilte. Der Schwerpunkt der …",https://image.stern.de/33155562/t/zp/v1/w1440/r1.7778/-/01--urnnewsmldpacom2009010123020199432431v2w800h600l1157t15r2329b857jpeg---427d1a19b42c8320.jpg,2023-02-01T06:29:54Z,https://web.archive.org/web/20230201080530/https://www.stern.de/gesellschaft/regional/niedersachsen-bremen/wissenschaft--millionenfoerderung-fuer-autonome-landwirtschaftsprojekte-33155560.html,"Osnabrücker Forschungseinrichtungen werden mit zehn Millionen Euro gefördert. Die Einrichtungen wollen an Projekten mit Künslicher Intelligenz für die Landwirtschaft forschen, wie die Universität Osn… [+1365 chars]",,de,'Landwirtschaft'
https://www.tagesspiegel.de/potsdam/potsdam-mittelmark/pflanzenturme-kuh-stresstests-bewegte-eier-so-sieht-die-landwirtschaft-der-zukunft-aus-9237654.html,https://www.tagesspiegel.de/potsdam/potsdam-mittelmark/pflanzenturme-kuh-stresstests-bewegte-eier-so-sieht-die-landwirtschaft-der-zukunft-aus-9237654.html,0,www.tagesspiegel.de,"Pflanzentürme, Kuh-Stresstests, bewegte Eier: So sieht die Landwirtschaft der Zukunft aus","Heiße Sommer, wenig Regen: Der Klimawandel macht Brandenburgs Landwirtschaft zu schaffen. Sieben Beispiele aus der Region zeigen, wie sie sich für die Zukunft wappnet.",https://www.tagesspiegel.de/images/susannetrolllandware202210568jpg/alternates/BASE_16_9_W1400/susannetrolllandware202210568jpg.jpeg,2023-02-01T06:37:39Z,http://archive.md/20230201094553/https://www.tagesspiegel.de/potsdam/potsdam-mittelmark/pflanzenturme-kuh-stresstests-bewegte-eier-so-sieht-die-landwirtschaft-der-zukunft-aus-9237654.html,"Die vergangenen fünf Jahre waren für Brandenburgs Landwirte keine gute Zeit. Heiße und trockene Monate ließen Felder verdorren, Tiere litten unter Hitzestress. Der Klimawandel ist in der Mark längst … [+236 chars]",,de,'Landwirtschaft'
https://www.tagesspiegel.de/potsdam/landeshauptstadt/potsdam-schafft-neue-platze-fur-gefluchtete-orangerie-in-der-biosphare-ist-wieder-notunterkunft-9273444.html,https://www.tagesspiegel.de/potsdam/landeshauptstadt/potsdam-schafft-neue-platze-fur-gefluchtete-orangerie-in-der-biosphare-ist-wieder-notunterkunft-9273444.html,0,www.tagesspiegel.de,Potsdam schafft neue Plätze für Geflüchtete: Orangerie in der Biosphäre ist wieder Notunterkunft,"95 Schlafplätze stehen zur Verfügung. Die Stadt musste handeln, weil schon im März die Metropolishalle geräumt werden muss.",https://www.tagesspiegel.de/potsdam/images/orangerie-der-biosphare-als-anlaufstelle-fur-gefluchtete-ohne-unterkunftbrigitte-meier-beigeordnete-fur-ordnung-sicherheit-soziales-und-gesundheit-sowie-leiterin-des-verwaltungsstabes-ukraine-informiert-gemeinsam-mit-sebastian-leifgen-geschaftsf5/alternates/BASE_16_9_W1400/orangerie-der-biosphaere-als-anlaufstelle-fuer-gefluechtete-ohne-unterkunftbrigitte-meier-beigeordnete-fuer-ordnung-sicherheit-soziales-und-gesundheit-sowie-leiterin-des-verwaltungsstabes-ukraine-informiert-gemeinsam-mit-sebastian-leifgen-geschaeftsfuehrer-der-biosphaere-potsdam-ueber-die-orangerie-al-7271.jpeg,2023-02-01T07:58:15Z,https://web.archive.org/web/20230201082351/https://www.tagesspiegel.de/potsdam/landeshauptstadt/potsdam-schafft-neue-platze-fur-gefluchtete-orangerie-in-der-biosphare-ist-wieder-notunterkunft-9273444.html,"Die Orangerie in der Biosphäre am Volkspark ist erneut eine Notunterkunft überwiegend für aus der Ukraine geflüchtete Menschen. Wie die Stadt mitteilte, stehen 95 Schlafplätze zur Verfügung. Wann ers… [+934 chars]",,de,'Notunterkunft'
https://www.stern.de/panorama/video-nrw--ende-der-maskenpflicht-im-oepnv-33156630.html,https://www.stern.de/panorama/video-nrw--ende-der-maskenpflicht-im-oepnv-33156630.html,0,www.stern.de,Video: NRW: Ende der Maskenpflicht im ÖPNV,Bei ÖPNV-Mitarbeitern herrscht große Erleichterung. Die Meinungen der Passiere sind hingegen gemischt.,https://image.stern.de/33156632/t/c5/v1/w1440/r1.7778/-/01-nrw--ende-der-maskenpflicht-im-oepnv-6319591417112-1.jpg,2023-02-01T11:29:32Z,,"Zugang zu allen STERN PLUS-Inhalten und Artikeln aus dem Print-Magazin
werbefrei &amp; jederzeit kündbar
Bereits registriert?
Hier anmelden",,de,'ÖPNV'
https://www.tagesspiegel.de/potsdam/landeshauptstadt/sechs-potsdamer-hauserblocke-waren-ohne-trinkwasser-rohrbruch-am-schlaatz-behoben-9275055.html,https://www.tagesspiegel.de/potsdam/landeshauptstadt/sechs-potsdamer-hauserblocke-waren-ohne-trinkwasser-rohrbruch-am-schlaatz-behoben-9275055.html,0,www.tagesspiegel.de,Sechs Potsdamer Häuserblöcke waren ohne Trinkwasser: Rohrbruch am Schlaatz behoben,Am Wieselkiez kam es am Dienstagabend zu einer Havarie. Mittlerweile kommt in allen Haushalten wieder Wasser aus den Hähnen.,https://www.tagesspiegel.de/potsdam/images/wasser-monopole-der-kommunen-6103/alternates/BASE_16_9_W1400/wasser-monopole-der-kommunen-6103.jpeg,2023-02-01T12:10:24Z,https://web.archive.org/web/20230201164107/https://www.tagesspiegel.de/potsdam/landeshauptstadt/sechs-potsdamer-hauserblocke-waren-ohne-trinkwasser-rohrbruch-am-schlaatz-behoben-9275055.html,Im Potsdamer Wohngebiet am Schlaatz ist am Mittwoch ein Rohrbruch behoben worden. Das teilten die Stadtwerke auf PNN-Nachfrage mit. In der Straße Am Wieselkiez war es am Dienstagabend gegen 20 Uhr zu… [+288 chars],,de,'Rohrbruch'
https://www.nzz.ch/wirtschaft/donald-hess-ein-unternehmerleben-vom-bier-ueber-das-valserwasser-zum-wein-ld.1724044,https://www.nzz.ch/wirtschaft/donald-hess-ein-unternehmerleben-vom-bier-ueber-das-valserwasser-zum-wein-ld.1724044,0,www.nzz.ch,"Donald Hess: Ein Unternehmer, der vom Bier über das Valserwasser zum Wein kam",Bekannt war der Berner vor allem für seine Weine aus Übersee. Doch der innovative Unternehmer hat auch in anderen Bereichen Spuren hinterlassen. Ein Nachruf.,"https://img.nzz.ch/2023/02/01/1799f8d0-b7bc-474f-b2d7-c33d873eacbb.jpeg?width=1200&height=675&fit=bound&quality=75&auto=webp&crop=1240,698,x207,y893&wmark=nzz",2023-02-01T19:05:00Z,,"Donald Hess (19362023) auf einem seiner Weingüter in Argentinien.
Eigentlich deutete bei Donald Hess alles auf ein Leben rund ums Bier hin. Der ursprünglich aus Bayern eingewanderten Familie gehörte… [+5122 chars]",,de,'Wein'
https://www.prnewswire.com/news-releases/tau-schlieWt-serie-b-runde-in-hohe-von-9-millionen-euro-ab-um-die-produktion-fur-die-elektromobilitat-auszubauen-301736778.html,https://www.prnewswire.com/news-releases/tau-schlieWt-serie-b-runde-in-hohe-von-9-millionen-euro-ab-um-die-produktion-fur-die-elektromobilitat-auszubauen-301736778.html,0,www.prnewswire.com,"Tau schließt Serie-B-Runde in Höhe von 9 Millionen Euro ab, um die Produktion für die Elektromobilität auszubauen","Die von Solvay Ventures angeführte Finanzierungsrunde wird von bestehenden Investoren, darunter Finindus, unterstützt und erfolgt parallel zum kommerziellen Durchbruch von Tau bei Automobilkunden TURIN, Italien und BERLIN, 1. Februar 2023 /PRNewswire/ -- Das …",https://mma.prnewswire.com/media/1993608/Tau_Group_Logo.jpg?p=facebook,2023-02-01T23:31:00Z,https://web.archive.org/web/20230201235153/https://www.prnewswire.com/news-releases/tau-schlieWt-serie-b-runde-in-hohe-von-9-millionen-euro-ab-um-die-produktion-fur-die-elektromobilitat-auszubauen-301736778.html,"Die von Solvay Ventures angeführte Finanzierungsrunde wird von bestehenden Investoren, darunter Finindus, unterstützt und erfolgt parallel zum kommerziellen Durchbruch von Tau bei Automobilkunden
TU… [+5151 chars]",,de,'Tau'
https://www.focus.de/finanzen/news/die-grosse-tabelle-zu-strom-und-gas-geben-sie-hier-ihre-postleitzahl-ein-und-sehen-sie-sofort-ihre-energiepreis-sparchancen_id_184642885.html,https://www.focus.de/finanzen/news/die-grosse-tabelle-zu-strom-und-gas-geben-sie-hier-ihre-postleitzahl-ein-und-sehen-sie-sofort-ihre-energiepreis-sparchancen_id_184642885.html,0,www.focus.de,"Die große Tabelle zu Strom und Gas - Hier sehen Sie mit nur einem Klick, wie viel Geld Sie bei der Energie sparen können","Strom- und Gaspreise sind im vergangenen Jahr deutlich gestiegen. Jetzt sinken sie wieder. Wer also eine Erhöhung bekommen hat, sollte jetzt wechseln und nicht auf die Energiepreisbremse warten. Geben Sie in unserer Tabelle nur Ihre Postleitzahl ein und sehen…",https://p6.focus.de/img/fotos/id_184643211/2023-02-01-14-33-04-window.png?im=Crop%3D%280%2C13%2C1367%2C683%29%3BResize%3D%281200%2C627%29&impolicy=perceptual&quality=medium&hash=f12c370c89ce0b239ed809f6e40154cab3c89a1127e239db17a448eb57e03751,2023-02-02T08:29:38Z,https://web.archive.org/web/20230202085401/https://www.focus.de/finanzen/news/die-grosse-tabelle-zu-strom-und-gas-geben-sie-hier-ihre-postleitzahl-ein-und-sehen-sie-sofort-ihre-energiepreis-sparchancen_id_184642885.html,"Strom- und Gaspreise sind im vergangenen Jahr deutlich gestiegen. Jetzt sinken sie wieder. Wer also eine Erhöhung bekommen hat, sollte jetzt wechseln und nicht auf die Energiepreisbremse warten. Gebe… [+2209 chars]",,de,'Gas'
https://www.focus.de/finanzen/das-ist-neu-ab-februar-2023-bier-wird-teurer-maskenpflicht-entfaellt-windkraft-gesetz_id_183815992.html,https://www.focus.de/finanzen/das-ist-neu-ab-februar-2023-bier-wird-teurer-maskenpflicht-entfaellt-windkraft-gesetz_id_183815992.html,0,www.focus.de,"Großer Überblick - Bierpreis, Windkraft-Gesetz, Maskenpflicht - das ändert sich im Februar","Ab Februar 2023 werden wieder viele Änderungen wirksam: Unter anderem wird Bier teurer, die Maskenpflicht in den öffentlichen Verkehrsmitteln fällt und Insekten dürfen im Essen verarbeitet werden. Alle Änderungen und Neuerungen erhalten Sie bei FOCUS online.",https://p6.focus.de/img/regional/thueringen/id_184264193/windkraftanlagen-stehen-bei-winterlichem-wetter-vor-dem-abendhimmel..jpg?im=Crop%3D%280%2C324%2C2048%2C1024%29%3BResize%3D%281200%2C627%29&impolicy=perceptual&quality=medium&hash=9479810f29ffd608f0bf6cab1b85179c065869cf485c4b5bd5d77b78977d1ea2,2023-02-02T08:31:10Z,https://web.archive.org/web/20230202121556/https://www.focus.de/finanzen/das-ist-neu-ab-februar-2023-bier-wird-teurer-maskenpflicht-entfaellt-windkraft-gesetz_id_183815992.html,"Ab Februar 2023 werden wieder viele Änderungen wirksam: Unter anderem wird Bier teurer, die Maskenpflicht in den öffentlichen Verkehrsmitteln fällt und Insekten dürfen im Essen verarbeitet werden. Al… [+5746 chars]",,de,'Wind'
https://www.dw.com/de/welche-heizung-ist-die-beste/a-64464340,https://www.dw.com/de/welche-heizung-ist-die-beste/a-64464340,0,www.dw.com,Welche Heizung ist die Beste?,"Heizen mit Erdgas und Öl ist klimaschädlich und teuer. Wie gut sind Wärmepumpe, Holz und Co fürs Klima und den Geldbeutel? Wir checken fünf Alternativen.",https://static.dw.com/image/63000958_6.jpg,2023-02-02T09:01:00Z,https://web.archive.org/web/20230202092124/https://www.dw.com/de/welche-heizung-ist-die-beste/a-64464340,"1. Wärmepumpen erobern die Welt 
Künftig könnten Wärmepumpen mehr als die Hälfte des weltweiten Wärmebedarfs decken, das zeigt ein Szenario der internationalen Energieagentur IEA. Bisher werden dami… [+5195 chars]",,de,'Gas'
https://www.diepresse.com/6246183/omv-schreibt-milliardengewinne-aktie-faellt-um-fuenf-prozent,https://www.diepresse.com/6246183/omv-schreibt-milliardengewinne-aktie-faellt-um-fuenf-prozent,0,www.diepresse.com,"""Am meisten profitiert die Republik"": OMV schreibt Milliardengewinne","Der Öl-, Gas- und Chemiekonzern OMV hat im Vorjahr von den hohen Öl- und Gaspreisen profitiert und schreibt einen Gewinn von 5,2 Milliarden Euro. Die Dividende wird auf 2,80 Euro je Aktie erhöht.",https://media.diepresse.com/social_diepresse_nachrichten/images/uploads_1200/f/2/7/6246183/omv_1675329157958488.jpg,2023-02-02T09:13:00Z,https://web.archive.org/web/20230202124026/https://www.diepresse.com/6246183/omv-schreibt-milliardengewinne-aktie-faellt-um-fuenf-prozent,"Der Öl-, Gas- und Chemiekonzern OMV hat im Vorjahr von den hohen Öl- und Gaspreisen profitiert und schreibt einen Gewinn von 5,2 Milliarden Euro. Die Aktie fällt nach Bekanntgabe der Geschäftszahlen … [+5766 chars]",,de,'Gas'
https://www.handelsblatt.com/politik/deutschland/energie-gasspeicher-zu-ueber-drei-vierteln-gefuellt-zielmarke-erreicht/28616386.html,https://www.handelsblatt.com/politik/deutschland/energie-gasspeicher-zu-ueber-drei-vierteln-gefuellt-zielmarke-erreicht/28616386.html,0,www.handelsblatt.com,"+++ Energiekrise +++: Weiteres Ziel erreicht: Gasspeicher zu 78,6 Prozent gefüllt – Keine Entlastung bei Öl und Pellets: Wüst kritisiert Bundesregierung",Verpuffung legt größten deutschen Gasspeicher Rehden lahm +++ Zweiter Tanker liefert LNG nach Lubmin +++ CDU-Politiker Spahn kritisiert Energie-Härtefallhilfen für Unternehmen +++ Der Newsblog.,https://www.handelsblatt.com/images/gasspeicher/28959488/2-format2003.jpg,2023-02-02T09:19:53Z,https://web.archive.org/web/20230202132222/https://www.handelsblatt.com/politik/deutschland/energie-gasspeicher-zu-ueber-drei-vierteln-gefuellt-zielmarke-erreicht/28616386.html,"<li>Herr Max Heck02.02.2023, 12:50 Uhr
Wir sollten uns alle warm anziehen. Und zwar zukünftig im doppelten Sinne!
Ihre Heizkosten im VergleichDurchschnitt ähnlicher Gebäude 20226.271 Berechnungsgru… [+6524 chars]",,de,'Gas'
https://www.stern.de/wirtschaft/news/energieversorgung--weiteres-ziel-erreicht--gasspeicher-zu-78-6-prozent-gefuellt-33159552.html,https://www.stern.de/wirtschaft/news/energieversorgung--weiteres-ziel-erreicht--gasspeicher-zu-78-6-prozent-gefuellt-33159552.html,0,www.stern.de,"Energieversorgung: Weiteres Ziel erreicht: Gasspeicher zu 78,6 Prozent gefüllt","Ganz voll sind die deutschen Gasspeicher nicht mehr, aber deutlich über dem von der Bundesregierung vorgegebenen Einspeicherziel. Die Netzagentur geht nicht mehr von einer Gasmangellage aus.",https://image.stern.de/33159554/t/1Q/v1/w1440/r1.7778/-/02--urnnewsmldpacom2009010123020299447905v3w800h600l924t432r1446b859jpeg---e80b6cabbea0f5fa.jpg,2023-02-02T09:19:53Z,https://web.archive.org/web/20230202095129/https://www.stern.de/wirtschaft/news/energieversorgung--weiteres-ziel-erreicht--gasspeicher-zu-78-6-prozent-gefuellt-33159552.html,"Ganz voll sind die deutschen Gasspeicher nicht mehr, aber deutlich über dem von der Bundesregierung vorgegebenen Einspeicherziel. Die Netzagentur geht nicht mehr von einer Gasmangellage aus.
Die deu… [+1922 chars]",,de,'Gas'
https://www.morgenpost.de/wirtschaft/article237527561/Weiteres-Ziel-erreicht-Gasspeicher-zu-78-6-Prozent-gefuellt.html,https://www.morgenpost.de/wirtschaft/article237527561/Weiteres-Ziel-erreicht-Gasspeicher-zu-78-6-Prozent-gefuellt.html,0,www.morgenpost.de,"Energieversorgung: Weiteres Ziel erreicht: Gasspeicher zu 78,6 Prozent gefüllt","Ganz voll sind die deutschen Gasspeicher nicht mehr, aber deutlich über dem von der Bundesregierung vorgegebenen Einspeicherziel. Die Netzagentur geht nicht mehr von einer Gasmangellage aus.",https://img.morgenpost.de/img/wirtschaft/crop237527559/9702603084-w820-cv16_9-q85/Gasspeicher.jpg,2023-02-02T09:19:53Z,https://web.archive.org/web/20230202102103/https://www.morgenpost.de/wirtschaft/article237527561/Weiteres-Ziel-erreicht-Gasspeicher-zu-78-6-Prozent-gefuellt.html,"Brüssel/Bonn. Die deutschen Erdgasspeicher waren am 1. Februar mit 78,6 Prozent Füllstand fast doppelt so voll wie vom Energiewirtschaftsgesetz zu diesem Stichtag vorgeschrieben. Dies ging am Donners… [+1729 chars]",,de,'Gas'
https://www.morgenpost.de/wirtschaft/article237527515/pelletspreise-heute-aktuell-2-februar-2023-energie-pellets.html,https://www.morgenpost.de/wirtschaft/article237527515/pelletspreise-heute-aktuell-2-februar-2023-energie-pellets.html,0,www.morgenpost.de,Energiekosten: Pelletspreise heute: So viel kostet eine Tonne am 02.02.,Die Pelletspreise in Deutschland fallen weiter.  ○ Wie viel kostet eine Tonne Pellets am 2. Februar? ○ Die aktuellen Preise finden Sie hier.,https://img.morgenpost.de/img/incoming/crop237508101/5212608645-w820-cv16_9-q85/holzpellets-preise-heute-aktuell-pelletspreise.jpg,2023-02-02T09:22:43Z,https://web.archive.org/web/20230202102044/https://www.morgenpost.de/wirtschaft/article237527515/pelletspreise-heute-aktuell-2-februar-2023-energie-pellets.html,"Berlin. Gute Nachrichten für Verbraucherinnen und Verbraucher in Deutschland: Was die Energiekrise betrifft, deutet der aktuelle Abwärtstrend auf ein Licht am Ende des Tunnels hin. Mussten Kundinnen … [+4913 chars]",,de,'Gas'
https://www.focus.de/finanzen/news/gaspreisbremse-heizgeschenk-vom-staat-wer-darf-sich-auf-den-1-maerz-freuen_id_184200876.html,https://www.focus.de/finanzen/news/gaspreisbremse-heizgeschenk-vom-staat-wer-darf-sich-auf-den-1-maerz-freuen_id_184200876.html,0,www.focus.de,Gaspreisbremse - Heizgeschenk vom Staat! Wer darf sich auf den 1. März freuen?,"Nun können Millionen Menschen auf Entlastung hoffen. Ab dem 1. März greift die Gaspreisbremse. Heizen wird dann für Millionen Haushalte günstiger. FOCUS online sagt, wer sich freuen darf und wer davon kaum bis gar nicht profitiert.",https://p6.focus.de/img/regional/mecklenburg-vorpommern/id_184035621/die-flamme-eines-gasherdes-brennt-in-einer-kueche..jpg?im=Crop%3D%280%2C170%2C2048%2C1024%29%3BResize%3D%281200%2C627%29&impolicy=perceptual&quality=medium&hash=0b0d97f75e178ea1346443c4409be9e3501d845e68f82ad88a59b18355e83865,2023-02-02T09:26:04Z,https://web.archive.org/web/20230202103605/https://www.focus.de/finanzen/news/gaspreisbremse-heizgeschenk-vom-staat-wer-darf-sich-auf-den-1-maerz-freuen_id_184200876.html,"Nun können Millionen Menschen auf Entlastung hoffen. Ab dem 1. März greift die Gaspreisbremse. Heizen wird dann für Millionen Haushalte günstiger. FOCUS online sagt, wer sich freuen darf und wer davo… [+6438 chars]",,de,'Gas'
https://www.handelsblatt.com/unternehmen/energie/gasspeicher-in-deutschland-fuellstand-auf-79-prozent-gefallen-/28819652.html,https://www.handelsblatt.com/unternehmen/energie/gasspeicher-in-deutschland-fuellstand-auf-79-prozent-gefallen-/28819652.html,0,www.handelsblatt.com,Gasspeicher in Deutschland: Füllstand auf 79 Prozent gefallen,Ein hoher Gasspeicher-Füllstand ist für Deutschlands Gasversorgung in der Energiekrise essenziell. Wie steht es aktuell um die Gasreserven? Ein Überblick.,https://www.handelsblatt.com/images/gasspeicher-in-sachsen-anhalt/28877480/2-format2003.jpg,2023-02-02T09:50:44Z,https://web.archive.org/web/20230202101106/https://www.handelsblatt.com/unternehmen/energie/gasspeicher-in-deutschland-fuellstand-auf-79-prozent-gefallen-/28819652.html,"Gasspeicher in Sachsen-AnhaltDer Gasspeicher-Füllstand in Deutschland ist in der Energiekrise zum wichtigen Faktor geworden.
(Foto: dpa)
Düsseldorf Ein stabiler Füllstand der deutschen Gasspeicher … [+7396 chars]",,de,'Gas'
https://www.faz.net/aktuell/wirtschaft/gasspeicher-ziel-fuer-den-fuellstand-zu-monatsbeginn-ist-erreicht-18648088.html,https://www.faz.net/aktuell/wirtschaft/gasspeicher-ziel-fuer-den-fuellstand-zu-monatsbeginn-ist-erreicht-18648088.html,0,www.faz.net,Nächstes Ziel für die Gasspeicher ist erreicht,Die Gasspeicher übererfüllen die Vorgabe für den Füllstand zu Monatsbeginn. Für das weitere Jahr kommt es dennoch aufs Energiesparen an.,https://media1.faz.net/ppmedia/aktuell/wirtschaft/1736231499/1.8648093/facebook_teaser/aufgefuellt-blick-auf-eine.jpg,2023-02-02T09:51:02Z,https://web.archive.org/web/20230202121041/https://www.faz.net/aktuell/wirtschaft/gasspeicher-ziel-fuer-den-fuellstand-zu-monatsbeginn-ist-erreicht-18648088.html,"Die deutschen Erdgasspeicher waren am 1. Februar mit 78,6 Prozent Füllstand fast doppelt so voll wie vom Energiewirtschaftsgesetz zu diesem Stichtag vorgeschrieben. Dies ging am Donnerstag aus vorläu… [+1610 chars]",,de,'Gas'
https://www.faz.net/aktuell/wirtschaft/naechstes-ziel-fuer-die-gasspeicher-ist-erreicht-18648088.html,https://www.faz.net/aktuell/wirtschaft/naechstes-ziel-fuer-die-gasspeicher-ist-erreicht-18648088.html,0,www.faz.net,Nächstes Ziel für die Gasspeicher ist erreicht,Zu Anfang Februar waren die deutschen Gasspeicher deutlich gefüllter als die Regierung vorschreibt. Für das weitere Jahr kommt es dennoch aufs Energiesparen an.,https://media1.faz.net/ppmedia/aktuell/wirtschaft/1736231499/1.8648093/facebook_teaser/aufgefuellt-blick-auf-eine.jpg,2023-02-02T09:51:02Z,https://web.archive.org/web/20230202101358/http://www.faz.net/aktuell/wirtschaft/naechstes-ziel-fuer-die-gasspeicher-ist-erreicht-18648088.html,"Die deutschen Erdgasspeicher waren am 1. Februar mit 78,6 Prozent Füllstand fast doppelt so voll wie vom Energiewirtschaftsgesetz zu diesem Stichtag vorgeschrieben. Dies ging am Donnerstag aus vorläu… [+1610 chars]",,de,'Gas'
https://www.welt.de/wirtschaft/article243561639/Erdgas-Speicherziel-erreicht-Fuellstand-fast-doppelt-so-voll-wie-vorgeschrieben.html,https://www.welt.de/wirtschaft/article243561639/Erdgas-Speicherziel-erreicht-Fuellstand-fast-doppelt-so-voll-wie-vorgeschrieben.html,0,www.welt.de,„Ziel überfüllt“ – Erdgas-Speicher fast doppelt so voll wie vorgeschrieben,"Das gesetzliche Füllstandziel ist weit übertroffen, eine Gasmangellage in diesem Winter demnach inzwischen unwahrscheinlich. Die Bundesnetzagentur lobt die „großartige gemeinsame Leistung“ und warnt vor der nächsten Herausforderung,",https://img.welt.de/img/bildergalerien/mobile243561615/4341359267-ci16x9-w1200/Erdgasspeicher.jpg,2023-02-02T10:26:57Z,https://web.archive.org/web/20230202103531/https://www.welt.de/wirtschaft/article243561639/Erdgas-Speicherziel-erreicht-Fuellstand-fast-doppelt-so-voll-wie-vorgeschrieben.html,"Die deutschen Erdgasspeicher waren am 1. Februar mit 78,6 Prozent Füllstand fast doppelt so voll wie vom Energiewirtschaftsgesetz zu diesem Stichtag vorgeschrieben. Dies ging am Donnerstag aus vorläu… [+1660 chars]",,de,'Gas'
https://www.n-tv.de/wirtschaft/Netzagentur-Chef-applaudiert-den-Deutschen-article23887362.html,https://www.n-tv.de/wirtschaft/Netzagentur-Chef-applaudiert-den-Deutschen-article23887362.html,0,www.n-tv.de,Speicher leeren sich aber weiter: Netzagentur-Chef applaudiert den Deutschen,"Jeder deutsche Gasspeicher muss am 1. Februar zu 40 Prozent gefüllt sein. In diesem Jahr ist der Speicherstand insgesamt fast doppelt so hoch. Klaus Müller freut sich über die ""großartige gemeinsame Leistung"" aller, die Gas sparen. Diese sollen allerdings wei…",https://bilder4.n-tv.de/img/incoming/crop23619703/3911328257-cImg_16_9-w1200/311388344.jpg,2023-02-02T10:44:26Z,https://web.archive.org/web/20230202123735/https://www.n-tv.de/wirtschaft/Netzagentur-Chef-applaudiert-den-Deutschen-article23887362.html,"Jeder deutsche Gasspeicher muss am 1. Februar zu 40 Prozent gefüllt sein. In diesem Jahr ist der Speicherstand insgesamt fast doppelt so hoch. Klaus Müller freut sich über die ""großartige gemeinsame … [+1928 chars]",,de,'Gas'
