index,url,valid,domain,title,description,image,published,archive,content,quote,language,keyword
https://stadt-bremerhaven.de/immer-wieder-sonntags-kw-39-10/,https://stadt-bremerhaven.de/immer-wieder-sonntags-kw-39-10/,0,stadt-bremerhaven.de,Immer wieder sonntags KW 39,Mittlerweile hat der Herbst begonnen und hier in Norddeutschland weht bereits ein rauerer Wind – die Tomaten auf meinem Balkon können davon ein Liedchen singen. Doch auch in der Technik-Welt und drumherum zieht einiges auf. Beispielsweise wollen die Diskussio…,https://stadt-bremerhaven.de/wp-content/uploads/2022/07/Kaffee-Sonntags.jpg,2023-10-01T04:30:54Z,https://web.archive.org/web/20231002085604/https://stadt-bremerhaven.de/immer-wieder-sonntags-kw-39-10/,Mittlerweile hat der Herbst begonnen und hier in Norddeutschland weht bereits ein rauerer Wind – die Tomaten auf meinem Balkon können davon ein Liedchen singen. Doch auch in der Technik-Welt und drum… [+3581 chars],,de,'Wind'
https://www.stern.de/gesellschaft/regional/niedersachsen-bremen/kirche--tierwohl-und-klimaschutz-im-zentrum-von-landeserntedankfest-33876018.html,https://www.stern.de/gesellschaft/regional/niedersachsen-bremen/kirche--tierwohl-und-klimaschutz-im-zentrum-von-landeserntedankfest-33876018.html,0,www.stern.de,Kirche: Tierwohl und Klimaschutz im Zentrum von Landeserntedankfest,"Beim niedersächsischen Landeserntedankfest haben am Sonntag zahlreiche Verbände zum Gespräch über Landwirtschaft, Ernährung und Naturschutz eingeladen. Auf dem Marktplatz vor der Alten Kirche in Nordhorn (Landkreis Grafschaft Bentheim) gab es an zwölf Projekt…",https://image.stern.de/33876020/t/n1/v1/w1440/r1.7778/-/01--urnnewsmldpacom2009010123100199402909v3w800h600l465t261r2008b1363jpeg---f2ae2365d439536b.jpg,2023-10-01T13:05:04Z,,"Beim niedersächsischen Landeserntedankfest haben am Sonntag zahlreiche Verbände zum Gespräch über Landwirtschaft, Ernährung und Naturschutz eingeladen. Auf dem Marktplatz vor der Alten Kirche in Nord… [+1594 chars]",,de,'Ackerbau'
https://www.welt.de/wirtschaft/article247769740/Bundesweiter-Protest-Tausende-Arztpraxen-bleiben-Montag-geschossen.html,https://www.welt.de/wirtschaft/article247769740/Bundesweiter-Protest-Tausende-Arztpraxen-bleiben-Montag-geschossen.html,0,www.welt.de,Tausende Arztpraxen bleiben Montag geschossen,"„Wir sind ausgeblutet – wir können nicht mehr“, teilt ein Ärzteverband mit und ruft zu einer bundesweiten Protestaktion auf. Am 2. Oktober sollen Tausende Arztpraxen geschlossen bleiben. Gesundheitsminister Lauterbach stellt Forderungen nach mehr Geld infrage.",https://img.welt.de/img/wirtschaft/mobile247769754/1581351257-ci16x9-w1200/Hausarzt.jpg,2023-10-02T03:45:44Z,,Deutschlandweit wollen Tausende Allgemein- und Fachärzte am Montag in einer bundesweiten Protestaktion ihre Praxen geschlossen halten. Der Virchowbund als Verband der niedergelassenen Haus- und Fachä… [+2675 chars],,de,'Tau'
https://www.focus.de/finanzen/news/gastbeitrag-von-rainer-zitelmann-der-staat-versagt-aber-nicht-so-wie-sie-womoeglich-denken_id_214421134.html,https://www.focus.de/finanzen/news/gastbeitrag-von-rainer-zitelmann-der-staat-versagt-aber-nicht-so-wie-sie-womoeglich-denken_id_214421134.html,0,www.focus.de,"Gastbeitrag von Rainer Zitelmann - Der Staat versagt - aber nicht so, wie Sie vielleicht denken","Viele Probleme in Deutschland haben ihre Ursache nicht in einem zu starken oder zu schwachen Staat. Der Staat ist vielmehr dort zu stark, wo er schwach sein sollte und dort zu schwach, wo er eigentlich stark sein sollte.Von FOCUS-online-Gastautor Rainer Zitel…",https://p6.focus.de/img/fotos/id_203861678/scholz-bemueht-sich-79132183.jpg?im=Crop%3D%280%2C74%2C3923%2C1964%29%3BResize%3D%281200%2C627%29&impolicy=perceptual&quality=mediumHigh&hash=3b84a6812f5e783dd81c946d547b98437022ebef94b94bfd9ea716f47bca42ee,2023-10-02T05:13:43Z,,"Viele Probleme in Deutschland haben ihre Ursache nicht in einem zu starken oder zu schwachen Staat. Der Staat ist vielmehr dort zu stark, wo er schwach sein sollte und dort zu schwach, wo er eigentli… [+7021 chars]",,de,'Gas'
https://www.welt.de/wirtschaft/article247747422/Anja-Siegesmund-und-Peter-Kurth-vom-BDE-ueber-Kreislaufwirtschaft-in-Deutschland.html,https://www.welt.de/wirtschaft/article247747422/Anja-Siegesmund-und-Peter-Kurth-vom-BDE-ueber-Kreislaufwirtschaft-in-Deutschland.html,0,www.welt.de,„Ein Leben ohne Abfälle wird es nicht geben“,"Die neue BDE-Präsidentin Anja Siegesmund hat klare Vorstellungen, wie das Recycling in Deutschland künftig aussehen sollte. Handlungsbedarf sieht sie vor allem bei Bauschutt und Windanlagen. Produktdesignern würde sie gern eine strenge Vorgabe machen.",https://img.welt.de/img/wirtschaft/mobile247764648/9001357907-ci16x9-w1200/Abriss-vom-alten-Exxon-Buerogebaeude-in-Hannover.jpg,2023-10-02T05:31:37Z,,"Anja Siegesmund darf gerade nicht arbeiten. Das thüringische Ministergesetz, das ihre eigene Partei einst maßgeblich vorangetrieben hat, verbietet der Grünen-Politikerin vor Sommer 2024 einen Job in … [+6478 chars]",,de,'Wind'
https://www.bild.de/video/clip/sport-videos/da-werden-fingernaegel-gekaut-bayerns-not-ist-riesengross-85607168.bild.html,https://www.bild.de/video/clip/sport-videos/da-werden-fingernaegel-gekaut-bayerns-not-ist-riesengross-85607168.bild.html,0,www.bild.de,„Da werden Fingernägel gekaut“ - Bayerns Not ist riesengroß!,FC Bayern-Trainer Thomas Tuchel hatte sich nach Ende des Transferfensters öffentlich über die dünne Personaldecke des Kaders beschwert.,"https://images.bild.de/651a850777fb632431b85cc8/281ce316fdbb9aa4de5d25f5f0cde9fa-landscape,b86d5024?w=1280",2023-10-02T08:57:12Z,,"Ungarin Katalin Karikó und den US-Amerikaner Drew Weissmann: Medizin-Nobelpreis geht an Covid-Forscher 
 Ungarin Katalin Karikó und den US-Amerikaner Drew Weissmann: Medizin-Nobelpreis geht an Covid… [+856 chars]",,de,'Not'
https://www.stern.de/gesellschaft/regional/rheinland-pfalz-saarland/umweltpolitik--studie--hohe-akzeptanz-fuer-ausbau-von-wind--und-solarenergie-33876502.html,https://www.stern.de/gesellschaft/regional/rheinland-pfalz-saarland/umweltpolitik--studie--hohe-akzeptanz-fuer-ausbau-von-wind--und-solarenergie-33876502.html,0,www.stern.de,Umweltpolitik: Studie: Hohe Akzeptanz für Ausbau von Wind- und Solarenergie,Die Offenheit für die Nutzung von mehr erneuerbarer Energie ist da. In Rheinland-Pfalz gibt es aber auch lange Genehmigungsverfahren für Windkraftanlagen und eine Stadt-Land-Debatte.,https://image.stern.de/33877514/t/tq/v1/w1440/r1.7778/-/02--urnnewsmldpacom2009010123100199404621v4w800h600l1013t192r2060b1400jpeg---f21094e56fe3a127.jpg,2023-10-02T09:56:24Z,,"Die Offenheit für die Nutzung von mehr erneuerbarer Energie ist da. In Rheinland-Pfalz gibt es aber auch lange Genehmigungsverfahren für Windkraftanlagen und eine Stadt-Land-Debatte.
In Rheinland-Pf… [+2373 chars]",,de,'Wind'
https://www.kicker.de/weil-er-einfach-und-gut-spielt-kovac-lobt-garant-lacroix-971546/artikel,https://www.kicker.de/weil-er-einfach-und-gut-spielt-kovac-lobt-garant-lacroix-971546/artikel,0,www.kicker.de,"Weil er einfach und gut spielt: Kovac lobt ""Garant"" Lacroix","Jonas Wind schoss die Tore, Koen Casteels parierte zweimal glänzend. Ein Sonderlob verteilte Wolfsburgs Trainer Niko Kovac nach dem 2:0-Sieg des VfL gegen Eintracht Frankfurt aber auch an Maxence Lacroix.","https://derivates.kicker.de/image/upload/c_crop,x_0,y_133,w_1933,h_1087/w_1200,q_auto/v1/2023/10/02/ebfc12d6-76f6-489a-8def-c848f3d4b3dd.jpeg",2023-10-02T11:58:01Z,,"Jonas Wind schoss die Tore, Koen Casteels parierte zweimal glänzend. Ein Sonderlob verteilte Wolfsburgs Trainer Niko Kovac nach dem 2:0-Sieg des VfL gegen Eintracht Frankfurt aber auch an Maxence Lac… [+2777 chars]",,de,'Wind'
https://www.n-tv.de/politik/Arzteverband-Lauterbach-kann-nicht-rechnen-article24437380.html,https://www.n-tv.de/politik/Arzteverband-Lauterbach-kann-nicht-rechnen-article24437380.html,0,www.n-tv.de,Praxen am Brückentag geschlossen: Ärzteverband: Lauterbach kann nicht rechnen,"Unter dem Motto ""Praxis in Not"" wollen Mediziner auf die mangelhafte Gesundheitspolitik und unzureichenden Kooperationen mit den Krankenkassen aufmerksam machen. Gesundheitsminister Lauterbach kritisiert den Protest und die damit geschlossenen Arztpraxen. Sei…",https://bilder3.n-tv.de/img/incoming/crop24437390/8901327201-cImg_16_9-w1200/imago0303828958h.jpg,2023-10-02T14:30:54Z,,"Unter dem Motto ""Praxis in Not"" wollen Mediziner auf die mangelhafte Gesundheitspolitik und unzureichenden Kooperationen mit den Krankenkassen aufmerksam machen. Gesundheitsminister Lauterbach kritis… [+3558 chars]",,de,'Not'
https://www.stern.de/gesellschaft/regional/baden-wuerttemberg/energie--transnetbw-chef--haette-gerne-in-jeder-gemeinde-einen-fanclub-33879540.html,https://www.stern.de/gesellschaft/regional/baden-wuerttemberg/energie--transnetbw-chef--haette-gerne-in-jeder-gemeinde-einen-fanclub-33879540.html,0,www.stern.de,Energie: TransnetBW-Chef: Hätte gerne in jeder Gemeinde einen Fanclub,"Energiewende heißt nicht nur Photovoltaik- und Windkraftanlagen aufzubauen. Auch die Netze müssen an die neuen Gegebenheiten angepasst werden. Doch die Zeit läuft. Wie TransnetBW Politik, Kraftwerksbetreiber und Verbraucher überzeugen will.",https://image.stern.de/33879542/t/pe/v1/w1440/r1.7778/-/03--urnnewsmldpacom2009010123100399421388v3w800h600l110t417r1745b1548jpeg---94f11745a5eb6bcb.jpg,2023-10-03T06:11:35Z,,"Energiewende heißt nicht nur Photovoltaik- und Windkraftanlagen aufzubauen. Auch die Netze müssen an die neuen Gegebenheiten angepasst werden. Doch die Zeit läuft. Wie TransnetBW Politik, Kraftwerksb… [+5697 chars]",,de,'Wind'
https://www.morgenpost.de/berlin/article239720439/wetter-vorhersage-berlin-brandenburger-warnung-windboeen-sturmboeen-gefahren.html,https://www.morgenpost.de/berlin/article239720439/wetter-vorhersage-berlin-brandenburger-warnung-windboeen-sturmboeen-gefahren.html,0,www.morgenpost.de,Es wird herbstlich: Wetter in Berlin: Warnung vor Wind- und Sturmböen,Der Spätsommer verabschiedet sich aus Berlin und Brandenburg. Das ist die Vorhersage für heute und die kommenden Tage.,https://img.morgenpost.de/img/frontpage/crop233651971/0652608800-w820-cv16_9-q85/69e064b6-334c-11ec-b9c5-d99746f737b9.jpg,2023-10-03T08:11:20Z,,"Berlin. Nachdem der Sommer in Berlin und Brandenburg verregnet war, hat der Spätsommer uns noch einmal richtig verwöhnt: Baden, Eis essen und in der Sonne liegen das war bis Anfang Oktober möglich. U… [+3064 chars]",,de,'Wind'
https://t3n.de/news/wind-solar-ladestation-e-autos-1579781/,https://t3n.de/news/wind-solar-ladestation-e-autos-1579781/,0,t3n.de,Strom vom Dach: Wind- und Solar-Ladestation lädt 6 E-Autos gleichzeitig,"Das US-Startup Wind & Solar Tower hat eine effiziente Wind- und Solar-Ladestation entwickelt. Die netzunabhängige Lösung soll jährlich 234.154 Kilowattstunden Energie erzeugen – ausreichend für 1,3 Millionen Kilometer E-Auto-Reichweite.weiterlesen auf t3n.de",https://t3n.de/news/wp-content/uploads/2023/10/Wind-Solar-Ladestation-E-Autos.jpg,2023-10-03T09:20:38Z,,"Die Idee, E-Auto-Ladestationen mit Wind- und Solaranlagen auszurüsten, um damit netzunabhängig Strom zu erzeugen, ist nicht neu. Das US-Startup Wind &amp; Solar Tower des Entwicklers Jim Bardia hat n… [+2642 chars]",,de,'Wind'
https://www.welt.de/politik/deutschland/article247799888/Gas-Umlagensenkung-soll-an-Kunden-weitergeben-fordert-Lemke.html,https://www.welt.de/politik/deutschland/article247799888/Gas-Umlagensenkung-soll-an-Kunden-weitergeben-fordert-Lemke.html,0,www.welt.de,"Gas-Umlagensenkung soll an Kunden weitergegeben werden, fordert Lemke","Mit dem Wegfall von zwei Umlagen werde für die Gaslieferanten die Beschaffung von Gas nun günstiger, so Bundesverbraucherministerin Steffi Lemke. Die Entlastung solle direkt an die Kunden weitergegeben werden.",https://img.welt.de/img/politik/deutschland/mobile247800172/8041355317-ci16x9-w1200/Bundestag-Debates-Climate-Protection-Law-Amendments.jpg,2023-10-04T07:36:50Z,,"Bundesverbraucherministerin Steffi Lemke hat Gaslieferanten aufgefordert, die Entlastung durch einen Wegfall von Gasumlagen direkt an die Kunden weiterzugeben. Auch wenn für Verbraucherinnen und Verb… [+3090 chars]",,de,'Energiekosten'
https://www.stern.de/gesellschaft/regional/mecklenburg-vorpommern/wirtschaftspolitik--mv-firmen-fordern-guenstigere-energie-und-buerokratieabbau-33882214.html,https://www.stern.de/gesellschaft/regional/mecklenburg-vorpommern/wirtschaftspolitik--mv-firmen-fordern-guenstigere-energie-und-buerokratieabbau-33882214.html,0,www.stern.de,Wirtschaftspolitik: MV-Firmen fordern günstigere Energie und Bürokratieabbau,"Fehlende Straßen, zu langsames Internet, hohe Energiekosten: Die Firmen im Osten von MV haben eine ganze Palette von Problemen. Die Bürokratie ist dabei eines der größten, sagt IHK-Präsident Blank.",https://image.stern.de/6681672/t/31/v5/w1440/r1.7778/-/video-fallback-image.jpg,2023-10-04T09:37:53Z,,"Fehlende Straßen, zu langsames Internet, hohe Energiekosten: Die Firmen im Osten von MV haben eine ganze Palette von Problemen. Die Bürokratie ist dabei eines der größten, sagt IHK-Präsident Blank.
… [+1930 chars]",,de,'Energiekosten'
