index,url,valid,domain,title,description,image,published,archive,content,quote,language,keyword
https://www.stern.de/gesellschaft/regional/hamburg-schleswig-holstein/notfaelle--wasserrohrbruch-in-hamburg-eimsbuettel---hauptleitung-kaputt-35691694.html,https://www.stern.de/gesellschaft/regional/hamburg-schleswig-holstein/notfaelle--wasserrohrbruch-in-hamburg-eimsbuettel---hauptleitung-kaputt-35691694.html,0,www.stern.de,Notfälle: Wasserrohrbruch in Hamburg-Eimsbüttel - Hauptleitung kaputt,Hamburg (lno) - In Hamburg-Eimsbüttel hat es am Morgen einen größeren Wasserrohrbruch gegeben und viele Haushalte hatten deshalb kein fließendes Wasser,https://image.stern.de/35691696/t/FP/v1/w1440/r1.7778/-/04--zuc753wrdqv10axs2048jpeg---c43b74d8212afc52.jpg,2025-05-04T07:15:26Z,,"Kopiere den aktuellen Link
Zur Merkliste hinzufügen
Am Morgen strömt auf einmal sehr viel Wasser über die Straßen von Eimsbüttel. Ein großer Wasserrohrbruch ruft auch Polizei und Feuerwehr auf den … [+791 chars]",,de,'Not'
https://www.zeit.de/news/2025-05/04/wasserrohrbruch-in-hamburg-eimsbuettel-hauptleitung-kaputt,https://www.zeit.de/news/2025-05/04/wasserrohrbruch-in-hamburg-eimsbuettel-hauptleitung-kaputt,0,www.zeit.de,Notfälle: Wasserrohrbruch in Hamburg-Eimsbüttel - Hauptleitung kaputt,Hier finden Sie Informationen zu dem Thema „Notfälle“. Lesen Sie jetzt „Wasserrohrbruch in Hamburg-Eimsbüttel - Hauptleitung kaputt“.,https://img.zeit.de/news/2025-05/04/wasserrohrbruch-in-hamburg-eimsbuettel-hauptleitung-kaputt-image-group/wide__1300x731,2025-05-04T07:15:26Z,,In Hamburg-Eimsbüttel hat es am Morgen einen größeren Wasserrohrbruch gegeben und viele Haushalte hatten deshalb kein fließendes Wasser mehr. «Wir haben einen Rohrbruch im Eidelstedter Weg. Es ist ei… [+625 chars],,de,'Rohrbruch'
https://www.telepolis.de/features/Bitcoin-Mining-Steigende-Kosten-fressen-Gewinne-auf-10370823.html,https://www.telepolis.de/features/Bitcoin-Mining-Steigende-Kosten-fressen-Gewinne-auf-10370823.html,0,www.telepolis.de,Bitcoin-Mining: Steigende Kosten fressen Gewinne auf,"Trotz Rekordpreisen für Bitcoin kämpfen die Miner ums Überleben. Zölle, Energiekosten und harter Wettbewerb machen das Schürfen der Kryptowährung immer teurer.",https://heise.cloudimg.io/bound/1200x1200/q85.png-lossy-85.webp-lossy-85.foil1/_www-heise-de_/imgs/18/4/8/4/7/3/0/5/shutterstock_2179657495-8c723245a2b44bbf.jpeg,2025-05-04T10:30:00Z,https://web.archive.org/web/20250504110542/https://www.telepolis.de/features/Bitcoin-Mining-Steigende-Kosten-fressen-Gewinne-auf-10370823.html,"(Bild: PalSand / Shutterstock.com)
Trotz Rekordpreisen für Bitcoin kämpfen die Miner ums Überleben. Zölle, Energiekosten und harter Wettbewerb machen das Schürfen der Kryptowährung immer teurer.
Es… [+4158 chars]",,de,'Energiekosten'
https://www.stern.de/gesellschaft/regional/bayern/gasbohrungen--hunderte-menschen-demonstrieren-gegen-gasbohrung-am-ammersee-35690772.html,https://www.stern.de/gesellschaft/regional/bayern/gasbohrungen--hunderte-menschen-demonstrieren-gegen-gasbohrung-am-ammersee-35690772.html,0,www.stern.de,Gasbohrungen: Hunderte Menschen demonstrieren gegen Gasbohrung am Ammersee,Reichling/Ludenhausen (lby) - Hunderte  Menschen haben in Reichling im Landkreis Landsberg am Lech lautstark gegen den Start von Gasbohrungen in ihrer,https://image.stern.de/35692232/t/5k/v1/w1440/r1.7778/-/04--nqdnkmjm7cv2axs2048jpeg---af2975691ffbd967.jpg,2025-05-04T11:39:02Z,https://web.archive.org/web/20250504124142/https://www.stern.de/gesellschaft/regional/bayern/gasbohrungen--hunderte-menschen-demonstrieren-gegen-gasbohrung-am-ammersee-35690772.html,"Kopiere den aktuellen Link
Zur Merkliste hinzufügen
In Reichling am Ammersee soll nach fossilem Gas gebohrt werden. Seit Monaten wehren sich Anwohner und Umweltschützer gegen die Pläne.
Hunderte  … [+2000 chars]",,de,'Gas'
https://www.bild.de/news/inland/staatsanwalt-sagt-34-polizeischuesse-auf-bilel-waren-notwehr-68178d9b4d4ae5690b18a2d4,https://www.bild.de/news/inland/staatsanwalt-sagt-34-polizeischuesse-auf-bilel-waren-notwehr-68178d9b4d4ae5690b18a2d4,0,www.bild.de,Staatsanwaltschaft sagt - 34 Polizeischüsse auf Bilel waren Notwehr,"Im Audi raste Bilel G. (21) durch Orte. In einer Sackgasse hielt er auf Polizisten zu, die schossen 34 Mal. Die Staatsanwaltschaft sagt jetzt: Notwehr!","https://images.bild.de/68178d9b4d4ae5690b18a2d4/5d6cb9d8a30bfed2b699ef04cb317f80,3ffe16cb?w=1280",2025-05-04T20:03:07Z,https://web.archive.org/web/20250504210707/https://www.bild.de/news/inland/staatsanwalt-sagt-34-polizeischuesse-auf-bilel-waren-notwehr-68178d9b4d4ae5690b18a2d4,"Bad Salzuflen Der Audi raste direkt auf sie zu. Da feuerten die Polizisten immer wieder. 34 Schüsse gaben sie ab, treffen den Fahrer mehrfach. Jetzt sagt die Staatsanwaltschaft: Das war Notwehr.
Was… [+2270 chars]",,de,'Not'
https://www.n-tv.de/politik/12-16-EU-will-Gas-Importe-aus-Russland-verbieten--article23143824.html,https://www.n-tv.de/politik/12-16-EU-will-Gas-Importe-aus-Russland-verbieten--article23143824.html,0,www.n-tv.de,Ukraine-Krieg im Liveticker: +++ 12:16 EU will Gas-Importe aus Russland verbieten +++,Lesen Sie alle aktuellen Entwicklungen und Nachrichten über den russischen Angriffskrieg auf die Ukraine im Liveticker von ntv.de.,https://www.n-tv.de/img/incoming/crop25117070/4231326595-cImg_16_9-w1200/Ukraine-Liveticker.jpg,2025-05-04T22:02:00Z,https://web.archive.org/web/20250505105114/https://www.n-tv.de/politik/12-16-EU-will-Gas-Importe-aus-Russland-verbieten--article23143824.html,"Die Europäische Union möchte laut einem Medienbericht Maßnahmen vorschlagen, die den Import von russischem Gas ab Ende 2027 verbieten. Wie die Finanznachrichtenagentur Bloomberg berichtet, sind die G… [+13871 chars]",,de,'Gas'
https://www.morgenpost.de/podcast/article408924398/48-wie-die-umgebung-unser-training-beeinflusst.html,https://www.morgenpost.de/podcast/article408924398/48-wie-die-umgebung-unser-training-beeinflusst.html,0,www.morgenpost.de,#48: Wie die Umgebung unser Training beeinflusst,"In der 48. Folge verrät Prof. Ingo Froböse, welche Location für gesundes Sporttreiben die beste ist, was wir bei körperlicher Outdoor-Aktivität in der Großstadt beachten sollten, wie sich Licht und Luft, Kälte und Hitze beim Training auf unseren Organismus au…",,2025-05-04T23:01:00Z,,"In der 48. Folge verrät Prof. Ingo Froböse, welche Location für gesundes Sporttreiben die beste ist, was wir bei körperlicher Outdoor-Aktivität in der Großstadt beachten sollten, wie sich Licht und L… [+1737 chars]",,de,'Kälte'
https://tirol.orf.at/stories/3303226/,https://tirol.orf.at/stories/3303226/,0,tirol.orf.at,„Housing First“: Hilfe für Wohnungslose,"Die Caritas Tirol unterstützt mit dem Projekt „Housing First"" Wohnungslose bei der Suche nach einem neuen Zuhause. Der Bahnhofsozialdienst (BSD) begleitet Betroffene von der Wohnungssuche bis zum Einzug. Allerdings mangelt es an leistbarem Wohnraum in Innsbru…",https://ibs.orf.at/tir?image=https%3A%2F%2Foekastatic.orf.at%2Fmims%2F2024%2F15%2F92%2Fcrops%2Fw%3D1200%2Ch%3D627%2Cq%3D75%2F2165303_master_819992_menschen_strassenszene_20120914_0061_doh.jpg%3Fs%3Dda0adc70a5ba7bfb4902e769bb899d6d3052e283,2025-05-05T03:42:56Z,https://web.archive.org/web/20250505155852/https://tirol.orf.at/stories/3303226/,"Der Bahnhofsozialdienst der Caritas Tirol ist seit mehr als einem Jahrhundert Anlaufstelle für Menschen in Notlagen. Viele der Betreuten sind wohnungslos oder leben in prekären Verhältnissen, obwohl … [+1617 chars]",,de,'Wohnungslose'
https://www.stern.de/familie/gardena-solar-bewaesserung-fuer-92-statt-140-euro--garten-deals-am-montag-34734620.html,https://www.stern.de/familie/gardena-solar-bewaesserung-fuer-92-statt-140-euro--garten-deals-am-montag-34734620.html,0,www.stern.de,Kraut & Dübel: Gardena Solar-Bewässerung für 92 statt 140 Euro: Top Garten-Deals am Montag,"Ob Hecke schneiden oder Unkraut jäten, Schädlinge bekämpfen oder Grillen: Hier finden Sie täglich wechselnde Deals rund um Haus und Garten, die sich wirklich lohnen.",https://image.stern.de/34905868/t/oG/v4/w1440/r1.7778/-/bewaesserungssytem.jpg,2025-05-05T07:06:00Z,,"Kopiere den aktuellen Link
Zur Merkliste hinzufügen
Ob Hecke schneiden oder Unkraut jäten, Schädlinge bekämpfen oder Grillen: Hier finden Sie täglich wechselnde Deals rund um Haus und Garten, die s… [+3559 chars]",,de,'Bewässerung'
https://www.morgenpost.de/wirtschaft/article408935772/heizoelpreise-aktuell-heute-5-mai-2025-was-kostet-oel-heizung-heizen.html,https://www.morgenpost.de/wirtschaft/article408935772/heizoelpreise-aktuell-heute-5-mai-2025-was-kostet-oel-heizung-heizen.html,0,www.morgenpost.de,Heizölpreise am Montag (5. Mai): Das kostet ein Liter heute,Die neue Woche beginnt mit Regen und Kälte. Was bedeutet der Wetterumschwung für die Heizölpreise? Der aktuelle Überblick vom 5. Mai.,https://img.sparknews.funkemedien.de/406858447/406858447_1724138717_v16_9_1600.jpeg,2025-05-05T07:21:21Z,,"Berlin. Die neue Woche beginnt mit Regen und Kälte. Was bedeutet der Wetterumschwung für die Heizölpreise? Der aktuelle Überblick vom 5. Mai.
Vergangene Woche wurde Deutschland noch von Frühlingswet… [+7393 chars]",,de,'Kälte'
https://salzburg.orf.at/stories/3304004/,https://salzburg.orf.at/stories/3304004/,0,salzburg.orf.at,Rekordzahlen bei Energie-Anbieterwechsel,"In Salzburg haben im ersten Quartal 2025 knapp 6.000 Haushalte und Unternehmen ihren Strom- oder Gasanbieter gewechselt, das sind fast dreimal so viele wie im Vorjahr. Die Stromregulierungsbehörde E-Control sieht darin ein Zeichen für den zurückgekehrten Wett…",https://ibs.orf.at/sbg?image=https%3A%2F%2Foekastatic.orf.at%2Fmims%2F2025%2F08%2F18%2Fcrops%2Fw%3D1200%2Ch%3D627%2Cq%3D75%2F2524192_master_966918_strom.jpg%3Fs%3De74ce0fa5e7f0d44b34e84da056ebdad5bb615dc,2025-05-05T10:14:26Z,https://web.archive.org/web/20250505141733/https://salzburg.orf.at/stories/3304004/,In den ersten drei Monaten des Jahres haben genau 5.822 Kunden und Kundinnen in Salzburg einen neuen Strom- und Gasanbieter gewählt. Das entspricht einer Steigerung von mehr als 180 Prozent gegenüber… [+2138 chars],,de,'Energiekosten'
https://www.stern.de/gesellschaft/regional/sachsen/weinanbau-im-elbtal--sachsens-staatsweingut-pflanzt-jungreben-neuer-sorten-35694584.html,https://www.stern.de/gesellschaft/regional/sachsen/weinanbau-im-elbtal--sachsens-staatsweingut-pflanzt-jungreben-neuer-sorten-35694584.html,0,www.stern.de,Weinanbau im Elbtal: Sachsens Staatsweingut pflanzt Jungreben neuer Sorten,Mit Innovation passen sich Sachsens Winzer den Folgen des Klimawandels im Elbtal an. 2024 sorgten heftige Spätfröste für enorme Schäden im Weinberg. Nun machen alternative Rebsorten Hoffnung.,https://image.stern.de/35694586/t/NS/v1/w1440/r1.7778/-/05--rheskh72ygv16axs2048jpeg---265f710a720b935f.jpg,2025-05-05T10:34:41Z,https://web.archive.org/web/20250505133229/https://www.stern.de/gesellschaft/regional/sachsen/weinanbau-im-elbtal--sachsens-staatsweingut-pflanzt-jungreben-neuer-sorten-35694584.html,"Kopiere den aktuellen Link
Zur Merkliste hinzufügen
Mit Innovation passen sich Sachsens Winzer den Folgen des Klimawandels im Elbtal an. 2024 sorgten heftige Spätfröste für enorme Schäden im Weinbe… [+2133 chars]",,de,'Wein'
https://www.zeit.de/news/2025-05/05/sachsens-staatsweingut-pflanzt-jungreben-neuer-sorten,https://www.zeit.de/news/2025-05/05/sachsens-staatsweingut-pflanzt-jungreben-neuer-sorten,0,www.zeit.de,Weinanbau im Elbtal: Sachsens Staatsweingut pflanzt Jungreben neuer Sorten,Hier finden Sie Informationen zu dem Thema „Weinanbau im Elbtal“. Lesen Sie jetzt „Sachsens Staatsweingut pflanzt Jungreben neuer Sorten“.,https://img.zeit.de/news/2025-05/05/sachsens-staatsweingut-pflanzt-jungreben-neuer-sorten-image-group/wide__1300x731,2025-05-05T10:34:41Z,,"Das Sächsische Staatsweingut Schloss Wackerbarth testet zwei pilzresistente Rebsorten im hiesigen Klima. Auf einem 1,4 Hektar großen Weinberg in Weinböhla setzte am Montag eine GPS-gesteuerte Pflanzm… [+1926 chars]",,de,'Wein'
https://www.sueddeutsche.de/bayern/bayern-wetter-frost-schnee-regen-eisheilige-li.3247349,https://www.sueddeutsche.de/bayern/bayern-wetter-frost-schnee-regen-eisheilige-li.3247349,0,www.sueddeutsche.de,"Wetter: Regen, Schnee und Frost zu Wochenbeginn in Bayern","Nach den sommerlichen Tagen mit viel Sonnenschein wird es nochmal kühl im Freistaat. Nass ist es vor allem im Süden, im Gebirge kann Schnee fallen.",https://www.sueddeutsche.de/2025/05/05/59a7dcbf-caac-407b-8b16-4d956f041008.jpeg?q=60&fm=webp&width=1200&rect=0%2C417%2C4000%2C2250,2025-05-05T11:23:02Z,,"In der Nacht zum Dienstag soll im Süden der Regen allmählich nachlassen, auch im Norden gebe es Auflockerungen. An den nördlichen Mittelgebirgen sei gebietsweise mit bodennahem Frost zu rechnen. Bis … [+971 chars]",,de,'Schnee'
https://www.stern.de/gesellschaft/regional/sachsen/insolvenzen--investor-fuer-insolvente-glashuette-in-freital-gesucht-35695566.html,https://www.stern.de/gesellschaft/regional/sachsen/insolvenzen--investor-fuer-insolvente-glashuette-in-freital-gesucht-35695566.html,0,www.stern.de,Insolvenzen: Investor für insolvente Glashütte in Freital gesucht,"In der Glashütte Freital werden Flaschen und Gläser für Saft, Wein und Co hergestellt. Doch das Unternehmen steckt in wirtschaftlicher Schieflage. Findet sich ein rettender Investor?",https://image.stern.de/35695568/t/uj/v1/w1440/r1.7778/-/05--zaw2n6qhkqv3axs2048jpeg---30d9555eba0ecf8c.jpg,2025-05-05T14:07:56Z,https://web.archive.org/web/20250505145227/https://www.stern.de/gesellschaft/regional/sachsen/insolvenzen--investor-fuer-insolvente-glashuette-in-freital-gesucht-35695566.html,"Kopiere den aktuellen Link
Zur Merkliste hinzufügen
In der Glashütte Freital werden Flaschen und Gläser für Saft, Wein und Co hergestellt. Doch das Unternehmen steckt in wirtschaftlicher Schieflage… [+803 chars]",,de,'Wein'
https://www.bild.de/sport/mehr-sport/handball-schock-in-oesterreich-hovrat-schlaegt-mahr-brutal-ins-gesicht-6818cae093978f2260025930,https://www.bild.de/sport/mehr-sport/handball-schock-in-oesterreich-hovrat-schlaegt-mahr-brutal-ins-gesicht-6818cae093978f2260025930,0,www.bild.de,Brutalo-Foul in Österreich - Handball-Star mit Not-OP nach offenem Nasenbruch,Im Handball-Derby zwischen Bregenz und Hard erleidet Spielmacher Mahr einen offenen Nasenbeinbruch nach einem brutalen Schlag von Hovrat.,"https://images.bild.de/6818cae093978f2260025930/1c41cee9b82dc04759ff6b5456bc0d69,ba609e7b?w=1280",2025-05-05T14:54:56Z,https://web.archive.org/web/20250505162317/https://www.bild.de/sport/mehr-sport/handball-schock-in-oesterreich-hovrat-schlaegt-mahr-brutal-ins-gesicht-6818cae093978f2260025930,"Riesen-Aufregung in Österreich!
Nach einem bösen Gesichtsschlag im Handball-Viertelfinal-Derby um die österreichische Meisterschaft zwischen Bregenz Handball und Alpla HC Hard knallt es gewaltig.
D… [+3008 chars]",,de,'Not'
https://www.zeit.de/news/2025-05/06/naechtliche-weinbergsfeuer-im-elbtal-zum-schutz-der-reben,https://www.zeit.de/news/2025-05/06/naechtliche-weinbergsfeuer-im-elbtal-zum-schutz-der-reben,0,www.zeit.de,Weinanbau im Elbtal: Nächtliche Weinbergsfeuer im Elbtal zum Schutz der Reben,Hier finden Sie Informationen zu dem Thema „Weinanbau im Elbtal“. Lesen Sie jetzt „Nächtliche Weinbergsfeuer im Elbtal zum Schutz der Reben“.,https://img.zeit.de/news/2025-05/06/naechtliche-weinbergsfeuer-im-elbtal-zum-schutz-der-reben-image-group/wide__1300x731,2025-05-06T03:31:38Z,https://web.archive.org/web/20250507101634/https://www.zeit.de/news/2025-05/06/naechtliche-weinbergsfeuer-im-elbtal-zum-schutz-der-reben,Zum Schutz gefährdeter Reben vor Spätfrost brannten am frühen Dienstagmorgen auf insgesamt 28 Hektar Fläche des Staatsweinguts Schloss Wackerbarth hunderte kleine kontrollierte Feuer. Insgesamt sollt… [+1955 chars],,de,'Wein'
https://www.stern.de/gesellschaft/regional/sachsen/weinanbau-im-elbtal--naechtliche-weinbergsfeuer-im-elbtal-zum-schutz-der-reben-35696728.html,https://www.stern.de/gesellschaft/regional/sachsen/weinanbau-im-elbtal--naechtliche-weinbergsfeuer-im-elbtal-zum-schutz-der-reben-35696728.html,0,www.stern.de,Weinanbau im Elbtal: Nächtliche Weinbergsfeuer im Elbtal zum Schutz der Reben,In einer Aprilnacht vor einem Jahr zerstörte extremer Spätfrost die jungen Triebe in den Rebanlagen des Elbtals. Die Winzer mussten enorme Vertragsverluste verkraften - nun drohen wieder Minusgrade.,https://image.stern.de/35696730/t/Q3/v1/w1440/r1.7778/-/06--u5r5jg6gigv5axs2048jpeg---c6f9f5be435a9fda.jpg,2025-05-06T03:31:38Z,https://web.archive.org/web/20250506050156/https://www.stern.de/gesellschaft/regional/sachsen/weinanbau-im-elbtal--naechtliche-weinbergsfeuer-im-elbtal-zum-schutz-der-reben-35696728.html,"Kopiere den aktuellen Link
Zur Merkliste hinzufügen
In einer Aprilnacht vor einem Jahr zerstörte extremer Spätfrost die jungen Triebe in den Rebanlagen des Elbtals. Die Winzer mussten enorme Vertra… [+2169 chars]",,de,'Wein'
https://www.bild.de/sport/fussball/hannover-96-suesser-doppel-stress-fuer-not-trainer-lars-barlemann-6818d2031ed1cb0e85b31344,https://www.bild.de/sport/fussball/hannover-96-suesser-doppel-stress-fuer-not-trainer-lars-barlemann-6818d2031ed1cb0e85b31344,0,www.bild.de,Hannovers Not-Trainer - Süßer Doppel-Stress für Barlemann,Aufregende Tage für Not-Trainer Lars Barlemann von Hannover 96. Auch privat ist viel los.,"https://images.bild.de/6818d2031ed1cb0e85b31344/854e332cafc79f29015d1eeac8692b20,8aca1f4?w=1280",2025-05-06T04:56:24Z,http://archive.md/20250506051225/https://www.bild.de/sport/fussball/hannover-96-suesser-doppel-stress-fuer-not-trainer-lars-barlemann-6818d2031ed1cb0e85b31344,"Aufregende Tage für Not-Trainer Lars Barlemann von Hannover 96. Auch privat ist viel los.
Lesen Sie die ganze Geschichte nur mit BILDplus.",,de,'Not'
https://www.zeit.de/news/2025-05/06/schnee-faellt-nachts-auf-dem-feldberg-am-morgen-nur-sturm,https://www.zeit.de/news/2025-05/06/schnee-faellt-nachts-auf-dem-feldberg-am-morgen-nur-sturm,0,www.zeit.de,Wetter: Schnee fällt nachts auf dem Feldberg - am Morgen nur Sturm,Hier finden Sie Informationen zu dem Thema „Wetter“. Lesen Sie jetzt „Schnee fällt nachts auf dem Feldberg - am Morgen nur Sturm“.,https://img.zeit.de/news/2025-05/06/schnee-faellt-nachts-auf-dem-feldberg-am-morgen-nur-sturm-image-group/wide__1300x731,2025-05-06T06:16:27Z,,Leichten Schneefall hat der Deutsche Wetterdienst auf dem Feldberg (Landkreis Breisgau-Hochschwarzwald) in der Nacht auf Dienstag gemeldet. Am Morgen lagen am Bismarckdenkmal auf dem Gipfel allerding… [+1557 chars],,de,'Schnee'
https://www.stern.de/gesellschaft/regional/baden-wuerttemberg/wetter--schnee-faellt-nachts-auf-dem-feldberg---am-morgen-nur-sturm-35696926.html,https://www.stern.de/gesellschaft/regional/baden-wuerttemberg/wetter--schnee-faellt-nachts-auf-dem-feldberg---am-morgen-nur-sturm-35696926.html,0,www.stern.de,Wetter: Schnee fällt nachts auf dem Feldberg - am Morgen nur Sturm,"Leicht geschneit hat es in der Nacht auf Dienstag auf dem Feldberg - am Morgen ist davon aber nichts mehr zu sehen. In Baden-Württemberg soll es weiter Wolken, Regen und Wind geben.",https://image.stern.de/35696928/t/sr/v1/w1440/r1.7778/-/06--6kqmw4cbgav5axs2048jpeg---0b66537a694b429b.jpg,2025-05-06T06:16:27Z,https://web.archive.org/web/20250506070726/https://www.stern.de/gesellschaft/regional/baden-wuerttemberg/wetter--schnee-faellt-nachts-auf-dem-feldberg---am-morgen-nur-sturm-35696926.html,"Kopiere den aktuellen Link
Zur Merkliste hinzufügen
Leicht geschneit hat es in der Nacht auf Dienstag auf dem Feldberg - am Morgen ist davon aber nichts mehr zu sehen. In Baden-Württemberg soll es … [+1754 chars]",,de,'Schnee'
https://www.stern.de/familie/gardena-solar-bewaesserung-fuer-92-statt-140-euro--garten-deals-am-dienstag-34734620.html,https://www.stern.de/familie/gardena-solar-bewaesserung-fuer-92-statt-140-euro--garten-deals-am-dienstag-34734620.html,0,www.stern.de,Kraut & Dübel: Gardena Solar-Bewässerung für 92 statt 140 Euro: Top Garten-Deals am Dienstag,"Ob Hecke schneiden oder Unkraut jäten, Schädlinge bekämpfen oder Grillen: Hier finden Sie täglich wechselnde Deals rund um Haus und Garten, die sich wirklich lohnen.",https://image.stern.de/34905868/t/96/v5/w1440/r1.7778/-/bewaesserungssytem.jpg,2025-05-06T07:18:00Z,,"Kopiere den aktuellen Link
Zur Merkliste hinzufügen
Ob Hecke schneiden oder Unkraut jäten, Schädlinge bekämpfen oder Grillen: Hier finden Sie täglich wechselnde Deals rund um Haus und Garten, die s… [+3404 chars]",,de,'Bewässerung'
https://www.stern.de/wirtschaft/news/viele-baustellen-fuer-regierung--mittelstand-gibt-standort-deutschland-schlechte-noten-35698130.html,https://www.stern.de/wirtschaft/news/viele-baustellen-fuer-regierung--mittelstand-gibt-standort-deutschland-schlechte-noten-35698130.html,0,www.stern.de,Viele Baustellen für Regierung: Mittelstand gibt Standort Deutschland schlechte Noten,"Unternehmer sind sich einig: Die künftige Bundesregierung hat reichlich Hausaufgaben zu erfüllen, um ""Made in Germany"" wieder nach vorn zu bringen. Der Zollstreit mit den USA belastet zusätzlich.",https://image.stern.de/35698132/t/x_/v1/w1440/r1.7778/-/06--7mrjjm6gluv2axs2048jpeg---173e7d9bebc31a04.jpg,2025-05-06T10:47:20Z,https://web.archive.org/web/20250506121806/https://www.stern.de/wirtschaft/news/viele-baustellen-fuer-regierung--mittelstand-gibt-standort-deutschland-schlechte-noten-35698130.html,"Kopiere den aktuellen Link
Zur Merkliste hinzufügen
Unternehmer sind sich einig: Die künftige Bundesregierung hat reichlich Hausaufgaben zu erfüllen, um ""Made in Germany"" wieder nach vorn zu bringe… [+2484 chars]",,de,'Energiekosten'
https://www.zeit.de/news/2025-05/06/mittelstand-gibt-standort-deutschland-schlechte-noten,https://www.zeit.de/news/2025-05/06/mittelstand-gibt-standort-deutschland-schlechte-noten,0,www.zeit.de,Viele Baustellen für Regierung: Mittelstand gibt Standort Deutschland schlechte Noten,Hier finden Sie Informationen zu dem Thema „Viele Baustellen für Regierung“. Lesen Sie jetzt „Mittelstand gibt Standort Deutschland schlechte Noten“.,https://img.zeit.de/news/2025-05/06/mittelstand-gibt-standort-deutschland-schlechte-noten-image-group/wide__1300x731,2025-05-06T10:47:20Z,https://web.archive.org/web/20250507105800/https://www.zeit.de/news/2025-05/06/mittelstand-gibt-standort-deutschland-schlechte-noten,"Zu viel Bürokratie, zu hohe Energiekosten, Lücken in der Digitalisierung: Der Mittelstand gibt dem Standort Deutschland überwiegend schlechte Noten. In einer Forsa-Umfrage für die Commerzbank landet … [+2273 chars]",,de,'Not'
https://www.tagesspiegel.de/wirtschaft/viele-baustellen-fur-regierung-mittelstand-gibt-standort-deutschland-schlechte-noten-13646371.html,https://www.tagesspiegel.de/wirtschaft/viele-baustellen-fur-regierung-mittelstand-gibt-standort-deutschland-schlechte-noten-13646371.html,0,www.tagesspiegel.de,Viele Baustellen für Regierung: Mittelstand gibt Standort Deutschland schlechte Noten,"Unternehmer sind sich einig: Die künftige Bundesregierung hat reichlich Hausaufgaben zu erfüllen, um „Made in Germany“ wieder nach vorn zu bringen. Der Zollstreit mit den USA belastet zusätzlich.",https://www.tagesspiegel.de/images/13646368/alternates/BASE_16_9_W1400/1746528517000/maurerkellen.jpeg,2025-05-06T10:48:37Z,https://web.archive.org/web/20250507142316/https://www.tagesspiegel.de/wirtschaft/viele-baustellen-fur-regierung-mittelstand-gibt-standort-deutschland-schlechte-noten-13646371.html,"Zu viel Bürokratie, zu hohe Energiekosten, Lücken in der Digitalisierung: Der Mittelstand gibt dem Standort Deutschland überwiegend schlechte Noten. In einer Forsa-Umfrage für die Commerzbank landet … [+2986 chars]",,de,'Energiekosten'
https://www.zeit.de/news/2025-05/06/windkraft-investoren-fordern-raschere-genehmigungsverfahren,https://www.zeit.de/news/2025-05/06/windkraft-investoren-fordern-raschere-genehmigungsverfahren,0,www.zeit.de,Windkraft-Ausbau: Windkraft-Investoren fordern raschere Genehmigungsverfahren,Hier finden Sie Informationen zu dem Thema „Windkraft-Ausbau“. Lesen Sie jetzt „Windkraft-Investoren fordern raschere Genehmigungsverfahren“.,https://img.zeit.de/news/2025-05/06/windkraft-investoren-fordern-raschere-genehmigungsverfahren-image-group/wide__1300x731,2025-05-06T12:10:45Z,https://web.archive.org/web/20250507033617/https://www.zeit.de/news/2025-05/06/windkraft-investoren-fordern-raschere-genehmigungsverfahren,Trotz wieder steigender Genehmigungen für den Bau neuer Windparks in Mecklenburg-Vorpommern erhöhen Investoren den Druck auf die zuständigen Behörden. «Die Zahl der Untätigkeitsklagen gegen die Geneh… [+3166 chars],,de,'Wind'
https://www.horizont.net/marketing/nachrichten/spirituosenhersteller-mot-hennessy-hat-neuen-marketingchef-fuer-deutschland-227621,https://www.horizont.net/marketing/nachrichten/spirituosenhersteller-mot-hennessy-hat-neuen-marketingchef-fuer-deutschland-227621,0,www.horizont.net,Spirituosenhersteller: Moët Hennessy hat neuen Marketingchef für Deutschland,Bei Moët Hennessy in Deutschland hat ein neuer Manager die Verantwortung für das Marketing übernommen. Er ist bereits seit zehn Jahren für die Wein- und Spirituosensparte des Luxuskonzerns LVMH tätig.,https://www.horizont.net/news/media/47/Gerrit-Zank-Mot-Hennessy-469482.jpeg,2025-05-06T14:56:00Z,,"Sie sind bereits registriert?
Hier anmelden
Der Nutzung Ihrer Daten können Sie jederzeit widersprechen. Weitere Hinweise finden Sie unter Datenschutz.",,de,'Wein'
