index,url,valid,domain,title,description,image,published,archive,content,quote,language,keyword
https://www.zeit.de/news/2024-08/06/rund-zwei-drittel-aller-wohnungen-in-nrw-mit-gas-beheizt,https://www.zeit.de/news/2024-08/06/rund-zwei-drittel-aller-wohnungen-in-nrw-mit-gas-beheizt,0,www.zeit.de,Heizenergie: Rund zwei Drittel aller Wohnungen in NRW mit Gas beheizt,Hier finden Sie Informationen zu dem Thema „Heizenergie“. Lesen Sie jetzt „Rund zwei Drittel aller Wohnungen in NRW mit Gas beheizt“.,https://img.zeit.de/news/2024-08/06/rund-zwei-drittel-aller-wohnungen-in-nrw-mit-gas-beheizt-image-group/wide__1300x731,2024-08-06T11:00:39Z,,"In Wohngebäuden in Nordrhein-Westfalen ist Gas nach wie vor der mit Abstand am häufigsten verwendete Energieträger. Etwa zwei Drittel der 9,1 Millionen Wohnungen wurden im Jahr 2022 mit Gas beheizt. … [+2454 chars]",,de,'Gas'
https://www.bild.de/leben-wissen/auswaertiges-amt-wie-sicher-ist-mein-urlaub-in-aegypten-tuerkei-japan-66b0dd31ac14285f2f4b333d,https://www.bild.de/leben-wissen/auswaertiges-amt-wie-sicher-ist-mein-urlaub-in-aegypten-tuerkei-japan-66b0dd31ac14285f2f4b333d,0,www.bild.de,Auswärtiges Amt warnt - Wie sicher ist mein Urlaub?,"Dürre in Italien, Reisewarnung für Ägypten – und wie wirkt sich der Nahost-Konflikt auf den Türkei-Urlaub aus?","https://images.bild.de/66b0dd31ac14285f2f4b333d/c0dc0061186967480b590288d88bfbfb,e6da5012?w=1280",2024-08-06T12:25:25Z,,"Dürre in Italien, Reisewarnung für Ägypten und wie wirkt sich der Nahost-Konflikt auf den Türkei-Urlaub aus? In vielen beliebten Urlaubsländern gibt es aktuell Unsicherheiten und Gefahren. 
Das Ausw… [+3986 chars]",,de,'Dürre'
https://www.sueddeutsche.de/politik/stromsystem-klimaneutral-bundesregierung-verbraucher-lux.4abZ6SVPg7aojQ1e3FCdYM,https://www.sueddeutsche.de/politik/stromsystem-klimaneutral-bundesregierung-verbraucher-lux.4abZ6SVPg7aojQ1e3FCdYM,0,www.sueddeutsche.de,"Änderung bei Stromversorgung: Laden, wenn die Sonne scheint","Deutschlands Energiesystem wandelt sich rasant, der Ausbau von Wind- und Solaranlagen, von Netzen und Speichern kommt voran. Welche Folgen wird das für Investoren und private Haushalte haben? Antworten auf die wichtigsten Fragen.",https://www.sueddeutsche.de/2024/07/07/e06cb3b1-2e73-410c-9745-a7c896bcd6ff.jpeg?q=60&fm=webp&width=1200&rect=0%2C205%2C3000%2C1688,2024-08-06T13:05:10Z,,"6. August 2024, 15:05 UhrLesezeit: 4 min
Deutschlands Energiesystem wandelt sich rasant, der Ausbau von Wind- und Solaranlagen, von Netzen und Speichern kommt voran. Welche Folgen wird das für Inves… [+759 chars]",,de,'Wind'
https://www.zeit.de/news/2024-08/06/land-plant-notunterkunft-fuer-gefluechtete-in-ahlhorn,https://www.zeit.de/news/2024-08/06/land-plant-notunterkunft-fuer-gefluechtete-in-ahlhorn,0,www.zeit.de,Migration: Land plant Notunterkunft für Geflüchtete in Ahlhorn,Hier finden Sie Informationen zu dem Thema „Migration“. Lesen Sie jetzt „Land plant Notunterkunft für Geflüchtete in Ahlhorn“.,https://img.zeit.de/news/2024-08/06/land-plant-notunterkunft-fuer-gefluechtete-in-ahlhorn-image-group/wide__1300x731,2024-08-06T14:41:21Z,,Die Landesaufnahmebehörde (LAB) plant in Ahlhorn (Landkreis Oldenburg) eine Notunterkunft für Geflüchtete. Das Land prüft die Umsetzung einer vorübergehenden Unterkunft in der Gemeinde Großenkneten f… [+2556 chars],,de,'Notunterkunft'
https://www.stern.de/gesellschaft/regional/niedersachsen-bremen/migration--land-plant-notunterkunft-fuer-gefluechtete-in-ahlhorn-34955652.html,https://www.stern.de/gesellschaft/regional/niedersachsen-bremen/migration--land-plant-notunterkunft-fuer-gefluechtete-in-ahlhorn-34955652.html,0,www.stern.de,Migration: Land plant Notunterkunft für Geflüchtete in Ahlhorn,"Auf dem früheren Fliegerhorst in Ahlhorn soll eine Flüchtlingsunterkunft entstehen. Das Land will Bürgerinnen und Bürger für ""das soziale Miteinander"" einbeziehen, doch die Kleinstadt wehrt sich.",https://image.stern.de/34955654/t/9x/v1/w1440/r1.7778/-/06--j56wy5xxigv17axw800h600jpeg---ae3bafe7af589c52.jpg,2024-08-06T14:41:21Z,,"Auf dem früheren Fliegerhorst in Ahlhorn soll eine Flüchtlingsunterkunft entstehen. Das Land will Bürgerinnen und Bürger für ""das soziale Miteinander"" einbeziehen, doch die Kleinstadt wehrt sich.
Di… [+1913 chars]",,de,'Not'
https://www.welt.de/reise/staedtereisen/article252859454/Suedkorea-Busan-die-zweitgroesste-Stadt-nach-Seoul-ist-unterschaetzt.html,https://www.welt.de/reise/staedtereisen/article252859454/Suedkorea-Busan-die-zweitgroesste-Stadt-nach-Seoul-ist-unterschaetzt.html,0,www.welt.de,Busan – die unterschätzte Nummer 2 in Südkorea,"Wer nach Südkorea reist, macht fast immer in der Hauptstadt Seoul Urlaub – und lässt Busan links liegen. Was schade ist, denn die zweitgrößte Stadt des Landes bietet aufregende Viertel, bestes Seafood und maritimes Flair mit fernöstlicher Note. Ein Rundgang d…",https://img.welt.de/img/reise/mobile252864882/1001351397-ci16x9-w1200/GettyImages-1720701433.jpg,2024-08-07T05:15:23Z,,"Es gehört Mumm dazu, das Cheongsapo-Daritdol-Observatory zu betreten. Über 72,5 Meter führt der Skywalk von der hohen Küste auf das Meer hinaus wie eine geschwungene Brücke, die im Nichts endet. Ihr … [+10600 chars]",,de,'Not'
https://www.morgenpost.de/bezirke/pankow/article406967357/rohrbruch-in-pankow-wasser-ueberflutet-mehrere-strassen.html,https://www.morgenpost.de/bezirke/pankow/article406967357/rohrbruch-in-pankow-wasser-ueberflutet-mehrere-strassen.html,0,www.morgenpost.de,Rohrbruch in Pankow: Wasser überflutet mehrere Straßen,"Nach einem Rohrbruch in der Thulestraße stehen mehrere Straßen unter Wasser. Wie lange die Reparatur dauert, ist noch ungewiss.",https://img.sparknews.funkemedien.de/406967144/406967144_1723025496_v16_9_1600.jpeg,2024-08-07T10:41:36Z,,"Berlin. Nach einem Rohrbruch in der Thulestraße stehen mehrere Straßen unter Wasser. Wie lange die Reparatur dauert, ist noch ungewiss.
Wellenförmig geschichteter Sand wie am Strand, SUV-Reifen umsp… [+2116 chars]",,de,'Rohrbruch'
https://www.tagesschau.de/ausland/europa/sizilien-duerre-100.html,https://www.tagesschau.de/ausland/europa/sizilien-duerre-100.html,0,www.tagesschau.de,Dürre auf Sizilien: Hotelpools gefüllt - Insulaner verärgert,"Sizilien steht eine extreme Dürreperiode durch: Bauern bringen ihr Vieh zu Notschlachtungen, Bewohner stehen mit Eimern Schlange vor öffentlichen Brunnen. Der Notstand hat vor allem menschliche Ursachen. Von Rüdiger Kronthaler.",https://images.tagesschau.de/image/0e3b365a-232c-485c-a713-fd70bfb07b24/AAABkSxvOJA/AAABjwnlFvA/16x9-1280/sizilien-126.jpg,2024-08-07T10:42:52Z,,"Stand: 07.08.2024 12:42 Uhr
Sizilien steht eine extreme Dürreperiode durch: Bauern bringen ihr Vieh zu Notschlachtungen, Bewohner stehen mit Eimern Schlange vor öffentlichen Brunnen. Der Notstand ha… [+3569 chars]",,de,'Dürre'
https://www.zeit.de/politik/ausland/2024-08/tunesien-staatschef-kais-saied-entlaesst-seinen-ministerpraesidenten,https://www.zeit.de/politik/ausland/2024-08/tunesien-staatschef-kais-saied-entlaesst-seinen-ministerpraesidenten,0,www.zeit.de,Nordafrika: Tunesiens Staatschef entlässt den Ministerpräsidenten,Wasser- und Stromausfälle plagen die Bevölkerung in Tunesien. Die Regierung sieht Dürre als Ursache. Der Präsident wittert hingegen eine Verschwörung.,https://img.zeit.de/politik/ausland/2024-08/tunesien-ministerpraesident-ahmed-hachani-entlassen/wide__1300x731,2024-08-08T04:13:16Z,,"Der tunesische Präsident Kais Saied hat Ministerpräsident
Ahmed Hachani seines Amtes enthoben. Der bisherige Sozialminister Kamel
Maddouri wird seinen Posten übernehmen. Die Entlassung erfolgt vor … [+3189 chars]",,de,'Dürre'
https://www.focus.de/panorama/welt/griechenland-und-die-verzweifelte-kampf-um-das-wasser_id_260210558.html,https://www.focus.de/panorama/welt/griechenland-und-die-verzweifelte-kampf-um-das-wasser_id_260210558.html,0,www.focus.de,Dürre und die Folgen - Touristen können nicht mehr duschen! Griechenland kämpft verzweifelt um das Wasser,"Die beliebte Urlaubsregion trocknet aus, die Touristen bleiben weg und die Einheimischen versuchen verzweifelt, den Alltag ohne fließendes Wasser zu meistern. Die Dürre schlägt gnadenlos zu - und eine Lösung ist nicht in Sicht.Von FOCUS-online-Autor Wassilis …",https://p6.focus.de/img/fotos/id_259882384/griechenland-halbins-81239286.jpg?im=Crop%3D%280%2C577%2C3464%2C1732%29%3BResize%3D%281200%2C627%29&impolicy=perceptual&quality=mediumHigh&hash=96cc3fc9874f8c227f8b5b39795fc8c72676ff66e67ac1246bca0ff04608edfb,2024-08-09T11:29:06Z,,"Die beliebte Urlaubsregion trocknet aus, die Touristen bleiben weg und die Einheimischen versuchen verzweifelt, den Alltag ohne fließendes Wasser zu meistern. Die Dürre schlägt gnadenlos zu - und ein… [+5645 chars]",,de,'Dürre'
