index,url,valid,domain,title,description,image,published,archive,content,quote,language,keyword
https://taz.de/Debatte-ueber-Maskenpflicht-im-OePNV/!5903848/,https://taz.de/Debatte-ueber-Maskenpflicht-im-OePNV/!5903848/,0,taz.de,Debatte über Maskenpflicht im ÖPNV: Die Politik hat keine Wahl mehr,"Natürlich wären Masken in vollen Berliner U-Bahnen sinnvoll, auch jenseits von Corona. Aber die Zeit der Pflicht ist vorbei, zumindest derzeit.",https://taz.de/picture/6013594/948/0341-1.jpeg,2023-01-05T08:11:00Z,https://web.archive.org/web/20230105082614/https://taz.de/Debatte-ueber-Maskenpflicht-im-OePNV/!5903848/,"Natürlich wären Masken in vollen Berliner U-Bahnen sinnvoll, auch jenseits von Corona. Aber die Zeit der Pflicht ist vorbei, zumindest derzeit.
Inzwischen fast schon die löbliche Ausnahme: maskenpfl… [+2946 chars]",,de,'ÖPNV'
https://www.bild.de/regional/frankfurt/frankfurt-aktuell/wiesbaden-defekte-gasleitung-zwei-verletzte-bei-explosion-in-garage-82449614.bild.html,https://www.bild.de/regional/frankfurt/frankfurt-aktuell/wiesbaden-defekte-gasleitung-zwei-verletzte-bei-explosion-in-garage-82449614.bild.html,0,www.bild.de,Defekte Gasleitung - Zwei Verletzte bei Explosion in Garage,Wiesbaden – Explosion in Hessens Landeshauptstadt: Im Wiesbadener Ortsbezirk Nordenstadt rummste es am Donnerstagmorgen in einer Garage eines Bungalows.,"https://images.bild.de/63b68680261468542f73963c/245df285f3b4e346cef6aa6dbc999ae1,1ba66177?w=1280",2023-01-05T08:24:15Z,https://web.archive.org/web/20230105085118/https://www.bild.de/regional/frankfurt/frankfurt-aktuell/wiesbaden-defekte-gasleitung-zwei-verletzte-bei-explosion-in-garage-82449614.bild.html,"Wiesbaden Explosion in Hessens Landeshauptstadt: Im Wiesbadener Ortsbezirk Nordenstadt rummste es am Donnerstagmorgen in einer Garage eines Bungalows.
Eine Frau (56) wurde offenbar schwer, ein Mann … [+1587 chars]",,de,'Gas'
https://www.welt.de/wirtschaft/article243031315/Energiewende-Warum-die-Plaene-der-Politik-Selbstbetrug-sind.html,https://www.welt.de/wirtschaft/article243031315/Energiewende-Warum-die-Plaene-der-Politik-Selbstbetrug-sind.html,0,www.welt.de,Die deutsche Energiewende ist bestimmt von Realitätsverweigerung,"Das teure Bemühen, die CO₂-Emissionen nachhaltig zu reduzieren, stockt. Zu stark ist der Ausstoß durch Kohleverstromung nach dem Ende des russischen Gases. Ab April wird sich die Lage noch verschlimmern. Die Antworten der Regierung signalisieren Hilflosigkeit…",https://img.welt.de/img/wirtschaft/mobile243031313/7701359137-ci16x9-w1200/Kombo-Fabricius-Kohlekraftwerk.jpg,2023-01-05T08:47:30Z,https://web.archive.org/web/20230105090414/https://www.welt.de/wirtschaft/article243031315/Energiewende-Warum-die-Plaene-der-Politik-Selbstbetrug-sind.html,"Die Realitätsverweigerung in der deutschen Energiewende-Strategie erreicht bedenkliche Ausmaße. Als Reaktion auf einen Erdbeben-Tsunami in Japan hat die Bundesregierung zunächst beschlossen, aus der … [+2374 chars]",,de,'Gas'
https://www.zeit.de/news/2023-01/05/bremse-und-gas-verwechselt-auto-kracht-in-aufzug,https://www.zeit.de/news/2023-01/05/bremse-und-gas-verwechselt-auto-kracht-in-aufzug,0,www.zeit.de,Unfall: Bremse und Gas verwechselt: Auto kracht in Aufzug,,,2023-01-05T09:00:59Z,,"When browsing with ads:
We collect personal data and also transmit it to third-party providers
 that help us improve and finance our digital content. Some of the information stored on your device, … [+732 chars]",,de,'Gas'
https://www.stern.de/gesellschaft/regional/rheinland-pfalz-saarland/unfall--bremse-und-gas-verwechselt--auto-kracht-in-aufzug-33070688.html,https://www.stern.de/gesellschaft/regional/rheinland-pfalz-saarland/unfall--bremse-und-gas-verwechselt--auto-kracht-in-aufzug-33070688.html,0,www.stern.de,Unfall: Bremse und Gas verwechselt: Auto kracht in Aufzug,"Weil er Gas- und Bremspedal verwechselte, ist ein 86 Jahre alter Mann mit seinem Auto in einen Aufzug in Worms gekracht. Durch den Aufprall am Mittwochabend sei ein Schaden von rund 200.000 Euro entstanden, teilte die Polizei am Donnerstag mit. Der Fahrer hat…",https://image.stern.de/6681672/t/31/v5/w1440/r1.7778/-/video-fallback-image.jpg,2023-01-05T09:00:59Z,,"Weil er Gas- und Bremspedal verwechselte, ist ein 86 Jahre alter Mann mit seinem Auto in einen Aufzug in Worms gekracht. Durch den Aufprall am Mittwochabend sei ein Schaden von rund 200.000 Euro ents… [+697 chars]",,de,'Gas'
https://www.morgenpost.de/wirtschaft/article237292913/heizoelpreise-aktuell-heute-5-januar-2023-energiekrise-oelpreis.html,https://www.morgenpost.de/wirtschaft/article237292913/heizoelpreise-aktuell-heute-5-januar-2023-energiekrise-oelpreis.html,0,www.morgenpost.de,Energiekosten: Heizölpreise heute am 5. Januar: Der Preis pro Liter Heizöl,Energie- und Preiskrise in Deutschland: Wie entwickeln sind die Heizölpreise aktuell? ○ Den Preis pro Liter Heizöl vom 5. Januar finden Sie hier.,https://img.morgenpost.de/img/Import/crop236494959/1322606720-w820-cv16_9-q85/Heizoel.jpg,2023-01-05T09:10:37Z,,Berlin. Die vom Krieg in der Ukraine ausgelöste Energie- und Preiskrise hat die Energiepreise in Deutschland massiv beeinflusst. Im Herbst 2022 spürten das die Verbraucher primär mit Blick auf die He… [+7079 chars],,de,'Gas'
https://www.morgenpost.de/wirtschaft/article237293353/pelletspreise-heute-aktuell-5-januar-2023-energie-verbraucher-inflation.html,https://www.morgenpost.de/wirtschaft/article237293353/pelletspreise-heute-aktuell-5-januar-2023-energie-verbraucher-inflation.html,0,www.morgenpost.de,Energiekosten: Pelletspreise am 5. Januar: Der Preis je Tonne Pellets heute,Wie entwickelt sich der Pelletspreis im neuen Jahr? In unserer Tabelle finden Sie die aktuelle Preisentwicklung je Tonne vom 5. Januar.,https://img.morgenpost.de/img/wirtschaft/crop235813099/3042605953-w820-cv16_9-q85/f5fd9c30-fc59-11ec-b30f-f0270eb2aedb.jpg,2023-01-05T09:44:36Z,https://web.archive.org/web/20230105112409/https://www.morgenpost.de/wirtschaft/article237293353/pelletspreise-heute-aktuell-5-januar-2023-energie-verbraucher-inflation.html,Berlin. Das Jahr 2022 war für viele Verbraucher von der Energie- und Preiskrise infolge der Kämpfe in der Ukraine geprägt. Die Kosten für Brennstoffe wie Heizöl und Gas sind explodiert. Und auch alte… [+4113 chars],,de,'Energiekosten'
https://www.morgenpost.de/wirtschaft/article237293501/gaspreis-aktuell-heute-5-januar-2023-energie-preis-gas-kwh.html,https://www.morgenpost.de/wirtschaft/article237293501/gaspreis-aktuell-heute-5-januar-2023-energie-preis-gas-kwh.html,0,www.morgenpost.de,Energiekosten: Gaspreis aktuell: Der Preis pro kWh heute am 5. Januar 2023,Auf dem Großmarkt fällt der Gaspreis. ○ Doch Verbraucher profitieren kaum davon. ○ Das ist der aktuelle Preis heute am 5. Januar 2023.,https://img.morgenpost.de/img/politik/crop237282563/2542602661-w820-cv16_9-q85/d3830766-8b7f-11ed-8fad-661895d80283.jpg,2023-01-05T09:59:57Z,,Berlin. Das neue Jahr bringt Schwung in den Gasmarkt: Im Großhandel sind die Preise deutlich gesunken doch Verbraucher profitieren kaum von dieser Entwicklung. Zwar sinkt der Preis für Gas leicht all… [+5032 chars],,de,'Gas'
https://www.tagesspiegel.de/wirtschaft/das-gas-fehlt-anderswo-europas-lng-kaufe-reissen-weltweit-lucken-9130186.html,https://www.tagesspiegel.de/wirtschaft/das-gas-fehlt-anderswo-europas-lng-kaufe-reissen-weltweit-lucken-9130186.html,0,www.tagesspiegel.de,Das Gas fehlt anderswo: Europas LNG-Käufe reißen weltweit Lücken,Russland exportiert kaum noch Erdgas – so fehlen dem Weltmarkt riesige Gasmengen. Deutschland kauft für viel Geld Ersatz. Aber ärmere Länder haben ein Problem.,https://www.tagesspiegel.de/images/file-photo-opening-of-the-lng-terminal-in-wilhelmshaven1/alternates/BASE_16_9_W1400/file-photo-opening-of-the-lng-terminal-in-wilhelmshaven.jpeg,2023-01-05T10:36:03Z,,"Wenn Deutschland Bilanz zieht für die Energieversorgung im Jahr 2022, dann sieht es auf den ersten Blick gut aus. Es ist nicht zum befürchteten Gasnotstand gekommen. Und die Gasspeicher sind Anfang J… [+186 chars]",,de,'Gas'
https://www.focus.de/finanzen/wegen-stark-gestiegener-energiepreise-experten-mahnen-eindringlich-diese-6-heizfehler-koennen-jetzt-richtig-teuer-werden_id_179880421.html,https://www.focus.de/finanzen/wegen-stark-gestiegener-energiepreise-experten-mahnen-eindringlich-diese-6-heizfehler-koennen-jetzt-richtig-teuer-werden_id_179880421.html,0,www.focus.de,Wegen stark gestiegener Energiepreise - Experten mahnen eindringlich: Diese 6 Heizfehler können jetzt richtig teuer werden,"Um die teuren Heizkosten zu reduzieren, sparen immer mehr Verbraucher Energie ein. Doch selbst bei perfekt eingestellter Heizung und optimaler Dämmung können Heizfehler dieses Ziel zunichte machen. Der Zentralverband Sanitär Heizung Klima zeigt die teuersten …",https://p6.focus.de/img/fotos/id_182216977/gettyimages-1389500445.jpg?im=Crop%3D%280%2C177%2C2121%2C1060%29%3BResize%3D%281200%2C627%29&impolicy=perceptual&quality=medium&hash=418870f35b6f2c8ae31f46b9cae741971853e52c91dae802a89ddd7473bda86f,2023-01-05T10:58:11Z,,"Um die teuren Heizkosten zu reduzieren, sparen immer mehr Verbraucher Energie ein. Doch selbst bei perfekt eingestellter Heizung und optimaler Dämmung können Heizfehler dieses Ziel zunichte machen. D… [+6631 chars]",,de,'Heizung'
https://www.zeit.de/news/2023-01/05/krankenkassenbeschaeftigte-lotst-retter-zu-senior-in-not,https://www.zeit.de/news/2023-01/05/krankenkassenbeschaeftigte-lotst-retter-zu-senior-in-not,0,www.zeit.de,Cuxhaven: Krankenkassenbeschäftigte lotst Retter zu Senior in Not,,,2023-01-05T11:21:22Z,,"When browsing with ads:
We collect personal data and also transmit it to third-party providers
 that help us improve and finance our digital content. Some of the information stored on your device, … [+732 chars]",,de,'Not'
https://www.diepresse.com/6234913/deutsche-bundesnetzagentur-gibt-leichte-entwarnung-in-der-gaskrise,https://www.diepresse.com/6234913/deutsche-bundesnetzagentur-gibt-leichte-entwarnung-in-der-gaskrise,0,www.diepresse.com,Deutsche Bundesnetzagentur gibt leichte Entwarnung in der Gaskrise,"Eine Gasmangellage in diesem Winter werde ""zunehmend unwahrscheinlich"". Insgesamt sei die Lage weniger angespannt als zu Beginn des Winters.",https://media.diepresse.com/social_diepresse_nachrichten/images/uploads_1200/3/2/1/6234913/BEC07A4C-ECFE-4621-B64A-ADBF0C9622B0_v0_h.jpg,2023-01-05T12:40:00Z,,"Eine Gasmangellage in diesem Winter werde ""zunehmend unwahrscheinlich"". Insgesamt sei die Lage weniger angespannt als zu Beginn des Winters.
In der Gaskrise gibt die deutsche Bundesnetzagentur leich… [+955 chars]",,de,'Gas'
https://www.stern.de/wirtschaft/news/energieversorgung--bundesnetzagentur-wird-in-der-gaskrise-etwas-optimistischer-33072166.html,https://www.stern.de/wirtschaft/news/energieversorgung--bundesnetzagentur-wird-in-der-gaskrise-etwas-optimistischer-33072166.html,0,www.stern.de,Energieversorgung: Bundesnetzagentur wird in der Gaskrise etwas optimistischer,Im vergangenen Jahr sprach die Bundesnetzagentur von einer angespannten Lage hinsichtlich der Gasversorgung in Deutschland. Das ist jetzt anders. Entwarnung gibt die Behörde aber nicht.,https://image.stern.de/33072168/t/mh/v1/w1440/r1.7778/-/05--urnnewsmldpacom2009010123010599114395v3w800h600l716t51r1699b1119jpeg---12e7bc43ef4a4eb6.jpg,2023-01-05T12:44:34Z,,"Im vergangenen Jahr sprach die Bundesnetzagentur von einer angespannten Lage hinsichtlich der Gasversorgung in Deutschland. Das ist jetzt anders. Entwarnung gibt die Behörde aber nicht.
In der Gaskr… [+1003 chars]",,de,'Gas'
https://www.morgenpost.de/wirtschaft/article237295407/Bundesnetzagentur-wird-in-der-Gaskrise-etwas-optimistischer.html,https://www.morgenpost.de/wirtschaft/article237295407/Bundesnetzagentur-wird-in-der-Gaskrise-etwas-optimistischer.html,0,www.morgenpost.de,Energieversorgung: Bundesnetzagentur wird in der Gaskrise etwas optimistischer,Im vergangenen Jahr sprach die Bundesnetzagentur von einer angespannten Lage hinsichtlich der Gasversorgung in Deutschland. Das ist jetzt anders. Entwarnung gibt die Behörde aber nicht.,https://img.morgenpost.de/img/wirtschaft/crop237295405/2382609517-w820-cv16_9-q85/Erdgasspeicher.jpg,2023-01-05T12:44:34Z,,"Bonn. In der Gaskrise gibt die Bundesnetzagentur leichte Entwarnung. Wie aus dem aktuellen Lagebericht der Behörde hervorgeht, wird aus ihrer Sicht eine Gasmangellage in diesem Winter zunehmend unwah… [+809 chars]",,de,'Gas'
https://www.faz.net/aktuell/wirtschaft/bundesnetzagentur-haelt-gasmangellage-fuer-zunehmend-unwahrscheinlich-18580811.html,https://www.faz.net/aktuell/wirtschaft/bundesnetzagentur-haelt-gasmangellage-fuer-zunehmend-unwahrscheinlich-18580811.html,0,www.faz.net,Milder Winter: Bundesnetzagentur wird in der Gaskrise etwas optimistischer,"Laut der Behörde wird eine Gasmangellage in Deutschland in diesem Winter zunehmend unwahrscheinlich. Das liegt am Wetter und an den Einsparbemühungen. Trotzdem bleibe es wichtig, sparsam zu sein.",https://media1.faz.net/ppmedia/aktuell/wirtschaft/2080698053/1.8580843/facebook_teaser/rohrleitungen-an-einem.jpg,2023-01-05T13:10:47Z,,"In der Gaskrise gibt die Bundesnetzagentur leichte Entwarnung. Wie aus dem am Donnerstag publizierten Lagebericht der Behörde hervorgeht, wird aus ihrer Sicht eine Gasmangellage in diesem Winter zune… [+1348 chars]",,de,'Gas'
https://www.welt.de/wirtschaft/article243043323/Bundesnetzagentur-haelt-Gasmangel-diesen-Winter-fuer-zunehmend-unwahrscheinlich.html,https://www.welt.de/wirtschaft/article243043323/Bundesnetzagentur-haelt-Gasmangel-diesen-Winter-fuer-zunehmend-unwahrscheinlich.html,0,www.welt.de,Bundesnetzagentur hält Gasmangel diesen Winter für „zunehmend unwahrscheinlich“,"Dass Deutschland in den nächsten Monaten das Gas ausgeht, ist laut Bundesnetzagentur unwahrscheinlich. Gründe dafür seien zusätzliche Importe aus anderen Ländern und weitere Einsparungen beim Verbrauch.",https://img.welt.de/img/regionales/niedersachsen/mobile243000061/4291358267-ci16x9-w1200/Pipelineanbindung-fuer-das-LNG-Terminal.jpg,2023-01-05T13:26:13Z,,"In der Gaskrise gibt die Bundesnetzagentur leichte Entwarnung. Wie aus dem am Donnerstag publizierten Lagebericht der Behörde hervorgeht, wird aus ihrer Sicht eine Gasmangellage in diesem Winter zune… [+816 chars]",,de,'Gas'
https://www.faz.net/aktuell/wissen/erde-klima/liveticker-klima-koennen-wale-helfen-co2-aus-der-atmosphaere-zu-ziehen-18134531.html,https://www.faz.net/aktuell/wissen/erde-klima/liveticker-klima-koennen-wale-helfen-co2-aus-der-atmosphaere-zu-ziehen-18134531.html,0,www.faz.net,"Klimablog: Können Wale helfen, CO2 aus der Atmosphäre zu ziehen?",Arktische Seen trocknen aus +++ Gaskraftwerke langfristig zehnmal teurer als PV-Anlagen +++ Die reichsten zehn Prozent emittieren das meiste CO₂ +++ Wenige Pflanzenarten dominieren Deutschland +++ alles Wichtige im F.A.Z. Klimablog „Kipppunkt“.,https://media1.faz.net/ppmedia/aktuell/wissen/185511733/1.7255707/facebook_teaser/buckelwale-gehoeren-wie.jpg,2023-01-05T13:37:27Z,,"Teure Gaskraftwerke, günstige Solarkraft: Nach Berechnungen des norwegischen Energieberatungsunternehmens Rystad Energy werden Gaskraftwerke langfristig zehnmal teurer sein als der Bau neuer Photovol… [+2234 chars]",,de,'Gas'
https://www.sueddeutsche.de/politik/gas-wasserstoff-habeck-norwegen-1.5727414,https://www.sueddeutsche.de/politik/gas-wasserstoff-habeck-norwegen-1.5727414,0,www.sueddeutsche.de,Energieversorgung: Die Norweger sind die Freunde in der Not,"Das skandinavische Land ist mittlerweile Deutschlands wichtigster Gaslieferant, nie waren die Bande so eng. Geht es nach Wirtschaftsminister Robert Habeck, liefert Norwegen bald statt Erdgas große Mengen Wasserstoff. Ob das gelingt?",https://www.sueddeutsche.de/image/sz.1.5727415/1200x675?v=1672930610,2023-01-05T14:57:11Z,,"Das skandinavische Land ist mittlerweile Deutschlands wichtigster Gaslieferant, nie waren die Bande so eng. Geht es nach Wirtschaftsminister Robert Habeck, liefert Norwegen bald statt Erdgas große Me… [+5312 chars]",,de,'Gas'
