index,url,valid,domain,title,description,image,published,archive,content,quote,language,keyword
https://www.tagesspiegel.de/berlin/in-richtung-wochenende-wird-es-warmer-neuschnee-in-berlin-und-brandenburg--aber-plusgrade-in-aussicht-15214862.html,https://www.tagesspiegel.de/berlin/in-richtung-wochenende-wird-es-warmer-neuschnee-in-berlin-und-brandenburg--aber-plusgrade-in-aussicht-15214862.html,0,www.tagesspiegel.de,In Richtung Wochenende wird es wärmer: Neuschnee in Berlin und Brandenburg – aber Plusgrade in Aussicht,Mit gefrierendem Regen und Schneefall: Die Straßen dürften in den kommenden Tagen rutschig bleiben. Dafür sind bei den Temperaturen wieder Plusgrade in Aussicht.,https://www.tagesspiegel.de/images/15214861/alternates/BASE_16_9_W1400/1770181034000/winterwetter-in-berlin.jpeg,2026-02-04T04:57:14Z,,"In Berlin und Brandenburg sind Schnee und Temperaturen über dem Gefrierpunkt in Sicht. Laut Deutschem Wetterdienst (DWD) ist es am Mittwoch stark bewölkt bei Höchsttemperaturen von -6 bis 1 Grad. 
T… [+1091 chars]",,de,'Schnee'
https://www.tagesspiegel.de/berlin/wetter-schnee-und-glatte-in-berlin-und-brandenburg-erwartet-15214862.html,https://www.tagesspiegel.de/berlin/wetter-schnee-und-glatte-in-berlin-und-brandenburg-erwartet-15214862.html,0,www.tagesspiegel.de,Wetter: Schnee und Glätte in Berlin und Brandenburg erwartet,Mit gefrierendem Regen und Schneefall: Die Straßen dürften in den kommenden Tagen rutschig bleiben. Dafür sind bei den Temperaturen wieder Plusgrade in Aussicht.,https://www.tagesspiegel.de/images/15214861/alternates/BASE_16_9_W1400/1770181034000/winterwetter-in-berlin.jpeg,2026-02-04T04:57:14Z,,In Berlin und Brandenburg sind Schnee und Temperaturen über dem Gefrierpunkt in Sicht. Laut Deutschem Wetterdienst (DWD) ist es am Mittwoch stark bewölkt bei Höchsttemperaturen von -6 bis 1 Grad. In … [+632 chars],,de,'Schnee'
https://www.zeit.de/news/2026-02/04/winterwetter-bremst-nahverkehr-wo-pendler-geduld-brauchen,https://www.zeit.de/news/2026-02/04/winterwetter-bremst-nahverkehr-wo-pendler-geduld-brauchen,0,www.zeit.de,Glätte und Schnee: Winterwetter bremst Nahverkehr – Wo Pendler Geduld brauchen,Hier finden Sie Informationen zu dem Thema „Glätte und Schnee“. Lesen Sie jetzt „Winterwetter bremst Nahverkehr – Wo Pendler Geduld brauchen“.,https://img.zeit.de/news/2026-02/04/winterwetter-bremst-nahverkehr-wo-pendler-geduld-brauchen-image-group/wide__1300x731,2026-02-04T06:00:07Z,,"Wer mit Bus oder Regionalbahn in Niedersachsen unterwegs ist, braucht wegen des Winterwetters Geduld. Fahrgäste müssen mit Verzögerungen oder Ausfällen im Linienverkehr rechnen, wie mehrere Busuntern… [+979 chars]",,de,'Schnee'
https://www.zeit.de/news/2026-02/04/winterwetter-legt-teile-des-bahn-fernverkehrs-lahm,https://www.zeit.de/news/2026-02/04/winterwetter-legt-teile-des-bahn-fernverkehrs-lahm,0,www.zeit.de,"Schnee, Eis, Kälte: Winterwetter legt Teile des Bahn-Fernverkehrs lahm","Hier finden Sie Informationen zu dem Thema „Schnee, Eis, Kälte“. Lesen Sie jetzt „Winterwetter legt Teile des Bahn-Fernverkehrs lahm“.",https://img.zeit.de/news/2026-02/04/winterwetter-legt-teile-des-bahn-fernverkehrs-lahm-image-group/wide__1300x731,2026-02-04T08:11:13Z,,"Das Winterwetter sorgt im Fernverkehr der Deutschen Bahn zwischen Berlin und Hannover am Morgen für zahlreiche Ausfälle. Wie die Bahn online mitteilte, fällt unter anderem der ICE-Sprinter zwischen B… [+338 chars]",,de,'Kälte'
https://www.zeit.de/news/2026-02/05/eisparty-unmoeglich-warum-friert-der-maschsee-nicht-zu,https://www.zeit.de/news/2026-02/05/eisparty-unmoeglich-warum-friert-der-maschsee-nicht-zu,0,www.zeit.de,Eis und Schnee: Eisparty unmöglich: Warum friert der Maschsee nicht zu?,Hier finden Sie Informationen zu dem Thema „Eis und Schnee“. Lesen Sie jetzt „Eisparty unmöglich: Warum friert der Maschsee nicht zu?“.,https://img.zeit.de/news/2026-02/05/eisparty-unmoeglich-warum-friert-der-maschsee-nicht-zu-image-group/wide__1300x731,2026-02-05T05:00:06Z,,Trotz anhaltender Frosttage friert der Maschsee in Hannover nicht ganz zu. An einen erneuten Schlittschuh-Spaß auf dem See wie zuletzt im Jahr 2012 mit rund 150.000 Besuchern ist daher derzeit nicht … [+2684 chars],,de,'Wind'
