index,url,valid,domain,title,description,image,published,archive,content,quote,language,keyword
https://www.tagesschau.de/wirtschaft/unternehmen/uniper-strategie-klimaneutral-100.html,https://www.tagesschau.de/wirtschaft/unternehmen/uniper-strategie-klimaneutral-100.html,0,www.tagesschau.de,Gasimporteur Uniper will Geschäftsmodell neu ausrichten,"Vor gut einem Jahr stand das Energieunternehmen Uniper am Abgrund, der Bund musste es mit Milliardenhilfen retten. Heute geht es dem Konzern deutlich besser - und er will mittelfristig weg vom Geschäft mit Gas und Kohle. Von Volker Hirth.",https://images.tagesschau.de/image/42c37788-dad5-43f2-825e-be798d061b27/AAABibC4KBc/AAABibBxqrQ/16x9-1280/uniper-157.jpg,2023-08-01T11:03:38Z,http://archive.md/20230801190926/https://www.tagesschau.de/wirtschaft/unternehmen/uniper-strategie-klimaneutral-100.html,"Stand: 01.08.2023 13:03 Uhr
Vor gut einem Jahr stand das Energieunternehmen Uniper am Abgrund, der Bund musste es mit Milliardenhilfen retten. Heute geht es dem Konzern deutlich besser - und er will… [+2853 chars]",,de,'Gas'
https://www.der-postillon.com/2023/08/uran.html,https://www.der-postillon.com/2023/08/uran.html,0,www.der-postillon.com,Putsch in Bawongola: Fällt jetzt Deutschlands wichtigster Lieferant für Wind und Sonne weg?,Elnay (dpo) - Große Sorgen um Deutschlands Energiesicherheit: Nach einem Militärputsch in Bawongola rechnen Experten mit einem Wegbrechen der wichtigen Sonnen- und Windimporte aus dem ostwestafrikanischen Land. Deutschland bezog im Jahr 2022 rund 80% seines W…,https://blogger.googleusercontent.com/img/b/R29vZ2xl/AVvXsEhI2hrKnr5KgOo0WoiDT-qbg_UMvhH0TWU10rxR5wy7vI-SdY9f7_1tMK9C8kvXJ2uhRAWt1_zyStiN7XKEHGiYdAFVFUYSZ_m2oNNUDW8CApGWFXkKYrcWFoK5OOAplupTA5F2CZE6bXhGvP06pVgdtM6CSsoLEyDtR6XNDX3GNjm-EoX1R0Ufu4j4M6g/w1600/Bawongola.jpg,2023-08-01T12:53:04Z,http://archive.md/20230802125926/https://www.der-postillon.com/2023/08/uran.html,Elnay (dpo) - Große Sorgen um Deutschlands Energiesicherheit: Nach einem Militärputsch in Bawongola rechnen Experten mit einem Wegbrechen der wichtigen Sonnen- und Windimporte aus dem ostwestafrikani… [+1525 chars],,de,'Wind'
https://www.focus.de/klima/analyse/hilfe-gegen-dunkelflauten-der-wichtige-durchbruch-fuer-die-deutsche-energiewende_id_200710354.html,https://www.focus.de/klima/analyse/hilfe-gegen-dunkelflauten-der-wichtige-durchbruch-fuer-die-deutsche-energiewende_id_200710354.html,0,www.focus.de,Hilfe gegen „Dunkelflauten“ - Der wichtige Durchbruch für die deutsche Energiewende,"Kein Wind weht, keine Sonne scheint: Was passiert im Energiesystem der Zukunft bei sogenannten „Dunkelflauten“? Dann sollen neue Kraftwerke einspringen. Auf EU-Ebene ist der Bundesregierung jetzt ein kleiner Durchbruch gelungen.",https://p6.focus.de/img/fotos/id_200711322/gettyimages-1396452117.jpg?im=Crop%3D%280%2C320%2C3265%2C1633%29%3BResize%3D%281200%2C627%29&impolicy=perceptual&quality=mediumHigh&hash=fdb2107c135cf58cc1f7c6632b7fcb1ac4eb853faad9c3a192c433c2413bfd3a,2023-08-02T07:55:13Z,,"Kein Wind weht, keine Sonne scheint: Was passiert im Energiesystem der Zukunft bei sogenannten Dunkelflauten? Dann sollen neue Kraftwerke einspringen. Auf EU-Ebene ist der Bundesregierung jetzt ein k… [+5172 chars]",,de,'Wind'
https://www.pcgames.de/The-Last-of-Us-Part-1-Spiel-73749/News/Klon-Nintendo-Switch-1425828/,https://www.pcgames.de/The-Last-of-Us-Part-1-Spiel-73749/News/Klon-Nintendo-Switch-1425828/,0,www.pcgames.de,"Doch kein ""Last of Us"" auf Nintendo Switch: Sony killt den frechen Klon","Ein dreister The Last of Us-Klon für die Nintendo Switch sorgte in den letzten Wochen für jede Menge Wirbel, jetzt hat Sony scheinbar Wind davon bekommen und den Titel endgültig entfernen lassen.",https://www.pcgames.de/screenshots/medium/2023/04/The-Last-of-Us-Part-1-PC-6--pc-games.jpg,2023-08-02T09:48:00Z,,Die The Last of Us-Reihe von Sony zählt bis heute zu den Videospielen mit der ergreifendsten Geschichte jemals und wurde vielfach ausgezeichnet. Im letzten Jahr wurde dem Franchise sogar eine ganze H… [+1854 chars],,de,'Wind'
https://consent.google.com/ml?continue=https://news.google.com/rss/articles/CBMijQFodHRwczovL3d3dy5uZHIuZGUvbmFjaHJpY2h0ZW4vbmllZGVyc2FjaHNlbi9vbGRlbmJ1cmdfb3N0ZnJpZXNsYW5kL1N0YXJrZXItV2luZC1kcm9odC1GcmVtYW50bGUtSGlnaHdheS1tdXNzLWluLWVpbmVuLUhhZmVuLGZyYWNodGVyNzMyLmh0bWzSAQA?oc%3D5&gl=FR&hl=en-US&cm=2&pc=n&src=1,https://consent.google.com/ml?continue=https://news.google.com/rss/articles/CBMijQFodHRwczovL3d3dy5uZHIuZGUvbmFjaHJpY2h0ZW4vbmllZGVyc2FjaHNlbi9vbGRlbmJ1cmdfb3N0ZnJpZXNsYW5kL1N0YXJrZXItV2luZC1kcm9odC1GcmVtYW50bGUtSGlnaHdheS1tdXNzLWluLWVpbmVuLUhhZmVuLGZyYWNodGVyNzMyLmh0bWzSAQA?oc%3D5&gl=FR&hl=en-US&cm=2&pc=n&src=1,0,consent.google.com,"Starker Wind droht: ""Fremantle Highway"" muss in einen Hafen - NDR.de","<ol><li>Starker Wind droht: ""Fremantle Highway"" muss in einen Hafen  NDR.de
</li><li>Brennendes Frachtschiff Fremantle Highway hat Kräne der Zweibrücker Firma Tadano geladen  SWR Aktuell
</li><li>Frachter „Fremantle Highway“: Schiff stabil und Feuer unter K…",,2023-08-02T10:41:15Z,,"We use cookies and data to<ul><li>Deliver and maintain Google services</li><li>Track outages and protect against spam, fraud, and abuse</li><li>Measure audience engagement and site statistics to unde… [+1131 chars]",,de,'Wind'
https://www.diepresse.com/13666846/bergungsunternehmen-draengt-auf-rasche-verlegung-des-verbrannten-autofrachters,https://www.diepresse.com/13666846/bergungsunternehmen-draengt-auf-rasche-verlegung-des-verbrannten-autofrachters,0,www.diepresse.com,Bergungsunternehmen drängt auf rasche Verlegung des verbrannten Autofrachters,"Das Schiff sei bei erwartetem Wind aus Nordwest nur schwierig zu beherrschen, warnt der Chef des Bergungsunternehmens. Das Oberdeck ist stark beschädigt. Ob das Feuer wirklich gelöscht ist, ist unklar.",https://img.diepresse.com/public/incoming/h5vby7-NETHERLANDS-MARITIME-SHIPPING-FIRE/alternates/DPR_SOCIAL_NACHRICHTEN/NETHERLANDS-MARITIME-SHIPPING-FIRE,2023-08-02T10:47:58Z,,"Das Schiff sei bei erwartetem Wind aus Nordwest nur schwierig zu beherrschen, warnt der Chef des Bergungsunternehmens. Das Oberdeck ist stark beschädigt. Ob das Feuer wirklich gelöscht ist, ist unkla… [+1949 chars]",,de,'Wind'
https://www.n-tv.de/panorama/Griechenland-entschaedigt-Touristen-mit-Gratisurlaub-article24300534.html,https://www.n-tv.de/panorama/Griechenland-entschaedigt-Touristen-mit-Gratisurlaub-article24300534.html,0,www.n-tv.de,Nach Waldbränden auf Rhodos: Griechenland entschädigt Touristen mit Gratisurlaub,Tausende Touristen mussten sich wegen der heftigen Waldbrände auf Rhodos in Sicherheit bringen und ihren Urlaub abbrechen. Dabei will es die griechische Regierung aber nicht belassen. Nächstes Jahr könnten sie entweder im Frühjahr oder Herbst eine Woche Grati…,https://bilder3.n-tv.de/img/incoming/crop24300566/7291322551-cImg_16_9-w1200/418370242.jpg,2023-08-02T11:32:21Z,,Tausende Touristen mussten sich wegen der heftigen Waldbrände auf Rhodos in Sicherheit bringen und ihren Urlaub abbrechen. Dabei will es die griechische Regierung aber nicht belassen. Nächstes Jahr k… [+2194 chars],,de,'Tau'
https://www.bild.de/news/wetter/wetter/schlechte-laune-wetter-suchmeldung-wo-steckt-der-sommer-84902530.bild.html,https://www.bild.de/news/wetter/wetter/schlechte-laune-wetter-suchmeldung-wo-steckt-der-sommer-84902530.bild.html,0,www.bild.de,Schlechte-Laune-Wetter - Suchmeldung: Wo steckt der Sommer?,"Dunkle Wolken, ein frischer Wind und Temperaturen knapp über 20 Grad. Der Sommer in Deutschland hat einen herben Dämpfer bekommen.  Stürmisches Wetter. W...","https://images.bild.de/64c8c3f6e98fa73a8ae2291c/dce1e2eb387d85716a6891d7a293e520,b7f8a1f7?w=1280",2023-08-02T12:42:43Z,,"Dunkle Wolken, ein frischer Wind und Temperaturen knapp über 20 Grad. Der Sommer in Deutschland hat einen herben Dämpfer bekommen. 
Stürmisches Wetter. Wolken am Mittwoch. Regen und Gewitter. Der We… [+2085 chars]",,de,'Wind'
https://www.tagesschau.de/ausland/europa/fremantle-highway-130.html,https://www.tagesschau.de/ausland/europa/fremantle-highway-130.html,0,www.tagesschau.de,Nordsee: Bergungsunternehmen drängt auf Verlegung des Autofrachters,"Bei starkem Wind könnte die ""Fremantle Highway"" nicht mehr beherrschbar sein, warnt das Bergungsunternehmen - und drängt, den Frachter rasch in einen Hafen zu schleppen. Die sichtbaren Feuer seien erloschen. Von A. Meyer-Feist.",https://images.tagesschau.de/image/cc40b60f-2f5e-47e8-982c-7b0d02690035/AAABibZujFY/AAABibBxqrQ/16x9-1280/fremantle-highway-132.jpg,2023-08-02T13:27:25Z,,"Stand: 02.08.2023 15:27 Uhr
Bei starkem Wind könnte die ""Fremantle Highway"" nicht mehr beherrschbar sein, warnt das Bergungsunternehmen - und drängt, den Frachter rasch in einen Hafen zu schleppen. … [+2858 chars]",,de,'Wind'
https://www.tagesschau.de/ausland/europa/rhodos-waldbraende-gratis-urlaub-100.html,https://www.tagesschau.de/ausland/europa/rhodos-waldbraende-gratis-urlaub-100.html,0,www.tagesschau.de,Nach Waldbränden auf Rhodos: Mitsotakis verspricht Touristen Gratisurlaub,"Tausende Rhodos-Touristen mussten wegen der Waldbrände ihre Reise abbrechen. Die griechische Regierung will ihnen nun einen Gratisurlaub anbieten - eine Woche lang, im kommenden Jahr.",https://images.tagesschau.de/image/173062ce-0206-4299-b612-c4eb6e9b0b22/AAABhnQ0xjM/AAABibBxqrQ/16x9-1280/griechenland-strand-105.jpg,2023-08-02T13:42:35Z,,"Stand: 02.08.2023 15:42 Uhr
Tausende Rhodos-Touristen mussten wegen der Waldbrände ihre Reise abbrechen. Die griechische Regierung will ihnen nun einen Gratisurlaub anbieten - eine Woche lang, im ko… [+1818 chars]",,de,'Tau'
https://www.stern.de/panorama/notfaelle--autofrachter-sollte-moeglichst-schnell-einen-hafen-anlaufen--33694656.html,https://www.stern.de/panorama/notfaelle--autofrachter-sollte-moeglichst-schnell-einen-hafen-anlaufen--33694656.html,0,www.stern.de,Notfälle: Autofrachter sollte möglichst schnell einen Hafen anlaufen,"Der Autofrachter ""Fremantle Highway"" liegt immer noch etwa 16 Kilometer vor der niederländischen Küste vor Anker. Wann kann er in einen sicheren Hafen geschleppt werden?",https://image.stern.de/33704918/t/8Z/v1/w1440/r1.7778/-/02--urnnewsmldpacom2009010123080199647260v2w800h600l454t138r2783b1722jpeg---08b9dc36585ebbed.jpg,2023-08-02T13:48:37Z,,"Der Autofrachter ""Fremantle Highway"" liegt immer noch etwa 16 Kilometer vor der niederländischen Küste vor Anker. Wann kann er in einen sicheren Hafen geschleppt werden?
Der schwer beschädigte Autof… [+2382 chars]",,de,'Not'
