index,url,valid,domain,title,description,image,published,archive,content,quote,language,keyword
https://www.zeit.de/news/2026-02/01/experte-landwirtschaft-auf-mooren-ist-endlich,https://www.zeit.de/news/2026-02/01/experte-landwirtschaft-auf-mooren-ist-endlich,0,www.zeit.de,Welttag der Feuchtgebiete: Experte: Landwirtschaft auf Mooren ist endlich,Hier finden Sie Informationen zu dem Thema „Welttag der Feuchtgebiete“. Lesen Sie jetzt „Experte: Landwirtschaft auf Mooren ist endlich“.,https://img.zeit.de/news/2026-02/01/experte-landwirtschaft-auf-mooren-ist-endlich-image-group/wide__1300x731,2026-02-01T03:30:20Z,,Ein Viertel der landwirtschaftlich genutzten Moorfläche in Bayern könnte in 15 Jahren nicht mehr wie bisher nutzbar sein. Das prognostiziert Professor Matthias Drösler von der Hochschule Weihenstepha… [+1776 chars],,de,'Ackerbau'
https://www.stern.de/gesellschaft/regional/bayern/welttag-der-feuchtgebiete--experte--landwirtschaft-auf-mooren-ist-endlich-37095350.html,https://www.stern.de/gesellschaft/regional/bayern/welttag-der-feuchtgebiete--experte--landwirtschaft-auf-mooren-ist-endlich-37095350.html,0,www.stern.de,Welttag der Feuchtgebiete: Experte: Landwirtschaft auf Mooren ist endlich,"Moorboden war lange für Torfabbau und Ackerbau attraktiv. Während Umweltschützer betonen, dass nasse Moore wichtig für den Klimaschutz sind, haben Landwirte auch einen Wirtschaftsanreiz zum Umdenken.",https://image.stern.de/37095352/t/RJ/v1/w1440/r1.7778/-/01--kk5ligwncuv15axs2048jpeg---7ba056fc0aa6897f.jpg,2026-02-01T03:30:20Z,,"Kopiere den aktuellen Link
Zur Merkliste hinzufügen
Moorboden war lange für Torfabbau und Ackerbau attraktiv. Während Umweltschützer betonen, dass nasse Moore wichtig für den Klimaschutz sind, habe… [+1991 chars]",,de,'Ackerbau'
https://www.stern.de/gesellschaft/regional/nordrhein-westfalen/piste-mit-tradition--skigebiet-zu-verkaufen--viele-anfragen-zum--sahnehang--37095374.html,https://www.stern.de/gesellschaft/regional/nordrhein-westfalen/piste-mit-tradition--skigebiet-zu-verkaufen--viele-anfragen-zum--sahnehang--37095374.html,0,www.stern.de,"Piste mit Tradition: Skigebiet zu verkaufen: Viele Anfragen zum ""Sahnehang""","Im Sauerland sucht ein Skigebiet einen neuen Besitzer - als Komplettpaket mit Schneekanonen, Hütte, Lift und Pistenraupen. Das kuriose Inserat weckt Nachfrage, aber findet sich auch ein Käufer?",https://image.stern.de/37095376/t/pG/v1/w1440/r1.7778/-/01--4gsoqpturhv8axs2048jpeg---024567034638583b.jpg,2026-02-01T04:00:12Z,,"Kopiere den aktuellen Link
Zur Merkliste hinzufügen
Im Sauerland sucht ein Skigebiet einen neuen Besitzer - als Komplettpaket mit Schneekanonen, Hütte, Lift und Pistenraupen. Das kuriose Inserat we… [+3507 chars]",,de,'Schnee'
https://www.zeit.de/news/2026-02/01/trotz-frost-und-schnee-mv-geht-in-die-heisse-karnevalszeit,https://www.zeit.de/news/2026-02/01/trotz-frost-und-schnee-mv-geht-in-die-heisse-karnevalszeit,0,www.zeit.de,MV Helau!: Trotz Frost und Schnee: MV geht in die heiße Karnevalszeit,Hier finden Sie Informationen zu dem Thema „MV Helau!“. Lesen Sie jetzt „Trotz Frost und Schnee: MV geht in die heiße Karnevalszeit“.,https://img.zeit.de/news/2026-02/01/trotz-frost-und-schnee-mv-geht-in-die-heisse-karnevalszeit-image-group/wide__1300x731,2026-02-01T04:00:22Z,,Die Karnevalssaison in Nordosten steuert auf ihren Höhepunkt zu. Bis zum Rosenmontag am 16. Februar und darüber hinaus absolvieren «Tollitäten und närrisches Fußvolk» in vielen Orten ein strammes Pro… [+1875 chars],,de,'Schnee'
https://www.stern.de/gesellschaft/regional/mecklenburg-vorpommern/mv-helau---trotz-frost-und-schnee--mv-geht-in-die-heisse-karnevalszeit-37095388.html,https://www.stern.de/gesellschaft/regional/mecklenburg-vorpommern/mv-helau---trotz-frost-und-schnee--mv-geht-in-die-heisse-karnevalszeit-37095388.html,0,www.stern.de,MV Helau!: Trotz Frost und Schnee: MV geht in die heiße Karnevalszeit,Für die rund 90 Karnevalsvereine in MV läuft der Countdown bis Rosenmontag. Anders als im Rest der Republik lassen es die Nordost-Narren aber selbst am Aschermittwoch noch krachen. Diesmal in Waren.,https://image.stern.de/37095390/t/Lz/v1/w1440/r1.7778/-/01--76ebncul7lv16axs2048jpeg---fd8e47516c9570b3.jpg,2026-02-01T04:00:22Z,,"Kopiere den aktuellen Link
Zur Merkliste hinzufügen
Für die rund 90 Karnevalsvereine in MV läuft der Countdown bis Rosenmontag. Anders als im Rest der Republik lassen es die Nordost-Narren aber sel… [+2089 chars]",,de,'Schnee'
https://www.n-tv.de/wirtschaft/In-NRW-steht-ganzes-Skigebiet-zum-Verkauf-id30310615.html,https://www.n-tv.de/wirtschaft/In-NRW-steht-ganzes-Skigebiet-zum-Verkauf-id30310615.html,0,www.n-tv.de,"700 Meter Pisten am ""Sahnehang"": In NRW steht ganzes Skigebiet zum Verkauf","Wer schon immer vom eigenen Skihang geträumt hat, hat jetzt seine Chance. In der Nähe von Winterberg steht einer zum Verkauf. Die Gastronomie und lauter technisches Equipment gehören zum Angebot dazu.",https://www.n-tv.de/img/30310637/1769922694/Img_16_9/1200/441752302.jpg,2026-02-01T04:30:00Z,,"Bei Einheimischen und Touristen durchaus beliebt: Der ""Sahnehang"". (Foto: picture alliance/dpa)
Wer schon immer vom eigenen Skihang geträumt hat, hat jetzt seine Chance. In der Nähe von Winterberg s… [+3449 chars]",,de,'Schnee'
https://www.zeit.de/news/2026-02/01/sturmboeen-und-schnee-im-norden,https://www.zeit.de/news/2026-02/01/sturmboeen-und-schnee-im-norden,0,www.zeit.de,Wetter im Norden: Sturmböen und Schnee im Norden,Hier finden Sie Informationen zu dem Thema „Wetter im Norden“. Lesen Sie jetzt „Sturmböen und Schnee im Norden“.,https://img.zeit.de/news/2026-02/01/sturmboeen-und-schnee-im-norden-image-group/wide__1300x731,2026-02-01T10:11:40Z,,"Die neue Woche startet im Norden mit dauerhaften Minusgraden, Frost, vereinzeltem Schneefall und der damit einhergehenden Gefahr auf glatten Straßen. 
Am Sonntag herrscht Dauerfrost bei minus 2 Grad… [+1805 chars]",,de,'Schnee'
https://www.sueddeutsche.de/politik/ukraine-kaelte-angriffe-verhandlungen-li.3378854,https://www.sueddeutsche.de/politik/ukraine-kaelte-angriffe-verhandlungen-li.3378854,0,www.sueddeutsche.de,Ukraine-Krieg: Gefangen in der Kälte,"Die Ukraine leidet unter schweren Stromausfällen, während Verhandlungen zwischen ukrainischen und russischen Vertretern in Abu Dhabi fortgesetzt werden. Die Temperaturen sinken drastisch, was die Situation in Städten wie Kiew und Charkiw verschärft.",https://www.sueddeutsche.de/2026/02/01/f1e8b54f-1286-4be1-88b9-8b54f3e85e7e.jpg?q=60&fm=webp&width=1200&rect=0%2C183%2C3500%2C1969,2026-02-01T14:00:35Z,,"Diese Woche wollen sich ukrainische und russische Vertreter erneut in Abu Dhabi treffen, um die vor einer Woche begonnenen Gespräche fortzusetzen. Die Begegnung war zunächst für Sonntag geplant gewes… [+7009 chars]",,de,'Heizung'
https://www.stern.de/panorama/winterwetter--historischer-wintereinbruch--bombenzyklon-trifft-usa-37096440.html,https://www.stern.de/panorama/winterwetter--historischer-wintereinbruch--bombenzyklon-trifft-usa-37096440.html,0,www.stern.de,Winterwetter: Historischer Wintereinbruch: Bombenzyklon trifft USA,"Washington - Ein schwerer Wintersturm hat Schnee, Orkanböen, Sturmfluten und gefährliche Kälte in den Südosten der USA gebracht. Ein Tiefdruckgebiet vor",https://image.stern.de/37096442/t/3Z/v1/w1440/r1.7778/-/01--nktjh7g2a4v5axs2048jpeg---bf2751655913949f.jpg,2026-02-01T14:26:48Z,,"Kopiere den aktuellen Link
Zur Merkliste hinzufügen
Ein explosiv erstarkender Wintersturm zieht durch Teile der USA: Hunderttausende Haushalte sind ohne Strom, der Flugverkehr ist eingeschränkt.
E… [+2062 chars]",,de,'Kälte'
https://www.zeit.de/politik/deutschland/2026-02/gasspeicher-fuellstaende-gasversorgung-katherina-reiche,https://www.zeit.de/politik/deutschland/2026-02/gasspeicher-fuellstaende-gasversorgung-katherina-reiche,0,www.zeit.de,Gasspeicher: Katherina Reiche befürchtet keine Knappheit bei der Gasversorgung,In deutschen Gasspeichern sind die Füllstände auf 35 Prozent gesunken. Laut Bundeswirtschaftsministerin Katherina Reiche ist das aber kein Grund zur Beunruhigung.,https://img.zeit.de/politik/deutschland/2026-02/erdgas-speicher-reiche-bild/wide__1300x731,2026-02-01T14:28:59Z,,"Nach Einschätzung von Bundeswirtschaftsministerin
 Katherina Reiche (CDU) sind die relativ niedrigen Füllstände in deutschen 
Gasspeichern kein Grund zur Beunruhigung. Man beobachte die Lage 
tägl… [+830 chars]",,de,'Gas'
https://orf.at/stories/3418892/,https://orf.at/stories/3418892/,0,orf.at,USA wappnen sich für Eiseskälte,"Ein schwerer Wintersturm hat Schnee, Orkanböen, Sturmfluten und gefährliche Kälte in den Südosten der USA gebracht. Ein Tiefdruckgebiet vor der Küste entwickelte sich in der Nacht zum Sonntag nach Angaben des nationalen Wetterdienstes zu einem explosiv erstar…",https://ibs.orf.at/news?image=https%3A%2F%2Fassets.orf.at%2Fmims%2F2026%2F06%2F46%2Fcrops%2Fw%3D1200%2Ch%3D630%2Cq%3D75%2F2918338_master_1127946_usa_schneesturm_bombe_warnung_ap.jpg%3Fs%3Dd7e6aa718c9f9e223ebc693434813f1efab2240b,2026-02-01T16:52:37Z,,"Im US-Bundesstaat North Carolina fielen örtlich Schneemengen, die zu den höchsten seit Beginn der Aufzeichnungen zählen. An der Küste wurden bis Sonntagfrüh (Ortszeit) teils mehr als 25 Zentimeter ge… [+2709 chars]",,de,'Schnee'
https://www.faz.net/aktuell/gesellschaft/bombenzyklon-trifft-usa-north-carolina-versinkt-im-schnee-accg-200495220.html,https://www.faz.net/aktuell/gesellschaft/bombenzyklon-trifft-usa-north-carolina-versinkt-im-schnee-accg-200495220.html,0,www.faz.net,"Schnee, Orkanböen, Sturmfluten: Bombenzyklon trifft USA","Eine gefährliche Kältewelle erfasst den Süden der USA. In North Carolina fallen örtlich Schneemengen, die zu den höchsten seit Beginn der Aufzeichnungen zählen.",https://media0.faz.net/image/w1200h627/91131d3cd1e5/w4000h2090x0y169o/202602/43601.0.1725169934/streugut-ist-dieser-tage-in.webp,2026-02-01T17:03:26Z,,"Ein schwerer Wintersturm hat Schnee, Orkanböen, Sturmfluten und gefährliche Kälte in den Südosten der USA gebracht. Ein Tiefdruckgebiet vor der Küste entwickelte sich in der Nacht zum Sonntag nach An… [+1799 chars]",,de,'Schnee'
https://www.faz.net/aktuell/feuilleton/debatten/regisseurin-iryna-tsilyk-ueberleben-in-der-kaelte-in-kiew-110829127.html,https://www.faz.net/aktuell/feuilleton/debatten/regisseurin-iryna-tsilyk-ueberleben-in-der-kaelte-in-kiew-110829127.html,0,www.faz.net,Krieg gegen die Ukraine: Bis zum Frühling in Kiew leben?,"Russland erzielt keine großen Erfolge an der Front, daher attackiert es das ukrainische Volk und unsere Heizkraftwerke. Wie überlebt man bei minus 25 Grad ohne Heizung und Strom?",https://media0.faz.net/image/w1200h627/8c128048cd56/w3000h1567x0y216o/202601/43601.0.1707757346/ein-verpflegungswagen-der.webp,2026-02-01T20:30:01Z,,"In meinem Schlafzimmer hat es heute acht Grad. Nicht nur heute, sondern die vergangenen zwei Wochen. Was solls, das ist eine weitere Bewährungsprobe. Ich bin Kiewerin und habe schon die sowjetische K… [+281 chars]",,de,'Heizung'
https://www.zeit.de/news/2026-02/02/bundesweite-warnstreiks-im-oeffentlichen-nahverkehr-am-montag,https://www.zeit.de/news/2026-02/02/bundesweite-warnstreiks-im-oeffentlichen-nahverkehr-am-montag,0,www.zeit.de,Tarifstreit im ÖPNV: Bundesweite Warnstreiks im öffentlichen Nahverkehr am Montag,Hier finden Sie Informationen zu dem Thema „Tarifstreit im ÖPNV“. Lesen Sie jetzt „Bundesweite Warnstreiks im öffentlichen Nahverkehr am Montag“.,https://img.zeit.de/news/2026-02/02/bundesweite-warnstreiks-im-oeffentlichen-nahverkehr-am-montag-image-group/wide__1300x731,2026-02-02T03:30:04Z,,"Wegen eines bundesweiten Warnstreiks der Gewerkschaft Verdi kommt es heute vielerorts ganztägig zu erheblichen Einschränkungen im öffentlichen Nahverkehr (ÖPNV). Busse, Straßen- und U-Bahnen bleiben … [+2835 chars]",,de,'ÖPNV'
https://www.tagesspiegel.de/wirtschaft/tarifkonflikt-im-opnv-warnstreiks-im-nahverkehr-legen-deutschland-lahm-15207306.html,https://www.tagesspiegel.de/wirtschaft/tarifkonflikt-im-opnv-warnstreiks-im-nahverkehr-legen-deutschland-lahm-15207306.html,0,www.tagesspiegel.de,Tarifkonflikt im ÖPNV: Warnstreiks im Nahverkehr legen Deutschland lahm,Der Wochenanfang ist für Millionen Fahrgäste des Nahverkehrs diesmal eine besondere Herausforderung. Haltestellen werden nicht angefahren. Was Arbeitnehmer und Schüler nun beachten müssen.,https://www.tagesspiegel.de/images/15207646/alternates/BASE_16_9_W1400/1770016254000/verdi-warnstreiks-im-nahverkehr-nordrhein-westfalen.jpeg,2026-02-02T03:31:27Z,,"Der öffentliche Nahverkehr (ÖPNV) ist in großen Teilen Deutschlands durch einen Warnstreik zum Erliegen gekommen. Busse, Straßen- und U-Bahnen bleiben bei vielen kommunalen Verkehrsunternehmen infolg… [+3276 chars]",,de,'Schnee'
https://www.tagesspiegel.de/wirtschaft/tarifstreit-im-opnv-bundesweite-warnstreiks-im-offentlichen-nahverkehr-am-montag-15207306.html,https://www.tagesspiegel.de/wirtschaft/tarifstreit-im-opnv-bundesweite-warnstreiks-im-offentlichen-nahverkehr-am-montag-15207306.html,0,www.tagesspiegel.de,Tarifstreit im ÖPNV: Bundesweite Warnstreiks im öffentlichen Nahverkehr am Montag,"Busse und Bahnen bleiben zum Wochenbeginn vielerorts stehen. Was der bundesweite Warnstreik im Nahverkehr für Pendler, Eltern und Schüler bedeutet.",https://www.tagesspiegel.de/images/15207305/alternates/BASE_16_9_W1400/1770003087000/streiks-im-opnv.jpeg,2026-02-02T03:31:27Z,,"Wegen eines bundesweiten Warnstreiks der Gewerkschaft Verdi kommt es heute vielerorts ganztägig zu erheblichen Einschränkungen im öffentlichen Nahverkehr (ÖPNV). Busse, Straßen- und U-Bahnen bleiben … [+2885 chars]",,de,'ÖPNV'
https://www.tagesspiegel.de/wirtschaft/tarifkonflikt-im-opnv-nahverkehr-steht-bundesweit-wegen-warnstreiks-still-15207306.html,https://www.tagesspiegel.de/wirtschaft/tarifkonflikt-im-opnv-nahverkehr-steht-bundesweit-wegen-warnstreiks-still-15207306.html,0,www.tagesspiegel.de,Tarifkonflikt im ÖPNV: Nahverkehr steht bundesweit wegen Warnstreiks still,Bus und Bahn bleiben im Depot: Warnstreiks legen den Nahverkehr in Deutschland lahm. Das hat Auswirkungen auf den Verkehr. Pendler steigen unter anderem aufs Auto oder Taxi um.,https://www.tagesspiegel.de/images/15209655/alternates/BASE_16_9_W1400/1770040834000/verdi-warnstreiks-im-nahverkehr-brandenburg.jpeg,2026-02-02T03:31:27Z,,"Ein ganztägiger Warnstreik hat den öffentlichen Nahverkehr (ÖPNV) in vielen Regionen Deutschlands zum Erliegen gebracht. Busse, Straßenbahnen und U-Bahnen blieben bei zahlreichen kommunalen Betrieben… [+5081 chars]",,de,'ÖPNV'
https://www.tagesspiegel.de/wirtschaft/tarifkonflikt-im-opnv-millionen-fahrgaste-mussen-wegen-warnstreiks-improvisieren-15207306.html,https://www.tagesspiegel.de/wirtschaft/tarifkonflikt-im-opnv-millionen-fahrgaste-mussen-wegen-warnstreiks-improvisieren-15207306.html,0,www.tagesspiegel.de,Tarifkonflikt im ÖPNV: Millionen Fahrgäste müssen wegen Warnstreiks improvisieren,Stillstand bei Bus und Bahn: Warnstreiks legen den Nahverkehr in Deutschland lahm. Als einziges Bundesland fährt Niedersachsen - aus kuriosem Grund.,https://www.tagesspiegel.de/images/15208106/alternates/BASE_16_9_W1400/1770026081000/verdi-warnstreiks-im-nahverkehr-baden-wurttemberg.jpeg,2026-02-02T03:31:27Z,,"Der öffentliche Nahverkehr (ÖPNV) steht in großen Teilen Deutschlands durch einen ganztägigen Warnstreik still. Busse, Straßen- und U-Bahnen bleiben bei vielen kommunalen Verkehrsunternehmen infolge … [+3948 chars]",,de,'ÖPNV'
https://www.stern.de/gesellschaft/regional/niedersachsen-bremen/wetter--winterwetter-stellt-bauern-vor-unterschiedliche-aufgaben-37097166.html,https://www.stern.de/gesellschaft/regional/niedersachsen-bremen/wetter--winterwetter-stellt-bauern-vor-unterschiedliche-aufgaben-37097166.html,0,www.stern.de,Wetter: Winterwetter stellt Bauern vor unterschiedliche Aufgaben,"Für Pflanzenanbauer ist Schnee ein Segen, Tierhalter kämpfen mit steigenden Heizkosten. Wie Bauern in Niedersachsen den Winter unterschiedlich erleben.",https://image.stern.de/37097168/t/bO/v1/w1440/r1.7778/-/02--htyo55232cv4axs2048jpeg---382fd333de1ba5cd.jpg,2026-02-02T04:00:18Z,,"Kopiere den aktuellen Link
Zur Merkliste hinzufügen
Für Pflanzenanbauer ist Schnee ein Segen, Tierhalter kämpfen mit steigenden Heizkosten. Wie Bauern in Niedersachsen den Winter unterschiedlich er… [+1457 chars]",,de,'Schnee'
https://www.stern.de/gesellschaft/regional/berlin-brandenburg/ueberlebenskuenstler--wie-winterhart-wildtiere-sind-und-wo-gefahren-lauern-37097320.html,https://www.stern.de/gesellschaft/regional/berlin-brandenburg/ueberlebenskuenstler--wie-winterhart-wildtiere-sind-und-wo-gefahren-lauern-37097320.html,0,www.stern.de,Überlebenskünstler: Wie winterhart Wildtiere sind und wo Gefahren lauern,"Dauerfrost in Brandenburg: Wie kommen Tiere durch den Winter? Schnee und Eis können zur Belastung für Rehe, aber auch Fische und Vögel werden. Ein Schmetterling zeigt sich besonders winterhart.",https://image.stern.de/37097322/t/7O/v1/w1440/r1.7778/-/02--6bv4epggiwv9axs2048jpeg---30b6b0834c4f2981.jpg,2026-02-02T05:00:09Z,,"Kopiere den aktuellen Link
Zur Merkliste hinzufügen
Dauerfrost in Brandenburg: Wie kommen Tiere durch den Winter? Schnee und Eis können zur Belastung für Rehe, aber auch Fische und Vögel werden. Ei… [+4694 chars]",,de,'Schnee'
https://www.tagesspiegel.de/berlin/uberlebenskunstler-wie-winterhart-wildtiere-sind-und-wo-gefahren-lauern-15207453.html,https://www.tagesspiegel.de/berlin/uberlebenskunstler-wie-winterhart-wildtiere-sind-und-wo-gefahren-lauern-15207453.html,0,www.tagesspiegel.de,Überlebenskünstler: Wie winterhart Wildtiere sind und wo Gefahren lauern,"Dauerfrost in Brandenburg: Wie kommen Tiere durch den Winter? Schnee und Eis können zur Belastung für Rehe, aber auch Fische und Vögel werden. Ein Schmetterling zeigt sich besonders winterhart.",https://www.tagesspiegel.de/images/15207452/alternates/BASE_16_9_W1400/1770008514000/winterwetter.jpeg,2026-02-02T05:01:54Z,,Tiere im Winterstress? Fettpolster und Futtervorräte helfen Wildtieren bei der Eiseskälte. Doch minus 10 Grad können auch gut angepasste Arten an Grenzen bringen. Wie es geht Tieren in Brandenburg - … [+4535 chars],,de,'Schnee'
https://www.stern.de/gesellschaft/regional/nordrhein-westfalen/regen-und-schnee--glatte-strassen-am-warnstreiktag-in-nrw-37097370.html,https://www.stern.de/gesellschaft/regional/nordrhein-westfalen/regen-und-schnee--glatte-strassen-am-warnstreiktag-in-nrw-37097370.html,0,www.stern.de,Regen und Schnee: Glatte Straßen am Warnstreiktag in NRW,Am Warnstreiktag kann es in vielen Regionen in NRW erneut glatt werden. Gerade in den Höhenlagen ist vereinzelt noch mit Schnee zu rechnen. Die Aussichten.,https://image.stern.de/37097372/t/qw/v1/w1440/r1.7778/-/02--w3qmsdypunv7axs2048jpeg---3a3d16ec18a23b03.jpg,2026-02-02T05:19:46Z,,"Kopiere den aktuellen Link
Zur Merkliste hinzufügen
Am Warnstreiktag kann es in vielen Regionen in NRW erneut glatt werden. Gerade in den Höhenlagen ist vereinzelt noch mit Schnee zu rechnen. Die A… [+1400 chars]",,de,'Schnee'
https://www.zeit.de/news/2026-02/02/glatte-strassen-am-warnstreiktag-in-nrw,https://www.zeit.de/news/2026-02/02/glatte-strassen-am-warnstreiktag-in-nrw,0,www.zeit.de,Regen und Schnee: Glatte Straßen am Warnstreiktag in NRW,Hier finden Sie Informationen zu dem Thema „Regen und Schnee“. Lesen Sie jetzt „Glatte Straßen am Warnstreiktag in NRW“.,https://img.zeit.de/news/2026-02/02/glatte-strassen-am-warnstreiktag-in-nrw-image-group/wide__1300x731,2026-02-02T05:19:46Z,,Am Morgen des Warnstreiks kann es auf den Straßen in Nordrhein-Westfalen weiterhin glatt werden. Dies teilt der Deutsche Wetterdienst (DWD) mit. Vor allem im Norden und Nordosten ist bis in den Vormi… [+1229 chars],,de,'Schnee'
https://vorarlberg.orf.at/stories/3340203/,https://vorarlberg.orf.at/stories/3340203/,0,vorarlberg.orf.at,Luftgüte leidet unter Öl- und Gasheizungen,"Das Jahr 2026 hat kalt begonnen. Schnee und frostige Temperaturen haben dazu geführt, dass in ganz Vorarlberg ordentlich geheizt werden musste. In vielen Fällen wird immer noch mit Öl oder Gas geheizt. Darunter leidet die Luftgüte, wie die Messwerte im Jänner…",https://ibs.orf.at/vbg?image=https%3A%2F%2Foekastatic.orf.at%2Fmims%2F2021%2F48%2F07%2Fcrops%2Fw%3D1200%2Ch%3D627%2Cq%3D75%2F1152693_master_410507_umstieg_von_oelheizung_211122_poechhacker_15315.mxf_00_19_26_09.jpg%3Fs%3D1b302da4fb3f8db120362a70f70764913cc6d39a,2026-02-02T05:39:26Z,,Die Belastung durch Feinstaub und Stickstoffdioxid war heuer im Jänner deutlich höher als in den Jahren zuvor. So fasst Luftgütespezialist Bernhard Anwander vom Umweltinstitut die Werte zusammen. Gre… [+1078 chars],,de,'Schnee'
https://www.stern.de/gesellschaft/regional/rheinland-pfalz-saarland/rheinland-pfalz-und-saarland--schnee-und-glaette-am-warnstreiktag-erwartet-37097432.html,https://www.stern.de/gesellschaft/regional/rheinland-pfalz-saarland/rheinland-pfalz-und-saarland--schnee-und-glaette-am-warnstreiktag-erwartet-37097432.html,0,www.stern.de,Rheinland-Pfalz und Saarland: Schnee und Glätte am Warnstreiktag erwartet,Vor allem in den Höhenlagen im Rheinland-Pfalz und dem Saarland kann es am Montag weiterhin glatt werden. Teilweise ist auch mit Schnee zu rechnen. Die Aussichten für den Warnstreiktag.,https://image.stern.de/37097434/t/cL/v1/w1440/r1.7778/-/02--mk6q5hjg5ov3axs2048jpeg---8752d8515f7ac92e.jpg,2026-02-02T05:57:24Z,,"Kopiere den aktuellen Link
Zur Merkliste hinzufügen
Vor allem in den Höhenlagen im Rheinland-Pfalz und dem Saarland kann es am Montag weiterhin glatt werden. Teilweise ist auch mit Schnee zu rechne… [+1055 chars]",,de,'Schnee'
https://www.zeit.de/news/2026-02/02/schnee-und-glaette-am-warnstreiktag-erwartet,https://www.zeit.de/news/2026-02/02/schnee-und-glaette-am-warnstreiktag-erwartet,0,www.zeit.de,Rheinland-Pfalz und Saarland: Schnee und Glätte am Warnstreiktag erwartet,Hier finden Sie Informationen zu dem Thema „Rheinland-Pfalz und Saarland“. Lesen Sie jetzt „Schnee und Glätte am Warnstreiktag erwartet“.,https://img.zeit.de/news/2026-02/02/schnee-und-glaette-am-warnstreiktag-erwartet-image-group/wide__1300x731,2026-02-02T05:57:24Z,,"In Rheinland-Pfalz und im Saarland kann es am Morgen des Warnstreiktags im öffentlichen Nahverkehr auf den Straßen glatt und verschneit werden. Wie der Deutsche Wetterdienst (DWD) mitteilte, ist vor … [+854 chars]",,de,'Schnee'
https://www.welt.de/politik/deutschland/video69804f6bfa531953d5218ae2/fdp-generalsekretaerin-was-die-regierung-abliefert-ist-absolut-beschaemend.html,https://www.welt.de/politik/deutschland/video69804f6bfa531953d5218ae2/fdp-generalsekretaerin-was-die-regierung-abliefert-ist-absolut-beschaemend.html,0,www.welt.de,"„Was die Regierung hier abliefert, ist absolut beschämend“",FDP-Generalsekretärin Nicole Büttner kritisiert die Bundesregierung für fehlende Reformen und mangelnde Prioritäten bei Infrastruktur und Wirtschaft. Sie fordert klare Entscheidungen und eine Reform des Streikrechts im ÖPNV.,https://images.welt.de/69804f6bfa531953d5218ae2/b8b1183ed6620bfadc4e9e6452fa08cd/ci16x9-w1200/dscf8409-jpeg,2026-02-02T07:33:05Z,,Die WELT als ePaper: Die vollständige Ausgabe steht Ihnen bereits am Vorabend zur Verfügung so sind Sie immer hochaktuell informiert. Weitere Informationen https://epaper.welt.de,,de,'ÖPNV'
https://www.perlentaucher.de/9punkt/2026-02-02.html,https://www.perlentaucher.de/9punkt/2026-02-02.html,0,www.perlentaucher.de,9PUNKT - DIE DEBATTENRUNDSCHAU: Gewaltige Luxusimmobilien,"Minus 20 Grad in Kiew, und keine Heizung, kein Strom, kein Wasser. Gegen wen führt Putin eigentlich seinen Krieg, fragt die Schriftstellerin  Iryna Tsilyk in der FAZ. Trocknet die Finanzströme des Terrors aus, ruft Navid Kermani in der SZ - mit Blick auf den …",https://www.perlentaucher.de/static/img/perlentaucher-logo-512x.png,2026-02-02T08:00:00Z,,"Man kann sich nicht helfen - Iryna Tsilyks Brief an die FAZ aus dem frierenden Kiew liest sich für jeden behaglich beheizten Westeuropäer beschämend. Minus 20 Grad müssen die Ukrainer aushalten, ohne… [+3793 chars]",,de,'Heizung'
https://www.welt.de/politik/deutschland/video698062fd78c88161f9da4202/verdi-verhandlungsfuehrer-es-liegt-in-der-hand-der-arbeitgeberseite.html,https://www.welt.de/politik/deutschland/video698062fd78c88161f9da4202/verdi-verhandlungsfuehrer-es-liegt-in-der-hand-der-arbeitgeberseite.html,0,www.welt.de,„Es liegt in der Hand der Arbeitgeberseite“,"Im Tarifkonflikt beim ÖPNV fordern Beschäftigte Verbesserungen bei Arbeitsbedingungen wie Ruhezeiten und Schichtlängen. Die Arbeitgeberseite bleibt bislang hart. „Wir sind verhandlungsbereit und warten“, sagt Verdi-Verhandlungsführer Serat Canyurt.",https://images.welt.de/698062fd78c88161f9da4202/82d8369a610f112faee3bef171151acc/ci16x9-w1200/dpa-com-20090101-260202-911-004051-jpg,2026-02-02T09:43:21Z,,Im Tarifkonflikt beim ÖPNV fordern Beschäftigte Verbesserungen bei Arbeitsbedingungen wie Ruhezeiten und Schichtlängen. Die Arbeitgeberseite bleibt bislang hart. Wir sind verhandlungsbereit und warte… [+106 chars],,de,'ÖPNV'
