index,url,valid,domain,title,description,image,published,archive,content,quote,language,keyword
https://tirol.orf.at/stories/3304600/,https://tirol.orf.at/stories/3304600/,0,tirol.orf.at,Schafrisse im Ötztal – Hinweise auf Bär,"In einem Almgebiet der Ötztaler Gemeinde Umhausen sind am Donnerstag Bärenspuren im Schnee entdeckt worden, zudem wurden zwei tote Schafe und zwei tote Lämmer entdeckt. Der Amtstierarzt ging von Rissen durch einen Bären aus. Erst in der Vorwoche war ein Bär a…",https://ibs.orf.at/tir?image=https%3A%2F%2Foekastatic.orf.at%2Fmims%2F2025%2F19%2F56%2Fcrops%2Fw%3D1200%2Ch%3D627%2Cq%3D75%2F2618078_master_1005356_baer2.jpg%3Fs%3D8ccec853f5f6b5dc939cb83a320180c790f45e5d,2025-05-08T18:00:36Z,https://web.archive.org/web/20250508231731/https://tirol.orf.at/stories/3304600/,"Wie das Land Tirol in einer Aussendung mitteilte, gehe man jedenfalls von einer Bärenpräsenz im Gemeindegebiet von Umhausen aus. Die Gemeinde hatte die Bevölkerung bereits informiert. Demnach entdeck… [+1177 chars]",,de,'Schnee'
https://www.stern.de/panorama/niedersachsen-und-bremen--abenteuer-fuer-einen-guten-zweck--tag-und-nacht-auf-der-weser-35707670.html,https://www.stern.de/panorama/niedersachsen-und-bremen--abenteuer-fuer-einen-guten-zweck--tag-und-nacht-auf-der-weser-35707670.html,0,www.stern.de,Niedersachsen und Bremen: Abenteuer für einen guten Zweck: Tag und Nacht auf der Weser,"431 Kilometer Tag und Nacht auf einem SUP - vier Männer wollen trotz Wind, Kälte und Schlafmangel weiterpaddeln. Sie möchten ein Abenteuer und dabei etwas Gutes tun.",https://image.stern.de/35707672/t/Tj/v1/w1440/r1.7778/-/09--ydomhklu2cv12axs2048jpeg---b997da7f727f02e2.jpg,2025-05-09T03:00:50Z,https://web.archive.org/web/20250509060959/https://www.stern.de/panorama/niedersachsen-und-bremen--abenteuer-fuer-einen-guten-zweck--tag-und-nacht-auf-der-weser-35707670.html,"Kopiere den aktuellen Link
Zur Merkliste hinzufügen
431 Kilometer Tag und Nacht auf einem SUP - vier Männer wollen trotz Wind, Kälte und Schlafmangel weiterpaddeln. Sie möchten ein Abenteuer und da… [+2142 chars]",,de,'Kälte'
https://www.tagesspiegel.de/gesellschaft/panorama/niedersachsen-und-bremen-abenteuer-fur-einen-guten-zweck-tag-und-nacht-auf-der-weser-13662517.html,https://www.tagesspiegel.de/gesellschaft/panorama/niedersachsen-und-bremen-abenteuer-fur-einen-guten-zweck-tag-und-nacht-auf-der-weser-13662517.html,0,www.tagesspiegel.de,Niedersachsen und Bremen: Abenteuer für einen guten Zweck: Tag und Nacht auf der Weser,"431 Kilometer Tag und Nacht auf einem SUP - vier Männer wollen trotz Wind, Kälte und Schlafmangel weiterpaddeln. Sie möchten ein Abenteuer und dabei etwas Gutes tun.",https://www.tagesspiegel.de/images/13662514/alternates/BASE_16_9_W1400/1746759761000/stand-up-paddler-wollen-weser-auf-rund-430-km-nonstop-befahren.jpeg,2025-05-09T03:02:42Z,https://web.archive.org/web/20250511001001/https://www.tagesspiegel.de/gesellschaft/panorama/niedersachsen-und-bremen-abenteuer-fur-einen-guten-zweck-tag-und-nacht-auf-der-weser-13662517.html,Auf einem mehr als fünf Meter langen Board wollen vier Männer auf der Weser von Hann. Münden im Landkreis Göttingen bis nach Bremerhaven paddeln. Die Strecke von 431 Kilometern will das Team mit dem … [+2676 chars],,de,'Kälte'
https://www.welt.de/politik/deutschland/article256091092/Neue-Bundesregierung-Dobrindt-verteidigt-Zurueckweisungen-an-den-Grenzen-EU-Kommission-mahnt-Deutschland-Liveticker.html,https://www.welt.de/politik/deutschland/article256091092/Neue-Bundesregierung-Dobrindt-verteidigt-Zurueckweisungen-an-den-Grenzen-EU-Kommission-mahnt-Deutschland-Liveticker.html,0,www.welt.de,Dobrindt verteidigt Zurückweisungen an den Grenzen – EU-Kommission mahnt Deutschland,Friedrich Merz hat angesichts der Migration eine „nationale Notlage“ ausgerufen – und dafür Beifall von der CSU bekommen. Die Grünen halten die Zurückweisungen an den Grenzen für rechtswidrig und EU-schödigend. Der neuen Außenminister betont die Absprachen mi…,https://img.welt.de/img/politik/deutschland/mobile256091120/2397931527-ci16x9-w1200/Bundesinnenminister-zur-Situation-an-den-Grenzen.jpg,2025-05-09T05:29:00Z,http://archive.md/20250509065045/https://www.welt.de/politik/deutschland/article256091092/Neue-Bundesregierung-Dobrindt-verteidigt-Zurueckweisungen-an-den-Grenzen-EU-Kommission-mahnt-Deutschland-Liveticker.html,Die Debatte über Zurückweisungen an den deutschen Außengrenzen ist in vollem Gange. In einer ZDF-Sendung äußert sich Innenminister Dobrindt. Die EU-Kommission mahnt Deutschland zu enger Abstimmung. ,,,
https://www.zeit.de/news/2025-05/09/reiche-kuendigt-neue-gaskraftwerke-fuer-deutschland-an,https://www.zeit.de/news/2025-05/09/reiche-kuendigt-neue-gaskraftwerke-fuer-deutschland-an,0,www.zeit.de,Bundeswirtschaftsministerin: Reiche kündigt neue Gaskraftwerke für Deutschland an,Hier finden Sie Informationen zu dem Thema „Bundeswirtschaftsministerin“. Lesen Sie jetzt „Reiche kündigt neue Gaskraftwerke für Deutschland an“.,https://img.zeit.de/news/2025-05/09/reiche-kuendigt-neue-gaskraftwerke-fuer-deutschland-an-image-group/wide__1300x731,2025-05-09T08:47:39Z,,"Bundeswirtschaftsministerin Katherina Reiche fordert den schnellen Zubau von neuen Gaskraftwerken in Deutschland. «Wir brauchen flexible Gaskraftwerke, die dann Strom liefern, wenn der Wind nicht weh… [+2746 chars]",,de,'Wind'
https://www.faz.net/aktuell/wirtschaft/klima-nachhaltigkeit/katherina-reiche-will-schnell-neue-gaskraftwerke-110466034.html,https://www.faz.net/aktuell/wirtschaft/klima-nachhaltigkeit/katherina-reiche-will-schnell-neue-gaskraftwerke-110466034.html,0,www.faz.net,Reiche will schnell neue Gaskraftwerke,Bei ihrem ersten größeren Auftritt betont die neue Bundeswirtschaftsministerin die Bedeutung von Gas. Sie wolle sich „ehrlich machen“ zum Stand der Energiewende.,https://media0.faz.net/ppmedia/aktuell/politik/3178300444/1.10466050/facebook_teaser/wirtschaftsministerin.jpg,2025-05-09T09:47:51Z,,"Bundeswirtschaftsministerin Katherina Reiche fordert den schnellen Zubau von neuen Gaskraftwerken in Deutschland. Wir brauchen flexible Gaskraftwerke, die dann Strom liefern, wenn der Wind nicht weht… [+2564 chars]",,de,'Gas'
https://www.n-tv.de/politik/Reiche-will-bei-neuen-Gaskraftwerken-Tempo-machen-article25756993.html,https://www.n-tv.de/politik/Reiche-will-bei-neuen-Gaskraftwerken-Tempo-machen-article25756993.html,0,www.n-tv.de,"""Ganz schnell in Ausschreibung"": Reiche will bei neuen Gaskraftwerken Tempo machen","Die neue Wirtschaftsministerin sieht im Stromausfall auf der iberischen Halbinsel einen Warnschuss. Dieser zeige, wie wichtig Gaskraftwerke seien, die Strom liefern, wenn bei Wind und Sonne Flaute herrscht. Bei der Energiewende müsse man sich ehrlich machen.",https://www.n-tv.de/img/incoming/crop25757034/9511327093-cImg_16_9-w1200/16038034720eb1b1703a81263f864b02.jpg,2025-05-09T10:18:19Z,https://web.archive.org/web/20250509110719/https://www.n-tv.de/politik/Reiche-will-bei-neuen-Gaskraftwerken-Tempo-machen-article25756993.html,"Die neue Wirtschaftsministerin sieht im Stromausfall auf der iberischen Halbinsel einen Warnschuss. Dieser zeige, wie wichtig Gaskraftwerke seien, die Strom liefern, wenn bei Wind und Sonne Flaute he… [+3110 chars]",,de,'Wind'
"https://www.gamestar.de/artikel/spotify-neue-funktion-mond-halbmond-icon-button,3432663.html","https://www.gamestar.de/artikel/spotify-neue-funktion-mond-halbmond-icon-button,3432663.html",0,www.gamestar.de,News: Spotify - Der Streamingdienst bekommt wohl einen neuen Button – und der bringt frischen Wind in eure Playlists,"Auf Spotify seht ihr bald einen Halbmond. Was der bedeutet, erfahrt ihr hier.",https://images.cgames.de/images/gamestar/293/spotify-mond-teaser_6353103.jpg,2025-05-09T11:00:00Z,"https://web.archive.org/web/20250509112830/https://www.gamestar.de/artikel/spotify-neue-funktion-mond-halbmond-icon-button,3432663.html","Das Mond-Symbol dürfte euch bald auf Spotify auffallen hier erfahrt ihr, wofür der steht. (Symbol: Solayman, Adobe Stock
Auf Spotify gibt es über 100.000.000 Songs, aber ihr hört immer wieder diesel… [+2122 chars]",,de,'Wind'
https://www.stern.de/gesellschaft/regional/bayern/baerenverdacht--schafrisse-und-spuren-im-schnee--baer-in-tirol-vermutet-35709294.html,https://www.stern.de/gesellschaft/regional/bayern/baerenverdacht--schafrisse-und-spuren-im-schnee--baer-in-tirol-vermutet-35709294.html,0,www.stern.de,Bärenverdacht: Schafrisse und Spuren im Schnee: Bär in Tirol vermutet,Einmal mehr scheint ein Bär im österreichischen Ötztal nicht allzu weit von der bayerischen Grenze unterwegs zu sein. Darauf lassen gerissene Tiere und Spuren schließen.,https://image.stern.de/35709296/t/Ns/v1/w1440/r1.7778/-/09--6je5cbuldlv1axs2048jpeg---33ac04b897928319.jpg,2025-05-09T11:11:12Z,https://web.archive.org/web/20250509115210/https://www.stern.de/gesellschaft/regional/bayern/baerenverdacht--schafrisse-und-spuren-im-schnee--baer-in-tirol-vermutet-35709294.html,"Kopiere den aktuellen Link
Zur Merkliste hinzufügen
Einmal mehr scheint ein Bär im österreichischen Ötztal nicht allzu weit von der bayerischen Grenze unterwegs zu sein. Darauf lassen gerissene Tie… [+1931 chars]",,de,'Schnee'
https://www.zeit.de/news/2025-05/09/schafrisse-und-spuren-im-schnee-baer-in-tirol-vermutet,https://www.zeit.de/news/2025-05/09/schafrisse-und-spuren-im-schnee-baer-in-tirol-vermutet,0,www.zeit.de,Bärenverdacht: Schafrisse und Spuren im Schnee: Bär in Tirol vermutet,Hier finden Sie Informationen zu dem Thema „Bärenverdacht“. Lesen Sie jetzt „Schafrisse und Spuren im Schnee: Bär in Tirol vermutet“.,https://img.zeit.de/news/2025-05/09/schafrisse-und-spuren-im-schnee-baer-in-tirol-vermutet-image-group/wide__1300x731,2025-05-09T11:11:12Z,https://web.archive.org/web/20250511000312/https://www.zeit.de/news/2025-05/09/schafrisse-und-spuren-im-schnee-baer-in-tirol-vermutet,"In einem Almgebiet bei der Gemeinde Umhausen in Tirol, rund 60 Kilometer von der bayerischen Grenze entfernt, sind Bärenspuren im Schnee entdeckt worden. Außerdem wurden zwei tote Schafe sowie zwei t… [+1745 chars]",,de,'Schnee'
https://www.welt.de/politik/deutschland/article256091092/Neue-Bundesregierung-Es-gibt-hier-keinen-deutschen-Alleingang-sagt-Merz-zu-den-Grenzkontrollen-Liveticker.html,https://www.welt.de/politik/deutschland/article256091092/Neue-Bundesregierung-Es-gibt-hier-keinen-deutschen-Alleingang-sagt-Merz-zu-den-Grenzkontrollen-Liveticker.html,0,www.welt.de,"„Es gibt hier keinen deutschen Alleingang“, sagt Merz zu den Grenzkontrollen",Bundeskanzler Friedrich Merz verteidigt das deutsche Vorgehen an der Grenze. Beim Thema „nationale Notlage“ spricht er von „Irritationen“. Wirtschaftsministerin Reiche umreißt indes ihren Plan für die deutsche Wirtschaft. Alle Entwicklungen im Liveticker.,https://img.welt.de/img/politik/deutschland/mobile256094282/9857939977-ci16x9-w1200/New-German-Chancellor-Friedrich-Merz-Meets-With-EU-And-Nato-Leaders-In-Brussels.jpg,2025-05-09T12:43:00Z,https://web.archive.org/web/20250509130813/https://www.welt.de/politik/deutschland/article256091092/Neue-Bundesregierung-Es-gibt-hier-keinen-deutschen-Alleingang-sagt-Merz-zu-den-Grenzkontrollen-Liveticker.html,Bundeskanzler Friedrich Merz verteidigt das deutsche Vorgehen an der Grenze. Beim Thema nationale Notlage spricht er von Irritationen. Wirtschaftsministerin Reiche umreißt indes ihren Plan für die de… [+10460 chars],,de,'Not'
https://www.diepresse.com/19663097/laender-mit-einem-hohen-anteil-an-erneuerbaren-werden-sich-wirtschaftlich-besser-entwickeln,https://www.diepresse.com/19663097/laender-mit-einem-hohen-anteil-an-erneuerbaren-werden-sich-wirtschaftlich-besser-entwickeln,0,www.diepresse.com,„Länder mit einem hohen Anteil an Erneuerbaren werden sich wirtschaftlich besser entwickeln“,"Die Vorstände der Energie Steiermark, Martin Graf und Werner Ressi, sprechen über den spanischen Blackout, die Rückkehr des russischen Gases und fordern eine gerechtere Aufteilung der Netzkosten.",https://img.diepresse.com/public/incoming/edconc-kein-Titel/alternates/DPR_SOCIAL_MAGAZIN/kein%20Titel,2025-05-09T12:47:33Z,,"Die Vorstände der Energie Steiermark, Martin Graf und Werner Ressi, sprechen über den spanischen Blackout, die Rückkehr des russischen Gases und fordern eine gerechtere Aufteilung der Netzkosten.
Di… [+6169 chars]",,de,'Wind'
https://www.abendblatt.de/podcast/article408970888/vier-flaschen-spargel-und-wein-mit-heinz-wehmann-vom-landhaus-scherrer.html,https://www.abendblatt.de/podcast/article408970888/vier-flaschen-spargel-und-wein-mit-heinz-wehmann-vom-landhaus-scherrer.html,0,www.abendblatt.de,Vier Flaschen: Spargel und Wein mit Heinz Wehmann vom Landhaus Scherrer,"Welcher Wein zu welchem Spargelgericht? Und wie bereitet man Spargel richtig zu? Sterne-Koch Heinz Wehmann vom Landhaus Scherrer bringt uns ein kleines Spargelmenü mit und wir erleben, was “gutes Pairing“ bedeutet und wie das Essen den Wein am Gaumen noch bes…",,2025-05-09T14:00:00Z,https://web.archive.org/web/20250509140614/https://www.abendblatt.de/podcast/article408970888/vier-flaschen-spargel-und-wein-mit-heinz-wehmann-vom-landhaus-scherrer.html,"Welcher Wein zu welchem Spargelgericht? Und wie bereitet man Spargel richtig zu? Sterne-Koch Heinz Wehmann vom Landhaus Scherrer bringt uns ein kleines Spargelmenü mit und wir erleben, was gutes Pair… [+992 chars]",,de,'Wein'
https://www.tagesspiegel.de/kultur/funf-spielfilmtipps-zum-wochenende-die-schone-agentin-und-der-schuchterne-taucher-13646266.html,https://www.tagesspiegel.de/kultur/funf-spielfilmtipps-zum-wochenende-die-schone-agentin-und-der-schuchterne-taucher-13646266.html,0,www.tagesspiegel.de,Fünf Spielfilmtipps zum Wochenende: Die schöne Agentin und der schüchterne Taucher,"Die Faszination der Tiefseefilme zieht immer, genauso wie Superhelden und Nicole Kidman, auch wenn man die Schauspielerin in „The Hours“ kaum wieder erkennt.",https://www.tagesspiegel.de/images/13646641/alternates/BASE_16_9_W1400/1746529831000/im-rausch-der-tiefe.jpeg,2025-05-09T16:22:51Z,https://web.archive.org/web/20250509165814/http://www.tagesspiegel.de/kultur/funf-spielfilmtipps-zum-wochenende-die-schone-agentin-und-der-schuchterne-taucher-13646266.html,Nur zwei Free-TV-Premieren an diesem Wochenende mit Black Adam und Dwayne Johnson sowie der grandiosen Schauspielerin Ísold Halldórudóttir in ihrem Filmdebüt Touched. Der spektakulärste Film läuft am… [+9152 chars],,de,'Schnee'
https://www.welt.de/politik/deutschland/article256091092/Neue-Bundesregierung-Bau-neuer-Gaskraftwerke-Gruene-warnen-Reiche-vor-Erpressbarkeiten-Liveticker.html,https://www.welt.de/politik/deutschland/article256091092/Neue-Bundesregierung-Bau-neuer-Gaskraftwerke-Gruene-warnen-Reiche-vor-Erpressbarkeiten-Liveticker.html,0,www.welt.de,Bau neuer Gaskraftwerke – Grüne warnen Reiche vor „Erpressbarkeiten“,"Die neue Arbeitsministerin fordert, dass auch Beamte in die gesetzliche Rente einzahlen sollen. Unterdessen hat Außenminister Johann Wadephul mit seinem Amtskollegen in Washington telefoniert. Das Gespräch lief offenbar gut. Alle Entwicklungen im Liveticker.",https://img.welt.de/img/politik/deutschland/mobile256097430/1487930417-ci16x9-w1200/Ludwig-Erhard-Gipfel.jpg,2025-05-10T08:30:00Z,https://web.archive.org/web/20250510090709/https://www.welt.de/politik/deutschland/article256091092/Neue-Bundesregierung-Bau-neuer-Gaskraftwerke-Gruene-warnen-Reiche-vor-Erpressbarkeiten-Liveticker.html,Eine seiner ersten Reisen als Bundeskanzler verschlägt Friedrich Merz mit Emmanuel Macron und Keir Starmer nach Kiew. Die Grünen antworten Wirtschaftsministerin Reiche auf ihre Energiepläne. Alle Ent… [+21761 chars],,de,'Wind'
https://www.zeit.de/news/2025-05/10/mv-minister-blank-energiewende-wirtschaftlich-und-sozial,https://www.zeit.de/news/2025-05/10/mv-minister-blank-energiewende-wirtschaftlich-und-sozial,0,www.zeit.de,Windkraft-Ausbau: MV-Minister Blank: Energiewende wirtschaftlich und sozial,Hier finden Sie Informationen zu dem Thema „Windkraft-Ausbau“. Lesen Sie jetzt „MV-Minister Blank: Energiewende wirtschaftlich und sozial“.,https://img.zeit.de/news/2025-05/10/mv-minister-blank-energiewende-wirtschaftlich-und-sozial-image-group/wide__1300x731,2025-05-10T09:49:22Z,,"Als Vorsitzender der Energieministerkonferenz in diesem Jahr sieht sich Mecklenburg-Vorpommerns Ressortchef Wolfgang Blank (parteilos) besonders in der Pflicht, den Ausbau der erneuerbaren Energien i… [+4190 chars]",,de,'Wind'
https://www.stern.de/gesellschaft/regional/mecklenburg-vorpommern/windkraft-ausbau--mv-minister-blank--energiewende-wirtschaftlich-und-sozial-35711558.html,https://www.stern.de/gesellschaft/regional/mecklenburg-vorpommern/windkraft-ausbau--mv-minister-blank--energiewende-wirtschaftlich-und-sozial-35711558.html,0,www.stern.de,Windkraft-Ausbau: MV-Minister Blank: Energiewende wirtschaftlich und sozial,Im Norden drehen sich besonders viele Windräder. Doch der regionale Nutzen der Ökostrom-Produktion ist nach Ansicht von Mecklenburg-Vorpommerns Energieminister Blank noch zu gering.,https://image.stern.de/35711560/t/uz/v1/w1440/r1.7778/-/10--ievu2tyejtv32axs2048jpeg---a398aadd641542f7.jpg,2025-05-10T09:49:22Z,https://web.archive.org/web/20250510105008/https://www.stern.de/gesellschaft/regional/mecklenburg-vorpommern/windkraft-ausbau--mv-minister-blank--energiewende-wirtschaftlich-und-sozial-35711558.html,"Kopiere den aktuellen Link
Zur Merkliste hinzufügen
Im Norden drehen sich besonders viele Windräder. Doch der regionale Nutzen der Ökostrom-Produktion ist nach Ansicht von Mecklenburg-Vorpommerns E… [+4391 chars]",,de,'Wind'
https://www.welt.de/geschichte/article256009024/Stadion-Katastrophe-1985-Zwei-Maenner-blieben-einfach-sitzen-und-verbrannten.html,https://www.welt.de/geschichte/article256009024/Stadion-Katastrophe-1985-Zwei-Maenner-blieben-einfach-sitzen-und-verbrannten.html,0,www.welt.de,„Zwei Männer blieben einfach sitzen und verbrannten“,"An sich hatte das Spiel in der dritten englischen Liga am 11. Mai 1985 keine Bedeutung, denn Gastgeber Bradford City war bereits aufgestiegen. Trotzdem saßen 12.000 Menschen im Stadion. Plötzlich geriet die älteste der Tribünen in Brand. Binnen Minuten starbe…",https://img.welt.de/img/geschichte/mobile256010150/8707934537-ci16x9-w1200/Fussball-Die-abgebrannte-Tribuene-in-Bradford-1985.jpg,2025-05-11T05:32:38Z,https://web.archive.org/web/20250512012808/https://www.welt.de/geschichte/article256009024/Stadion-Katastrophe-1985-Zwei-Maenner-blieben-einfach-sitzen-und-verbrannten.html,"An sich hatte das Spiel in der dritten englischen Liga am 11. Mai 1985 keine Bedeutung, denn Gastgeber Bradford City war bereits aufgestiegen. Trotzdem saßen 12.000 Menschen im Stadion. Plötzlich ger… [+7433 chars]",,de,'Wind'
https://www.kino.de/news/bridgerton-fans-aufgepasst-neue-serie-ab-sofort-auf-netflix-und-die-verspricht-jede-menge-royalen-spass/,https://www.kino.de/news/bridgerton-fans-aufgepasst-neue-serie-ab-sofort-auf-netflix-und-die-verspricht-jede-menge-royalen-spass/,0,www.kino.de,„Bridgerton“-Fans aufgepasst: Neue Serie ab sofort auf Netflix – und die verspricht jede Menge royalen Spaß,"Party-Thronerbe trifft auf selbstbewusste Unternehmerin, um sein bröckliges Königreich zu retten – diese Serie bringt frischen Wind in die royale Serienwelt.",https://crops.giga.de/b6/40/65/24fe0a632f9dd1f26a6f860c3f_YyAxODk1eDk5MCsxMysxMwJyZSAxMjAwIDYyNwNiMDJlNmZkMjY2Mw==.jpg,2025-05-11T06:33:29Z,,"Party-Thronerbe trifft auf selbstbewusste Unternehmerin, um sein bröckliges Königreich zu retten – diese Serie bringt frischen Wind in die royale Serienwelt.
Opulente Kulissen, prickelnde Romanze un… [+3645 chars]",,de,'Wind'
https://taz.de/Militarisierung-der-Polizei/!6084187/,https://taz.de/Militarisierung-der-Polizei/!6084187/,0,taz.de,Militarisierung der Polizei: Es weht ein bayerischer Wind,"CSU-Innenminister Alexander Dobrindt steht für Law and Order. Das passt zu einem Trend, der Polizeibeamten immer mehr Befugnisse gibt.",https://taz.de/picture/7686235/1200/38287064-1.jpeg,2025-05-11T10:02:00Z,https://web.archive.org/web/20250511182417/https://taz.de/Militarisierung-der-Polizei/!6084187/,"CSU-Innenminister Alexander Dobrindt steht für Law and Order. Das passt zu einem Trend, der Polizeibeamten immer mehr Befugnisse gibt. mehr...",,de,'Wind'
https://www.stern.de/gesellschaft/regional/niedersachsen-bremen/auf-der-weser--431-kilometer-fuer-den-guten-zweck-gepaddelt-35713702.html,https://www.stern.de/gesellschaft/regional/niedersachsen-bremen/auf-der-weser--431-kilometer-fuer-den-guten-zweck-gepaddelt-35713702.html,0,www.stern.de,Auf der Weser: 431 Kilometer für den guten Zweck gepaddelt,"Schier endlos paddeln auf einem Board, die gesamte Weser entlang, bis zur Nordsee: Vier Männer haben trotz Wind, Kälte und Schlafmangel ihr Ziel erreicht - und dabei etwas Gutes getan.",https://image.stern.de/35713704/t/MK/v1/w1440/r1.7778/-/11--7hyyxdzoecv3axs2048jpeg---e8d0732fab5480e8.jpg,2025-05-11T15:40:09Z,,"Kopiere den aktuellen Link
Zur Merkliste hinzufügen
Schier endlos paddeln auf einem Board, die gesamte Weser entlang, bis zur Nordsee: Vier Männer haben trotz Wind, Kälte und Schlafmangel ihr Ziel … [+1386 chars]",,de,'Kälte'
https://www.tagesspiegel.de/wissen/kalte-nach-dem-sport-gut-fur-die-muskeln-aber-wirkt-die-eistonne-auch-bei-frauen-13676038.html,https://www.tagesspiegel.de/wissen/kalte-nach-dem-sport-gut-fur-die-muskeln-aber-wirkt-die-eistonne-auch-bei-frauen-13676038.html,0,www.tagesspiegel.de,Kälte nach dem Sport gut für die Muskeln: Aber wirkt die Eistonne auch bei Frauen?,"Studien zeigen, dass ein eiskaltes Bad nach dem Sport hilft, schnell wieder fit zu werden. Doch jetzt hat eine Untersuchung ergaben, dass das nicht für alle Menschen zutrifft.",https://www.tagesspiegel.de/images/13676731/alternates/BASE_16_9_W1400/1747045397000/eis012-russia-winter-swimming-8155916-02-04-2022-lovers-of-winter-swimming-close-the-bathing-season-in-the-icy-water-of-the-lak.jpeg,2025-05-12T12:41:16Z,https://web.archive.org/web/20250512152435/https://www.tagesspiegel.de/wissen/kalte-nach-dem-sport-gut-fur-die-muskeln-aber-wirkt-die-eistonne-auch-bei-frauen-13676038.html,Nach dem Schwitzen schnell ins eiskalte Fass? Dieser Fitness-Trend könnte für Frauen über eine schnelle Erfrischung hinaus nicht viel Wirkung entfalten. Das legt eine Studie eines Teams der Fachhochs… [+4706 chars],,de,'Kälte'
https://tirol.orf.at/stories/3305054/,https://tirol.orf.at/stories/3305054/,0,tirol.orf.at,Schaf und Lamm im Ötztal von Bären gerissen,"In einem Almgebiet in Umhausen im Ötztal sind am Sonntag ein totes Schaf sowie ein totes Lamm gefunden wurden. Der Amtstierarzt vermutet, dass die Nutztiere von einem Bären gerissen wurden. In diesem Bereich wurden die Spuren eines Bären im Schnee fotografier…",https://ibs.orf.at/tir?image=https%3A%2F%2Foekastatic.orf.at%2Fmims%2F2025%2F20%2F72%2Fcrops%2Fw%3D1200%2Ch%3D627%2Cq%3D75%2F2622917_master_1007272_unbenannt-2.jpg%3Fs%3D9741d076774c366d3995586bf358312550a2e095,2025-05-12T15:05:25Z,https://web.archive.org/web/20250512191616/https://tirol.orf.at/stories/3305054/,"Wie das Land am Montag in einer Aussendung erklärte, wurden entnommene Tupferproben zur genetischen Untersuchung an das Forschungsinstitut für Wildtierkunde und Ökologie in Wien geschickt.
Ende der … [+697 chars]",,de,'Schnee'
https://www.stern.de/gesellschaft/regional/baden-wuerttemberg/quartalszahlen---unvorteilhafte-wetterbedingungen---wie-2025-fuer-enbw-begann-35717826.html,https://www.stern.de/gesellschaft/regional/baden-wuerttemberg/quartalszahlen---unvorteilhafte-wetterbedingungen---wie-2025-fuer-enbw-begann-35717826.html,0,www.stern.de,"Quartalszahlen: ""Unvorteilhafte Wetterbedingungen"": Wie 2025 für EnBW begann",Der Energiekonzern setzt immer mehr auf erneuerbare Energien - und ist daher auf Wind und Wetter angewiesen. Die Auswirkungen zeigen sich unmittelbar in der Bilanz für die ersten drei Monate.,https://image.stern.de/35717828/t/Fu/v1/w1440/r1.7778/-/13--nlaykcs4mvv8axs2048jpeg---df5b3d2bd247c96d.jpg,2025-05-13T07:00:38Z,https://web.archive.org/web/20250513074647/https://www.stern.de/gesellschaft/regional/baden-wuerttemberg/quartalszahlen---unvorteilhafte-wetterbedingungen---wie-2025-fuer-enbw-begann-35717826.html,"Kopiere den aktuellen Link
Zur Merkliste hinzufügen
Der Energiekonzern setzt immer mehr auf erneuerbare Energien - und ist daher auf Wind und Wetter angewiesen. Die Auswirkungen zeigen sich unmitte… [+2503 chars]",,de,'Wind'
https://www.stern.de/gesellschaft/regional/baden-wuerttemberg/flugverkehr--wegen-gasleck--flugbetrieb-am-baden-airpark-eingeschraenkt-35719246.html,https://www.stern.de/gesellschaft/regional/baden-wuerttemberg/flugverkehr--wegen-gasleck--flugbetrieb-am-baden-airpark-eingeschraenkt-35719246.html,0,www.stern.de,Flugverkehr: Wegen Gasleck: Flugbetrieb am Baden-Airpark eingeschränkt,In der Nähe tritt Gas aus und der Wind verteilt es. Das hat Konsequenzen für Reisende am Flughafen Karlsruhe / Baden-Baden. Landungen und Starts fallen aus.,https://image.stern.de/35719248/t/lP/v1/w1440/r1.7778/-/13--xcfp6epvwdv5axs2048jpeg---f37c7bf25783130e.jpg,2025-05-13T11:42:56Z,https://web.archive.org/web/20250513131516/https://www.stern.de/gesellschaft/regional/baden-wuerttemberg/flugverkehr--wegen-gasleck--flugbetrieb-am-baden-airpark-eingeschraenkt-35719246.html,"Kopiere den aktuellen Link
Zur Merkliste hinzufügen
In der Nähe tritt Gas aus und der Wind verteilt es. Das hat Konsequenzen für Reisende am Flughafen Karlsruhe / Baden-Baden. Landungen und Starts … [+751 chars]",,de,'Wind'
