index,url,valid,domain,title,description,image,published,archive,content,quote,language,keyword
https://www.focus.de/panorama/welt/koelner-energie-riese-blockiert-ausflugsziel-fuer-rohre-familie-sauer-zumutung_6c3a4265-ccd5-4bf0-8548-fcbd32289288.html,https://www.focus.de/panorama/welt/koelner-energie-riese-blockiert-ausflugsziel-fuer-rohre-familie-sauer-zumutung_6c3a4265-ccd5-4bf0-8548-fcbd32289288.html,0,www.focus.de,"Ärger in der Südstadt - Kölner Energie-Riese blockiert Ausflugsziel für Rohre, Familie sauer: „Zumutung“",Am Forstbotanischen Garten in Köln herrscht Parkplatz-Not. Der Grund könnte nicht besser zu Köln passen.,https://quadro.burda-forward.de/ctf/d368d4ab-c42f-4390-91ef-11ad729f11e9.021e1371-c80f-401f-8336-6ad41b94b1f6.jpeg?im=RegionOfInterestCrop%3D%281200%2C630%29%2CregionOfInterest%3D%281349%2C737%29&hash=a7b3033f91774f85850667f703a95ae9f75e5e89b5b0b19f9565751c3db27e2b,2025-04-01T17:09:00Z,,"Der großzügige, wertvolle Forstbotanische Garten in Köln mit seinem Friedenspark und dem Waldkindergarten ist besonders bei Sonnenschein wie in den kommenden Tagen eines der beliebtesten Ausflugsziel… [+1698 chars]",,de,'Not'
https://www.focus.de/wetter/sommerwetter-in-deutschland-am-donnerstag-sind-hier-bis-zu-23-grad-drin_a9c06b4a-b8d2-4e7a-9ddb-dd327b8cc3ec.html,https://www.focus.de/wetter/sommerwetter-in-deutschland-am-donnerstag-sind-hier-bis-zu-23-grad-drin_a9c06b4a-b8d2-4e7a-9ddb-dd327b8cc3ec.html,0,www.focus.de,"Erst warm, dann kalt - Sommerwetter in Deutschland: am Donnerstag sind hier bis zu 24 Grad drin",Hoch Naomi bringt Wärme. Das Wetter in Deutschland könnte am Freitag fast sommerliche Temperaturen erreichen. Ein Kälteeinbruch am Wochenende ist jedoch vorhergesagt.Von FOCUS-online-Autor Matthias Kernstock (München),https://quadro.burda-forward.de/ctf/232cddbe-bbb3-48a1-a9f8-ca4e53a415a0.38c3cc9f-cc4a-4c34-a4af-919870b11a16.jpg?im=RegionOfInterestCrop%3D%281200%2C630%29%2CregionOfInterest%3D%28963%2C353%29&hash=f8ab831d1f0b14ba17d7e95c0abb8443dcab42f658198904deadc6d3a42793e7,2025-04-02T05:10:00Z,,Jetzt kommt Sommerwetter nach Deutschland. Ein neues Hochdruckgebiet namens Naomi breitet sich von Westen her aus und könnte insbesondere am Freitag die Temperaturen in Deutschland in die Nähe der 25… [+2232 chars],,de,'Schnee'
https://www.stern.de/gesellschaft/regional/mecklenburg-vorpommern/bauerntag--landwirte-fordern-kurswechsel-in-der-agrarpolitik-35605688.html,https://www.stern.de/gesellschaft/regional/mecklenburg-vorpommern/bauerntag--landwirte-fordern-kurswechsel-in-der-agrarpolitik-35605688.html,0,www.stern.de,Bauerntag: Landwirte fordern Kurswechsel in der Agrarpolitik,Mecklenburg-Vorpommerns Bauern diskutieren beim Bauerntag über die zukünftige Agrarpolitik. Von der künftigen Regierung erwarten sie verlässliche Rahmenbedingungen in der Landwirtschaft.,https://image.stern.de/35605690/t/kC/v1/w1440/r1.7778/-/02--6j5uac5qxdv4axs2048jpeg---fc606162795ccee6.jpg,2025-04-02T09:23:31Z,,"Kopiere den aktuellen Link
Zur Merkliste hinzufügen
Mecklenburg-Vorpommerns Bauern diskutieren beim Bauerntag über die zukünftige Agrarpolitik. Von der künftigen Regierung erwarten sie verlässliche… [+1597 chars]",,de,'Landwirtschaft'
https://www.stern.de/gesellschaft/regional/mecklenburg-vorpommern/bauerntag-mv--bauern-appellieren-an-politik---hoechste-zeit-zum-handeln--35606814.html,https://www.stern.de/gesellschaft/regional/mecklenburg-vorpommern/bauerntag-mv--bauern-appellieren-an-politik---hoechste-zeit-zum-handeln--35606814.html,0,www.stern.de,"Bauerntag MV: Bauern appellieren an Politik: ""Höchste Zeit zum Handeln""",Mecklenburg-Vorpommerns Landwirte stellen beim Bauerntag Forderungen an die künftige Bundesregierung. Landwirtschaftsminister Backhaus kündigt schnelle Lösungen an.,https://image.stern.de/35606816/t/yR/v1/w1440/r1.7778/-/02--mnxcwltwbov5axs2048jpeg---012a43ec90549d38.jpg,2025-04-02T13:04:17Z,,"Kopiere den aktuellen Link
Zur Merkliste hinzufügen
Mecklenburg-Vorpommerns Landwirte stellen beim Bauerntag Forderungen an die künftige Bundesregierung. Landwirtschaftsminister Backhaus kündigt sc… [+3034 chars]",,de,'Landwirtschaft'
