index,url,valid,domain,title,description,image,published,archive,content,quote,language,keyword
https://www.tagesspiegel.de/berlin/zum-sommerbeginn-hitzehilfe-fur-berliner-obdachlose-startet-13783969.html,https://www.tagesspiegel.de/berlin/zum-sommerbeginn-hitzehilfe-fur-berliner-obdachlose-startet-13783969.html,0,www.tagesspiegel.de,Zum Sommerbeginn: Hitzehilfe für Berliner Obdachlose startet,Nicht nur Kälte und Regen machen auf der Straße lebenden Menschen zu schaffen. Im Sommer kann Hitze für sie lebensgefährlich werden. Deshalb startet an diesem Sonntag erneut die Hitzehilfe.,https://www.tagesspiegel.de/images/13783972/alternates/BASE_16_9_W1400/1748743387000/notunterkunft-der-hitzehilfe-fur-obdachlose.jpeg,2025-06-01T02:02:31Z,https://web.archive.org/web/20250601081433/https://www.tagesspiegel.de/berlin/zum-sommerbeginn-hitzehilfe-fur-berliner-obdachlose-startet-13783969.html,Mit dem meteorologischen Beginn des Sommers startet an diesem Sonntag auch die Hitzehilfe für obdachlose Menschen in Berlin. Sie können dann in speziellen Räumlichkeiten Schutz vor gleißender Sonne u… [+1465 chars],,de,'Kälte'
https://www.morgenpost.de/berlin/article409157638/zum-sommeranfang-berlin-startet-hitzehilfe-fuer-obdachlose.html,https://www.morgenpost.de/berlin/article409157638/zum-sommeranfang-berlin-startet-hitzehilfe-fuer-obdachlose.html,0,www.morgenpost.de,Zum Sommeranfang: Berlin startet Hitzehilfe für Obdachlose,Nicht nur Kälte macht auf der Straße lebenden Menschen zu schaffen. Hitze kann für sie lebensgefährlich werden. Was Sie tun können.,https://img.sparknews.funkemedien.de/409157617/409157617_1748762473_v16_9_1600.jpeg,2025-06-01T07:21:14Z,https://web.archive.org/web/20250602092438/https://www.morgenpost.de/berlin/article409157638/zum-sommeranfang-berlin-startet-hitzehilfe-fuer-obdachlose.html,"Berlin. Nicht nur Kälte macht auf der Straße lebenden Menschen zu schaffen. Hitze kann für sie lebensgefährlich werden. Was Sie tun können.
Mit dem meteorologischen Beginn des Sommers startet an die… [+1056 chars]",,de,'Kälte'
https://www.faz.net/aktuell/wirtschaft/unternehmen/private-equity-investoren-in-der-warteschleife-110511017.html,https://www.faz.net/aktuell/wirtschaft/unternehmen/private-equity-investoren-in-der-warteschleife-110511017.html,0,www.faz.net,Private: Equity: Investoren in der Warteschleife,In diesem Jahr wollte Private Equity wieder loslegen. Dann kamen die amerikanischen Zölle. Der Deal-Druck wächst. Spezialfonds helfen in der Zeit der Dürre.,https://media0.faz.net/ppmedia/aktuell/4150478947/1.10511016/facebook_teaser/haltedauer-der-investoren.jpg,2025-06-02T08:00:12Z,,"Die Hoffungen der Private-Equity-Branche auf einen starken Aufschwung im laufenden Jahr sind schon wieder weitgehend zerstoben. Fachleute hatten darauf gesetzt, dass nach schwierigen Jahren der Hande… [+7416 chars]",,de,'Dürre'
https://www.zeit.de/wirtschaft/2025-06/kaffee-inflation-ernteausfall,https://www.zeit.de/wirtschaft/2025-06/kaffee-inflation-ernteausfall,0,www.zeit.de,Ernteausfall: Kaffeepreis steigt deutlich stärker als allgemeine Inflation,Dürre und Waldbrände beeinträchtigten 2024 die Kaffeeernte in Brasilien. Der Preis für Kaffeebohnen in Deutschland stieg deshalb um 12 Prozent innerhalb eines Jahres.,https://img.zeit.de/wirtschaft/2025-06/kaffee-inlfation-ernteausfall-bild/wide__1300x731,2025-06-02T08:20:33Z,http://archive.md/20250602084314/https://www.zeit.de/wirtschaft/2025-06/kaffee-inflation-ernteausfall,"Durch Ernteausfälle in wichtigen Anbauländern sind die Preise für Rohkaffee stark gestiegen. Nach Angaben des Statistischen Bundesamts war Bohnenkaffee in Deutschland diesen April um 12,2 Prozent teu… [+1809 chars]",,de,'Dürre'
https://www.faz.net/aktuell/gesellschaft/ungluecke/aetna-auf-sizilien-ausgebrochen-110514370.html,https://www.faz.net/aktuell/gesellschaft/ungluecke/aetna-auf-sizilien-ausgebrochen-110514370.html,0,www.faz.net,"Eine riesige Wolke aus Asche, Gas und Gestein","Zu Beginn der Woche ist der Vulkan Ätna auf Sizilien im Süden Italiens abermals ausgebrochen: Aufnahmen zeigen „einen pyroklastischen Strom“. Die Rauchwolke reichte bis in eine Höhe von 6,5 Kilometern.",https://media1.faz.net/ppmedia/aktuell/gesellschaft/1088127698/1.10514377/facebook_teaser/der-nahegelegene-flughafen-in.jpg,2025-06-03T07:11:23Z,,"Der Vulkan Ätna auf Sizilien ist abermals ausgebrochen: Der größte aktive Vulkan Europas stieß am Montag eine riesige Wolke aus Asche, Gas und Gestein aus. Der Ausbruch begann am späten Vormittag und… [+2068 chars]",,de,'Gas'
https://www.nzz.ch/sport/weitere-sportarten/kaeltekammern-boomen-was-die-erfrischung-bei-minus-110-grad-celsius-bringt-ld.1886956,https://www.nzz.ch/sport/weitere-sportarten/kaeltekammern-boomen-was-die-erfrischung-bei-minus-110-grad-celsius-bringt-ld.1886956,0,www.nzz.ch,Kältekammern boomen. Das bringt die Erfrischung bei minus 110 Grad Celsius,"Die Anbieter versprechen Sportlern vielfältige Wirkungen: bessere Erholung, höhere Leistungsfähigkeit und eine schnellere Genesung nach Verletzungen. Ist der Nutzen auch wissenschaftlich erwiesen?","https://img.nzz.ch/2025/06/03/3b582d50-5032-4762-81ed-61b9fe6430e7.jpeg?width=1200&height=674&fit=bounds&quality=75&auto=webp&crop=3110,1749,x136,y145&wmark=nzz",2025-06-03T12:21:09Z,http://archive.md/20250603144124/https://www.nzz.ch/sport/weitere-sportarten/kaeltekammern-boomen-was-die-erfrischung-bei-minus-110-grad-celsius-bringt-ld.1886956,"Der Kältekammer werden viele positive Effekte nachgesagt unter anderem soll sie die Selbstheilung des Körpers aktivieren.
Drei Minuten bei minus 110 Grad Celsius, und die Welt ist eine andere: Das v… [+6978 chars]",,de,'Kälte'
https://www.zeit.de/2025/23/kupferproduktion-energiewende-stromversorgung-chile-bergbau,https://www.zeit.de/2025/23/kupferproduktion-energiewende-stromversorgung-chile-bergbau,0,www.zeit.de,Kupferproduktion: Die hässliche Seite des Kupfers,"Grüner Strom braucht Sonne, Wind – und sehr viel Kupfer. Doch der Abbau verursacht extrem giftigen Müll. Eine Recherche über drei Kontinente, von der Mine bis zum Windrad",https://img.zeit.de/2025/23/die-haessliche-seite-des-kupfers-bild-7/wide__1300x731,2025-06-03T13:49:44Z,http://archive.md/20250603145527/https://www.zeit.de/2025/23/kupferproduktion-energiewende-stromversorgung-chile-bergbau,"Dieser Artikel ist Teil von ZEIT am Wochenende, Ausgabe 22/2025.
Chile
Ganz oben im Norden von Chile, tief in der Atacama-Wüste, wo es so trocken ist, dass fast nichts wachsen und fast nichts leben… [+340 chars]",,de,'Wind'
