index,url,valid,domain,title,description,image,published,archive,content,quote,language,keyword
https://www.zeit.de/wirtschaft/2026-03/unabhaengigkeit-fossile-energien-energiepreise-krise-massnahmen,https://www.zeit.de/wirtschaft/2026-03/unabhaengigkeit-fossile-energien-energiepreise-krise-massnahmen,0,www.zeit.de,"Unabhängigkeit von fossilen Energien: Wie Sie von Gas, Öl, Benzin und Diesel wegkommen",Immer mehr Bürger wollen sich unabhängig von den fossilen Energien machen – und setzen auf erneuerbare. Was Sie beim Umstieg auf Wärmepumpe und E-Auto beachten sollten.,https://img.zeit.de/wirtschaft/unternehmen/2026-03/unabhaengigkeit-fossile-energien-energiepreise-krise-massnahmen-bild/wide__1300x731,2026-04-04T16:20:42Z,,"Dass Donald Trump die Absatzzahlen von Solarmodulen und E-Autos hochtreibt, ist einer der bemerkenswerteren Zusammenhänge der vergangenen Wochen, auch wenn er schnell erklärt ist: Der Gaspreis liegt … [+488 chars]",,de,'Wärmepumpe'
https://www.focus.de/finanzen/preishammer-der-gas-netzgebuehren-mehr-als-3000-euro-bis-2045_3827b455-78bc-4664-9fcf-c552cf7a54b6.html,https://www.focus.de/finanzen/preishammer-der-gas-netzgebuehren-mehr-als-3000-euro-bis-2045_3827b455-78bc-4664-9fcf-c552cf7a54b6.html,0,www.focus.de,Preishammer der Gas-Netzgebühren: mehr als 3000 Euro bis 2045,Gas könnte für Haushalte deutlich teurer werden. Studien zeigen stark steigende Netzkosten – vor allem für die letzten Gaskunden.,"https://quadro.burda-forward.de/ctf/125a1645-2218-4e35-9770-78f6947691d1.f29c5ffc-f955-48ea-a01e-fa2f937ab2d1.jpg?im=RegionOfInterestCrop=(1200,630),regionOfInterest=(3111,2281)&hash=b86427c7576ff167740cfa963694e1616e6a7a3bb7e50277f582b3c063dbeae6",2026-04-06T09:28:00Z,,Gasheizungen könnten für viele Haushalte zur Kostenfalle werden. Denn nicht nur CO-Preis und Energiepreise treiben die Kosten auch die Netzentgelte steigen massiv. Studien zeigen: Für die letzten Gas… [+3881 chars],,de,'Wärmepumpe'
https://www.tagesspiegel.de/wirtschaft/die-grosse-unabhangigkeit-wie-haushalte-sich-von-den-energiepreisen-abkoppeln-15433004.html,https://www.tagesspiegel.de/wirtschaft/die-grosse-unabhangigkeit-wie-haushalte-sich-von-den-energiepreisen-abkoppeln-15433004.html,0,www.tagesspiegel.de,Die große Unabhängigkeit : Wie Haushalte sich von den Energiepreisen abkoppeln,"Solaranlage, Wärmepumpe, Elektroauto: Wer früh investiert hat, schaut gelassen auf steigende Heizöl- und Benzinpreise. Was das kostet – und was auch ohne großes Budget geht.",https://www.tagesspiegel.de/images/15443813/alternates/BASE_16_9_W1400/1775577424000/schlaue-warme-kopie.jpeg,2026-04-08T07:53:49Z,,"Im Augenblick tankt Egbert Mill für 3,75 Euro auf 100 Kilometer. Theoretisch jedenfalls. Denn normalerweise kostet es den Rentner aus Lieberose gar nichts, wenn er sein Elektroauto an der heimischen … [+112 chars]",,de,'Wärmepumpe'
https://www.morgenpost.de/ratgeber-wissen/finanzen/article411655474/waermepumpe-energieberatung-kosten-heizung.html,https://www.morgenpost.de/ratgeber-wissen/finanzen/article411655474/waermepumpe-energieberatung-kosten-heizung.html,0,www.morgenpost.de,Wärmepumpe mit Energieberatung: Profi-Tipp gegen „unnötig hohe Kosten“,Eine ineffiziente Wärmepumpe kann hohe Kosten verursachen. Eine Energieberatung zahlt sich vor der Sanierung in mehrfacher Hinsicht aus. Doch ein Experte warnt.,https://img.sparknews.funkemedien.de/409008314/409008314_1747141743_v16_9_1600.jpeg,2026-04-08T10:37:41Z,,"Wer seine Immobilie energetisch saniert, spart langfristig nicht nur Energiekosten. Auch bei der Baufinanzierung kann sich der Aufwand lohnen: Energieeffiziente Gebäude führen oft zu günstigeren Kond… [+5994 chars]",,de,'Wärmepumpe'
https://www.zeit.de/news/2026-04/10/gas-und-oel-auf-dem-rueckzug-beim-heizen-in-neuen-wohngebaeuden,https://www.zeit.de/news/2026-04/10/gas-und-oel-auf-dem-rueckzug-beim-heizen-in-neuen-wohngebaeuden,0,www.zeit.de,Statistik: Gas und Öl auf dem Rückzug beim Heizen in neuen Wohngebäuden,Hier finden Sie Informationen zu dem Thema „Statistik“. Lesen Sie jetzt „Gas und Öl auf dem Rückzug beim Heizen in neuen Wohngebäuden“.,https://img.zeit.de/news/2026-04/10/gas-und-oel-auf-dem-rueckzug-beim-heizen-in-neuen-wohngebaeuden-image-group/wide__1300x731,2026-04-10T09:41:46Z,,Bauherren setzen bei Wohnungsneubauten in Thüringen vor allem auf die Nutzung erneuerbarer Energien zum Heizen. Bei den 780 im vergangenen Jahr neu geplanten Wohngebäuden werden nach Daten des Landes… [+1020 chars],,de,'Wärmepumpe'
https://www.stern.de/gesellschaft/regional/thueringen/statistik--gas-und-oel-auf-dem-rueckzug-beim-heizen-in-neuen-wohngebaeuden-37296836.html,https://www.stern.de/gesellschaft/regional/thueringen/statistik--gas-und-oel-auf-dem-rueckzug-beim-heizen-in-neuen-wohngebaeuden-37296836.html,0,www.stern.de,Statistik: Gas und Öl auf dem Rückzug beim Heizen in neuen Wohngebäuden,Erfurt (th) - Bauherren setzen bei Wohnungsneubauten in Thüringen vor allem auf die Nutzung erneuerbarer Energien zum Heizen. Bei den 780 im vergangenen,https://image.stern.de/37296838/t/Wf/v1/w1440/r1.7778/-/10--4pr4ncfkmfv9axs2048jpeg---f55de923c34571c5.jpg,2026-04-10T09:41:46Z,,"Kopiere den aktuellen Link
Zur Merkliste hinzufügen
Wärmepumpen dominieren beim Heizen neuer Wohngebäude in Thüringen. Nur noch bei wenigen Neubauten werden Gas oder Öl als Hauptenergiequelle gewäh… [+1184 chars]",,de,'Gas'
