index,url,valid,domain,title,description,image,published,archive,content,quote,language,keyword
https://www.wiwo.de/unternehmen/energie/energieversorgung-weiteres-ziel-erreicht-gasspeicher-zu-78-6-prozent-gefuellt/28959508.html,https://www.wiwo.de/unternehmen/energie/energieversorgung-weiteres-ziel-erreicht-gasspeicher-zu-78-6-prozent-gefuellt/28959508.html,0,www.wiwo.de,"Energie: Weiteres Ziel erreicht: Gasspeicher zu 78,6 Prozent gefüllt","Ganz voll sind die deutschen Gasspeicher nicht mehr, aber deutlich über dem von der Bundesregierung vorgegebenen Einspeicherziel. Die Netzagentur geht nicht mehr von einer Gasmangellage aus.",https://www.wiwo.de/images/gasspeicher/28959506/1-format11240.jpg,2023-02-02T10:59:21Z,https://web.archive.org/web/20230202114402/https://www.wiwo.de/unternehmen/energie/energieversorgung-weiteres-ziel-erreicht-gasspeicher-zu-78-6-prozent-gefuellt/28959508.html,"Die deutschen Erdgasspeicher waren am 1. Februar mit 78,6 Prozent Füllstand fast doppelt so voll wie vom Energiewirtschaftsgesetz zu diesem Stichtag vorgeschrieben. Dies ging am Donnerstag aus vorläu… [+873 chars]",,de,'Gas'
https://www.telepolis.de/features/Netzentwicklungsplan-Bedenkliche-Ueberschaetzung-des-Gasbedarfs-7477874.html,https://www.telepolis.de/features/Netzentwicklungsplan-Bedenkliche-Ueberschaetzung-des-Gasbedarfs-7477874.html,0,www.telepolis.de,Netzentwicklungsplan: Bedenkliche Überschätzung des Gasbedarfs,"Energie und Klima – kompakt: Kritik von Klimaschützern an Planungen für Gaswirtschaft. Angenommener Bedarf sei zu hoch, geplante Infrastruktur überdimensioniert. Umsetzung würde erhebliche Probleme schaffen.",https://heise.cloudimg.io/bound/1200x1200/q85.png-lossy-85.webp-lossy-85.foil1/_www-heise-de_/imgs/18/3/6/8/9/5/4/6/3e2a3a81a41fc0b6.jpeg,2023-02-02T11:00:00Z,https://web.archive.org/web/20230202114818/https://www.telepolis.de/features/Netzentwicklungsplan-Bedenkliche-Ueberschaetzung-des-Gasbedarfs-7477874.html,"Das schwimmende LNG-Terminal Höegh Esperanza in Wilhelmshaven. Bild: Ein Dahmer / CC-BY-SA-4.0
Energie und Klima kompakt: Kritik von Klimaschützern an Planungen für Gaswirtschaft. Angenommener Bedar… [+2561 chars]",,de,'Gas'
https://www.focus.de/finanzen/news/auch-fuer-pellets-und-fluessiggas-sie-haben-2022-heizoel-bestellt-dann-winken-ihnen-bis-zu-2000-euro-hilfe_id_184726229.html,https://www.focus.de/finanzen/news/auch-fuer-pellets-und-fluessiggas-sie-haben-2022-heizoel-bestellt-dann-winken-ihnen-bis-zu-2000-euro-hilfe_id_184726229.html,0,www.focus.de,Auch für Pellets und Flüssiggas - Sie haben 2022 Heizöl bestellt? Dann winken Ihnen bis zu 2000 Euro Hilfe,"Gaspreisbremse, Strompreisbremse und Erstattung für Fernwärme. Doch was ist mit Haushalten, die mit Heizöl heizen? Im Kleingedruckten hat die Bundesregierung eine Entlastung geplant. Doch nur wenige können davon profitieren. FOCUS online sagt, was genau gilt.",https://p6.focus.de/img/fotos/id_160188255/heizoel-lieferung-51920714.jpg?im=Crop%3D%280%2C248%2C3533%2C1766%29%3BResize%3D%281200%2C627%29&impolicy=perceptual&quality=medium&hash=c362821a40fc41e398678fce90cf69cd5cdcdc1aa2c5b6225e37d66030ecb725,2023-02-02T11:44:22Z,https://web.archive.org/web/20230202115521/https://www.focus.de/finanzen/news/auch-fuer-pellets-und-fluessiggas-sie-haben-2022-heizoel-bestellt-dann-winken-ihnen-bis-zu-2000-euro-hilfe_id_184726229.html,"Gaspreisbremse, Strompreisbremse und Erstattung für Fernwärme. Doch was ist mit Haushalten, die mit Heizöl heizen? Im Kleingedruckten hat die Bundesregierung eine Entlastung geplant. Doch nur wenige … [+3711 chars]",,de,'Gas'
https://www.sueddeutsche.de/muenchen/le-petit-p-garibaldi-weinbar-coucou-food-market-bao-burger-1.5743810,https://www.sueddeutsche.de/muenchen/le-petit-p-garibaldi-weinbar-coucou-food-market-bao-burger-1.5743810,0,www.sueddeutsche.de,Lokalrunde: Ein Weincafé und zwei Bao-Burger,"Ein kleines P hat eröffnet, elf Winzer kommen zu Besuch und bei Coucou gibt's Entenfetzen und Blumenkohl.",https://www.sueddeutsche.de/image/sz.1.5743811/1200x675?v=1675338373,2023-02-02T11:46:29Z,https://web.archive.org/web/20230202130608/https://www.sueddeutsche.de/muenchen/le-petit-p-garibaldi-weinbar-coucou-food-market-bao-burger-1.5743810,"Ein kleines P hat eröffnet, elf Winzer kommen zu Besuch und bei Coucou gibt's Entenfetzen und Blumenkohl.Viel weiß man noch nicht über die neue Weinbar im Schlachthofviertel. Le Petit P. nennt sie si… [+2470 chars]",,de,'Wein'
https://www.wiwo.de/politik/deutschland/fracking-wie-niedersachsen-seinen-gas-schatz-ablehnt/28952560.html,https://www.wiwo.de/politik/deutschland/fracking-wie-niedersachsen-seinen-gas-schatz-ablehnt/28952560.html,0,www.wiwo.de,Fracking: Wie Niedersachsen seinen Gas-Schatz ablehnt,"Ob in Deutschland Erdgas aus unkonventionellen Lagerstätten gefördert werden soll, ist stark umstritten. Dabei ist vor allem Niedersachsen zentraler Akteur in der Debatte. Wie sich die einzelnen Parteien positionieren.",https://www.wiwo.de/images/imago0117100524h/28952838/3-format11240.jpg,2023-02-02T11:50:45Z,https://web.archive.org/web/20230202122135/https://www.wiwo.de/politik/deutschland/fracking-wie-niedersachsen-seinen-gas-schatz-ablehnt/28952560.html,"Die Diskussion über einen möglichen Fracking-Einstieg hält seit Monaten an. Während Stimmen aus Industrie und Wissenschaft sich vermehrt für die Technologie aussprechen, lehnen große Teile aus Politi… [+5533 chars]",,de,'Gas'
"https://winfuture.de/news,134353.html","https://winfuture.de/news,134353.html",0,winfuture.de,Stromerzeugung: Wind und Sonne setzten sich in der EU an die Spitze,"Wind- und Solar-Energie haben es im letzten Jahr geschafft, sich zumindest zusammengenommen an die Spitze im europäischen Stromnetz zu setzen. Angesichts der Trends der letzten Jahre dürften die Anteile bald noch deutlicher verteilt werden.(Weiter lesen)",https://i.wfcdn.de/teaser/1920/39104.jpg,2023-02-02T14:01:00Z,"https://web.archive.org/web/20230202140423/https://winfuture.de/news,134353.html","Wind- und Solar-Energie haben es im letzten Jahr geschafft, sich zumindest zusammengenommen an die Spitze im europäischen Stromnetz zu setzen. Angesichts der Trends der letzten Jahre dürften die Ante… [+2651 chars]",,de,'Wind'
https://www.zeit.de/news/2023-02/02/schnee-und-eis-verursachen-probleme-auf-strassen-in-der-rhoen,https://www.zeit.de/news/2023-02/02/schnee-und-eis-verursachen-probleme-auf-strassen-in-der-rhoen,0,www.zeit.de,Fulda: Schnee und Eis verursachen Probleme auf Straßen in der Rhön,,,2023-02-02T14:24:51Z,https://web.archive.org/web/20230203052204/https://www.zeit.de/news/2023-02/02/schnee-und-eis-verursachen-probleme-auf-strassen-in-der-rhoen,"When browsing with ads:
We collect personal data and also transmit it to third-party providers
 that help us improve and finance our digital content. Some of the information stored on your device, … [+732 chars]",,de,'Schnee'
https://www.dealdoktor.de/italienisches-wein-naschpaket/,https://www.dealdoktor.de/italienisches-wein-naschpaket/,0,www.dealdoktor.de," Italienisches Wein & Naschpaket für 38,90€ + 10€ Bonus","Euch sind 3 Weine zu wenig? Na dann könnt ihr euch hier auch ein größeres Paket mit Weinen und italienischen Leckereien bestellen. Das Ganze kostet euch 38,90€, aber ihr bekommt vom Doc einen 10€ Bonus zurück. 
Und für nur 1€ mehr bekommt ihr noch 4 weitere W…",https://www.dealdoktor.de/app/uploads/2023/01/giordano-bonus-deal-10-thumb-1.png,2023-02-02T15:05:45Z,,"Euch sind 3 Weine zu wenig? Na dann könnt ihr euch hier auch ein größeres Paket mit Weinen und italienischen Leckereien bestellen. Das Ganze kostet euch 38,90, aber ihr bekommt vom Doc einen 10 Bonus… [+3648 chars]",,de,'Wein'
https://www.sueddeutsche.de/muenchen/dachau/dachau-stadtwerke-energiepreise-gaspreisdeckel-1.5744119,https://www.sueddeutsche.de/muenchen/dachau/dachau-stadtwerke-energiepreise-gaspreisdeckel-1.5744119,0,www.sueddeutsche.de,Dachau: Die Energiepreise schlagen Kapriolen,"Viele Gaskunden der Stadtwerke wundern sich aktuell über Rückzahlungen, während Abschläge steigen. Das liegt an den Preisbremsen der Regierung, die jetzt kassenwirksam werden. Ab März kommen noch Gas- und Stromdeckel dazu - rückwirkend.",https://www.sueddeutsche.de/image/sz.1.5744120/1200x675?v=1675349553,2023-02-02T20:40:40Z,https://web.archive.org/web/20230202205933/https://www.sueddeutsche.de/muenchen/dachau/dachau-stadtwerke-energiepreise-gaspreisdeckel-1.5744119,"Viele Gaskunden der Stadtwerke wundern sich aktuell über Rückzahlungen, während Abschläge steigen. Das liegt an den Preisbremsen der Regierung, die jetzt kassenwirksam werden. Ab März kommen noch Gas… [+4093 chars]",,de,'Gas'
https://www.nzz.ch/feuilleton/enrique-mazzola-im-portraet-ein-neues-stil-gefuehl-fuer-den-belcanto-ld.1723878,https://www.nzz.ch/feuilleton/enrique-mazzola-im-portraet-ein-neues-stil-gefuehl-fuer-den-belcanto-ld.1723878,0,www.nzz.ch,Belcanto-Oper ohne Wein? Für den Dirigenten Enrique Mazzola geht das gar nicht,Mit Donizettis Königinnendrama «Roberto Devereux» kehrt Enrique Mazzola an die Oper Zürich zurück. Der Italiener will das Stilbewusstsein beim Belcanto schärfen und scheut sich nicht einmal vor Kritik an einer Ikone dieser besonderen Kunst: an Maria Callas.,"https://img.nzz.ch/2023/02/01/c249546c-d162-4458-8632-727b6a8a6d38.jpeg?width=1200&height=675&fit=bound&quality=75&auto=webp&crop=3543,1993,x0,y271&wmark=nzz",2023-02-03T04:30:00Z,,Es ist einsam geworden um die alternde Königin Elizabeth I. (Inga Kalna): Szene aus der Zürcher Neuproduktion von «Roberto Devereux» in der Regie von David Alden und unter der musikalischen Leitung v… [+6256 chars],,de,'Wein'
https://www.focus.de/digital/abzocke-bei-gas-strom-darum-sollten-sie-nie-die-zaehlernummer-am-telefon-durchgeben_id_179431261.html,https://www.focus.de/digital/abzocke-bei-gas-strom-darum-sollten-sie-nie-die-zaehlernummer-am-telefon-durchgeben_id_179431261.html,0,www.focus.de,Abzocke bei Gas & Strom - Darum sollten Sie nie die Zählernummer am Telefon durchgeben,"Der Energiemarkt ist aktuell stark in Bewegung, da viele Kunden die günstigsten Tarife suchen. Das nutzen aufdringliche Anbieter aus und rufen Kunden aus dem Nichts an. Wer nicht aufpasst, der landet plötzlich in einem teuren Vertrag. Wir kennen diese Rufnumm…",https://p6.focus.de/img/digital/id_179431260/abzocke-bei-gas-und-strom-gehen-sie-nicht-ran-wenn-diese-nummern-anrufen.jpg?im=Crop%3D%280%2C60%2C1920%2C960%29%3BResize%3D%281200%2C627%29&impolicy=perceptual&quality=medium&hash=d618c6d43c7e31d91481b51581ec1150a117f4028795b6bc981163acdd4e8756,2023-02-03T06:06:39Z,,"Der Energiemarkt ist aktuell stark in Bewegung, da viele Kunden die günstigsten Tarife suchen. Das nutzen aufdringliche Anbieter aus und rufen Kunden aus dem Nichts an. Wer nicht aufpasst, der landet… [+2702 chars]",,de,'Gas'
https://www.handelsblatt.com/unternehmen/energie/gasspeicher-in-deutschland-fuellstand-von-78-prozent-erreicht-/28819652.html,https://www.handelsblatt.com/unternehmen/energie/gasspeicher-in-deutschland-fuellstand-von-78-prozent-erreicht-/28819652.html,0,www.handelsblatt.com,Gasspeicher in Deutschland: Füllstand von 78 Prozent erreicht,Ein hoher Gasspeicher-Füllstand ist für Deutschlands Gasversorgung in der Energiekrise essenziell. Wie steht es aktuell um die Gasreserven? Ein Überblick.,https://www.handelsblatt.com/images/gasspeicher-in-sachsen-anhalt/28877480/2-format2003.jpg,2023-02-03T06:45:16Z,https://web.archive.org/web/20230203083627/https://www.handelsblatt.com/unternehmen/energie/gasspeicher-in-deutschland-fuellstand-von-78-prozent-erreicht-/28819652.html,"Gasspeicher in Sachsen-AnhaltDer Gasspeicher-Füllstand in Deutschland ist in der Energiekrise zum wichtigen Faktor geworden.
(Foto: dpa)
Düsseldorf Ein stabiler Füllstand der deutschen Gasspeicher … [+7471 chars]",,de,'Gas'
https://salzburg.orf.at/stories/3193185/,https://salzburg.orf.at/stories/3193185/,0,salzburg.orf.at,Straßwalchen: „Keine Erdgas-Bohrungen“,"Nach der Aufregung in Molln (Oberösterreich) wegen der geplanten Erdgas-Probebohrungen rückt jetzt Straßwalchen (Flachgau) ins Blickfeld. konkrete Pläne für die Gegend gebe es derzeit aber nicht, heißt es dazu von der Gas-Erschließungsfirma ADX.",https://ibs.orf.at/sbg?image=https%3A%2F%2Foekastatic.orf.at%2Fmims%2F2023%2F05%2F94%2Fcrops%2Fw%3D1200%2Ch%3D627%2Cq%3D75%2F1663385_master_612194_strasswalchen.jpg%3Fs%3Df5672f60d44438a34d485f71f8454a9b28ef1bfd,2023-02-03T06:46:46Z,,"Diese hatte auch für die Gegend rund um Straßwalchen, Zell am Moos und Irrsdorf eine Bohrlizenz erhalten. Das Gebiet rund um Straßwalchen ist eine potenzielle Lagerstätte von Erdgas dies ist schon se… [+1446 chars]",,de,'Gas'
https://help.orf.at/stories/3217501/,https://help.orf.at/stories/3217501/,0,help.orf.at,E-Control: Energielieferanten sollen Kunden besser schützen,"Angesichts der turbulenten Situation auf den Strom- und Gasmärkten fordert die Regulierungsbehörde E-Control die Energieunternehmen auf, mehr zum Schutz ihrer Kunden zu tun. Informationen zu  Preisänderungen sollten verständlicher sein, Abrechnungen anhand de…",https://ibs.orf.at/help?image=https%3A%2F%2Ftubestatic.orf.at%2Fmims%2F2022%2F37%2F69%2Fcrops%2Fw%3D1200%2Ch%3D627%2Cq%3D75%2F1492462_master_541569_stromkosten.jpg%3Fs%3D3a4efbf1ea6c490e458b7587e1d66118621f7fa1,2023-02-03T07:35:00Z,,Massiv gestiegene Preise für Strom und Gas oder gar gekündigte Verträge hätten im vergangenen Jahr für große Verunsicherung bei Kundinnen und Kunden gesorgt. Das habe zu einem ungeheuren Informations… [+3923 chars],,de,'Gas'
https://www.stern.de/gesellschaft/regional/niedersachsen-bremen/gas--speicher-rehden-gibt-nach-verpuffung-wieder-gas-ans-netz-ab--33163102.html,https://www.stern.de/gesellschaft/regional/niedersachsen-bremen/gas--speicher-rehden-gibt-nach-verpuffung-wieder-gas-ans-netz-ab--33163102.html,0,www.stern.de,Gas: Speicher Rehden gibt nach Verpuffung wieder Gas ans Netz ab,"Nach einer Verpuffung gibt Deutschlands größter Gasspeicher im niedersächsischen Rehden wieder Gas an das Netz ab. Der Betrieb wurde planmäßig am Freitag um 6.00 Uhr wieder aufgenommen, wie der Betreiber Astora am Freitag bestätigte. Aufgrund eines technische…",https://image.stern.de/33163104/t/t-/v1/w1440/r1.7778/-/03--urnnewsmldpacom2009010123020399459996v3w800h600l691t51r1377b975jpeg---a173cb5bfe0cbfa8.jpg,2023-02-03T08:28:37Z,,"Nach einer Verpuffung gibt Deutschlands größter Gasspeicher im niedersächsischen Rehden wieder Gas an das Netz ab. Der Betrieb wurde planmäßig am Freitag um 6.00 Uhr wieder aufgenommen, wie der Betre… [+1213 chars]",,de,'Gas'
https://www.stern.de/panorama/wissen/alkohol-koenne-ausloeser-fuer-mindestens-sieben-krebsarten-sein---experte-warnt-33160692.html,https://www.stern.de/panorama/wissen/alkohol-koenne-ausloeser-fuer-mindestens-sieben-krebsarten-sein---experte-warnt-33160692.html,0,www.stern.de,"Mediziner über neue Erkenntnisse: ""Wer auf Alkohol verzichtet, reduziert sein Krebsrisiko dramatisch"" – wie viel zu viel ist","Eine kanadische Regierungskommission hat untersucht, wie schädlich Alkohol ist. Ihr Fazit: Die Wirkung von Wein, Bier und Co. wird seit Jahren unterschätzt. Peter Butt, Mediziner und Vorsitzender der Kommission, erklärt im Interview, woran das liegt. Und was …",https://image.stern.de/33160696/t/X_/v5/w1440/r1.7778/-/alkohol.jpg,2023-02-03T08:59:00Z,,"Herr Butt, Sie haben sich intensiv mit der Frage beschäftigt, wie Alkohol auf den menschlichen Körper wirkt. Dafür haben Sie in einem großen Team zahlreiche Studien ausgewertet und bewertet. Was ist … [+287 chars]",,de,'Wein'
https://www.sueddeutsche.de/wirtschaft/energiekrise-buero-banken-decken-westen-1.5744808,https://www.sueddeutsche.de/wirtschaft/energiekrise-buero-banken-decken-westen-1.5744808,0,www.sueddeutsche.de,Energiekrise: Wenn Banker bibbern,"Staatliche Banken verteilen warme Westen und Kuscheldecken an frierende Mitarbeitende. Hauptsache, die drehen die Heizung nicht hoch.",https://www.sueddeutsche.de/image/sz.1.5744836/1200x675?v=1675438816,2023-02-03T14:47:30Z,http://archive.md/20230203155628/https://www.sueddeutsche.de/wirtschaft/energiekrise-buero-banken-decken-westen-1.5744808,"Staatliche Banken verteilen warme Westen und Kuscheldecken an frierende Mitarbeitende. Hauptsache, die drehen die Heizung nicht hoch.Wer in einem staatlichen Gebäude arbeitet oder zu Gast ist, weiß e… [+3499 chars]",,de,'Kälte'
https://www.focus.de/reisen/urlaubs-check/badeziele-im-februar-das-sind-die-schoensten-strandziele-mitten-im-winter_id_183911972.html,https://www.focus.de/reisen/urlaubs-check/badeziele-im-februar-das-sind-die-schoensten-strandziele-mitten-im-winter_id_183911972.html,0,www.focus.de,"Baden im Februar - Die fünf besten Reiseziele, um dem Winter zu entfliehen","Keine Lust mehr auf Schnee, Eis und Kälte? Dann ganz schnell ab in wärmere Gefilde! Wir stellen fünf Urlaubsziele vor, an denen das Thermometer mindestens 30 Grad anzeigt und Sie Sonne, Strand und Meer in vollen Zügen genießen können.Von FOCUS-online-Autorin …",https://p6.focus.de/img/fotos/id_183913289/gettyimages-83629122.jpg?im=Crop%3D%280%2C0%2C2148%2C1073%29%3BResize%3D%281200%2C627%29&impolicy=perceptual&quality=medium&hash=2c0321c47261e4e41b9686cc034d178ada5179f1b893de086cb4519eba7ad96f,2023-02-03T15:52:07Z,https://web.archive.org/web/20230204001347/https://www.focus.de/reisen/urlaubs-check/badeziele-im-februar-das-sind-die-schoensten-strandziele-mitten-im-winter_id_183911972.html,"Keine Lust mehr auf Schnee, Eis und Kälte? Dann ganz schnell ab in wärmere Gefilde! Wir stellen fünf Urlaubsziele vor, an denen das Thermometer mindestens 30 Grad anzeigt und Sie Sonne, Strand und Me… [+6745 chars]",,de,'Schnee'
https://www.bild.de/news/wetter/wetter/regenwetter-in-deutschland-was-macht-eigentlich-die-duerre-82777874.bild.html,https://www.bild.de/news/wetter/wetter/regenwetter-in-deutschland-was-macht-eigentlich-die-duerre-82777874.bild.html,0,www.bild.de,Regenwetter in Deutschland - Was macht eigentlich die Dürre?,Deutschland ist pitschnass: Seit Tagen regnet und regnet es. Was macht da eigentlich die Dürre in Deutschland? Nach den starken Regenfällen in den vergan...,"https://images.bild.de/63dcdd6e1c6acc32ccdd11b8/729171e9f1b25bf51674cf87de58c7af,97d46e9c?w=1280",2023-02-03T17:33:48Z,https://web.archive.org/web/20230203235653/https://www.bild.de/news/wetter/wetter/regenwetter-in-deutschland-was-macht-eigentlich-die-duerre-82777874.bild.html,"Deutschland ist pitschnass: Seit Tagen regnet und regnet es. Was macht da eigentlich die Dürre in Deutschland?
Nach den starken Regenfällen in den vergangenen Tagen sind einige Flüsse im Norden Baye… [+2572 chars]",,de,'Dürre'
https://www.stern.de/sport/weltcup-in-willingen--windspringen-mit-irrem-161-meter-flug--deutsche-dritte-33165248.html,https://www.stern.de/sport/weltcup-in-willingen--windspringen-mit-irrem-161-meter-flug--deutsche-dritte-33165248.html,0,www.stern.de,Weltcup in Willingen: Windspringen mit irrem 161-Meter-Flug: Deutsche Dritte,Bei diesem Wind wird Skispringen zur reinen Lotterie. Die Organisatoren drücken in Willingen einen Durchgang durch - und brechen dann ab. Für das deutsche Mixed-Team geht es immerhin aufs Podium.,https://image.stern.de/33165250/t/wS/v1/w1440/r1.7778/-/03--urnnewsmldpacom2009010123020399467168v2w800h600l1020t372r3020b1705jpeg---45d7e91a6fe9f288.jpg,2023-02-03T17:34:23Z,,"Bei diesem Wind wird Skispringen zur reinen Lotterie. Die Organisatoren drücken in Willingen einen Durchgang durch - und brechen dann ab. Für das deutsche Mixed-Team geht es immerhin aufs Podium.
Vo… [+3401 chars]",,de,'Wind'
https://www.tagesspiegel.de/berlin/zwischen-kuchen-und-wohnungsbau-im-berliner-hofbrauhaus-diskutieren-abgeordnete-mit-obdachlosen-9275046.html,https://www.tagesspiegel.de/berlin/zwischen-kuchen-und-wohnungsbau-im-berliner-hofbrauhaus-diskutieren-abgeordnete-mit-obdachlosen-9275046.html,0,www.tagesspiegel.de,Zwischen Kuchen und Wohnungsbau: Im Berliner Hofbräuhaus diskutieren Abgeordnete mit Obdachlosen,"Die CDU will eine Steuer für Spekulanten, die FDP weniger Bürokratie für den Kältebus: Bei einer Veranstaltung in Mitte kamen Politik und Armutsbetroffene zusammen.",https://www.tagesspiegel.de/images/wohnungslosigkeit-in-deutschland1/alternates/BASE_16_9_W1400/wohnungslosigkeit-in-deutschland.jpeg,2023-02-03T17:39:19Z,https://web.archive.org/web/20230204000354/https://www.tagesspiegel.de/berlin/zwischen-kuchen-und-wohnungsbau-im-berliner-hofbrauhaus-diskutieren-abgeordnete-mit-obdachlosen-9275046.html,"Aus dem hinteren Teil des Berliner Hofbräuhauses ertönen Stimmen. In der gemütlichen Atmosphäre des bayerischen Hauses könnte man meinen, es sei ein freundlicher Kaffeeklatsch. Doch hier werden die K… [+4928 chars]",,de,'Kältebus'
https://www.welt.de/sport/article243593997/Skispringen-in-Willingen-Sturz-und-Abbruch-nach-abstrusem-Sprung-auf-161-5-Meter.html,https://www.welt.de/sport/article243593997/Skispringen-in-Willingen-Sturz-und-Abbruch-nach-abstrusem-Sprung-auf-161-5-Meter.html,0,www.welt.de,"Sturz und Abbruch nach abstrusem Sprung auf 161,5 Meter","Beim Weltcup in Willingen wurde das Skispringen zur reinen Lotterie. Trotz extremer Winde drücken die Organisatoren einen Durchgang durch. Erst als es zu Stürzen kommt, wird der bizarre Wettkampf abgebrochen.",https://img.welt.de/img/sport/mobile243594109/7591354177-ci16x9-w1200/SKI-JUMPING-WORLD-GER.jpg,2023-02-03T18:13:55Z,,"Vorzeitiger Abbruch auf der Schanze, Risikospiel für die Athleten und eine harte Probe für die rund 10.000 in der Kälte wartenden Fans: Mieses Wetter und heftiger Wind haben den ersten Wettkampftag b… [+3125 chars]",,de,'Wind'
https://orf.at/stories/3303507/,https://orf.at/stories/3303507/,0,orf.at,"Unklar, wohin die Reise geht",Die Semesterferien stehen vor der Tür – und Österreichs Skigebiete können mit Blick auf Schnee- und Buchungslage vorerst aufatmen. Nach den österreichweit aperen Skigebieten in den letzten Monaten dürften die kommenden Wochen viel Schnee bringen. Trotz des Ne…,https://ibs.orf.at/news?image=https%3A%2F%2Fassets.orf.at%2Fmims%2F2023%2F05%2F85%2Fcrops%2Fw%3D1200%2Ch%3D630%2Cq%3D75%2F1661289_master_611285_klima_skifahren_semesterferien_schnee_afp.jpg%3Fs%3D82427945c24cdcdd595e77e4015e353451ff4491,2023-02-03T22:02:24Z,,"Im Tourismus ist die heurige Wintersaison bisher vom Schneemangel im Jänner beeinträchtigt. Die Branche hofft auf einen starken Februar, den dank Semesterferien traditionell umsatzstärksten Monat der… [+9158 chars]",,de,'Kälte'
https://www.stern.de/panorama/kiew--zoo-mitarbeiter-kaempfen-gegen-kaeltetod-ihrer-tiere-33156914.html,https://www.stern.de/panorama/kiew--zoo-mitarbeiter-kaempfen-gegen-kaeltetod-ihrer-tiere-33156914.html,0,www.stern.de,Angst vor Kältetod: Mitarbeiter im Zoo Kiew kämpfen um Wärme für ihre Tiere – und bekommen Spenden aus Berlin,Strom und Heizung fallen durch russische Angriffe auf die Infrastruktur der ukrainischen Hauptstadt Kiew immer wieder aus. Darunter leiden auch die Tiere im Zoo. Nun hat der Zoo dank Spenden aus Berlin mehr Generatoren und Futtermittel.,https://image.stern.de/33156916/t/Wr/v3/w1440/r1.7778/-/01-licht-und-waerme-fuer-den-kiewer-zoo-6319592866112-1.jpg,2023-02-04T07:18:00Z,,Sehen Sie im Video: Mitarbeiter im Zoo Kiew kämpfen um Wärme für ihre Tiere und bekommen Spenden aus Berlin.Tony kann Kälte nicht ausstehen - so wie wohl die meisten Menschenaffen. Das Problem: Der 4… [+2768 chars],,de,'Kälte'
https://www.morgenpost.de/vermischtes/article237546823/Toter-unter-Lawine-in-Oesterreich-gefunden.html,https://www.morgenpost.de/vermischtes/article237546823/Toter-unter-Lawine-in-Oesterreich-gefunden.html,0,www.morgenpost.de,Unfälle: Toter unter Lawine in Österreich gefunden,Im gesamten Alpenraum herrscht nach ergiebigen Schneefällen erhöhte Lawinengefahr. In Österreich starb ein Mann unter den Schneemassen.,https://img.morgenpost.de/img/vermischtes/crop237546821/9472608408-w820-cv16_9-q85/Grosse-Lawinengefahr-in-OEsterreich.jpg,2023-02-04T11:39:52Z,,Innsbruck. In Österreich ist am Samstag ein Mann tot unter einer Lawine gefunden worden. Nach dem Vermissten im Kleinwalsertal war nach Angaben der Polizei seit Freitagabend gesucht worden. Vor allem… [+845 chars],,de,'Wind'
https://www.stern.de/reise/europa/sonne-satt-statt-eisige-kaelte--neun-sonnige-reiseziele-in-europa-fuer-die-winterzeit-33147424.html,https://www.stern.de/reise/europa/sonne-satt-statt-eisige-kaelte--neun-sonnige-reiseziele-in-europa-fuer-die-winterzeit-33147424.html,0,www.stern.de,Raus aus dem Winterblues: Sonne satt statt eisige Kälte: Sonnige Reiseziele in Europa für die Winterzeit,"Es ist kalt, nass und dunkel draußen. Höchste Zeit also für eine Auszeit in der Sonne. Dafür brauchen Sie nicht einmal weit reisen – auch in Europa gibt es sonnenreiche Reiseziele für die Wintermonate.",https://image.stern.de/33147450/t/nL/v6/w1440/r1.7778/-/thodos.jpg,2023-02-04T12:34:00Z,,"Keine Lust mehr auf Regen, Wind und Temperaturen weit unter 10 Grad Celsius? Dann Koffer packen und ab in den Süden! So richtig weit müssen wir für die Winterflucht nicht einmal reisen. Auch in Europ… [+951 chars]",,de,'Kälte'
