index,url,valid,domain,title,description,image,published,archive,content,quote,language,keyword
https://www.businessinsider.de/gruenderszene/im-winter-steht-man-da-und-weiss-nicht-ob-der-bus-kommt/,https://www.businessinsider.de/gruenderszene/im-winter-steht-man-da-und-weiss-nicht-ob-der-bus-kommt/,0,www.businessinsider.de,"Milliarden für Mobilität – und im Winter steht man da und weiß nicht, ob der Bus kommt",Der Frust mit dem ÖPNV entsteht oft direkt an der Haltestelle. Aber eine Lösung wäre einfach und technisch nicht mal aufwendig.,https://cdn.businessinsider.de/wp-content/uploads/2026/01/571960817.jpg?ver=1770030092,2026-02-02T11:03:58Z,,Der Frust mit dem ÖPNV entsteht oft direkt an der Haltestelle. Aber eine Lösung wäre einfach und technisch nicht mal aufwendig.Der Winter ist keine gute Zeit für den ÖPNV. Das Problem ist aber nicht … [+3655 chars],,de,'ÖPNV'
https://stadt-bremerhaven.de/itsyhome-open-source-tool-bringt-apple-home-in-die-macos-menueleiste/,https://stadt-bremerhaven.de/itsyhome-open-source-tool-bringt-apple-home-in-die-macos-menueleiste/,0,stadt-bremerhaven.de,Itsyhome: Open-Source-Tool bringt Apple Home in die macOS-Menüleiste,"Wer am Mac arbeitet und mal eben das Licht dimmen oder die Heizung regeln möchte, muss nicht zwangsläufig die große Home-App von Apple öffnen. Mit Itsyhome steht eine schlanke Lösung parat, die sich direkt in der Menüleiste von macOS einnistet....Zum Beitrag:…",https://stadt-bremerhaven.de/wp-content/uploads/2026/02/itsyhome-screenshot-2.jpg,2026-02-02T12:00:03Z,,"Wer am Mac arbeitet und mal eben das Licht dimmen oder die Heizung regeln möchte, muss nicht zwangsläufig die große Home-App von Apple öffnen. Mit Itsyhome steht eine schlanke Lösung parat, die sich … [+2897 chars]",,de,'Heizung'
https://www.zeit.de/news/2026-02/02/geschaeft-von-bosch-heizungstochter-stagniert,https://www.zeit.de/news/2026-02/02/geschaeft-von-bosch-heizungstochter-stagniert,0,www.zeit.de,"Heizung, Lüftung und Klima: Geschäft von Bosch-Heizungstochter stagniert","Hier finden Sie Informationen zu dem Thema „Heizung, Lüftung und Klima“. Lesen Sie jetzt „Geschäft von Bosch-Heizungstochter stagniert“.",https://img.zeit.de/news/2026-02/02/geschaeft-von-bosch-heizungstochter-stagniert-image-group/wide__1300x731,2026-02-02T13:17:27Z,,"Schwächelnde Märkte haben die Gebäudetechnik-Tochter von Bosch im vergangenen Jahr ausgebremst. Der Umsatz lag nach vorläufigen Zahlen bei rund 4,4 Milliarden Euro und damit leicht über dem Vorjahres… [+2022 chars]",,de,'Heizung'
https://www.stern.de/gesellschaft/regional/baden-wuerttemberg/heizung--lueftung-und-klima--geschaeft-von-bosch-heizungstochter-stagniert-37099032.html,https://www.stern.de/gesellschaft/regional/baden-wuerttemberg/heizung--lueftung-und-klima--geschaeft-von-bosch-heizungstochter-stagniert-37099032.html,0,www.stern.de,"Heizung, Lüftung und Klima: Geschäft von Bosch-Heizungstochter stagniert","Viele Menschen halten gerade ihr Geld zusammen - und investieren nicht in eine neue Heizung. In Deutschland, aber auch in anderen Märkten. Das bekommt Bosch zu spüren. Wann geht es wieder aufwärts?",https://image.stern.de/37099034/t/nw/v1/w1440/r1.7778/-/02--ko6fib2b2kv6axs2048jpeg---b2443fb9626df951.jpg,2026-02-02T13:17:27Z,,"Kopiere den aktuellen Link
Zur Merkliste hinzufügen
Viele Menschen halten gerade ihr Geld zusammen - und investieren nicht in eine neue Heizung. In Deutschland, aber auch in anderen Märkten. Das be… [+2235 chars]",,de,'Heizung'
https://www.welt.de/politik/ausland/video6980aaad78c88161f9da4a5d/ukraine-in-not-meine-haende-werden-taub-genauso-die-beine-kampf-gegen-die-eiseskaelte-und-russlands-angriffe.html,https://www.welt.de/politik/ausland/video6980aaad78c88161f9da4a5d/ukraine-in-not-meine-haende-werden-taub-genauso-die-beine-kampf-gegen-die-eiseskaelte-und-russlands-angriffe.html,0,www.welt.de,"„Meine Hände werden taub, genauso die Beine“ – Kampf gegen die Eiseskälte und Russlands Angriffe",Russland greift weiter gezielt die Energieinfrastruktur der Ukraine an. In Kiew müssen Tausende bei minus 15 Grad ohne Strom und Heizung ausharren. WELT-Reporter Ibrahim Naber berichtet über die kritische Lage im Land.,https://images.welt.de/6980aaad78c88161f9da4a5d/6e4a8a2b778f6f90b7c6e1e929070bb3-master/ci16x9-w1200/dpa-com-20090101-260130-99-338568-jpg,2026-02-02T14:00:46Z,,Die WELT als ePaper: Die vollständige Ausgabe steht Ihnen bereits am Vorabend zur Verfügung so sind Sie immer hochaktuell informiert. Weitere Informationen https://epaper.welt.de,,de,'Heizung'
https://www.welt.de/politik/ausland/video6980ab1678c88161f9da4a7f/tausende-ohne-strom-russland-will-die-ukraine-in-den-totalen-blackout-bomben.html,https://www.welt.de/politik/ausland/video6980ab1678c88161f9da4a7f/tausende-ohne-strom-russland-will-die-ukraine-in-den-totalen-blackout-bomben.html,0,www.welt.de,„Russland will die Ukraine in den totalen Blackout bomben“,"In Kiew hält die Waffenruhe bislang, doch ab Freitag drohen neue russische Angriffe auf die Energieversorgung. Tausende sind weiterhin ohne Strom und Heizung. „Für die Menschen hier ist das eine Qual“, so WELT-Reporter Ibrahim Naber aus Kiew.",https://images.welt.de/6980ab1678c88161f9da4a7f/c2ebcbc906f3746a56f517d9f6f86c50/ci16x9-w1200/naber-png,2026-02-02T14:13:00Z,,"In Kiew hält die Waffenruhe bislang, doch ab Freitag drohen neue russische Angriffe auf die Energieversorgung. Tausende sind weiterhin ohne Strom und Heizung. Für die Menschen hier ist das eine Qual,… [+100 chars]",,de,'Heizung'
https://taz.de/Wirksame-OePNV-Warnstreiks-Tote-Hose-an-den-Haltestellen/!6150533/,https://taz.de/Wirksame-OePNV-Warnstreiks-Tote-Hose-an-den-Haltestellen/!6150533/,0,taz.de,Wirksame Verdi-Warnstreiks im ÖPNV: Tote Hose an den Haltestellen,Bundesweit stand am Montag der Nahverkehr fast still. Verdi rief Beschäftigte zum Warnstreik auf und fordert bessere Arbeitsbedingungen.,https://taz.de/picture/8224606/1200/40280832.jpeg,2026-02-02T18:16:00Z,,Bundesweit stand am Montag der Nahverkehr fast still. Verdi rief Beschäftigte zum Warnstreik auf und fordert bessere Arbeitsbedingungen. mehr...,,de,'ÖPNV'
https://www.zeit.de/news/2026-02/03/glatteisgefahr-im-westen-eisige-kaelte-im-osten,https://www.zeit.de/news/2026-02/03/glatteisgefahr-im-westen-eisige-kaelte-im-osten,0,www.zeit.de,Wetter: Glatteisgefahr im Westen - eisige Kälte im Osten,Hier finden Sie Informationen zu dem Thema „Wetter“. Lesen Sie jetzt „Glatteisgefahr im Westen - eisige Kälte im Osten“.,https://img.zeit.de/news/2026-02/03/glatteisgefahr-im-westen-eisige-kaelte-im-osten-image-group/wide__1300x731,2026-02-03T03:41:42Z,,"Während die Menschen im Osten und Nordosten mit den eisigen Temperaturen zu kämpfen haben, droht im Westen und Südwesten Deutschlands zur Wochenmitte neue Glatteisgefahr. Am Dienstag fällt dort laut … [+2939 chars]",,de,'Wind'
https://www.zeit.de/news/2026-02/03/glatte-strassen-moeglich-neuer-schnee-zieht-heran,https://www.zeit.de/news/2026-02/03/glatte-strassen-moeglich-neuer-schnee-zieht-heran,0,www.zeit.de,Wetter-Vorhersage: Glatte Straßen möglich - neuer Schnee zieht heran,Hier finden Sie Informationen zu dem Thema „Wetter-Vorhersage“. Lesen Sie jetzt „Glatte Straßen möglich - neuer Schnee zieht heran“.,https://img.zeit.de/news/2026-02/03/glatte-strassen-moeglich-neuer-schnee-zieht-heran-image-group/wide__1300x731,2026-02-03T06:04:54Z,,"Verkehrsteilnehmer müssen heute Morgen mit Glätte auf Straßen und Wegen rechnen. Dies trete örtlich durch überfrierende Nässe, vereinzelt auch durch Reif auf, teilt der Deutsche Wetterdienst (DWD) in… [+1147 chars]",,de,'Schnee'
https://www.bild.de/news/zu-viel-schnee-frankfurter-flughafen-stellt-betrieb-ein-69820a6506b45afdb339c094,https://www.bild.de/news/zu-viel-schnee-frankfurter-flughafen-stellt-betrieb-ein-69820a6506b45afdb339c094,0,www.bild.de,Zu viel Schnee! - Frankfurter Flughafen stellt Betrieb ein,Am Frankfurter Flughafen ist der Flugverkehr vorübergehend eingestellt worden.,"https://images.bild.de/69820a6506b45afdb339c094/06ec1b758d1e3f2c106fb4c52bf782ad,38b42761?w=1280",2026-02-03T14:48:45Z,,TTS-Player überspringenArtikel weiterlesenFrankfurt Am Frankfurter Flughafen ist der Flugverkehr wegen des starken Schneefalls vorübergehend eingestellt worden. Das teilte die Fraport AG als Betreibe… [+918 chars],,de,'Schnee'
https://www.zeit.de/news/2026-02/03/schnee-am-frankfurter-airport-flieger-landen-in-stuttgart,https://www.zeit.de/news/2026-02/03/schnee-am-frankfurter-airport-flieger-landen-in-stuttgart,0,www.zeit.de,Winterwetter: Schnee am Frankfurter Airport - Flieger landen in Stuttgart,Hier finden Sie Informationen zu dem Thema „Winterwetter“. Lesen Sie jetzt „Schnee am Frankfurter Airport - Flieger landen in Stuttgart“.,https://img.zeit.de/news/2026-02/03/schnee-am-frankfurter-airport-flieger-landen-in-stuttgart-image-group/wide__1300x731,2026-02-03T14:54:21Z,,"Wegen Schneefalls am Frankfurter Flughafen sind mehrere Flugzeuge nach Stuttgart umgeleitet worden. Zehn Maschinen seien am Stuttgarter Airport gelandet, sagte eine Sprecherin. Ob und wie viele weite… [+921 chars]",,de,'Schnee'
https://www.stern.de/gesellschaft/regional/hamburg-schleswig-holstein/wetterbedingte-absage--termin-gefunden--towers-gegen-trier-am-22--maerz-37102946.html,https://www.stern.de/gesellschaft/regional/hamburg-schleswig-holstein/wetterbedingte-absage--termin-gefunden--towers-gegen-trier-am-22--maerz-37102946.html,0,www.stern.de,Wetterbedingte Absage: Termin gefunden: Towers gegen Trier am 22. März,Schnee und Eis haben Anfang Januar den Norden Deutschlands beherrscht. Ein Spiel der Basketball-Bundesliga ist ausgefallen. Ende März wird es nachgeholt.,https://image.stern.de/37102948/t/Vy/v1/w1440/r1.7778/-/03--emhhnz4mcuv1axs2048jpeg---3aa61894901f5616.jpg,2026-02-03T14:57:23Z,,"Kopiere den aktuellen Link
Zur Merkliste hinzufügen
Schnee und Eis haben Anfang Januar den Norden Deutschlands beherrscht. Ein Spiel der Basketball-Bundesliga ist ausgefallen. Ende März wird es nac… [+452 chars]",,de,'Schnee'
https://www.welt.de/vermischtes/article69820ca76f72c99c11b1a97e/winterwetter-zu-viel-schnee-betrieb-am-frankfurter-flughafen-eingestellt.html,https://www.welt.de/vermischtes/article69820ca76f72c99c11b1a97e/winterwetter-zu-viel-schnee-betrieb-am-frankfurter-flughafen-eingestellt.html,0,www.welt.de,Zu viel Schnee – Betrieb am Frankfurter Flughafen eingestellt,Eine Schneedecke auf Start- und Landebahnen hat den Flugbetrieb am Frankfurter Flughafen vorübergehend zum Erliegen gebracht. Einzelne Maschinen wurden nach Stuttgart umgeleitet.,https://images.welt.de/69820ca76f72c99c11b1a97e/c6717f866060ad90111518fc6adcbacc-master/ci16x9-w1200/dpa-com-20090101-260203-935-1125795-jpg,2026-02-03T14:59:06Z,,Eine Schneedecke auf Start- und Landebahnen hat den Flugbetrieb am Frankfurter Flughafen vorübergehend zum Erliegen gebracht. Einzelne Maschinen wurden nach Stuttgart umgeleitet.Am Frankfurter Flugha… [+1475 chars],,de,'Schnee'
https://www.welt.de/vermischtes/article69820ca76f72c99c11b1a97e/winterwetter-frankfurter-flughafen-stellt-betrieb-wegen-schnee-voruebergehend-ein.html,https://www.welt.de/vermischtes/article69820ca76f72c99c11b1a97e/winterwetter-frankfurter-flughafen-stellt-betrieb-wegen-schnee-voruebergehend-ein.html,0,www.welt.de,Frankfurter Flughafen stellt Betrieb wegen Schnee vorübergehend ein,Eine Schneedecke auf Start- und Landebahnen hat den Flugbetrieb am Frankfurter Flughafen vorübergehend zum Erliegen gebracht. Einzelne Maschinen wurden nach Stuttgart umgeleitet. Inzwischen sind Landungen wieder möglich.,https://images.welt.de/69820ca76f72c99c11b1a97e/fc71aa35b1f3f9e171aee034a72fbf97/ci16x9-w1200/dpa-com-20090101-260203-935-1125795-jpg,2026-02-03T14:59:06Z,,Wegen starken Schneefalls ist der Flugbetrieb an Deutschlands größtem Airport am Dienstag zeitweilig lahmgelegt gewesen. Am Nachmittag starteten die ersten Maschinen wieder. Das teilte der Flughafenb… [+1258 chars],,de,'Schnee'
https://www.morgenpost.de/panorama/article411108054/zu-viel-schnee-frankfurter-flughafen-stellt-betrieb-ein.html,https://www.morgenpost.de/panorama/article411108054/zu-viel-schnee-frankfurter-flughafen-stellt-betrieb-ein.html,0,www.morgenpost.de,Zu viel Schnee: Frankfurter Flughafen stellt Betrieb ein,An Deutschlands größtem Airport startet oder landet derzeit kein Flugzeug. Grund dafür ist starker Schneefall. Wie lange das vorussichtlich so bleibt.,https://img.sparknews.funkemedien.de/411108076/411108076_1770131142_v16_9_1600.jpeg,2026-02-03T15:05:42Z,,Am Frankfurter Flughafen ist der Flugverkehr wegen des starken Schneefalls vorübergehend eingestellt worden. Das teilte die Fraport AG als Betreiber von Deutschlands größtem Flughafen mit. Seit etwa … [+535 chars],,de,'Schnee'
https://www.stern.de/gesellschaft/regional/sachsen-anhalt/tierisches--perfektes--draussenwetter--fuer-sibirische-tiger-in-magdeburg-37103034.html,https://www.stern.de/gesellschaft/regional/sachsen-anhalt/tierisches--perfektes--draussenwetter--fuer-sibirische-tiger-in-magdeburg-37103034.html,0,www.stern.de,"Tierisches: Perfektes ""Draußenwetter"" für Sibirische Tiger in Magdeburg","Zootiere, die Eis, Schnee und Kälte mögen, kommen gerade voll auf ihre Kosten. Ebenso Besucherinnen und Besucher, die sie gerade jetzt oft draußen erleben können. So wie aktuell in Magdeburg.",https://image.stern.de/37103036/t/3C/v1/w1440/r1.7778/-/03--fih47ikfmtv8axs2048jpeg---fdf3b586c96b68a7.jpg,2026-02-03T15:06:36Z,,"Kopiere den aktuellen Link
Zur Merkliste hinzufügen
Zootiere, die Eis, Schnee und Kälte mögen, kommen gerade voll auf ihre Kosten. Ebenso Besucherinnen und Besucher, die sie gerade jetzt oft drauße… [+918 chars]",,de,'Kälte'
https://www.stern.de/panorama/weltgeschehen/wetter--bis-zu-4-5-meter-hoch---japan-versinkt-unter-xxl-schneemassen-37102364.html,https://www.stern.de/panorama/weltgeschehen/wetter--bis-zu-4-5-meter-hoch---japan-versinkt-unter-xxl-schneemassen-37102364.html,0,www.stern.de,"Armee im Einsatz: Bis zu 4,5 Meter hoch – Japan versinkt unter XXL-Schneemassen","Heftige Schneefälle sorgen in Japan für Chaos. In Aomori liegen bis zu 4,5 Meter Schnee. Der Gouverneur fordert die Armee zur Katastrophenhilfe an, um beim Schneeräumen zu helfen.",https://image.stern.de/37102812/t/7q/v2/w1440/r1.7778/-/schneemassen-in-japan.jpg,2026-02-03T15:13:00Z,,"Zugang zu stern+statt 11,96 
 nur 1  
<ul><li>Alles von stern+ mit erstklassigen Inhalten von GEO und Capital</li><li>4 Wochen testen, dann 2,99  je Woche</li><li>jederzeit kündbar</li></ul>",,de,'Schnee'
https://www.faz.net/aktuell/rhein-main/region-und-hessen/wegen-schneefalls-flugausfaelle-und-staus-in-frankfurt-und-hessen-200503112.html,https://www.faz.net/aktuell/rhein-main/region-und-hessen/wegen-schneefalls-flugausfaelle-und-staus-in-frankfurt-und-hessen-200503112.html,0,www.faz.net,Flughafen Frankfurt: Flugausfälle und Staus wegen Schneefalls,"Wegen anhaltenden Schneefalls steht der Verkehr in weiten Teilen Hessens still. Auf den Autobahnen staut sich der Verkehr, der Busverkehr ist vielerorts eingestellt, und auch Flugzeuge können nicht starten.",https://media0.faz.net/image/w1200h627/53f7e7cce903/w5587h2919x0y332o/202602/43601.0.1731620938/nichts-geht-mehr-nach-starkem.webp,2026-02-03T15:18:13Z,,"Diesmal hat sich die Warnung des Deutschen Wetterdienstes erfüllt: In ganz Hessen herrscht am Dienstagnachmittag dichtes Schneetreiben, und es geht wegen Schnee und Eisglätte auf den Straßen und Schi… [+1332 chars]",,de,'Schnee'
https://www.stern.de/panorama/wetter/wetter-heute--schnee-und-eis---dwd-warnt-vor-unwetter-37103098.html,https://www.stern.de/panorama/wetter/wetter-heute--schnee-und-eis---dwd-warnt-vor-unwetter-37103098.html,0,www.stern.de,Vorhersage: Eis und starker Schneefall – DWD warnt vor Unwetter,"Gibt es Schnee, Regenschauer oder Sonnenschein? Der stern verrät Ihnen, wie das Wetter heute bei Ihnen im Ort wird – mit der offiziellen Vorhersage und interaktiven Karten.",https://image.stern.de/37103160/t/bd/v1/w1440/r1.7778/-/wetter-schnee-eis.jpg,2026-02-03T15:29:00Z,,"Kopiere den aktuellen Link
Zur Merkliste hinzufügen
Gibt es Schnee, Regenschauer oder Sonnenschein? Der stern verrät Ihnen, wie das Wetter heute bei Ihnen im Ort wird mit der offiziellen Vorhersage… [+2881 chars]",,de,'Schnee'
https://www.welt.de/sport/article6981e5fb74ddb16e1a83cd34/olympia-2026-ich-bin-bereit-ich-lasse-mir-das-nicht-nehmen-skikoenigin-vonn-startet-mit-kreuzbandriss.html,https://www.welt.de/sport/article6981e5fb74ddb16e1a83cd34/olympia-2026-ich-bin-bereit-ich-lasse-mir-das-nicht-nehmen-skikoenigin-vonn-startet-mit-kreuzbandriss.html,0,www.welt.de,"„Ich bin bereit, ich lasse das mir nicht nehmen“ – Skikönigin Vonn startet mit Kreuzbandriss","Lindsey Vonn sollte der Star der Olympischen Winterspiele werden. Die US-Amerikanerin elektrisiert die internationale Sportwelt wie keine andere Athletin auf Eis oder Schnee, ihr Comeback mit über 40 ist phänomenal. Dann ein Sturz vor vier Tagen. Jetzt sprich…",https://images.welt.de/6981e5fb74ddb16e1a83cd34/096feaa11168332f18699053502fcfab-master/ci16x9-w1200/apdpa-32b88600e7ea7ec5-jpg,2026-02-03T15:33:38Z,,"Lindsey Vonn sollte der Star der Olympischen Winterspiele werden. Die US-Amerikanerin elektrisiert die internationale Sportwelt wie keine andere Athletin auf Eis oder Schnee, ihr Comeback mit über 40… [+4210 chars]",,de,'Schnee'
https://www.stern.de/gesellschaft/regional/niedersachsen-bremen/bildung--erneut-schulausfaelle-wegen-winterwetters-in-niedersachsen-37103208.html,https://www.stern.de/gesellschaft/regional/niedersachsen-bremen/bildung--erneut-schulausfaelle-wegen-winterwetters-in-niedersachsen-37103208.html,0,www.stern.de,Bildung: Erneut Schulausfälle wegen Winterwetters in Niedersachsen,Wegen Schnee und Glätte sollen die Schülerinnen und Schüler in einigen Landkreisen erneut zu Hause bleiben. Welche Regionen betroffen sind.,https://image.stern.de/37103210/t/nq/v1/w1440/r1.7778/-/03--7clv4fwjikv9axs2048jpeg---15e3f2b5258dbc87.jpg,2026-02-03T15:35:42Z,,"Kopiere den aktuellen Link
Zur Merkliste hinzufügen
Wegen Schnee und Glätte sollen die Schülerinnen und Schüler in einigen Landkreisen erneut zu Hause bleiben. Welche Regionen betroffen sind.
Wege… [+1198 chars]",,de,'Schnee'
https://www.stern.de/panorama/wetter/flughafen-frankfurt-stoppt-flugbetrieb-wegen-zu-viel-schnee-37103086.html,https://www.stern.de/panorama/wetter/flughafen-frankfurt-stoppt-flugbetrieb-wegen-zu-viel-schnee-37103086.html,0,www.stern.de,Winterwetter: Zu viel Schnee: Flughafen Frankfurt stellt Betrieb ein,Wegen heftigen Schneefalls sind am Flughafen Frankfurt weder Starts noch Landungen möglich. Der Flugbetrieb soll aber noch am Nachmittag teilweise wieder anlaufen.,https://image.stern.de/37103146/t/e7/v1/w1440/r1.7778/-/flughafen-frankfurt-enteisung.jpg,2026-02-03T15:41:00Z,,"Kopiere den aktuellen Link
Zur Merkliste hinzufügen
Wegen heftigen Schneefalls sind am Flughafen Frankfurt weder Starts noch Landungen möglich. Der Flugbetrieb soll aber noch am Nachmittag teilweis… [+1106 chars]",,de,'Schnee'
https://www.zeit.de/news/2026-02/04/schnee-und-glatteis-in-teilen-deutschlands-angesagt,https://www.zeit.de/news/2026-02/04/schnee-und-glatteis-in-teilen-deutschlands-angesagt,0,www.zeit.de,Wetter: Schnee und Glatteis in Teilen Deutschlands angesagt,Hier finden Sie Informationen zu dem Thema „Wetter“. Lesen Sie jetzt „Schnee und Glatteis in Teilen Deutschlands angesagt“.,https://img.zeit.de/news/2026-02/04/schnee-und-glatteis-in-teilen-deutschlands-angesagt-image-group/wide__1300x731,2026-02-04T04:04:48Z,,Wegen des Winterwetters müssen sich die Menschen in Teilen Deutschlands am Morgen auf glatte Straßen einstellen. Der Deutsche Wetterdienst hatte für die Nacht stellenweise vor Glätte durch überfriere… [+2095 chars],,de,'Schnee'
https://www.stern.de/panorama/wetter--schnee-und-glatteis-in-teilen-deutschlands-angesagt-37104166.html,https://www.stern.de/panorama/wetter--schnee-und-glatteis-in-teilen-deutschlands-angesagt-37104166.html,0,www.stern.de,Wetter: Schnee und Glatteis in Teilen Deutschlands angesagt,Im Westen und Norden ist mit Glatteis und Schnee zu rechnen. Vor allem in Niedersachsen dürfte es heute für viele wohl alles andere als ein entspannter Morgen werden.,https://image.stern.de/37104168/t/-z/v1/w1440/r1.7778/-/04--teglxod6kdv2axs2048jpeg---6dc18234bf8cf597.jpg,2026-02-04T04:04:48Z,,"Kopiere den aktuellen Link
Zur Merkliste hinzufügen
Im Westen und Norden ist mit Glatteis und Schnee zu rechnen. Vor allem in Niedersachsen dürfte es heute für viele wohl alles andere als ein entsp… [+2277 chars]",,de,'Schnee'
https://www.tagesspiegel.de/gesellschaft/panorama/wetter-schnee-und-glatteis-in-teilen-deutschlands-angesagt-15214849.html,https://www.tagesspiegel.de/gesellschaft/panorama/wetter-schnee-und-glatteis-in-teilen-deutschlands-angesagt-15214849.html,0,www.tagesspiegel.de,Wetter: Schnee und Glatteis in Teilen Deutschlands angesagt,Im Westen und Norden ist mit Glatteis und Schnee zu rechnen. Vor allem in Niedersachsen dürfte es heute für viele wohl alles andere als ein entspannter Morgen werden.,https://www.tagesspiegel.de/images/15214848/alternates/BASE_16_9_W1400/1770177963000/winterwetter-in-niedersachsen-oldenburg.jpeg,2026-02-04T04:06:04Z,,Wegen des Winterwetters müssen sich die Menschen in Teilen Deutschlands am Morgen auf glatte Straßen einstellen. Der Deutsche Wetterdienst hatte für die Nacht stellenweise vor Glätte durch überfriere… [+2153 chars],,de,'Schnee'
https://www.tagesspiegel.de/gesellschaft/panorama/winter-in-deutschland-glatte-und-schnee-unfalle-lange-staus-und-zugausfalle-15214849.html,https://www.tagesspiegel.de/gesellschaft/panorama/winter-in-deutschland-glatte-und-schnee-unfalle-lange-staus-und-zugausfalle-15214849.html,0,www.tagesspiegel.de,"Winter in Deutschland: Glätte und Schnee: Unfälle, lange Staus und Zugausfälle",Der Winter stellt Autofahrer und Fußgänger einmal mehr auf eine Geduldsprobe. Es gibt Unfälle und Ausfälle bei der Bahn. Ein Überblick.,https://www.tagesspiegel.de/images/15215216/alternates/BASE_16_9_W1400/1770195363000/winterwetter.jpeg,2026-02-04T04:06:04Z,,Schnee und spiegelglatte Straßen haben in mehreren Bundesländern zu Unfällen und langen Staus geführt. Mitunter saßen Autofahrer stundenlang fest. Es gab mindestens einen Toten und viele Verletzte. M… [+4222 chars],,de,'Schnee'
https://www.faz.net/aktuell/gesellschaft/ungluecke/unfaelle-und-staus-schnee-und-glatteis-in-teilen-deutschlands-accg-200504458.html,https://www.faz.net/aktuell/gesellschaft/ungluecke/unfaelle-und-staus-schnee-und-glatteis-in-teilen-deutschlands-accg-200504458.html,0,www.faz.net,Winter-Wetter: Schnee und Glatteis in Teilen Deutschlands angesagt,Im Westen und Norden Deutschlands ist mit Glatteis und Schnee zu rechnen. Vor allem in Niedersachsen herrscht bereits Chaos auf den Straßen.,https://media0.faz.net/image/w1200h627/14aee72b71d7/w5031h2628x0y363o/202602/43601.0.1732366419/im-nordwesten-von.webp,2026-02-04T04:13:57Z,,Wegen des Winterwetters müssen sich die Menschen in Teilen Deutschlands am Morgen auf glatte Straßen einstellen. Der Deutsche Wetterdienst hatte für die Nacht stellenweise vor Glätte durch überfriere… [+2037 chars],,de,'Schnee'
https://www.zeit.de/gesellschaft/2026-02/hessen-verkehr-stillstand-stau-winterwetter-schnee,https://www.zeit.de/gesellschaft/2026-02/hessen-verkehr-stillstand-stau-winterwetter-schnee,0,www.zeit.de,Winterwetter: Heftiger Schneefall verursacht Verkehrschaos in Hessen,"Kilometerlange Staus, festgefahrene Lkws: In Mittelhessen steht auf verschneiten Straßen vielerorts der Verkehr still. Die B49 dürfte bis in den Morgen gesperrt bleiben.",https://img.zeit.de/gesellschaft/2026-02/hessen-verkehr-stillstand-stau-winterwetter-schnee-bild/wide__1300x731,2026-02-04T04:29:18Z,,"Nach schweren Schneefällen in der Nacht zum Mittwoch steht in Mittelhessen vielerorts der Verkehr auf Straßen und Autobahnen still. Immer wieder fahren sich Lastwagen im Schnee fest, sagte ein Polize… [+722 chars]",,de,'Schnee'
https://www.zeit.de/news/2026-02/04/schnee-und-glaette-in-berlin-und-brandenburg-erwartet,https://www.zeit.de/news/2026-02/04/schnee-und-glaette-in-berlin-und-brandenburg-erwartet,0,www.zeit.de,Wetter: Schnee und Glätte in Berlin und Brandenburg erwartet,Hier finden Sie Informationen zu dem Thema „Wetter“. Lesen Sie jetzt „Schnee und Glätte in Berlin und Brandenburg erwartet“.,https://img.zeit.de/news/2026-02/04/schnee-und-glaette-in-berlin-und-brandenburg-erwartet-image-group/wide__1300x731,2026-02-04T04:56:16Z,,In Berlin und Brandenburg sind Schnee und Temperaturen über dem Gefrierpunkt in Sicht. Laut Deutschem Wetterdienst (DWD) ist es am Mittwoch stark bewölkt bei Höchsttemperaturen von -6 bis 1 Grad. In … [+578 chars],,de,'Schnee'
https://www.stern.de/gesellschaft/regional/berlin-brandenburg/wetter--schnee-und-glaette-in-berlin-und-brandenburg-erwartet-37104218.html,https://www.stern.de/gesellschaft/regional/berlin-brandenburg/wetter--schnee-und-glaette-in-berlin-und-brandenburg-erwartet-37104218.html,0,www.stern.de,Wetter: Schnee und Glätte in Berlin und Brandenburg erwartet,Mit gefrierendem Regen und Schneefall: Die Straßen dürften in den kommenden Tagen rutschig bleiben. Dafür sind bei den Temperaturen wieder Plusgrade in Aussicht.,https://image.stern.de/37104220/t/ls/v1/w1440/r1.7778/-/04--umv6yokbrdv6axs2048jpeg---4b791164ec451b1f.jpg,2026-02-04T04:56:16Z,,"Kopiere den aktuellen Link
Zur Merkliste hinzufügen
Mit gefrierendem Regen und Schneefall: Die Straßen dürften in den kommenden Tagen rutschig bleiben. Dafür sind bei den Temperaturen wieder Plusgr… [+755 chars]",,de,'Schnee'
