index,url,valid,domain,title,description,image,published,archive,content,quote,language,keyword
https://www.stern.de/gesellschaft/regional/rheinland-pfalz-saarland/verkehr--lob-und-tadel-fuer-deutschlandticket-in-rheinland-pfalz-34675530.html,https://www.stern.de/gesellschaft/regional/rheinland-pfalz-saarland/verkehr--lob-und-tadel-fuer-deutschlandticket-in-rheinland-pfalz-34675530.html,0,www.stern.de,Verkehr: Fahrgastverband: Deutschlandticket löst nicht alle Probleme,Als wichtigen Schritt in die richtige Richtung bezeichnet der Landesverband des Fahrgastverbandes Pro Bahn das Deutschlandticket - und verlangt gleichzeitig ein besseres ÖPNV-Angebot.,https://image.stern.de/34675532/t/rP/v2/w1440/r1.7778/-/01--urnnewsmldpacom2009010124050199874334v2w800h600l1290t851r3870b2560jpeg---09da18702bf1f1f4.jpg,2024-05-01T06:14:53Z,,"Seit einem Jahr macht das Deutschlandticket Fahrten mit Bus und Bahn einfacher und für viele günstiger. Lob kommt vom Fahrgastverband Bahn, aber auch eine Mahnung.
Das vor einem Jahr eingeführte Deu… [+5684 chars]",,de,'ÖPNV'
https://taz.de/Ein-Jahr-Deutschlandticket/!6008085/,https://taz.de/Ein-Jahr-Deutschlandticket/!6008085/,0,taz.de,Ein Jahr Deutschlandticket: Revolution? Schön wär’s!,Das Ticket selbst ist ein Grund zum Feiern. Für einen Erfolg in Sachen Transformation reicht es allein nicht. Dazu ist der ÖPNV zu dürftig ausgebaut.,https://taz.de/picture/6978065/948/35181141-1.jpeg,2024-05-01T15:51:00Z,,"Das Ticket selbst ist ein Grund zum Feiern. Für einen Erfolg in Sachen Transformation reicht es allein nicht. Dazu ist der ÖPNV zu dürftig ausgebaut.
Seit einem Jahr im Umlauf: Das Deutschlandticket… [+2219 chars]",,de,'ÖPNV'
https://ooe.orf.at/stories/3255365/,https://ooe.orf.at/stories/3255365/,0,ooe.orf.at,Bergsteiger tödlich verunglückt,"Tödlich verletzt wurde ein 56-jähriger Linzer am Mittwoch beim Bergsteigen im Bezirk Kirchdorf. Der Mann war 50 Meter über steiles, felsdurchsetztes Gelände abgestürzt. Seine Begleiterin setze den Notruf ab. Für den Mann kam aber jeder Hilfe zu spät.",https://ibs.orf.at/ooe?image=https%3A%2F%2Foekastatic.orf.at%2Fmims%2F2020%2F27%2F20%2Fcrops%2Fw%3D1200%2Ch%3D627%2Cq%3D75%2F605285_master_207220_oebrd-pressefoto-sommer-kfz_2.jpg%3Fs%3D3734f6eac63569835c42bcb7506d4ad72bb526bd,2024-05-01T19:11:25Z,https://web.archive.org/web/20240501193747/https://ooe.orf.at/stories/3255365/,Der Mann war mit einer 46-jährigen Bekannten aus dem Bezirk Linz-Land über die Gowilalm auf den kleinen Pyhrgas gegangen. Unbeabsichtigt waren die beiden auf den sogenannten Bad Haller Steig geraten.… [+513 chars],,de,'Not'
https://www.tagesschau.de/wirtschaft/landwirtschaft-arbeitskraefte-100.html,https://www.tagesschau.de/wirtschaft/landwirtschaft-arbeitskraefte-100.html,0,www.tagesschau.de,Zahl der Arbeitskräfte in der Landwirtschaft gesunken,In landwirtschaftlichen Betrieben sind weniger Mitarbeiterinnen und Mitarbeiter beschäftigt. Die meisten Arbeitskräfte stammen aus dem Familienkreis. Immer mehr Betriebe setzen auf eine zusätzliche Einnahmequelle.,https://images.tagesschau.de/image/e39f80e0-abfc-45ae-b239-f039850c57e1/AAABjz3mG2Y/AAABjwnlFvA/16x9-1280/erdbeerernte-100.jpg,2024-05-03T10:14:21Z,,"Stand: 03.05.2024 12:14 Uhr
In landwirtschaftlichen Betrieben sind weniger Mitarbeiterinnen und Mitarbeiter beschäftigt. Die meisten Arbeitskräfte stammen aus dem Familienkreis. Immer mehr Betriebe … [+3229 chars]",,de,'Landwirtschaft'
