index,url,valid,domain,title,description,image,published,archive,content,quote,language,keyword
https://www.tagesspiegel.de/berlin/einigermassen-gluck-gehabt-schaden-nach-rohrbruch-in-berliner-landesbibliothek-uberschaubar-12123743.html,https://www.tagesspiegel.de/berlin/einigermassen-gluck-gehabt-schaden-nach-rohrbruch-in-berliner-landesbibliothek-uberschaubar-12123743.html,0,www.tagesspiegel.de,„Einigermaßen Glück gehabt“: Schäden nach Rohrbruch in Berliner Landesbibliothek überschaubar,Vor rund drei Wochen lief Wasser in das Magazin der ZLB. Die Institution hatte laut eigenen Angaben dabei Glück im Unglück. Einige Bände sind noch nicht wieder zurück im Haus.,https://www.tagesspiegel.de/images/12123737/alternates/BASE_16_9_W1400/1722491780000/wasser-in-berliner-stadtbibliothek-bestande-in-gefahr.jpeg,2024-08-01T02:02:22Z,,"Die Zentral- und Landesbibliothek (ZLB) in Berlin kann nach dem Wasserschaden im Magazin eigenen Angaben nach wieder etwas aufatmen. Wir haben einigermaßen Glück gehabt, sagte eine Sprecherin der ZLB… [+2026 chars]",,de,'Rohrbruch'
https://www.zeit.de/news/2024-08/01/gas-aus-autos-ausgetreten-grosseinsatz-in-wuerzburg,https://www.zeit.de/news/2024-08/01/gas-aus-autos-ausgetreten-grosseinsatz-in-wuerzburg,0,www.zeit.de,Einsatz in Würzburg: Gas aus Autos ausgetreten - Großeinsatz in Würzburg,Hier finden Sie Informationen zu dem Thema „Einsatz in Würzburg“. Lesen Sie jetzt „Gas aus Autos ausgetreten - Großeinsatz in Würzburg“.,https://img.zeit.de/news/2024-08/01/gas-aus-autos-ausgetreten-grosseinsatz-in-wuerzburg-image-group/wide__1300x731,2024-08-01T05:31:26Z,,"Weil aus einem Auto in einem Innenhof in Würzburg Gas ausgetreten ist, haben mehrere Anwohner über Atemwegsreizungen geklagt. Mindestens 37 Menschen wurden vom Rettungsdienst untersucht. Es sei aber … [+604 chars]",,de,'Gas'
https://www.tagesspiegel.de/wissen/783-aktive-brandherde-mehr-waldbrande-denn-je-im-brasilianischen-amazonas-12124700.html,https://www.tagesspiegel.de/wissen/783-aktive-brandherde-mehr-waldbrande-denn-je-im-brasilianischen-amazonas-12124700.html,0,www.tagesspiegel.de,783 aktive Brandherde: Mehr Waldbrände denn je im brasilianischen Amazonas,Dürre und Brandstiftung sind die Ursachen für die hohe Zahl an Bränden im Herzen des brasilianischen Regenwalds. Schon jetzt läuft es auf einen neuen Jahresrekord hinaus.,https://www.tagesspiegel.de/images/12094427/alternates/BASE_16_9_W1400/1721998175000/waldbrande-in-kanada.jpeg,2024-08-01T08:24:24Z,,"Der brasilianische Teilstaat Amazonas hat im Juli mit insgesamt 4.072 Brandherden einen neuen Monatsrekord aufgestellt, wie Medien am Mittwochabend (Ortszeit) berichteten. Seit Beginn der Messungen d… [+1775 chars]",,de,'Dürre'
https://www.tagesspiegel.de/potsdam/landeshauptstadt/autofreies-leben-in-potsdam-wie-familien-eine-pflegekraft-und-eine-handwerkerin-ihren-alltag-meistern-12075917.html,https://www.tagesspiegel.de/potsdam/landeshauptstadt/autofreies-leben-in-potsdam-wie-familien-eine-pflegekraft-und-eine-handwerkerin-ihren-alltag-meistern-12075917.html,0,www.tagesspiegel.de,"Autofreies Leben in Potsdam: Wie Familien, eine Pflegekraft und eine Handwerkerin ihren Alltag meistern","Potsdam ohne Auto funktioniert sehr gut, finden drei Potsdamer Familien, eine Pflegekraft und eine Handwerkerin. Sie berichten von ihrem Alltag mit Rad, ÖPNV und Carsharing.",https://www.tagesspiegel.de/images/12089144/alternates/BASE_16_9_W1400/1721925983000/potsdam-ohne-auto.jpeg,2024-08-01T11:08:34Z,,"Im Potsdamer Straßenverkehr staut es sich seit der Sommerferienbaustellen noch mehr als üblich. Gelassener bleiben die Potsdamerinnen und Potsdamer, die mit Fahrrad, der Tram oder zu Fuß unterwegs si… [+158 chars]",,de,'ÖPNV'
https://www.tagesspiegel.de/internationales/konigliche-gnade-in-marokko-mohammed-vi-begnadigt-kritische-journalisten-12111350.html,https://www.tagesspiegel.de/internationales/konigliche-gnade-in-marokko-mohammed-vi-begnadigt-kritische-journalisten-12111350.html,0,www.tagesspiegel.de,Königliche Gnade in Marokko: Mohammed VI. begnadigt kritische Journalisten,"Zum 25. Thronjubiläum lässt der Monarch überraschend prominente Regimekritiker frei. Dürre, Inflation und die Beziehungen zu Israel führen im Land zu Spannungen. Will der König so die Zivilgesellschaft befrieden?",https://www.tagesspiegel.de/images/12111410/alternates/BASE_16_9_W1400/1722345210000/morocco-government-media.jpeg,2024-08-01T13:42:14Z,,"Zum 25. Thronjubiläum lässt der Monarch überraschend prominente Regimekritiker frei. Dürre, Inflation und die Beziehungen zu Israel führen im Land zu Spannungen. Will der König so die Zivilgesellscha… [+12 chars]",,de,'Dürre'
https://www.stern.de/gesellschaft/regional/mecklenburg-vorpommern/oepnv--ein-jahr-seniorenticket---40-000-abonnenten-34939252.html,https://www.stern.de/gesellschaft/regional/mecklenburg-vorpommern/oepnv--ein-jahr-seniorenticket---40-000-abonnenten-34939252.html,0,www.stern.de,ÖPNV: Ein Jahr Seniorenticket - 40.000 Abonnenten,Schwerin (mv) - Ein Jahr nach dem Start des Seniorentickets zieht die Landesregierung in MV eine positive Bilanz. «Der Vertrieb läuft seit einem Jahr,https://image.stern.de/34939254/t/G-/v1/w1440/r1.7778/-/01--74yxim2xr4v22axw800h600jpeg---eccabd230d6cf746.jpg,2024-08-01T14:22:00Z,,"Die Generation 65+ in MV weiß das Seniorenticket zu schätzen. Das zeigen die Zahlen bei Abonnenten und verkauften Tickets.
Ein Jahr nach dem Start des Seniorentickets zieht die Landesregierung in MV… [+1424 chars]",,de,'ÖPNV'
https://www.zeit.de/news/2024-08/01/ein-jahr-seniorenticket-40-000-abonnenten,https://www.zeit.de/news/2024-08/01/ein-jahr-seniorenticket-40-000-abonnenten,0,www.zeit.de,ÖPNV: Ein Jahr Seniorenticket - 40.000 Abonnenten,Hier finden Sie Informationen zu dem Thema „ÖPNV“. Lesen Sie jetzt „Ein Jahr Seniorenticket - 40.000 Abonnenten“.,https://img.zeit.de/news/2024-08/01/ein-jahr-seniorenticket-40-000-abonnenten-image-group/wide__1300x731,2024-08-01T14:22:00Z,,"Ein Jahr nach dem Start des Seniorentickets zieht die Landesregierung in MV eine positive Bilanz. «Der Vertrieb läuft seit einem Jahr stabil und die hohe, konstant wachsende Nachfrage bestätigt den E… [+1331 chars]",,de,'ÖPNV'
https://www.diepresse.com/18724594/gas-handy-klima-was-die-koalition-noch-will,https://www.diepresse.com/18724594/gas-handy-klima-was-die-koalition-noch-will,0,www.diepresse.com,"Gas, Handy, Klima: Was die Koalition noch will [premium]","Etliche Vorhaben musste Türkis-Grün bereits begraben, nach dem Ende der Blockade um den EU-Kommissar kommt aber wieder Bewegung in Verhandlungen. Bei einem Großprojekt zeigt sich die SPÖ gesprächsbereit.",https://img.diepresse.com/public/incoming/1la5vg-MINISTERRAT-BRUNNER-KOGLER-NEHAMMER/alternates/DPR_SOCIAL_NACHRICHTEN/MINISTERRAT%20BRUNNER%20%20KOGLER%20%20NEHAMMER,2024-08-01T15:37:34Z,,"Etliche Vorhaben musste Türkis-Grün bereits begraben, nach dem Ende der Blockade um den EU-Kommissar kommt aber wieder Bewegung in Verhandlungen. Bei einem Großprojekt zeigt sich die SPÖ gesprächsber… [+1392 chars]",,de,'Gas'
https://www.focus.de/finanzen/news/waermepumpenhersteller-schlagen-alarm-gefahr-dass-unternehmen-das-nicht-ueberleben_id_260189431.html,https://www.focus.de/finanzen/news/waermepumpenhersteller-schlagen-alarm-gefahr-dass-unternehmen-das-nicht-ueberleben_id_260189431.html,0,www.focus.de,"Habecks Heizungsgesetz - Wärmepumpenhersteller schlagen Alarm: „Gefahr, dass Unternehmen nicht überleben“","Ein Jahr nach dem Heizungsgesetz brechen die Einbauzahlen von Wärmepumpen dramatisch ein. Firmen, die eben noch investiert haben, sind nun in Not. Zwei Geschäftsführer berichten.",https://p6.focus.de/img/panorama/id_260189429/waermepumpen-stehen-aktuell-haeufig-ungenutzt-in-werkshallen..jpg?im=Crop%3D%280%2C215%2C1000%2C500%29%3BResize%3D%281200%2C627%29&impolicy=perceptual&quality=mediumHigh&hash=6dbf1fa6cfe53d6dd75287fa8ec8e64ba767e34977b7d474d637e364236b461a,2024-08-01T18:41:07Z,,"Das Ziel, das Robert Habeck vorgegeben hatte, war ambitioniert: 500.000 neu installierte Wärmepumpen pro Jahr ab 2024 ist ein starkes Bekenntnis und ein starkes Signal, welches von dem heutigen Wärme… [+5000 chars]",,de,'Not'
https://www.stern.de/gesellschaft/regional/hamburg-schleswig-holstein/einsatz--gasleck-im-harburger-hafen---bahnverkehr-kurz-unterbrochen-34940074.html,https://www.stern.de/gesellschaft/regional/hamburg-schleswig-holstein/einsatz--gasleck-im-harburger-hafen---bahnverkehr-kurz-unterbrochen-34940074.html,0,www.stern.de,Einsatz: Gasleck im Harburger Hafen - Bahnverkehr kurz unterbrochen,Hamburg (lno) - Wegen eines Gaslecks im Harburger Hafen ist der Bahnverkehr in Hamburg kurzzeitig unterbrochen worden. Kohlenwasserstoff sei am späten,https://image.stern.de/34940076/t/Y1/v1/w1440/r1.7778/-/01--ucknckaic5v11axw800h600jpeg---25d5d07374683b72.jpg,2024-08-01T21:28:51Z,,"Aus einem undichten Kessel tritt Gas aus. Die Einsatzkräfte werden alarmiert - und gehen auf Nummer sicher.
Wegen eines Gaslecks im Harburger Hafen ist der Bahnverkehr in Hamburg kurzzeitig unterbro… [+488 chars]",,de,'Gas'
https://www.sueddeutsche.de/projekte/artikel/wirtschaft/lokfuehrer-deutsche-bahn-fachkraeftemangel-aegypten-e829238/,https://www.sueddeutsche.de/projekte/artikel/wirtschaft/lokfuehrer-deutsche-bahn-fachkraeftemangel-aegypten-e829238/,0,www.sueddeutsche.de,"Deutsche Bahn: Suche Lokführer, biete neues Leben","Der Deutschen Bahn fehlen Tausende Fachkräfte. Deshalb sucht der Konzern nun im Ausland, unter anderem in Ägypten. Wer sind die Menschen, die bald Deutschlands Züge steuern?","https://www.sueddeutsche.de/projekte/artikel/wirtschaft/lokfuehrer-deutsche-bahn-fachkraeftemangel-aegypten-e829238/8c408b687fd0272a47556569a19f21c48ad56b0da3607d54904fc2ea857be2e7_w2400_h1256_r221,743,5305,2776_oszplus_q70.jpg",2024-08-01T22:00:00Z,,"Plötzlich piept es wie verrückt. Der ICE macht auf freier Strecke eine Vollbremsung. Fragend schaut Hossam Ramadan zu Joachim Ecker. Was war passiert? „Du warst zu schnell“, erklärt der Trainer, „des… [+197 chars]",,de,'Gas'
https://www.welt.de/vermischtes/video252814546/Verheerende-Waldbraende-auf-dem-Balkan-diese-Regionen-sind-besonders-betroffen.html,https://www.welt.de/vermischtes/video252814546/Verheerende-Waldbraende-auf-dem-Balkan-diese-Regionen-sind-besonders-betroffen.html,0,www.welt.de,Verheerende Waldbrände auf dem Balkan – diese Regionen sind besonders betroffen,"In einigen Balkanländern wüten derzeit große Waldbrände, ausgelöst durch lang anhaltende Dürre. Neben Kroatien sind auch Albanien sowie Nordmazedonien von starken Waldbränden betroffen, wo 66 Flächenbrände innerhalb von 24 Stunden ausgebrochen sind.",https://img.welt.de/img/incoming/mobile252814536/8141358637-ci16x9-w1200/OFF-Waldbraende-Mittelmeer-Fr-0855-0-jpg.jpg,2024-08-02T09:30:23Z,,"Die WELT als ePaper: Die vollständige Ausgabe steht Ihnen bereits am Vorabend zur Verfügung so sind Sie immer hochaktuell informiert. Weitere Informationen: http://epaper.welt.de 
 Der Kurz-Link die… [+49 chars]",,de,'Dürre'
https://www.stern.de/wirtschaft/news/energie--habeck-legt-vorschlaege-zur-reform-des-stromsystems-vor-34942474.html,https://www.stern.de/wirtschaft/news/energie--habeck-legt-vorschlaege-zur-reform-des-stromsystems-vor-34942474.html,0,www.stern.de,Energie: Habeck legt Vorschläge zur Reform des Stromsystems vor,Das Stromsystem in Deutschland ist mitten in einem Wandel. Grund ist vor allem der Ausbau der erneuerbaren Energien aus Wind und Sonne. Das hat Folgen.,https://image.stern.de/34942476/t/2p/v1/w1440/r1.7778/-/02--2hdrq4tcsmv10axw800h600jpeg---41576697d0c78404.jpg,2024-08-02T13:00:35Z,,"Das Stromsystem in Deutschland ist mitten in einem Wandel. Grund ist vor allem der Ausbau der erneuerbaren Energien aus Wind und Sonne. Das hat Folgen.
Das Bundeswirtschaftsministerium hat Vorschläg… [+2062 chars]",,de,'Gas'
https://www.tagesspiegel.de/wirtschaft/energie-habeck-legt-vorschlage-zur-reform-des-stromsystems-vor-12135050.html,https://www.tagesspiegel.de/wirtschaft/energie-habeck-legt-vorschlage-zur-reform-des-stromsystems-vor-12135050.html,0,www.tagesspiegel.de,Energie: Habeck legt Vorschläge zur Reform des Stromsystems vor,Das Stromsystem in Deutschland ist mitten in einem Wandel. Grund ist vor allem der Ausbau der erneuerbaren Energien aus Wind und Sonne. Das hat Folgen.,https://www.tagesspiegel.de/images/12135047/alternates/BASE_16_9_W1400/1722603694000/strommasten.jpeg,2024-08-02T13:01:34Z,,"Das Bundeswirtschaftsministerium hat Vorschläge zur Reform des Stromsystems in Deutschland vorgelegt. Zentral soll ein neuer sogenannter Kapazitätsmechanismus sein, der bis zum Jahr 2028 eingeführt w… [+1988 chars]",,de,'Gas'
https://www.focus.de/finanzen/news/energie-habeck-legt-vorschlaege-zur-reform-des-stromsystems-vor_id_260192236.html,https://www.focus.de/finanzen/news/energie-habeck-legt-vorschlaege-zur-reform-des-stromsystems-vor_id_260192236.html,0,www.focus.de,Energie - Habeck legt Vorschläge zur Reform des Stromsystems vor,Das Stromsystem in Deutschland ist mitten in einem Wandel. Grund ist vor allem der Ausbau der erneuerbaren Energien aus Wind und Sonne. Das hat Folgen.,https://p6.focus.de/img/finanzen/news/id_260192232/wirtschaftsminister-robert-habeck-legt-vorschlaege-zur-reform-des-stromsystems-vor-archivfoto-.jpg?im=Crop%3D%280%2C170%2C2048%2C1024%29%3BResize%3D%281200%2C627%29&impolicy=perceptual&quality=mediumHigh&hash=9693700dc21dbc35039eb7c03d570ecf475cd3bb5354efad651d9e0468047d89,2024-08-02T13:05:04Z,,"Das Bundeswirtschaftsministerium hat Vorschläge zur Reform des Stromsystems in Deutschland vorgelegt. Zentral soll ein neuer sogenannter Kapazitätsmechanismus sein, der bis zum Jahr 2028 eingeführt w… [+1900 chars]",,de,'Wind'
https://www.stern.de/wirtschaft/news/energiewende--umbau-des-deutschen-stromsystems---wie-es-aussehen-koennte-34942690.html,https://www.stern.de/wirtschaft/news/energiewende--umbau-des-deutschen-stromsystems---wie-es-aussehen-koennte-34942690.html,0,www.stern.de,Energiewende: Umbau des deutschen Stromsystems - wie es aussehen könnte,"Berlin - Immer mehr Strom aus Wind und Sonne, immer mehr Wärmepumpen und Elektroautos: das hat Folgen für das Stromsystem. Es sind Reformen notwendig.",https://image.stern.de/34942692/t/wW/v1/w1440/r1.7778/-/02--lr4hwlxtovv7axw800h600jpeg---4a362752b0b125c4.jpg,2024-08-02T13:48:26Z,,"Der massive Ausbau der erneuerbaren Energien aus Wind und Sonne hat Folgen für das Stromsystem. Geplant sind umfassende Reformen.
Immer mehr Strom aus Wind und Sonne, immer mehr Wärmepumpen und Elek… [+5895 chars]",,de,'Wind'
https://www.tagesspiegel.de/wirtschaft/energiewende-umbau-des-deutschen-stromsystems-wie-es-aussehen-konnte-12135629.html,https://www.tagesspiegel.de/wirtschaft/energiewende-umbau-des-deutschen-stromsystems-wie-es-aussehen-konnte-12135629.html,0,www.tagesspiegel.de,Energiewende: Umbau des deutschen Stromsystems - wie es aussehen könnte,Der massive Ausbau der erneuerbaren Energien aus Wind und Sonne hat Folgen für das Stromsystem. Geplant sind umfassende Reformen.,https://www.tagesspiegel.de/images/12135626/alternates/BASE_16_9_W1400/1722606574000/strommasten.jpeg,2024-08-02T13:49:34Z,,"Immer mehr Strom aus Wind und Sonne, immer mehr Wärmepumpen und Elektroautos: das hat Folgen für das Stromsystem. Es sind Reformen notwendig. Nun hat das Wirtschafts- und Klimaschutzministerium ein u… [+5829 chars]",,de,'Gas'
https://www.focus.de/finanzen/news/energiewende-umbau-des-deutschen-stromsystems-wie-es-aussehen-koennte_id_260192420.html,https://www.focus.de/finanzen/news/energiewende-umbau-des-deutschen-stromsystems-wie-es-aussehen-koennte_id_260192420.html,0,www.focus.de,Energiewende - Umbau des deutschen Stromsystems - wie es aussehen könnte,Der massive Ausbau der erneuerbaren Energien aus Wind und Sonne hat Folgen für das Stromsystem. Geplant sind umfassende Reformen.,https://p6.focus.de/img/finanzen/news/id_260192418/stromnetze-wirtschaftsminister-robert-habeck-hat-vorschlaege-zur-reform-des-stromsystems-vorgelegt-archivfoto-..jpg?im=Crop%3D%280%2C170%2C2048%2C1024%29%3BResize%3D%281200%2C627%29&impolicy=perceptual&quality=mediumHigh&hash=f4c7c724563f457d503a55696e2f89d624e02c5450c9c834695e5e3f2245f13d,2024-08-02T13:50:06Z,,"Immer mehr Strom aus Wind und Sonne, immer mehr Wärmepumpen und Elektroautos: das hat Folgen für das Stromsystem. Es sind Reformen notwendig. Nun hat das Wirtschafts- und Klimaschutzministerium ein u… [+5786 chars]",,de,'Gas'
https://www.zeit.de/wirtschaft/2024-07/duerre-sizilien-trockenheit-landwirtschaft-tourismus,https://www.zeit.de/wirtschaft/2024-07/duerre-sizilien-trockenheit-landwirtschaft-tourismus,0,www.zeit.de,Dürre: Sizilien? Kaum wiederzuerkennen,"90 Prozent weniger Regen plus Hitzerekorde: Auf Sizilien wird sichtbar, welche Folgen extreme Sommer haben. Und wie absurd der Alltag von Landwirten und Bewohnern wird.",https://img.zeit.de/wirtschaft/2024-07/duerre-sizilien-trockenheit-landwirtschaft-tourismus-bild/wide__1300x731,2024-08-02T16:02:47Z,,"Der Pozzillo-See in der Provinz Catania auf Sizilien sah früher aus wie ein kleiner Gebirgssee: smaragdblaues Wasser, rundherum satte, grüne Wiesen. Für die Insel ist er überlebenswichtig, der künstl… [+636 chars]",,de,'Dürre'
https://www.zeit.de/news/2024-08/03/wissing-wuenscht-sich-kundenansturm-aufs-deutschlandticket,https://www.zeit.de/news/2024-08/03/wissing-wuenscht-sich-kundenansturm-aufs-deutschlandticket,0,www.zeit.de,ÖPNV: Wissing wünscht sich Kundenansturm aufs Deutschlandticket,Hier finden Sie Informationen zu dem Thema „ÖPNV“. Lesen Sie jetzt „Wissing wünscht sich Kundenansturm aufs Deutschlandticket“.,https://img.zeit.de/news/2024-08/03/wissing-wuenscht-sich-kundenansturm-aufs-deutschlandticket-image-group/wide__1300x731,2024-08-03T02:00:38Z,,"Bundesverkehrsminister Volker Wissing wünscht sich einen Kundenansturm auf den ÖPNV. «Natürlich muss man den bewältigen, aber möglichst viele Menschen von Bus und Bahn zu überzeugen, ist doch genau d… [+2899 chars]",,de,'ÖPNV'
https://www.n-tv.de/panorama/In-Sizilien-herrscht-grosse-Duerre-und-Wassermangel-Touristen-sollen-nichts-mitbekommen-article25130040.html,https://www.n-tv.de/panorama/In-Sizilien-herrscht-grosse-Duerre-und-Wassermangel-Touristen-sollen-nichts-mitbekommen-article25130040.html,0,www.n-tv.de,Bisher so gut wie kein Regen: Sizilianer sind Dürreprofis - aber es wird schwerer,"Die Sizilianer sind Trockenheit und Wassermangel gewohnt. Sie gehen damit so gut um, dass die vielen Touristen dort nichts davon merken. Aber nun erlebt die Insel ihre schlimmste Dürre seit mehr als zwei Jahrzehnten.",https://bilder1.n-tv.de/img/incoming/crop25130064/487132331-cImg_16_9-w1200/6bf5bf3c4daa1d570a36cd4963f0a0ce.jpg,2024-08-04T11:43:57Z,,"Die Sizilianer sind Trockenheit und Wassermangel gewohnt. Sie gehen damit so gut um, dass die vielen Touristen dort nichts davon merken. Aber nun erlebt die Insel ihre schlimmste Dürre seit mehr als … [+5730 chars]",,de,'Dürre'
https://www.bild.de/leben-wissen/reisen/sommerurlaub-auswaertiges-amt-warnt-italien-urlauber-vor-duerre-66af8b6cc3cfd352dfe77b3c,https://www.bild.de/leben-wissen/reisen/sommerurlaub-auswaertiges-amt-warnt-italien-urlauber-vor-duerre-66af8b6cc3cfd352dfe77b3c,0,www.bild.de,Gefahr für Touristen - Auswärtiges Amt warnt Italien-Urlauber vor Dürre,Das Auswärtige Amt warnt Deutsche Urlauber vor den aktuellen Wetterbedingungen in Italien. Besonders stark betroffen ist der Süden der Urlaubsregion.,"https://images.bild.de/66af8b6cc3cfd352dfe77b3c/8d4f89f7a80129cd3173bac27c2b5f9f,103e41ea?w=1280",2024-08-04T15:12:58Z,,"Trocken, trockener, Sizilien! 
Das Auswärtige Amt warnt Deutsche Urlauber vor den aktuellen Wetterbedingungen in Italien. Besonders stark betroffen: die südliche Region des Landes. Hitze und ausblei… [+1381 chars]",,de,'Dürre'
https://www.tagesschau.de/ausland/europa/eu-methan-verordnung-100.html,https://www.tagesschau.de/ausland/europa/eu-methan-verordnung-100.html,0,www.tagesschau.de,EU-Klimaschutz: Methanverordnung tritt in Kraft,"Methan ist für ein Drittel der bisherigen Erderhitzung verantwortlich. Um den Ausstoß des Gases einzudämmen, tritt heute eine neue EU-Verordnung in Kraft. Die größten Emittenten werden damit aber nicht reguliert. Von Paul Vorreiter.",https://images.tagesschau.de/image/03f2ec07-bb7a-4b06-bc40-844f7923787c/AAABkSGwbFc/AAABjwnlFvA/16x9-1280/raffinerie-methan-abbrennen-100.jpg,2024-08-05T09:07:04Z,,"Stand: 05.08.2024 11:07 Uhr
Methan ist für ein Drittel der bisherigen Erderhitzung verantwortlich. Um den Ausstoß des Gases einzudämmen, tritt heute eine neue EU-Verordnung in Kraft. Die größten Emi… [+2987 chars]",,de,'Gas'
https://www.zeit.de/news/2024-08/05/backhaus-will-auskunft-von-bundesregierung-zur-gasversorgung,https://www.zeit.de/news/2024-08/05/backhaus-will-auskunft-von-bundesregierung-zur-gasversorgung,0,www.zeit.de,Flüssiggas-Terminal: Backhaus will Auskunft von Bundesregierung zur Gasversorgung,Hier finden Sie Informationen zu dem Thema „Flüssiggas-Terminal“. Lesen Sie jetzt „Backhaus will Auskunft von Bundesregierung zur Gasversorgung“.,https://img.zeit.de/news/2024-08/05/backhaus-will-auskunft-von-bundesregierung-zur-gasversorgung-image-group/wide__1300x731,2024-08-05T12:54:05Z,,Die Verzögerungen bei der Aufnahme des Regelbetriebs am Flüssigerdgas-Terminal in Mukran auf Rügen haben die Debatte um die Notwendigkeit eines Gas-Importhafens an der deutschen Ostseeküste neu beleb… [+2346 chars],,de,'Gas'
https://www.stern.de/gesellschaft/regional/hessen/gas-unglueck---verkettung-ungluecklicher-umstaende--fuehrte-zu-gas-stoerfall-34952014.html,https://www.stern.de/gesellschaft/regional/hessen/gas-unglueck---verkettung-ungluecklicher-umstaende--fuehrte-zu-gas-stoerfall-34952014.html,0,www.stern.de,"Gas-Unglück: ""Verkettung unglücklicher Umstände"" führte zu Gas-Störfall",Hadamar/Darmstadt (lhe) - Das folgenschwere Gasleck in einem Betrieb in Hadamar im Februar ist laut einem Gutachten von einer «Verkettung unglücklicher,https://image.stern.de/34952016/t/Aj/v1/w1440/r1.7778/-/05--bkmpk4dg2qv15axw800h600jpeg---aedf9b81c7bc3f01.jpg,2024-08-05T15:09:48Z,,"Was führte zu dem folgenschweren Gasleck im Februar in Hadamar? Nun ist das Gutachten da. Demnach haben mehrere Schutzbarrieren versagt.
Das folgenschwere Gasleck in einem Betrieb in Hadamar im Febr… [+1878 chars]",,de,'Gas'
https://www.zeit.de/news/2024-08/05/verkettung-ungluecklicher-umstaende-fuehrte-zu-gas-stoerfall,https://www.zeit.de/news/2024-08/05/verkettung-ungluecklicher-umstaende-fuehrte-zu-gas-stoerfall,0,www.zeit.de,Gas-Unglück: «Verkettung unglücklicher Umstände» führte zu Gas-Störfall,"Hier finden Sie Informationen zu dem Thema „Gas-Unglück“. Lesen Sie jetzt „""Verkettung unglücklicher Umstände"" führte zu Gas-Störfall“.",https://img.zeit.de/news/2024-08/05/verkettung-ungluecklicher-umstaende-fuehrte-zu-gas-stoerfall-image-group/wide__1300x731,2024-08-05T15:09:48Z,,Das folgenschwere Gasleck in einem Betrieb in Hadamar im Februar ist laut einem Gutachten von einer «Verkettung unglücklicher Umstände» während Wartungsarbeiten ausgelöst worden. «Menschliches Versag… [+2693 chars],,de,'Gas'
https://www.zeit.de/news/2024-08/06/hilfsorganisation-duerre-vertreibt-menschen-in-afghanistan,https://www.zeit.de/news/2024-08/06/hilfsorganisation-duerre-vertreibt-menschen-in-afghanistan,0,www.zeit.de,Katastrophen: Hilfsorganisation: Dürre vertreibt Menschen in Afghanistan,Hier finden Sie Informationen zu dem Thema „Katastrophen“. Lesen Sie jetzt „Hilfsorganisation: Dürre vertreibt Menschen in Afghanistan“.,https://img.zeit.de/news/2024-08/06/hilfsorganisation-duerre-vertreibt-menschen-in-afghanistan-image-group/wide__1300x731,2024-08-06T09:10:36Z,,Extreme Wetterereignisse haben in Afghanistan in den ersten sechs Monaten dieses Jahres mehr Menschen vertrieben als im gesamten Jahr 2023. Das teilte die Hilfsorganisation Save the Children in einer… [+2579 chars],,de,'Dürre'
https://www.stern.de/panorama/katastrophen--hilfsorganisation--duerre-vertreibt-menschen-in-afghanistan-34954226.html,https://www.stern.de/panorama/katastrophen--hilfsorganisation--duerre-vertreibt-menschen-in-afghanistan-34954226.html,0,www.stern.de,Katastrophen: Hilfsorganisation: Dürre vertreibt Menschen in Afghanistan,Extreme Wettereignisse wie Fluten oder Dürren nehmen in Afghanistan zu. Laut der Hilfsorganisation Save the Children flüchten dort immer mehr Menschen vor den Folgen der Klimakrise.,https://image.stern.de/34954228/t/fU/v1/w1440/r1.7778/-/06--r5oearqaofv5axw800h600jpeg---8038465f9c254f40.jpg,2024-08-06T09:10:36Z,,"Extreme Wettereignisse wie Fluten oder Dürren nehmen in Afghanistan zu. Laut der Hilfsorganisation Save the Children flüchten dort immer mehr Menschen vor den Folgen der Klimakrise.
Extreme Wetterer… [+1908 chars]",,de,'Dürre'
https://www.tagesspiegel.de/gesellschaft/panorama/katastrophen-hilfsorganisation-durre-vertreibt-menschen-in-afghanistan-12151553.html,https://www.tagesspiegel.de/gesellschaft/panorama/katastrophen-hilfsorganisation-durre-vertreibt-menschen-in-afghanistan-12151553.html,0,www.tagesspiegel.de,Katastrophen: Hilfsorganisation: Dürre vertreibt Menschen in Afghanistan,Extreme Wettereignisse wie Fluten oder Dürren nehmen in Afghanistan zu. Laut der Hilfsorganisation Save the Children flüchten dort immer mehr Menschen vor den Folgen der Klimakrise.,https://www.tagesspiegel.de/images/12151550/alternates/BASE_16_9_W1400/1722935496000/durre-in-afghanistan.jpeg,2024-08-06T09:11:36Z,,Extreme Wetterereignisse haben in Afghanistan in den ersten sechs Monaten dieses Jahres mehr Menschen vertrieben als im gesamten Jahr 2023. Das teilte die Hilfsorganisation Save the Children in einer… [+1808 chars],,de,'Dürre'
