index,url,valid,domain,title,description,image,published,archive,content,quote,language,keyword
https://www.tagesschau.de/wirtschaft/verbraucher/heizkosten-spartipps-verbraucher-gas-heizoel-waermepumpe-100.html,https://www.tagesschau.de/wirtschaft/verbraucher/heizkosten-spartipps-verbraucher-gas-heizoel-waermepumpe-100.html,0,www.tagesschau.de,Start der Heizperiode: Wie teuer wird die warme Wohnung?,Anfang Oktober gilt als Beginn der Heizperiode. Wie teuer ist die warme Wohnung geworden? Werden Heizöl- und Gasheizungen zur Kostenfalle? Und wie können Verbraucher ihre Heizkosten senken? Von Angela Göpfert.,https://images.tagesschau.de/image/c7fcb2f0-2bac-4a25-85f4-45a9b58e244c/AAABmZpVOMs/AAABmKJZ-0g/16x9-big/heizung-134.jpg?width=1280,2025-10-01T07:13:40Z,,"Stand: 01.10.2025 09:13 Uhr
Anfang Oktober gilt als Beginn der Heizperiode. Wie teuer ist die warme Wohnung geworden? Werden Heizöl- und Gasheizungen zur Kostenfalle? Und wie können Verbraucher ihre… [+5965 chars]",,de,'Gas'
https://www.dw.com/de/wie-beim-zahnarzt-warum-immer-mehr-erdkrater-entstehen-und-was-hilft-dolinen-d%C3%BCrre-grundwasser/a-73773932,https://www.dw.com/de/wie-beim-zahnarzt-warum-immer-mehr-erdkrater-entstehen-und-was-hilft-dolinen-d%C3%BCrre-grundwasser/a-73773932,0,www.dw.com,Warum verursacht der Klimawandel gefährliche Senklöcher?,"Dürren, sinkende Grundwasserspiegel und Starkregen tragen dazu bei, dass immer öfter große Erdkrater im Boden entstehen. Wie kann die Gefahr reduziert werden?",https://static.dw.com/image/72898169_6.jpg,2025-10-01T08:11:00Z,,"Im Nordosten des brasilianischen Amazonasgebiets stehen Häuser plötzlich am Rande riesiger Krater. Die gewaltigen Erdlöcher entstanden nach starken Regenfällen, über tausend Menschen sind von Obdachl… [+6263 chars]",,de,'Dürre'
https://www.zeit.de/news/2025-10/01/polizisten-entdecken-zufaellig-kitesurfer-in-not,https://www.zeit.de/news/2025-10/01/polizisten-entdecken-zufaellig-kitesurfer-in-not,0,www.zeit.de,Rettung aus Seenot: Polizisten entdecken zufällig Kitesurfer in Not,Hier finden Sie Informationen zu dem Thema „Rettung aus Seenot“. Lesen Sie jetzt „Polizisten entdecken zufällig Kitesurfer in Not“.,https://img.zeit.de/news/2025-10/01/polizisten-entdecken-zufaellig-kitesurfer-in-not-image-group/wide__1300x731,2025-10-01T09:18:58Z,,Mit Hilfe zweier aufmerksamer Polizisten haben Seenotretter zwei Kitesurfer aus dem Fehmarnsund gerettet. Die Beamten der gemeinsamen Fahndungsgruppe Schengen von Bundes- und Landespolizei bemerkten … [+961 chars],,de,'Not'
https://www.faz.net/aktuell/gesellschaft/schweiz-gletscher-in-den-alpen-schrumpfen-2025-weiter-accg-110712116.html,https://www.faz.net/aktuell/gesellschaft/schweiz-gletscher-in-den-alpen-schrumpfen-2025-weiter-accg-110712116.html,0,www.faz.net,"Wenig Schnee, viel Hitze: Gletscher in der Schweiz sind in diesem Jahr deutlich geschrumpft",Auf einen schneearmen Winter folgten mehrere Hitzewellen: In diesem Jahr ging das Volumen der Schweizer Gletscher um drei Prozent zurück. Das hat Folgen für das Gestein und die umliegenden Orte.,https://media1.faz.net/ppmedia/w1200/aktuell/gesellschaft/1814428222/1.10712121/facebook_teaser/der-muttgletscher-in-den.jpg.webp,2025-10-01T09:28:36Z,,"Es gibt keine Verschnaufpause für die Schweizer Gletscher: in diesem Jahr wurde bei ihnen der viertgrößte Schwund seit Messbeginn 1950 erfasst. Ihr Volumen ging um drei Prozent zurück, wie das Gletsc… [+2168 chars]",,de,'Schnee'
https://kaernten.orf.at/stories/3323986/,https://kaernten.orf.at/stories/3323986/,0,kaernten.orf.at,Erntebilanz heuer durchwachsen,"In Kärnten hat es im Jahr 2025 eine sehr gute Getreideernte gegeben, bei Mais, Soja und Kürbissen fiel das Ergebnis aber unterdurchschnittlich aus. Diese Bilanz zogen Vertreter der Landwirtschaftskammer Kärnten am Mittwoch in Klagenfurt. Man arbeiten an neuen…",https://ibs.orf.at/ktn?image=https%3A%2F%2Foekastatic.orf.at%2Fmims%2F2025%2F25%2F24%2Fcrops%2Fw%3D1200%2Ch%3D627%2Cq%3D75%2F2668805_master_1026224_trockenheit_120_2123_00_00_00_00.jpg%3Fs%3D7c728b250cec6f48e0c556c2bc1e84eca811e552,2025-10-01T10:52:24Z,,"Besonders zu schaffen machte den Landwirten heuer einmal mehr das Wetter: Sowohl das kühle Frühjahr, als auch die starke Hitze im Juni sorgten für durchwachsene Ergebnisse. Während sich die kühlen Mo… [+3310 chars]",,de,'Landwirtschaft'
https://www.morgenpost.de/berlin/article410131935/e-scooter-und-co-berlin-plant-tausende-abstellpunkte-bis-2035.html,https://www.morgenpost.de/berlin/article410131935/e-scooter-und-co-berlin-plant-tausende-abstellpunkte-bis-2035.html,0,www.morgenpost.de,E-Scooter und Co.: Berlin plant Tausende Abstellpunkte bis 2035,Berlin arbeitet an einer neuen „Sharing-Strategie“ – während vor Gericht über die E-Scooter in der Stadt verhandelt wurde. So geht es weiter.,https://img.sparknews.funkemedien.de/410132165/410132165_1759327251_v16_9_1600.jpeg,2025-10-01T14:00:52Z,,"In Berlin sollen in den nächsten zehn Jahren Hunderte neue Abstellstationen für Leihfahrzeuge wie E-Scooter, Fahrräder oder Autos entstehen. Der Entwurf der Sharing-Strategie der Senatsverkehrsverwal… [+4791 chars]",,de,'ÖPNV'
https://sport.orf.at/stories/3146160/,https://sport.orf.at/stories/3146160/,0,sport.orf.at,Steilhang in Sölden wird steiler und steiler,Knapp vier Wochen vor dem alpinen Weltcup-Opening in Sölden präsentiert sich der Rettenbachferner von seiner besten Seite. An Schnee wird es am 25. (Damen) bzw. 26. Oktober (Herren) zur Freude der Veranstalter in den Riesentorläufen nicht mangeln. Interessant…,https://ibs.orf.at/sport?image=https%3A%2F%2Fassets.orf.at%2Fmims%2F2025%2F40%2F57%2Fcrops%2Fw%3D1200%2Ch%3D630%2Cq%3D75%2F2785246_master_1074257_ski_alpin_soelden_steilhang_schnee_g.jpg%3Fs%3Dc4c71dc03f95276fbbe1ca21a6458edff04d1f61,2025-10-01T14:45:40Z,,Bei einem Lokalaugenschein von ORF-Regisseur Michael Kögler zeigte sich der Gletscher hoch über Sölden tief winterlich. Es kribbelt schon nach der langen Pause bei Fahrern und Verantwortlichen. Sölde… [+1727 chars],,de,'Schnee'
https://www.welt.de/wirtschaft/plus68dd070a381f1ea56f359059/gas-heizoel-strom-so-wird-es-fuer-sie-ein-guenstiger-winter.html,https://www.welt.de/wirtschaft/plus68dd070a381f1ea56f359059/gas-heizoel-strom-so-wird-es-fuer-sie-ein-guenstiger-winter.html,0,www.welt.de,Bis zu 1000 Euro weniger – So sparen Sie im Winter Heizkosten,"Seit der Energiepreiskrise zögern viele Verbraucher, an den ersten kalten Tagen direkt die Heizung aufzudrehen. Dabei sinken die Preise für Brennstoffe längst. Auch Strom für Wärmepumpen wird billiger. Wer auf Heizöl angewiesen ist, sollte ein spezielles Datu…",https://images.welt.de/68dd070a381f1ea56f359059/05045e75c745bf482f450529623fa82f-master/ci16x9-w1200/fernwaerme,2025-10-01T15:38:43Z,,"Seit der Energiepreiskrise zögern viele Verbraucher, an den ersten kalten Tagen direkt die Heizung aufzudrehen. Dabei sinken die Preise für Brennstoffe längst. Auch Strom für Wärmepumpen wird billige… [+76 chars]",,de,'Heizung'
https://www.bild.de/regional/rheinland-pfalz/dieser-wein-fuer-unfassbaren-preis-versteigert-betrag-fuenfstellig-68da36e1de710a0a2d5f551d,https://www.bild.de/regional/rheinland-pfalz/dieser-wein-fuer-unfassbaren-preis-versteigert-betrag-fuenfstellig-68da36e1de710a0a2d5f551d,0,www.bild.de,Betrag fünfstellig - Dieser deutsche Wein für unfassbaren Preis versteigert,Was den Wein so besonders macht und warum er so einen hohen Preis erzielte.,"https://images.bild.de/68da36e1de710a0a2d5f551d/9ce6f1faae9480ef52b482b27ec9a643,d3962c8b?w=1280",2025-10-01T17:26:05Z,,Bernkastel (Rheinland-Pfalz) Die Flasche stammt aus einem kühlen Weinkeller und war gut bewacht. Nur fünf Flaschen von diesem Wein gibt es noch. Eine von ihnen erzielte bei einer Versteigerung jetzt … [+3498 chars],,de,'Wein'
https://www.stern.de/gesellschaft/regional/rheinland-pfalz-saarland/tag-der-deutschen-einheit--einheitsfest-in-saarbruecken--wie-reise-ich-am-besten-an--36099328.html,https://www.stern.de/gesellschaft/regional/rheinland-pfalz-saarland/tag-der-deutschen-einheit--einheitsfest-in-saarbruecken--wie-reise-ich-am-besten-an--36099328.html,0,www.stern.de,Tag der Deutschen Einheit: Einheitsfest in Saarbrücken: Wie reise ich am besten an?,"Die Stadt steht drei Tage lang ganz im Zeichen der Deutschen Einheit - mit Auswirkungen auf Straßen, Parkplätze und ÖPNV. Was man als Besucher beachten sollte.",https://image.stern.de/36099330/t/t5/v1/w1440/r1.7778/-/02--ndubing4k2v7axs2048jpeg---6079435d5d2f6011.jpg,2025-10-02T03:00:17Z,,"Kopiere den aktuellen Link
Zur Merkliste hinzufügen
Die Stadt steht drei Tage lang ganz im Zeichen der Deutschen Einheit - mit Auswirkungen auf Straßen, Parkplätze und ÖPNV. Was man als Besucher be… [+2947 chars]",,de,'ÖPNV'
https://www.diepresse.com/20153261/ultimatum-omv-droht-bohrlizenzen-im-schwarzen-meer-zu-verlieren,https://www.diepresse.com/20153261/ultimatum-omv-droht-bohrlizenzen-im-schwarzen-meer-zu-verlieren,0,www.diepresse.com,Ultimatum: OMV droht Bohrlizenzen im Schwarzen Meer zu verlieren [premium],Ab 2027 soll das rumänische OMV-Projekt „Neptun Deep“ große Mengen an Gas für Europa liefern. Doch Rumänien geht es nicht schnell genug. Im Raum stehen Millionenstrafen und im Extremfall sogar der Verlust der Lizenz.,https://img.diepresse.com/public/incoming/2awdq2-ROMANIA-ENERGYOFFSHORE/alternates/DPR_SOCIAL_NACHRICHTEN/ROMANIA-ENERGYOFFSHORE,2025-10-02T03:55:28Z,,"Zukunftsprojekte, wohin das Auge reicht: Während die teilstaatliche OMV im heimischen Bruck an der Leitha den Grundstein für das größte grüne Wasserstoff-Werk des Landes legt, arbeitet der Konzern im… [+5400 chars]",,de,'Gas'
https://kaernten.orf.at/stories/3324079/,https://kaernten.orf.at/stories/3324079/,0,kaernten.orf.at,86-Jähriger in Wald abgestürzt,Ein 86-jähriger Mann aus dem Bezirk Hermagor ist am Mittwochnachmittag nach einem Sturz in steiles Gelände gerettet worden. Die Bergung des Verletzten wurde mit dem Tau vom Hubschrauber aus durchgeführt.,https://ibs.orf.at/ktn?image=https%3A%2F%2Foekastatic.orf.at%2Fmojo%2F1_4_1%2Fstoryserver%2Foeka%2Fcommon%2Fimages%2Fog-fallback-ktn.png%3Fs%3Dd1ef40bef2ffd65644b4df37900c0e4d80e97249,2025-10-02T04:36:13Z,,"Am Nachmittag gegen 16.00 Uhr wurden die Beamten der Polizeiinspektion Liesing über einen Unfall im hochalpinen Gelände, im Bereich des Niedergailer Tals (Gemeinde Lesachtal), informiert. Nach Eintre… [+425 chars]",,de,'Tau'
https://www.sueddeutsche.de/gesundheit/flugreisen-notfaelle-medizin-li.3319036,https://www.sueddeutsche.de/gesundheit/flugreisen-notfaelle-medizin-li.3319036,0,www.sueddeutsche.de,Flugmedizin: Not über den Wolken,"Übelkeit, Blasensprung, Schlaganfall: Eine große Studie hat untersucht, zu welchen medizinischen Zwischenfällen es in Flugzeugen kommt. Die gute Nachricht: Ziemlich wahrscheinlich ist ein Arzt an Bord.",https://www.sueddeutsche.de/2025/10/01/6525c96f-48d7-48e0-ac22-4072b67e80a7.jpg?q=60&fm=webp&width=1200&rect=0%2C209%2C4000%2C2250,2025-10-02T05:00:00Z,,"Zählt man all die Passagiere der heutzutage umherfliegenden Maschinen zusammen, dann befinden sich zu jedem Zeitpunkt etwa 1,5 Millionen Menschen in der Luft. Das ist, als würden sich alle Einwohner … [+249 chars]",,de,'Not'
https://www.faz.net/aktuell/rhein-main/frankfurt/hessen-muss-bei-den-kommunalfinanzen-handeln-110712847.html,https://www.faz.net/aktuell/rhein-main/frankfurt/hessen-muss-bei-den-kommunalfinanzen-handeln-110712847.html,0,www.faz.net,Städte in Not: Das Land Hessen muss bei den Kommunalfinanzen handeln,Das Beispiel Taunusstein zeigt die dramatische Lage der Kommunalfinanzen in Hessen. Ohne baldige Reform drohen Städten und Gemeinden massive Einschnitte.,https://media0.faz.net/ppmedia/w1200/aktuell/2761870151/1.7268740/facebook_teaser/die-finanzlage-vieler-kommunen.jpg.webp,2025-10-02T06:38:51Z,,"Taunusstein ist mit mehr als 30.000 Einwohnern nicht nur die größte Stadt im Rheingau-Taunus-Kreis. Sie gilt auch als wirtschaftlich potent, beheimatet viele interessante Unternehmen und gilt zu Rech… [+2077 chars]",,de,'Not'
https://www.globenewswire.com/news-release/2025/10/02/3160106/0/en/HSBC-Continental-Europe-Post-Stabilisation-Notice.html,https://www.globenewswire.com/news-release/2025/10/02/3160106/0/en/HSBC-Continental-Europe-Post-Stabilisation-Notice.html,0,www.globenewswire.com,HSBC Continental Europe: Post Stabilisation Notice,"PARIS, Oct.  02, 2025  (GLOBE NEWSWIRE) --   Münchener Rückversicherungs-GesellschaftAktiengesellschaft in München  HSBC (contact:......",,2025-10-02T07:00:00Z,,"PARIS, Oct. 02, 2025 (GLOBE NEWSWIRE) -- 
Münchener Rückversicherungs-GesellschaftAktiengesellschaft in München
HSBC (contact: syndexecution@noexternalmail.hsbc.com) hereby gives notice that no sta… [+1120 chars]",,de,'Not'
https://www.focus.de/wissen/wein-optimal-lagern-so-beeinflusst-der-verschluss-geschmack-und-haltbarkeit_e3202b48-e5ce-455f-8454-add50f1f52c3.html,https://www.focus.de/wissen/wein-optimal-lagern-so-beeinflusst-der-verschluss-geschmack-und-haltbarkeit_e3202b48-e5ce-455f-8454-add50f1f52c3.html,0,www.focus.de,Wein optimal lagern: So beeinflusst der Verschluss Geschmack und Haltbarkeit,"Weinliebhaber stehen oft vor der Frage: Welcher Verschluss ist der beste für ihren edlen Tropfen? Ernährungswissenschaftler Uwe Knop beleuchtet die Vor- und Nachteile von Naturkork, Schraubverschluss und Co. und erklärt, welcher Verschluss für welchen Weintyp…",https://quadro.burda-forward.de/ctf/6d1e99cc-6d47-4699-8885-a66e29d5d808.9eaa60e5-b01f-4cc7-8102-246a65a1ed8f.jpg?im=RegionOfInterestCrop%3D%281200%2C630%29%2CregionOfInterest%3D%281148%2C768%29&hash=a48b043001b9124dd6553a4eb4c5750fdb6c856568d16afcdde008326d701647,2025-10-02T07:36:09Z,,"Wein oder nicht Wein - welcher Verschluss soll es sein: Welche Weinverschlüsse gibt es?
Die gängigsten Weinverschlüsse sind der Naturkork, der Silikonkork, der Schraubverschluss (Screw Cap) und der … [+3481 chars]",,de,'Wein'
https://taz.de/Wegen-Gas-Import/!6117414/,https://taz.de/Wegen-Gas-Import/!6117414/,0,taz.de,Wegen Gas-Import: Greenpeace blockiert Hafen in Belgien,"Um ihren Energiebedarf zu decken, importiert die EU Flüssigerdgas – auch aus Moskau. Nun blockieren Greenpeace-Aktivisten einen Hafen.",https://taz.de/picture/7963930/1200/550368017.jpeg,2025-10-02T08:23:00Z,,"Um ihren Energiebedarf zu decken, importiert die EU Flüssigerdgas – auch aus Moskau. Nun blockieren Greenpeace-Aktivisten einen Hafen. mehr...",,de,'Gas'
https://www.stern.de/gesellschaft/regional/bayern/weinbau--fraenkische-winzer-unter-druck---zwei-bocksbeutel-je-rebe-36099180.html,https://www.stern.de/gesellschaft/regional/bayern/weinbau--fraenkische-winzer-unter-druck---zwei-bocksbeutel-je-rebe-36099180.html,0,www.stern.de,Weinbau: Fränkische Winzer unter Druck - zwei Bocksbeutel je Rebe,Veitshöchheim (lby) - Die etwa 3.400 Winzer in Franken stehen nach Angaben ihres Branchenverbandes vor wirtschaftlich schwierigen Zeiten. Der Preiskampf,https://image.stern.de/36100100/t/Pk/v1/w1440/r1.7778/-/02--bmp6veckdxv6axs2048jpeg---bda152b949706bf0.jpg,2025-10-02T08:54:38Z,,"Kopiere den aktuellen Link
Zur Merkliste hinzufügen
Wetterkapriolen bereiten den fränkischen Winzern heuer wenig Probleme. Die hohen Kosten dagegen schon. Die Lese ist rasant, der Verkauf stockt.
… [+3329 chars]",,de,'Wein'
https://www.zeit.de/news/2025-10/02/giftiges-gas-tritt-in-magdeburg-aus,https://www.zeit.de/news/2025-10/02/giftiges-gas-tritt-in-magdeburg-aus,0,www.zeit.de,Notfälle: Giftiges Gas tritt in Magdeburg aus,Hier finden Sie Informationen zu dem Thema „Notfälle“. Lesen Sie jetzt „Giftiges Gas tritt in Magdeburg aus“.,https://img.zeit.de/news/2025-10/02/giftiges-gas-tritt-in-magdeburg-aus-image-group/wide__1300x731,2025-10-02T09:55:40Z,,"Giftiges Gas tritt in Magdeburg aus dem Keller eines Wohnhauses aus. Der Verdacht bestehe, dass es sich dabei um Monophosphan handele, sagte eine Sprecherin der Polizei Magdeburg. Fünf Menschen werde… [+364 chars]",,de,'Gas'
https://www.faz.net/aktuell/gesellschaft/erntehelfer-in-der-pfalz-ist-es-das-wert-so-ein-leben-in-deutschland-110710397.html,https://www.faz.net/aktuell/gesellschaft/erntehelfer-in-der-pfalz-ist-es-das-wert-so-ein-leben-in-deutschland-110710397.html,0,www.faz.net,"Erntehelfer in der Pfalz: Ist es das wert, so ein Leben in Deutschland?","Nicht meckern – schaffen. Denn ohne Saisonkräfte und Helfer wie ihn fiele die Ernte aus: Adam Kuchyt aus Polen arbeitet auf einem Weingut in der Pfalz. Seine Familie sieht er selten. Besuch bei einem, der viel alleine ist.",https://media0.faz.net/ppmedia/w1200/aktuell/1725627163/1.10710436/facebook_teaser/049f494e-895d-11f0-a7ca.jpg.webp,2025-10-02T10:35:44Z,,"Seinen Tag beginnt er mit einem Zigarillo, Marke JPS Red Filter, 3,10 Euro die Schachtel. Ein hektischer Zug. Adam blickt über die Weinberge, die vor ihm liegen wie ein grüngelbes, ruhiges Meer. Es i… [+549 chars]",,de,'Wein'
https://www.sueddeutsche.de/muenchen/muenchen-weinbar-garbo-glockenbachviertel-li.3296818,https://www.sueddeutsche.de/muenchen/muenchen-weinbar-garbo-glockenbachviertel-li.3296818,0,www.sueddeutsche.de,Weinbar Garbo: Wo so mancher Gast länger bleibt,"Im Garbo im Glockenbachviertel bleiben viele den ganzen Abend über bei einer Flasche Wein sitzen. Die Empfehlungen des Personals sind oft treffsicher – doch es lohnt sich, nach dem Preis zu fragen.",https://www.sueddeutsche.de/2025/09/30/46b856f0-143e-41ba-a45d-4cac50f74280.jpg?q=60&fm=webp&width=1200&rect=0%2C210%2C4000%2C2250,2025-10-02T11:54:25Z,,"Beim zweiten Wurf sollte der Wein im Fokus stehen, Hirschlers und Grablers Steckenpferd. Beide sind gelernte Sommeliers und leiteten gemeinsam die Weinbar Grapes im Cortiina Hotel, bevor sie sich sel… [+3068 chars]",,de,'Wein'
https://www.zeit.de/news/2025-10/02/planet-verschlingt-gas-in-rekordtempo,https://www.zeit.de/news/2025-10/02/planet-verschlingt-gas-in-rekordtempo,0,www.zeit.de,Tonnenweise Appetithäppchen: Planet verschlingt Gas in Rekordtempo,Hier finden Sie Informationen zu dem Thema „Tonnenweise Appetithäppchen“. Lesen Sie jetzt „Planet verschlingt Gas in Rekordtempo“.,https://img.zeit.de/news/2025-10/02/planet-verschlingt-gas-in-rekordtempo-image-group/wide__1300x731,2025-10-02T12:17:40Z,,Sechs Milliarden Tonnen pro Sekunde - mit dieser Rate hat sich der Planet «Cha 1107-7626» im August 2025 Gas und Staub aus seiner Umgebung einverleibt. Es handle sich um die größte je bei einem Plane… [+1112 chars],,de,'Gas'
https://www.zeit.de/news/2025-10/02/kammern-fordern-festhalten-am-flaechenziel-fuer-windkraft,https://www.zeit.de/news/2025-10/02/kammern-fordern-festhalten-am-flaechenziel-fuer-windkraft,0,www.zeit.de,Windenergie: Kammern fordern Festhalten am Flächenziel für Windkraft,Hier finden Sie Informationen zu dem Thema „Windenergie“. Lesen Sie jetzt „Kammern fordern Festhalten am Flächenziel für Windkraft“.,https://img.zeit.de/news/2025-10/02/kammern-fordern-festhalten-am-flaechenziel-fuer-windkraft-image-group/wide__1300x731,2025-10-02T14:15:05Z,,"Die drei sächsischen Industrie- und Handelskammern (IHK) kritisieren den Vorstoß der Ost-Ministerpräsidenten, das Zwei-Prozent-Flächenziel beim Windkraft-Ausbau zu kippen. Ständige Änderungen der pol… [+1741 chars]",,de,'Gas'
https://www.zeit.de/news/2025-10/03/akuter-mangel-in-sachsen-fehlt-es-an-pflegefamilien,https://www.zeit.de/news/2025-10/03/akuter-mangel-in-sachsen-fehlt-es-an-pflegefamilien,0,www.zeit.de,"Hilfe in der Not: ""Akuter Mangel"" - In Sachsen fehlt es an Pflegefamilien","Hier finden Sie Informationen zu dem Thema „Hilfe in der Not“. Lesen Sie jetzt „""Akuter Mangel"" - In Sachsen fehlt es an Pflegefamilien“.",https://img.zeit.de/news/2025-10/03/akuter-mangel-in-sachsen-fehlt-es-an-pflegefamilien-image-group/wide__1300x731,2025-10-03T03:20:06Z,,"In Sachsen fehlt es an Pflegefamilien. «Vielerorts werden sie händeringend gesucht», sagte die Sprecherin der Diakonie Sachsen, Nora Köhler. Die Lage aktuell sei kritisch, es gebe einen «akuten Mange… [+3792 chars]",,de,'Not'
https://www.welt.de/wirtschaft/weltplus/article68de4fff8016f8118e2fa4ca/stilllegung-von-gasspeichern-verlust-vieler-gasspeicher-droht-das-bizarre-problem-des-deutschen-energiemarkts.html,https://www.welt.de/wirtschaft/weltplus/article68de4fff8016f8118e2fa4ca/stilllegung-von-gasspeichern-verlust-vieler-gasspeicher-droht-das-bizarre-problem-des-deutschen-energiemarkts.html,0,www.welt.de,Verlust vieler Gasspeicher droht – Das bizarre Problem des deutschen Energiemarkts,Zu Beginn der Heizsaison sind viele Gasspeicher in Deutschland nur unzureichend gefüllt. Der Staatskonzern Uniper beantragt jetzt sogar die Stilllegung des drittgrößten deutschen Speichers. Der Grund überrascht – und offenbart ein großes Versorgungsrisiko für…,https://images.welt.de/68de4fff8016f8118e2fa4ca/a5bc7e7513b65a5f221929f637b3edb2/ci16x9-w1200/gasspeicher-fuellen-sich-schneller-als-vermutet,2025-10-03T04:10:55Z,,Zu Beginn der Heizsaison sind viele Gasspeicher in Deutschland nur unzureichend gefüllt. Der Staatskonzern Uniper beantragt jetzt sogar die Stilllegung des drittgrößten deutschen Speichers. Der Grund… [+7284 chars],,de,'Gas'
https://www.stern.de/lifestyle/leute/fatih-akin--filmemacher-rettete-ehepaar-vor-dem-ertrinken-36103116.html,https://www.stern.de/lifestyle/leute/fatih-akin--filmemacher-rettete-ehepaar-vor-dem-ertrinken-36103116.html,0,www.stern.de,Fatih Akin: Filmemacher rettete Ehepaar vor dem Ertrinken,Fatih Akin rettete in North Dakota ein Ehepaar aus einem überfluteten Auto. Trotz eisiger Kälte zog er die beiden aus dem Wagen.,https://image.stern.de/36103120/t/WZ/v1/w1440/r1.7778/-/03--filmemacher-rettete-ehepaar-vor-dem-ertrinken---16-9---spoton-article-1115837.jpg,2025-10-03T07:45:00Z,,"Kopiere den aktuellen Link
Zur Merkliste hinzufügen
Fatih Akin rettete in North Dakota ein Ehepaar aus einem überfluteten Auto. Trotz eisiger Kälte zog er die beiden aus dem Wagen.
Es war eine Rec… [+2470 chars]",,de,'Kälte'
https://www.faz.net/aktuell/stil/essen-trinken/getraenke/tipps-fuer-die-weinprobe-darauf-sollten-sie-bei-weinen-achten-accg-110704710.html,https://www.faz.net/aktuell/stil/essen-trinken/getraenke/tipps-fuer-die-weinprobe-darauf-sollten-sie-bei-weinen-achten-accg-110704710.html,0,www.faz.net,"Tipps für die Weinprobe: So finden Sie heraus, welcher Wein Ihnen wirklich schmeckt",Sie verstehen nichts von Wein? Macht nichts! Mit diesen Tipps verkosten Sie bei der nächsten Weinprobe wie ein Profi.,https://media0.faz.net/ppmedia/w1200/aktuell/4217488583/1.10704706/facebook_teaser/fassen-sie-das-glas-am-stiel.jpg.webp,2025-10-03T11:47:10Z,,"Hand aufs Herz: Haben Sie bei einer Weinprobe schon mal Wein gekauft, der Ihnen zu Hause nicht mehr geschmeckt hat? Oder wurden Sie schon mal in Verlegenheit gebracht, als der Winzer Sie nach Ihrer M… [+242 chars]",,de,'Wein'
https://www.n-tv.de/politik/Russland-attackiert-ukrainische-Gasinfrastruktur-wie-nie-zuvor-article26073314.html,https://www.n-tv.de/politik/Russland-attackiert-ukrainische-Gasinfrastruktur-wie-nie-zuvor-article26073314.html,0,www.n-tv.de,Zu Beginn der Heizperiode: Russland attackiert ukrainische Gasinfrastruktur wie nie zuvor,"Es gehört leider schon zur Gewohnheit: Beginnt die kalte Jahreszeit, attackiert Russland die ukrainische Energie-Infrastruktur, um die Bevölkerung mürbe zu machen. Einen so schweren Angriff wie nun gab es bisher jedoch nicht. Kiew hat sich jedoch vorbereitet.",https://www.n-tv.de/img/incoming/crop26073337/0441328898-cImg_16_9-w1200/457452040.jpg,2025-10-03T14:06:14Z,,"Es gehört leider schon zur Gewohnheit: Beginnt die kalte Jahreszeit, attackiert Russland die ukrainische Energie-Infrastruktur, um die Bevölkerung mürbe zu machen. Einen so schweren Angriff wie nun g… [+2738 chars]",,de,'Gas'
https://www.stern.de/gesellschaft/regional/rheinland-pfalz-saarland/saarbruecken--einheitsfest--gut-gelaunte-politiker---und-besucher-36103884.html,https://www.stern.de/gesellschaft/regional/rheinland-pfalz-saarland/saarbruecken--einheitsfest--gut-gelaunte-politiker---und-besucher-36103884.html,0,www.stern.de,Saarbrücken: Einheitsfest: Gut gelaunte Politiker – und Besucher,"Dichtes Gedränge, 600 Künstler, kulinarische Leckerbissen und politische Prominenz: Warum das kleine Saarland beim Einheitsfest für Begeisterung sorgte – trotz etwas Frust über den ÖPNV.",https://image.stern.de/36103886/t/uh/v2/w1440/r1.7778/-/03--b3rtf2a3lgv23axs2048jpeg---c3137651a9648df6.jpg,2025-10-03T14:59:14Z,,"Kopiere den aktuellen Link
Zur Merkliste hinzufügen
Dichtes Gedränge, 600 Künstler, kulinarische Leckerbissen und politische Prominenz: Warum das kleine Saarland beim Einheitsfest für Begeisterung … [+2228 chars]",,de,'ÖPNV'
https://www.bild.de/sport/fussball/preussen-stuermer-gibt-gas-schweden-oscar-plant-den-3-streich-68dfe7eadc95f1f53102ad1a,https://www.bild.de/sport/fussball/preussen-stuermer-gibt-gas-schweden-oscar-plant-den-3-streich-68dfe7eadc95f1f53102ad1a,0,www.bild.de,Preußen-Stürmer gibt Gas - „Schweden-Oscar“ plant den 3. Streich,Nach zuletzt zwei Toren in Folge will Preußen-Stürmer Oscar Vilhelmsson auch gegen Hertha treffen. Und so zur gelungenen Revanche fürs Pokal-Aus beitragen.,"https://images.bild.de/68dfe7eadc95f1f53102ad1a/eb96a8437f99fa92ef901acfe1ef66eb,3c20e813?w=1280",2025-10-03T16:58:27Z,,"Keine Frage, er hat wieder Blut geleckt...
Preußen-Stürmer gibt Gas. Schweden-Oscar plant den 3. Streich.
Das hat sich verdammt gut angefühlt. Jetzt will ich natürlich mehr. Nach seinen ersten beid… [+3281 chars]",,de,'Gas'
