index,url,valid,domain,title,description,image,published,archive,content,quote,language,keyword
https://www.stern.de/gesellschaft/regional/mecklenburg-vorpommern/anschlaege-auf-gaspipelines--nord-stream-verdaechtiger--polnisches-gericht-entscheidet-36132732.html,https://www.stern.de/gesellschaft/regional/mecklenburg-vorpommern/anschlaege-auf-gaspipelines--nord-stream-verdaechtiger--polnisches-gericht-entscheidet-36132732.html,0,www.stern.de,Anschläge auf Gaspipelines: Nord-Stream-Verdächtiger: Polnisches Gericht entscheidet,Der Nord-Stream-Anschlag sorgte vor drei Jahren für Schlagzeilen. Ein Verdächtiger sitzt in Polen in U-Haft. Die deutsche Justiz erwartet seine Auslieferung.,https://image.stern.de/36132734/t/XM/v1/w1440/r1.7778/-/15--zwapfmjl67v9axs2048jpeg---9cf761b707af203e.jpg,2025-10-15T08:17:39Z,,"Kopiere den aktuellen Link
Zur Merkliste hinzufügen
Der Nord-Stream-Anschlag sorgte vor drei Jahren für Schlagzeilen. Ein Verdächtiger sitzt in Polen in U-Haft. Die deutsche Justiz erwartet seine A… [+2274 chars]",,de,'Gas'
https://www.n-tv.de/leute/Christian-Rach-versalzt-die-Suppe-article26099191.html,https://www.n-tv.de/leute/Christian-Rach-versalzt-die-Suppe-article26099191.html,0,www.n-tv.de,Nächster Abschied vom Henssler: Christian Rach versalzt die Suppe,"Mit den Gästen Tim Bendzko, Panagiota Petridou und Stefano Zarrella endet das ""Sommer-Special"" von ""Grill den Henssler"". Doch einer gießt beim fulminanten Staffelfinale Wasser in den Wein: Christian Rach verabschiedet sich nach 103 Sendungen.",https://www.n-tv.de/img/incoming/crop26099203/2821327425-cImg_16_9-w1200/7F96F.jpg,2025-10-15T13:57:45Z,,"Mit den Gästen Tim Bendzko, Panagiota Petridou und Stefano Zarrella endet das ""Sommer-Special"" von ""Grill den Henssler"". Doch einer gießt beim fulminanten Staffelfinale Wasser in den Wein: Christian … [+2289 chars]",,de,'Wein'
https://www.zeit.de/news/2025-10/15/rom-stoppt-auslieferung-von-nord-stream-verdaechtigem,https://www.zeit.de/news/2025-10/15/rom-stoppt-auslieferung-von-nord-stream-verdaechtigem,0,www.zeit.de,Anschläge auf Gaspipelines: Rom stoppt Auslieferung von Nord-Stream-Verdächtigem,Hier finden Sie Informationen zu dem Thema „Anschläge auf Gaspipelines“. Lesen Sie jetzt „Rom stoppt Auslieferung von Nord-Stream-Verdächtigem“.,https://img.zeit.de/news/2025-10/15/rom-stoppt-auslieferung-von-nord-stream-verdaechtigem-image-group/wide__1300x731,2025-10-15T16:23:37Z,,Italien hat die geplante Auslieferung des mutmaßlichen Drahtziehers der Anschläge auf die Nord-Stream-Gasleitungen 2022 in der Ostsee an Deutschland gestoppt. Das oberste italienische Gericht in Rom … [+2669 chars],,de,'Gas'
https://www.faz.net/aktuell/stil/trends-nischen/rita-ora-und-anna-lahey-beantworten-den-f-a-z-fragebogen-110697915.html,https://www.faz.net/aktuell/stil/trends-nischen/rita-ora-und-anna-lahey-beantworten-den-f-a-z-fragebogen-110697915.html,0,www.faz.net,"Rita Ora im Fragebogen: „Negroni, Wein, Porn Star Martini, Tequila, ich nehme alles“",Eigentlich ist Rita Ora für Musik bekannt – statt eines Albums hat sie nun aber eine Haarpflegeserie herausgebracht. Im Stil-Fragebogen spricht sie über ihren Aberglauben und verrät ihr bestes Smalltalk-Thema.,https://media1.faz.net/ppmedia/w1200/aktuell/feuilleton/4080418590/1.10706767/facebook_teaser/rita-ora-steht-im-september.jpg.webp,2025-10-15T18:47:44Z,,"Wird sie singen? Das fragt sich Rita Ora wohl selbst bei ihrem Besuch in Düsseldorf. Gekommen ist die 34 Jahre alte Sängerin, um mit ihrer Geschäftspartnerin Anna Lahey und dem Parfümerieunternehmen … [+5229 chars]",,de,'Wein'
https://www.zeit.de/zeit-magazin/wochenmarkt/2025/09/fruehstueckskekse-italien-backen-rezept-wochenmarkt,https://www.zeit.de/zeit-magazin/wochenmarkt/2025/09/fruehstueckskekse-italien-backen-rezept-wochenmarkt,0,www.zeit.de,Italienische Frühstückskekse: Gebäck auf Stippvisite,"Sie gehen hell golden auf und duften nach Orange. Obendrein nach Kaffee oder Wein, je nachdem, wo Sie die Biscotti einstippen. Einfach so wegknuspern geht aber auch.",https://img.zeit.de/zeit-magazin/wochenmarkt/2025-10/fruehstueckskekse-italien-backen-rezept-wochenmarkt-bild-2/wide__1300x731,2025-10-16T05:39:16Z,,"Die Bäckerei ""Passi"" in Rom ist ein langer, ziemlich schmaler Schlauch mit Terrazzo-Fliesen und einer L-förmigen Glastheke. Selbst am kältesten Tag ist es dort warm. Und wenn es regnet, wird der Bode… [+355 chars]",,de,'Wein'
https://www.stern.de/wirtschaft/geld/mit-dem-rentenausweis-sparen--diese-verguenstigungen-bekommen-sie-36050296.html,https://www.stern.de/wirtschaft/geld/mit-dem-rentenausweis-sparen--diese-verguenstigungen-bekommen-sie-36050296.html,0,www.stern.de,Von ÖPNV bis Zoo: Diese Rabatte gibt es mit dem Rentenausweis,"Theatertickets, Eintritt im Zoo oder Bahnfahrkarten: Der Rentenausweis bringt Senioren zahlreiche Vergünstigungen. Ein kleiner Überblick über mögliche Rabatte.",https://image.stern.de/36050500/t/9w/v4/w1440/r1.7778/-/diese-rabatte-gibt-es-mit-dem-rentenausweis.jpg,2025-10-16T06:57:00Z,,"Kopiere den aktuellen Link
Zur Merkliste hinzufügen
Theatertickets, Eintritt im Zoo oder Bahnfahrkarten: Der Rentenausweis bringt Senioren zahlreiche Vergünstigungen. Ein kleiner Überblick über mög… [+3324 chars]",,de,'ÖPNV'
https://www.morgenpost.de/wirtschaft/article410212442/heizoelpreise-aktuell-heute-16-oktober-2025-heizoel-kaufen-heizung.html,https://www.morgenpost.de/wirtschaft/article410212442/heizoelpreise-aktuell-heute-16-oktober-2025-heizoel-kaufen-heizung.html,0,www.morgenpost.de,Heizölpreise am Donnerstag (16. Oktober): Der aktuelle Preis pro Liter,Mit den sinkenden Temperaturen drehen viele die Heizung wieder auf. Unser Überblick zeigt die aktuellen Heizölpreise vom 16. Oktober.,https://img.sparknews.funkemedien.de/406858449/406858449_1728458201_v16_9_1600.jpeg,2025-10-16T07:03:34Z,,Mit den herbstlichen Temperaturen denken viele an die wohlige Wärme daheim. In vielen deutschen Haushalten werden die Heizungen wieder in Betrieb genommen. Das lenkt natürlich den Blick vieler Verbra… [+8312 chars],,de,'Heizung'
https://www.morgenpost.de/wirtschaft/article410212282/pelletspreise-aktuell-heute-16-oktober-holz-pellets-heizung-kaufen-preis-tonne.html,https://www.morgenpost.de/wirtschaft/article410212282/pelletspreise-aktuell-heute-16-oktober-holz-pellets-heizung-kaufen-preis-tonne.html,0,www.morgenpost.de,Pelletspreise heute (16. Oktober): Der aktuelle Preis pro Tonne,Der Herbst bringt Regen und Kälte – und die Pelletöfen laufen wieder heiß. Und die Pelletspreise? Ein Überblick vom 16. Oktober.,https://img.sparknews.funkemedien.de/406640804/406640804_1719220732_v16_9_1600.jpeg,2025-10-16T07:13:01Z,,"Die Herbsttage bringen Regen und sinkende Temperaturen für viele Zeit, den Pelletvorrat zu prüfen. Doch wie entwickeln sich die Pelletspreise aktuell? Lohnt es sich, jetzt die Vorräte aufzufüllen? In… [+6065 chars]",,de,'Heizung'
https://www.focus.de/finanzen/news/morgen-kann-reiche-putin-den-gashahn-zudrehen-verbrauchern-auch_a01117e2-793a-4a1b-aa61-46ce8f979183.html,https://www.focus.de/finanzen/news/morgen-kann-reiche-putin-den-gashahn-zudrehen-verbrauchern-auch_a01117e2-793a-4a1b-aa61-46ce8f979183.html,0,www.focus.de,Morgen kann Reiche Putin den Gashahn zudrehen – Verbrauchern auch?,"Am Montag beraten die EU-Minister, ob ihre Länder schon 2027 aus russischen Gasimporten aussteigen. Tun sie es, prägen sie den Ukraine-Krieg – und Ihre Gasrechnung.",https://quadro.burda-forward.de/ctf/f0621fd2-d195-44b4-9afd-962d67a8ece9.804a4494-e97a-41a3-8c92-0c07c254ec0d.jpg?im=RegionOfInterestCrop%3D%281200%2C630%29%2CregionOfInterest%3D%28262%2C100%29&hash=9b5a62e6af818ac00c6dcdbd3293ff324805d5069f8b8a3d41de4e62f4246040,2025-10-16T08:15:06Z,,"Am Montag beraten Katherina Reiche (CDU) und ihre Kollegen einen der wichtigsten Schritte zur Unterstützung der Ukraine im Krieg gegen Russland seit Langem. Bei der Tagung des EU-Rats für Verkehr, Te… [+5645 chars]",,de,'Heizung'
https://www.sueddeutsche.de/muenchen/gastronomie-muenchen-starnberger-see-woerthsee-tapas-vincent-fricke-li.3325889,https://www.sueddeutsche.de/muenchen/gastronomie-muenchen-starnberger-see-woerthsee-tapas-vincent-fricke-li.3325889,0,www.sueddeutsche.de,Was läuft in der Gastro?: Altes neu interpretiert,Die Münchner Food-Profis Vincent Fricke und Marc Christian toben sich am Starnberger See bei einem speziellen Event mit gereiften Produkten aus. In Wörthsee gibt es neuerdings bayerische Tapas – und in Haidhausen wandelt sich der Simplicissimus in den Stehaus…,https://www.sueddeutsche.de/2025/10/15/b4ba0306-c640-4c2f-904b-c2ed9b8f67e8.jpg?q=60&fm=webp&width=1200&rect=198%2C120%2C992%2C558,2025-10-16T09:54:12Z,,"Er sieht die Menschheit schon allein wegen der gegenwärtigen geopolitischen Lage auf einer Art Schwelle: Entweder werden wir reifer und besser, oder wir verfallen. Seine und Christians neue Idee soll… [+3239 chars]",,de,'Wein'
https://www.sueddeutsche.de/projekte/artikel/reise/frankreich-burgund-wein-kulinarik-fahrrad-reise-e938191/,https://www.sueddeutsche.de/projekte/artikel/reise/frankreich-burgund-wein-kulinarik-fahrrad-reise-e938191/,0,www.sueddeutsche.de,Frankreich: Auf dem Rad durch das Burgund,"In dieser Gegend werden die besten und teuersten Weine Frankreichs gemacht. Der Herbst ist eine hervorragende Zeit für Kostproben auf Märkten, in Restaurants und Kellern. Besonders schön lässt sich das auf einer Genuss-Fahrradtour von Dijon nach Beaune erlebe…","https://www.sueddeutsche.de/projekte/artikel/reise/frankreich-burgund-wein-kulinarik-fahrrad-reise-e938191/e1195333b4079cbc78a4a04320d5be66fd410b58ec3780f03b53d5052544b52a_w2400_h1256_r232,0,3543,1854_q70.jpg",2025-10-16T11:22:00Z,,"Wer wissen möchte, wie wichtig den Menschen im Burgund gute Lebensmittel sind, der sollte die große Markthalle von Dijon betreten. Und wer wissen möchte, wie wichtig den Menschen in Burgund der Wein … [+497 chars]",,de,'Wein'
https://www.spektrum.de/news/unerwartet-hohe-konzentration-von-alzheimer-biomarker-bei-neugeborenen/2290938,https://www.spektrum.de/news/unerwartet-hohe-konzentration-von-alzheimer-biomarker-bei-neugeborenen/2290938,0,www.spektrum.de,Neurodegenerative Erkrankungen: Unerwartet hohe Konzentration von Alzheimer-Biomarker bei Neugeborenen,Neue Erkenntnisse zeigen überraschende pTau217-Werte bei Neugeborenen und eröffnen neue Perspektiven für die Alzheimer-Forschung und -Behandlung.,https://static.spektrum.de/fm/912/f1920x1080/GettyImages-923849186.jpg,2025-10-16T12:22:16Z,,"Exklusive Übersetzung aus
Dies ist eine maschinell erzeugte Übersetzung eines Artikels der internationalen Partner von Spektrum.de. Er wurde von uns überprüft, jedoch nicht redaktionell bearbeitet. … [+8750 chars]",,de,'Tau'
https://www.nzz.ch/wissenschaft/der-co2-gehalt-in-der-luft-ist-so-stark-gestiegen-wie-noch-nie-seit-messbeginn-was-bedeutet-der-rekord-ld.1907359,https://www.nzz.ch/wissenschaft/der-co2-gehalt-in-der-luft-ist-so-stark-gestiegen-wie-noch-nie-seit-messbeginn-was-bedeutet-der-rekord-ld.1907359,0,www.nzz.ch,Der CO2-Gehalt in der Luft ist so stark gestiegen wie noch nie seit Messbeginn. Was bedeutet der Rekord?,Vor allem Dürren und Waldbrände haben zu dem hohen Zuwachs des Treibhausgases CO2 beigetragen. Das meldet die Weltmeteorologieorganisation.,"https://img.nzz.ch/2025/10/16/53574c3c-1611-401c-a8e2-e797292381b1.jpg?width=1200&height=675&fit=bounds&quality=75&auto=webp&crop=4580,2577,x508,y547&wmark=nzz",2025-10-16T14:00:00Z,,"Vor allem Dürren und Waldbrände haben zu dem hohen Zuwachs des Treibhausgases CO2 beigetragen. Das meldet die Weltmeteorologieorganisation.
Die Verbrennung von Kohle ist eine der wichtigsten Quellen… [+3422 chars]",,de,'Dürre'
https://www.n-tv.de/wissen/Australiens-Regenwaelder-stossen-mehr-CO2-aus-als-sie-speichern-article26101521.html,https://www.n-tv.de/wissen/Australiens-Regenwaelder-stossen-mehr-CO2-aus-als-sie-speichern-article26101521.html,0,www.n-tv.de,Klimawandel ist Hauptursache: Australiens Regenwälder stoßen mehr CO2 aus als sie speichern,"Die Tropen Australiens leiden zunehmend unter Hitze, Dürre und Wirbelstürmen. Einst als große CO2-Speicher bekannt, stoßen sie nun selbst klimaschädliches CO2 aus, wie Forscher feststellen. Auch in anderen Urwäldern nimmt die Speicherkapazität ab.",https://www.n-tv.de/img/incoming/crop26101601/4431325425-cImg_16_9-w1200/427821757.jpg,2025-10-16T14:37:36Z,,"Die Tropen Australiens leiden zunehmend unter Hitze, Dürre und Wirbelstürmen. Einst als große CO2-Speicher bekannt, stoßen sie nun selbst klimaschädliches CO2 aus, wie Forscher feststellen. Auch in a… [+3253 chars]",,de,'Dürre'
https://taz.de/Radikale-Entmietungspraktiken/!6121130/,https://taz.de/Radikale-Entmietungspraktiken/!6121130/,0,taz.de,Radikale Entmietungspraktiken: Winter ohne Heizung,"In der Habersaathstraße will ein Vermieter den Be­woh­ne­r:in­nen die Heizung abdrehen, um sie zum Auszug zu bewegen. Das Bezirksamt prüft den Fall.",https://taz.de/picture/7996148/1200/39484026.jpeg,2025-10-16T15:00:00Z,,"In der Habersaathstraße will ein Vermieter den Be­woh­ne­r:in­nen die Heizung abdrehen, um sie zum Auszug zu bewegen. Das Bezirksamt prüft den Fall. mehr...",,de,'Heizung'
https://www.jungewelt.de/artikel/510542.energiekosten-wenn-die-wohnung-kalt-bleibt.html,https://www.jungewelt.de/artikel/510542.energiekosten-wenn-die-wohnung-kalt-bleibt.html,0,www.jungewelt.de,Energiekosten: Wenn die Wohnung kalt bleibt [Online-Abo],"Millionen Menschen müssen wegen Armut den Winter ohne Heizung verbringen. Besonders betroffen sind Pflegende, Eltern und Erwerbslose.",https://www.jungewelt.de/img/1100/214546.jpg,2025-10-16T17:40:55Z,,"Uneingeschränkter Zugriff auf alle Inhalte: Erleben Sie die Tageszeitung junge Welt in gedruckter oder digitaler Form oder beides kombiniert.
Nachrichtenauswahl und -aufbereitung erfordern finanziel… [+458 chars]",,de,'Heizung'
https://www.zeit.de/news/2025-10/17/studie-sieht-grosses-potenzial-fuer-oepnv-ausbau-in-bayern,https://www.zeit.de/news/2025-10/17/studie-sieht-grosses-potenzial-fuer-oepnv-ausbau-in-bayern,0,www.zeit.de,Busse und Bahnen: Studie sieht großes Potenzial für ÖPNV-Ausbau in Bayern,Hier finden Sie Informationen zu dem Thema „Busse und Bahnen“. Lesen Sie jetzt „Studie sieht großes Potenzial für ÖPNV-Ausbau in Bayern“.,https://img.zeit.de/news/2025-10/17/studie-sieht-grosses-potenzial-fuer-oepnv-ausbau-in-bayern-image-group/wide__1300x731,2025-10-17T03:00:06Z,,"Durch massive Investitionen in den öffentlichen Personennahverkehr (ÖPNV) könnten die Fahrgastzahlen laut einer Studie in den nächsten 15 Jahren deutlich zunehmen. Die Untersuchung geht davon aus, da… [+2873 chars]",,de,'ÖPNV'
https://www.stern.de/gesellschaft/regional/bayern/busse-und-bahnen--studie-sieht-grosses-potenzial-fuer-oepnv-ausbau-in-bayern-36138768.html,https://www.stern.de/gesellschaft/regional/bayern/busse-und-bahnen--studie-sieht-grosses-potenzial-fuer-oepnv-ausbau-in-bayern-36138768.html,0,www.stern.de,Busse und Bahnen: Studie sieht großes Potenzial für ÖPNV-Ausbau in Bayern,"Eine Untersuchung sieht für Bayerns ÖPNV großes Wachstumspotenzial – vorausgesetzt, es wird kräftig investiert. Welche Summen dafür bis 2040 nötig wären, zeigt die Analyse.",https://image.stern.de/36138770/t/ff/v1/w1440/r1.7778/-/17--ltm64izsc4v9axs2048jpeg---e5095e21b60b75ac.jpg,2025-10-17T03:00:06Z,,"Kopiere den aktuellen Link
Zur Merkliste hinzufügen
Eine Untersuchung sieht für Bayerns ÖPNV großes Wachstumspotenzial vorausgesetzt, es wird kräftig investiert. Welche Summen dafür bis 2040 nötig … [+3320 chars]",,de,'ÖPNV'
https://www.morgenpost.de/blogs-kolumnen/article410241889/kasupke-macht-einen-auf-winter.html,https://www.morgenpost.de/blogs-kolumnen/article410241889/kasupke-macht-einen-auf-winter.html,0,www.morgenpost.de,Kasupke macht einen auf Winter,"Bei Kasupkes is die Heizung an, und Trude hat die dicken Decken rausjeholt. Kasu jeht damit janz professionell um und kooft Jlühwein.",https://img.sparknews.funkemedien.de/408091545/408091545_1736958730_v16_9_1600.jpeg,2025-10-17T04:00:00Z,,"Nu isset passiert: Trude hat die dicken Daunendecken ausm Sommalaga rausjezojen und uffe Betten jeleecht. Und als ick jestan nach Hause kam, da bullate die Heizung ordentlich und meene Holde saß dick… [+365 chars]",,de,'Heizung'
https://www.autobild.de/artikel/maserati-mcpura-der-dreizack-gegen-den-herbstblues-28377247.html,https://www.autobild.de/artikel/maserati-mcpura-der-dreizack-gegen-den-herbstblues-28377247.html,0,www.autobild.de,"630 PS, V6-Sound und Bella Figura – Maserati feuert den MCPura ab","Während es uns so langsam in die miesepetrige Kälte der dunklen Jahreszeit zieht wie nasser, schwerer Morgennebel, wärmt uns Maserati jetzt das Gemüt – mit dem MCPura. Fahrbericht!",https://i.auto-bild.de/ir_img/4/0/0/5/2/5/3/Maserati-MCPura-2869-4595x2584-87a7907546f761db.jpg?impolicy=og_images,2025-10-17T09:41:00Z,,Maserati beweist ein Herz für fröstelnde Mitteleuropäer und unterstützt die Petrolheads nördlich der Alpen im Kampf gegen drohende Herbstdepressionen mit dem neuen MCPura: Mit leidenschaftlichem Desi… [+5194 chars],,de,'Kälte'
"https://www.gamestar.de/artikel/3-wichtige-tipps-zum-heizen-vom-experten,3440593.html","https://www.gamestar.de/artikel/3-wichtige-tipps-zum-heizen-vom-experten,3440593.html",0,www.gamestar.de,Special: Richtig heizen - »Im Auto gibt man ja auch nicht gleichzeitig Gas und tritt auf die Bremse«: 3 wichtige Tipps zum Heizen vom Experten,"Wie heizt man eigentlich richtig? Wir haben einen Heizungs-Experten gefragt und verraten euch wichtige Tipps, die jeder kennen sollte.",https://images.cgames.de/images/gamestar/293/heizung-nico-mittendorff-titel-teaser_6380824.jpg,2025-10-17T10:00:00Z,,"Wie heizt man eigentlich richtig? Wir haben wichtige Tipps vom Experten bekommen. Bildquelle: Nico Mittendorf + Adobe Stock (Fabian Krueger)
Es ist Oktober, draußen wird es früher dunkel und die Tem… [+4298 chars]",,de,'Gas'
https://www.stern.de/gesellschaft/regional/rheinland-pfalz-saarland/wein-bilanz--moselwinzer-fahren-wieder-groessere-ernte-ein-36140348.html,https://www.stern.de/gesellschaft/regional/rheinland-pfalz-saarland/wein-bilanz--moselwinzer-fahren-wieder-groessere-ernte-ein-36140348.html,0,www.stern.de,Wein-Bilanz: Moselwinzer fahren wieder größere Ernte ein,Trier (lrs) - Die Moselwinzer freuen sich in diesem Herbst über eine wieder höhere Erntemenge. Die Gesamtproduktion im Gebiet von Perl bis Koblenz werde,https://image.stern.de/36140350/t/3T/v1/w1440/r1.7778/-/17--o7g2dgukvsv7axs2048jpeg---714896fda1c6b576.jpg,2025-10-17T11:52:40Z,,"Kopiere den aktuellen Link
Zur Merkliste hinzufügen
Im Anbaugebiet Mosel ist die Ernte im Keller. Die Winzer sind zufrieden. Nicht nur, weil es wieder mehr Wein geben wird.
Die Moselwinzer freuen … [+1118 chars]",,de,'Wein'
https://science.orf.at/stories/3232527/,https://science.orf.at/stories/3232527/,0,science.orf.at,Pflanzen verkraften Dürrejahre schlecht,"Lange anhaltende Hitzeperioden werden häufiger. Ein internationales Forschungsteam untersuchte nun die weltweiten Folgen von Dürre. Die Studie zeigt, dass Pflanzen den Regenausfall nach einigen wenigen Dürrejahren kaum mehr kompensieren können.",https://ibs.orf.at/science?image=https%3A%2F%2Ftubestatic.orf.at%2Fmims%2F2020%2F32%2F25%2Fcrops%2Fw%3D1200%2Ch%3D627%2Cq%3D75%2F644180_master_221625_themenbild_trockenheit_duerre_landwirtschaft_.jpg%3Fs%3Db1b939a48e6d7bf0bd3ea3d66f7b3b4d03e97033,2025-10-17T12:10:01Z,,"Wissenschaftlerinnen und Wissenschaftler analysierten für die weitverzweigte, im Fachjournal Science erschienene Studie die Produktivität in 74 Gras- oder Busch- bzw. Strauchland-Ökosystemen unter ve… [+3771 chars]",,de,'Dürre'
https://www.diepresse.com/20216649/was-laszlo-krasznahorkai-ueber-viktor-orban-erzaehlt,https://www.diepresse.com/20216649/was-laszlo-krasznahorkai-ueber-viktor-orban-erzaehlt,0,www.diepresse.com,Was László Krasznahorkai über Viktor Orbán erzählt [premium],Wein und Zen mit dem neuen Literaturnobelpreisträger: Ein Wiener Freund schildert seine denkwürdigen Begegnungen mit dem ungarischen Autor.,https://img.diepresse.com/public/incoming/7ln647-Lszlo.jpg/alternates/DPR_SOCIAL_MAGAZIN/Lszlo.jpg,2025-10-17T15:26:31Z,,"Eine Woche, bevor ihm der Nobelpreis für Literatur verliehen wurde, zeigte mir László wie jedes Jahr die Liste der Buchmacher in London, auf der er seit Jahren unter die ersten zehn, dann fünf, heuer… [+8159 chars]",,de,'Wein'
https://ct-uplink.podigee.io/621-sicher-im-internet-wie-mullvad-vpn-proton-vpn-nordvpn-co-dabei-helfen-c-t-uplink,https://ct-uplink.podigee.io/621-sicher-im-internet-wie-mullvad-vpn-proton-vpn-nordvpn-co-dabei-helfen-c-t-uplink,0,ct-uplink.podigee.io,"Sicher im Internet: Wie Mullvad VPN, Proton VPN, NordVPN & Co. dabei helfen | c’t uplink","Kommerzielle VPN-Anbieter wie Bitdefender Premium VPN, ExpressVPN, hide.me VPN, IVPN, Mullvad VPN, NordVPN, Proton VPN, TunnelBear und Windscribe versprechen, ihre Kunden für ein paar Euro im Monat vor quasi allen Bedrohungen des Internets zu schützen. Und ne…","https://images.podigee-cdn.net/0x,spsdbdC-1PW-58zHcA_TFtFa1dkRNyJXJ5-Mt-r7F0NE=/https://main.podigee-cdn.net/uploads/u13959/06cfc78b-6d2e-40ca-a329-6bb6dc5dc272.jpg",2025-10-18T04:30:00Z,,"00:00:00: Heute bei CT Aplink, die kommerziellen VPN-Anbieter versprechen euch vor allem, bösenes Internet zu schützen.
00:00:07: Wir gehen der Frage nach, was stimmt, was nicht stimmt und was ihr m… [+82029 chars]",,de,'Heizung'
https://www.zeit.de/news/2025-10/18/diepgen-ist-gegen-u-bahn-zugangssperren,https://www.zeit.de/news/2025-10/18/diepgen-ist-gegen-u-bahn-zugangssperren,0,www.zeit.de,ÖPNV: Diepgen ist gegen U-Bahn-Zugangssperren,Hier finden Sie Informationen zu dem Thema „ÖPNV“. Lesen Sie jetzt „Diepgen ist gegen U-Bahn-Zugangssperren“.,https://img.zeit.de/news/2025-10/18/diepgen-ist-gegen-u-bahn-zugangssperren-image-group/wide__1300x731,2025-10-18T09:30:15Z,,"Berlins ehemaliger Regierender Bürgermeister Eberhard Diepgen (CDU) hat sich gegen Zugangssperren an U-Bahnhöfen ausgesprochen. «Ich bestreite nicht, dass Sperren das Sicherheitsgefühl der Fahrgäste … [+1055 chars]",,de,'ÖPNV'
https://www.stern.de/gesellschaft/regional/berlin-brandenburg/oepnv--diepgen-ist-gegen-u-bahn-zugangssperren-36142030.html,https://www.stern.de/gesellschaft/regional/berlin-brandenburg/oepnv--diepgen-ist-gegen-u-bahn-zugangssperren-36142030.html,0,www.stern.de,ÖPNV: Diepgen ist gegen U-Bahn-Zugangssperren,Der CDU-Fraktionschef hat sich für Zugangssperren an Berlins U-Bahnhöfen ausgesprochen. Ein prominenter Parteifreund findet das nicht einleuchtend.,https://image.stern.de/36142032/t/D4/v1/w1440/r1.7778/-/18--6bltyhkcznv4axs2048jpeg---4e95fdbd4c10955c.jpg,2025-10-18T09:30:15Z,,"Kopiere den aktuellen Link
Zur Merkliste hinzufügen
Der CDU-Fraktionschef hat sich für Zugangssperren an Berlins U-Bahnhöfen ausgesprochen. Ein prominenter Parteifreund findet das nicht einleuchten… [+1219 chars]",,de,'ÖPNV'
https://www.tagesspiegel.de/berlin/opnv-diepgen-ist-gegen-u-bahn-zugangssperren-14600795.html,https://www.tagesspiegel.de/berlin/opnv-diepgen-ist-gegen-u-bahn-zugangssperren-14600795.html,0,www.tagesspiegel.de,ÖPNV: Diepgen ist gegen U-Bahn-Zugangssperren,Der CDU-Fraktionschef hat sich für Zugangssperren an Berlins U-Bahnhöfen ausgesprochen. Ein prominenter Parteifreund findet das nicht einleuchtend.,https://www.tagesspiegel.de/images/14600792/alternates/BASE_16_9_W1400/1760779881000/u-bahn.jpeg,2025-10-18T09:31:22Z,,"Berlins ehemaliger Regierender Bürgermeister Eberhard Diepgen (CDU) hat sich gegen Zugangssperren an U-Bahnhöfen ausgesprochen. Ich bestreite nicht, dass Sperren das Sicherheitsgefühl der Fahrgäste s… [+1104 chars]",,de,'ÖPNV'
https://www.n-tv.de/politik/Buergergeld-Reform-SoVD-warnt-vor-Wohnungslosigkeit-durch-Mietkuerzungen-article26105184.html,https://www.n-tv.de/politik/Buergergeld-Reform-SoVD-warnt-vor-Wohnungslosigkeit-durch-Mietkuerzungen-article26105184.html,0,www.n-tv.de,Durch Bürgergeld-Reform: Sozialverband warnt vor Wohnungslosenkrise,Union und SPD planen striktere Regeln für Bürgergeld-Empfänger. Wiederholte Terminversäumnisse könnten auch zum Verlust der Wohnung führen. Der Sozialverband kritisiert die Maßnahmen deshalb scharf.,https://www.n-tv.de/img/incoming/crop26105185/2301329958-cImg_16_9-w1200/516752198.jpg,2025-10-18T12:27:40Z,,Union und SPD planen striktere Regeln für Bürgergeld-Empfänger. Wiederholte Terminversäumnisse könnten auch zum Verlust der Wohnung führen. Der Sozialverband kritisiert die Maßnahmen deshalb scharf.,,,
https://www.abendblatt.de/podcast/article410230262/toller-rioja-fuer-nen-schmalen-taler-i-speedtasting.html,https://www.abendblatt.de/podcast/article410230262/toller-rioja-fuer-nen-schmalen-taler-i-speedtasting.html,0,www.abendblatt.de,Toller Rioja für nen schmalen Taler I Speedtasting,"Der Herbst ist da – und mit ihm die Lust auf Rotwein! In dieser Speedtasting-Folge von “Vier Flaschen“ verkosten Lars, Michi und Axel einen echten Klassiker aus Spanien: den Telmemore Rioja 2022 vom renommierten Winzer Telmo Rodríguez.
Michi bringt den Wein m…",,2025-10-18T14:00:00Z,,"4 Flaschen - Der Wein-Podcast - vom Hamburger Abendblatt alle 14 Tage neu mit den Experten Michael Kutej, Axel Leonhard und Lars Haider.
Entdecke die Welt des Weins mit dem beliebten Weinpodcast ""4 … [+1090 chars]",,de,'Wein'
