index,url,valid,domain,title,description,image,published,archive,content,quote,language,keyword
https://www.ibiza-heute.de/foto-des-tages-in-ibizaheute-5/,https://www.ibiza-heute.de/foto-des-tages-in-ibizaheute-5/,0,www.ibiza-heute.de,Foto des Tages in IbizaHEUTE,"Schnee auf Formentera? „Hallo von Formentera“, schrieb Peter Eberhardt, „mein Foto des Tages nenne ich Schnee auf Formentera. Nein, geschneit hat es […]
Der Beitrag Foto des Tages in IbizaHEUTE erschien zuerst auf Ibiza Heute.",https://www.ibiza-heute.de/wp-content/uploads/2025/04/aFormenteraEberhardt.jpg,2025-05-01T04:00:18Z,,"Schnee auf Formentera?
Hallo von Formentera, schrieb Peter Eberhardt, mein Foto des Tages nenne ich Schnee auf Formentera. Nein, geschneit hat es nicht. Schuld an dem Weiß auf der Straße war der sta… [+494 chars]",,de,'Schnee'
https://www.stern.de/gesellschaft/regional/hamburg-schleswig-holstein/tag-der-arbeit--tausende-demonstrieren-fuer-eine-gerechtere-arbeitswelt-35683958.html,https://www.stern.de/gesellschaft/regional/hamburg-schleswig-holstein/tag-der-arbeit--tausende-demonstrieren-fuer-eine-gerechtere-arbeitswelt-35683958.html,0,www.stern.de,Tag der Arbeit: Tausende demonstrieren für eine gerechtere Arbeitswelt,Tausende Menschen haben sich in Hamburg am traditionellen 1. Mai-Aufmarsch des Deutschen Gewerkschaftsbunds (DGB) beteiligt. Bei den Reden kam die schwarz-rote Koalition im Bund nicht gut weg.,https://image.stern.de/35684888/t/SU/v1/w1440/r1.7778/-/01--66b7cjwow7v6axs2048jpeg---e44ec885f7171174.jpg,2025-05-01T12:03:27Z,https://web.archive.org/web/20250501125338/https://www.stern.de/gesellschaft/regional/hamburg-schleswig-holstein/tag-der-arbeit--tausende-demonstrieren-fuer-eine-gerechtere-arbeitswelt-35683958.html,"Kopiere den aktuellen Link
Zur Merkliste hinzufügen
Tausende Menschen haben sich in Hamburg am traditionellen 1. Mai-Aufmarsch des Deutschen Gewerkschaftsbunds (DGB) beteiligt. Bei den Reden kam di… [+3679 chars]",,de,'Kälte'
https://www.discountfan.de/artikel/news/ebay-outdoor-rabatt-von-bis-zu-20-prozent,https://www.discountfan.de/artikel/news/ebay-outdoor-rabatt-von-bis-zu-20-prozent,0,www.discountfan.de,Ebay: Outdoor-Rabatt von bis zu 20 Prozent,Anzeige*Bei Ebay lockt noch bis zum 7. April ein Outdoor-Rabatt von 10 bis 20 Prozent auf Tausende Artikel. Neben Camping-Artikeln und Fahrrädern sind auch Outdoor-Bekleidung und Schlafsäcke rabattiert zu haben. Um die 10 – 20 Prozent Rabatt auf Outdoor bei E…,,2025-05-01T15:49:15Z,,"Ebay: Outdoor-Rabatt von bis zu 20 Prozent (Bild: Ebay.de) 
Um die 10 – 20 Prozent Rabatt auf Outdoor bei Ebay zu erhalten, müssen Discountfans bei der Bestellung den
Gutschein-Code AKTIV(gültig bi… [+880 chars]",,de,'Kälte'
https://www.stern.de/gesellschaft/regional/hamburg-schleswig-holstein/tag-der-arbeit--tausende-demonstrieren-am-1--mai---alles-bleibt-friedlich-35683958.html,https://www.stern.de/gesellschaft/regional/hamburg-schleswig-holstein/tag-der-arbeit--tausende-demonstrieren-am-1--mai---alles-bleibt-friedlich-35683958.html,0,www.stern.de,Tag der Arbeit: Tausende demonstrieren am 1. Mai - alles bleibt friedlich,Tausende Menschen gehen am 1. Mai in Hamburg auf die Straßen. Ob beim Aufmarsch des Deutschen Gewerkschaftsbunds oder bei den Demos linker und Linksextremer Gruppen - alles bleibt friedlich.,https://image.stern.de/35685404/t/lQ/v1/w1440/r1.7778/-/01--fqxqyz3l4wv1axs2048jpeg---df5f74fcb1f96451.jpg,2025-05-01T17:25:44Z,https://web.archive.org/web/20250501175525/https://www.stern.de/gesellschaft/regional/hamburg-schleswig-holstein/tag-der-arbeit--tausende-demonstrieren-am-1--mai---alles-bleibt-friedlich-35683958.html,"Kopiere den aktuellen Link
Zur Merkliste hinzufügen
Tausende Menschen gehen am 1. Mai in Hamburg auf die Straßen. Ob beim Aufmarsch des Deutschen Gewerkschaftsbunds oder bei den Demos linker und Li… [+4235 chars]",,de,'Tau'
https://www.jungewelt.de/artikel/499156.australien-klimakrise-auf-die-agenda.html,https://www.jungewelt.de/artikel/499156.australien-klimakrise-auf-die-agenda.html,0,www.jungewelt.de,Australien: Klimakrise auf die Agenda [Online-Abo],"Dürre, Buschbrände und Überschwemmungen: Während Australiens konservative Opposition noch im Leugnen verharrt, erkennen die Sozialdemokraten der Regierung den Ernst der Lage zumindest an.",https://www.jungewelt.de/img/1100/208305.jpg,2025-05-01T17:39:38Z,https://web.archive.org/web/20250501175123/https://www.jungewelt.de/artikel/499156.australien-klimakrise-auf-die-agenda.html,"Uneingeschränkter Zugriff auf alle Inhalte: Erleben Sie die Tageszeitung junge Welt in gedruckter oder digitaler Form oder beides kombiniert.
Nachrichtenauswahl und -aufbereitung erfordern finanziel… [+458 chars]",,de,'Dürre'
https://www.welt.de/regionales/hamburg/article256049040/Mai-Demos-in-Hamburg-Eher-friedliche-Linksextreme-eher-kaempferische-Gewerkschaften.html,https://www.welt.de/regionales/hamburg/article256049040/Mai-Demos-in-Hamburg-Eher-friedliche-Linksextreme-eher-kaempferische-Gewerkschaften.html,0,www.welt.de,"Eher friedliche Linksextreme, eher kämpferische Gewerkschaften",Tausende Menschen gehen am 1. Mai in Hamburg auf die Straßen. Ob beim Aufmarsch des Deutschen Gewerkschaftsbunds oder bei den Demos linker und Linksextremer Gruppen - alles bleibt im Rahmen.,https://img.welt.de/img/regionales/hamburg/mobile256049036/8797932137-ci16x9-w1200/Demonstrationen-zum-1-Mai-Hamburg.jpg,2025-05-01T19:48:49Z,https://web.archive.org/web/20250501201530/http://www.welt.de/regionales/hamburg/article256049040/Mai-Demos-in-Hamburg-Eher-friedliche-Linksextreme-eher-kaempferische-Gewerkschaften.html,Tausende Menschen gehen am 1. Mai in Hamburg auf die Straßen. Ob beim Aufmarsch des Deutschen Gewerkschaftsbunds oder bei den Demos linker und Linksextremer Gruppen - alles bleibt im Rahmen.Tausende … [+4132 chars],,de,'Tau'
https://www.stern.de/familie/gardena-solar-bewaesserung-fuer-89-statt-140-euro--garten-deals-am-freitag-34734620.html,https://www.stern.de/familie/gardena-solar-bewaesserung-fuer-89-statt-140-euro--garten-deals-am-freitag-34734620.html,0,www.stern.de,Kraut & Dübel: Gardena Solar-Bewässerung für 89 statt 140 Euro: Garten-Deals am Freitag,"Ob Hecke schneiden oder Unkraut jäten, Schädlinge bekämpfen oder Grillen: Hier finden Sie täglich wechselnde Deals rund um Haus und Garten, die sich wirklich lohnen.",https://image.stern.de/34905868/t/oG/v4/w1440/r1.7778/-/bewaesserungssytem.jpg,2025-05-02T05:32:00Z,,"Kopiere den aktuellen Link
Zur Merkliste hinzufügen
Ob Hecke schneiden oder Unkraut jäten, Schädlinge bekämpfen oder Grillen: Hier finden Sie täglich wechselnde Deals rund um Haus und Garten, die s… [+3559 chars]",,de,'Bewässerung'
https://www.morgenpost.de/berlin/article408915102/waerme-adC3A9-berlin-erwarten-gewitter-sturmboeen-und-wieder-kaelte.html,https://www.morgenpost.de/berlin/article408915102/waerme-adC3A9-berlin-erwarten-gewitter-sturmboeen-und-wieder-kaelte.html,0,www.morgenpost.de,"Wärme adé: Berlin erwarten Gewitter, Sturmböen und wieder Kälte",Die T-Shirts können wieder in den Schrank gepackt werden. Am Abend soll es gewittern. Danach wird es in Berlin deutlich kälter.,https://img.sparknews.funkemedien.de/408913912/408913912_1746166140_v16_9_1600.jpeg,2025-05-02T06:08:53Z,http://archive.md/20250502122709/https://www.morgenpost.de/berlin/article408915102/waerme-adC3A9-berlin-erwarten-gewitter-sturmboeen-und-wieder-kaelte.html,"Berlin. Die T-Shirts können wieder in den Schrank gepackt werden. Am Abend soll es gewittern. Danach wird es in Berlin deutlich kälter.
En paar Tage konnten die Berlinerinnen und Berliner sonnige un… [+3252 chars]",,de,'Kälte'
https://www.brigitte.de/aktuell/koenig-charles-und-koenig-carl-gustaf--royales-gartenprojekt-mit-historischem-bezug-13983248.html,https://www.brigitte.de/aktuell/koenig-charles-und-koenig-carl-gustaf--royales-gartenprojekt-mit-historischem-bezug-13983248.html,0,www.brigitte.de,König Charles und König Carl Gustaf: Royales Gartenprojekt mit historischem Bezug,Ein ungewöhnlicher gemeinsamer Termin: Die Königspaare aus Großbritannien und Schweden pflanzten zusammen eine besondere Eiche in Windsor.,https://image.brigitte.de/13983250/t/OK/v1/w1440/r1.7778/-/02--royales-gartenprojekt-mit-historischem-bezug---1-1---spoton-article-1095770.jpg,2025-05-02T06:18:00Z,,"Ein ungewöhnlicher gemeinsamer Termin: Die Königspaare aus Großbritannien und Schweden pflanzten zusammen eine besondere Eiche in Windsor.
König Charles III. (76) und Königin Camilla (77) haben sich… [+2830 chars]",,de,'Wind'
https://www.stern.de/lifestyle/leute/koenig-charles-und-koenig-carl-gustaf--koenigliche-gartenarbeit-mit-bedeutung-35686020.html,https://www.stern.de/lifestyle/leute/koenig-charles-und-koenig-carl-gustaf--koenigliche-gartenarbeit-mit-bedeutung-35686020.html,0,www.stern.de,König Charles und König Carl Gustaf: Königliche Gartenarbeit mit Bedeutung,Ein ungewöhnlicher gemeinsamer Termin: Die Königspaare aus Großbritannien und Schweden pflanzten zusammen eine besondere Eiche in Windsor.,https://image.stern.de/35686024/t/ye/v1/w1440/r1.7778/-/02--koenigliche-gartenarbeit-mit-bedeutung---16-9---spoton-article-1095770.jpg,2025-05-02T06:28:00Z,https://web.archive.org/web/20250502073324/https://www.stern.de/lifestyle/leute/koenig-charles-und-koenig-carl-gustaf--koenigliche-gartenarbeit-mit-bedeutung-35686020.html,"Kopiere den aktuellen Link
Zur Merkliste hinzufügen
Ein ungewöhnlicher gemeinsamer Termin: Die Königspaare aus Großbritannien und Schweden pflanzten zusammen eine besondere Eiche in Windsor.
König… [+2776 chars]",,de,'Bewässerung'
https://futurezone.at/digital-life/bitcoin-mining-verlustgeschaeft-energiekosten/403037292,https://futurezone.at/digital-life/bitcoin-mining-verlustgeschaeft-energiekosten/403037292,0,futurezone.at,Deshalb ist Bitcoin-Mining jetzt ein Verlustgeschäft,"Für kleine Bitcoin-Hersteller übersteigen die Energiekosten mittlerweile den Wert der Coins, die sie dafür bekommen.",https://image.futurezone.at/images/facebook/8662954/46-205108359.jpg,2025-05-02T07:44:41Z,https://web.archive.org/web/20250502114941/https://futurezone.at/digital-life/bitcoin-mining-verlustgeschaeft-energiekosten/403037292,"Für kleine Bitcoin-Hersteller übersteigen die Energiekosten mittlerweile den Wert der Coins, die sie dafür bekommen.",,de,'Energiekosten'
https://www.bild.de/sport/fussball/zwischen-pokal-und-3-liga-kaelte-schock-fuer-profis-von-hansa-rostock-6813f4c710132913ef604519,https://www.bild.de/sport/fussball/zwischen-pokal-und-3-liga-kaelte-schock-fuer-profis-von-hansa-rostock-6813f4c710132913ef604519,0,www.bild.de,Zwischen Pokal und 3. Liga - Kälte-Schock für Hansa-Profis,Nach dem Pokalsieg bei FC Schönberg bereitet sich Hansa Rostock intensiv auf die wichtige Drittliga-Auswärtspartie gegen Sandhausen vor.,"https://images.bild.de/6813f4c710132913ef604519/b894c738a6659b0264eb515059f1eb5f,89637231?w=1280",2025-05-02T08:48:12Z,https://web.archive.org/web/20250502101949/https://www.bild.de/sport/fussball/zwischen-pokal-und-3-liga-kaelte-schock-fuer-profis-von-hansa-rostock-6813f4c710132913ef604519,"Im Saisonfinale muss auch der Körper mitspielen! Nach dem Halbfinale des MV-Landespokals ist vor der wichtigen Drittliga-Auswärtspartie in Sandhausen.
Hansa Rostock hat genau 48 Stunden Zeit, um zu … [+1697 chars]",,de,'Kälte'
https://orf.at/stories/3392275/,https://orf.at/stories/3392275/,0,orf.at,Luxuriöse Weinsammlung von Schweizer Milliardär versteigert,,https://orf.at/mojo/1_4_1/storyserver//news/common/images/og-fallback-news.png,2025-05-02T09:32:13Z,https://web.archive.org/web/20250502130423/https://orf.at/stories/3392275/,"Die Versteigerung der Weinsammlung des Schweizer Milliardärs, Juweliers und Uhrenhändlers Jörg G. Bucherer in London hat umgerechnet 1,4 Millionen Euro eingebracht. Der Ertrag fließt in eine Stiftung… [+1802 chars]",,de,'Wein'
https://www.zeit.de/familie/2025-05/kinder-luegen-moritz-daum-psychologie-familienrat,https://www.zeit.de/familie/2025-05/kinder-luegen-moritz-daum-psychologie-familienrat,0,www.zeit.de,"Kinder und Lügen: ""Kinder lügen oft aus einer Not heraus""","Wenn Kinder lügen, ist das nicht unbedingt schlimm, sagt der Entwicklungspsychologe Moritz Daum. Eltern sollten aber verstehen, warum ihr Kind nicht die Wahrheit sagt.",https://img.zeit.de/familie/2025-04/kinder-luegen-moritz-daum-psychologie/wide__1300x731,2025-05-02T09:54:06Z,http://archive.md/20250502100056/https://www.zeit.de/familie/2025-05/kinder-luegen-moritz-daum-psychologie-familienrat,"Dieser Artikel ist Teil von ZEIT am Wochenende, Ausgabe 18/2025.
""Ich hab' schon Zähne geputzt"", ""Ich habe Bauchweh"", ""Das Buch ist wirklich ganz toll, Oma"": Kinder lügen aus ganz unterschiedlichen … [+799 chars]",,de,'Not'
https://ooe.orf.at/stories/3303698/,https://ooe.orf.at/stories/3303698/,0,ooe.orf.at,Bergsteiger von Großem Priel gerettet,"Zwei Tschechen haben den Schnee in den Bergen unterschätzt und am Donnerstag eine Tour auf den Großen Priel unternommen. Auf dem Gipfel angekommen, setzten sie einen Notruf ab, weil sie sich den Abstieg nicht mehr zutrauten. Die Flugpolizei brachte die beiden…",https://ibs.orf.at/ooe?image=https%3A%2F%2Foekastatic.orf.at%2Fmims%2F2025%2F17%2F19%2Fcrops%2Fw%3D1200%2Ch%3D627%2Cq%3D75%2F2597104_master_996919_polihub.jpg%3Fs%3D73c4c3b89d0c5b866256626f9de2baf4bc6316a6,2025-05-02T10:39:13Z,https://web.archive.org/web/20250502130850/https://ooe.orf.at/stories/3303698/,Die tschechischen Bergsteiger beide 28 Jahre alt hatten zunächst die Nacht auf Donnerstag im Prielschutzhaus verbracht. Am Feiertag brachen sie in der Früh zu ihrer Tour auf den Großen Priel auf. Für… [+1759 chars],,de,'Schnee'
https://www.diepresse.com/19639275/wie-neue-perspektiven-die-identitaet-der-wachau-veraendern,https://www.diepresse.com/19639275/wie-neue-perspektiven-die-identitaet-der-wachau-veraendern,0,www.diepresse.com,Wie neue Perspektiven die Identität der Wachau verändern,Die aufgeladene Marille-Wein-Kloster-Identität des gewundenen Donautals soll seine Komfortzone verlassen und neu vermessen werden.,https://img.diepresse.com/public/incoming/rxgpp9-cAlessaGrandePortrait.jpeg/alternates/DPR_SOCIAL_MAGAZIN/cAlessaGrandePortrait.jpeg,2025-05-02T11:50:50Z,https://web.archive.org/web/20250503043543/https://www.diepresse.com/19639275/wie-neue-perspektiven-die-identitaet-der-wachau-veraendern,"Die aufgeladene Marille-Wein-Kloster-Identität des gewundenen Donautals soll seine Komfortzone verlassen und neu vermessen werden. 
Vor 25 Jahren wurde in den bergigen Regenwäldern von Cairns beschl… [+3756 chars]",,de,'Wein'
https://www.sueddeutsche.de/wirtschaft/katherina-reiche-wirtschaftsministerium-berlin-li.3243526,https://www.sueddeutsche.de/wirtschaft/katherina-reiche-wirtschaftsministerium-berlin-li.3243526,0,www.sueddeutsche.de,Wirtschaftsministerium: Was Katherina Reiche erwartet,"Die neue Wirtschaftsministerin soll den Standort wieder stark machen und dafür unter anderem die Energiekosten senken. Dabei hat sie wenig Spielraum, weil ihr Haus ganze Abteilungen abgeben muss.",https://www.sueddeutsche.de/2025/05/02/a9e7454c-a468-4656-8a69-5dd4f659cf79.jpeg?q=60&fm=webp&width=1200&rect=0%2C431%2C4000%2C2250,2025-05-02T13:42:37Z,http://archive.md/20250503123002/https://www.sueddeutsche.de/wirtschaft/katherina-reiche-wirtschaftsministerium-berlin-li.3243526,"Reiche zählt zu den Überraschungen des neuen Bundeskabinetts. Aus der aktiven Politik hatte sich die 51-Jährige schon lange verabschiedet, in Düsseldorf lenkte sie zuletzt die Geschicke des Netzbetre… [+9399 chars]",,de,'Energiekosten'
https://www.abendblatt.de/podcast/article408898096/chardonnay-ohne-holz-aber-mit-honigmelone.html,https://www.abendblatt.de/podcast/article408898096/chardonnay-ohne-holz-aber-mit-honigmelone.html,0,www.abendblatt.de,Chardonnay ohne Holz aber mit Honigmelone,"Das Mehrheitsprinzip entscheidet diese Folge: Der Chardonnay Altkirch
von der Winzergenossenschaft Schreckbichl aus Südtirol im Jahrgang 2023 ist nicht sonderlich dickflüssig und schmeckt vor allem nach Honigmelone. 
Aber probiert selbst: Den Wein gibt es u…",,2025-05-02T14:00:00Z,https://web.archive.org/web/20250502153647/https://www.abendblatt.de/podcast/article408898096/chardonnay-ohne-holz-aber-mit-honigmelone.html,"4 Flaschen - Der Wein-Podcast - vom Hamburger Abendblatt alle 14 Tage neu mit den Experten Michael Kutej, Axel Leonhard und Lars Haider.
Entdecke die Welt des Weins mit dem beliebten Weinpodcast ""4 … [+1090 chars]",,de,'Wein'
https://www.faz.net/aktuell/rhein-main/region-und-hessen/gar-nicht-seltsam-warum-man-sich-zu-hause-fuer-katastrophen-wappnen-sollte-110451752.html,https://www.faz.net/aktuell/rhein-main/region-und-hessen/gar-nicht-seltsam-warum-man-sich-zu-hause-fuer-katastrophen-wappnen-sollte-110451752.html,0,www.faz.net,Katastrophenschutz: Warum Eigeninitiative jetzt wichtiger ist denn je,"Kein Wasser, kein Strom, Überflutungen oder Versorgungsengpässe: Die wenigsten rechnen mit dem Schlimmsten. Sollten sie aber, denn kluge Vorbereitung kann im Notfall entscheidend sein.",https://media0.faz.net/ppmedia/aktuell/1785341134/1.10451744/facebook_teaser/beschaeftigte-der-stadtwerke.jpg,2025-05-02T16:46:46Z,http://archive.md/20250504114607/https://www.faz.net/aktuell/rhein-main/region-und-hessen/gar-nicht-seltsam-warum-man-sich-zu-hause-fuer-katastrophen-wappnen-sollte-110451752.html,"Deutschland sieht sich heute Bedrohungen gegenüber, wie sie vor wenigen Jahren noch undenkbar schienen. Im Schatten des russischen Angriffskrieges in der Ukraine rücken Szenarien näher, die lange als… [+9073 chars]",,de,'Not'
https://www.welt.de/debatte/plus256050274/Blackout-Die-Pulverisierung-der-Energiewende.html,https://www.welt.de/debatte/plus256050274/Blackout-Die-Pulverisierung-der-Energiewende.html,0,www.welt.de,Die Pulverisierung der Energiewende,Der Blackout auf der iberischen Halbinsel hat mehr Todesopfer als die Havarie des Atomkraftwerks Fukushima gefordert. Flatterstrom aus Wind und Sonne erweist sich bei der Frequenzhaltung als problematisch. Nötig ist jetzt ein Ausbau-Moratorium für Solarenergi…,https://img.welt.de/img/debatte/mobile256051870/5977934197-ci16x9-w1200-fnov-fpotl-fpi157750653/Massiver-Stromausfall-in-Spanien-und-Portugal.jpg,2025-05-02T19:19:19Z,http://archive.md/20250502195603/https://www.welt.de/debatte/plus256050274/Blackout-Die-Pulverisierung-der-Energiewende.html,Der Blackout auf der iberischen Halbinsel hat mehr Todesopfer als die Havarie des Atomkraftwerks Fukushima gefordert. Flatterstrom aus Wind und Sonne erweist sich bei der Frequenzhaltung als problema… [+61 chars],,de,'Wind'
https://www.welt.de/sport/article256059364/Sorgen-um-Verletzte-Durchaus-lebensbedrohlich-Not-OP-bei-Bochums-Stuermer-Hofmann.html,https://www.welt.de/sport/article256059364/Sorgen-um-Verletzte-Durchaus-lebensbedrohlich-Not-OP-bei-Bochums-Stuermer-Hofmann.html,0,www.welt.de,„Durchaus lebensbedrohlich“ – Not-OP bei Bochums Stürmer Hofmann,Mehr als zehn Minuten wurde Kevin Müller vom 1. FC Heidenheim nach einem Zusammenprall beim Spiel gegen Bochum behandelt. Auf den Schock folgt die vorsichtige Entwarnung. VfL-Stürmer Hofmann wird noch in der Nacht nach einem Rippenbruch operiert.,https://img.welt.de/img/sport/mobile256059354/0697935877-ci16x9-w1200/1-FC-Heidenheim-VfL-Bochum.jpg,2025-05-03T09:54:48Z,https://web.archive.org/web/20250503124436/https://www.welt.de/sport/article256059364/Sorgen-um-Verletzte-Durchaus-lebensbedrohlich-Not-OP-bei-Bochums-Stuermer-Hofmann.html,Mehr als zehn Minuten wurde Kevin Müller vom 1. FC Heidenheim nach einem Zusammenprall beim Spiel gegen Bochum behandelt. Auf den Schock folgt die vorsichtige Entwarnung. VfL-Stürmer Hofmann wird noc… [+3220 chars],,de,'Not'
https://www.telepolis.de/features/Klimawandel-laesst-Wasserspeicher-der-Alpen-verdunsten-10369827.html,https://www.telepolis.de/features/Klimawandel-laesst-Wasserspeicher-der-Alpen-verdunsten-10369827.html,0,www.telepolis.de,Klimawandel lässt Wasserspeicher der Alpen verdunsten,Die Alpen verlieren ihre Rolle als Europas Wasserspeicher. Immer weniger Schnee bleibt im Winter liegen. Wird das Alpenvorland zur Steppe?,https://heise.cloudimg.io/bound/1200x1200/q85.png-lossy-85.webp-lossy-85.foil1/_www-heise-de_/imgs/18/4/8/4/6/7/9/9/Scheefall-223b1dabd207bd6c.jpeg,2025-05-03T10:00:00Z,https://web.archive.org/web/20250503104934/https://www.telepolis.de/features/Klimawandel-laesst-Wasserspeicher-der-Alpen-verdunsten-10369827.html,"Die Alpen verlieren ihre Rolle als Europas Wasserspeicher. Immer weniger Schnee bleibt im Winter liegen. Wird das Alpenvorland zur Steppe?
Der Klimawandel sorgt für beachtliche Entwicklungen im mitt… [+5443 chars]",,de,'Schnee'
https://www.zeit.de/news/2025-05/03/feiern-in-der-ferkeltaxe-30-jahre-usedomer-baederbahn,https://www.zeit.de/news/2025-05/03/feiern-in-der-ferkeltaxe-30-jahre-usedomer-baederbahn,0,www.zeit.de,"ÖPNV: Feiern in der ""Ferkeltaxe"": 30 Jahre Usedomer Bäderbahn","Hier finden Sie Informationen zu dem Thema „ÖPNV“. Lesen Sie jetzt „Feiern in der ""Ferkeltaxe"": 30 Jahre Usedomer Bäderbahn“.",https://img.zeit.de/news/2025-05/03/feiern-in-der-ferkeltaxe-30-jahre-usedomer-baederbahn-image-group/wide__1300x731,2025-05-03T12:17:32Z,https://web.archive.org/web/20250504013414/https://www.zeit.de/news/2025-05/03/feiern-in-der-ferkeltaxe-30-jahre-usedomer-baederbahn,"Mit Sonderfahrten der «Ferkeltaxe» und einem Fest feiert die Usedomer Bäderbahn (UBB) ihr 30-jähriges Bestehen. Für Besucher gibt es am Bahnhof Heringsdorf Essen, Trinken, Musik und Sonderfahrten nac… [+1341 chars]",,de,'ÖPNV'
https://www.stern.de/gesellschaft/regional/mecklenburg-vorpommern/oepnv--feiern-in-der--ferkeltaxe---30-jahre-usedomer-baederbahn-35690602.html,https://www.stern.de/gesellschaft/regional/mecklenburg-vorpommern/oepnv--feiern-in-der--ferkeltaxe---30-jahre-usedomer-baederbahn-35690602.html,0,www.stern.de,"ÖPNV: Feiern in der ""Ferkeltaxe"": 30 Jahre Usedomer Bäderbahn",Nostalgische Sonderfahrten und Zukunftspläne: Besucher auf Usedom können am Wochenende mit einem Oldtimer auf Schienen fahren. Die UBB-Geschäftsführerin formuliert derweil Ziele für die Zukunft.,https://image.stern.de/35690604/t/Ow/v1/w1440/r1.7778/-/03--mk6hqjcwdcv4axs2048jpeg---00fcfd306f7dce7b.jpg,2025-05-03T12:17:32Z,https://web.archive.org/web/20250503161133/https://www.stern.de/gesellschaft/regional/mecklenburg-vorpommern/oepnv--feiern-in-der--ferkeltaxe---30-jahre-usedomer-baederbahn-35690602.html,"Kopiere den aktuellen Link
Zur Merkliste hinzufügen
Nostalgische Sonderfahrten und Zukunftspläne: Besucher auf Usedom können am Wochenende mit einem Oldtimer auf Schienen fahren. Die UBB-Geschäftsf… [+1551 chars]",,de,'ÖPNV'
https://www.tagesspiegel.de/gesellschaft/panorama/starkregen-windboen-blitzeinschlage-viele-schaden-durch-schwere-unwetter--mehrere-verletzte-13634359.html,https://www.tagesspiegel.de/gesellschaft/panorama/starkregen-windboen-blitzeinschlage-viele-schaden-durch-schwere-unwetter--mehrere-verletzte-13634359.html,0,www.tagesspiegel.de,"Starkregen, Windböen, Blitzeinschläge: Viele Schäden durch schwere Unwetter – mehrere Verletzte","Wetter-Turbulenzen hinterlassen in Teilen Deutschlands ihre Spuren: abgedeckte Dächer, Brände, gesperrte Bahnstrecken und Straßen. Veranstaltungen mussten unterbrochen werden.",https://www.tagesspiegel.de/images/13634356/alternates/BASE_16_9_W1400/1746339356000/gewitter-in-bayern.jpeg,2025-05-04T00:16:27Z,https://web.archive.org/web/20250504143844/https://www.tagesspiegel.de/gesellschaft/panorama/starkregen-windboen-blitzeinschlage-viele-schaden-durch-schwere-unwetter--mehrere-verletzte-13634359.html,"Gewitter, starker Regen und Windböen: Bei Unwettern in einigen Bundesländern sind mehrere Menschen verletzt worden. An einer vierspurigen Straße in Trier etwa fiel wegen eines Sturms eine Baumkrone a… [+5268 chars]",,de,'Wind'
https://www.bild.de/sport/mehr-sport/formel-1-nach-3-stunden-gibt-es-ploetzlich-ein-neues-ergebnis-6816d25310132913ef60d2ff,https://www.bild.de/sport/mehr-sport/formel-1-nach-3-stunden-gibt-es-ploetzlich-ein-neues-ergebnis-6816d25310132913ef60d2ff,0,www.bild.de,Komplettes Chaos - Formel 1 verändert Rennergebnis nach 3 Stunden!,"Um 13.05 Uhr schwenkte Rosé (nein, sie hat nicht den leckeren Rosé-Wein erfunden) am Samstag beim Sprint-Rennen in Miami die karierte Flagge.","https://images.bild.de/6816d25310132913ef60d2ff/4011d703259b47a447f47035d68ca14a,347e2c3f?w=1280",2025-05-04T03:03:54Z,http://archive.md/20250504070337/https://www.bild.de/sport/mehr-sport/formel-1-nach-3-stunden-gibt-es-ploetzlich-ein-neues-ergebnis-6816d25310132913ef60d2ff,"Um 19.05 Uhr deutscher Zeit schwenkte Rosé (nein, sie hat nicht den leckeren Rosé-Wein erfunden) am Samstag beim Sprint-Rennen in Miami die karierte Flagge.
Aus. Ende. Der Chaos-Sprint ist vorbei. L… [+3421 chars]",,de,'Wein'
https://tirol.orf.at/stories/3303461/,https://tirol.orf.at/stories/3303461/,0,tirol.orf.at,Zugriffsrekord beim Euregio-Lawinenreport,"Trotz des schneearmen Winters sind beim Euregio-Lawinenreport Zugriffsrekorde verzeichnet worden. In der abgelaufenen Wintersaison wurde er 5,7 Millionen-mal aufgerufen. Mit Ende April wurde der Report eingestellt.  Der Winter war von wenig Schnee und mildem …",https://ibs.orf.at/tir?image=https%3A%2F%2Foekastatic.orf.at%2Fmims%2F2025%2F18%2F11%2Fcrops%2Fw%3D1200%2Ch%3D627%2Cq%3D75%2F2608336_master_1001411_20250430_lawinenreport__1_.jpg%3Fs%3Dd020c0bb0bdb1172dd7a69d82e52171c25cd782c,2025-05-04T03:56:54Z,https://web.archive.org/web/20250504065532/https://tirol.orf.at/stories/3303461/,Seit 7. Dezember informierten insgesamt 144 Lawinenreporte über die aktuelle Lawinensituation in der Euregio Tirol-Südtirol-Trentino. Um zehn Prozent wurde www.lawinen.report häufiger aufgerufen als … [+1521 chars],,de,'Schnee'
