index,url,valid,domain,title,description,image,published,archive,content,quote,language,keyword
https://www.focus.de/kultur/kino_tv/4-juli-das-sind-bei-maischberger-die-heutigen-gaeste_id_198193447.html,https://www.focus.de/kultur/kino_tv/4-juli-das-sind-bei-maischberger-die-heutigen-gaeste_id_198193447.html,0,www.focus.de,4. Juli - Das sind bei „Maischberger“ die heutigen Gäste,In der Talkshow „Maischberger“ geht es regelmäßig um die aktuellen politischen Debatten in Deutschland. Wer ist heute zu Gast und welche Themen kommen auf den Tisch?Von FOCUS-online-Redakteur Jan Thinius-Heemann,https://p6.focus.de/img/kultur/kino_tv/id_197472967/sandra-maischberger-spricht-in-der-nach-ihr-benannten-talkshow-am-dienstag-unter-anderem-mit-actionstar-harrison-ford..jpg?im=Crop%3D%280%2C85%2C1360%2C680%29%3BResize%3D%281200%2C627%29&impolicy=perceptual&quality=mediumHigh&hash=d7908236309c25aeafbe3c8fb4ff5e7d899e715b11635b6518abe1c76686b934,2023-07-04T14:16:29Z,https://web.archive.org/web/20230704153940/https://www.focus.de/kultur/kino_tv/4-juli-das-sind-bei-maischberger-die-heutigen-gaeste_id_198193447.html,In der Talkshow Maischberger geht es regelmäßig um die aktuellen politischen Debatten in Deutschland. Wer ist heute zu Gast und welche Themen kommen auf den Tisch?Verschiedene Themen erfordern eine b… [+2610 chars],,de,'Gas'
https://www.focus.de/politik/deutschland/den-umstieg-gestalten-wir-sozial-und-gerecht-ampel-praezisiert-details-fuer-heizungs-foerderplaene_id_198200501.html,https://www.focus.de/politik/deutschland/den-umstieg-gestalten-wir-sozial-und-gerecht-ampel-praezisiert-details-fuer-heizungs-foerderplaene_id_198200501.html,0,www.focus.de,"„Den Umstieg gestalten wir sozial und gerecht“ - Langsam wird klar, wie die Heizungs-Förderpläne der Ampel aussehen",Durchs Heizen sollen in Deutschland weniger Treibhausgase entstehen. Das ist das Ziel des neuen Heizungsgesetzes. Doch wie sieht es mit der Förderung aus? Langsam wird das Bild klarer.,https://p6.focus.de/img/fotos/id_197473395/ein-mann-kontrolliert-seine-alte-gasheizung.jpg?im=Crop%3D%280%2C7%2C3501%2C1751%29%3BResize%3D%281200%2C627%29&impolicy=perceptual&quality=mediumHigh&hash=3ddd12c22d2511f0052234b61f2b0e850cc1eb8484b4febf6bde916dc7cc68dd,2023-07-04T15:57:51Z,https://web.archive.org/web/20230704170735/https://www.focus.de/politik/deutschland/den-umstieg-gestalten-wir-sozial-und-gerecht-ampel-praezisiert-details-fuer-heizungs-foerderplaene_id_198200501.html,Durchs Heizen sollen in Deutschland weniger Treibhausgase entstehen. Das ist das Ziel des neuen Heizungsgesetzes. Doch wie sieht es mit der Förderung aus? Langsam wird das Bild klarer.Die Ampel-Frakt… [+3331 chars],,de,'Heizung'
https://www.stern.de/wirtschaft/news/energie--ampel-fraktionen-skizzieren-details-fuer-heizungs-foerderplaene-33619972.html,https://www.stern.de/wirtschaft/news/energie--ampel-fraktionen-skizzieren-details-fuer-heizungs-foerderplaene-33619972.html,0,www.stern.de,Energie: Ampel-Fraktionen skizzieren Details für Heizungs-Förderpläne,Durchs Heizen sollen in Deutschland weniger Treibhausgase entstehen. Das ist das Ziel des neuen Heizungsgesetzes. Doch wie sieht es mit der Förderung aus? Langsam wird das Bild klarer.,https://image.stern.de/33619974/t/XM/v1/w1440/r1.7778/-/04--urnnewsmldpacom2009010123070499280258v3w800h600l440t345r1272b1018jpeg---e12768e9263d8d21.jpg,2023-07-04T16:07:34Z,https://web.archive.org/web/20230704205231/https://www.stern.de/wirtschaft/news/energie--ampel-fraktionen-skizzieren-details-fuer-heizungs-foerderplaene-33619972.html,"Durchs Heizen sollen in Deutschland weniger Treibhausgase entstehen. Das ist das Ziel des neuen Heizungsgesetzes. Doch wie sieht es mit der Förderung aus? Langsam wird das Bild klarer.
Die Ampel-Fra… [+3319 chars]",,de,'Heizung'
https://www.zeit.de/news/2023-07/05/gentechnik-eu-kommission-praesentiert-lockerungsplaene,https://www.zeit.de/news/2023-07/05/gentechnik-eu-kommission-praesentiert-lockerungsplaene,0,www.zeit.de,Landwirtschaft: Gentechnik: EU-Kommission präsentiert Lockerungspläne,,,2023-07-05T02:56:35Z,,"When browsing with ads:
We collect personal data and also transmit it to third-party providers
 that help us improve and finance our digital content. Some of the information stored on your device, … [+821 chars]",,de,'Landwirtschaft'
https://www.morgenpost.de/ratgeber/article238862157/heizung-waermepumpe-branche-umsatz-eigentuemer-heizoel-gas.html,https://www.morgenpost.de/ratgeber/article238862157/heizung-waermepumpe-branche-umsatz-eigentuemer-heizoel-gas.html,0,www.morgenpost.de,Installateur: Darum investieren viele Haushalte noch in Gas und Öl,Heizöl und Gas statt Wärmepumpe – immer mehr Eigentümer kaufen noch eine Brennstoffheizung. Branchenkenner erklären die Gründe und geben Hinweise.,https://img.morgenpost.de/img/frontpage/crop238807739/2322607497-w820-cv16_9-q85/Gasheizung.jpg,2023-07-05T03:52:01Z,https://web.archive.org/web/20230705042144/https://www.morgenpost.de/ratgeber/article238862157/heizung-waermepumpe-branche-umsatz-eigentuemer-heizoel-gas.html,Berlin. Das Thema Heizung war innerhalb der Ampel-Koalition über viele Wochen ein Dauerstreitthema. Vor allem zwischen den Grünen und der FDP waren die Fronten verhärtet. Am Ende konnte sich die Bund… [+8526 chars],,de,'Gas'
https://www.faz.net/podcasts/f-a-z-podcast-fruehdenker/faz-fruehdenker-eu-kommission-will-mehr-gentechnik-in-der-landwirtschaft-19011155.html,https://www.faz.net/podcasts/f-a-z-podcast-fruehdenker/faz-fruehdenker-eu-kommission-will-mehr-gentechnik-in-der-landwirtschaft-19011155.html,0,www.faz.net,F.A.Z. Frühdenker: EU-Kommission will mehr Gentechnik in der Landwirtschaft,"Das Kabinett will den Haushaltsentwurf beschließen, Kanzler Scholz stellt sich den Fragen der Abgeordneten, und die EU legt einen Gesetzentwurf zur Gentechnik vor. Der F.A.Z. Newsletter",https://media1.faz.net/ppmedia/aktuell/1593337102/1.9011179/facebook_teaser_fplus/durch-gentechnik-veraenderter.jpg,2023-07-05T04:22:38Z,,"Das Wichtigste für Sie am Mittwoch: 
1. Kabinett will Haushaltsentwurf beschließen2. Scholz stellt sich den Fragen der Abgeordneten3. EU will den Weg für die Genschere frei machen4. El Niño kehrt zu… [+598 chars]",,de,'Landwirtschaft'
https://www.focus.de/politik/deutschland/gastbeitrag-von-gabor-steingart-wie-viele-ampel-koeche-das-heizungsgesetz-verdorben-haben_id_198252133.html,https://www.focus.de/politik/deutschland/gastbeitrag-von-gabor-steingart-wie-viele-ampel-koeche-das-heizungsgesetz-verdorben-haben_id_198252133.html,0,www.focus.de,Gastbeitrag von Gabor Steingart - Wie viele Ampel-Köche das Heizungsgesetz verdorben haben,"Was lange währt, wird auch jetzt nicht gut. Die Regierung wollte mit dem neuen Heizungsgesetz ein Meisterstück vorlegen. Herausgekommen ist eine Bastelarbeit.Von Gastautor Gabor Steingart (Berlin)",https://p6.focus.de/img/fotos/id_198252359/stg246.jpg?im=Crop%3D%280%2C22%2C780%2C389%29%3BResize%3D%281200%2C627%29&impolicy=perceptual&quality=mediumHigh&hash=81ac54303025eb27cc25bd435b3c4cf3957eeac5f07e5a12635d51d847ac683d,2023-07-05T06:06:16Z,,"Was lange währt, wird auch jetzt nicht gut. Die Regierung wollte mit dem neuen Heizungsgesetz ein Meisterstück vorlegen. Herausgekommen ist eine Bastelarbeit.Am Freitag soll das umstrittene Heizungsg… [+6279 chars]",,de,'Heizung'
https://www.faz.net/aktuell/wirtschaft/klima-nachhaltigkeit/soeder-wuerden-heizungsgesetz-abschaffen-ampel-fraktionen-skizzieren-foerder-details-19011516.html,https://www.faz.net/aktuell/wirtschaft/klima-nachhaltigkeit/soeder-wuerden-heizungsgesetz-abschaffen-ampel-fraktionen-skizzieren-foerder-details-19011516.html,0,www.faz.net,Söder: Würden Heizungsgesetz abschaffen – Ampel-Fraktionen skizzieren Förder-Details,"Nach langem Streit hat sich die Ampel auf ein Heizungsgesetz geeinigt. Nun werden weitere Details bekannt. Bayerns Ministerpräsident sagt derweil, wie eine von der Union geführte Regierung agieren würde.",https://media0.faz.net/ppmedia/aktuell/politik/1509535588/1.9001580/facebook_teaser/kritisiert-die-ampel-markus.jpg,2023-07-05T07:19:19Z,,Bayerns Ministerpräsident und CSU-Parteivorsitzender Markus Söder will sich weiter gegen das Heizungsgesetz einsetzen. Ich sage es mal für die Union: Wir würden dieses Gesetz nach der nächsten Bundes… [+3529 chars],,de,'Heizung'
https://www.zeit.de/news/2023-07/05/bio-anteil-in-der-landwirtschaft-weiter-leicht-gestiegen,https://www.zeit.de/news/2023-07/05/bio-anteil-in-der-landwirtschaft-weiter-leicht-gestiegen,0,www.zeit.de,Agrar: Bio-Anteil in der Landwirtschaft weiter leicht gestiegen,,,2023-07-05T08:28:25Z,,"When browsing with ads:
We collect personal data and also transmit it to third-party providers
 that help us improve and finance our digital content. Some of the information stored on your device, … [+821 chars]",,de,'Landwirtschaft'
https://www.telepolis.de/features/El-Nino-gestartet-Warum-das-nichts-Gutes-fuer-die-Welt-bedeutet-9207700.html,https://www.telepolis.de/features/El-Nino-gestartet-Warum-das-nichts-Gutes-fuer-die-Welt-bedeutet-9207700.html,0,www.telepolis.de,El Niño gestartet: Warum das nichts Gutes für die Welt bedeutet,"Energie und Klima – kompakt: Wichtige Wind- und Meeresströmungen ändern sich. Die Meteorologen warnen vor extremen Temperaturen, aber auch Unwettern. Warum ist das so?",https://heise.cloudimg.io/bound/1200x1200/q85.png-lossy-85.webp-lossy-85.foil1/_www-heise-de_/imgs/18/4/2/6/6/6/1/3/Storm-994b356fa594b93d.jpeg,2023-07-05T10:00:00Z,https://web.archive.org/web/20230705102620/https://www.telepolis.de/features/El-Nino-gestartet-Warum-das-nichts-Gutes-fuer-die-Welt-bedeutet-9207700.html,"Bild: Fanny Schertzer / CC BY-SA 3.0
Energie und Klima kompakt: Wichtige Wind- und Meeresströmungen ändern sich. Die Meteorologen warnen vor extremen Temperaturen, aber auch Unwettern. Warum ist das… [+2324 chars]",,de,'Dürre'
https://www.zeit.de/news/2023-07/05/bio-anteil-in-hessens-landwirtschaft-weiter-gestiegen,https://www.zeit.de/news/2023-07/05/bio-anteil-in-hessens-landwirtschaft-weiter-gestiegen,0,www.zeit.de,Ökologisch: Bio-Anteil in Hessens Landwirtschaft weiter gestiegen,,,2023-07-05T10:04:46Z,,"When browsing with ads:
We collect personal data and also transmit it to third-party providers
 that help us improve and finance our digital content. Some of the information stored on your device, … [+821 chars]",,de,'Landwirtschaft'
https://www.stern.de/gesellschaft/regional/hessen/oekologisch--bio-anteil-in-hessens-landwirtschaft-weiter-gestiegen-33621620.html,https://www.stern.de/gesellschaft/regional/hessen/oekologisch--bio-anteil-in-hessens-landwirtschaft-weiter-gestiegen-33621620.html,0,www.stern.de,Ökologisch: Bio-Anteil in Hessens Landwirtschaft weiter gestiegen,"Die Bio-Landwirtschaft hat in Hessen weiter zugenommen. Im Jahr 2022 wurden in dem Bundesland 126.474 Hektar ökologisch bewirtschaftet, wie das Bundeslandwirtschaftsministerium am Mittwoch in Berlin mitteilte. Im Vorjahr waren es noch 123.776 Hektar gewesen. …",https://image.stern.de/33621622/t/YJ/v1/w1440/r1.7778/-/05--urnnewsmldpacom2009010123070599291321v2w800h600l1926t295r4468b1984jpeg---51eb21c6e5e3e219.jpg,2023-07-05T10:04:46Z,https://web.archive.org/web/20230708020814/https://www.stern.de/gesellschaft/regional/hessen/oekologisch--bio-anteil-in-hessens-landwirtschaft-weiter-gestiegen-33621620.html,"Die Bio-Landwirtschaft hat in Hessen weiter zugenommen. Im Jahr 2022 wurden in dem Bundesland 126.474 Hektar ökologisch bewirtschaftet, wie das Bundeslandwirtschaftsministerium am Mittwoch in Berlin … [+1829 chars]",,de,'Landwirtschaft'
https://www.stern.de/wirtschaft/news/agrar--bio-landwirtschaft-waechst-leicht---kommt-bald-mehr-tempo---33621096.html,https://www.stern.de/wirtschaft/news/agrar--bio-landwirtschaft-waechst-leicht---kommt-bald-mehr-tempo---33621096.html,0,www.stern.de,Agrar: Bio-Landwirtschaft wächst leicht - kommt bald mehr Tempo?,"Bei Gurken oder Kartoffeln greifen viele gern zu Bio, mit teurerem Öko-Fleisch ist es schon so eine Sache. Dabei soll eine schonendere Lebensmittelproduktion vorankommen. Was tut sich da auf den Höfen?",https://image.stern.de/33621098/t/p9/v2/w1440/r1.7778/-/05--urnnewsmldpacom2009010123070599290078v3w800h600l366t268r1797b1407jpeg---6016908df1b8194d.jpg,2023-07-05T10:42:48Z,https://web.archive.org/web/20230708020724/https://www.stern.de/wirtschaft/news/agrar--bio-landwirtschaft-waechst-leicht---kommt-bald-mehr-tempo---33621096.html,"Bei Gurken oder Kartoffeln greifen viele gern zu Bio, mit teurerem Öko-Fleisch ist es schon so eine Sache. Dabei soll eine schonendere Lebensmittelproduktion vorankommen. Was tut sich da auf den Höfe… [+3658 chars]",,de,'Landwirtschaft'
https://www.nzz.ch/wirtschaft/bruessel-will-die-marktzulassung-gewisser-genveraenderter-pflanzen-vereinfachen-ld.1745895,https://www.nzz.ch/wirtschaft/bruessel-will-die-marktzulassung-gewisser-genveraenderter-pflanzen-vereinfachen-ld.1745895,0,www.nzz.ch,Brüssel will die Marktzulassung gewisser genveränderter Pflanzen vereinfachen,Die EU-Kommission möchte dank innovativer neuer Gentechnik der Landwirtschaft in Europa einen neuen Schub verleihen. Administrative Hürden für gewisse genveränderte Pflanzen sollen verschwinden. Doch das finden nicht alle toll.,"https://img.nzz.ch/2023/07/05/a6ad88db-447b-4d08-b717-ca488518cfd3.jpeg?width=1200&height=675&fit=bound&quality=75&auto=webp&crop=8192,4608,x0,y428&wmark=nzz",2023-07-05T10:46:53Z,,"Hitzebeständigere Pflanzen dank moderner Gentechnologie? Ein Landwirt erntet im August 2022 in der Nähe von Jessen in Deutschland Mais, der von der Sommerhitze ausgetrocknet worden ist.
Kurz bevor d… [+4760 chars]",,de,'Landwirtschaft'
https://www.stern.de/news/eu-kommission-schlaegt-lockerungen-fuer-gentechnik-in-der-landwirtschaft-vor-33621824.html,https://www.stern.de/news/eu-kommission-schlaegt-lockerungen-fuer-gentechnik-in-der-landwirtschaft-vor-33621824.html,0,www.stern.de,EU-Kommission schlägt Lockerungen für Gentechnik in der Landwirtschaft vor,"Nach großen Diskussionen bereits im Vorfeld hat die Europäische Kommission ihren Gesetzentwurf zur Gentechnik in der Landwirtschaft vorgestellt. Die Behörde empfiehlt darin weitreichende Lockerungen für bestimmte mit Gentechnik gezüchtete Pflanzenarten, wie s…",https://image.stern.de/33621826/t/RZ/v1/w1440/r1.7778/-/05--traktor-auf-einem-feld---e4c69ee035bb45dc.jpg,2023-07-05T10:52:14Z,,Nach großen Diskussionen bereits im Vorfeld hat die Europäische Kommission ihren Gesetzentwurf zur Gentechnik in der Landwirtschaft vorgestellt. Die Behörde empfiehlt darin weitreichende Lockerungen … [+1816 chars],,de,'Landwirtschaft'
https://www.n-tv.de/wissen/Hitze-Duerren-drohen-in-Mitteleuropa-zuzunehmen-article24238567.html,https://www.n-tv.de/wissen/Hitze-Duerren-drohen-in-Mitteleuropa-zuzunehmen-article24238567.html,0,www.n-tv.de,Stark betroffene Weltregion: Hitze-Dürren drohen in Mitteleuropa zuzunehmen,"Dürren und Hitzewellen sind eine gefährliche Kombination. Landwirtschaft und die Gesundheit der Menschen leiden darunter, zudem begünstigt die Trockenheit Brände. In kommenden Jahrzehnten könnten solche Ereignisse vermehrt zusammenfallen, mahnen Forscher - be…",https://bilder3.n-tv.de/img/incoming/crop24238646/6301322801-cImg_16_9-w1200/imago0262201841h.jpg,2023-07-05T11:17:16Z,,"Dürren und Hitzewellen sind eine gefährliche Kombination. Landwirtschaft und die Gesundheit der Menschen leiden darunter, zudem begünstigt die Trockenheit Brände. In kommenden Jahrzehnten könnten sol… [+3325 chars]",,de,'Landwirtschaft'
https://consent.google.com/ml?continue=https://news.google.com/rss/articles/CBMiR2h0dHBzOi8vd3d3LnRhZ2Vzc2NoYXUuZGUvd2lydHNjaGFmdC9sYW5kd2lydHNjaGFmdC1nZW50ZWNobmlrLTEwMC5odG1s0gEA?oc%3D5&gl=FR&hl=en&cm=2&pc=n&src=1,https://consent.google.com/ml?continue=https://news.google.com/rss/articles/CBMiR2h0dHBzOi8vd3d3LnRhZ2Vzc2NoYXUuZGUvd2lydHNjaGFmdC9sYW5kd2lydHNjaGFmdC1nZW50ZWNobmlrLTEwMC5odG1s0gEA?oc%3D5&gl=FR&hl=en&cm=2&pc=n&src=1,0,consent.google.com,"Umstrittene EU-Pläne: Biobauern wehren sich gegen ""grüne Gentechnik"" - tagesschau.de","<ol><li>Umstrittene EU-Pläne: Biobauern wehren sich gegen ""grüne Gentechnik""  tagesschau.de
</li><li>EU will Gentechnik in Landwirtschaft zulassen – Ökobauern sind entsetzt  Handelsblatt 
</li><li>Gentechnik bald ungekennzeichnet in Lebensmitteln?: EU-Kommi…",,2023-07-05T11:27:14Z,https://web.archive.org/web/20230708020356/https://consent.google.com/ml?continue=https:%2F%2Fnews.google.com%2Frss%2Farticles%2FCBMiR2h0dHBzOi8vd3d3LnRhZ2Vzc2NoYXUuZGUvd2lydHNjaGFmdC9sYW5kd2lydHNjaGFmdC1nZW50ZWNobmlrLTEwMC5odG1s0gEA%3Foc%3D5&gl=FR&hl=en&cm=2&pc=n&src=1,"We use cookies and data to<ul><li>Deliver and maintain Google services</li><li>Track outages and protect against spam, fraud, and abuse</li><li>Measure audience engagement and site statistics to unde… [+1131 chars]",,de,'Landwirtschaft'
https://orf.at/stories/3322801/,https://orf.at/stories/3322801/,0,orf.at,EU-Kommission stellte Pläne zur Lockerung vor,Die EU-Kommission hat am Mittwoch Pläne für einen deutlich lockereren Umgang mit der Neuen Gentechnik (NGT) in der Landwirtschaft vorgestellt. Neue Mutationsverfahren wie etwa die Genschere CRISPR/Cas sollen demnach künftig einfacher zum Einsatz kommen können…,https://ibs.orf.at/news?image=https%3A%2F%2Fassets.orf.at%2Fmims%2F2023%2F27%2F61%2Fcrops%2Fw%3D1200%2Ch%3D630%2Cq%3D75%2F1853031_master_692961_eu_neue_gentechnik_praesentation_gy.jpg%3Fs%3De409c10c0a50804a0feda985a227cde62fbfabc4,2023-07-05T12:08:22Z,,"Die EU-Kommission schlägt vor, gentechnisch veränderte Pflanzen in zwei Kategorien zu unterteilen. Für beide Kategorien sollen unterschiedliche Anforderungen gelten, um auf den Markt zu gelangen. Die… [+7749 chars]",,de,'Landwirtschaft'
https://www.faz.net/aktuell/wirtschaft/unternehmen/niedrigwasser-rheinschiffe-koennen-zu-wenig-laden-19012276.html,https://www.faz.net/aktuell/wirtschaft/unternehmen/niedrigwasser-rheinschiffe-koennen-zu-wenig-laden-19012276.html,0,www.faz.net,Alarm für die Logistik: Rheinschiffe können zu wenig laden,Die Dürre behindert die Logistik auf Europas wichtigster Wasserstraße. Fachleute warnen vor einer weiteren Zuspitzung. Schon jetzt müssen Rheinschiffe die Ladung um 40 Prozent reduzieren.,https://media1.faz.net/ppmedia/aktuell/gesellschaft/613158504/1.9012293/facebook_teaser/gefaehrlich-flach-ein.jpg,2023-07-05T12:09:24Z,,Die Gefahr von anhaltend niedrigem Wasser im Rhein ist nach Einschätzung des Beratungsunternehmens Everstream Analytics aktuell so groß wie sie seit dem historischen Niedrigwasser im Jahr 2018 nicht … [+2711 chars],,de,'Dürre'
https://www.stern.de/politik/ausland/landwirtschaft--gentechnik-plaene-der-eu-kommission--lockerungen-auf-dem-weg-33620286.html,https://www.stern.de/politik/ausland/landwirtschaft--gentechnik-plaene-der-eu-kommission--lockerungen-auf-dem-weg-33620286.html,0,www.stern.de,Landwirtschaft: Gentechnik-Pläne der EU-Kommission: Lockerungen auf dem Weg,"Ist Gentechnik unnötig oder Baustein einer modernen Landwirtschaft? Neue Methoden erlauben präzise Züchtungen, die auch natürlich entstehen könnten. Manche sehen die geplante Deregulierung kritisch.",https://image.stern.de/33622826/t/6l/v1/w1440/r1.7778/-/05--urnnewsmldpacom2009010123070599287476v5w800h600l640t453r1920b1282jpeg---39dbcf9e1dd79c65.jpg,2023-07-05T12:13:44Z,,"Ist Gentechnik unnötig oder Baustein einer modernen Landwirtschaft? Neue Methoden erlauben präzise Züchtungen, die auch natürlich entstehen könnten. Manche sehen die geplante Deregulierung kritisch.… [+3117 chars]",,de,'Landwirtschaft'
https://www.dw.com/de/landwirtschaft-eu-%C3%BCberdenkt-strenge-gentechnik-gesetze/a-66108931,https://www.dw.com/de/landwirtschaft-eu-%C3%BCberdenkt-strenge-gentechnik-gesetze/a-66108931,0,www.dw.com,Landwirtschaft: EU überdenkt strenge Gentechnik-Gesetze,"Die EU-Kommission möchte die Regeln für gentechnisch veränderte Pflanzen lockern, um die Lebensmittelproduktion effizienter zu machen und den Einsatz von Pestiziden einzudämmen. Gentechnisch veränderte Lebensmittel - bei diesem Gedanken ist vielen Menschen un…",https://static.dw.com/image/50135761_6.jpg,2023-07-05T13:22:00Z,,Gentechnisch veränderte Lebensmittel - bei diesem Gedanken ist vielen Menschen unwohl. Warum? Die vielen Monsanto-Skandale dürften dazu ihren Teil beigetragen haben. Doch auch die EU-Gesetzgebung ist… [+7837 chars],,de,'Landwirtschaft'
https://www.sueddeutsche.de/bayern/bayern-landwirtschaft-ernte-klimawandel-1.6000210,https://www.sueddeutsche.de/bayern/bayern-landwirtschaft-ernte-klimawandel-1.6000210,0,www.sueddeutsche.de,Landwirtschaft: Bauern in Bayern erwarten schwache Ernte,"Das Frühjahr war zu nass, seit Wochen ist es zu trocken - die Auswirkungen der Klimakrise werden gerade im Ackerbau immer deutlicher.",https://www.sueddeutsche.de/image/sz.1.6000211/1200x675?v=1688563636,2023-07-05T13:27:20Z,,"Das Frühjahr war zu nass, seit Wochen ist es zu trocken - die Auswirkungen der Klimakrise werden gerade im Ackerbau immer deutlicher. Erst Nässe, dann Trockenheit: Die Bauern in Bayern kämpfen auch i… [+2195 chars]",,de,'Ackerbau'
https://www.morgenpost.de/berlin/article238869629/Bombenentschaerfung-in-Berlin-Notunterkuenfte-eingerichtet.html,https://www.morgenpost.de/berlin/article238869629/Bombenentschaerfung-in-Berlin-Notunterkuenfte-eingerichtet.html,0,www.morgenpost.de,Kriegsfolgen: Bombenentschärfung in Berlin: Notunterkünfte eingerichtet,"Wegen der Evakuierung zur Entschärfung einer Weltkriegsbombe in Berlin-Hohenschönhausen stehen drei Schulen im Umkreis als Notunterkünfte zur Verfügung. 7800 Menschen mussten am Mittwoch ihre Wohnungen verlassen, wie ein Sprecher der Polizei am Mittwoch mitte…",https://img.morgenpost.de/img/berlin/crop238869627/243260265-w820-cv16_9-q85/Absperrband.jpg,2023-07-05T14:34:06Z,https://web.archive.org/web/20230705153704/https://www.morgenpost.de/berlin/article238869629/Bombenentschaerfung-in-Berlin-Notunterkuenfte-eingerichtet.html,Berlin (dpa/bb). Wegen der Evakuierung zur Entschärfung einer Weltkriegsbombe in Berlin-Hohenschönhausen stehen drei Schulen im Umkreis als Notunterkünfte zur Verfügung. 7800 Menschen mussten am Mitt… [+653 chars],,de,'Notunterkunft'
https://taz.de/Zuschuesse-beim-Heizungstausch/!5942015/,https://taz.de/Zuschuesse-beim-Heizungstausch/!5942015/,0,taz.de,Zuschüsse beim Heizungstausch: Es gibt maximal 21.000 Euro,Am Freitag soll das Gesetz zum Heizungstausch im Bundestag verabschiedet werden. Kurz vorher legt die Ampel Details für staatliche Zuschüsse vor.,https://taz.de/picture/6371213/948/33131960-1.jpeg,2023-07-05T15:49:00Z,,"Am Freitag soll das Gesetz zum Heizungstausch im Bundestag verabschiedet werden. Kurz vorher legt die Ampel Details für staatliche Zuschüsse vor.
Die Bundesregierung fördert den Einbau klimafreundli… [+3532 chars]",,de,'Heizung'
https://www.sueddeutsche.de/wirtschaft/weniger-pestizide-eu-kein-risiko-fuer-ernaehrungssicherheit-1.6000765,https://www.sueddeutsche.de/wirtschaft/weniger-pestizide-eu-kein-risiko-fuer-ernaehrungssicherheit-1.6000765,0,www.sueddeutsche.de,Weniger Pestizide: EU: Kein Risiko für Ernährungssicherheit,Die Ernährungssicherheit wird laut EU-Kommission durch einen geringeren Pestizideinsatz in der Landwirtschaft nicht gefährdet. Das Gegenteil sei der Fall: Wenn...,https://www.sueddeutsche.de/image/sz.1.5861561/1200x675?v=1688574093,2023-07-05T16:24:35Z,,Die Ernährungssicherheit wird laut EU-Kommission durch einen geringeren Pestizideinsatz in der Landwirtschaft nicht gefährdet. Das Gegenteil sei der Fall: Wenn der Einsatz von Pestiziden nicht reduzi… [+1543 chars],,de,'Landwirtschaft'
https://www.morgenpost.de/ratgeber/article238873059/hitze-klimawandel-duerre-studie.html,https://www.morgenpost.de/ratgeber/article238873059/hitze-klimawandel-duerre-studie.html,0,www.morgenpost.de,Studie: Klimawandel: So hart treffen Hitze und Dürre Mitteleuropa,Laut einer Klimastudie werden in Mitteleuropa Hitze und Dürre vermehrt auftreten. Warum gerade diese Kombination so gefährlich ist.,https://img.morgenpost.de/img/incoming/crop238873055/970260925-w820-cv16_9-q85/5FAD9800942FAA02.jpg,2023-07-06T10:29:53Z,,"Berlin. Die Sommer werden heißer und Regen macht sich rar ein Phänomen, dass lange Zeit in Gegenden außerhalb des europäischen Kontinents zu beobachten war. Doch mittlerweile treten diese klimatische… [+3629 chars]",,de,'Dürre'
https://www.faz.net/aktuell/politik/oecd-treibhausgasemissionen-der-landwirtschaft-steigen-weiter-19014638.html,https://www.faz.net/aktuell/politik/oecd-treibhausgasemissionen-der-landwirtschaft-steigen-weiter-19014638.html,0,www.faz.net,OECD: Treibhausgasemissionen der Landwirtschaft steigen weiter,"Die Viehhaltung ist laut der Industrieländerorganisation zu vier Fünfteln für landwirtschaftliche Ausstöße verantwortlich. Die Emissionen werden zunehmen, aber immerhin nimmt die Klimaintensität ab.",https://media0.faz.net/ppmedia/aktuell/2897621763/1.9014684/facebook_teaser/flugzeug-auto-rind-einige-der.jpg,2023-07-06T10:54:20Z,https://web.archive.org/web/20230706150324/https://www.faz.net/aktuell/politik/oecd-treibhausgasemissionen-der-landwirtschaft-steigen-weiter-19014638.html,Die durch die Landwirtschaft verursachten Treibhausgasemissionen werden laut der Organisation für wirtschaftliche Entwicklung und Zusammenarbeit (OECD) weiter zunehmen. Wie aus dem gemeinsam mit der … [+1237 chars],,de,'Landwirtschaft'
