index,url,valid,domain,title,description,image,published,archive,content,quote,language,keyword
https://consent.google.com/ml?continue=https://news.google.com/rss/articles/CBMiXGh0dHBzOi8vd3d3LnN3ci5kZS9zd3Jha3R1ZWxsL2JhZGVuLXd1ZXJ0dGVtYmVyZy8yMi0wMy0yMDIzLWJ3LW5ld3N0aWNrZXItYW0tbW9yZ2VuLTEwMC5odG1s0gEA?oc%3D5&gl=FR&hl=en-US&cm=2&pc=n&src=1,https://consent.google.com/ml?continue=https://news.google.com/rss/articles/CBMiXGh0dHBzOi8vd3d3LnN3ci5kZS9zd3Jha3R1ZWxsL2JhZGVuLXd1ZXJ0dGVtYmVyZy8yMi0wMy0yMDIzLWJ3LW5ld3N0aWNrZXItYW0tbW9yZ2VuLTEwMC5odG1s0gEA?oc%3D5&gl=FR&hl=en-US&cm=2&pc=n&src=1,0,consent.google.com,Newsticker BW: Streiks im ÖPNV ++ A6-Unfall ++ Corona-Prozess - SWR Aktuell,"<ol><li>Newsticker BW: Streiks im ÖPNV ++ A6-Unfall ++ Corona-Prozess  SWR Aktuell
</li><li>Streik-Welle in Baden-Württemberg geht weiter: Kitas und Nahverkehr betroffen  echo24.de
</li><li>Kreis Ludwigsburg: Verwaltungen und Kitas werden erneut bestreikt  …",,2023-03-22T04:56:56Z,,"We use cookies and data to<ul><li>Deliver and maintain Google services</li><li>Track outages and protect against spam, fraud, and abuse</li><li>Measure audience engagement and site statistics to unde… [+1131 chars]",,de,'ÖPNV'
https://orf.at/stories/3309655/,https://orf.at/stories/3309655/,0,orf.at,Trockenheit setzt Europa zu,"In Europa werden bereits jetzt manche Gebiete von der Dürre heimgesucht. Besonders in Italien, Spanien und Frankreich verschlechterte sich in den vergangenen Monaten die Grundwassersituation deutlich. Die Hitzeperioden im vergangenen Jahr, der trockene Winter…",https://ibs.orf.at/news?image=https%3A%2F%2Fassets.orf.at%2Fmims%2F2023%2F12%2F60%2Fcrops%2Fw%3D1200%2Ch%3D630%2Cq%3D75%2F1722757_master_637160_klima_trockenheit_oesterreich_afp.jpg%3Fs%3D179857838e0dba341c5657eb719ea4332d0317e3,2023-03-22T05:05:53Z,https://web.archive.org/web/20230322061353/https://orf.at/stories/3309655/,Am Montag hatte der Weltklimarat der Vereinten Nationen (IPCC) vor einer Eskalation der Klimakrise gewarnt. Mit jedem weiteren Schritt der globalen Erwärmung würden die Veränderungen bei den Extremen… [+7212 chars],,de,'Dürre'
https://www.morgenpost.de/politik/article237954457/klimawandel-deutschland-hitze-tote-regen-dwd.html,https://www.morgenpost.de/politik/article237954457/klimawandel-deutschland-hitze-tote-regen-dwd.html,0,www.morgenpost.de,Klimawandel mit Folgen : Hitze & Dürre 2022: So viele Menschen starben in Deutschland,"Der Deutsche Wetterdienst schlägt Alarm. Der Klimawandel wird spürbar: Unwetter, Hitzetote, Waldbrände. Eine schockierende Bilanz.",https://img.morgenpost.de/img/web-wissen/crop237951497/1562609286-w820-cv16_9-q85/Klima-Bilanz.jpg,2023-03-22T06:31:53Z,https://web.archive.org/web/20230322083757/https://www.morgenpost.de/politik/article237954457/klimawandel-deutschland-hitze-tote-regen-dwd.html,"Berlin. Über den wurde jahrelang wissenschaftlich und politisch diskutiert. Aber seine Folgen ""sind keine abstrakte statistische Kenngröße mehr, sondern belasten zunehmend Deutschlands sichere Versor… [+3685 chars]",,de,'Dürre'
https://www.tagesspiegel.de/berlin/bezirke/ubernachtungshalle-soll-zum-safe-place-werden-wie-berlin-mit-den-obdachlosen-am-ring-center-umgehen-will-9537890.html,https://www.tagesspiegel.de/berlin/bezirke/ubernachtungshalle-soll-zum-safe-place-werden-wie-berlin-mit-den-obdachlosen-am-ring-center-umgehen-will-9537890.html,0,www.tagesspiegel.de,Übernachtungshalle soll zum Safe Place werden: Wie Berlin mit den Obdachlosen am Ring-Center umgehen will,Unter der S-Bahnbrücke an der Frankfurter Allee campieren obdachlose Menschen. Dabei ist in der Nähe eine Notunterkunft. Wie die Bezirke hier planen.,https://www.tagesspiegel.de/images/obdachlose-zempel-toter-obdachloser-an-der-frankfurter-allee-in-berlin/alternates/BASE_16_9_W1400/obdachlose-zempel-toter-obdachloser-an-der-frankfurter-allee-in-berlin.jpeg,2023-03-22T08:42:46Z,,"Die S-Bahnbrücke am Ring Center in der Frankfurter Allee ist eine Art Hotspot für obdachlose Menschen, die sich hier gelegentlich versammeln, nächtigen oder auch musizieren. Im Jahre 2021 wurde es un… [+122 chars]",,de,'Not'
https://www.diepresse.com/6266374/uno-zehn-prozent-der-weltbevoelkerung-durch-wasserknappheit-in-kritischer-gefahr,https://www.diepresse.com/6266374/uno-zehn-prozent-der-weltbevoelkerung-durch-wasserknappheit-in-kritischer-gefahr,0,www.diepresse.com,"Uno: Zehn Prozent der Weltbevölkerung durch Wasserknappheit in ""hoher und kritischer Gefahr""","In New York startet heute eine dreitägige Wasserkonferenz der Vereinten Nationen. Selbst dort, wo es Wasser heute noch im Überfluss vorhanden sei, drohten durch den Klimawandel bald Dürren, warnt Unesco.",https://media.diepresse.com/social_diepresse_nachrichten/images/uploads_1200/e/0/6/6266374/B9E30B1F-A880-404C-8637-03BAE4C6EBFF_v0_l.jpg,2023-03-22T09:14:00Z,https://web.archive.org/web/20230323213558/https://www.diepresse.com/6266374/uno-zehn-prozent-der-weltbevoelkerung-durch-wasserknappheit-in-kritischer-gefahr,"In New York startet heute eine dreitägige Wasserkonferenz der Vereinten Nationen. Selbst dort, wo es Wasser heute noch im Überfluss vorhanden sei, drohten durch den Klimawandel bald Dürren, warnt Une… [+3306 chars]",,de,'Dürre'
https://www.handelsblatt.com/infografiken/grafik/infografik-der-woche-duerre-und-ihre-folgen-der-kampf-ums-wasser/29050776.html,https://www.handelsblatt.com/infografiken/grafik/infografik-der-woche-duerre-und-ihre-folgen-der-kampf-ums-wasser/29050776.html,0,www.handelsblatt.com,Infografik: Dürre und ihre Folgen: Der Kampf ums Wasser,In den vergangenen zwei Jahrzehnten haben laut Unicef mehr als zwei Milliarden Menschen Zugang zu sauberem Trinkwasser erhalten. Doch gleichzeitig nehmen Dürren und Konflikte zu.,https://www.handelsblatt.com/images/duerre/29050774/3-format2003.png,2023-03-22T09:25:50Z,https://web.archive.org/web/20230322140743/https://www.handelsblatt.com/infografiken/grafik/infografik-der-woche-duerre-und-ihre-folgen-der-kampf-ums-wasser/29050776.html,Düsseldorf Die Zahl der Naturkatastrophen hat seit der Jahrtausendwende zugenommen. Vor allem die wetterbedingten Ereignisse Überschwemmungen und Stürme sind zahlreicher geworden. So listen die Verei… [+2220 chars],,de,'Dürre'
https://www.faz.net/aktuell/technik-motor/energie/drohendes-heizungsverbot-fuehrt-zu-verunsicherung-bei-verbrauchern-18760953.html,https://www.faz.net/aktuell/technik-motor/energie/drohendes-heizungsverbot-fuehrt-zu-verunsicherung-bei-verbrauchern-18760953.html,0,www.faz.net,Schluss mit dem Ofen: Wenn das Heizungsverbot droht,"Die Krise im Keller nimmt ihren Lauf: Neue Ölbrenner sind so gefragt, grüne Heizsysteme so teuer wie lange nicht. Zurück bleiben verunsicherte Kunden und Heizungsbauer im Ausnahmezustand.",https://media1.faz.net/ppmedia/aktuell/2370689069/1.8766993/facebook_teaser/anschluss-gesichert-ein.jpg,2023-03-22T10:34:23Z,http://archive.md/20230322115722/https://www.faz.net/aktuell/technik-motor/energie/drohendes-heizungsverbot-fuehrt-zu-verunsicherung-bei-verbrauchern-18760953.html,"Volker Schrörs und Robert Habeck hängen in einer Schicksalsgemeinschaft, ob sie wollen oder nicht. Denn Habeck, der Klimaminister, will den Gebäudesektor auf Pariskurs bringen und rüttelt an den Kell… [+3296 chars]",,de,'Heizung'
https://www.focus.de/klima/experten/ohne-wasser-kein-leben-viele-grossstaedte-vernetzen-sich-jetzt-aus-einem-grund_id_188684562.html,https://www.focus.de/klima/experten/ohne-wasser-kein-leben-viele-grossstaedte-vernetzen-sich-jetzt-aus-einem-grund_id_188684562.html,0,www.focus.de,Weltwassertag - Kampf ums Wasser wird für Deutschland zum Risiko - was sich ändern muss,Die Dürre in afrikanischen Ländern führt jedes Jahr zu Hunderttausenden Toten und viel Leid. Auch Deutschland hat die Trockenheit im Hitzerekord-Sommer 2022 erreicht. Der Journalist Jürgen Rahmig beschreibt den Kampf um das Wasser im 21. Jahrhundert. Wo lauer…,https://p6.focus.de/img/fotos/id_188684869/gettyimages-579978111-170667a.jpg?im=Crop%3D%280%2C103%2C494%2C247%29%3BResize%3D%281200%2C627%29&hash=35ef20f8e3f0fcf35961335b6fa40d0fa7ce7c8eaa8d793b1ac964e52724241d,2023-03-22T11:18:03Z,https://web.archive.org/web/20230322172839/https://www.focus.de/klima/experten/ohne-wasser-kein-leben-viele-grossstaedte-vernetzen-sich-jetzt-aus-einem-grund_id_188684562.html,"<ul><li>
Kommentare</li><li>
E-Mail</li><li>
Teilen</li><li>
Mehr</li><li>
Twitter</li><li>
Drucken</li><li>
Feedback</li><li>
Fehler meldenSie haben einen Fehler gefunden?
Bitte markieren S… [+15019 chars]",,de,'Dürre'
https://www.welt.de/politik/ausland/article244411340/Moldaus-Energieminister-Putin-nutzt-Gas-als-Waffe.html,https://www.welt.de/politik/ausland/article244411340/Moldaus-Energieminister-Putin-nutzt-Gas-als-Waffe.html,0,www.welt.de,"„Putin nutzt Gas als Waffe, um uns zu schwächen. Aber es wird ihm nicht gelingen“","Moskau setzt alles daran, um das strategisch wichtige Land in Europa zu destabilisieren. Moldaus neuer Energieminister Victor Parlicov berichtet im Interview von seiner Strategie, um sich aus Putins Griff zu lösen. Aber eine gefährliche Schwachstelle bleibt.",https://img.welt.de/img/politik/ausland/mobile244411818/4781351327-ci16x9-w1200/An-employee-works-at-a-gas-distribution-plant-in-Chisinau-2.jpg,2023-03-22T13:22:05Z,https://web.archive.org/web/20230322172021/https://www.welt.de/politik/ausland/article244411340/Moldaus-Energieminister-Putin-nutzt-Gas-als-Waffe.html,"WELT: Minister Parlicov, seit Ausbruch des Krieges im Nachbarland Ukraine leidet die Bevölkerung in Moldau unter einer Energiekrise. Warum sind die Preisschocks immer noch nicht überwunden?
Victor P… [+5425 chars]",,de,'Gas'
https://www.welt.de/wirtschaft/article244426022/Koalitionsstreit-Jetzt-fordert-der-erste-FDP-Politiker-Maessigung-bei-Habeck-Kritik.html,https://www.welt.de/wirtschaft/article244426022/Koalitionsstreit-Jetzt-fordert-der-erste-FDP-Politiker-Maessigung-bei-Habeck-Kritik.html,0,www.welt.de,„Ehrabschneidend“ – FDP-Politiker fordert Mäßigung bei Habeck-Kritik,"FDP und Grüne streiten heftig über den Kurs in der Ampel-Regierung. Vor allem Wirtschaftsminister Robert Habeck steht wegen seiner Heizungs-Pläne in der Kritik. Doch aus der FDP gibt es nun erste Stimmen, die Besonnenheit einfordern. Man dürfe nicht den Job d…",https://img.welt.de/img/wirtschaft/mobile244426510/3571355797-ci16x9-w1200/Bundestag.jpg,2023-03-22T13:41:16Z,http://archive.md/20230322151524/https://www.welt.de/wirtschaft/article244426022/Koalitionsstreit-Jetzt-fordert-der-erste-FDP-Politiker-Maessigung-bei-Habeck-Kritik.html,"Im Streit zwischen FDP und Grünen in der Ampelregierung rufen erste Liberale zur Mäßigung auf. Er empfinde den Streit innerhalb der Koalition als belastend, sagte der wirtschaftspolitische Sprecher d… [+3466 chars]",,de,'Gas'
https://www.bild.de/regional/dresden/dresden-aktuell/dresden-gasexplosionen-in-friedrichstadt-zerstoeren-mehrere-fahrzeuge-83295124.bild.html,https://www.bild.de/regional/dresden/dresden-aktuell/dresden-gasexplosionen-in-friedrichstadt-zerstoeren-mehrere-fahrzeuge-83295124.bild.html,0,www.bild.de,Mehrere Fahrzeuge zerstört - Gas-Explosionen in Dresden,Mehrere Explosionen erschütterten Mittwochnachmittag den Dresdner Stadtteil Friedrichstadt.Foto: Roland Halkasch,"https://images.bild.de/641b0a508758ea0c20c18d9e/91b76c6dc327dd66a3c129715377f3a6,be3aaa6a?w=1280",2023-03-22T14:12:38Z,https://web.archive.org/web/20230322142853/https://www.bild.de/regional/dresden/dresden-aktuell/dresden-gasexplosionen-in-friedrichstadt-zerstoeren-mehrere-fahrzeuge-83295124.bild.html,"Dresden  Mehrere Explosionen erschütterten Mittwochnachmittag den Dresdner Stadtteil Friedrichstadt.
Gegen 14.08 Uhr wurden wir an die Schäfer/Ecke Walther-Straße gerufen. Dort kommt es zu einem Bra… [+851 chars]",,de,'Gas'
https://www.zeit.de/news/2023-03/22/infotelefon-fuer-berliner-in-finanzieller-not-eingerichtet,https://www.zeit.de/news/2023-03/22/infotelefon-fuer-berliner-in-finanzieller-not-eingerichtet,0,www.zeit.de,Soziales: Infotelefon für Berliner in finanzieller Not eingerichtet,,,2023-03-22T14:22:06Z,https://web.archive.org/web/20230323060514/https://www.zeit.de/news/2023-03/22/infotelefon-fuer-berliner-in-finanzieller-not-eingerichtet,"When browsing with ads:
We collect personal data and also transmit it to third-party providers
 that help us improve and finance our digital content. Some of the information stored on your device, … [+732 chars]",,de,'Not'
https://www.faz.net/aktuell/rhein-main/frankfurt/nachts-im-buchladen-der-etwas-andere-besuch-in-der-buchhandlung-18763301.html,https://www.faz.net/aktuell/rhein-main/frankfurt/nachts-im-buchladen-der-etwas-andere-besuch-in-der-buchhandlung-18763301.html,0,www.faz.net,"Nachts im Buchladen: Eingesperrt mit Büchern, Wein und Snacks","Auf Wunsch können sich Kunden abends mit Familie und Freunden in Buchhandlungen einschließen lassen – ein Besuch in der Buchhandlung eben, nur mal anders. Für die Läden ist das beliebte Format ein gutes Geschäft.",https://media1.faz.net/ppmedia/aktuell/4220809270/1.8763297/facebook_teaser_fplus/fuer-jeden-etwas-auch-um.jpg,2023-03-22T14:45:41Z,,"Noch einige Kunden stehen an der Kasse an, mit ihren Büchern unter dem Arm, und wollen zahlen. Draußen ist es schon dunkel, kalt ist es auch. Wir sind in die Buchhandlung Büchergilde in Frankfurt ges… [+674 chars]",,de,'Wein'
https://www.kino-zeit.de/film-kritiken-trailer/thelma,https://www.kino-zeit.de/film-kritiken-trailer/thelma,0,www.kino-zeit.de,Thelma (2017),"Film

 
 
 




 
 Produktion / Verleih

 
 Thelma von Joachim Trier

 




Kälteeruptionen
Ein Mann und ein kleines Mädchen stehen auf einer vereisten Seefläche in dem winterlich-kalten Norwegen. Sie verharren fast in der Mitte des Bildes, ehe sie langsam…",,2023-03-22T14:52:19Z,,"Nach diesem einschneidend-frostigen Beginn geht Joachim Triers Thelma mit einer zweiten großartigen Totalen weiter: Der Campus der Universität Oslo wird aus der Vogelperspektive eingefangen, Menschen… [+4827 chars]",,de,'Kälte'
https://www.sueddeutsche.de/muenchen/florian-riedl-dreiviertelblut-hi-fly-orchestra-saxofon-muenchen-tipps-1.5773054,https://www.sueddeutsche.de/muenchen/florian-riedl-dreiviertelblut-hi-fly-orchestra-saxofon-muenchen-tipps-1.5773054,0,www.sueddeutsche.de,Promi-Tipps für München und Region: Die Woche von Florian Riedl,"Der Musiker freut sich in der Woche vom 27. März bis zum 2. April auf Konzerte von Kollegen in München, besonders aber auf seinen Auftritt mit einer Jazzlegende. Ein Gastbeitrag.",https://www.sueddeutsche.de/image/sz.1.5773056/1200x675?v=1679413190,2023-03-22T14:56:11Z,,"Der Musiker freut sich in der Woche vom 27. März bis zum 2. April auf Konzerte von Kollegen in München, besonders aber auf seinen Auftritt mit einer Jazzlegende. Ein Gastbeitrag.Mittlerweile ist die … [+9307 chars]",,de,'Gas'
https://sz-magazin.sueddeutsche.de/gruss-aus-der-kueche/wein-fruchtsaft-vegan-92544,https://sz-magazin.sueddeutsche.de/gruss-aus-der-kueche/wein-fruchtsaft-vegan-92544,0,sz-magazin.sueddeutsche.de,Sind Weine und Fruchtsäfte eigentlich vegan?,"Könnte man meinen. Warum tierische Bestandteile zur Filtrierung und Klärung aber eine Rolle spielen und nicht auf der Zutatenliste stehen müssen, weiß eine Ernährungswissenschaftlerin.",https://szm-media.sueddeutsche.de/image/szm/fc4c1977203cf13f9ff084f941af2279/t107l0w2448h1285/1280/image.jpeg,2023-03-22T16:00:00Z,,"Die Ernährungswissenschaftlerin Elvira Schwörer informiert bei der Verbraucherzentrale Baden-Württemberg über Lebensmittel und Ernährung.
»Wein besteht aus Trauben, Fruchtsäfte werden aus Obst herge… [+1587 chars]",,de,'Wein'
https://www.stern.de/panorama/unglueck--explosionen-in-dresden-nach-brand-an-gasleitung-33307788.html,https://www.stern.de/panorama/unglueck--explosionen-in-dresden-nach-brand-an-gasleitung-33307788.html,0,www.stern.de,Unglück: Explosionen in Dresden nach Brand an Gasleitung,Bei Bauarbeiten in Dresden beschädigt ein Bagger eine Gasleitung. Dadurch kommt zu einem Brand. Vor allem mehrere Explosionen bereiten den Einsatzkräften Probleme.,https://image.stern.de/33307790/t/4u/v1/w1440/r1.7778/-/22--urnnewsmldpacom200901012303229949606v3w800h600l471t505r1749b1377jpeg---d7ac1219756e4e01.jpg,2023-03-22T16:53:16Z,https://web.archive.org/web/20230322191631/https://www.stern.de/panorama/unglueck--explosionen-in-dresden-nach-brand-an-gasleitung-33307788.html,"Bei Bauarbeiten in Dresden beschädigt ein Bagger eine Gasleitung. Dadurch kommt zu einem Brand. Vor allem mehrere Explosionen bereiten den Einsatzkräften Probleme.
Meterhohe Flammen und Explosionen:… [+2440 chars]",,de,'Gas'
https://www.stern.de/panorama/unglueck--explosionen-in-dresden-nach-brand-an-gasleitung--33307788.html,https://www.stern.de/panorama/unglueck--explosionen-in-dresden-nach-brand-an-gasleitung--33307788.html,0,www.stern.de,Unglück: Explosionen in Dresden nach Brand an Gasleitung,Bei Bauarbeiten in Dresden beschädigt ein Bagger eine Gasleitung. Dadurch kommt es zu einem Brand - und zu Explosionen. Der Feuerwehreinsatz dauert mehrere Stunden.,https://image.stern.de/33307790/t/og/v3/w1440/r1.7778/-/22--urnnewsmldpacom200901012303229949606v3w800h600l471t505r1749b1377jpeg---d7ac1219756e4e01.jpg,2023-03-22T19:18:01Z,https://web.archive.org/web/20230322210347/https://www.stern.de/panorama/unglueck--explosionen-in-dresden-nach-brand-an-gasleitung--33307788.html,"Bei Bauarbeiten in Dresden beschädigt ein Bagger eine Gasleitung. Dadurch kommt es zu einem Brand - und zu Explosionen. Der Feuerwehreinsatz dauert mehrere Stunden.
Meterhohe Flammen und Explosionen… [+2723 chars]",,de,'Gas'
https://www.basicthinking.de/blog/2023/03/22/laender-die-fossile-brennstoffe-von-russland-kaufen/,https://www.basicthinking.de/blog/2023/03/22/laender-die-fossile-brennstoffe-von-russland-kaufen/,0,www.basicthinking.de,"Diese 10 Länder kaufen am meisten Kohle, Gas und Öl aus Russland","Russland nimmt auch über ein Jahr nach dem Angriffskrieg auf die Ukraine viel Geld durch den Verkauf von fossilen Brennstoffen ein. In unserem wöchentlichen Ranking zeigen wir dir deshalb, welche zehn Länder aktuell am meisten Kohle, Gas und Öl aus Russland k…",https://www.basicthinking.de/blog/wp-content/uploads/2023/03/fossile-brennstoffe-russland.jpg,2023-03-22T20:15:06Z,,"Russland nimmt auch über ein Jahr nach dem Angriffskrieg auf die Ukraine viel Geld durch den Verkauf von fossilen Brennstoffen ein. In unserem wöchentlichen Ranking zeigen wir dir deshalb, welche zeh… [+1029 chars]",,de,'Gas'
https://www.welt.de/wirtschaft/plus244430844/Energiekrise-viel-guenstiger-als-gedacht-Kampf-um-die-Rest-Milliarden-beginnt.html,https://www.welt.de/wirtschaft/plus244430844/Energiekrise-viel-guenstiger-als-gedacht-Kampf-um-die-Rest-Milliarden-beginnt.html,0,www.welt.de,Energiekrise viel günstiger als gedacht – Jetzt beginnt der Kampf um die Rest-Milliarden,Statt einst prognostizierten 83 Milliarden Euro wird die Gas- und Strompreisbremse den Staat in diesem Jahr wohl nicht einmal die Hälfte davon kosten. Das verschärft nun den Streit um das verbliebene Geld. Die FDP warnt vor voreiligem Verteilen.,https://img.welt.de/img/wirtschaft/mobile244436564/9651353097-ci16x9-w1200-fnov-fpotl-fpi157750653/Cooking-on-Gas.jpg,2023-03-22T21:54:06Z,http://archive.md/20230322221229/https://www.welt.de/wirtschaft/plus244430844/Energiekrise-viel-guenstiger-als-gedacht-Kampf-um-die-Rest-Milliarden-beginnt.html,"Die WELT als ePaper: Die vollständige Ausgabe steht Ihnen bereits am Vorabend zur Verfügung so sind Sie immer hochaktuell informiert. Weitere Informationen: http://epaper.welt.de 
 Der Kurz-Link die… [+49 chars]",,de,'Gas'
https://www.bild.de/politik/inland/politik-inland/verliert-habeck-die-nerven-noch-son-spruch-ampel-bruch-83298754.bild.html,https://www.bild.de/politik/inland/politik-inland/verliert-habeck-die-nerven-noch-son-spruch-ampel-bruch-83298754.bild.html,0,www.bild.de,"Verliert Habeck die Nerven? - Noch so’n Spruch, Ampel-Bruch","Die Ampel-Hütte brennt nach dem Heizungs-Irrsinn von Klimaminister Robert Habeck (53, Grüne). Und was macht der? Gießt noch mal Öl ins Feuer.","https://images.bild.de/641b3b9500141b5aa373065d/c0b783697145c19758c0d37e7085c909,3deec226?w=1280",2023-03-22T21:55:39Z,https://web.archive.org/web/20230323011221/https://www.bild.de/politik/inland/politik-inland/verliert-habeck-die-nerven-noch-son-spruch-ampel-bruch-83298754.bild.html,"Die Ampel-Hütte brennt nach dem Heizungs-Irrsinn von Klimaminister Robert Habeck (53, Grüne). Und was macht der? Gießt noch mal Öl ins Feuer:
 Bei der Grünen-Klausur in Weimar motzt Habeck: Es gehe … [+2829 chars]",,de,'Heizung'
https://www.stern.de/panorama/usa--mindestens-fuenf-tote-bei-heftige-stuermen-in-kalifornien-33308492.html,https://www.stern.de/panorama/usa--mindestens-fuenf-tote-bei-heftige-stuermen-in-kalifornien-33308492.html,0,www.stern.de,USA: Mindestens fünf Tote bei heftige Stürmen in Kalifornien,"Der oft eher von Trockenheit und Dürre geplagte US-Bundesstaat Kalifornien ist von schweren Unwettern getroffen worden. Fünf Menschen kamen bereits ums Leben, Zehntausende waren zeitweise ohne Strom.",https://image.stern.de/33308494/t/kQ/v1/w1440/r1.7778/-/23--urnnewsmldpacom200901012303239954507v3w800h600l348t468r1628b1321jpeg---2e272188c188e480.jpg,2023-03-23T01:19:16Z,https://web.archive.org/web/20230323015923/https://www.stern.de/panorama/usa--mindestens-fuenf-tote-bei-heftige-stuermen-in-kalifornien-33308492.html,"Der oft eher von Trockenheit und Dürre geplagte US-Bundesstaat Kalifornien ist von schweren Unwettern getroffen worden. Fünf Menschen kamen bereits ums Leben, Zehntausende waren zeitweise ohne Strom.… [+1297 chars]",,de,'Dürre'
https://www.morgenpost.de/vermischtes/article237966433/Mindestens-fuenf-Tote-bei-heftige-Stuermen-in-Kalifornien.html,https://www.morgenpost.de/vermischtes/article237966433/Mindestens-fuenf-Tote-bei-heftige-Stuermen-in-Kalifornien.html,0,www.morgenpost.de,USA: Mindestens fünf Tote bei heftige Stürmen in Kalifornien,"Der oft eher von Trockenheit und Dürre geplagte US-Bundesstaat Kalifornien ist von schweren Unwettern getroffen worden. Fünf Menschen kamen bereits ums Leben, Zehntausende waren zeitweise ohne Strom.",https://img.morgenpost.de/img/vermischtes/crop237966431/7902606556-w820-cv16_9-q85/San-Francisco.jpg,2023-03-23T01:19:16Z,https://web.archive.org/web/20230323040733/https://www.morgenpost.de/vermischtes/article237966433/Mindestens-fuenf-Tote-bei-heftige-Stuermen-in-Kalifornien.html,"San Francisco. Bei heftigen Winterstürmen in Nordkalifornien sind mindestens fünf Menschen ums Leben gekommen. Nach Mitteilung der Stadt San Francisco starben zwei Menschen an ihren Verletzungen, die… [+1209 chars]",,de,'Dürre'
https://www.freitag.de/autoren/werner-ruegemer/lancet-studie-fracking-kann-toedlich-sein,https://www.freitag.de/autoren/werner-ruegemer/lancet-studie-fracking-kann-toedlich-sein,0,www.freitag.de,Gesundheitsrisiken | Lancet-Studie: Fracking kann tödlich sein,Eine Lancet-Studie verweist nicht nur auf die ökologischen Schäden hin. Auch der Mensch setzt sich an den Bohrlöchern verstärkten Gesundheitsgefahren aus Seit über zwei Jahrzehnten haben es Tausende Umweltinitiativen und Dutzende Universitätsinstitute in den …,https://www.freitag.de/autoren/werner-ruegemer/lancet-studie-fracking-kann-toedlich-sein/@@images/social_image,2023-03-23T03:00:00Z,,"Seit über zwei Jahrzehnten haben es Tausende Umweltinitiativen und Dutzende Universitätsinstitute in den USA dokumentiert, immer wieder: Fracking ist umweltschädlich. Grundwasser, Trinkwasser, Böden,… [+537 chars]",,de,'Tau'
https://www.tagesspiegel.de/berlin/freie-fahrt-fur-die-bvg-wahrend-andere-im-stau-stehen-verkehrsbetriebe-fordern-kilometerlange-bus-trassen-in-berlin-9545924.html,https://www.tagesspiegel.de/berlin/freie-fahrt-fur-die-bvg-wahrend-andere-im-stau-stehen-verkehrsbetriebe-fordern-kilometerlange-bus-trassen-in-berlin-9545924.html,0,www.tagesspiegel.de,"„Freie Fahrt für die BVG, während andere im Stau stehen“: Verkehrsbetriebe fordern kilometerlange Bus-Trassen in Berlin","Die BVG fordert von der Berliner Politik mehr Radikalität beim Vorrang des ÖPNV auf der Straße und will mehrere, kilometerlange Bus-Trassen einrichten. Unter anderem auf der Heerstraße.",https://www.tagesspiegel.de/images/29-euro-monatsticket-fur-berlin-nur-im-abo5/alternates/BASE_16_9_W1400/29-euro-monatsticket-fuer-berlin---nur-im-abo.jpeg,2023-03-23T06:09:44Z,,"Täglich stecken Busse der Berliner Verkehrsbetriebe (BVG) im Stadtverkehr fest. Um dem Nahverkehr auf der Straße endlich mehr Tempo zu verschaffen, fordert die BVG nun mehr Radikalität zugunsten des … [+132 chars]",,de,'ÖPNV'
https://www.zeit.de/news/2023-03/23/muenster-will-29-euro-ticket-im-oepnv-einfuehren,https://www.zeit.de/news/2023-03/23/muenster-will-29-euro-ticket-im-oepnv-einfuehren,0,www.zeit.de,Verkehr: Münster will 29-Euro-Ticket im ÖPNV einführen,,,2023-03-23T07:00:29Z,https://web.archive.org/web/20230323072354/https://www.zeit.de/news/2023-03/23/muenster-will-29-euro-ticket-im-oepnv-einfuehren,"When browsing with ads:
We collect personal data and also transmit it to third-party providers
 that help us improve and finance our digital content. Some of the information stored on your device, … [+732 chars]",,de,'ÖPNV'
