index,url,valid,domain,title,description,image,published,archive,content,quote,language,keyword
https://www.zeit.de/news/2023-11/01/warmes-essen-und-ein-bett-kaeltehilfe-startet-in-potsdam,https://www.zeit.de/news/2023-11/01/warmes-essen-und-ein-bett-kaeltehilfe-startet-in-potsdam,0,www.zeit.de,Soziales: Warmes Essen und ein Bett - Kältehilfe startet in Potsdam,Hier finden Sie Informationen zu dem Thema „Soziales“. Lesen Sie jetzt „Warmes Essen und ein Bett - Kältehilfe startet in Potsdam“.,https://img.zeit.de/news/2023-11/01/warmes-essen-und-ein-bett-kaeltehilfe-startet-in-potsdam-image-group/wide__1300x731,2023-11-01T04:30:45Z,https://web.archive.org/web/20231104143146/https://www.zeit.de/news/2023-11/01/warmes-essen-und-ein-bett-kaeltehilfe-startet-in-potsdam,Obdachlose Menschen in Potsdam können ab Mittwoch wieder die Kältehilfe nutzen. Die Stadt stellt in diesem Winter zunächst 99 Plätze in Pensionen zur Unterbringung wohnungsloser Menschen zur Verfügun… [+1535 chars],,de,'Kälte'
https://orf.at/stories/3338372/,https://orf.at/stories/3338372/,0,orf.at,Panamakanal: Noch weniger Schiffspassage wegen Dürre,,https://orf.at/mojo/1_4_1/storyserver//news/common/images/og-fallback-news.png,2023-11-01T05:33:13Z,,Angesichts des Niedrigwassers im Panamakanal soll der Schiffsverkehr durch die wichtige Wasserstraße weiter reduziert werden. Bis Februar kommenden Jahres werde die Zahl der buchbaren Schiffspassagen… [+987 chars],,de,'Dürre'
https://www.tagesspiegel.de/politik/migrationspolitik-der-grunen-dauerhafte-humanitat-kann-es-nur-in-ordnung-geben-10710655.html,https://www.tagesspiegel.de/politik/migrationspolitik-der-grunen-dauerhafte-humanitat-kann-es-nur-in-ordnung-geben-10710655.html,0,www.tagesspiegel.de,Migrationspolitik der Grünen: „Dauerhafte Humanität kann es nur in Ordnung geben“,Grünen-Chefin Lang und Ministerpräsident Kretschmann wollen die Migrationszahlen senken. Dafür wollen sie der Union die Hand reichen und machen fünf Vorschläge. Ein Gastbeitrag.,https://www.tagesspiegel.de/images/kretschmann-und-lang/alternates/BASE_16_9_W1400/kretschmann-und-lang.jpeg,2023-11-01T06:15:21Z,,"Die Welt ist in Aufruhr. Es sind so viele Menschen auf der Flucht wie nie zuvor. Sie fliehen vor Krieg und Gewalt, Vertreibung und Verfolgung, Dürre und Überschwemmung. Hinzu kommen viele Millionen M… [+101 chars]",,de,'Dürre'
https://www.n-tv.de/wirtschaft/Duerre-schraenkt-Schiffsverkehr-im-Panamakanal-ein-article24501733.html,https://www.n-tv.de/wirtschaft/Duerre-schraenkt-Schiffsverkehr-im-Panamakanal-ein-article24501733.html,0,www.n-tv.de,Wichtige Welthandelsstraße: Dürre schränkt Schiffsverkehr im Panamakanal ein,"Der Panamakanal ist eine wichtige Handelsstraße, vor allem für den Waren-Transport von Asien in die USA. Doch weil es so wenig regnet wie seit 1950 nicht mehr, sinkt der Wasserstand. Nun muss der Schiffsverkehr stark eingeschränkt werden.",https://bilder4.n-tv.de/img/incoming/crop24501831/2111324196-cImg_16_9-w1200/2023-10-31T172223Z-1102564059-RC22X0AMM4BT-RTRMADP-3-PANAMA-CANAL.jpg,2023-11-01T06:32:01Z,,"Der Panamakanal ist eine wichtige Handelsstraße, vor allem für den Waren-Transport von Asien in die USA. Doch weil es so wenig regnet wie seit 1950 nicht mehr, sinkt der Wasserstand. Nun muss der Sch… [+1958 chars]",,de,'Dürre'
https://www.tagesschau.de/wirtschaft/weltwirtschaft/panama-kanal-schifffahrt-duerre-100.html,https://www.tagesschau.de/wirtschaft/weltwirtschaft/panama-kanal-schifffahrt-duerre-100.html,0,www.tagesschau.de,Schiffsverkehr im Panamakanal wegen Niedrigwassers eingeschränkt,"Die Schifffahrt im Panamakanal muss weiter eingeschränkt werden. Niedrigwasser in Folge einer ungewöhnlichen Dürre und hohe Temperaturen sorgen dafür, dass die Wasserstraße weniger befahren werden kann.",https://images.tagesschau.de/image/42733b69-ae21-4271-8fe4-df0f09fb3464/AAABi4oo8nQ/AAABibBxqrQ/16x9-1280/panama-kanal-132.jpg,2023-11-01T10:28:12Z,,"Stand: 01.11.2023 11:28 Uhr
Die Schifffahrt im Panamakanal muss weiter eingeschränkt werden. Niedrigwasser in Folge einer ungewöhnlichen Dürre und hohe Temperaturen sorgen dafür, dass die Wasserstra… [+2965 chars]",,de,'Dürre'
https://www.stern.de/gesellschaft/regional/berlin-brandenburg/soziales--essen-und-ein-bett--kaeltehilfe-fuer-beduerftige-startet-33960366.html,https://www.stern.de/gesellschaft/regional/berlin-brandenburg/soziales--essen-und-ein-bett--kaeltehilfe-fuer-beduerftige-startet-33960366.html,0,www.stern.de,Soziales: Essen und ein Bett: Kältehilfe für Bedürftige startet,"Der Winter rückt näher. Für Obdachlose kommt mit der Kälte teilweise eine lebensbedrohliche Gefahr. Die Städte wollen ein Angebot machen, um Kältetote zu vermeiden.",https://image.stern.de/33960368/t/JB/v3/w1440/r1.7778/-/01--urnnewsmldpacom2009010123110199779045v3w800h600l638t457r1918b1374jpeg---243eb36bf50fb4b6.jpg,2023-11-01T12:27:08Z,,"Der Winter rückt näher. Für Obdachlose kommt mit der Kälte teilweise eine lebensbedrohliche Gefahr. Die Städte wollen ein Angebot machen, um Kältetote zu vermeiden.
Brandenburgs größte Städte wollen… [+2440 chars]",,de,'Kältebus'
https://www.sueddeutsche.de/sport/st-pauli-schalke-eggestein-huerzeler-1.6296814,https://www.sueddeutsche.de/sport/st-pauli-schalke-eggestein-huerzeler-1.6296814,0,www.sueddeutsche.de,St. Paulis Johannes Eggestein: Aus dem wird jetzt einer,"Johannes Eggestein galt mal als deutsche Stürmerhoffnung, erlebte dann aber einige Dürrejahre. Beim FC St. Pauli trifft er wieder - weil Trainer Fabian Hürzeler einen passgenauen Einsatzplan für ihn entwickelt hat.",https://www.sueddeutsche.de/image/sz.1.6296816/1200x675?v=1698844068,2023-11-01T13:07:56Z,,"Es heißt häufig, der Fußball schreibe ganz besondere Geschichten. Besonders ist eine Geschichte zum Beispiel, wenn ein Spieler gegen seinen ehemaligen Klub trifft - ausgerechnet Spieler XY, rufen die… [+4291 chars]",,de,'Dürre'
https://www.zeit.de/news/2023-11/02/wind-und-regen-in-rheinland-pfalz-und-dem-saarland,https://www.zeit.de/news/2023-11/02/wind-und-regen-in-rheinland-pfalz-und-dem-saarland,0,www.zeit.de,Wetter: Wind und Regen in Rheinland-Pfalz und dem Saarland,Hier finden Sie Informationen zu dem Thema „Wetter“. Lesen Sie jetzt „Wind und Regen in Rheinland-Pfalz und dem Saarland“.,https://img.zeit.de/news/2023-11/02/wind-und-regen-in-rheinland-pfalz-und-dem-saarland-image-group/wide__1300x731,2023-11-02T08:14:04Z,,"In Rheinland-Pfalz und dem Saarland müssen sich die Menschen gegen Wind und Regen wappnen. Ab Donnerstagmorgen gebe es im Nordwesten oft Böen bis 65 Stundenkilometer, schrieb der DWD. Im nördlichen B… [+1857 chars]",,de,'Wind'
https://www.stern.de/gesellschaft/regional/rheinland-pfalz-saarland/wetter--wind-und-regen-in-rheinland-pfalz-und-dem-saarland-33963626.html,https://www.stern.de/gesellschaft/regional/rheinland-pfalz-saarland/wetter--wind-und-regen-in-rheinland-pfalz-und-dem-saarland-33963626.html,0,www.stern.de,Wetter: Wind und Regen in Rheinland-Pfalz und dem Saarland,"In Rheinland-Pfalz und dem Saarland müssen sich die Menschen gegen Wind und Regen wappnen. Ab Donnerstagmorgen gebe es im Nordwesten oft Böen bis 65 Stundenkilometer, schrieb der DWD. Im nördlichen Bergland seien Sturmböen von 80 Stundenkilometern wahrscheinl…",https://image.stern.de/33963628/t/58/v1/w1440/r1.7778/-/02--urnnewsmldpacom2009010123110299793326v3w800h600l640t425r1920b1278jpeg---9038fd0c6d3ae336.jpg,2023-11-02T08:14:04Z,,"In Rheinland-Pfalz und dem Saarland müssen sich die Menschen gegen Wind und Regen wappnen. Ab Donnerstagmorgen gebe es im Nordwesten oft Böen bis 65 Stundenkilometer, schrieb der DWD. Im nördlichen B… [+1593 chars]",,de,'Wind'
https://www.stern.de/gesellschaft/regional/hessen/wetter--wind-und-regen-in-hessen---vereinzelt-sturmboeen-moeglich-33963658.html,https://www.stern.de/gesellschaft/regional/hessen/wetter--wind-und-regen-in-hessen---vereinzelt-sturmboeen-moeglich-33963658.html,0,www.stern.de,Wetter: Wind und Regen in Hessen - Vereinzelt Sturmböen möglich,"In Hessen müssen sich die Menschen gegen Wind und Regen wappnen. Am Donnerstag könne es zu Böen von bis zu 65 Stundenkilometern kommen, schrieb der Deutsche Wetterdienst (DWD) am Morgen. In Hochlagen seien vereinzelt Sturmböen von 80 Stundenkilometern wahrsch…",https://image.stern.de/33963660/t/zJ/v1/w1440/r1.7778/-/02--urnnewsmldpacom2009010123110299793481v2w800h600l1290t810r3870b2435jpeg---69f14feb7b0e26c7.jpg,2023-11-02T08:29:11Z,,"In Hessen müssen sich die Menschen gegen Wind und Regen wappnen. Am Donnerstag könne es zu Böen von bis zu 65 Stundenkilometern kommen, schrieb der Deutsche Wetterdienst (DWD) am Morgen. In Hochlagen… [+1488 chars]",,de,'Wind'
https://www.zeit.de/news/2023-11/02/wind-und-regen-in-hessen-vereinzelt-sturmboeen-moeglich,https://www.zeit.de/news/2023-11/02/wind-und-regen-in-hessen-vereinzelt-sturmboeen-moeglich,0,www.zeit.de,Wetter: Wind und Regen in Hessen - Vereinzelt Sturmböen möglich,Hier finden Sie Informationen zu dem Thema „Wetter“. Lesen Sie jetzt „Wind und Regen in Hessen - Vereinzelt Sturmböen möglich“.,https://img.zeit.de/news/2023-11/02/wind-und-regen-in-hessen-vereinzelt-sturmboeen-moeglich-image-group/wide__1300x731,2023-11-02T08:29:11Z,https://web.archive.org/web/20231104100958/https://www.zeit.de/news/2023-11/02/wind-und-regen-in-hessen-vereinzelt-sturmboeen-moeglich,"In Hessen müssen sich die Menschen gegen Wind und Regen wappnen. Am Donnerstag könne es zu Böen von bis zu 65 Stundenkilometern kommen, schrieb der Deutsche Wetterdienst (DWD) am Morgen. In Hochlagen… [+1880 chars]",,de,'Wind'
https://www.tagesspiegel.de/sport/kolumne-losgelaufen-lauftreff-fur-beinamputierte--wieder-den-wind-spuren-10713121.html,https://www.tagesspiegel.de/sport/kolumne-losgelaufen-lauftreff-fur-beinamputierte--wieder-den-wind-spuren-10713121.html,0,www.tagesspiegel.de,Kolumne „Losgelaufen“: Lauftreff für Beinamputierte – wieder den Wind spüren,Unsere Kolumnistin war bei einem Lauftreff für beinamputierte Läuferinnen und Läufer. Mit der richtigen Prothese wird die Freude am Laufen schnell wiedergefunden.,https://www.tagesspiegel.de/images/losgelaufen-kolumne/alternates/BASE_16_9_W1400/losgelaufen-kolumne.png,2023-11-02T08:35:34Z,https://web.archive.org/web/20231103021314/https://www.tagesspiegel.de/sport/kolumne-losgelaufen-lauftreff-fur-beinamputierte--wieder-den-wind-spuren-10713121.html,"Schnell laufen, den Wind im Gesicht und auf der Haut spüren. Ein Gefühl, das immer noch am schönsten ist, wenn man es gemeinsam erleben darf. So gesehen beim Lauftreff in Frankfurt. Treffen am Sportp… [+337 chars]",,de,'Wind'
https://www.basicthinking.de/blog/2023/11/02/orsted-aktie-windradhersteller-bricht-ein/,https://www.basicthinking.de/blog/2023/11/02/orsted-aktie-windradhersteller-bricht-ein/,0,www.basicthinking.de,Orsted: Aktie von Windradhersteller bricht ein – das ist der Grund,"Die Aktie des dänischen Energiekonzerns Orsted brach binnen eines Tages um fast 25 Prozent ein. Die Krise in der Windernegiebranche hat damit auch den weltgrößten Windradhersteller getroffen. Der Grund: Kosten, die aus dem Ruder laufen. Die Krise in der Winde…",https://www.basicthinking.de/blog/wp-content/uploads/2023/11/orsted-aktie.jpg,2023-11-02T09:15:01Z,https://web.archive.org/web/20231102091651/https://www.basicthinking.de/blog/2023/11/02/orsted-aktie-windradhersteller-bricht-ein/,Die Aktie des dänischen Energiekonzerns Orsted brach binnen eines Tages um fast 25 Prozent ein. Die Krise in der Windernegiebranche hat damit auch den weltgrößten Windradhersteller getroffen. Der Gru… [+2339 chars],,de,'Wind'
https://www.focus.de/panorama/wetter-aktuell/sturmboeen-bis-100-km-h-sturmfahrplan-hier-treffen-die-orkane-jetzt-auf-deutschland_id_237460758.html,https://www.focus.de/panorama/wetter-aktuell/sturmboeen-bis-100-km-h-sturmfahrplan-hier-treffen-die-orkane-jetzt-auf-deutschland_id_237460758.html,0,www.focus.de,Sturmböen bis 100 km/h - Sturmfahrplan: Hier treffen die Orkane jetzt auf Deutschland,"Gleich drei Stürme bekommen wir in den nächsten Tagen zu spüren. Auch wenn wir nicht mit den gleichen Windstärken wie Frankreich und England zu kämpfen haben, stehen die Zeichen in den nächsten Tagen auf Wind und Sturm.",https://p6.focus.de/img/fotos/id_237461169/de-orkanserie-fahrplan.jpg?im=Crop%3D%280%2C60%2C1920%2C960%29%3BResize%3D%281200%2C627%29&impolicy=perceptual&quality=mediumHigh&hash=5fa08eb09974f6fac9b03979b580e7afe17910faf3012fbbba88986b7d284958,2023-11-02T10:23:27Z,https://web.archive.org/web/20231102114336/https://www.focus.de/panorama/wetter-aktuell/sturmboeen-bis-100-km-h-sturmfahrplan-hier-treffen-die-orkane-jetzt-auf-deutschland_id_237460758.html,"Gleich drei Stürme bekommen wir in den nächsten Tagen zu spüren. Auch wenn wir nicht mit den gleichen Windstärken wie Frankreich und England zu kämpfen haben, stehen die Zeichen in den nächsten Tagen… [+2849 chars]",,de,'Wind'
https://www.stern.de/gesellschaft/regional/bayern/wetter--regen-und-wolken-in-bayern--schneefallgrenze-bei-1200-metern-33964218.html,https://www.stern.de/gesellschaft/regional/bayern/wetter--regen-und-wolken-in-bayern--schneefallgrenze-bei-1200-metern-33964218.html,0,www.stern.de,Wetter: Regen und Wolken in Bayern: Schneefallgrenze bei 1200 Metern,"Wer in Bayern Schlitten fahren will, muss in den kommenden Tagen hoch hinaus: Auf mehr als 2000 Metern Höhe würden am Donnerstag bis zu 20 Zentimeter Schnee erwartet, sagte ein Sprecher des Deutschen Wetterdienstes (DWD). Aber auch in niedrigeren Lagen könnte…",https://image.stern.de/33964220/t/kz/v1/w1440/r1.7778/-/02--urnnewsmldpacom2009010123110299795613v1w800h600l216t216r891b1030jpeg---88c86bc9f720d24d.jpg,2023-11-02T10:52:41Z,,"Wer in Bayern Schlitten fahren will, muss in den kommenden Tagen hoch hinaus: Auf mehr als 2000 Metern Höhe würden am Donnerstag bis zu 20 Zentimeter Schnee erwartet, sagte ein Sprecher des Deutschen… [+1261 chars]",,de,'Schnee'
https://www.zeit.de/news/2023-11/02/regen-und-wolken-in-bayern-schneefallgrenze-bei-1200-metern,https://www.zeit.de/news/2023-11/02/regen-und-wolken-in-bayern-schneefallgrenze-bei-1200-metern,0,www.zeit.de,Wetter: Regen und Wolken in Bayern: Schneefallgrenze bei 1200 Metern,Hier finden Sie Informationen zu dem Thema „Wetter“. Lesen Sie jetzt „Regen und Wolken in Bayern: Schneefallgrenze bei 1200 Metern“.,https://img.zeit.de/news/2023-11/02/regen-und-wolken-in-bayern-schneefallgrenze-bei-1200-metern-image-group/wide__1300x731,2023-11-02T10:52:41Z,https://web.archive.org/web/20231104101334/https://www.zeit.de/news/2023-11/02/regen-und-wolken-in-bayern-schneefallgrenze-bei-1200-metern,"Wer in Bayern Schlitten fahren will, muss in den kommenden Tagen hoch hinaus: Auf mehr als 2000 Metern Höhe würden am Donnerstag bis zu 20 Zentimeter Schnee erwartet, sagte ein Sprecher des Deutschen… [+963 chars]",,de,'Wind'
https://www.stern.de/familie/kalte-jahreszeit--so-bekommen-sie-ihren-garten-winterfest-33964350.html,https://www.stern.de/familie/kalte-jahreszeit--so-bekommen-sie-ihren-garten-winterfest-33964350.html,0,www.stern.de,Kalte Jahreszeit: Den Garten winterfest machen: So schützen Sie Ihre Pflanzen vor der Kälte,"Nicht nur Pflanzen, sondern auch Gartenmöbel leiden im Winter unter den vorherrschenden Witterungsverhältnissen. Wenn Sie im Frühjahr keine bösen Überraschungen erleben wollen, sollten Sie Ihren Garten zeitnah winterfest machen.",https://image.stern.de/9021216/t/qY/v3/w1440/r1.7778/-/garten-winterfest-machen-neu.jpg,2023-11-02T11:20:00Z,,"Auch wenn der Winter seinen Höhepunkt erst im neuen Jahr erreicht, machen die sinkenden Temperaturen vielen Gartenbewohnern jetzt schon zu schaffen: Sensible Pflanzen wie Rosen und Kamelien, junge Bä… [+7284 chars]",,de,'Kälte'
https://www.n-tv.de/panorama/Der-Orkan-erreicht-jetzt-seinen-Hoehepunkt-article24504848.html,https://www.n-tv.de/panorama/Der-Orkan-erreicht-jetzt-seinen-Hoehepunkt-article24504848.html,0,www.n-tv.de,"Bis zu 20 Meter hohe Wellen: ""Der Orkan erreicht jetzt seinen Höhepunkt""","Die Wetterlage führt in weiten Teilen Europas zu bedrohlichen Windgeschwindigkeiten, teils in Hurrikan-Stärke. Laut ntv-Wetterexperte Björn Alexander ist der Orkan einer der stärksten Stürme, den Frankreich und Südengland bislang erlebt haben. Und es bildet s…",https://bilder2.n-tv.de/img/incoming/crop24504901/4451329241-cImg_16_9-w1200/432942760.jpg,2023-11-02T11:30:54Z,https://web.archive.org/web/20231102211025/https://www.n-tv.de/panorama/Der-Orkan-erreicht-jetzt-seinen-Hoehepunkt-article24504848.html,"Die stürmische Wetterlage führt in weiten Teilen Europas zu bedrohlichen Windgeschwindigkeiten, teils in Hurrikan-Stärke. Laut ntv-Wetterexperte Björn Alexander ist der Orkan einer der stärksten Stür… [+4708 chars]",,de,'Wind'
https://www.diepresse.com/17786790/truebes-wetter-und-schneefall-im-gebirge-am-wochenende,https://www.diepresse.com/17786790/truebes-wetter-und-schneefall-im-gebirge-am-wochenende,0,www.diepresse.com,Trübes Wetter und Schneefall im Gebirge am Wochenende,"Die Temperaturen am Wochenende erreichen maximal 16 Grad, vor allem am Freitag könnte es schon ab 900 Meter schneien.",https://img.diepresse.com/public/incoming/4810cc-EG3009-324100/alternates/DPR_SOCIAL_NACHRICHTEN/EG3009%2C%20324100,2023-11-02T12:07:41Z,,"Die Temperaturen am Wochenende erreichen maximal 16 Grad, vor allem am Freitag könnte es schon ab 900 Meter schneien.
Das kommende Wochenende dürfte wettertechnisch in weiten Landesteilen eher trüb … [+3217 chars]",,de,'Schnee'
https://taz.de/Erneuerbare-Energien-in-der-Krise/!5967100/,https://taz.de/Erneuerbare-Energien-in-der-Krise/!5967100/,0,taz.de,Erneuerbare Energien in der Krise: Windbranche mit Milliardenverlusten,Die Konzerne kämpfen mit Lieferkettenproblemen und Einbußen. Nun gibt der Energieriese Ørsted zwei Offshoreparks in den USA auf.,https://taz.de/picture/6627369/948/33630151-1.jpeg,2023-11-02T16:30:00Z,,"Die Konzerne kämpfen mit Lieferkettenproblemen und Einbußen. Nun gibt der Energieriese Ørsted zwei Offshoreparks in den USA auf.
Es betrifft nicht nur die Dänen: Die Windbranche steckt in einer Kris… [+4624 chars]",,de,'Wind'
https://www.zeit.de/zeit-magazin/wochenmarkt/2023-10/weine-weihnachten-pinot-noir-cuvee-winter-weinkolumne,https://www.zeit.de/zeit-magazin/wochenmarkt/2023-10/weine-weihnachten-pinot-noir-cuvee-winter-weinkolumne,0,www.zeit.de,Weine zu Weihnachten: Wünsch-dir-Weine,Bald beginnt die Festsaison. Denken Sie frühzeitig an die richtige Weinbegleitung! Unser Kolumnist hat viele Empfehlungen und verbeugt sich vor seinen Jahreslieblingen.,https://img.zeit.de/zeit-magazin/wochenmarkt/2023-10/weine-weihnachten-pinot-noir-cuvee-winter-weinkolumne-teaser/wide__1300x731,2023-11-02T17:29:00Z,https://web.archive.org/web/20231103054742/https://www.zeit.de/zeit-magazin/wochenmarkt/2023-10/weine-weihnachten-pinot-noir-cuvee-winter-weinkolumne,"""Wein doch""
 heißt Gero von Randows ZEIT-ONLINE-Kolumne über Wein. Bis 2020 war er 
ZEIT-Redakteur, einige Jahre lang auch Korrespondent in Frankreich. Er 
ist Mitglied von Verkostungsjurys, organ… [+625 chars]",,de,'Wein'
https://www.stern.de/kultur/musik/albumveroeffentlichung---was-ne-geile-zeit---wolfgang-petry-mit-weihnachtsalbum--33966526.html,https://www.stern.de/kultur/musik/albumveroeffentlichung---was-ne-geile-zeit---wolfgang-petry-mit-weihnachtsalbum--33966526.html,0,www.stern.de,"Albumveröffentlichung: ""Was ne geile Zeit"": Wolfgang Petry mit Weihnachtsalbum","""Schneeflöckschen, Weißröckschen"" - Wolfgang Petry bringt erstmals seit 23 Jahren wieder ein Weihnachtsalbum heraus. Im Interview erzählt der 72-Jährige, wie er das Fest als kleiner Junge erlebt hat.",https://image.stern.de/33966528/t/KV/v1/w1440/r1.7778/-/03--urnnewsmldpacom2009010123110299793602v4w800h600l652t107r1801b1013jpeg---59a470bde5b12f59.jpg,2023-11-03T07:30:59Z,https://web.archive.org/web/20231103075613/https://www.stern.de/kultur/musik/albumveroeffentlichung---was-ne-geile-zeit---wolfgang-petry-mit-weihnachtsalbum--33966526.html,"""Schneeflöckschen, Weißröckschen"" - Wolfgang Petry bringt erstmals seit 23 Jahren wieder ein Weihnachtsalbum heraus. Im Interview erzählt der 72-Jährige, wie er das Fest als kleiner Junge erlebt hat.… [+3125 chars]",,de,'Schnee'
https://wien.orf.at/stories/3231002/,https://wien.orf.at/stories/3231002/,0,wien.orf.at,Kältetelefon wieder in Betrieb,Die kalte Jahreszeit nähert sich und das stellt vor allem obdachlose Menschen vor Herausforderungen. Das Kältetelefon der Caritas soll jetzt wieder dabei helfen. Es ist sieben Tage die Woche rund um die Uhr besetzt. Am Telefon sitzen viele freiwillige Helferi…,https://ibs.orf.at/wie?image=https%3A%2F%2Foekastatic.orf.at%2Fmims%2F2022%2F47%2F40%2Fcrops%2Fw%3D1200%2Ch%3D627%2Cq%3D75%2F1571131_master_574640_5ab6dfc8-1fc9-4ed7-a169-5f7ae372e1b0.jpg%3Fs%3D2f2ba385a62bbe8b839ab92d02cd5aa2c256d999,2023-11-03T18:00:00Z,https://web.archive.org/web/20231103203446/https://wien.orf.at/stories/3231002/,"Auch wenn es untertags noch zweistellige Plusgrade hat, in der Nacht und Früh ist es bereits kalt und die ersten Anrufe kommen, um obdachlose Personen zu melden. Rund 9.700-mal hat das Kältetelefon i… [+1137 chars]",,de,'Kältebus'
https://www.faz.net/aktuell/wirtschaft/klima-nachhaltigkeit/klimawandel-anpassung-an-hitze-duerre-und-starkregen-19288142.html,https://www.faz.net/aktuell/wirtschaft/klima-nachhaltigkeit/klimawandel-anpassung-an-hitze-duerre-und-starkregen-19288142.html,0,www.faz.net,"Wer Deutschland für Hitze, Dürre und Starkregen fit macht",Deutschland soll widerstandsfähiger gegen Extremwetter werden. Viele Kommunen stellen dafür Klimaanpassungsmanager ein. Deren Pläne stoßen aber nicht immer auf Begeisterung.,https://media0.faz.net/ppmedia/aktuell/2058420808/1.9288140/facebook_teaser_fplus/niedriger-wasserstand-das.jpg,2023-11-05T11:22:37Z,,Ortstermin in Beeskow mit Agnieszka Blaske. Seit Jahresbeginn ist die 35 Jahre alte Umwelttechnikerin die Klimaanpassungsmanagerin des brandenburgischen Landkreises Oder-Spree. Sie hat damit eine Pio… [+632 chars],,de,'Dürre'
