index,url,valid,domain,title,description,image,published,archive,content,quote,language,keyword
https://www.tagesspiegel.de/potsdam/landeshauptstadt/trockenheit-in-potsdam-aussergewohnliche-durre-im-boden-13715053.html,https://www.tagesspiegel.de/potsdam/landeshauptstadt/trockenheit-in-potsdam-aussergewohnliche-durre-im-boden-13715053.html,0,www.tagesspiegel.de,Trockenheit in Potsdam: „Außergewöhnliche Dürre“ im Boden,Potsdams Stadtverwaltung zeigt sich besorgt wegen „Pflanzen im Trockenstress“. Die Bewässerung von öffentlichen Grünflächen hat daher schon begonnen.,https://www.tagesspiegel.de/images/13724893/alternates/BASE_16_9_W1400/1747748724000/freundschaftsinsel.jpeg,2025-05-20T14:02:45Z,http://archive.md/20250521111033/https://www.tagesspiegel.de/potsdam/landeshauptstadt/trockenheit-in-potsdam-aussergewohnliche-durre-im-boden-13715053.html,"Zwar hat es jüngst einige Regengüsse gegeben. Doch am grundlegenden Problem, dass es dieses Jahr in Potsdam bisher viel zu trocken ist, hat das nichts geändert. Im Ober- und Gesamtboden kann man mome… [+160 chars]",,de,'Bewässerung'
https://www.appgefahren.de/homematic-ip-stellt-smarten-bewaesserungsaktor-fuer-den-garten-vor-379409.html,https://www.appgefahren.de/homematic-ip-stellt-smarten-bewaesserungsaktor-fuer-den-garten-vor-379409.html,0,www.appgefahren.de,Homematic IP stellt smarten Bewässerungsaktor für den Garten vor,"Pünktlich zur Gartensaison bringt eQ-3 frischen Wind ins Smart-Home-Portfolio: Ab Juli 2025 ergänzt ein neuer Bewässerungsaktor das System Homematic IP. Der batteriebetriebene Aktor übernimmt das automatische Gießen von Pflanzen – bedarfsgerecht, effizient un…",https://www.appgefahren.de/wp-content/uploads/2025/05/Homematic-IP-Bewasserungsaktor.jpg,2025-05-20T14:05:54Z,,Pünktlich zur Gartensaison bringt eQ-3 frischen Wind ins Smart-Home-Portfolio: Ab Juli 2025 ergänzt ein neuer Bewässerungsaktor das System Homematic IP. Der batteriebetriebene Aktor übernimmt das aut… [+1478 chars],,de,'Bewässerung'
https://www.stern.de/news/unbekannte-lassen-in-stuttgarter-universitaet-rund-6000-liter-wein-auslaufen-35741290.html,https://www.stern.de/news/unbekannte-lassen-in-stuttgarter-universitaet-rund-6000-liter-wein-auslaufen-35741290.html,0,www.stern.de,Unbekannte lassen in Stuttgarter Universität rund 6000 Liter Wein auslaufen,"Unbekannte haben im Keller einer Universität in Stuttgart etwa 6000 Liter Wein auslaufen lassen. Wie die Polizei in der baden-württembergischen Landeshauptstadt am Dienstag mitteilte, drangen die Täter im Laufe des Wochenendes über eine defekte Tür ein und öf…",https://image.stern.de/35741292/t/gh/v1/w1440/r1.7778/-/20--stahltanks-zur-weinherstellung---daa8485fc0abb50b.jpg,2025-05-20T14:38:23Z,,"Kopiere den aktuellen Link
Zur Merkliste hinzufügen
Unbekannte haben im Keller einer Universität in Stuttgart etwa 6000 Liter Wein auslaufen lassen. Wie die Polizei in der baden-württembergischen L… [+560 chars]",,de,'Wein'
https://www.bild.de/news/wetter/wetterumschwung-bringt-endlich-regen-doch-es-ist-nicht-genug-682c5baa591a80205121fc61,https://www.bild.de/news/wetter/wetterumschwung-bringt-endlich-regen-doch-es-ist-nicht-genug-682c5baa591a80205121fc61,0,www.bild.de,Dürre in Deutschland - Wetterumschwung bringt endlich Regen,In dieser Woche bringt das Wetter endlich Regen in Deutschland. Doch die Trockenheit bleibt ein Problem.,"https://images.bild.de/682c5baa591a80205121fc61/3ddf09a1dd6def5fe8b1290b62245bfe,8611f05c?w=1280",2025-05-20T15:27:15Z,,"Mal Sonne, mal Wolken, aber kaum Regen in Deutschland. Doch jetzt kommt die Wetter-Wende! Die nächsten Tage werden endlich auch mal nass.
Die Trockenheit in diesem Frühjahr hat ernste Folgen für Pfl… [+4245 chars]",,de,'Dürre'
https://www.stern.de/gesellschaft/regional/baden-wuerttemberg/stuttgart--einbrecher-lassen-weintanks-im-universitaetskeller-auslaufen-35741690.html,https://www.stern.de/gesellschaft/regional/baden-wuerttemberg/stuttgart--einbrecher-lassen-weintanks-im-universitaetskeller-auslaufen-35741690.html,0,www.stern.de,Stuttgart: Einbrecher lassen Weintanks im Universitätskeller auslaufen,Stuttgart (lsw) - Unbekannte sind in einen Keller der Universität Hohenheim in Stuttgart eingebrochen und haben mehrere Ablassventile von Stahltanks mit,https://image.stern.de/35741692/t/3U/v1/w1440/r1.7778/-/20--zkukehj37bv16axs2048jpeg---70e2d57d9c56fe76.jpg,2025-05-20T16:27:58Z,,"Kopiere den aktuellen Link
Zur Merkliste hinzufügen
Unbekannte brechen in einen Keller einer Stuttgarter Universität ein. Was sie dort tun, ist eher ungewöhnlich.
Unbekannte sind in einen Keller d… [+439 chars]",,de,'Wein'
https://www.zeit.de/news/2025-05/20/einbrecher-lassen-weintanks-im-universitaetskeller-auslaufen,https://www.zeit.de/news/2025-05/20/einbrecher-lassen-weintanks-im-universitaetskeller-auslaufen,0,www.zeit.de,Stuttgart: Einbrecher lassen Weintanks im Universitätskeller auslaufen,Hier finden Sie Informationen zu dem Thema „Stuttgart“. Lesen Sie jetzt „Einbrecher lassen Weintanks im Universitätskeller auslaufen“.,https://img.zeit.de/news/2025-05/20/einbrecher-lassen-weintanks-im-universitaetskeller-auslaufen-image-group/wide__1300x731,2025-05-20T16:27:58Z,,Unbekannte sind in einen Keller der Universität Hohenheim in Stuttgart eingebrochen und haben mehrere Ablassventile von Stahltanks mit Wein geöffnet. Sie hätten zwischen Freitagabend und Montagmorgen… [+313 chars],,de,'Wein'
https://www.morgenpost.de/ratgeber-wissen/article407746602/heizung-waermepumpe-heizoel-gas-zukunft.html,https://www.morgenpost.de/ratgeber-wissen/article407746602/heizung-waermepumpe-heizoel-gas-zukunft.html,0,www.morgenpost.de,Gas und Heizöl: Warum fossile Heizungen keine Zukunft haben,Die Themen Heizung und Energiewende werden auch die künftige Bundesregierung beschäftigen. Was für politische Schritte sind nötig?,https://img.sparknews.funkemedien.de/408107013/408107013_1737128487_v16_9_1600.jpeg,2025-05-20T17:25:00Z,,"Die Themen Heizung und Energiewende werden auch die künftige Bundesregierung beschäftigen. Was für politische Schritte sind nötig?
<ul><li>Die neue Wirtschaftsministerin möchte alte Gastherme weiter… [+5828 chars]",,de,'Heizung'
https://www.zeit.de/politik/ausland/2025-05/humanitaere-lage-gazastreifen-hilfslieferungen-hungersnot-israel,https://www.zeit.de/politik/ausland/2025-05/humanitaere-lage-gazastreifen-hilfslieferungen-hungersnot-israel,0,www.zeit.de,"Humanitäre Lage im Gazastreifen: Ein Fehler, moralisch und strategisch","Israel lässt wieder Hilfslieferungen nach Gaza, nach einem zweifelhaften System. Die Not wird das kaum lindern. Menschen aus der Region berichten von elendem Hunger.",https://img.zeit.de/politik/ausland/2025-05/humanitaere-lage-gazastreifen-hilfslieferungen-hungersnot-israel-bild-1/wide__1300x731,2025-05-20T18:44:48Z,http://archive.md/20250520184829/https://www.zeit.de/politik/ausland/2025-05/humanitaere-lage-gazastreifen-hilfslieferungen-hungersnot-israel,"Zwei Monate lang hat Israel keine Hilfsgüter in den Gazastreifen gelassen. Güter, die in der Region dringend gebraucht würden, um eine Hungerkatastrophe noch irgendwie abzuwenden. Seit einer Woche ha… [+703 chars]",,de,'Not'
https://www.zeit.de/news/2025-05/21/windiges-wetter-in-berlin-und-brandenburg-erwartet,https://www.zeit.de/news/2025-05/21/windiges-wetter-in-berlin-und-brandenburg-erwartet,0,www.zeit.de,Wetteraussichten: Windiges Wetter in Berlin und Brandenburg erwartet,Hier finden Sie Informationen zu dem Thema „Wetteraussichten“. Lesen Sie jetzt „Windiges Wetter in Berlin und Brandenburg erwartet“.,https://img.zeit.de/news/2025-05/21/windiges-wetter-in-berlin-und-brandenburg-erwartet-image-group/wide__1300x731,2025-05-21T04:03:15Z,https://web.archive.org/web/20250522050737/https://www.zeit.de/news/2025-05/21/windiges-wetter-in-berlin-und-brandenburg-erwartet,Auf einen etwas windigen Tag bei Sonnenschein und Wolken können sich die Menschen in Berlin und Brandenburg einstellen. Bei Temperaturen von bis zu 23 Grad bleibt es nach Angaben des Deutschen Wetter… [+757 chars],,de,'Wind'
https://www.dw.com/de/waldverlust-treiber-feuer-klimawandel-lateinamerika-am-st%C3%A4rksten-betroffen/a-72607368,https://www.dw.com/de/waldverlust-treiber-feuer-klimawandel-lateinamerika-am-st%C3%A4rksten-betroffen/a-72607368,0,www.dw.com,Wie viel Wald bleibt uns noch?,"Intensive und anhaltende Hitzewellen und extreme Dürre machen verheerende Waldbrände immer wahrscheinlicher. Neue Ansätze können helfen zu schützen, was noch übrig ist.",https://static.dw.com/image/70475951_6.jpg,2025-05-21T04:20:00Z,,"Mariana Oliveira nimmt kein Blatt vor den Mund, als sie beschreibt, wie Waldbrände ihr Land verwüstet haben. ""Letztes Jahr erlebte Brasilien die intensivste und längste Dürre seit sieben Jahrzehnten.… [+6409 chars]",,de,'Dürre'
https://www.n-tv.de/panorama/Australier-retten-sich-wegen-Uberflutungen-auf-ihre-Daecher-article25781978.html,https://www.n-tv.de/panorama/Australier-retten-sich-wegen-Uberflutungen-auf-ihre-Daecher-article25781978.html,0,www.n-tv.de,Starkregen in New South Wales: Australier retten sich wegen Überflutungen auf ihre Dächer,"Tausende Menschen sind nach starken Niederschlägen an der australischen Ostküste auf Hilfe angewiesen. Die unerwarteten Regenfälle sorgen für extreme Überschwemmungen, viele Menschen sind vom Wasser eingeschlossen. Die Lage soll sich nur weiter verschärfen.",https://www.n-tv.de/img/incoming/crop25782001/9031322559-cImg_16_9-w1200/526450031.jpg,2025-05-21T08:16:06Z,,"Tausende Menschen sind nach starken Niederschlägen an der australischen Ostküste auf Hilfe angewiesen. Die unerwarteten Regenfälle sorgen für extreme Überschwemmungen, viele Menschen sind vom Wasser … [+1927 chars]",,de,'Kälte'
https://www.stern.de/wirtschaft/news/energie--verbaende-verlangen-klarheit-zum-heizungsgesetz-35743526.html,https://www.stern.de/wirtschaft/news/energie--verbaende-verlangen-klarheit-zum-heizungsgesetz-35743526.html,0,www.stern.de,Energie: Verbände verlangen Klarheit zum Heizungsgesetz,Berlin - 14 Verbände aus der Energie- und Immobilienwirtschaft verlangen von der Bundesregierung rasch Klarheit zur Zukunft des sogenannten,https://image.stern.de/35743528/t/_l/v1/w1440/r1.7778/-/21--5gzt5lpo5uv5axs2048jpeg---81fc77b9f0c70386.jpg,2025-05-21T09:07:38Z,,"Kopiere den aktuellen Link
Zur Merkliste hinzufügen
Das Heizungsgesetz soll weg. Doch wie sieht der Nachfolger aus? Betroffene Branchen rufen nach Klärung.
14 Verbände aus der Energie- und Immobil… [+2197 chars]",,de,'Heizung'
https://www.tagesspiegel.de/wirtschaft/energie-verbande-verlangen-klarheit-zum-heizungsgesetz-13728637.html,https://www.tagesspiegel.de/wirtschaft/energie-verbande-verlangen-klarheit-zum-heizungsgesetz-13728637.html,0,www.tagesspiegel.de,Energie: Verbände verlangen Klarheit zum Heizungsgesetz,Das Heizungsgesetz soll weg. Doch wie sieht der Nachfolger aus? Betroffene Branchen rufen nach Klärung.,https://www.tagesspiegel.de/images/13728634/alternates/BASE_16_9_W1400/1747818522000/heizung.jpeg,2025-05-21T09:08:42Z,,14 Verbände aus der Energie- und Immobilienwirtschaft verlangen von der Bundesregierung rasch Klarheit zur Zukunft des sogenannten Heizungsgesetzes. Um eine erfolgreiche Wärmewende sicherzustellen un… [+2778 chars],,de,'Heizung'
https://www.der-postillon.com/2025/05/duerre-wolken.html,https://www.der-postillon.com/2025/05/duerre-wolken.html,0,www.der-postillon.com,Grund für Dürre gefunden: Dobrindt lässt Regenwolken an deutschen Außengrenzen abweisen,Berlin (dpo) - Seit Wochen hat es kaum mehr geregnet. Jetzt haben Meteorologen den Grund für die Dürre gefunden: Offenbar lässt Innenminister Alexander Dobrindt seit dem Regierungswechsel Regenwolken routinemäßig direkt an den deutschen Außengrenzen kontrolli…,https://blogger.googleusercontent.com/img/b/R29vZ2xl/AVvXsEgY76_G6gnYH_9X1yc40y1jGM2YME9ofGP7XJ52hXI7Io-fURgVaWtfsNyDX_4aT5hcuyEzPwXiLutxwDa87Fmnaj-bpyQ1gnOro1XKO5lTAMLZo3EhCHbtkByasmQjWftiUjJ0cp_qUUvr2YcqEAgRMnzxlf-4JMsbTV6u05N4ub8yiyQhA70hlo53Je0/w1600/Duerre-Regenwolken-Grenze.jpg,2025-05-21T11:02:57Z,http://archive.md/20250522173534/https://www.der-postillon.com/2025/05/duerre-wolken.html,Berlin (dpo) - Seit Wochen hat es kaum mehr geregnet. Jetzt haben Meteorologen den Grund für die Dürre gefunden: Offenbar lässt Innenminister Alexander Dobrindt seit dem Regierungswechsel Regenwolken… [+1406 chars],,de,'Dürre'
https://www.sueddeutsche.de/politik/heizungsgesetz-abschaffen-heizung-reiche-li.3256440,https://www.sueddeutsche.de/politik/heizungsgesetz-abschaffen-heizung-reiche-li.3256440,0,www.sueddeutsche.de,Heizungsgesetz: Viel Rauch im Kessel,Bundeswirtschaftsministerin Reiche will rasch die geltenden Betriebsverbote für alte Heizungen abschaffen. Das klingt nach einem beherzten Plan. Doch was bedeutet er wirklich für Hausbesitzer und Mieter?,https://www.sueddeutsche.de/2025/05/21/ade7bced-f75a-44c5-827b-34c1c006fb09.jpeg?q=60&fm=webp&width=1200&rect=0%2C0%2C3000%2C1687,2025-05-21T12:23:41Z,http://archive.md/20250521135048/https://www.sueddeutsche.de/politik/heizungsgesetz-abschaffen-heizung-reiche-li.3256440,Der Vorstoß ist Teil von Reiches Mission Heizungsgesetz abschaffen. So ist es im Koalitionsvertrag vereinbart; Union und SPD wollen sich so von dem umstrittenen Gesetzeswerk absetzen. Allerdings ist … [+3933 chars],,de,'Heizung'
https://www.n-tv.de/wirtschaft/Wirtschaftsministerium-sieht-hohe-Huerden-fuer-Industriestrompreis-article25783397.html,https://www.n-tv.de/wirtschaft/Wirtschaftsministerium-sieht-hohe-Huerden-fuer-Industriestrompreis-article25783397.html,0,www.n-tv.de,Schon die Ampel scheiterte daran: Wirtschaftsministerium sieht hohe Hürden für Industriestrompreis,"Seit Langem fordert die Energiebranche niedrigere Energiekosten. Die neue Regierung plant, einen Industriestrompreis einzuführen. Die Genehmigung des Konzepts wird jedoch durch verschiedene Faktoren erschwert.",https://www.n-tv.de/img/incoming/crop25783483/0671326857-cImg_16_9-w1200/443281345.jpg,2025-05-21T13:19:18Z,,"Seit Langem fordert die Energiebranche niedrigere Energiekosten. Die neue Regierung plant, einen Industriestrompreis einzuführen. Die Genehmigung des Konzepts wird jedoch durch verschiedene Faktoren … [+1500 chars]",,de,'Energiekosten'
https://www.sueddeutsche.de/wissen/cloud-seeding-wettermodifikation-wolken-impfung-silberiodid-rosenheim-li.3240831,https://www.sueddeutsche.de/wissen/cloud-seeding-wettermodifikation-wolken-impfung-silberiodid-rosenheim-li.3240831,0,www.sueddeutsche.de,"Wettermodifikation: Wie Regierungen versuchen, die Wolken zu impfen","Und so Regen, Sonne und Schnee auf Knopfdruck zu erzeugen. „Cloud Seeding“ wird zum globalen Geschäft – und zur Hoffnung in der Klimakrise. Doch wie gut lässt sich das Wetter wirklich steuern?",https://www.sueddeutsche.de/2025/05/21/17e6ba78-0905-45cc-8fdc-97323be2d50f.jpeg?q=60&fm=webp&width=1200&rect=0%2C209%2C4000%2C2250,2025-05-21T13:29:22Z,http://archive.md/20250521135504/https://www.sueddeutsche.de/wissen/cloud-seeding-wettermodifikation-wolken-impfung-silberiodid-rosenheim-li.3240831,"21. Mai 2025, 15:29 Uhr|Lesezeit: 5 Min.
|
Und so Regen, Sonne und Schnee auf Knopfdruck zu erzeugen. Cloud Seeding wird zum globalen Geschäft und zur Hoffnung in der Klimakrise. Doch wie gut lässt… [+824 chars]",,de,'Schnee'
https://www.faz.net/aktuell/wirtschaft/unternehmen/ausgerechnet-zukunftsbranchen-fehlen-die-fachkraefte-110490724.html,https://www.faz.net/aktuell/wirtschaft/unternehmen/ausgerechnet-zukunftsbranchen-fehlen-die-fachkraefte-110490724.html,0,www.faz.net,Firmen schließen: Ausgerechnet Zukunftsbranchen fehlen Fachkräfte,"Die steigende Zahl von Unternehmen, die ihren Geschäftsbetrieb einstellen, alarmiert. Nicht nur die hohen Energiekosten sind schuld. Es mangelt auch an Personal und Eigentümern, die Verantwortung übernehmen wollen.",https://media0.faz.net/ppmedia/aktuell/wirtschaft/2702743110/1.10490726/facebook_teaser/geschaeftsaufgabe-immer-mehr.jpg,2025-05-21T13:57:07Z,http://archive.md/20250521155707/https://www.faz.net/aktuell/wirtschaft/unternehmen/ausgerechnet-zukunftsbranchen-fehlen-die-fachkraefte-110490724.html,Steigende Kosten und der Mangel an Personal zwingen einer Studie zufolge immer mehr Firmen zur Aufgabe. Laut der Untersuchung durch die Bonitätsauskunft Creditreform und das Mannheimer Wirtschaftsfor… [+2596 chars],,de,'Energiekosten'
https://www.zeit.de/news/2025-05/21/trockenheit-agrarminister-stellt-bauern-hilfe-in-aussicht,https://www.zeit.de/news/2025-05/21/trockenheit-agrarminister-stellt-bauern-hilfe-in-aussicht,0,www.zeit.de,Dürre: Trockenheit: Agrarminister stellt Bauern Hilfe in Aussicht,Hier finden Sie Informationen zu dem Thema „Dürre“. Lesen Sie jetzt „Trockenheit: Agrarminister stellt Bauern Hilfe in Aussicht“.,https://img.zeit.de/news/2025-05/21/trockenheit-agrarminister-stellt-bauern-hilfe-in-aussicht-image-group/wide__1300x731,2025-05-21T14:49:44Z,,"Angesichts anhaltender Trockenheit in Mecklenburg-Vorpommern hat Agrarminister Till Backhaus (SPD) angekündigt, geeignete Hilfsmaßnahmen für Landwirte zu prüfen. Dazu sei die «AG Dürre» - mit Vertret… [+2121 chars]",,de,'Dürre'
https://www.stern.de/gesellschaft/regional/mecklenburg-vorpommern/duerre--trockenheit--agrarminister-stellt-bauern-hilfe-in-aussicht-35745312.html,https://www.stern.de/gesellschaft/regional/mecklenburg-vorpommern/duerre--trockenheit--agrarminister-stellt-bauern-hilfe-in-aussicht-35745312.html,0,www.stern.de,Dürre: Trockenheit: Agrarminister stellt Bauern Hilfe in Aussicht,Seit Monaten regnet es in Mecklenburg-Vorpommern zu wenig - die Trockenheit macht den Landwirten zu schaffen. Agrarminister Backhaus prüft nun Maßnahmen.,https://image.stern.de/35745314/t/tF/v1/w1440/r1.7778/-/21--ijeqwj4cv3v5axs2048jpeg---5a414dc10b65b394.jpg,2025-05-21T14:49:44Z,,"Kopiere den aktuellen Link
Zur Merkliste hinzufügen
Seit Monaten regnet es in Mecklenburg-Vorpommern zu wenig - die Trockenheit macht den Landwirten zu schaffen. Agrarminister Backhaus prüft nun Ma… [+2290 chars]",,de,'Dürre'
https://www.zeit.de/news/2025-05/21/segler-in-not-laut-polizei-gerettet,https://www.zeit.de/news/2025-05/21/segler-in-not-laut-polizei-gerettet,0,www.zeit.de,Freizeit: Segler in Not laut Polizei gerettet,Hier finden Sie Informationen zu dem Thema „Freizeit“. Lesen Sie jetzt „Segler in Not laut Polizei gerettet“.,https://img.zeit.de/news/2025-05/21/segler-in-not-laut-polizei-gerettet-image-group/wide__1300x731,2025-05-21T16:25:07Z,https://web.archive.org/web/20250522132000/https://www.zeit.de/news/2025-05/21/segler-in-not-laut-polizei-gerettet,"Ein in Hamburg in die Elbe gefallener Segler ist laut Polizei von einem Kleinboot gerettet worden. Die Jolle des Seglers sei gekentert, sagte der Polizeisprecher. Es werde nicht ausgeschlossen, dass … [+423 chars]",,de,'Not'
https://www.stern.de/news/forscher--zahnschmerzen-moeglicherweise-auf-500-millionen-jahre-alten-fisch-zurueckzufuehren-35745664.html,https://www.stern.de/news/forscher--zahnschmerzen-moeglicherweise-auf-500-millionen-jahre-alten-fisch-zurueckzufuehren-35745664.html,0,www.stern.de,Forscher: Zahnschmerzen möglicherweise auf 500 Millionen Jahre alten Fisch zurückzuführen,"Zähne dienen Menschen heute als Kauwerkzeug. Dass sie häufig empfindlich reagieren - etwa auf Kälte - oder sogar schmerzen, könnte möglicherweise daran liegen, dass sie evolutionär eine ganz andere Funktion hatten, wie eine am Mittwoch in der Fachzeitschrift …",https://image.stern.de/35745666/t/va/v1/w1440/r1.7778/-/21--zahnschmerzen-koennten-einer-studie-zufolge-unseren-aquatischen-vorfahren-beim-ueberleben-geholfen-haben---766990fdfeea7d0b.jpg,2025-05-21T17:50:07Z,https://web.archive.org/web/20250522055254/https://www.stern.de/news/forscher--zahnschmerzen-moeglicherweise-auf-500-millionen-jahre-alten-fisch-zurueckzufuehren-35745664.html,"Kopiere den aktuellen Link
Zur Merkliste hinzufügen
Zähne dienen Menschen heute als Kauwerkzeug. Dass sie häufig empfindlich reagieren - etwa auf Kälte - oder sogar schmerzen, könnte möglicherweise… [+1994 chars]",,de,'Kälte'
https://www.zeit.de/news/2025-05/22/erste-200-gaslaternen-in-duesseldorf-auf-led-umgestellt,https://www.zeit.de/news/2025-05/22/erste-200-gaslaternen-in-duesseldorf-auf-led-umgestellt,0,www.zeit.de,Strom statt Gas: Erste 200 Gaslaternen in Düsseldorf auf LED umgestellt,Hier finden Sie Informationen zu dem Thema „Strom statt Gas“. Lesen Sie jetzt „Erste 200 Gaslaternen in Düsseldorf auf LED umgestellt“.,https://img.zeit.de/news/2025-05/22/erste-200-gaslaternen-in-duesseldorf-auf-led-umgestellt-image-group/wide__1300x731,2025-05-22T01:41:36Z,,In Düsseldorf sind die ersten rund 200 historischen Gaslaternen auf strombetriebene LED-Technik umgerüstet worden. Diese Zahl nannte die Stadt anlässlich einer Präsentation der Arbeiten. Die Umrüstun… [+1048 chars],,de,'Gas'
https://www.faz.net/aktuell/politik/ausland/israel-laesst-weitere-hilfe-nach-gaza-verteilung-ungewiss-110491984.html,https://www.faz.net/aktuell/politik/ausland/israel-laesst-weitere-hilfe-nach-gaza-verteilung-ungewiss-110491984.html,0,www.faz.net,Die Nacht in Nahost: Noch immer kommt keine Hilfe bei den Menschen in Gaza an,"Hunderttausende Palästinenser leiden große Not. Es stehen Hilfsgüter bereit, die aber anscheinend bisher nicht ausgeliefert werden können. Netanjahu schmiedet derweil Pläne für die Zukunft Gazas. Der Überblick.",https://media1.faz.net/ppmedia/aktuell/2486596877/1.10492007/facebook_teaser/ein-palaestinensisches.jpg,2025-05-22T03:48:53Z,,"Während Hunderttausende notleidende Menschen im Gazastreifen weiter auf lebensrettende Hilfe warten, setzt Israel seine massiven Angriffe dort fort. Nach Ende der laufenden Großoffensive werde das ge… [+4305 chars]",,de,'Not'
https://www.tagesschau.de/ausland/israel-netanjahu-gaza-plaene-100.html,https://www.tagesschau.de/ausland/israel-netanjahu-gaza-plaene-100.html,0,www.tagesschau.de,"Netanjahu plant ""sterile Zone"" für Palästinenser im Gazastreifen","Angesichts der Not im Gazastreifen nimmt der Druck auf Israel zu. Premier Netanjahu hat nun einen dreiteiligen Plan zur Versorgung vorgestellt. So solle für Hunderttausende Bewohner eine ""sterile Zone"" in Südgaza entstehen.",https://images.tagesschau.de/image/77bbe1f0-c4a4-4919-84e7-6e34d8955108/AAABlvXvOms/AAABkZLhkrw/16x9-1280/netanjahu-226.jpg,2025-05-22T05:12:11Z,,"Stand: 22.05.2025 07:12 Uhr
Angesichts der Not im Gazastreifen nimmt der Druck auf Israel zu. Premier Netanjahu hat nun einen dreiteiligen Plan zur Versorgung vorgestellt. So solle für Hunderttausen… [+4596 chars]",,de,'Not'
https://gentleman-blog.de/10-tipps-kindersicherheit-im-strassenverkehr/,https://gentleman-blog.de/10-tipps-kindersicherheit-im-strassenverkehr/,0,gentleman-blog.de,Baby on Board: 10 Tipps für Kindersicherheit im Straßenverkehr,"Du hast Schlafmangel, trägst das dritte Mal in Folge ein T-Shirt mit Milchflecken und dein Auto riecht neuerdings nach Feuchttüchern und Babycreme? Willkommen im Club der frischgebackenen Väter. Zwischen Wickeltasche und Windelwechsel steht jetzt auch die Sic…",https://gentleman-blog.de/wp-content/uploads/father-putting-daughter-car-seat-1.jpg,2025-05-22T06:20:07Z,,"Du hast Schlafmangel, trägst das dritte Mal in Folge ein T-Shirt mit Milchflecken und dein Auto riecht neuerdings nach Feuchttüchern und Babycreme? Willkommen im Club der frischgebackenen Väter. Zwis… [+6020 chars]",,de,'Wind'
https://www.zeit.de/news/2025-05/22/regen-und-wind-statt-sonne,https://www.zeit.de/news/2025-05/22/regen-und-wind-statt-sonne,0,www.zeit.de,Wetter: Regen und Wind statt Sonne,Hier finden Sie Informationen zu dem Thema „Wetter“. Lesen Sie jetzt „Regen und Wind statt Sonne“.,https://img.zeit.de/news/2025-05/22/regen-und-wind-statt-sonne-image-group/wide__1300x731,2025-05-22T07:07:07Z,,"Viele Wolken, etwas Regen und teils kräftiger Wind erwartet die Menschen heute in Thüringen. Der Deutsche Wetterdienst rechnet mit maximal 13 bis 17 Grad. Im Bergland liegen die Temperaturen bei höch… [+992 chars]",,de,'Wind'
https://www.tagesspiegel.de/wissen/tendenz-zu-einem-sehr-heissen-sommer-was-wettermodelle-sagen-und-warum-die-trockenheit-riskant-bleibt-13725151.html,https://www.tagesspiegel.de/wissen/tendenz-zu-einem-sehr-heissen-sommer-was-wettermodelle-sagen-und-warum-die-trockenheit-riskant-bleibt-13725151.html,0,www.tagesspiegel.de,„Tendenz zu einem sehr heißen Sommer“: Was Wettermodelle sagen und warum die Trockenheit riskant bleibt,"Der Frühling war zu trocken, eventuell droht ein Hitzesommer. Klimaforscher Fred Hattermann erklärt, warum das Wasser knapp bleibt – und was das für Natur und Landwirtschaft bedeutet.",https://www.tagesspiegel.de/images/13522951/alternates/BASE_16_9_W1400/1744295263000/vertrocknete-sonnenblumen-vertrocknete-sonnenblumen-06-09-2024-borkwalde-brandenburg-auf-einem-feld-stehen-vertrockn.jpeg,2025-05-22T07:55:18Z,http://archive.md/20250523104803/https://www.tagesspiegel.de/wissen/tendenz-zu-einem-sehr-heissen-sommer-was-wettermodelle-sagen-und-warum-die-trockenheit-riskant-bleibt-13725151.html,"Herr Hattermann, Deutschland ist aktuell auf dem Weg zum trockensten Frühjahr seit Beginn der Wetteraufzeichnungen. Ist die Lage tatsächlich so dramatisch?Tatsächlich liegen wir zurzeit bei den Niede… [+7271 chars]",,de,'Landwirtschaft'
