index,url,valid,domain,title,description,image,published,archive,content,quote,language,keyword
https://www.stern.de/gesellschaft/regional/hamburg-schleswig-holstein/oepnv--fahrpreiserhoehungen-in-bahnen-und-bussen-gelten-ab-heute-35601416.html,https://www.stern.de/gesellschaft/regional/hamburg-schleswig-holstein/oepnv--fahrpreiserhoehungen-in-bahnen-und-bussen-gelten-ab-heute-35601416.html,0,www.stern.de,ÖPNV: Fahrpreiserhöhungen in Bahnen und Bussen gelten ab heute,"Wer im Norden Bus oder Bahn fahren will, muss tiefer in die Tasche greifen. Die Preise im Schleswig-Holstein-Tarif sind erhöht worden. Nicht betroffen ist das Deutschland-Ticket.",https://image.stern.de/35601418/t/tF/v1/w1440/r1.7778/-/01--bid4a5ynkkv6axs2048jpeg---e405035ef2f06457.jpg,2025-04-01T03:00:37Z,https://web.archive.org/web/20250401070230/https://www.stern.de/gesellschaft/regional/hamburg-schleswig-holstein/oepnv--fahrpreiserhoehungen-in-bahnen-und-bussen-gelten-ab-heute-35601416.html,"Kopiere den aktuellen Link
Zur Merkliste hinzufügen
Wer im Norden Bus oder Bahn fahren will, muss tiefer in die Tasche greifen. Die Preise im Schleswig-Holstein-Tarif sind erhöht worden. Nicht betr… [+1334 chars]",,de,'ÖPNV'
https://www.zeit.de/news/2025-04/01/fahrpreiserhoehungen-in-bahnen-und-bussen-gelten-ab-heute,https://www.zeit.de/news/2025-04/01/fahrpreiserhoehungen-in-bahnen-und-bussen-gelten-ab-heute,0,www.zeit.de,ÖPNV: Fahrpreiserhöhungen in Bahnen und Bussen gelten ab heute,Hier finden Sie Informationen zu dem Thema „ÖPNV“. Lesen Sie jetzt „Fahrpreiserhöhungen in Bahnen und Bussen gelten ab heute“.,https://img.zeit.de/news/2025-04/01/fahrpreiserhoehungen-in-bahnen-und-bussen-gelten-ab-heute-image-group/wide__1300x731,2025-04-01T03:00:37Z,https://web.archive.org/web/20250401080012/https://www.zeit.de/news/2025-04/01/fahrpreiserhoehungen-in-bahnen-und-bussen-gelten-ab-heute,Der öffentliche Nahverkehr im Norden ist seit heute teurer. Die Fahrkartenpreise im landesweit gültigen Schleswig-Holstein-Tarif stiegen nach Angaben der Nahverkehr Schleswig-Holstein GmbH (NSH) um d… [+1140 chars],,de,'ÖPNV'
https://www.focus.de/deals/50-prozent-guenstiger-als-uvp-spanischer-rose-im-sparpaket_e4791cc0-71c4-48f1-8976-144aefc5bca8.html,https://www.focus.de/deals/50-prozent-guenstiger-als-uvp-spanischer-rose-im-sparpaket_e4791cc0-71c4-48f1-8976-144aefc5bca8.html,0,www.focus.de,"Shopping-Deal mit FOCUS online - Spanische Rosé-Weine in Perfektion: Jetzt 6er-Paket für nur 29,99 Euro sichern","Lust auf spanischen Rosé-Genuss? Sichern Sie sich Ihr 6er-Probierpaket zum exklusiven Angebotspreis von nur 29,99 Euro und sparen ganze 50 Prozent auf die UVP (59,65 Euro). Lassen Sie sich von lebendigen Aromen verzaubern und holen sich die spanische Sonne in…",https://quadro.burda-forward.de/ctf/d5d391e5-217e-4e98-b992-9a2acda5ac0a.08de9f4d-f712-4a88-939f-433d5ff6b01f.png?im=RegionOfInterestCrop%3D%281200%2C630%29%2CregionOfInterest%3D%28784%2C307%29&hash=0fadab9ed27943a8d8d6ed7fc7b6d28f3f56e90d70029757f0b4a6a6163894da,2025-04-01T06:51:00Z,,"Rosé Olé! Mit spanischer Lebensfreude in den Frühling starten
Wenn der Frühling beginnt, die Luft milder wird und das Leben sich wieder mehr nach draußen verlagert, ist die Zeit für Rosé gekommen. K… [+6310 chars]",,de,'Wein'
https://www.focus.de/panorama/welt/koelner-energie-riese-blockiert-ausflugsziel-fuer-rohre-familie-sauer-zumutung_6c3a4265-ccd5-4bf0-8548-fcbd32289288.html,https://www.focus.de/panorama/welt/koelner-energie-riese-blockiert-ausflugsziel-fuer-rohre-familie-sauer-zumutung_6c3a4265-ccd5-4bf0-8548-fcbd32289288.html,0,www.focus.de,"Ärger in der Südstadt - Kölner Energie-Riese blockiert Ausflugsziel für Rohre, Familie sauer: „Zumutung“",Am Forstbotanischen Garten in Köln herrscht Parkplatz-Not. Der Grund könnte nicht besser zu Köln passen.,https://quadro.burda-forward.de/ctf/d368d4ab-c42f-4390-91ef-11ad729f11e9.021e1371-c80f-401f-8336-6ad41b94b1f6.jpeg?im=RegionOfInterestCrop%3D%281200%2C630%29%2CregionOfInterest%3D%281349%2C737%29&hash=a7b3033f91774f85850667f703a95ae9f75e5e89b5b0b19f9565751c3db27e2b,2025-04-01T17:09:00Z,,"Der großzügige, wertvolle Forstbotanische Garten in Köln mit seinem Friedenspark und dem Waldkindergarten ist besonders bei Sonnenschein wie in den kommenden Tagen eines der beliebtesten Ausflugsziel… [+1698 chars]",,de,'Not'
https://www.zeit.de/news/2025-04/01/giftiges-gas-steigt-von-granate-auf-neun-menschen-in-klinik,https://www.zeit.de/news/2025-04/01/giftiges-gas-steigt-von-granate-auf-neun-menschen-in-klinik,0,www.zeit.de,Edewecht (Kreis Ammerland): Giftiges Gas steigt von Granate auf: Neun Menschen in Klinik,Hier finden Sie Informationen zu dem Thema „Edewecht (Kreis Ammerland)“. Lesen Sie jetzt „Giftiges Gas steigt von Granate auf: Neun Menschen in Klinik“.,https://img.zeit.de/news/2025-04/01/giftiges-gas-steigt-von-granate-auf-neun-menschen-in-klinik-image-group/wide__1300x731,2025-04-01T21:19:34Z,,Neun Menschen sind wegen einer rauchenden Phosphorgranate in ein Krankenhaus gebracht worden - darunter drei Kinder. Passanten hatten am Dienstag Rauch von einer Wiese in Edewecht (Kreis Ammerland) a… [+1186 chars],,de,'Gas'
https://www.focus.de/wetter/sommerwetter-in-deutschland-am-donnerstag-sind-hier-bis-zu-23-grad-drin_a9c06b4a-b8d2-4e7a-9ddb-dd327b8cc3ec.html,https://www.focus.de/wetter/sommerwetter-in-deutschland-am-donnerstag-sind-hier-bis-zu-23-grad-drin_a9c06b4a-b8d2-4e7a-9ddb-dd327b8cc3ec.html,0,www.focus.de,"Erst warm, dann kalt - Sommerwetter in Deutschland: am Donnerstag sind hier bis zu 24 Grad drin",Hoch Naomi bringt Wärme. Das Wetter in Deutschland könnte am Freitag fast sommerliche Temperaturen erreichen. Ein Kälteeinbruch am Wochenende ist jedoch vorhergesagt.Von FOCUS-online-Autor Matthias Kernstock (München),https://quadro.burda-forward.de/ctf/232cddbe-bbb3-48a1-a9f8-ca4e53a415a0.38c3cc9f-cc4a-4c34-a4af-919870b11a16.jpg?im=RegionOfInterestCrop%3D%281200%2C630%29%2CregionOfInterest%3D%28963%2C353%29&hash=f8ab831d1f0b14ba17d7e95c0abb8443dcab42f658198904deadc6d3a42793e7,2025-04-02T05:10:00Z,,Jetzt kommt Sommerwetter nach Deutschland. Ein neues Hochdruckgebiet namens Naomi breitet sich von Westen her aus und könnte insbesondere am Freitag die Temperaturen in Deutschland in die Nähe der 25… [+2232 chars],,de,'Schnee'
https://www.stern.de/gesellschaft/regional/mecklenburg-vorpommern/bauerntag--landwirte-fordern-kurswechsel-in-der-agrarpolitik-35605688.html,https://www.stern.de/gesellschaft/regional/mecklenburg-vorpommern/bauerntag--landwirte-fordern-kurswechsel-in-der-agrarpolitik-35605688.html,0,www.stern.de,Bauerntag: Landwirte fordern Kurswechsel in der Agrarpolitik,Mecklenburg-Vorpommerns Bauern diskutieren beim Bauerntag über die zukünftige Agrarpolitik. Von der künftigen Regierung erwarten sie verlässliche Rahmenbedingungen in der Landwirtschaft.,https://image.stern.de/35605690/t/kC/v1/w1440/r1.7778/-/02--6j5uac5qxdv4axs2048jpeg---fc606162795ccee6.jpg,2025-04-02T09:23:31Z,,"Kopiere den aktuellen Link
Zur Merkliste hinzufügen
Mecklenburg-Vorpommerns Bauern diskutieren beim Bauerntag über die zukünftige Agrarpolitik. Von der künftigen Regierung erwarten sie verlässliche… [+1597 chars]",,de,'Landwirtschaft'
https://www.focus.de/earth/gas-und-kohle-helfen-aus-der-schlappe-maerz-zeigt-was-deutschlands-energiewende-noch-fehlt_20b5b318-d9cb-43db-adf7-8f6208420fff.html,https://www.focus.de/earth/gas-und-kohle-helfen-aus-der-schlappe-maerz-zeigt-was-deutschlands-energiewende-noch-fehlt_20b5b318-d9cb-43db-adf7-8f6208420fff.html,0,www.focus.de,Gas und Kohle helfen aus - Schlapper März: Deutschlands Energiewende hat ein großes Wind-Problem,Der große Flauten-Monat: Zum Jahresbeginn ist Deutschlands Ausbeute aus der Windkraft schwach wie selten. Kohle und Gas springen in die Bresche – und treiben die Preise. Wann wird die Bundesrepublik wirklich unabhängig von fossilen Energien?Von FOCUS-online-R…,https://quadro.burda-forward.de/ctf/8f418476-50c2-47d6-92ac-3cb1b7fea703.c57a570b-1e05-429a-b451-e0b7b5f7f51a.jpg?im=RegionOfInterestCrop%3D%281200%2C630%29%2CregionOfInterest%3D%28991%2C660%29&hash=390ec292ad5c96ef605dda22ce48a4f7c5661831b62d691b5080bc8bcac7bead,2025-04-02T11:45:00Z,,"Über die Windkraft in Deutschland lassen sich derzeit zwei Geschichten erzählen, und die eine geht so: Der Drang auf Windenergieanlagen ist so groß wie nie zuvor, Investoren stehen Schlange, der Ausb… [+4165 chars]",,de,'Gas'
https://www.zeit.de/news/2025-04/02/mehrere-verletzte-nach-verspruehen-von-gas-an-schule,https://www.zeit.de/news/2025-04/02/mehrere-verletzte-nach-verspruehen-von-gas-an-schule,0,www.zeit.de,Lauenburg: Mehrere Verletzte nach Versprühen von Gas an Schule,Hier finden Sie Informationen zu dem Thema „Lauenburg“. Lesen Sie jetzt „Mehrere Verletzte nach Versprühen von Gas an Schule“.,https://img.zeit.de/news/2025-04/02/mehrere-verletzte-nach-verspruehen-von-gas-an-schule-image-group/wide__1300x731,2025-04-02T12:54:10Z,,"Mehrere Schülerinnen und Schüler einer Gemeinschaftsschule in Lauenburg sind am Mittag durch ein Gas leicht verletzt worden. Ersten Ermittlungen zufolge besteht der Verdacht, dass Reizgas versprüht w… [+438 chars]",,de,'Gas'
https://www.stern.de/gesellschaft/regional/mecklenburg-vorpommern/bauerntag-mv--bauern-appellieren-an-politik---hoechste-zeit-zum-handeln--35606814.html,https://www.stern.de/gesellschaft/regional/mecklenburg-vorpommern/bauerntag-mv--bauern-appellieren-an-politik---hoechste-zeit-zum-handeln--35606814.html,0,www.stern.de,"Bauerntag MV: Bauern appellieren an Politik: ""Höchste Zeit zum Handeln""",Mecklenburg-Vorpommerns Landwirte stellen beim Bauerntag Forderungen an die künftige Bundesregierung. Landwirtschaftsminister Backhaus kündigt schnelle Lösungen an.,https://image.stern.de/35606816/t/yR/v1/w1440/r1.7778/-/02--mnxcwltwbov5axs2048jpeg---012a43ec90549d38.jpg,2025-04-02T13:04:17Z,,"Kopiere den aktuellen Link
Zur Merkliste hinzufügen
Mecklenburg-Vorpommerns Landwirte stellen beim Bauerntag Forderungen an die künftige Bundesregierung. Landwirtschaftsminister Backhaus kündigt sc… [+3034 chars]",,de,'Landwirtschaft'
https://www.welt.de/regionales/hamburg/article255853996/Bilanz-Ein-Jahr-Alkoholverbot-am-Hamburger-Hauptbahnhof-75-Bussgeldverfahren.html,https://www.welt.de/regionales/hamburg/article255853996/Bilanz-Ein-Jahr-Alkoholverbot-am-Hamburger-Hauptbahnhof-75-Bussgeldverfahren.html,0,www.welt.de,Ein Jahr Alkoholverbot am Hamburger Hauptbahnhof – 75 Bußgeldverfahren,"Seit einem Jahr gilt am Hamburger Hauptbahnhof ein Alkoholverbot. Wer trotzdem Bier oder Wein trinkt, riskiert ein Bußgeld. In zahlreichen Fällen hat die Polizei bereits durchgegriffen.",https://img.welt.de/img/regionales/hamburg/mobile255853994/5897935147-ci16x9-w1200/Alkoholkonsum-am-Hamburger-Hauptbahnhof-verboten.jpg,2025-04-03T07:05:30Z,,"Seit einem Jahr gilt am Hamburger Hauptbahnhof ein Alkoholverbot. Wer trotzdem Bier oder Wein trinkt, riskiert ein Bußgeld. In zahlreichen Fällen hat die Polizei bereits durchgegriffen.Seit Einführun… [+2522 chars]",,de,'Wein'
https://www.zeit.de/news/2025-04/03/thueringer-bauherren-entscheiden-sich-zumeist-fuer-waermepumpen,https://www.zeit.de/news/2025-04/03/thueringer-bauherren-entscheiden-sich-zumeist-fuer-waermepumpen,0,www.zeit.de,Heizung: Thüringer Bauherren entscheiden sich zumeist für Wärmepumpen,Hier finden Sie Informationen zu dem Thema „Heizung“. Lesen Sie jetzt „Thüringer Bauherren entscheiden sich zumeist für Wärmepumpen“.,https://img.zeit.de/news/2025-04/03/thueringer-bauherren-entscheiden-sich-zumeist-fuer-waermepumpen-image-group/wide__1300x731,2025-04-03T09:23:36Z,,"Der Großteil der neu gebauten Wohnungen in Thüringen wird primär mit regenerativen Energien beheizt. Von den im vergangenen Jahr 678 neu geplanten Wohngebäuden werden 87,3 Prozent mit Wärmepumpen, So… [+1117 chars]",,de,'Gas'
https://www.morgenpost.de/bezirke/mitte/article408706073/obdachlosigkeit-in-berlin-mitte-verbaende-sehen-wachsende-not.html,https://www.morgenpost.de/bezirke/mitte/article408706073/obdachlosigkeit-in-berlin-mitte-verbaende-sehen-wachsende-not.html,0,www.morgenpost.de,Obdachlosigkeit in Berlin-Mitte: Verbände sehen wachsende Not,"Immer mehr Obdachlose sind in Berlin anzutreffen, vor allem im Bezirk Mitte. Wo sie sich aufhalten, was die Wohlfahrtsverbände sagen.",https://img.sparknews.funkemedien.de/408706157/408706157_1743708501_v16_9_1600.jpeg,2025-04-03T19:28:14Z,,"Berlin. Immer mehr Obdachlose sind in Berlin anzutreffen, vor allem im Bezirk Mitte. Wo sie sich aufhalten, was die Wohlfahrtsverbände sagen.
Seit 15 Jahren ist der DRK-Wärmebus ein fester Bestandte… [+3157 chars]",,de,'Wärmebus'
https://www.zeit.de/news/2025-04/04/fuss-vom-gas-verstaerkte-kontrollen-in-der-kommenden-woche,https://www.zeit.de/news/2025-04/04/fuss-vom-gas-verstaerkte-kontrollen-in-der-kommenden-woche,0,www.zeit.de,Verkehr: Fuß vom Gas: Verstärkte Kontrollen in der kommenden Woche,Hier finden Sie Informationen zu dem Thema „Verkehr“. Lesen Sie jetzt „Fuß vom Gas: Verstärkte Kontrollen in der kommenden Woche“.,https://img.zeit.de/news/2025-04/04/fuss-vom-gas-verstaerkte-kontrollen-in-der-kommenden-woche-image-group/wide__1300x731,2025-04-04T03:00:44Z,,"Autofahrerinnen und Autofahrer aufgepasst: In der kommenden Woche finden auch in Rheinland-Pfalz verstärkte Polizeikontrollen statt. Das Bundesland beteilige sich am sogenannten Speedmarathon, sagte … [+3059 chars]",,de,'Gas'
