index,url,valid,domain,title,description,image,published,archive,content,quote,language,keyword
https://www.stern.de/wirtschaft/news/gastgewerbe--steuererhoehung--pleitesorgen-in-britischer-getraenkebranche-33699306.html,https://www.stern.de/wirtschaft/news/gastgewerbe--steuererhoehung--pleitesorgen-in-britischer-getraenkebranche-33699306.html,0,www.stern.de,Gastgewerbe: Steuererhöhung: Pleitesorgen in britischer Getränkebranche,"Unter der Steuererhöhung leiden besonders kleinere und mittlere Betriebe der Branche. WSTA-Chef Miles Beale kündigt eine ""schwierige Zeit für Wein- und Spirituosenunternehmen"" in Großbritannien an.",https://image.stern.de/33699308/t/qU/v1/w1440/r1.7778/-/01--urnnewsmldpacom2009010123080199636560v2w800h600l847t933r2548b2002jpeg---a8de7e83be8dd089.jpg,2023-08-01T03:30:09Z,,"Unter der Steuererhöhung leiden besonders kleinere und mittlere Betriebe der Branche. WSTA-Chef Miles Beale kündigt eine ""schwierige Zeit für Wein- und Spirituosenunternehmen"" in Großbritannien an.
… [+2383 chars]",,de,'Gas'
https://www.stern.de/gesellschaft/regional/hamburg-schleswig-holstein/gastgewerbe--ssw-und-fdp--niedrige-gastronomie-mehrwertsteuer-beibehalten-33699494.html,https://www.stern.de/gesellschaft/regional/hamburg-schleswig-holstein/gastgewerbe--ssw-und-fdp--niedrige-gastronomie-mehrwertsteuer-beibehalten-33699494.html,0,www.stern.de,Gastgewerbe: SSW und FDP: Niedrige Gastronomie-Mehrwertsteuer beibehalten,Zwei Oppositionsfraktionen im Schulterschluss: SSW und FDP wollen die ermäßigte Umsatzsteuer auf Speisen in Gaststätten beibehalten. Dafür soll sich die Regierung stark machen - um den Betrieben mehr Luft zu verschaffen.,https://image.stern.de/33699496/t/RF/v1/w1440/r1.7778/-/01--urnnewsmldpacom2009010123080199637156v3w800h600l640t457r1920b1372jpeg---605df56eaa953f4e.jpg,2023-08-01T04:32:36Z,,Zwei Oppositionsfraktionen im Schulterschluss: SSW und FDP wollen die ermäßigte Umsatzsteuer auf Speisen in Gaststätten beibehalten. Dafür soll sich die Regierung stark machen - um den Betrieben mehr… [+1170 chars],,de,'Gas'
https://www.morgenpost.de/politik/article238686873/gasheizung-h2-ready-heizung-energieberater-kosten.html,https://www.morgenpost.de/politik/article238686873/gasheizung-h2-ready-heizung-energieberater-kosten.html,0,www.morgenpost.de,Heizungsgesetz entschärft: Für diese Heizung trifft Experte ein vernichtendes Urteil,Die Ampel-Koalition hat das Heizungsgesetz entschärft. Der Einbau einer Gasheizung ist weiter möglich – doch unter welchen Bedingungen?,https://img.morgenpost.de/img/frontpage/crop238727511/3862604295-w820-cv16_9-q85/5FAD9C00317C6524.jpg,2023-08-01T08:52:00Z,,Berlin. <ul><li>Die vergangenen Monate waren für viele Hausbesitzer sicher keine leichten: Dass lag vor allem an den Konflikten in der Debatte um das neue Heizungsgesetz </li><li>Die Novelle wird ers… [+13244 chars],,de,'Gas'
https://www.morgenpost.de/ratgeber/article238804575/gasheizung-heizungsgesetz-aenderungen-2024.html,https://www.morgenpost.de/ratgeber/article238804575/gasheizung-heizungsgesetz-aenderungen-2024.html,0,www.morgenpost.de,Förderung und Co.: Was sich ab 2024 bei der Gasheizung alles ändern wird,Laut Heizungsgesetz soll auch die Gasheizung ab 2024 weiter eingebaut werden – doch es gelten Voraussetzungen. Hier lesen Sie mehr.,https://img.morgenpost.de/img/frontpage/crop238235527/1692604027-w820-cv16_9-q85/H2-Gasheizung.jpg,2023-08-01T08:58:00Z,,"Berlin. <ul><li>Wer noch eine Gasheizung hat, musste in den vergangenen Monaten darauf hoffen, dass nicht ihr Ende besiegelt werden würde</li><li>Letztlich wurde das Heizungsgesetz entschärft, Gashei… [+9126 chars]",,de,'Heizung'
https://www.tagesschau.de/wirtschaft/unternehmen/foerderung-gaskraftwerke-100.html,https://www.tagesschau.de/wirtschaft/unternehmen/foerderung-gaskraftwerke-100.html,0,www.tagesschau.de,Bund und Brüssel einig über Förder-Leitplanken für Gaskraftwerke,Bundesregierung und EU-Kommissionen haben sich auf einen Förderrahmen für neue Gaskraftwerke verständigt. Monatelange rang man um Eckwerte für die geplante finanzielle Förderung.,https://images.tagesschau.de/image/ca3f2233-4601-4a70-bc89-f4e767d5eb62/AAABh3ns82g/AAABg8tME_8/16x9-1280/gaskraftwerk-111.jpg,2023-08-01T09:27:46Z,https://web.archive.org/web/20230801095439/https://www.tagesschau.de/wirtschaft/unternehmen/foerderung-gaskraftwerke-100.html,"Stand: 01.08.2023 11:27 Uhr
Bundesregierung und EU-Kommissionen haben sich auf einen Förderrahmen für neue Gaskraftwerke verständigt. Monatelange rang man um Eckwerte für die geplante finanzielle Fö… [+1826 chars]",,de,'Gas'
https://www.stern.de/wirtschaft/news/energie--habeck---politischer-durchbruch--fuer-neue-kraftwerke-33700682.html,https://www.stern.de/wirtschaft/news/energie--habeck---politischer-durchbruch--fuer-neue-kraftwerke-33700682.html,0,www.stern.de,"Energie: Habeck: ""Politischer Durchbruch"" für neue Kraftwerke","Was passiert im Energiesystem der Zukunft bei ""Dunkelflauten"", wenn kaum Wind weht und keine Sonne scheint? Dann sollen neue Kraftwerke einspringen. Der Wirtschaftsminister sieht dafür nun einen Durchbruch.",https://image.stern.de/33700684/t/iS/v1/w1440/r1.7778/-/01--urnnewsmldpacom2009010123080199641917v2w800h600l467t371r1744b1688jpeg---70cd8170ff9554c6.jpg,2023-08-01T09:55:43Z,,"Was passiert im Energiesystem der Zukunft bei ""Dunkelflauten"", wenn kaum Wind weht und keine Sonne scheint? Dann sollen neue Kraftwerke einspringen. Der Wirtschaftsminister sieht dafür nun einen Durc… [+2484 chars]",,de,'Wind'
https://www.morgenpost.de/wirtschaft/article238925393/heizung-kaufen-mieten-waermepumpe-vorteile-nachteile.html,https://www.morgenpost.de/wirtschaft/article238925393/heizung-kaufen-mieten-waermepumpe-vorteile-nachteile.html,0,www.morgenpost.de,Wärmempumpe: Heizung mieten statt kaufen: Das sind die Vor- und Nachteile,Die Kosten für eine neue Heizung sind hoch – doch es gibt eine Alternative zum Kauf. Energie-Experten schildern die Vor- und Nachteile beim Mieten.,https://img.morgenpost.de/img/wirtschaft/crop238925391/1792608133-w820-cv16_9-q85/77f63f20-1fff-11ee-a53e-ed9500bb0d2e.jpg,2023-08-01T10:19:00Z,,"Berlin. <ul><li>Eine neue Heizung kann für Hausbesitzer ordentlich ins Geld gehen: Wärmepumpen sind derzeit noch vergleichsweise teuer in der Anschaffung, amortisieren sich aber in relativ kurzer Zei… [+6937 chars]",,de,'Heizung'
https://www.morgenpost.de/ratgeber/article237566323/heizung-oelheizung-gasheizung-austauschpflicht-ausnahmen.html,https://www.morgenpost.de/ratgeber/article237566323/heizung-oelheizung-gasheizung-austauschpflicht-ausnahmen.html,0,www.morgenpost.de,Gas- und Ölheizung: Heizung: Diese Ausnahmen gibt es von der Austauschpflicht,Die alte Heizung ist womöglich schon ab 2023 von der Austauschpflicht betroffen. Doch manche Verbraucher profitieren von Ausnahmen  – ein Überblick.,https://img.morgenpost.de/img/incoming/crop238366301/4542601863-w820-cv16_9-q85/Eine-alte-OElheizung-steht-auf-der-Strasse.jpg,2023-08-01T10:53:00Z,,"Berlin. <ul><li>Wenn Öl- und Gasheizungen ein bestimmtes Alter erreicht haben, müssen sie ausgetauscht werden</li><li>Allerdings gibt es Ausnahmen für diese sogenannte Austauschpflicht für Heizungen … [+5462 chars]",,de,'Heizung'
https://www.tagesschau.de/wirtschaft/unternehmen/uniper-strategie-klimaneutral-100.html,https://www.tagesschau.de/wirtschaft/unternehmen/uniper-strategie-klimaneutral-100.html,0,www.tagesschau.de,Gasimporteur Uniper will Geschäftsmodell neu ausrichten,"Vor gut einem Jahr stand das Energieunternehmen Uniper am Abgrund, der Bund musste es mit Milliardenhilfen retten. Heute geht es dem Konzern deutlich besser - und er will mittelfristig weg vom Geschäft mit Gas und Kohle. Von Volker Hirth.",https://images.tagesschau.de/image/42c37788-dad5-43f2-825e-be798d061b27/AAABibC4KBc/AAABibBxqrQ/16x9-1280/uniper-157.jpg,2023-08-01T11:03:38Z,http://archive.md/20230801190926/https://www.tagesschau.de/wirtschaft/unternehmen/uniper-strategie-klimaneutral-100.html,"Stand: 01.08.2023 13:03 Uhr
Vor gut einem Jahr stand das Energieunternehmen Uniper am Abgrund, der Bund musste es mit Milliardenhilfen retten. Heute geht es dem Konzern deutlich besser - und er will… [+2853 chars]",,de,'Gas'
https://www.handelsblatt.com/finanzen/immobilien/bafa-kfw-beg-wie-sie-mit-passender-foerderung-energetisch-sanieren/28866662.html,https://www.handelsblatt.com/finanzen/immobilien/bafa-kfw-beg-wie-sie-mit-passender-foerderung-energetisch-sanieren/28866662.html,0,www.handelsblatt.com,"Bafa-, KfW- und BEG-Förderung: So sanieren Sie Ihr Haus energetisch richtig","Wegen der gestiegenen Energiekosten wollen viele Eigentümer ihr Zuhause energetisch sanieren. Ein Überblick, welche Maßnahmen gefördert werden.",https://www.handelsblatt.com/images/energetische-sanierung/28869402/3-format2003.jpg,2023-08-01T11:18:50Z,,"Energetische SanierungNur etwa fünf bis zehn Prozent der hiesigen Wohngebäude entsprechen den gesetzlichen Mindeststandards für Energieeffizienz.
(Foto: dpa)
MünchenDeutschland steht vor einer giga… [+1323 chars]",,de,'Energiekosten'
https://www.der-postillon.com/2023/08/uran.html,https://www.der-postillon.com/2023/08/uran.html,0,www.der-postillon.com,Putsch in Bawongola: Fällt jetzt Deutschlands wichtigster Lieferant für Wind und Sonne weg?,Elnay (dpo) - Große Sorgen um Deutschlands Energiesicherheit: Nach einem Militärputsch in Bawongola rechnen Experten mit einem Wegbrechen der wichtigen Sonnen- und Windimporte aus dem ostwestafrikanischen Land. Deutschland bezog im Jahr 2022 rund 80% seines W…,https://blogger.googleusercontent.com/img/b/R29vZ2xl/AVvXsEhI2hrKnr5KgOo0WoiDT-qbg_UMvhH0TWU10rxR5wy7vI-SdY9f7_1tMK9C8kvXJ2uhRAWt1_zyStiN7XKEHGiYdAFVFUYSZ_m2oNNUDW8CApGWFXkKYrcWFoK5OOAplupTA5F2CZE6bXhGvP06pVgdtM6CSsoLEyDtR6XNDX3GNjm-EoX1R0Ufu4j4M6g/w1600/Bawongola.jpg,2023-08-01T12:53:04Z,http://archive.md/20230802125926/https://www.der-postillon.com/2023/08/uran.html,Elnay (dpo) - Große Sorgen um Deutschlands Energiesicherheit: Nach einem Militärputsch in Bawongola rechnen Experten mit einem Wegbrechen der wichtigen Sonnen- und Windimporte aus dem ostwestafrikani… [+1525 chars],,de,'Wind'
https://www.wiwo.de/unternehmen/industrie/covestro-chef-die-frage-ist-doch-wofuer-das-geld-ausgegeben-wird-/29290750.html,https://www.wiwo.de/unternehmen/industrie/covestro-chef-die-frage-ist-doch-wofuer-das-geld-ausgegeben-wird-/29290750.html,0,www.wiwo.de,"Covestro-Chef: „Die Frage ist doch, wofür das Geld ausgegeben wird“","Covestro-CEO Markus Steilemann drängt die Ampelkoalition zu mehr Unterstützung. Er erklärt, warum er trotz allem noch Hoffnung für die deutsche Chemieindustrie hat – und warnt vor einer neuen Abhängigkeit bei Öl und Gas.",https://www.wiwo.de/images/covestro-corrosion-protection/29290930/2-format11240.jpg,2023-08-01T13:56:37Z,https://web.archive.org/web/20230801145205/https://www.wiwo.de/unternehmen/industrie/covestro-chef-die-frage-ist-doch-wofuer-das-geld-ausgegeben-wird-/29290750.html,"WirtschaftsWoche: Herr Steilemann, die deutsche Wirtschaft lahmt, die Chemieindustrie in Deutschland geht den Bach runter. Sie haben die Risiken selbst beschrieben: hohe Energiekosten und Steuern, sc… [+6500 chars]",,de,'Gas'
https://www.diepresse.com/13494529/von-reben-und-aromen,https://www.diepresse.com/13494529/von-reben-und-aromen,0,www.diepresse.com,Von Reben und Aromen,"Der „Presse“-Club lud erstmals Winzerbetriebe aus Niederösterreich ein, eine Auswahl ihrer Weine im exklusiven Rahmen der neuen Studio-Räumlichkeiten der „Presse“ zu präsentieren.",https://img.diepresse.com/public/incoming/mir4fm-Weingenuss-Sujet.jpg/alternates/DPR_SOCIAL_NACHRICHTEN/Weingenuss%20Sujet.jpg,2023-08-01T16:09:15Z,,"Der Presse-Club lud erstmals Winzerbetriebe aus Niederösterreich ein, eine Auswahl ihrer Weine im exklusiven Rahmen der neuen Studio-Räumlichkeiten der Presse zu präsentieren.
Seit mehreren Jahren p… [+2860 chars]",,de,'Wein'
https://www.faz.net/aktuell/wirtschaft/kommentar-zur-wirtschaftspolitik-der-ampel-deutschland-braucht-reformen-19073984.html,https://www.faz.net/aktuell/wirtschaft/kommentar-zur-wirtschaftspolitik-der-ampel-deutschland-braucht-reformen-19073984.html,0,www.faz.net,Schlechte Konjunkturlage: Deutschland braucht schnell Reformen,"Ob Heizungsgesetz oder Viertagewoche – die Debatten der vergangenen Monate waren die eines Landes, das glaubt, sich alles leisten zu können. Nicht nur deshalb braucht es jetzt den Mut, eine große Wirtschaftsreform zu wagen.",https://media0.faz.net/ppmedia/aktuell/wirtschaft/2991128861/1.9074454/facebook_teaser/baustelle-in-hannover-der.jpg,2023-08-01T19:01:46Z,,"Der kranke Mann Europas ist wieder da. In Deutschland wird weniger investiert, produziert und konsumiert. Nahezu täglich fügen sich neue Zahlen wie Mosaiksteine in dieses triste Bild. Das Bruttoinlan… [+4450 chars]",,de,'Heizung'
https://www.nzz.ch/schweiz/showdown-an-der-schneegrenze-ein-dorf-kaempft-fuer-seine-skilifte-ld.1749736,https://www.nzz.ch/schweiz/showdown-an-der-schneegrenze-ein-dorf-kaempft-fuer-seine-skilifte-ld.1749736,0,www.nzz.ch,Showdown an der Schneegrenze – ein Dorf kämpft für seine Skilifte,"Auf Sattel-Hochstuckli spielt sich ein Kampf ab, der angesichts des Schneemangels anderen Skigebieten noch bevorsteht.","https://img.nzz.ch/2023/08/03/2d0113a9-7c6b-4217-8d6f-86f4700f9b43.jpeg?width=1200&height=675&fit=bound&quality=75&auto=webp&crop=4944,2781,x0,y927&wmark=nzz",2023-08-02T07:43:53Z,,"Grossandrang zur Generalversammlung der Bergbahn Sattel-Hochstuckli.
Skigebiete sterben normalerweise still. Nicht so auf Sattel-Hochstuckli im Kanton Schwyz. In dem kleinen Wintersportort sollen di… [+7786 chars]",,de,'Schnee'
https://www.focus.de/klima/analyse/hilfe-gegen-dunkelflauten-der-wichtige-durchbruch-fuer-die-deutsche-energiewende_id_200710354.html,https://www.focus.de/klima/analyse/hilfe-gegen-dunkelflauten-der-wichtige-durchbruch-fuer-die-deutsche-energiewende_id_200710354.html,0,www.focus.de,Hilfe gegen „Dunkelflauten“ - Der wichtige Durchbruch für die deutsche Energiewende,"Kein Wind weht, keine Sonne scheint: Was passiert im Energiesystem der Zukunft bei sogenannten „Dunkelflauten“? Dann sollen neue Kraftwerke einspringen. Auf EU-Ebene ist der Bundesregierung jetzt ein kleiner Durchbruch gelungen.",https://p6.focus.de/img/fotos/id_200711322/gettyimages-1396452117.jpg?im=Crop%3D%280%2C320%2C3265%2C1633%29%3BResize%3D%281200%2C627%29&impolicy=perceptual&quality=mediumHigh&hash=fdb2107c135cf58cc1f7c6632b7fcb1ac4eb853faad9c3a192c433c2413bfd3a,2023-08-02T07:55:13Z,,"Kein Wind weht, keine Sonne scheint: Was passiert im Energiesystem der Zukunft bei sogenannten Dunkelflauten? Dann sollen neue Kraftwerke einspringen. Auf EU-Ebene ist der Bundesregierung jetzt ein k… [+5172 chars]",,de,'Wind'
https://www.morgenpost.de/wirtschaft/article239087475/Heizen-Wo-der-Abschied-vom-Gas-in-Deutschland-konkret-wird.html,https://www.morgenpost.de/wirtschaft/article239087475/Heizen-Wo-der-Abschied-vom-Gas-in-Deutschland-konkret-wird.html,0,www.morgenpost.de,Energieversorgung: Heizen: Wo der Abschied vom Gas in Deutschland konkret wird,"Erste Kommunen planen den konkreten Abschied vom Gas. Wo es Vorzeigeprojekte gibt, wie es vonstatten geht - und warum Wasserstoff kein Allheilmittel ist.",https://img.morgenpost.de/img/wirtschaft/crop239087739/1332601865-w820-cv16_9-q85/2060345c-3119-11ee-97f9-3ba5b9b8c0aa.jpg,2023-08-02T09:21:19Z,,"Berlin.  Grüner Wasserstoff zum Heizen wie soll das funktionieren? 214 Privathaushalte werden demnächst damit beliefert. Es ist ein erster praktischer Versuch, mit dem die Stadtwerke Heide diesen Weg… [+5094 chars]",,de,'Gas'
https://www.pcgames.de/The-Last-of-Us-Part-1-Spiel-73749/News/Klon-Nintendo-Switch-1425828/,https://www.pcgames.de/The-Last-of-Us-Part-1-Spiel-73749/News/Klon-Nintendo-Switch-1425828/,0,www.pcgames.de,"Doch kein ""Last of Us"" auf Nintendo Switch: Sony killt den frechen Klon","Ein dreister The Last of Us-Klon für die Nintendo Switch sorgte in den letzten Wochen für jede Menge Wirbel, jetzt hat Sony scheinbar Wind davon bekommen und den Titel endgültig entfernen lassen.",https://www.pcgames.de/screenshots/medium/2023/04/The-Last-of-Us-Part-1-PC-6--pc-games.jpg,2023-08-02T09:48:00Z,,Die The Last of Us-Reihe von Sony zählt bis heute zu den Videospielen mit der ergreifendsten Geschichte jemals und wurde vielfach ausgezeichnet. Im letzten Jahr wurde dem Franchise sogar eine ganze H… [+1854 chars],,de,'Wind'
https://consent.google.com/ml?continue=https://news.google.com/rss/articles/CBMijQFodHRwczovL3d3dy5uZHIuZGUvbmFjaHJpY2h0ZW4vbmllZGVyc2FjaHNlbi9vbGRlbmJ1cmdfb3N0ZnJpZXNsYW5kL1N0YXJrZXItV2luZC1kcm9odC1GcmVtYW50bGUtSGlnaHdheS1tdXNzLWluLWVpbmVuLUhhZmVuLGZyYWNodGVyNzMyLmh0bWzSAQA?oc%3D5&gl=FR&hl=en-US&cm=2&pc=n&src=1,https://consent.google.com/ml?continue=https://news.google.com/rss/articles/CBMijQFodHRwczovL3d3dy5uZHIuZGUvbmFjaHJpY2h0ZW4vbmllZGVyc2FjaHNlbi9vbGRlbmJ1cmdfb3N0ZnJpZXNsYW5kL1N0YXJrZXItV2luZC1kcm9odC1GcmVtYW50bGUtSGlnaHdheS1tdXNzLWluLWVpbmVuLUhhZmVuLGZyYWNodGVyNzMyLmh0bWzSAQA?oc%3D5&gl=FR&hl=en-US&cm=2&pc=n&src=1,0,consent.google.com,"Starker Wind droht: ""Fremantle Highway"" muss in einen Hafen - NDR.de","<ol><li>Starker Wind droht: ""Fremantle Highway"" muss in einen Hafen  NDR.de
</li><li>Brennendes Frachtschiff Fremantle Highway hat Kräne der Zweibrücker Firma Tadano geladen  SWR Aktuell
</li><li>Frachter „Fremantle Highway“: Schiff stabil und Feuer unter K…",,2023-08-02T10:41:15Z,,"We use cookies and data to<ul><li>Deliver and maintain Google services</li><li>Track outages and protect against spam, fraud, and abuse</li><li>Measure audience engagement and site statistics to unde… [+1131 chars]",,de,'Wind'
https://www.diepresse.com/13666846/bergungsunternehmen-draengt-auf-rasche-verlegung-des-verbrannten-autofrachters,https://www.diepresse.com/13666846/bergungsunternehmen-draengt-auf-rasche-verlegung-des-verbrannten-autofrachters,0,www.diepresse.com,Bergungsunternehmen drängt auf rasche Verlegung des verbrannten Autofrachters,"Das Schiff sei bei erwartetem Wind aus Nordwest nur schwierig zu beherrschen, warnt der Chef des Bergungsunternehmens. Das Oberdeck ist stark beschädigt. Ob das Feuer wirklich gelöscht ist, ist unklar.",https://img.diepresse.com/public/incoming/h5vby7-NETHERLANDS-MARITIME-SHIPPING-FIRE/alternates/DPR_SOCIAL_NACHRICHTEN/NETHERLANDS-MARITIME-SHIPPING-FIRE,2023-08-02T10:47:58Z,,"Das Schiff sei bei erwartetem Wind aus Nordwest nur schwierig zu beherrschen, warnt der Chef des Bergungsunternehmens. Das Oberdeck ist stark beschädigt. Ob das Feuer wirklich gelöscht ist, ist unkla… [+1949 chars]",,de,'Wind'
https://www.n-tv.de/panorama/Griechenland-entschaedigt-Touristen-mit-Gratisurlaub-article24300534.html,https://www.n-tv.de/panorama/Griechenland-entschaedigt-Touristen-mit-Gratisurlaub-article24300534.html,0,www.n-tv.de,Nach Waldbränden auf Rhodos: Griechenland entschädigt Touristen mit Gratisurlaub,Tausende Touristen mussten sich wegen der heftigen Waldbrände auf Rhodos in Sicherheit bringen und ihren Urlaub abbrechen. Dabei will es die griechische Regierung aber nicht belassen. Nächstes Jahr könnten sie entweder im Frühjahr oder Herbst eine Woche Grati…,https://bilder3.n-tv.de/img/incoming/crop24300566/7291322551-cImg_16_9-w1200/418370242.jpg,2023-08-02T11:32:21Z,,Tausende Touristen mussten sich wegen der heftigen Waldbrände auf Rhodos in Sicherheit bringen und ihren Urlaub abbrechen. Dabei will es die griechische Regierung aber nicht belassen. Nächstes Jahr k… [+2194 chars],,de,'Tau'
https://www.stern.de/wirtschaft/gasriese-uniper-wird-gruen---was-die-bundesregierung-damit-zu-tun-hat-33703392.html,https://www.stern.de/wirtschaft/gasriese-uniper-wird-gruen---was-die-bundesregierung-damit-zu-tun-hat-33703392.html,0,www.stern.de,Energiewende: Gasriese Uniper schaltet um auf grün – was die Bundesregierung damit zu tun hat,"Der Düsseldorfer Gas- und Kohlekonzern Uniper, der vergangenes Jahr noch vor der Pleite stand, schreibt wieder satte Gewinne. Und will sich zum klimafreundlichen Energieriesen wandeln. Hinter der Strategie steckt auch die Bundesregierung",https://image.stern.de/33703610/t/S-/v2/w1440/r1.7778/-/uniper-datteln.jpg,2023-08-02T12:10:00Z,,"02.08.2023, 14:10
 3 Min.
Der Düsseldorfer Gas- und Kohlekonzern Uniper, der vergangenes Jahr noch vor der Pleite stand, schreibt wieder satte Gewinne. Und will sich zum klimafreundlichen Energieri… [+5638 chars]",,de,'Gas'
https://www.bild.de/news/wetter/wetter/schlechte-laune-wetter-suchmeldung-wo-steckt-der-sommer-84902530.bild.html,https://www.bild.de/news/wetter/wetter/schlechte-laune-wetter-suchmeldung-wo-steckt-der-sommer-84902530.bild.html,0,www.bild.de,Schlechte-Laune-Wetter - Suchmeldung: Wo steckt der Sommer?,"Dunkle Wolken, ein frischer Wind und Temperaturen knapp über 20 Grad. Der Sommer in Deutschland hat einen herben Dämpfer bekommen.  Stürmisches Wetter. W...","https://images.bild.de/64c8c3f6e98fa73a8ae2291c/dce1e2eb387d85716a6891d7a293e520,b7f8a1f7?w=1280",2023-08-02T12:42:43Z,,"Dunkle Wolken, ein frischer Wind und Temperaturen knapp über 20 Grad. Der Sommer in Deutschland hat einen herben Dämpfer bekommen. 
Stürmisches Wetter. Wolken am Mittwoch. Regen und Gewitter. Der We… [+2085 chars]",,de,'Wind'
https://www.tagesschau.de/ausland/europa/fremantle-highway-130.html,https://www.tagesschau.de/ausland/europa/fremantle-highway-130.html,0,www.tagesschau.de,Nordsee: Bergungsunternehmen drängt auf Verlegung des Autofrachters,"Bei starkem Wind könnte die ""Fremantle Highway"" nicht mehr beherrschbar sein, warnt das Bergungsunternehmen - und drängt, den Frachter rasch in einen Hafen zu schleppen. Die sichtbaren Feuer seien erloschen. Von A. Meyer-Feist.",https://images.tagesschau.de/image/cc40b60f-2f5e-47e8-982c-7b0d02690035/AAABibZujFY/AAABibBxqrQ/16x9-1280/fremantle-highway-132.jpg,2023-08-02T13:27:25Z,,"Stand: 02.08.2023 15:27 Uhr
Bei starkem Wind könnte die ""Fremantle Highway"" nicht mehr beherrschbar sein, warnt das Bergungsunternehmen - und drängt, den Frachter rasch in einen Hafen zu schleppen. … [+2858 chars]",,de,'Wind'
https://www.tagesschau.de/ausland/europa/rhodos-waldbraende-gratis-urlaub-100.html,https://www.tagesschau.de/ausland/europa/rhodos-waldbraende-gratis-urlaub-100.html,0,www.tagesschau.de,Nach Waldbränden auf Rhodos: Mitsotakis verspricht Touristen Gratisurlaub,"Tausende Rhodos-Touristen mussten wegen der Waldbrände ihre Reise abbrechen. Die griechische Regierung will ihnen nun einen Gratisurlaub anbieten - eine Woche lang, im kommenden Jahr.",https://images.tagesschau.de/image/173062ce-0206-4299-b612-c4eb6e9b0b22/AAABhnQ0xjM/AAABibBxqrQ/16x9-1280/griechenland-strand-105.jpg,2023-08-02T13:42:35Z,,"Stand: 02.08.2023 15:42 Uhr
Tausende Rhodos-Touristen mussten wegen der Waldbrände ihre Reise abbrechen. Die griechische Regierung will ihnen nun einen Gratisurlaub anbieten - eine Woche lang, im ko… [+1818 chars]",,de,'Tau'
https://www.stern.de/panorama/notfaelle--autofrachter-sollte-moeglichst-schnell-einen-hafen-anlaufen--33694656.html,https://www.stern.de/panorama/notfaelle--autofrachter-sollte-moeglichst-schnell-einen-hafen-anlaufen--33694656.html,0,www.stern.de,Notfälle: Autofrachter sollte möglichst schnell einen Hafen anlaufen,"Der Autofrachter ""Fremantle Highway"" liegt immer noch etwa 16 Kilometer vor der niederländischen Küste vor Anker. Wann kann er in einen sicheren Hafen geschleppt werden?",https://image.stern.de/33704918/t/8Z/v1/w1440/r1.7778/-/02--urnnewsmldpacom2009010123080199647260v2w800h600l454t138r2783b1722jpeg---08b9dc36585ebbed.jpg,2023-08-02T13:48:37Z,,"Der Autofrachter ""Fremantle Highway"" liegt immer noch etwa 16 Kilometer vor der niederländischen Küste vor Anker. Wann kann er in einen sicheren Hafen geschleppt werden?
Der schwer beschädigte Autof… [+2382 chars]",,de,'Not'
https://www.handelsblatt.com/finanzen/anlagestrategie/trends/geldanlage-wie-sie-vom-megatrend-waermepumpen-profitieren-koennen/29287360.html,https://www.handelsblatt.com/finanzen/anlagestrategie/trends/geldanlage-wie-sie-vom-megatrend-waermepumpen-profitieren-koennen/29287360.html,0,www.handelsblatt.com,Geldanlage: Analysten sehen bis zu 30 Prozent Kurspotenzial: So können Anleger vom Megatrend Wärmepumpen profitieren,Weltweit setzen Regierungen auf emissionsarme Heizungen. Das treibt die Geschäfte von Wärmepumpen-Herstellern und -zulieferern an – und bewegt auch deren Aktien.,https://www.handelsblatt.com/images/handwerkerin-an-einer-waermepumpe/29288560/3-format2003.jpg,2023-08-02T14:00:26Z,,"Handwerkerin an einer WärmepumpeZwischenzeitlich sorgt das geplante Heizungsgesetz der Bundesregierung für etwas Zurückhaltung. Das könnte sich aber bald wieder ändern.
(Foto: dpa)
Köln Kaum ein Th… [+1297 chars]",,de,'Heizung'
https://www.morgenpost.de/ratgeber/article238104219/gasheizung-umruesten-2023-heizungsgesetz-heizung-h2-ready.html,https://www.morgenpost.de/ratgeber/article238104219/gasheizung-umruesten-2023-heizungsgesetz-heizung-h2-ready.html,0,www.morgenpost.de,Was Experten empfehlen: Gasheizung umrüsten: Große Hürden für Hausbesitzer,Auf Wasserstoff umrüstbare Gasheizungen sollen weiter erlaubt sein. • Doch nicht überall sind H2-Netze vorgesehen • Was Hausbesitzer bedenken sollten.,https://img.morgenpost.de/img/frontpage/crop238709449/5602605610-w820-cv16_9-q85/Gasheizung-mit-Wasserstoff-nutzen-H2-ready-ab-2024.jpg,2023-08-02T14:37:00Z,,"Berlin. <ul><li>In den vergangenen Monaten gab es für Hausbesitzer mit Gasheizung viele Unklarheiten</li><li>Lange sah es so aus, als würde der Einbau neuer Gasheizungen mit der Überarbeitung des Hei… [+13899 chars]",,de,'Gas'
