index,url,valid,domain,title,description,image,published,archive,content,quote,language,keyword
https://www.focus.de/klima/experten/energieexperte-michael-sterner-meine-persoenliche-stromwende-klimaschutz-zum-nachmachen_id_187986356.html,https://www.focus.de/klima/experten/energieexperte-michael-sterner-meine-persoenliche-stromwende-klimaschutz-zum-nachmachen_id_187986356.html,0,www.focus.de,Energieexperte Michael Sterner - Wie ich in nur zwei Schritten meine persönliche Stromwende geschafft habe,"Das eigene Beispiel wirkt mehr als tausend gut gemeinte Worte und Ratschläge. Darum möchte ich Ihnen in diesem Gastbeitrag keine erhobenen Zeigefinger und To-do-Listen anbieten, sondern Einblicke in die Umsetzung meines persönlichen Klimaschutzes geben. Von G…",https://p6.focus.de/img/fotos/id_188212185/gettyimages-1411002313-1-.jpg?im=Crop%3D%280%2C577%2C3464%2C1732%29%3BResize%3D%281200%2C627%29&hash=e0ebc649f514634ce4ae5b8a351fa5511a7010b5d9490553ca36b4e48798279a,2023-03-13T09:51:59Z,https://web.archive.org/web/20230314150728/https://www.focus.de/klima/experten/energieexperte-michael-sterner-meine-persoenliche-stromwende-klimaschutz-zum-nachmachen_id_187986356.html,"<ul><li>
Kommentare</li><li>
E-Mail</li><li>
Teilen</li><li>
Mehr</li><li>
Twitter</li><li>
Drucken</li><li>
Feedback</li><li>
Fehler meldenSie haben einen Fehler gefunden?
Bitte markieren S… [+7438 chars]",,de,'Gas'
https://www.focus.de/politik/deutschland/geplante-heizungs-verbote-experte-erhebt-schwerem-vorwurf-gegen-habecks-oeko-diktatur_id_188213208.html,https://www.focus.de/politik/deutschland/geplante-heizungs-verbote-experte-erhebt-schwerem-vorwurf-gegen-habecks-oeko-diktatur_id_188213208.html,0,www.focus.de,Heizungs-Hammer ab 2024 - Experte kritisiert Habecks Verbote: „Auf dem Weg in die Öko-Diktatur“,Bundeswirtschaftsminister Robert Habeck steht für seine Pläne zu Heizungs-Verboten und Sanierungspflicht in der Kritik. Wissenschaftler Prof. Manuel Frondel sieht Deutschland „auf dem Weg in die Öko-Diktatur“. Ein Heizungs-Verbot hält der Experte für „unnötig…,https://p6.focus.de/img/fotos/id_188213888/bundeswirtschaftsminister-robert-habeck-will-heizungs-verbote-durchsetzen.jpg?im=Crop%3D%280%2C101%2C3464%2C1732%29%3BResize%3D%281200%2C627%29&hash=77312da775589e673f8bd79d2193696a1a0af6072d683dff49554e45a6e6fc98,2023-03-13T10:29:18Z,,Zum Schutz des Klimas will die Bundesregierung um Wirtschaftsminister Robert Habeck ein Verbot neuer Öl- und Gasheizungen durchsetzen. Ab 2024 sollen in deutschen Haushalten nur noch Heizungen instal… [+1251 chars],,de,'Heizung'
https://www.zeit.de/news/2023-03/13/verbraucher-kaufen-weniger-wein-absatzminus-von-10-prozent,https://www.zeit.de/news/2023-03/13/verbraucher-kaufen-weniger-wein-absatzminus-von-10-prozent,0,www.zeit.de,Getränke: Verbraucher kaufen weniger Wein: Absatzminus von 10 Prozent,,,2023-03-13T10:30:30Z,,"When browsing with ads:
We collect personal data and also transmit it to third-party providers
 that help us improve and finance our digital content. Some of the information stored on your device, … [+732 chars]",,de,'Wein'
https://hallespektrum.de/nachrichten/umwelt-verkehr/halle-bewaehrt-sich-als-oepnv-innovationslabor-etarif-berechnet-nur-die-luftliniendistanz/432935/,https://hallespektrum.de/nachrichten/umwelt-verkehr/halle-bewaehrt-sich-als-oepnv-innovationslabor-etarif-berechnet-nur-die-luftliniendistanz/432935/,0,hallespektrum.de,Halle bewährt sich als ÖPNV-Innovationslabor: eTarif berechnet nur die Luftliniendistanz,"Seit September 2022 können Kunden der Halleschen Verkehrs-AG (HAVAG) die innovative App FTQ Lab nutzen, die bei Fahrten in der Tarifzone 210 (Halle) automatisch nur die zurückgelegte Luftliniendistanz abrechnet. Mit mehr als 30.000 Fahrten und über 1.500 regi…",https://hallespektrum.de/wp-content/uploads/2023/03/HAVAG-Luftlinie.png,2023-03-13T11:00:45Z,https://web.archive.org/web/20230313110504/https://hallespektrum.de/nachrichten/umwelt-verkehr/halle-bewaehrt-sich-als-oepnv-innovationslabor-etarif-berechnet-nur-die-luftliniendistanz/432935/,"Seit September 2022 können Kunden der Halleschen Verkehrs-AG (HAVAG) die innovative App FTQ Lab nutzen, die bei Fahrten in der Tarifzone 210 (Halle) automatisch nur die zurückgelegte Luftliniendistan… [+2799 chars]",,de,'ÖPNV'
https://www.zeit.de/news/2023-03/13/minister-tierwohl-wichtig-fuer-milchviehwirtschaft-akzeptanz,https://www.zeit.de/news/2023-03/13/minister-tierwohl-wichtig-fuer-milchviehwirtschaft-akzeptanz,0,www.zeit.de,Landwirtschaft: Minister: Tierwohl wichtig für Milchviehwirtschaft-Akzeptanz,,,2023-03-13T11:19:32Z,,"When browsing with ads:
We collect personal data and also transmit it to third-party providers
 that help us improve and finance our digital content. Some of the information stored on your device, … [+732 chars]",,de,'Landwirtschaft'
https://www.zeit.de/news/2023-03/13/duerre-experte-daten-zu-wasserentnahme-aus-boden-notwendig,https://www.zeit.de/news/2023-03/13/duerre-experte-daten-zu-wasserentnahme-aus-boden-notwendig,0,www.zeit.de,Umwelt: Dürre-Experte: Daten zu Wasserentnahme aus Boden notwendig,,,2023-03-13T13:02:10Z,https://web.archive.org/web/20230313132332/https://www.zeit.de/news/2023-03/13/duerre-experte-daten-zu-wasserentnahme-aus-boden-notwendig,"When browsing with ads:
We collect personal data and also transmit it to third-party providers
 that help us improve and finance our digital content. Some of the information stored on your device, … [+732 chars]",,de,'Dürre'
https://www.diepresse.com/6262706/duerre-frankreich-droht-schon-im-winter-das-wasser-auszugehen,https://www.diepresse.com/6262706/duerre-frankreich-droht-schon-im-winter-das-wasser-auszugehen,0,www.diepresse.com,Dürre: Frankreich droht schon im Winter das Wasser auszugehen,32 Tage ohne nennenswerten Niederschlag hinterlassen ihre Spuren: 80 Prozent der Grundwasserreserven sind nicht ausreichend gefüllt. Die Regierung will in den kommenden Tagen einen nationalen Wasserplan vorlegen.,https://media.diepresse.com/social_diepresse_nachrichten/images/uploads_1200/f/b/2/6262706/66611681-9F5E-4987-9840-C0DE6318E5CE_v0_h.jpg,2023-03-13T13:18:00Z,https://web.archive.org/web/20230314085047/https://www.diepresse.com/6262706/duerre-frankreich-droht-schon-im-winter-das-wasser-auszugehen,32 Tage ohne nennenswerten Niederschlag hinterlassen ihre Spuren: 80 Prozent der Grundwasserreserven sind nicht ausreichend gefüllt. Die Regierung will in den kommenden Tagen einen nationalen Wasserp… [+3462 chars],,de,'Dürre'
https://www.faz.net/aktuell/wirtschaft/wie-trinkwasser-gesichert-werden-soll-nationale-wasserstrategie-18744902.html,https://www.faz.net/aktuell/wirtschaft/wie-trinkwasser-gesichert-werden-soll-nationale-wasserstrategie-18744902.html,0,www.faz.net,Wie das Trinkwasser gesichert werden soll,"Starkregen, Überflutungen, Dürre: Der Klimawandel erfordert einen krisenfesten Umgang mit der Ressource Wasser. Dafür gibt es nun erstmals eine Nationale Wasserstrategie.",https://media0.faz.net/ppmedia/aktuell/gesellschaft/2492325488/1.8744964/facebook_teaser/ein-trinkwasserbrunnen-steht.jpg,2023-03-13T13:22:21Z,http://archive.md/20230313134323/https://www.faz.net/aktuell/wirtschaft/wie-trinkwasser-gesichert-werden-soll-nationale-wasserstrategie-18744902.html,"Die Sicherung der Trinkwasserversorgung und der Schutz des Grundwassers sind Kernziele der Nationalen Wasserstrategie, die an diesem Mittwoch vom Kabinett beschlossen werden soll und die der F.A.Z. v… [+5023 chars]",,de,'Dürre'
https://orf.at/stories/3308695/,https://orf.at/stories/3308695/,0,orf.at,Dürre in Frankreich lässt Grundwasserspiegel sinken,,https://orf.at/mojo/1_4_1/storyserver//news/common/images/og-fallback-news.png,2023-03-13T13:32:52Z,https://web.archive.org/web/20230313135728/https://orf.at/stories/3308695/,Die Trockenheit im vergangenen Sommer und die extreme Winterdürre in Frankreich haben die dortigen Grundwasserreserven schrumpfen lassen. Die Situation hat sich im Februar wegen mangelnden Niederschl… [+2015 chars],,de,'Dürre'
https://www.pcgames.de/Baumarkt-Hardware-279480/News/Tronitechnik-Reykir-Split-Klimaanlage-kaufen-Kuehlung-Heizung-Luftsterilisation-Angebot-Amazon-Coupon-1415328/,https://www.pcgames.de/Baumarkt-Hardware-279480/News/Tronitechnik-Reykir-Split-Klimaanlage-kaufen-Kuehlung-Heizung-Luftsterilisation-Angebot-Amazon-Coupon-1415328/,0,www.pcgames.de,"Tronitechnik Reykir Split Klimaanlage mit 100 Euro Rabatt: Kühlung, Heizung & Luftsterilisation zum Sparpreis","Wer eine Klimaanlage für möglichst wenig Geld kaufen möchte, findet in der ""Tronitechnik Reykir Split Klimaanlage"" womöglich das für ihn passende Gerät. Es handelt sich um ein Inverter-Splitgerät mit UVC-Luftsterilisation sowie 9000 BTU, das zur Kühlung…",https://www.pcgames.de/screenshots/medium/2023/03/Tronitechnik-Reykir-Split-Klimaanlage-Inverter-Splitgeraet-mit-UVC-Luftsterilisation-pcgh.jpg,2023-03-13T15:37:00Z,,"Ihr seid auf der Suche nach einer Klimaanlage, die nicht nur kühlt, sondern auch heizt, entfeuchtet und eine UVC-Luftsterilisation bietet? Dann haben wir bei Amazon für euch womöglich genau den richt… [+3814 chars]",,de,'Heizung'
https://www.sueddeutsche.de/bayern/29-euro-ticket-bayern-studenten-nahverkehr-1.5768170,https://www.sueddeutsche.de/bayern/29-euro-ticket-bayern-studenten-nahverkehr-1.5768170,0,www.sueddeutsche.de,Nahverkehr: Junge Leute fahren bald für 29 Euro,"Von Herbst an können Studenten, Auszubildende und Freiwilligendienstleistende in Bayern ein vergünstigtes ÖPNV-Ticket kaufen, das bundesweit gültig sein wird. Allerdings wird es kein Sozialticket geben. Wie es genau funktionieren wird.",https://www.sueddeutsche.de/image/sz.1.5768171/1200x675?v=1678723210,2023-03-13T16:00:22Z,https://web.archive.org/web/20230313181952/https://www.sueddeutsche.de/bayern/29-euro-ticket-bayern-studenten-nahverkehr-1.5768170,"Von Herbst an können Studenten, Auszubildende und Freiwilligendienstleistende in Bayern ein vergünstigtes ÖPNV-Ticket kaufen, das bundesweit gültig sein wird. Allerdings wird es kein Sozialticket geb… [+6386 chars]",,de,'ÖPNV'
https://www.n-tv.de/wissen/Sowohl-Niederschlaege-als-auch-Duerren-werden-extremer-article23980106.html,https://www.n-tv.de/wissen/Sowohl-Niederschlaege-als-auch-Duerren-werden-extremer-article23980106.html,0,www.n-tv.de,Weltweite Daten aus 20 Jahren: Sowohl Niederschläge als auch Dürren werden extremer,"""Trocken wird trockener, nass wird nasser"" - so lautet der Kommentar zu den Ergebnissen einer großen Studie zu Extremwetter-Ereignissen der vergangenen Jahre. Anhand von Satellitendaten werden darin Prognosen von Klimamodellen belegt: Die Klimakrise hat mehr …",https://bilder1.n-tv.de/img/incoming/crop23980260/275132969-cImg_16_9-w1200/385883984.jpg,2023-03-13T16:20:13Z,https://web.archive.org/web/20230314065815/https://www.n-tv.de/wissen/Sowohl-Niederschlaege-als-auch-Duerren-werden-extremer-article23980106.html,"""Trocken wird trockener, nass wird nasser"" - so lautet der Kommentar zu den Ergebnissen einer großen Studie zu Extremwetter-Ereignissen der vergangenen Jahre. Anhand von Satellitendaten werden darin … [+4813 chars]",,de,'Dürre'
https://www.wiwo.de/politik/deutschland/krankenhausgipfel-berlin-lauterbach-krankenhaeuser-sind-in-groesster-not/29032884.html,https://www.wiwo.de/politik/deutschland/krankenhausgipfel-berlin-lauterbach-krankenhaeuser-sind-in-groesster-not/29032884.html,0,www.wiwo.de,Krankenhäuser: Lauterbach: „Krankenhäuser sind in größter Not“,"Die Kliniklandschaft in Deutschland soll reformiert werden. Krankenhaus-Vertreter sind zwar grundsätzlich offen, fordern aber zunächst schnelle Finanzhilfen, denn vielen Kliniken drohe die Insolvenz.",https://www.wiwo.de/images/intensivstation/29034058/2-format11240.jpg,2023-03-13T16:29:25Z,https://web.archive.org/web/20230313164650/https://www.wiwo.de/politik/deutschland/krankenhausgipfel-berlin-lauterbach-krankenhaeuser-sind-in-groesster-not/29032884.html,Klinikvertreter haben erneut vor Krankenhaus-Insolvenzen gewarnt und schnelle Finanzhilfen noch vor der von der Ampel geplanten großen Krankenhausreform gefordert. Die Krankenhäuser liegen im Schockr… [+4124 chars],,de,'Not'
https://www.n-tv.de/politik/Lauterbach-will-Klinikreform-trotz-scharfer-Kritik-durchdruecken-article23981104.html,https://www.n-tv.de/politik/Lauterbach-will-Klinikreform-trotz-scharfer-Kritik-durchdruecken-article23981104.html,0,www.n-tv.de,"""Krankenhäuser in größter Not"": Lauterbach will Klinikreform trotz scharfer Kritik durchdrücken",Personalmangel und Inflation machen den Kliniken schwer zu schaffen. Gesundheitsminister Lauterbach macht sich deshalb für eine Reform der Krankenhäuser stark. Schwierige Fälle sollen so stärker zentralisiert werden. Länder und Opposition warnen jedoch vor de…,https://bilder4.n-tv.de/img/incoming/crop23981147/284132327-cImg_16_9-w1200/398899903.jpg,2023-03-13T17:05:01Z,https://web.archive.org/web/20230313171336/https://www.n-tv.de/politik/Lauterbach-will-Klinikreform-trotz-scharfer-Kritik-durchdruecken-article23981104.html,Personalmangel und Inflation machen den Kliniken schwer zu schaffen. Gesundheitsminister Lauterbach macht sich deshalb für eine Reform der Krankenhäuser stark. Schwierige Fälle sollen so stärker zent… [+4844 chars],,de,'Not'
https://www.sueddeutsche.de/sport/eishockey-koelner-haie-del-moritz-mueller-playoffs-1.5767974,https://www.sueddeutsche.de/sport/eishockey-koelner-haie-del-moritz-mueller-playoffs-1.5767974,0,www.sueddeutsche.de,Kölner Haie in der Deutschen Eishockey Liga: Der Jubilar atmet wieder,Nach Zeiten der Dürre erlauben sich die Kölner Haie im Jahr ihres 50. Geburtstags Gedanken an den deutschen Eishockey-Titel. Für Kapitän Moritz Müller wäre es nach seinem 1000. DEL-Spiel der letzte fehlende Triumph.,https://www.sueddeutsche.de/image/sz.1.5767975/1200x675?v=1678810041,2023-03-13T17:54:39Z,,Nach Zeiten der Dürre erlauben sich die Kölner Haie im Jahr ihres 50. Geburtstags Gedanken an den deutschen Eishockey-Titel. Für Kapitän Moritz Müller wäre es nach seinem 1000. DEL-Spiel der letzte f… [+3779 chars],,de,'Dürre'
https://www.welt.de/wirtschaft/article244277803/Wein-in-der-Pfandflasche-Winzer-setzen-auf-neue-Verpackungen.html,https://www.welt.de/wirtschaft/article244277803/Wein-in-der-Pfandflasche-Winzer-setzen-auf-neue-Verpackungen.html,0,www.welt.de,Bio-Wein in Mehrweg-Bierflaschen – Das schmeckt dem Zeitgeist,Fast die Hälfte der CO₂-Emissionen eines Weines fallen auf die Glasflasche. Deshalb setzen einige Winzer schon jetzt auf Mehrweg. Die Generation Fridays For Future könnte den Druck bald erhöhen. Auch im Gespräch: mit Folie ausgekleidete 10-Liter-Kartons mit Z…,https://img.welt.de/img/wirtschaft/mobile244277793/7021359487-ci16x9-w1200/Weingut-Galler-Wein-in-Mehrwegflaschen.jpg,2023-03-13T19:53:38Z,,Silja Mende-Kamps und Leonie Berents sehen sich als Rebolutionärinnen. Mit diesem Wortspiel aus den beiden Begriffen Rebe und Revolution beschreiben die zwei Gründerinnen die Idee und Mission ihres S… [+6151 chars],,de,'Wein'
https://www.bild.de/regional/sachsen-anhalt/sachsen-anhalt-news/sachsen-anhalt-windraeder-sollen-in-den-wald-83197094.bild.html,https://www.bild.de/regional/sachsen-anhalt/sachsen-anhalt-news/sachsen-anhalt-windraeder-sollen-in-den-wald-83197094.bild.html,0,www.bild.de,"Nach Borkenkäferplage, Dürre und Sturm - Windräder sollen in den Wald","Sachsen-Anhalt ist Deutschlands Windkraft-Meister! Allein von den 51 neuen Anlagen, die seit Jahresbeginn bundesweit genehmigt wurden, liegen 19 hier im Land. Foto: picture alliance / Westend61","https://images.bild.de/640f86ba1f5b20050498fed5/79628384c3cc503198880213a6208d30,9ab74df8?w=1280",2023-03-13T20:41:37Z,https://web.archive.org/web/20230313211746/https://www.bild.de/regional/sachsen-anhalt/sachsen-anhalt-news/sachsen-anhalt-windraeder-sollen-in-den-wald-83197094.bild.html,"Salzwedel Sachsen-Anhalt ist Deutschlands Windkraft-Meister! Allein von den 51 neuen Anlagen, die seit Jahresbeginn bundesweit genehmigt wurden, liegen 19 hier im Land. Allerdings steht bis heute kei… [+1430 chars]",,de,'Dürre'
https://www.telepolis.de/features/Dauer-Notstand-Rekord-Ueberschwemmungen-in-Mosambik-und-Kalifornien-7544031.html,https://www.telepolis.de/features/Dauer-Notstand-Rekord-Ueberschwemmungen-in-Mosambik-und-Kalifornien-7544031.html,0,www.telepolis.de,Dauer-Notstand: Rekord-Überschwemmungen in Mosambik und Kalifornien,"Energie und Klima – kompakt: ""Freddy"" könnte der bisher längste Tropensturm gewesen sein. Gleichzeitig geht das Klimaphänomen La Niña zu Ende. In Kalifornien herrscht nach dem Niedergang ""atmosphärischer Flüsse"" der Ausnahmezustand.",https://heise.cloudimg.io/bound/1200x1200/q85.png-lossy-85.webp-lossy-85.foil1/_www-heise-de_/imgs/18/3/7/1/6/9/9/5/image03082023_main_2-fdd79a488560f564.jpeg,2023-03-13T23:00:00Z,https://web.archive.org/web/20230313235630/https://www.telepolis.de/features/Dauer-Notstand-Rekord-Ueberschwemmungen-in-Mosambik-und-Kalifornien-7544031.html,"Am 8. März kehrte der rekordverdächtige tropische Wirbelsturm Freddy nach Mosambik zurück. Bild: MODIS Land Rapid Response Team, NASA GSF
Energie und Klima kompakt: ""Freddy"" könnte der bisher längst… [+2865 chars]",,de,'Kälte'
https://www.sueddeutsche.de/bayern/bayern-29-euro-ticket-studenten-nahverkehr-1.5768170,https://www.sueddeutsche.de/bayern/bayern-29-euro-ticket-studenten-nahverkehr-1.5768170,0,www.sueddeutsche.de,Nahverkehr in Bayern: Junge Leute fahren bald für 29 Euro,"Ab Herbst können Studenten, Azubis und Freiwilligendienstleistende in Bayern ein vergünstigtes ÖPNV-Ticket kaufen, das bundesweit gültig ist. Ein Sozialticket wird es aber nicht geben. Antworten auf die wichtigsten Fragen.",https://www.sueddeutsche.de/image/sz.1.5768171/1200x675?v=1678777971,2023-03-14T04:04:51Z,https://web.archive.org/web/20230314072913/https://www.sueddeutsche.de/bayern/bayern-29-euro-ticket-studenten-nahverkehr-1.5768170,"Ab Herbst können Studenten, Azubis und Freiwilligendienstleistende in Bayern ein vergünstigtes ÖPNV-Ticket kaufen, das bundesweit gültig ist. Ein Sozialticket wird es aber nicht geben. Antworten auf … [+6374 chars]",,de,'ÖPNV'
https://www.focus.de/finanzen/news/warnstreiks-im-ticker-erneute-warnstreiks-bus-und-bahn-fahren-nicht-in-hannover_id_186420889.html,https://www.focus.de/finanzen/news/warnstreiks-im-ticker-erneute-warnstreiks-bus-und-bahn-fahren-nicht-in-hannover_id_186420889.html,0,www.focus.de,Warnstreiks im Ticker - Wegen Warnstreiks fallen auch Flüge nach Berlin aus,"Die Warnstreiks von Verdi gehen immer noch weiter. Nach den Protesten in zahlreichen deutschen Flughäfen, ist heute wieder der ÖPNV betroffen. In Hannover fallen deswegen Bus und Bahn aus. Wo heute noch gestreikt wird, erfahren Sie in unseren Warnstreikticker.",https://p6.focus.de/img/regional/hessen/id_187598306/warnstreik-steht-auf-einem-transparent..jpg?im=Crop%3D%280%2C256%2C2048%2C1024%29%3BResize%3D%281200%2C627%29&impolicy=perceptual&quality=medium&hash=81dfdd4984c00898cfc429ad6b64e8f58072090d3b136ba2dbbba71181475cf4,2023-03-14T05:30:12Z,https://web.archive.org/web/20230314055356/https://www.focus.de/finanzen/news/warnstreiks-im-ticker-erneute-warnstreiks-bus-und-bahn-fahren-nicht-in-hannover_id_186420889.html,"Die Warnstreiks von Verdi gehen immer noch weiter. Nach den Protesten in zahlreichen deutschen Flughäfen, ist heute wieder der ÖPNV betroffen. In Hannover fallen deswegen Bus und Bahn aus. Wo heute n… [+13913 chars]",,de,'ÖPNV'
https://www.faz.net/aktuell/rhein-main/subventioniertes-schuelerticket-in-wiesbaden-18745252.html,https://www.faz.net/aktuell/rhein-main/subventioniertes-schuelerticket-in-wiesbaden-18745252.html,0,www.faz.net,Schülerticket: Für 15 Euro durch ganz Hessen,Wiesbaden subventioniert stark vergünstigte ÖPNV-Tickets für Kinder und Jugendliche im Alter zwischen sechs und 17 Jahren. Das kostet rund vier Millionen Euro jährlich.,https://media0.faz.net/ppmedia/aktuell/rhein-main/43564654/1.6467638/facebook_teaser/gesichert-schuelerticket-fuer.jpg,2023-03-14T06:15:00Z,https://web.archive.org/web/20230314061813/http://www.faz.net/aktuell/rhein-main/subventioniertes-schuelerticket-in-wiesbaden-18745252.html,Die Landeshauptstadt Wiesbaden subventioniert mit rund vier Millionen Euro jährlich stark vergünstigte ÖPNV-Tickets für Kinder und Jugendliche im Alter zwischen sechs und 17 Jahren. Diese Aktion baut… [+2798 chars],,de,'ÖPNV'
https://www.zeit.de/news/2023-03/14/wind-und-gebietsweise-regen-in-berlin-und-brandenburg,https://www.zeit.de/news/2023-03/14/wind-und-gebietsweise-regen-in-berlin-und-brandenburg,0,www.zeit.de,Wetter: Wind und gebietsweise Regen in Berlin und Brandenburg,,,2023-03-14T07:29:55Z,https://web.archive.org/web/20230314075115/https://www.zeit.de/news/2023-03/14/wind-und-gebietsweise-regen-in-berlin-und-brandenburg,"When browsing with ads:
We collect personal data and also transmit it to third-party providers
 that help us improve and finance our digital content. Some of the information stored on your device, … [+732 chars]",,de,'Wind'
https://www.zeit.de/news/2023-03/14/feuerwehr-rettet-eichhoernchenbabys,https://www.zeit.de/news/2023-03/14/feuerwehr-rettet-eichhoernchenbabys,0,www.zeit.de,Eichhörnchen in Not: Feuerwehr rettet Eichhörnchenbabys,,,2023-03-14T08:05:21Z,https://web.archive.org/web/20230314082430/https://www.zeit.de/news/2023-03/14/feuerwehr-rettet-eichhoernchenbabys,"When browsing with ads:
We collect personal data and also transmit it to third-party providers
 that help us improve and finance our digital content. Some of the information stored on your device, … [+732 chars]",,de,'Not'
https://www.zeit.de/news/2023-03/14/erneut-viel-wind-in-hessen-teilweise-auch-schnee-dabei,https://www.zeit.de/news/2023-03/14/erneut-viel-wind-in-hessen-teilweise-auch-schnee-dabei,0,www.zeit.de,Wetter: Erneut viel Wind in Hessen: Teilweise auch Schnee dabei,,,2023-03-14T08:16:49Z,https://web.archive.org/web/20230314083944/https://www.zeit.de/news/2023-03/14/erneut-viel-wind-in-hessen-teilweise-auch-schnee-dabei,"When browsing with ads:
We collect personal data and also transmit it to third-party providers
 that help us improve and finance our digital content. Some of the information stored on your device, … [+732 chars]",,de,'Wind'
https://www.sueddeutsche.de/wissen/europa-winterduerre-lage-klimawandel-sommer-1.5767285,https://www.sueddeutsche.de/wissen/europa-winterduerre-lage-klimawandel-sommer-1.5767285,0,www.sueddeutsche.de,Die große Dürre: Banges Warten auf den Sommer,"Dieser Winter hat vielen europäischen Ländern zu wenig Regen oder Schnee gebracht. Wie ist die Lage in Italien, Frankreich, Spanien und Deutschland? Ein Überblick.",https://www.sueddeutsche.de/image/sz.1.5767290/1200x675?v=1678782277,2023-03-14T08:24:38Z,https://web.archive.org/web/20230314083201/https://www.sueddeutsche.de/wissen/europa-winterduerre-lage-klimawandel-sommer-1.5767285,"Dieser Winter hat vielen europäischen Ländern zu wenig Regen oder Schnee gebracht. Wie ist die Lage in Italien, Frankreich, Spanien und Deutschland? Ein Überblick.In Italien hat es in den vergangenen… [+9504 chars]",,de,'Dürre'
https://www.zeit.de/news/2023-03/14/am-dienstag-viel-wind-in-rheinland-pfalz-und-dem-saarland,https://www.zeit.de/news/2023-03/14/am-dienstag-viel-wind-in-rheinland-pfalz-und-dem-saarland,0,www.zeit.de,Wetter: Am Dienstag viel Wind in Rheinland-Pfalz und dem Saarland,,,2023-03-14T08:33:19Z,https://web.archive.org/web/20230314084938/https://www.zeit.de/news/2023-03/14/am-dienstag-viel-wind-in-rheinland-pfalz-und-dem-saarland,"When browsing with ads:
We collect personal data and also transmit it to third-party providers
 that help us improve and finance our digital content. Some of the information stored on your device, … [+732 chars]",,de,'Wind'
https://www.zeit.de/news/2023-03/14/wetterwechsel-nach-sonne-kommen-wind-und-regen,https://www.zeit.de/news/2023-03/14/wetterwechsel-nach-sonne-kommen-wind-und-regen,0,www.zeit.de,Kaltfront: Wetterwechsel: Nach Sonne kommen Wind und Regen,,,2023-03-14T08:39:45Z,https://web.archive.org/web/20230314091438/https://www.zeit.de/news/2023-03/14/wetterwechsel-nach-sonne-kommen-wind-und-regen,"When browsing with ads:
We collect personal data and also transmit it to third-party providers
 that help us improve and finance our digital content. Some of the information stored on your device, … [+732 chars]",,de,'Wind'
https://www.tagesschau.de/wirtschaft/verbraucher/energiegeld-studierende-101.html,https://www.tagesschau.de/wirtschaft/verbraucher/energiegeld-studierende-101.html,0,www.tagesschau.de,Das Energiegeld für Studierende ist von heute an abrufbar,"Die Sonderzahlung, die Studierende und Fachschüler von den gestiegenen Energiekosten entlasten soll, kann nun abgerufen werden. Laut dem Familienministerium startet die Plattform im Internet heute.",https://www.tagesschau.de/multimedia/bilder/studierende-hoersaal-107~_v-original.jpg,2023-03-14T09:04:22Z,https://web.archive.org/web/20230314090521/http://www.tagesschau.de/wirtschaft/verbraucher/energiegeld-studierende-101.html,"Die Sonderzahlung, die Studierende und Fachschüler von den gestiegenen Energiekosten entlasten soll, kann nun abgerufen werden. Laut dem Familienministerium startet die Plattform im Internet heute. … [+2591 chars]",,de,'Energiekosten'
