index,url,valid,domain,title,description,image,published,archive,content,quote,language,keyword
https://steiermark.orf.at/stories/3295172/,https://steiermark.orf.at/stories/3295172/,0,steiermark.orf.at,Regen war Segen für die Landwirtschaft,Laut Geosphere Austria ist in diesem Winter in der Steiermark bis zu 50 Prozent weniger Niederschlag gefallen als üblich. Auf den steirischen Äckern und Feldern beginnt jetzt die Arbeit. Die Landwirtschaft spricht trotz langer Trockenheit dank des Regens dies…,https://ibs.orf.at/stm?image=https%3A%2F%2Foekastatic.orf.at%2Fmims%2F2024%2F31%2F72%2Fcrops%2Fw%3D1200%2Ch%3D627%2Cq%3D75%2F2295842_master_874072_traktorreifen2.jpg%3Fs%3D6a56dddd20bc982ca8ceae666eb4ea5cffe87b8a,2025-03-01T06:30:00Z,,"Nach dem wärmsten Jahr seit Messbeginn ist auch der Winter 2024/25 wieder deutlich zu mild ausgefallen. Es gab zwar nur wenige Rekorde, die Temperaturen lagen aber trotzdem weit über dem langjährigen… [+2248 chars]",,de,'Ackerbau'
https://www.stern.de/gesellschaft/regional/mecklenburg-vorpommern/tarifkonflikt--tarifstreit-in-mv--wieder-warnstreiks-im-oepnv-35512202.html,https://www.stern.de/gesellschaft/regional/mecklenburg-vorpommern/tarifkonflikt--tarifstreit-in-mv--wieder-warnstreiks-im-oepnv-35512202.html,0,www.stern.de,Tarifkonflikt: Tarifstreit in MV: Wieder Warnstreiks im ÖPNV,"Zum wiederholten Male müssen Pendler, Schüler und andere Nutzer des ÖPNV Geduld aufbringen. In MV sind Warnstreiks angesagt. Am Donnerstag beginnt die vierte Verhandlungsrunde.",https://image.stern.de/35512204/t/-x/v1/w1440/r1.7778/-/02--3h56jwhyfwv1axs2048jpeg---a073e8ffd2bb58fb.jpg,2025-03-02T16:30:37Z,,"Kopiere den aktuellen Link
Zur Merkliste hinzufügen
Zum wiederholten Male müssen Pendler, Schüler und andere Nutzer des ÖPNV Geduld aufbringen. In MV sind Warnstreiks angesagt. Am Donnerstag beginn… [+942 chars]",,de,'ÖPNV'
https://www.stern.de/gesellschaft/regional/mecklenburg-vorpommern/tarifkonflikt--wieder-warnstreiks-im-oepnv---bis-zu-85-prozent-steht-still-35513122.html,https://www.stern.de/gesellschaft/regional/mecklenburg-vorpommern/tarifkonflikt--wieder-warnstreiks-im-oepnv---bis-zu-85-prozent-steht-still-35513122.html,0,www.stern.de,Tarifkonflikt: Wieder Warnstreiks im ÖPNV - bis zu 85 Prozent steht still,"Zum wiederholten Male müssen Pendler, Schüler und andere Nutzer des ÖPNV Geduld aufbringen. In MV sind erneut Warnstreiks angesagt. Der Blick richtet sich auf den Donnerstag.",https://image.stern.de/35513124/t/Mz/v1/w1440/r1.7778/-/03--kpncum6h66v5axs2048jpeg---5b2d6a1499785420.jpg,2025-03-03T06:38:45Z,,"Kopiere den aktuellen Link
Zur Merkliste hinzufügen
Zum wiederholten Male müssen Pendler, Schüler und andere Nutzer des ÖPNV Geduld aufbringen. In MV sind erneut Warnstreiks angesagt. Der Blick ric… [+1333 chars]",,de,'ÖPNV'
