index,url,valid,domain,title,description,image,published,archive,content,quote,language,keyword
https://www.focus.de/politik/heizungs_id_198083345.html,https://www.focus.de/politik/heizungs_id_198083345.html,0,www.focus.de,Liveticker - Im Ausschuss diskutieren Experten über das umstrittene Heizungsgesetz,In dieser Woche soll das sogenannte Heizungsgesetz im Bundestag beschlossen werden. Den Auftakt der Beratungen bildet am heutigen Montag (13.30 Uhr) eine Anhörung im Klima- und Energieausschuss zur Änderung des Gebäudeenergiegesetzes (GEG). Alle Infos im Live…,https://p6.focus.de/img/fotos/id_198093416/unbenannt.jpg?im=Crop%3D%280%2C6%2C533%2C266%29%3BResize%3D%281200%2C627%29&impolicy=perceptual&quality=mediumHigh&hash=a7dfc2025b6e356313649ab602e8b548d56ace22ddcd765fda3498e3bbf5a494,2023-07-03T11:24:49Z,,Die Linke fordert eine Verschiebung der Abstimmung im Bundestag über das umstrittene Heizungsgesetz bis nach der Sommerpause des Parlaments. Die Bundesregierung sollte die Verabschiedung des Heizgese… [+1353 chars],,de,'Heizung'
https://www.faz.net/bewaesserung-von-aeckern-dilemma-zwischen-duerre-und-wasserknappheit-19007233.html,https://www.faz.net/bewaesserung-von-aeckern-dilemma-zwischen-duerre-und-wasserknappheit-19007233.html,0,www.faz.net,Die Bewässerung von Äckern: Das Dilemma zwischen Dürre und Wasserknappheit,Gut 70 Prozent des genutzten Süßwassers geht auf die Felder. Sparsamkeit ist angesagt. Doch Bewässerungen könnten die Erhitzung lokal abmildern und sogar im Kampf gegen den Klimawandel nützen. Mehr wässern also?,https://media1.faz.net/ppmedia/aktuell/politik/3753602727/1.9007287/facebook_teaser/ein-maisfeld-in-niedersachsen.jpg,2023-07-03T11:46:13Z,https://web.archive.org/web/20230707093045/https://www.faz.net/bewaesserung-von-aeckern-dilemma-zwischen-duerre-und-wasserknappheit-19007233.html,"Ackerböden werden an vielen Orten immer trockener, die Pflanzen brauchen mehr Wasser. Zeitgleich wird Wasser knapper. So verkündeten einige Kommunen in Hessen und Brandenburg Einschränkungen bei der … [+3737 chars]",,de,'Bewässerung'
https://www.focus.de/klima/experten/brandenburger-versuchslabor-acker-mit-agroforst-will-benedikt-boesel-die-landwirtschaft-vor-duerre-schuetzen_id_198098741.html,https://www.focus.de/klima/experten/brandenburger-versuchslabor-acker-mit-agroforst-will-benedikt-boesel-die-landwirtschaft-vor-duerre-schuetzen_id_198098741.html,0,www.focus.de,Brandenburger Versuchslabor: Acker - Dürre bedroht Landwirtschaft - Bauer Bösel schützt Böden mit Agroforst,"Klimakrise, Dürresommer - Zukunftssorgen belasten die Landwirtschaft. Gerade in einer der trockensten Regionen Deutschlands will ein Öko-Bauer den Boden retten, er macht Ackerland zum Versuchslabor. Wissenschaftler halten ein Umdenken in der Landwirtschaft fü…",https://p6.focus.de/img/fotos/id_189684504/benedikt-boesel-g-b-v.jpg?im=Crop%3D%280%2C117%2C2045%2C1022%29%3BResize%3D%281200%2C627%29&impolicy=perceptual&quality=mediumHigh&hash=9e127c8a7ac4cfd8f750bb525408670f57e0190e230fce8a48f6536388397900,2023-07-03T13:43:28Z,,"Klimakrise, Dürresommer - Zukunftssorgen belasten die Landwirtschaft. Gerade in einer der trockensten Regionen Deutschlands will ein Öko-Bauer den Boden retten, er macht Ackerland zum Versuchslabor. … [+6165 chars]",,de,'Dürre'
https://www.telepolis.de/features/Heizungsgesetz-der-Ampel-teuer-klimaschaedlich-Dauerbaustelle-9206024.html,https://www.telepolis.de/features/Heizungsgesetz-der-Ampel-teuer-klimaschaedlich-Dauerbaustelle-9206024.html,0,www.telepolis.de,"Heizungsgesetz der Ampel – teuer, klimaschädlich, Dauerbaustelle?",Nicht nur vor der Verfehlung der Klimaziele im Wärmesektor wird gewarnt – auch ungeahnte Kosten könnten auf Verbraucher zukommen. Schont das Vorhaben weder Klima noch Geldbeutel?,https://heise.cloudimg.io/bound/1200x1200/q85.png-lossy-85.webp-lossy-85.foil1/_www-heise-de_/imgs/18/4/2/6/5/7/0/9/heizung-kalt_ho-129dc06cf2cc627f.jpeg,2023-07-03T14:00:00Z,https://web.archive.org/web/20230703154038/https://www.telepolis.de/features/Heizungsgesetz-der-Ampel-teuer-klimaschaedlich-Dauerbaustelle-9206024.html,"Nicht nur vor der Verfehlung der Klimaziele im Wärmesektor wird gewarnt auch ungeahnte Kosten könnten auf Verbraucher zukommen. Schont das Vorhaben weder Klima noch Geldbeutel?
Vor der Expertenanhör… [+3194 chars]",,de,'Heizung'
https://www.sueddeutsche.de/wirtschaft/heizungsgesetz-daemmen-waermepumpe-1.5983646,https://www.sueddeutsche.de/wirtschaft/heizungsgesetz-daemmen-waermepumpe-1.5983646,0,www.sueddeutsche.de,Heizungsgesetz: Und jetzt auch noch dämmen?,"Erst eine teure, neue Heizung und nun noch das Haus sanieren? Keine Panik, sagen Experten. Der Aufwand ist oft überschaubar. Was man tun sollte, was es bringt - und was das Ganze kostet.",https://www.sueddeutsche.de/image/sz.1.5993699/1200x675?v=1688392803,2023-07-03T15:00:57Z,http://archive.md/20230704110207/https://www.sueddeutsche.de/wirtschaft/heizungsgesetz-daemmen-waermepumpe-1.5983646,"Erst eine teure, neue Heizung und nun noch das Haus sanieren? Keine Panik, sagen Experten. Der Aufwand ist oft überschaubar. Was man tun sollte, was es bringt - und was das Ganze kostet.Da erscheint … [+568 chars]",,de,'Heizung'
https://www.n-tv.de/politik/Experten-Auch-neues-Heizungsgesetz-voller-Kostenfallen-article24233638.html,https://www.n-tv.de/politik/Experten-Auch-neues-Heizungsgesetz-voller-Kostenfallen-article24233638.html,0,www.n-tv.de,Anhörung im Bundestag: Experten: Auch neues Heizungsgesetz voller Kostenfallen,"Kurz vor der geplanten Verabschiedung des Heizungsgesetzes kommen noch einmal die Experten zu Wort. In der Anhörung des zuständigen Bundestagsausschusses gibt es zwar durchaus Lob für Verbesserungen, doch sowohl Eigentümer als auch Mieter-Vertreter warnen vor…",https://bilder2.n-tv.de/img/incoming/crop24234801/0801329093-cImg_16_9-w1200/410083765.jpg,2023-07-03T15:36:56Z,,"Kurz vor der geplanten Verabschiedung des Heizungsgesetzes kommen noch einmal die Experten zu Wort. In der Anhörung des zuständigen Bundestagsausschusses gibt es zwar durchaus Lob für Verbesserungen,… [+6874 chars]",,de,'Heizung'
https://www.sueddeutsche.de/politik/anhoerung-geg-bundestag-1.5993826,https://www.sueddeutsche.de/politik/anhoerung-geg-bundestag-1.5993826,0,www.sueddeutsche.de,Gebäudeenergiegesetz: Erste allgemeine Abkühlung,"Nur ein Wochenende lang konnten Experten und Verbände die Details des Heizungsgesetzes studieren. Wenig Zeit - aber für die meisten genug, sich mit dem Kompromiss anzufreunden.",https://www.sueddeutsche.de/image/sz.1.5993827/1200x675?v=1688399093,2023-07-03T15:44:58Z,https://web.archive.org/web/20230703165214/https://www.sueddeutsche.de/politik/anhoerung-geg-bundestag-1.5993826,"Nur ein Wochenende lang konnten Experten und Verbände die Details des Heizungsgesetzes studieren. Wenig Zeit - aber für die meisten genug, sich mit dem Kompromiss anzufreunden.Die Anhörung im Bundest… [+3184 chars]",,de,'Heizung'
https://www.focus.de/politik/deutschland/analyse-zum-gebaeudeenergiegesetz-experten-anhoerung-entbloesst-habecks-heizungsgesetz-als-unfertiges-stueckwerk_id_198084969.html,https://www.focus.de/politik/deutschland/analyse-zum-gebaeudeenergiegesetz-experten-anhoerung-entbloesst-habecks-heizungsgesetz-als-unfertiges-stueckwerk_id_198084969.html,0,www.focus.de,Analyse zum Gebäudeenergiegesetz - Experten-Anhörung entblößt Habecks Heizungsgesetz als unfertiges Stückwerk,"Nach der Expertenanhörung zum Gebäudeenergiegesetz bleiben viele Fragen weiter offen. Unklar ist, ob sich von den Experten überhaupt etwas im GEG findet. Denn die Zeit drängt, soll das Heizungsgesetz tatsächlich bis Freitag vom Bundestag verabschiedet werden.…",https://p6.focus.de/img/fotos/id_198109750/habeck1.jpg?im=Crop%3D%280%2C361%2C3464%2C1732%29%3BResize%3D%281200%2C627%29&impolicy=perceptual&quality=mediumHigh&hash=f2519fc273e790f24c1a79a5723cd097fb4ec5fd6d985d9dfeb7e685020909d2,2023-07-03T15:52:32Z,https://web.archive.org/web/20230703170812/https://www.focus.de/politik/deutschland/analyse-zum-gebaeudeenergiegesetz-experten-anhoerung-entbloesst-habecks-heizungsgesetz-als-unfertiges-stueckwerk_id_198084969.html,"<ul><li>
Kommentare</li><li>
E-Mail</li><li>
Teilen</li><li>
Mehr</li><li>
Twitter</li><li>
Drucken</li><li>
Feedback</li><li>
Fehler meldenSie haben einen Fehler gefunden?
Bitte markieren S… [+6134 chars]",,de,'Heizung'
https://www.welt.de/wirtschaft/article246201670/GEG-Die-Abstimmung-diese-Woche-muss-abgeblasen-werden.html,https://www.welt.de/wirtschaft/article246201670/GEG-Die-Abstimmung-diese-Woche-muss-abgeblasen-werden.html,0,www.welt.de,Massive Mängel im Heizgesetz? „Die Abstimmung diese Woche muss abgeblasen werden“,"Bei der Experten-Befragung im Bundestagsausschuss für Energie und Klima zeigt das Heizungsgesetz weiterhin Lücken. Die Opposition fordert indes eine Verschiebung der Abstimmung. Und bei Verbänden gibt es Zweifel, ob die eingebrachte Kritik überhaupt noch berü…",https://img.welt.de/img/wirtschaft/mobile246203432/8601356247-ci16x9-w1200/Debatte-zur-Fachkraefteeinwanderung.jpg,2023-07-03T17:27:18Z,https://web.archive.org/web/20230703173408/https://www.welt.de/wirtschaft/article246201670/GEG-Die-Abstimmung-diese-Woche-muss-abgeblasen-werden.html,"Vor der geplanten Verabschiedung des umstrittenen Heizungsgesetzes am Mittwoch hat eine Expertenanhörung weitere, zum Teil gravierende Regelungslücken festgestellt.
So betonten die kommunalen Spitze… [+4478 chars]",,de,'Heizung'
https://www.n-tv.de/politik/So-kostet-eine-Waermepumpe-nicht-mehr-als-eine-Gasheizung-article24234512.html,https://www.n-tv.de/politik/So-kostet-eine-Waermepumpe-nicht-mehr-als-eine-Gasheizung-article24234512.html,0,www.n-tv.de,Vorschlag für ein Förderkonzept: So kostet eine Wärmepumpe nicht mehr als eine Gasheizung,"Der Wirtschaftswissenschaftler Sebastian Dullien hat ein Konzept entwickelt, mit dem der Einbau einer Wärmepumpe nicht teurer wäre als eine Gasheizung - und auch den öffentlichen Haushalten würden keine Kosten entstehen.",https://bilder3.n-tv.de/img/incoming/crop24234502/4661326909-cImg_16_9-w1200/imago0262256553h.jpg,2023-07-03T18:06:59Z,,"Der Wirtschaftswissenschaftler Sebastian Dullien hat ein Konzept entwickelt, mit dem der Einbau einer Wärmepumpe nicht teurer wäre als eine neue Gasheizung - und auch den öffentlichen Haushalten würd… [+8019 chars]",,de,'Gas'
https://www.zeit.de/wirtschaft/2023-06/duerre-landwirtschaft-wassermangel-unterfranken,https://www.zeit.de/wirtschaft/2023-06/duerre-landwirtschaft-wassermangel-unterfranken,0,www.zeit.de,Dürre in der Landwirtschaft: Die Wasserschlacht,"Manipulierte Wasseruhren und Brunnenkontrollen: In Franken eskaliert ein Streit zwischen Bauern und Bürgern ums Grundwasser. Ein Verteilungskampf, der vielerorts droht.",,2023-07-03T18:30:25Z,http://archive.md/20230703183229/https://www.zeit.de/wirtschaft/2023-06/duerre-landwirtschaft-wassermangel-unterfranken,"When browsing with ads:
We collect personal data and also transmit it to third-party providers
 that help us improve and finance our digital content. Some of the information stored on your device, … [+821 chars]",,de,'Landwirtschaft'
https://www.morgenpost.de/politik/article238854491/heizungsgesetz-anhoerung-habeck-gebaeudeenergiegesetz-bundestag-geg.html,https://www.morgenpost.de/politik/article238854491/heizungsgesetz-anhoerung-habeck-gebaeudeenergiegesetz-bundestag-geg.html,0,www.morgenpost.de,Wärmewende: Heizungsgesetz: An diese vier Punkte muss die Ampel nun ran,Das Heizungsgesetz wird überarbeitet. Doch Experten bemängeln weitere Punkte. Wo die Ampel-Koalition jetzt Hausaufgaben bekommen hat.,https://img.morgenpost.de/img/frontpage/crop238854569/0762605625-w820-cv16_9-q85/5FADB400E1DB8874.jpg,2023-07-03T19:01:06Z,https://web.archive.org/web/20230703194010/https://www.morgenpost.de/politik/article238854491/heizungsgesetz-anhoerung-habeck-gebaeudeenergiegesetz-bundestag-geg.html,Berlin.  Befriedigend lautet das Urteil der Experten über die Arbeit der Bundesregierung nach viermonatigen Verhandlungen zum Heizungsgesetz. Anfang März war der Entwurf zum Gebäudeenergiegesetz (GEG… [+3754 chars],,de,'Heizung'
https://orf.at/stories/3322609/,https://orf.at/stories/3322609/,0,orf.at,Landwirtschaft: Biodiversität rechnet sich nicht immer,,https://orf.at/mojo/1_4_1/storyserver//news/common/images/og-fallback-news.png,2023-07-03T19:38:48Z,https://web.archive.org/web/20230703194947/https://orf.at/stories/3322609/,Maßnahmen für eine nachhaltigere Landwirtschaft können die Anzahl und Vielfalt von Wildbienenarten im Grünland erhöhen und so die Bestäubung und Ernteerträge in benachbarten Feldern steigern. Wirtsch… [+165 chars],,de,'Landwirtschaft'
https://www.morgenpost.de/ratgeber/article238848673/heizung-2024-eigentuemer-wasserstoff-kosten-biomasse-experte.html,https://www.morgenpost.de/ratgeber/article238848673/heizung-2024-eigentuemer-wasserstoff-kosten-biomasse-experte.html,0,www.morgenpost.de,An Betriebskosten denken: Experte warnt vor H2-Heizung: Alternative ist viel günstiger,"Die Gasheizung mit Biomasse oder Wasserstoff nutzen – Experten raten davon ab. Vor welchen Kosten Eigentümer stehen und was für Risiken es gibt, lesen Sie hier.",https://img.morgenpost.de/img/frontpage/crop238848965/0562603474-w820-cv16_9-q85/Heizen-mit-H2-Eine-Erzeugungsanlage-fuer-Wasserstoff.jpg,2023-07-03T19:50:16Z,https://web.archive.org/web/20230703213923/https://www.morgenpost.de/ratgeber/article238848673/heizung-2024-eigentuemer-wasserstoff-kosten-biomasse-experte.html,Berlin. Weg von fossilen Brennstoffen wie Heizöl oder Gas und in Zukunft stattdessen auf erneuerbare Energien setzen das ehrgeizige Ziel: Deutschland soll bis 2045 klimaneutral werden. Ein elementare… [+8081 chars],,de,'Heizung'
https://www.zeit.de/news/2023-07/04/erdnuss-sesam-reis-vielfalt-in-landwirtschaft,https://www.zeit.de/news/2023-07/04/erdnuss-sesam-reis-vielfalt-in-landwirtschaft,0,www.zeit.de,"Agrar: Erdnuss, Sesam, Reis: Vielfalt in Landwirtschaft",,,2023-07-04T03:28:22Z,,"When browsing with ads:
We collect personal data and also transmit it to third-party providers
 that help us improve and finance our digital content. Some of the information stored on your device, … [+821 chars]",,de,'Landwirtschaft'
https://www.nzz.ch/wirtschaft/dem-texanischen-stromnetz-droht-der-hitzeschock-ein-symptom-fuer-die-fragile-us-infrastruktur-ld.1744688,https://www.nzz.ch/wirtschaft/dem-texanischen-stromnetz-droht-der-hitzeschock-ein-symptom-fuer-die-fragile-us-infrastruktur-ld.1744688,0,www.nzz.ch,Dem texanischen Stromnetz droht der Hitzeschock – ein Symptom für die fragile US-Infrastruktur,"Vor zwei Jahren wegen Kälte eingefroren, nun droht in der Sommerhitze wegen der Klimaanlagen der Kollaps. Texas legt offen, wie dürftig das amerikanische Stromnetz auf den Klimawandel, die erneuerbaren Energien und die Elektrifizierung vorbereitet ist.","https://img.nzz.ch/2023/06/30/bf7f0e01-eb88-45ca-a0fe-37ea8e650b1d.jpeg?width=1200&height=675&fit=bound&quality=75&auto=webp&crop=3200,1800,x296,y172&wmark=nzz",2023-07-04T03:30:00Z,,Hitze pur in Texas ist es für diese Jahreszeit ungewöhnlich heiss. Tatsächlich hat eine gefährliche Hitzewelle die Temperaturen seit drei Wochen von Mexiko bis in die Region Dallas-Fort Worth auf bis… [+319 chars],,de,'Kälte'
https://www.focus.de/finanzen/news/habecks-heizungsgesetz-beschert-ausgerechnet-waermepumpen-dieben-hochkonjunktur_id_198109418.html,https://www.focus.de/finanzen/news/habecks-heizungsgesetz-beschert-ausgerechnet-waermepumpen-dieben-hochkonjunktur_id_198109418.html,0,www.focus.de,Wohngebäudeversicherung greift nicht automatisch - Habecks Heizungsgesetz beschert ausgerechnet Wärmepumpen-Dieben Hochkonjunktur,"Solarmodule und Wärmepumpen werden zum Lieblingsobjekt für Diebe. Meist ungeschützt außen montiert, lassen sie sich verhältnismäßig einfach klauen. Für Besitzer dann besonders ärgerlich: Die Versicherung ersetzt den Schaden nur in seltenen Fällen, wenn es nic…",https://p6.focus.de/img/fotos/id_198109419/waermepumpe-handwerker-fin-vt.jpg?im=Crop%3D%280%2C465%2C2828%2C1414%29%3BResize%3D%281200%2C627%29&impolicy=perceptual&quality=mediumHigh&hash=d48e48ea4fd5959fcb9d30f0c491956eb8e25215a16357c841b378036bf0b323,2023-07-04T04:49:03Z,https://web.archive.org/web/20230704080618/https://www.focus.de/finanzen/news/habecks-heizungsgesetz-beschert-ausgerechnet-waermepumpen-dieben-hochkonjunktur_id_198109418.html,"Solarmodule und Wärmepumpen werden zum Lieblingsobjekt für Diebe. Meist ungeschützt außen montiert, lassen sie sich verhältnismäßig einfach klauen. Für Besitzer dann besonders ärgerlich: Die Versiche… [+5210 chars]",,de,'Heizung'
https://www.n-tv.de/mediathek/videos/ratgeber/Muss-Heizung-trotz-kleiner-Rente-gewechselt-werden-article24230672.html,https://www.n-tv.de/mediathek/videos/ratgeber/Muss-Heizung-trotz-kleiner-Rente-gewechselt-werden-article24230672.html,0,www.n-tv.de,Zuschauer fragen Experten: Muss Heizung trotz kleiner Rente gewechselt werden?,"Der Energiepreis-Schock durch den Ukraine-Krieg macht klar: Der Umstieg auf Erneuerbare ist ebenso dringend, wie er aufwendig und teuer wird. Sandra Duy, Expertin für energetische Sanierung bei ""Finanztip"", beantwortet dazu drängende Fragen. Wenn auch Sie Anl…",https://bilder3.n-tv.de/img/incoming/crop24232686/4751323990-cImg_16_9-w1200/319216589.jpg,2023-07-04T08:03:48Z,https://web.archive.org/web/20230709035211/https://www.n-tv.de/mediathek/videos/ratgeber/Muss-Heizung-trotz-kleiner-Rente-gewechselt-werden-article24230672.html,,,de,'Heizung'
https://consent.google.com/ml?continue=https://news.google.com/rss/articles/CBMicWh0dHBzOi8vd3d3LmFncmFyaGV1dGUuY29tL21hcmt0L21hcmt0ZnJ1ZWNodGUvZ2V0cmVpZGVlcm50ZS0yMDIzLXNjaHJ1bXBmdC13ZWdlbi1kdWVycmUtc2NoYWVkZW4tZGV1dGxpY2gtNjA4NjE00gEA?oc%3D5&gl=FR&hl=en-US&cm=2&pc=n&src=1,https://consent.google.com/ml?continue=https://news.google.com/rss/articles/CBMicWh0dHBzOi8vd3d3LmFncmFyaGV1dGUuY29tL21hcmt0L21hcmt0ZnJ1ZWNodGUvZ2V0cmVpZGVlcm50ZS0yMDIzLXNjaHJ1bXBmdC13ZWdlbi1kdWVycmUtc2NoYWVkZW4tZGV1dGxpY2gtNjA4NjE00gEA?oc%3D5&gl=FR&hl=en-US&cm=2&pc=n&src=1,0,consent.google.com,Getreideernte 2023 schrumpft wegen Dürre – Schäden sind deutlich - agrarheute.com,"<ol><li>Getreideernte 2023 schrumpft wegen Dürre – Schäden sind deutlich  agrarheute.com
</li><li>Agrar - Bauernverband gibt erste Ernteprognose ab  Nordbayerischer Kurier
</li><li>Mehr zum Thema ansehen in Google News</li></ol>",,2023-07-04T09:30:12Z,,"We use cookies and data to<ul><li>Deliver and maintain Google services</li><li>Track outages and protect against spam, fraud, and abuse</li><li>Measure audience engagement and site statistics to unde… [+1131 chars]",,de,'Dürre'
https://www.n-tv.de/wissen/Wetterphaenomen-El-Nino-ist-zurueck-bleibt-das-gesamte-Jahr-article24236236.html,https://www.n-tv.de/wissen/Wetterphaenomen-El-Nino-ist-zurueck-bleibt-das-gesamte-Jahr-article24236236.html,0,www.n-tv.de,Hitzerekorde und Extremwetter: Wetterphänomen El Niño ist zurück - bleibt das gesamte Jahr,"Weltweit treibt der Klimawandel die Temperaturen in die Höhe. Das derzeit auftretende Wetterphänomen El Niño kann die Gefahr von Extremwettern zusätzlich befeuern und für Dürre, Hitze oder Überschwemmungen sorgen. UN-Experten halten die Regierungen weltweit d…",https://bilder3.n-tv.de/img/incoming/crop24236298/0851328310-cImg_16_9-w1200/2009-03-19T000000Z-50162838-GM1E53J1FHB01-RTRMADP-3-DEADSEA-WONDER.jpg,2023-07-04T10:32:53Z,,"Weltweit treibt der Klimawandel die Temperaturen in die Höhe. Das derzeit auftretende Wetterphänomen El Niño kann die Gefahr von Extremwettern zusätzlich befeuern und für Dürre, Hitze oder Überschwem… [+2160 chars]",,de,'Dürre'
https://www.handelsblatt.com/politik/deutschland/geg-diese-kosten-kommen-auf-eigentuemer-zu/29234314.html,https://www.handelsblatt.com/politik/deutschland/geg-diese-kosten-kommen-auf-eigentuemer-zu/29234314.html,0,www.handelsblatt.com,Wärmewende: Das neue Heizungsgesetz – mit diesen Kosten müssen Eigentümer rechnen,Die Wärmepumpe wird künftig in vielen Fällen alte Gas- und Ölheizungen ersetzen. Mit welchen Kosten müssen Immobilieneigentümer rechnen? Ein Blick in die Praxis.,https://www.handelsblatt.com/images/pruefung-der-oelheizung/29235150/4-format2003.jpg,2023-07-04T11:19:52Z,https://web.archive.org/web/20230705192106/https://www.handelsblatt.com/politik/deutschland/geg-diese-kosten-kommen-auf-eigentuemer-zu/29234314.html,"Prüfung der ÖlheizungFunktionierende Heizungen müssen nicht ausgetauscht werden, doch 2024 soll die Förderung deutlich ansteigen. 
(Foto: dpa)
Berlin Mit der Novelle des Gebäudeenergiegesetzes (GEG… [+1225 chars]",,de,'Heizung'
https://www.morgenpost.de/berlin/article238858757/Brandenburg-enthaelt-sich-im-Bundesrat-zum-Heizungsgesetz.html,https://www.morgenpost.de/berlin/article238858757/Brandenburg-enthaelt-sich-im-Bundesrat-zum-Heizungsgesetz.html,0,www.morgenpost.de,Energie: Brandenburg enthält sich im Bundesrat zum Heizungsgesetz,"Das rot-schwarz-grün regierte Land Brandenburg wird sich im Bundesrat bei der Abstimmung über das Heizungsgesetz enthalten. CDU-Landes- und Fraktionschef Jan Redmann sagte am Dienstag in Potsdam: „Die CDU wird nicht zustimmen, sodass sich Brandenburg im Bunde…",https://img.morgenpost.de/img/berlin/crop238858755/2202604239-w820-cv16_9-q85/Thermostat-an-einer-Heizung.jpg,2023-07-04T11:42:47Z,https://web.archive.org/web/20230704132143/https://www.morgenpost.de/berlin/article238858757/Brandenburg-enthaelt-sich-im-Bundesrat-zum-Heizungsgesetz.html,Potsdam (dpa/bb). Das rot-schwarz-grün regierte Land Brandenburg wird sich im Bundesrat bei der Abstimmung über das Heizungsgesetz enthalten. CDU-Landes- und Fraktionschef Jan Redmann sagte am Dienst… [+1239 chars],,de,'Heizung'
https://www.stern.de/gesellschaft/regional/berlin-brandenburg/energie--brandenburg-enthaelt-sich-im-bundesrat-zum-heizungsgesetz-33618390.html,https://www.stern.de/gesellschaft/regional/berlin-brandenburg/energie--brandenburg-enthaelt-sich-im-bundesrat-zum-heizungsgesetz-33618390.html,0,www.stern.de,Energie: Brandenburg enthält sich im Bundesrat zum Heizungsgesetz,"Das rot-schwarz-grün regierte Land Brandenburg wird sich im Bundesrat bei der Abstimmung über das Heizungsgesetz enthalten. CDU-Landes- und Fraktionschef Jan Redmann sagte am Dienstag in Potsdam: ""Die CDU wird nicht zustimmen, sodass sich Brandenburg im Bunde…",https://image.stern.de/33618392/t/os/v1/w1440/r1.7778/-/04--urnnewsmldpacom2009010123070499281028v2w800h600l930t378r2413b1415jpeg---ecd0f0904212d294.jpg,2023-07-04T11:42:47Z,https://web.archive.org/web/20230704122448/https://www.stern.de/gesellschaft/regional/berlin-brandenburg/energie--brandenburg-enthaelt-sich-im-bundesrat-zum-heizungsgesetz-33618390.html,"Das rot-schwarz-grün regierte Land Brandenburg wird sich im Bundesrat bei der Abstimmung über das Heizungsgesetz enthalten. CDU-Landes- und Fraktionschef Jan Redmann sagte am Dienstag in Potsdam: ""Di… [+1814 chars]",,de,'Heizung'
https://www.tagesspiegel.de/potsdam/brandenburg/abstimmung-uber-heizungsgesetz-brandenburg-will-sich-enthalten-10091329.html,https://www.tagesspiegel.de/potsdam/brandenburg/abstimmung-uber-heizungsgesetz-brandenburg-will-sich-enthalten-10091329.html,0,www.tagesspiegel.de,Abstimmung über Heizungsgesetz: Brandenburg will sich enthalten,"CDU-Landeschef Jan Redmann kritisierte, die Bundesregierung hätte eher mit Anreizen als mit Verboten arbeiten sollen. Das Gesetz soll am Donnerstag im Bundesrat beschlossen werden.",https://www.tagesspiegel.de/images/warmepumpen1/alternates/BASE_16_9_W1400/waermepumpen.jpeg,2023-07-04T12:13:32Z,https://web.archive.org/web/20230704125612/https://www.tagesspiegel.de/potsdam/brandenburg/abstimmung-uber-heizungsgesetz-brandenburg-will-sich-enthalten-10091329.html,Das Land Brandenburg wird sich bei der Abstimmung über das Gebäudeenergiegesetz von Bundeswirtschaftsminister Robert Habeck (Grüne) im Bundesrat enthalten. Das kündigte CDU-Fraktionschef Jan Redmann … [+1869 chars],,de,'Heizung'
https://www.welt.de/wissenschaft/article246215432/Wetterphaenomen-2023-wird-ein-El-Nino-Jahr-mit-Folgen.html,https://www.welt.de/wissenschaft/article246215432/Wetterphaenomen-2023-wird-ein-El-Nino-Jahr-mit-Folgen.html,0,www.welt.de,2023 wird ein El-Niño-Jahr mit Folgen,"Jetzt steht es fest: Das Wetterphänomen El Niño bahnt sich im tropischen Pazifik an. Es kann überall auf der Welt zu mehr Dürren, mehr Überschwemmungen, mehr Hitze führen. Lesen Sie hier, was die Forschung weiß – und wann ein Super-El-Niño droht.",https://img.welt.de/img/wissenschaft/mobile246215428/9581358337-ci16x9-w1200/EXPLAINER-Why-El-Nino-is-a-concern-for-Indian-monsoon-rains.jpg,2023-07-04T13:01:11Z,,"In der menschengemachten Klimakrise steigt die globale Durchschnittstemperatur unaufhörlich. Das heißeste Jahr seit Beginn der Industrialisierung war 2016, und das ist kein Zufall: Zusätzlich zum lan… [+6102 chars]",,de,'Dürre'
