index,url,valid,domain,title,description,image,published,archive,content,quote,language,keyword
https://www.zeit.de/news/2023-01/01/kirche-menschen-in-not-staerker-in-den-blick-nehmen,https://www.zeit.de/news/2023-01/01/kirche-menschen-in-not-staerker-in-den-blick-nehmen,0,www.zeit.de,Jahreswechsel: Kirche: Menschen in Not stärker in den Blick nehmen,,,2023-01-01T14:04:50Z,,"When browsing with ads:
We collect personal data and also transmit it to third-party providers
 that help us improve and finance our digital content. Some of the information stored on your device, … [+732 chars]",,de,'Not'
https://www.stern.de/gesellschaft/regional/rheinland-pfalz-saarland/jahreswechsel--kirche--menschen-in-not-staerker-in-den-blick-nehmen-33058934.html,https://www.stern.de/gesellschaft/regional/rheinland-pfalz-saarland/jahreswechsel--kirche--menschen-in-not-staerker-in-den-blick-nehmen-33058934.html,0,www.stern.de,Jahreswechsel: Kirche: Menschen in Not stärker in den Blick nehmen,"Die stellvertretende Kirchenpräsidentin der Evangelischen Kirche in Hessen und Nassau (EKHN), Ulrike Scherf, hat zum Jahreswechsel dazu aufgerufen, Menschen in Not stärker in den Blick zu nehmen. Besondere Aufmerksamkeit bräuchten derzeit unter anderem Geflüc…",https://image.stern.de/6681672/t/31/v5/w1440/r1.7778/-/video-fallback-image.jpg,2023-01-01T14:04:50Z,,"Die stellvertretende Kirchenpräsidentin der Evangelischen Kirche in Hessen und Nassau (EKHN), Ulrike Scherf, hat zum Jahreswechsel dazu aufgerufen, Menschen in Not stärker in den Blick zu nehmen. Bes… [+1321 chars]",,de,'Not'
https://www.sueddeutsche.de/kultur/1923-peter-longerich-volker-ullrich-peter-reichel-weimarer-republik-1.5722470,https://www.sueddeutsche.de/kultur/1923-peter-longerich-volker-ullrich-peter-reichel-weimarer-republik-1.5722470,0,www.sueddeutsche.de,Das Jahr 1923: Als die Republik sich behauptet hat,"Hyperinflation, Not und Putschversuche erschütterten 1923 die erste deutsche Demokratie. Drei neue Bücher erzählen die Geschichte eines schicksalhaften Jahres.",https://www.sueddeutsche.de/image/sz.1.5722471/1200x675?v=1672575056,2023-01-01T16:05:18Z,,"Hyperinflation, Not und Putschversuche erschütterten 1923 die erste deutsche Demokratie. Drei neue Bücher erzählen die Geschichte eines schicksalhaften Jahres.In seiner Weihnachtsbotschaft an das deu… [+454 chars]",,de,'Not'
https://www.zeit.de/news/2023-01/02/steigende-papier-und-energiekosten-buecher-werden-teurer,https://www.zeit.de/news/2023-01/02/steigende-papier-und-energiekosten-buecher-werden-teurer,0,www.zeit.de,Literatur: Steigende Papier- und Energiekosten: Bücher werden teurer,,,2023-01-02T08:17:46Z,,"When browsing with ads:
We collect personal data and also transmit it to third-party providers
 that help us improve and finance our digital content. Some of the information stored on your device, … [+732 chars]",,de,'Energiekosten'
https://www.tagesspiegel.de/kultur/obdachlosigkeit-und-wie-architektur-helfen-kann-erst-das-wohnen-dann-die-fursorge-9100738.html,https://www.tagesspiegel.de/kultur/obdachlosigkeit-und-wie-architektur-helfen-kann-erst-das-wohnen-dann-die-fursorge-9100738.html,0,www.tagesspiegel.de,"Obdachlosigkeit und wie Architektur helfen kann: Erst das Wohnen, dann die Fürsorge",Die Not vor der Tür: Das Hamburger Museum für Kunst und Gewerbe mitten im Problembezirk St. Georg macht mit einer Ausstellung konkrete Gegenvorschläge.,https://www.tagesspiegel.de/kultur/images/mkgwhosnextsan-francisco-tents--christopher-micheljpg/alternates/BASE_16_9_W1400/mkgwhosnextsan-francisco-tents--christopher-micheljpg.jpeg,2023-01-02T10:38:33Z,https://web.archive.org/web/20230102110845/https://www.tagesspiegel.de/kultur/obdachlosigkeit-und-wie-architektur-helfen-kann-erst-das-wohnen-dann-die-fursorge-9100738.html,"Wer im Hamburger Museum für Kunst und Gewerbe die Treppe ins zweite Obergeschoss zur Ausstellung Whos next? Obdachlosigkeit, Architektur und die Stadt hochläuft, der muss erst einmal unter 43 Schlafs… [+6391 chars]",,de,'Not'
https://www.stern.de/gesellschaft/regional/berlin-brandenburg/gesundheit--berlin-und-brandenburg--maskenpflicht-im-oepnv-februar-kippen-33065544.html,https://www.stern.de/gesellschaft/regional/berlin-brandenburg/gesundheit--berlin-und-brandenburg--maskenpflicht-im-oepnv-februar-kippen-33065544.html,0,www.stern.de,Gesundheit: Berlin und Brandenburg: Maskenpflicht im ÖPNV Februar kippen,In drei Bundesländern ist die Maske zum Schutz vor Corona in Bus und Bahn im Nahverkehr bereits abgeschafft. Nun könnten im Februar zwei Länder hinzukommen. Beschlossene Sache ist das aber noch nicht.,https://image.stern.de/33065546/t/_M/v2/w1440/r1.7778/-/03--urnnewsmldpacom200901012301039991961v2w800h600l1838t689r5216b4808jpeg---5312eaa4dea65b0b.jpg,2023-01-03T17:12:17Z,https://web.archive.org/web/20230103172738/https://www.stern.de/gesellschaft/regional/berlin-brandenburg/gesundheit--berlin-und-brandenburg--maskenpflicht-im-oepnv-februar-kippen-33065544.html,In drei Bundesländern ist die Maske zum Schutz vor Corona in Bus und Bahn im Nahverkehr bereits abgeschafft. Nun könnten im Februar zwei Länder hinzukommen. Beschlossene Sache ist das aber noch nicht… [+3138 chars],,de,'ÖPNV'
https://www.zeit.de/politik/deutschland/2023-01/corona-massnahmen-maskenpflicht-bundeslaender,https://www.zeit.de/politik/deutschland/2023-01/corona-massnahmen-maskenpflicht-bundeslaender,0,www.zeit.de,Corona-Maßnahmen: Mehrheit der Bundesländer hält an Maskenpflicht im ÖPNV fest,"13 Bundesländer wollen bis März an der Maskenpflicht in Bussen und Bahnen festhalten. Nur Schleswig-Holstein, Bayern und Sachsen-Anhalt lockern ihre Corona-Maßnahmen.",,2023-01-03T23:17:51Z,https://web.archive.org/web/20230104000659/https://www.zeit.de/politik/deutschland/2023-01/corona-massnahmen-maskenpflicht-bundeslaender,"When browsing with ads:
We collect personal data and also transmit it to third-party providers
 that help us improve and finance our digital content. Some of the information stored on your device, … [+732 chars]",,de,'ÖPNV'
https://www.welt.de/politik/deutschland/article243014797/Corona-13-Bundeslaender-bleiben-vorerst-bei-Maskenpflicht-im-OEPNV.html,https://www.welt.de/politik/deutschland/article243014797/Corona-13-Bundeslaender-bleiben-vorerst-bei-Maskenpflicht-im-OEPNV.html,0,www.welt.de,13 Bundesländer wollen Maskenpflicht im ÖPNV vorerst beibehalten,"Bisher haben Schleswig-Holstein, Bayern und Sachsen-Anhalt die Maskenpflicht im öffentlichen Nahverkehr abgeschafft. Die anderen Bundesländer möchten sie beibehalten – zumindest in den kommenden Wochen.",https://img.welt.de/img/wirtschaft/mobile225119177/4021354227-ci16x9-w1200/Coronavirus-Berlin.jpg,2023-01-04T01:44:20Z,http://archive.md/20230104072652/https://www.welt.de/politik/deutschland/article243014797/Corona-13-Bundeslaender-bleiben-vorerst-bei-Maskenpflicht-im-OEPNV.html,An der Maskenpflicht im ÖPNV wollen 13 von 16 Bundesländern noch mindestens im Januar und Februar festhalten. Das hat eine Umfrage des Redaktionsnetzwerks Deutschland (RND) unter allen 16 Bundeslände… [+1629 chars],,de,'ÖPNV'
https://www.tagesschau.de/ausland/afrika/aegypten-wirtschaftskrise-101.html,https://www.tagesschau.de/ausland/afrika/aegypten-wirtschaftskrise-101.html,0,www.tagesschau.de,Wirtschaftskrise in Ägypten - nach zehn Jahren Al-Sisi,"Mit Großprojekten versucht Ägyptens Präsident Al-Sisi, seiner autoritären Herrschaft Glanz zu verleihen. Zugleich wird die wirtschaftliche Not im Land immer größer. Führt Al-Sisi sein Land in den Bankrott? <em>Von S. Riesche.</em>",https://www.tagesschau.de/multimedia/bilder/markt-aegypten-105~_v-original.jpg,2023-01-04T05:35:35Z,http://archive.md/20230104190347/https://www.tagesschau.de/ausland/afrika/aegypten-wirtschaftskrise-101.html,"Mit Großprojekten versucht Ägyptens Präsident Al-Sisi, seiner autoritären Herrschaft Glanz zu verleihen. Zugleich wird die wirtschaftliche Not im Land immer größer. Führt Al-Sisi sein Land in den Ban… [+5252 chars]",,de,'Not'
https://www.welt.de/politik/deutschland/video243014999/Corona-Maskenpflicht-im-OEPNV-Viele-Bundeslaender-wollen-an-Regel-festhalten.html,https://www.welt.de/politik/deutschland/video243014999/Corona-Maskenpflicht-im-OEPNV-Viele-Bundeslaender-wollen-an-Regel-festhalten.html,0,www.welt.de,Maskenpflicht im ÖPNV – Viele Bundesländer wollen an Regel festhalten,"Die Maskenpflicht in Bahnen und Bussen soll in 13 von 16 Bundesländern noch mindestens im Januar und Februar gelten. Bisher haben Schleswig-Holstein, Bayern und Sachsen-Anhalt die Maskenpflicht im ÖPNV abgeschafft.",https://img.welt.de/img/politik/deutschland/mobile243015041/1851355877-ci16x9-w1200/Maskenpflicht-in-Bus-und-Bahn-in-Stuttgart.jpg,2023-01-04T05:37:34Z,https://web.archive.org/web/20230104054143/https://www.welt.de/politik/deutschland/video243014999/Corona-Maskenpflicht-im-OEPNV-Viele-Bundeslaender-wollen-an-Regel-festhalten.html,"Die WELT als ePaper: Die vollständige Ausgabe steht Ihnen bereits am Vorabend zur Verfügung so sind Sie immer hochaktuell informiert. Weitere Informationen: http://epaper.welt.de 
 Der Kurz-Link die… [+49 chars]",,de,'ÖPNV'
https://www.tagesschau.de/inland/maskenpflicht-bundeslaender-corona-101.html,https://www.tagesschau.de/inland/maskenpflicht-bundeslaender-corona-101.html,0,www.tagesschau.de,Mehrheit der Bundesländer wollen noch die Maske im ÖPNV,"Schleswig-Holstein, Bayern und Sachsen-Anhalt haben die Maskenpflicht im öffentlichen Nahverkehr schon abgeschafft. Die anderen Bundesländer wollen sie wohl noch beibehalten – zumindest für einige Wochen.",https://www.tagesschau.de/multimedia/bilder/bus-hamburg-passagiere-masken-101~_v-original.jpg,2023-01-04T07:54:18Z,,"Schleswig-Holstein, Bayern und Sachsen-Anhalt haben die Maskenpflicht im öffentlichen Nahverkehr schon abgeschafft. Die anderen Bundesländer wollen sie wohl noch beibehalten zumindest für einige Woch… [+1834 chars]",,de,'ÖPNV'
https://www.morgenpost.de/wirtschaft/article237284721/pelletspreise-heute-aktuell-4-januar-2023-energie-verbraucher-inflation.html,https://www.morgenpost.de/wirtschaft/article237284721/pelletspreise-heute-aktuell-4-januar-2023-energie-verbraucher-inflation.html,0,www.morgenpost.de,Energiekosten: Das sind die aktuellen Pelletspreise heute am 4. Januar,Wie entwickeln sich die Pelletspreise im neuen Jahr? Hier finden Sie die aktuellen Preise pro Tonne Pellets von heute (4. Januar 2022).,https://img.morgenpost.de/img/wirtschaft/crop237240955/2372608-w820-cv16_9-q85/Holz-Holzpellets-Pellets.jpg,2023-01-04T08:58:35Z,https://web.archive.org/web/20230104093809/https://www.morgenpost.de/wirtschaft/article237284721/pelletspreise-heute-aktuell-4-januar-2023-energie-verbraucher-inflation.html,Berlin. 2022 war für viele Pelletskundinnen und -kunden ein teures Jahr: Die Preise sind infolge des Ukraine-Kriegs geradezu explodiert. Statt rund 350 Euro wie zu Beginn des Jahres kostete die Tonne… [+4353 chars],,de,'Energiekosten'
https://www.focus.de/wissen/natur/wissen-umwelt-goldene-zeit-fuer-geothermie_id_182121341.html,https://www.focus.de/wissen/natur/wissen-umwelt-goldene-zeit-fuer-geothermie_id_182121341.html,0,www.focus.de,Umweltfreundliche Gas-Alternative - Goldene Zeit für Geothermie?,Erdgas ist klimaschädlich und seit Russlands Krieg teuer. Erdwärme wäre eine günstige und umweltfreundliche Alternative. Beginnt nun das goldene Zeitalter für Geothermie?,https://p6.focus.de/img/wissen/natur/id_182121320/mit-98-grad-heissem-wasser-aus-2400-metern-tiefe-heizen-ueber-6000-buerger-in-neustadt-glewe-bei-schwerin-ihre-haeuser.jpg?im=Crop%3D%280%2C29%2C940%2C470%29%3BResize%3D%281200%2C627%29&impolicy=perceptual&quality=medium&hash=cc743b99b4f56de29ff66c99cc24803f0feb1cbf32e5f3aac39f641be88f9cf4,2023-01-04T09:10:07Z,https://web.archive.org/web/20230104155444/https://www.focus.de/wissen/natur/wissen-umwelt-goldene-zeit-fuer-geothermie_id_182121341.html,"Seit wann gibt es Geothermie?
In der Mitte unserer Erde ist es so heiß wie auf der Sonne, rund 6000 Grad. 2000 bis 5000 Meter tief unter der Erdoberfläche sind es dann noch 60 bis 200 Grad und in Vu… [+6208 chars]",,de,'Gas'
https://www.n-tv.de/wirtschaft/Bei-Gaspreisen-ein-hoeheres-New-Normal-article23821163.html,https://www.n-tv.de/wirtschaft/Bei-Gaspreisen-ein-hoeheres-New-Normal-article23821163.html,0,www.n-tv.de,"Kerstin Andreae im ""Frühstart"": Bei Gaspreisen ""ein höheres New Normal""","Die Börsenpreise für Gas sind seit einiger Zeit wieder deutlich niedriger, aber die Endkunden spüren davon nichts. Da liegt die Befürchtung nahe, Energieversorger könnten die Preisbremsen ausnutzen, um die Preise hochzuhalten. Die Energielobbyistin Andreae ve…",https://bilder2.n-tv.de/img/incoming/crop23821109/48113231-cImg_16_9-w1200/andreae-fs.jpg,2023-01-04T09:25:48Z,https://web.archive.org/web/20230104093915/https://www.n-tv.de/wirtschaft/Bei-Gaspreisen-ein-hoeheres-New-Normal-article23821163.html,"Die Börsenpreise für Gas sind seit einiger Zeit wieder deutlich niedriger, aber die Endkunden spüren davon nichts. Da liegt die Befürchtung nahe, Energieversorger könnten die Preisbremsen ausnutzen, … [+2976 chars]",,de,'Gas'
https://www.welt.de/politik/deutschland/video243016259/Maskenpflicht-im-OEPNV-Testpflicht-fuer-China-Reisende-Virologe-Prof-Klaus-Stoehr-erklaert.html,https://www.welt.de/politik/deutschland/video243016259/Maskenpflicht-im-OEPNV-Testpflicht-fuer-China-Reisende-Virologe-Prof-Klaus-Stoehr-erklaert.html,0,www.welt.de,"„Maskenpflicht im ÖPNV aufrecht zu erhalten, ergibt überhaupt keinen Sinn“","„Einen großen Unterschied würde das Testen, was den Infektionsdruck in Europa betrifft, nicht machen“, sagt der Virologe Prof. Klaus Stöhr. Im WELT-Interview erklärt er, warum eine Testpflicht für China-Reisende nicht viel bringt und eine Maskenpflicht im ÖPN…",https://img.welt.de/img/newsticker/dpa_nt/infoline_nt/wissenschaft_nt/mobile241162627/2021353557-ci16x9-w1200/Klaus-Stoehr.jpg,2023-01-04T09:39:17Z,https://web.archive.org/web/20230104094413/https://www.welt.de/politik/deutschland/video243016259/Maskenpflicht-im-OEPNV-Testpflicht-fuer-China-Reisende-Virologe-Prof-Klaus-Stoehr-erklaert.html,"Die WELT als ePaper: Die vollständige Ausgabe steht Ihnen bereits am Vorabend zur Verfügung so sind Sie immer hochaktuell informiert. Weitere Informationen: http://epaper.welt.de 
 Der Kurz-Link die… [+49 chars]",,de,'ÖPNV'
https://orf.at/stories/3300063/,https://orf.at/stories/3300063/,0,orf.at,Europäischer Gaspreis: Niedrigster Wert seit Februar 2022,,https://orf.at/mojo/1_4_1/storyserver//news/common/images/og-fallback-news.png,2023-01-04T10:15:54Z,https://web.archive.org/web/20230104101711/https://orf.at/stories/3300063/,Der europäische Gaspreis hat in den ersten Handelstagen des neuen Jahres seine Talfahrt dank ungewöhnlich milder Wintertemperaturen in Europa fortgesetzt. Heute wurde der Terminkontrakt TTF für niede… [+991 chars],,de,'Gas'
"https://www.cio.de/a/deutschland-soll-wasserstoffnetz-bekommen,3702903?utm_source=Seiten_3932&utm_medium=RSS&utm_campaign=RSS-Feeds","https://www.cio.de/a/deutschland-soll-wasserstoffnetz-bekommen,3702903?utm_source=Seiten_3932&utm_medium=RSS&utm_campaign=RSS-Feeds",0,www.cio.de,Ersatz für Erdgas und Kohle: Deutschland soll Wasserstoffnetz bekommen,"In Stahlwerken soll Wasserstoff die Kohle ersetzen, in Gaskraftwerken das Erdgas. Doch wie kommt es dahin? Die Energiewirtschaft hat Pläne für Wasserstoff-Netze. Die Bundesregierung und die EU allerdings auch.",https://images.cio.de/bdb/3369881/640x360.jpg,2023-01-04T12:27:00Z,,"Ein neues deutschlandweites Wasserstoffnetz soll auf bestehende Erdgas-Pipelines zurückgreifen.Foto: Audio und werbung - shutterstock.com
Auf dem Weg zur Klimaneutralität 2045 soll Wasserstoff eine … [+7027 chars]",,de,'Gas'
https://www.tagesschau.de/wirtschaft/verbraucher/gaspreis-unter-70-euro-101.html,https://www.tagesschau.de/wirtschaft/verbraucher/gaspreis-unter-70-euro-101.html,0,www.tagesschau.de,Mildes Winterwetter: Gaspreis fällt unter 70 Euro,Dank ungewöhnlich milder Wintertemperaturen hat der europäische Gaspreis seine Talfahrt der vergangenen Tage fortgesetzt. Erstmals seit Februar 2022 sinkt der Gaspreis unter die Marke von 70 Euro.,https://www.tagesschau.de/multimedia/bilder/erdgas-149~_v-original.jpg,2023-01-04T12:54:17Z,https://web.archive.org/web/20230104125730/http://www.tagesschau.de/wirtschaft/verbraucher/gaspreis-unter-70-euro-101.html,"Dank ungewöhnlich milder Wintertemperaturen hat der europäische Gaspreis seine Talfahrt der vergangenen Tage fortgesetzt. Erstmals seit Februar 2022 sinkt der Gaspreis unter die Marke von 70 Euro. 
… [+2253 chars]",,de,'Gas'
https://www.sueddeutsche.de/medien/radio-hoerfunktipps-5-1-2023-1.5726549,https://www.sueddeutsche.de/medien/radio-hoerfunktipps-5-1-2023-1.5726549,0,www.sueddeutsche.de,Hörfunktipps: Was läuft im Radio?,"Kleinmut und Größenwahn, Not und Hilfe: Die Dinge liegen mitunter nah beieinander in den spannendsten Hörfunksendungen am Beginn des Jahres.",https://www.sueddeutsche.de/image/sz.1.4008972/1200x675?v=1672820313,2023-01-04T13:23:04Z,https://web.archive.org/web/20230104132638/https://www.sueddeutsche.de/medien/radio-hoerfunktipps-5-1-2023-1.5726549,"Kleinmut und Größenwahn, Not und Hilfe: Die Dinge liegen mitunter nah beieinander in den spannendsten Hörfunksendungen am Beginn des Jahres.Rätsel
Watson, die Jagd beginnt! ist eine Lange Nacht über… [+1627 chars]",,de,'Not'
https://www.welt.de/wirtschaft/article243026557/Bundesnetzagentur-Stromverbrauch-sinkt-um-vier-Prozent.html,https://www.welt.de/wirtschaft/article243026557/Bundesnetzagentur-Stromverbrauch-sinkt-um-vier-Prozent.html,0,www.welt.de,Stromverbrauch sinkt um vier Prozent – Erzeugung von grünem Strom steigt,"Der deutsche Stromverbrauch ist im vergangenen Jahr leicht gesunken. Gleichzeitig stieg die Produktion aus erneuerbaren Quellen kräftig. Die Energie aus Solar, Wind, Braun- und Steinkohle glich dabei den starken Rückgang der Stromproduktion mit Atomkraft aus.",https://img.welt.de/img/newsticker/dpa_nt/infoline_nt/wirtschaft_nt/mobile243025289/5211358267-ci16x9-w1200/Windraeder-hinter-Stromleitungen.jpg,2023-01-04T14:24:14Z,https://web.archive.org/web/20230104142554/https://www.welt.de/wirtschaft/article243026557/Bundesnetzagentur-Stromverbrauch-sinkt-um-vier-Prozent.html,"In Deutschland sind im vergangenen Jahr vier Prozent weniger Strom verbraucht worden als im Vorjahr. Die Netzlast betrug über das Jahr 484,2 Terawattstunden, wie die Bundesnetzagentur in Bonn am Mitt… [+1761 chars]",,de,'Wind'
https://www.n-tv.de/politik/Habeck-sieht-Verkehr-als-groesstes-Klima-Problem-article23821854.html,https://www.n-tv.de/politik/Habeck-sieht-Verkehr-als-groesstes-Klima-Problem-article23821854.html,0,www.n-tv.de,CO₂-Einsparung 2022 zu niedrig: Habeck sieht Verkehr als größtes Klima-Problem,"Der verstärkte Einsatz von Kohlekraftwerken als Gas-Ersatz und der Verkehrssektor bescheren Deutschland in 2022 eine schlechte CO₂-Bilanz. Während Wirtschaftsminister Habeck sich den Verkehr vorknöpft, fühlt sich die FDP in ihrer Haltung zur Atomkraft bestäti…",https://bilder2.n-tv.de/img/incoming/crop23821901/7121324368-cImg_16_9-w1200/389275820.jpg,2023-01-04T14:31:20Z,https://web.archive.org/web/20230104145739/https://www.n-tv.de/politik/Habeck-sieht-Verkehr-als-groesstes-Klima-Problem-article23821854.html,Der verstärkte Einsatz von Kohlekraftwerken als Gas-Ersatz und der Verkehrssektor bescheren Deutschland in 2022 eine schlechte CO-Bilanz. Während Wirtschaftsminister Habeck sich den Verkehr vorknöpft… [+2445 chars],,de,'Gas'
https://www.focus.de/finanzen/energiekrise-in-deutschland-der-gaspreis-sinkt-aber-verbraucher-warten-weiter-auf-entlastung_id_182126287.html,https://www.focus.de/finanzen/energiekrise-in-deutschland-der-gaspreis-sinkt-aber-verbraucher-warten-weiter-auf-entlastung_id_182126287.html,0,www.focus.de,"Energiekrise in Deutschland - Der Gaspreis sinkt, aber Verbraucher warten weiter auf Entlastung","Nicht nur für Strom müssen Verbraucherinnen und Verbraucher in Deutschland seit Jahresbeginn tiefer in die Tasche greifen, auch Gas wurde mit dem Beginn des Krieges in der Ukraine immer teuer. Am Gasmarkt fällt der Preis nun auf einen Tiefstand. Private Haush…",https://p6.focus.de/img/fotos/id_182124987/europaeischer-gaspre-76473797.jpg?im=Crop%3D%280%2C411%2C3464%2C1732%29%3BResize%3D%281200%2C627%29&impolicy=perceptual&quality=medium&hash=56e6636e93c99ab6614835eaf7d4eeafa6468fc0f2f76ac31758cfa5ed90e2d0,2023-01-04T14:38:35Z,https://web.archive.org/web/20230104152446/https://www.focus.de/finanzen/energiekrise-in-deutschland-der-gaspreis-sinkt-aber-verbraucher-warten-weiter-auf-entlastung_id_182126287.html,"Nicht nur für Strom müssen Verbraucherinnen und Verbraucher in Deutschland seit Jahresbeginn tiefer in die Tasche greifen, auch Gas wurde mit dem Beginn des Krieges in der Ukraine immer teuer. Am Gas… [+5997 chars]",,de,'Gas'
https://www.faz.net/aktuell/politik/ausland/bulgariens-gasversorgung-ohne-russland-putins-plan-ging-nicht-auf-18576429.html,https://www.faz.net/aktuell/politik/ausland/bulgariens-gasversorgung-ohne-russland-putins-plan-ging-nicht-auf-18576429.html,0,www.faz.net,Gasversorgung in Bulgarien: Es geht auch ohne Russland,"Im April hat Putin Bulgarien das Gas abgedreht. Sein Machtspiel aber ging nicht auf. Dafür sorgten die EU, die USA, ein türkischer Autokrat, ein kaukasischer Diktator und internationale Energiekonzerne.",https://media0.faz.net/ppmedia/aktuell/2226125807/1.8576470/facebook_teaser/hoechste-prioritaet-im-oktober.jpg,2023-01-04T14:51:05Z,https://web.archive.org/web/20230104150609/http://www.faz.net/aktuell/politik/ausland/bulgariens-gasversorgung-ohne-russland-putins-plan-ging-nicht-auf-18576429.html,"Höchste Priorität: Im Oktober ging der Interkonnektor zwischen Griechenland und Bulgarien in Betrieb (hier eine Baustelle im griechischen Komotini im März) Bild: Bloomberg
Im April hat Putin Bulgari… [+2964 chars]",,de,'Gas'
https://www.sueddeutsche.de/politik/klimabilanz-agora-energiewende-1.5726928,https://www.sueddeutsche.de/politik/klimabilanz-agora-energiewende-1.5726928,0,www.sueddeutsche.de,Klimabilanz 2022: Kohlendioxid in Hülle und Fülle,"Um teures Gas zu sparen, haben viele Menschen zuletzt weniger geheizt. Doch Deutschland erreicht seine Klimaziele trotzdem nicht. Wie kann das sein?",https://www.sueddeutsche.de/image/sz.1.4972263/1200x675?v=1672843188,2023-01-04T15:03:59Z,https://web.archive.org/web/20230104150536/https://www.sueddeutsche.de/politik/klimabilanz-agora-energiewende-1.5726928,"Um teures Gas zu sparen, haben viele Menschen zuletzt weniger geheizt. Doch Deutschland erreicht seine Klimaziele trotzdem nicht. Wie kann das sein?Für die deutschen Klimaziele hätte 2022 ein wirklic… [+2829 chars]",,de,'Gas'
https://www.handelsblatt.com/unternehmen/energie/fuellstand-in-deutschland-gasspeicher-wieder-zu-90-prozent-gefuellt-/28819652.html,https://www.handelsblatt.com/unternehmen/energie/fuellstand-in-deutschland-gasspeicher-wieder-zu-90-prozent-gefuellt-/28819652.html,0,www.handelsblatt.com,Füllstand in Deutschland: Gasspeicher wieder zu 90 Prozent gefüllt,Ein hoher Gasspeicher-Füllstand ist für Deutschlands Gasversorgung in der Energiekrise essenziell. Wie steht es aktuell um die Gasreserven? Ein Überblick.,https://www.handelsblatt.com/images/gasspeicher-in-sachsen-anhalt/28877480/2-format2003.jpg,2023-01-04T15:06:20Z,https://web.archive.org/web/20230104155321/https://www.handelsblatt.com/unternehmen/energie/fuellstand-in-deutschland-gasspeicher-wieder-zu-90-prozent-gefuellt-/28819652.html,"Gasspeicher in Sachsen-AnhaltDer Gasspeicher-Füllstand in Deutschland ist in der Energiekrise zum wichtigen Faktor geworden.
(Foto: dpa)
Düsseldorf Ein stabiler Füllstand der deutschen Gasspeicher … [+8111 chars]",,de,'Gas'
https://www.morgenpost.de/ratgeber/article237285241/heizung-heizoel-zuschuss-sonderbonus-csu-bayern.html,https://www.morgenpost.de/ratgeber/article237285241/heizung-heizoel-zuschuss-sonderbonus-csu-bayern.html,0,www.morgenpost.de,Vorstoß aus Bayern: Zuschuss: CSU will Sonderbonus für Tausch alter Ölheizungen,"Die CSU will mit einem ""Sonderbonus"" Bürger zum Tausch ihrer alten Ölheizung bewegen. Lesen Sie hier, was die Partei in ihrem Beschlusspapier fordert.",https://img.morgenpost.de/img/incoming/crop226773495/8542605247-w820-cv16_9-q85/560a9084-be72-11e9-aaff-092ea8f20259.jpg,2023-01-04T15:21:41Z,https://web.archive.org/web/20230104172338/https://www.morgenpost.de/ratgeber/article237285241/heizung-heizoel-zuschuss-sonderbonus-csu-bayern.html,München. Die Energie- und Preiskrise infolge vom Ukraine-Krieg belastet viele Verbraucher in Deutschland aktuell primär mit Blick auf die Heizkosten. Im Herbst 2022 waren die Preise für Heizöl und Ga… [+5362 chars],,de,'Tau'
https://www.stern.de/gesellschaft/regional/mecklenburg-vorpommern/internet--wlan-busse-sind-noch-die-ausnahme-im-nordost-oepnv--33068700.html,https://www.stern.de/gesellschaft/regional/mecklenburg-vorpommern/internet--wlan-busse-sind-noch-die-ausnahme-im-nordost-oepnv--33068700.html,0,www.stern.de,Internet: Wlan-Busse sind noch die Ausnahme im Nordost-ÖPNV,"Wer Bus oder Bahn fährt, kennt es: Die meisten Nachbarn links und rechts scrollen, tippen oder wischen auf dem Smartphone herum. Einige Verkehrsbetriebe bieten kostenloses Wlan an. Die Frage bleibt, wo und wann es sinnvoll ist.",https://image.stern.de/33068702/t/x4/v2/w1440/r1.7778/-/04--urnnewsmldpacom2009010123010499104600v3w800h600l640t396r1920b1189jpeg---d4a663a5fd124978.jpg,2023-01-04T16:51:09Z,,"Wer Bus oder Bahn fährt, kennt es: Die meisten Nachbarn links und rechts scrollen, tippen oder wischen auf dem Smartphone herum. Einige Verkehrsbetriebe bieten kostenloses Wlan an. Die Frage bleibt, … [+4261 chars]",,de,'ÖPNV'
