index,url,valid,domain,title,description,image,published,archive,content,quote,language,keyword
https://t3n.de/news/bill-gates-klimaschutz-green-premium-erkenntnis-1710865/,https://t3n.de/news/bill-gates-klimaschutz-green-premium-erkenntnis-1710865/,0,t3n.de,"Bill Gates investiert seit 20 Jahren in Klimaschutz – und verrät, worauf es wirklich ankommt","Der ehemalige Microsoft-Chef nutzt eine Formel namens Green Premium, um zu bestimmen, wo sein Geld am meisten gegen die Erderwärmung herausholen kann. Wie das geht, erklärt er in diesem Gastbeitrag. Es dürfte mittlerweile klar sein, dass die Welt die im Paris…",https://cdn.t3n.de/news/wp-content/uploads/2023/06/Bill-Gates.jpg?class=content,2025-10-12T09:30:00Z,,"Es dürfte mittlerweile klar sein, dass die Welt die im Pariser Klimaabkommen von 2015 festgelegten Ziele zur Begrenzung der CO-Emissionen und der globalen Erwärmung nicht erreichen wird. Viele Mensch… [+11203 chars]",,de,'Gas'
https://www.stern.de/news/strafzoelle-von-trump-regierung--deutsche-winzer-sehen-irreparable-schaeden-36124802.html,https://www.stern.de/news/strafzoelle-von-trump-regierung--deutsche-winzer-sehen-irreparable-schaeden-36124802.html,0,www.stern.de,Strafzölle von Trump-Regierung: Deutsche Winzer sehen irreparable Schäden,"Die deutschen Winzer sehen irreparable Schäden durch die Zoll-Politik der Regierung von US-Präsident Donald Trump. Der Export in die USA habe ""enorm gelitten"", sagte Christian Schwörer, Generalsekretär des Deutschen Weinbauverbands, der ""Welt am Sonntag"". Der…",https://image.stern.de/36124804/t/0-/v1/w1440/r1.7778/-/12--weinanbau-am-neckar---57ee3f530743ad34.jpg,2025-10-12T10:50:29Z,,"Kopiere den aktuellen Link
Zur Merkliste hinzufügen
Die deutschen Winzer sehen irreparable Schäden durch die Zoll-Politik der Regierung von US-Präsident Donald Trump. Der Export in die USA habe ""en… [+1618 chars]",,de,'Wein'
https://www.tagesschau.de/wirtschaft/weltwirtschaft/zoelle-usa-mexiko-ciudad-juarez-100.html,https://www.tagesschau.de/wirtschaft/weltwirtschaft/zoelle-usa-mexiko-ciudad-juarez-100.html,0,www.tagesschau.de,Existenzängste in Mexiko durch die US-Zollpolitik,In der mexikanischen Grenzstadt Ciudad Juárez produzieren viele Firmen hauptsächlich für den US-Markt. Zuletzt haben sie Tausende entlassen. Das liegt vor allem an der Zollpolitik von US-Präsident Trump. Von Jenny Barke.,https://images.tagesschau.de/image/f594b0a3-78ac-493a-a42f-74aee9956baf/AAABmb59Ns8/AAABmKJZ-0g/16x9-big/ciudad-juarez-116.jpg?width=1280,2025-10-12T13:42:28Z,,"Stand: 12.10.2025 15:42 Uhr
In der mexikanischen Grenzstadt Ciudad Juárez produzieren viele Firmen hauptsächlich für den US-Markt. Zuletzt haben sie Tausende entlassen. Das liegt vor allem an der Zo… [+5317 chars]",,de,'Not'
https://www.tagesspiegel.de/wirtschaft/deutsche-winzer-suchen-neue-markte-weinbauverband-warnt-vor-dauerhaften-folgen-der-us-zollpolitik-14545247.html,https://www.tagesspiegel.de/wirtschaft/deutsche-winzer-suchen-neue-markte-weinbauverband-warnt-vor-dauerhaften-folgen-der-us-zollpolitik-14545247.html,0,www.tagesspiegel.de,Deutsche Winzer suchen neue Märkte: Weinbauverband warnt vor dauerhaften Folgen der US-Zollpolitik,Seit August erhebt die Trump-Regierung 15 Prozent Zoll auf EU-Wein. Deutsche Winzer sehen irreparable Schäden. Nun suchen sie nach Alternativen.,https://www.tagesspiegel.de/images/14545346/alternates/BASE_16_9_W1400/1760282325000/weinlese-in-sachsen-anhalt.jpeg,2025-10-12T15:25:53Z,,"Die deutschen Winzer sehen irreparable Schäden durch die Zoll-Politik der Regierung von US-Präsident Donald Trump. Der Export in die USA habe enorm gelitten, sagte Christian Schwörer, Generalsekretär… [+1947 chars]",,de,'Wein'
https://www.faz.net/aktuell/rhein-main/region-und-hessen/die-leiden-eines-bahnfahrers-im-raum-frankfurt-accg-110726037.html,https://www.faz.net/aktuell/rhein-main/region-und-hessen/die-leiden-eines-bahnfahrers-im-raum-frankfurt-accg-110726037.html,0,www.faz.net,Tagebuch eines Pendlers: Die Leiden eines Bahnfahrers,"Der Bahnverkehr in Rhein-Main ist so unzuverlässig wie seit Jahrzehnten nicht, findet unser Autor. Er hat zweieinhalb Jahre lang Notizen gesammelt zu Verspätungen, Bahnausfällen und wirren Erklärungen.",https://media1.faz.net/ppmedia/w1200/aktuell/3535496727/1.10726035/facebook_teaser/warten-auf-den-zug-bahnfahrer.jpg.webp,2025-10-13T05:17:56Z,,"Es waren mal kalte, mal heiße, aber vor allem viele lange Stunden am Bahnhof in Mainz-Kastel. Das Rabanus-Maurus-Gymnasium in Mainz, das wir 1985 besuchten, war weit vom Heimatort entfernt, und wir v… [+9886 chars]",,de,'ÖPNV'
https://www.bild.de/unterhaltung/alter-ist-nur-eine-zahl-wie-alt-wuerden-sie-sie-schaetzen-68dee78f23e5675945862881,https://www.bild.de/unterhaltung/alter-ist-nur-eine-zahl-wie-alt-wuerden-sie-sie-schaetzen-68dee78f23e5675945862881,0,www.bild.de,Alter ist nur eine Zahl - Wie alt würden Sie sie schätzen?,"Sie trinkt Wein, isst Kekse – und bringt ihren Körper trotzdem in Bestform. Mit 74 ist sie das, was viele sich mit 30 wünschen: selbstbewusst, zufrieden ...","https://images.bild.de/68dee78f23e5675945862881/e0e4c4d8e967cfc81f4ab88d101b60a1,46cf29ca?w=1280",2025-10-13T06:26:26Z,,In Freiheit! 7 israelische Geiseln sind ans Militär übergeben +++ In wenigen Minuten sollen die weiteren 13 lebenden Geiseln freikommen +++ Riesiger Jubel in den Straßen von Tel Aviv +++ Trump verfol… [+2528 chars],,de,'Wein'
https://www.zeit.de/news/2025-10/13/heissluftballon-muss-in-heilbronner-park-notlanden,https://www.zeit.de/news/2025-10/13/heissluftballon-muss-in-heilbronner-park-notlanden,0,www.zeit.de,Notfälle: Heißluftballon muss in Heilbronner Park notlanden,Hier finden Sie Informationen zu dem Thema „Notfälle“. Lesen Sie jetzt „Heißluftballon muss in Heilbronner Park notlanden“.,https://img.zeit.de/news/2025-10/13/heissluftballon-muss-in-heilbronner-park-notlanden-image-group/wide__1300x731,2025-10-13T06:42:17Z,,Nach Problemen mit Wind und Thermik ist ein Heißluftballon mitten in einem Heilbronner Park nahe des Neckars notgelandet. Nach dem Start am Sonntagnachmittag war der Ballon während der Fahrt über Hei… [+140 chars],,de,'Wind'
https://www.zeit.de/news/2025-10/13/gewalttat-in-maintal-opfer-nach-not-op-in-lebensgefahr,https://www.zeit.de/news/2025-10/13/gewalttat-in-maintal-opfer-nach-not-op-in-lebensgefahr,0,www.zeit.de,Kriminalität: Gewalttat in Maintal – Opfer nach Not-OP in Lebensgefahr,Hier finden Sie Informationen zu dem Thema „Kriminalität“. Lesen Sie jetzt „Gewalttat in Maintal – Opfer nach Not-OP in Lebensgefahr“.,https://img.zeit.de/news/2025-10/13/gewalttat-in-maintal-opfer-nach-not-op-in-lebensgefahr-image-group/wide__1300x731,2025-10-13T10:47:09Z,,"Bei einer Gewalttat in Maintal (Main-Kinzig-Kreis) ist ein 19-Jähriger lebensgefährlich verletzt worden. Die Hintergründe des Falls sind derzeit noch unklar, wie die Staatsanwaltschaft Hanau und das … [+1111 chars]",,de,'Not'
https://www.stern.de/gesellschaft/regional/hessen/kriminalitaet--gewalttat-in-maintal---opfer-nach-not-op-in-lebensgefahr-36126946.html,https://www.stern.de/gesellschaft/regional/hessen/kriminalitaet--gewalttat-in-maintal---opfer-nach-not-op-in-lebensgefahr-36126946.html,0,www.stern.de,Kriminalität: Gewalttat in Maintal – Opfer nach Not-OP in Lebensgefahr,"Wer steckt hinter der Attacke auf einen 19-Jährigen? Die Ermittlungen laufen, Zeugen werden vernommen. Hinweise auf eine Gefahr für andere gibt es laut Polizei bisher nicht.",https://image.stern.de/36126948/t/cw/v1/w1440/r1.7778/-/13--qv2um5pmq7v1axs2048jpeg---028445708174c391.jpg,2025-10-13T10:47:09Z,,"Kopiere den aktuellen Link
Zur Merkliste hinzufügen
Wer steckt hinter der Attacke auf einen 19-Jährigen? Die Ermittlungen laufen, Zeugen werden vernommen. Hinweise auf eine Gefahr für andere gibt e… [+1300 chars]",,de,'Not'
https://ooe.orf.at/stories/3325628/,https://ooe.orf.at/stories/3325628/,0,ooe.orf.at,Spitzenerträge bei Herbsternte,"Ein Jahr „ohne Dürre“ sorgt für Spitzenerträge in der aktuellen Herbsternte, zogen in Linz Landwirtschaftskammerpräsident Franz Waldenberger und der Leiter der Abteilung Pflanzenbau, Helmut Feitzlmayr, Bilanz. Trotz positiver Mengenentwicklung drücke aber ein…",https://ibs.orf.at/ooe?image=https%3A%2F%2Foekastatic.orf.at%2Fmims%2F2021%2F41%2F58%2Fcrops%2Fw%3D1200%2Ch%3D627%2Cq%3D75%2F1101291_master_391158_be0i3216.jpg%3Fs%3D18b2a50d6f47f583d8c11fc61cc97b641303bf75,2025-10-13T11:07:44Z,,"Mehr als die Hälfte vom Mais ist geerntet und die Landwirtschaftskammer Oberösterreich (LK OÖ) geht von einem Durchschnittsertrag von ca. 12,1 Tonnen pro Hektar aus. Dies bedeute ein Plus von 11 Proz… [+2703 chars]",,de,'Landwirtschaft'
https://www.faz.net/aktuell/wirtschaft/bahnkreise-personeller-kahlschlag-bei-db-cargo-geplant-110730643.html,https://www.faz.net/aktuell/wirtschaft/bahnkreise-personeller-kahlschlag-bei-db-cargo-geplant-110730643.html,0,www.faz.net,Gütersparte in Not: Bahnkreise: Personeller Kahlschlag bei DB Cargo geplant,Bis 2030 will das Management den Personalstamm der Gütersparte der Bahn angeblich drastisch schrumpfen. Dann soll DB Cargo nur noch 10.100 Mitarbeiter in Deutschland beschäftigen. Vor kurzer Zeit waren es noch rund 19.000.,https://media1.faz.net/ppmedia/w1200/aktuell/wirtschaft/1507696865/1.10613141/facebook_teaser/die-vorstandsvorsitzende-von.jpg.webp,2025-10-13T16:29:50Z,,Die notleidende Gütersparte der Deutschen Bahn plant nach Informationen aus Bahnkreisen mittelfristig einen personellen Kahlschlag. Bis 2030 soll nach einem Mittelfristkonzept des Managements die Zah… [+2455 chars],,de,'Not'
https://www.diepresse.com/20184977/diese-zehn-alkoholfreien-weine-sind-auch-ein-zweites-glas-wert,https://www.diepresse.com/20184977/diese-zehn-alkoholfreien-weine-sind-auch-ein-zweites-glas-wert,0,www.diepresse.com,Diese zehn alkoholfreien Weine sind auch ein zweites Glas wert [premium],"Die Qualität alkoholfreier Weine steigt rasant. Zehn Weine im Test von Bloomberg zeigen, wie gut „Zero“ heute schmecken kann.",https://img.diepresse.com/public/incoming/uf1w2y-imago835400623.jpg/alternates/DPR_SOCIAL_NACHRICHTEN/imago835400623.jpg,2025-10-14T03:40:33Z,,Alkoholfreie Weine haben mittlerweile den Mainstream erreicht und die Qualität ist in den letzten Jahren deutlich gestiegen. Die Auswahl ist größer denn je und es kommen noch mehr hinzu weil Winzer d… [+5016 chars],,de,'Wein'
https://www.tagesschau.de/wirtschaft/verbraucher/heizen-studie-100.html,https://www.tagesschau.de/wirtschaft/verbraucher/heizen-studie-100.html,0,www.tagesschau.de,Deutsche sparen trotz gestiegener Preise nicht mehr beim Heizen,"In den vergangenen Jahren ist Heizen im Schnitt um 82 Prozent teurer geworden, so der Heizatlas der Firma Techem. Dennoch haben viele Deutsche zuletzt sogar wieder stärker die Heizung aufgedreht. Von Ingo Nathusius.",https://images.tagesschau.de/image/e3881b86-63a9-4e4f-a06b-1d7b01214770/AAABmd2-MTQ/AAABmKJZ-0g/16x9-big/heizung-136.jpg?width=1280,2025-10-14T06:00:12Z,,"Stand: 14.10.2025 08:00 Uhr
In den vergangenen Jahren ist Heizen im Schnitt um 82 Prozent teurer geworden, so der Heizatlas der Firma Techem. Dennoch haben viele Deutsche zuletzt sogar wieder stärke… [+4001 chars]",,de,'Heizung'
https://www.stern.de/gesellschaft/regional/berlin-brandenburg/oepnv--bvg--neue-u-bahnen-auf-u2-erhoehen-die-zuverlaessigkeit-36129324.html,https://www.stern.de/gesellschaft/regional/berlin-brandenburg/oepnv--bvg--neue-u-bahnen-auf-u2-erhoehen-die-zuverlaessigkeit-36129324.html,0,www.stern.de,ÖPNV: BVG: Neue U-Bahnen auf U2 erhöhen die Zuverlässigkeit,Seit einigen Wochen setzt die BVG auf der Linie U2 eine neue Modellreihe ein. Dem Unternehmen zufolge haben die ersten Neuwagen die Zuverlässigkeitsstatistik verbessert.,https://image.stern.de/36129326/t/iV/v1/w1440/r1.7778/-/14--qvluv27qemv8axs2048jpeg---3329d4e9b9a0dd85.jpg,2025-10-14T08:17:20Z,,"Kopiere den aktuellen Link
Zur Merkliste hinzufügen
Seit einigen Wochen setzt die BVG auf der Linie U2 eine neue Modellreihe ein. Dem Unternehmen zufolge haben die ersten Neuwagen die Zuverlässigke… [+1418 chars]",,de,'ÖPNV'
https://www.zeit.de/news/2025-10/14/bvg-neue-u-bahnen-auf-u2-erhoehen-die-zuverlaessigkeit,https://www.zeit.de/news/2025-10/14/bvg-neue-u-bahnen-auf-u2-erhoehen-die-zuverlaessigkeit,0,www.zeit.de,ÖPNV: BVG: Neue U-Bahnen auf U2 erhöhen die Zuverlässigkeit,Hier finden Sie Informationen zu dem Thema „ÖPNV“. Lesen Sie jetzt „BVG: Neue U-Bahnen auf U2 erhöhen die Zuverlässigkeit“.,https://img.zeit.de/news/2025-10/14/bvg-neue-u-bahnen-auf-u2-erhoehen-die-zuverlaessigkeit-image-group/wide__1300x731,2025-10-14T08:17:20Z,,Einen Monat nach dem Start der neuen U-Bahnmodelle auf der Linie U2 hat sich die Zuverlässigkeit der Berliner U-Bahnen nach Angaben der Berliner Verkehrsbetriebe (BVG) insgesamt verbessert. In der Wo… [+1233 chars],,de,'ÖPNV'
https://www.tagesspiegel.de/berlin/opnv-bvg-neue-u-bahnen-auf-u2-erhohen-die-zuverlassigkeit-14556797.html,https://www.tagesspiegel.de/berlin/opnv-bvg-neue-u-bahnen-auf-u2-erhohen-die-zuverlassigkeit-14556797.html,0,www.tagesspiegel.de,ÖPNV: BVG: Neue U-Bahnen auf U2 erhöhen die Zuverlässigkeit,Seit einigen Wochen setzt die BVG auf der Linie U2 eine neue Modellreihe ein. Dem Unternehmen zufolge haben die ersten Neuwagen die Zuverlässigkeitsstatistik verbessert.,https://www.tagesspiegel.de/images/14556794/alternates/BASE_16_9_W1400/1760429904000/neue-u-bahngeneration-in-berlin.jpeg,2025-10-14T08:18:25Z,,Einen Monat nach dem Start der neuen U-Bahnmodelle auf der Linie U2 hat sich die Zuverlässigkeit der Berliner U-Bahnen nach Angaben der Berliner Verkehrsbetriebe (BVG) insgesamt verbessert. In der Wo… [+1289 chars],,de,'ÖPNV'
https://www.stern.de/news/alkoholfreier-wein-fuer-hund-und-katz-36130532.html,https://www.stern.de/news/alkoholfreier-wein-fuer-hund-und-katz-36130532.html,0,www.stern.de,Alkoholfreier Wein für Hund und Katz,"Ein Glas Wein zum Feierabend - das können in Neuseeland jetzt auch Haustiere genießen. Die Firma Muttley's Estate aus Auckland hat einen alkoholfreien Wein mit Katzenminze entwickelt, den Hunde und Katzen nach einem langen Tag als Wachhund oder nach stundenla…",https://image.stern.de/36130534/t/W-/v1/w1440/r1.7778/-/14--hund-mo-bei-der-weinprobe---e24ff763f4b271c9.jpg,2025-10-14T12:13:33Z,,"Kopiere den aktuellen Link
Zur Merkliste hinzufügen
Ein Glas Wein zum Feierabend - das können in Neuseeland jetzt auch Haustiere genießen. Die Firma Muttley's Estate aus Auckland hat einen alkoholf… [+1015 chars]",,de,'Wein'
https://www.stern.de/gesellschaft/regional/berlin-brandenburg/oepnv--krach-gegen-u-bahn-zugangssperren-auf-kosten-teurer-tickets-36130836.html,https://www.stern.de/gesellschaft/regional/berlin-brandenburg/oepnv--krach-gegen-u-bahn-zugangssperren-auf-kosten-teurer-tickets-36130836.html,0,www.stern.de,ÖPNV: Krach gegen U-Bahn-Zugangssperren auf Kosten teurer Tickets,Die CDU will Zugangssperren an U-Bahnhöfen durch höhere Ticketpreise finanzieren. SPD-Mann Krach hält das für den falschen Weg – und sieht auch keinen klaren Nutzen.,https://image.stern.de/36130838/t/0G/v1/w1440/r1.7778/-/14--exlbiuxmexv19axs2048jpeg---8fe0138ceb9b44f7.jpg,2025-10-14T13:10:59Z,,"Kopiere den aktuellen Link
Zur Merkliste hinzufügen
Die CDU will Zugangssperren an U-Bahnhöfen durch höhere Ticketpreise finanzieren. SPD-Mann Krach hält das für den falschen Weg und sieht auch kei… [+2673 chars]",,de,'ÖPNV'
https://www.tagesspiegel.de/berlin/opnv-krach-gegen-u-bahn-zugangssperren-auf-kosten-teurer-tickets-14562974.html,https://www.tagesspiegel.de/berlin/opnv-krach-gegen-u-bahn-zugangssperren-auf-kosten-teurer-tickets-14562974.html,0,www.tagesspiegel.de,ÖPNV: Krach gegen U-Bahn-Zugangssperren auf Kosten teurer Tickets,Die CDU will Zugangssperren an U-Bahnhöfen durch höhere Ticketpreise finanzieren. SPD-Mann Krach hält das für den falschen Weg – und sieht auch keinen klaren Nutzen.,https://www.tagesspiegel.de/images/14562971/alternates/BASE_16_9_W1400/1760447518000/steffen-krach.jpeg,2025-10-14T13:11:58Z,,"Der designierte SPD-Spitzenkandidat Steffen Krach ist gegen den Vorschlag der Berliner CDU, Zugangssperren an U-Bahnhöfen über höhere Ticketpreise zu finanzieren. Wieder einmal ein Vorschlag der CDU,… [+2538 chars]",,de,'ÖPNV'
https://www.diepresse.com/20205302/drei-polizisten-bei-der-zwangsraeumung-eines-hofs-in-italien-getoetet,https://www.diepresse.com/20205302/drei-polizisten-bei-der-zwangsraeumung-eines-hofs-in-italien-getoetet,0,www.diepresse.com,Drei Polizisten bei der Zwangsräumung eines Hofs in Italien getötet,"Beamte wollten das Landhaus räumen, drei Geschwister dürften eine Gasexplosion ausgelöst haben. Bereits zuvor wehrten sie sich heftig dagegen, den Hof zu verlassen.",https://img.diepresse.com/public/incoming/8z42vk-imago8371516431.jpg/alternates/DPR_SOCIAL_NACHRICHTEN/imago8371516431.jpg,2025-10-14T14:19:27Z,,"Beamte wollten das Landhaus räumen, drei Geschwister dürften eine Gasexplosion ausgelöst haben. Bereits zuvor wehrten sie sich heftig dagegen, den Hof zu verlassen. 
Am Dienstag wurden bei einem Pol… [+2889 chars]",,de,'Gas'
https://www.faz.net/aktuell/stil/essen-trinken/restaurants/restaurantkritik-gutshof-andres-in-kirchlauter-110692107.html,https://www.faz.net/aktuell/stil/essen-trinken/restaurants/restaurantkritik-gutshof-andres-in-kirchlauter-110692107.html,0,www.faz.net,„Gutshof ­Andres“: Können die Hauptgerichte mit den Vorspeisen mithalten?,Voll Sinn und Vergnügen: Im „Gutshof ­Andres“ in Kirchlauter haben die Vorspeisen ein hohes Niveau. Und wie steht es um den Rest der Karte? Die Kolumne Hier spricht der Gast.,https://media1.faz.net/ppmedia/w1200/aktuell/1920843317/1.10692095/facebook_teaser/der-gutshof-andres-von-aussen.jpg.webp,2025-10-14T15:51:29Z,,"Der Gutsgasthof Andres in Pettstadt, einem kleinen Ortsteil von Kirchlauter (nahe Bamberg), gehört zu den gastronomischen Geheimtipps, die über das ganze Land verteilt sind und aus gutem Grund Gäste … [+4079 chars]",,de,'Wein'
https://www.welt.de/sport/fussball/bundesliga/borussia-moenchengladbach/article68ee67804806d40275c9359d/rouven-schroeder-nach-17-jahren-versucht-es-gladbach-in-der-not-mal-wieder-mit-einer-externen-loesung.html,https://www.welt.de/sport/fussball/bundesliga/borussia-moenchengladbach/article68ee67804806d40275c9359d/rouven-schroeder-nach-17-jahren-versucht-es-gladbach-in-der-not-mal-wieder-mit-einer-externen-loesung.html,0,www.welt.de,Nach 17 Jahren versucht es Gladbach in der Not mal wieder mit einer externen Lösung,Borussia Mönchengladbach präsentiert nach dem Rücktritt von Roland Virkus einen neuen Sportchef. Rouven Schröder kommt vom österreichischen Erstligisten FC Red Bull Salzburg. Gladbach zahlt für ihn eine Ablösesumme. Auf den 49-Jährigen warten schwierige Aufga…,https://images.welt.de/68ee67804806d40275c9359d/f120aef1d40841e43cdf93aeeee27c7d-master/ci16x9-w1200/admiral-bundesliga-2024-2025-sp-32-rb-salzburg-vs-sk-rapid-wien,2025-10-14T15:55:40Z,,Borussia Mönchengladbach präsentiert nach dem Rücktritt von Roland Virkus einen neuen Sportchef. Rouven Schröder kommt vom österreichischen Erstligisten FC Red Bull Salzburg. Gladbach zahlt für ihn e… [+3505 chars],,de,'Not'
https://www.dw.com/de/russland-greift-vor-dem-winter-das-gasnetz-der-ukraine-an/a-74356304,https://www.dw.com/de/russland-greift-vor-dem-winter-das-gasnetz-der-ukraine-an/a-74356304,0,www.dw.com,Russland greift vor dem Winter das Gasnetz der Ukraine an,Die Ukraine bereitet sich auf eine schwierige Heizsaison vor. Wegen gezielter russischer Angriffe auf Anlagen gibt es Engpässe bei der Gasversorgung. Die Regierung bleibt aber bei festen Gaspreisen für die Haushalte.,https://static.dw.com/image/61228858_6.jpg,2025-10-14T18:01:00Z,,Fast täglich attackiert Russland die Energieinfrastruktur der Ukraine. In der Nacht auf Dienstag fiel nach gezielten Bombenangriffen auf Charkiw in drei Bezirken der Strom aus. Zuvor hatte ein Angrif… [+7633 chars],,de,'Gas'
https://www.stern.de/wirtschaft/news/wein--weinernte-faellt-geringer-aus-als-angenommen-36131964.html,https://www.stern.de/wirtschaft/news/wein--weinernte-faellt-geringer-aus-als-angenommen-36131964.html,0,www.stern.de,Wein: Weinernte fällt geringer aus als angenommen,Bodenheim - Extrem frühe Lese und kräftige Niederschläge im September: Der Ertrag bei der diesjährigen Lese liegt nach Einschätzung des Deutschen,https://image.stern.de/36131966/t/_5/v1/w1440/r1.7778/-/15--5a5h4o6hzbv6axs2048jpeg---0ddc7526d7c2aa97.jpg,2025-10-15T01:35:05Z,,"Kopiere den aktuellen Link
Zur Merkliste hinzufügen
Die Ernte der deutschen Weinbaubetriebe fällt geringer aus als zunächst angenommen. Ein Grund ist der kräftige September-Regen.
Extrem frühe Les… [+1126 chars]",,de,'Wein'
https://www.stern.de/gesellschaft/regional/rheinland-pfalz-saarland/schwangere-frauen-in-not--die-mainzer-babyklappe-ist-zu-36131998.html,https://www.stern.de/gesellschaft/regional/rheinland-pfalz-saarland/schwangere-frauen-in-not--die-mainzer-babyklappe-ist-zu-36131998.html,0,www.stern.de,Schwangere Frauen in Not: Die Mainzer Babyklappe ist zu,"Weil es den Marienschwestern in Mainz an Nachwuchs fehlt, gibt es die Babyklappe in der Altstadt nicht mehr. Solche Klappen sind umstritten, werden aber genutzt – auch nach einer Gesetzesänderung.",https://image.stern.de/36132000/t/Zh/v1/w1440/r1.7778/-/15--bny6ilje4iv12axs2048jpeg---0ac029e2e717f660.jpg,2025-10-15T02:01:03Z,,"Kopiere den aktuellen Link
Zur Merkliste hinzufügen
Weil es den Marienschwestern in Mainz an Nachwuchs fehlt, gibt es die Babyklappe in der Altstadt nicht mehr. Solche Klappen sind umstritten, werd… [+5919 chars]",,de,'Not'
https://www.zeit.de/news/2025-10/15/die-mainzer-babyklappe-ist-zu,https://www.zeit.de/news/2025-10/15/die-mainzer-babyklappe-ist-zu,0,www.zeit.de,Schwangere Frauen in Not: Die Mainzer Babyklappe ist zu,Hier finden Sie Informationen zu dem Thema „Schwangere Frauen in Not“. Lesen Sie jetzt „Die Mainzer Babyklappe ist zu“.,https://img.zeit.de/news/2025-10/15/die-mainzer-babyklappe-ist-zu-image-group/wide__1300x731,2025-10-15T02:01:03Z,,Nach rund 23 Jahren ist die Babyklappe des Sozialdienstes katholischer Frauen (SkF) in der Mainzer Altstadt Ende September geschlossen worden. Das rückt ein oft verschwiegenes Thema in den Fokus und … [+5445 chars],,de,'Not'
https://www.nzz.ch/feuilleton/max-frischs-stiller-wird-von-stefan-haupt-verfilmt-ld.1906958,https://www.nzz.ch/feuilleton/max-frischs-stiller-wird-von-stefan-haupt-verfilmt-ld.1906958,0,www.nzz.ch,Männer in Not und ein Film der Stunde: Max Frischs «Stiller» kommt in die Kinos,"Der Erfolgsroman des Schweizer Schriftstellers erzählt von einem Mann, der gerne ein anderer wäre. «Stiller» ist so aktuell wie 1954, als der Roman erschien.","https://img.nzz.ch/2025/10/14/08f35d87-8182-4bd5-9ec9-ab0ccb4f67ac.jpg?width=1200&height=675&fit=bounds&quality=75&auto=webp&crop=1731,974,x0,y55&wmark=nzz",2025-10-15T04:30:00Z,,"Der Erfolgsroman des Schweizer Schriftstellers erzählt von einem Mann, der gerne ein anderer wäre. «Stiller» ist so aktuell wie 1954, als der Roman erschien.
Paul Jandl15.10.2025, 06.30 Uhr
Albrech… [+6585 chars]",,de,'Not'
https://kaernten.orf.at/stories/3325869/,https://kaernten.orf.at/stories/3325869/,0,kaernten.orf.at,Evakuierung nach Explosion in Küche,"In einem Gasthaus in Klagenfurt ist Dienstagabend in der Küche ein Brand ausgebrochen. Ein defekter Gas-Schlauch hatte das Feuer verursacht, laut Feuerwehr ist es sogar zu einer Explosion gekommen. Das Gebäude musste vorübergehend evakuiert werden. Verletzt w…",https://ibs.orf.at/ktn?image=https%3A%2F%2Foekastatic.orf.at%2Fmims%2F2025%2F42%2F11%2Fcrops%2Fw%3D1200%2Ch%3D627%2Cq%3D75%2F2799977_master_1080311_rosentaler.jpg%3Fs%3Dde31e62d647163715d1ff044ca0620cce3a18b1d,2025-10-15T04:47:48Z,,"Der Brand brach während des laufenden Betriebs in der Gasthofküche aus. Die beiden Köchinnen befanden sich in der Küche als es zu der Explosion und dem anschließenden Brand kam, wurden jedoch nicht v… [+610 chars]",,de,'Gas'
https://www.morgenpost.de/wirtschaft/article410212442/heizoelpreise-heute-aktuell-15-oktober-2025-heizoel-kaufen-heizung.html,https://www.morgenpost.de/wirtschaft/article410212442/heizoelpreise-heute-aktuell-15-oktober-2025-heizoel-kaufen-heizung.html,0,www.morgenpost.de,Heizölpreise aktuell (15. Oktober): Das kostet ein Liter heute,"Die Temperaturen sinken, die Heizungen werden aufgedreht: Wie steht es in der dritten Oktoberwoche um die Heizölpreise? Ein Überblick.",https://img.sparknews.funkemedien.de/406858447/406858447_1724138717_v16_9_1600.jpeg,2025-10-15T07:35:35Z,,In Anbetracht der sinken Temperaturen dürften in vielen deutschen Haushalten die Heizungen schon bald wieder aufgedreht werden. Demnach werfen sicherlich viele Verbraucherinnen und Verbraucher nun wi… [+8353 chars],,de,'Heizung'
https://www.zeit.de/news/2025-10/15/nord-stream-verdaechtiger-polnisches-gericht-entscheidet,https://www.zeit.de/news/2025-10/15/nord-stream-verdaechtiger-polnisches-gericht-entscheidet,0,www.zeit.de,Anschläge auf Gaspipelines: Nord-Stream-Verdächtiger: Polnisches Gericht entscheidet,Hier finden Sie Informationen zu dem Thema „Anschläge auf Gaspipelines“. Lesen Sie jetzt „Nord-Stream-Verdächtiger: Polnisches Gericht entscheidet“.,https://img.zeit.de/news/2025-10/15/nord-stream-verdaechtiger-polnisches-gericht-entscheidet-image-group/wide__1300x731,2025-10-15T08:17:39Z,,"Drei Jahre nach dem Anschlag auf die Nord-Stream-Pipelines soll am Freitag ein polnisches Gericht entscheiden, ob ein in U-Haft sitzender Verdächtiger an Deutschland ausgeliefert wird. Das bestätigte… [+2044 chars]",,de,'Gas'
