index,url,valid,domain,title,description,image,published,archive,content,quote,language,keyword
https://www.n-tv.de/panorama/Toter-unter-Lawine-in-Osterreich-gefunden-article23893144.html,https://www.n-tv.de/panorama/Toter-unter-Lawine-in-Osterreich-gefunden-article23893144.html,0,www.n-tv.de,Gefahr im Skigebiet Sölden: Toter unter Lawine in Österreich gefunden,Intensive Schneefälle und Wind werden in Österreichs Skigebieten zu einem großen Risiko: Leicht können sich Schneemassen lösen - und Menschen unter sich begraben. Einem Skifahrer aus Tirol wurde dies nun zum Verhängnis.,https://bilder2.n-tv.de/img/incoming/crop23893201/2751327317-cImg_16_9-w1200/389038319.jpg,2023-02-04T12:37:59Z,,Intensive Schneefälle und Wind werden in Österreichs Skigebieten zu einem großen Risiko: Leicht können sich Schneemassen lösen - und Menschen unter sich begraben. Einem Skifahrer aus Tirol wurde dies… [+1572 chars],,de,'Schnee'
https://hallespektrum.de/meldungen/polizeimeldungen/polizeiberichte-vom-4-februar-2022/431511/,https://hallespektrum.de/meldungen/polizeimeldungen/polizeiberichte-vom-4-februar-2022/431511/,0,hallespektrum.de,Polizeiberichte vom 4. Februar 2022,"Zwei Personen verletzt Freitagnachmittag fiel bei starkem Wind eine Birke in der Nähe einer Baustelle im Bereich Heide-Süd um und traf zwei Arbeiter. Eine Person wurde schwer, die Andere leicht verletzt. Der Schwerverletzte kam zur ärztlichen Behandlung in ei…",https://hallespektrum.de/wp-content/uploads/2023/01/symbol3.jpg,2023-02-04T12:38:21Z,,"Zwei Personen verletzt
Freitagnachmittag fiel bei starkem Wind eine Birke in der Nähe einer Baustelle im Bereich Heide-Süd um und traf zwei Arbeiter. Eine Person wurde schwer, die Andere leicht verl… [+689 chars]",,de,'Wind'
https://www.tagesschau.de/ausland/oesterreich-lawinen-tote-101.html,https://www.tagesschau.de/ausland/oesterreich-lawinen-tote-101.html,0,www.tagesschau.de,Tote bei Lawinenabgängen in Österreich abseits der Piste,"Wegen starker Winde und Neuschnee wird in großen Teilen Österreichs vor Lawinen gewarnt. Zwei Skifahrer, die trotzdem abseits der Piste unterwegs waren, kamen bei Lawinenabgängen ums Leben - einer im Ötztal, einer im Kleinwalsertal.",https://www.tagesschau.de/multimedia/bilder/lawinengefahr-103~_v-original.jpg,2023-02-04T13:30:56Z,,"Wegen starker Winde und Neuschnee wird in großen Teilen Österreichs vor Lawinen gewarnt. Zwei Skifahrer, die trotzdem abseits der Piste unterwegs waren, kamen bei Lawinenabgängen ums Leben - einer im… [+1570 chars]",,de,'Wind'
https://orf.at/stories/3303920/,https://orf.at/stories/3303920/,0,orf.at,Sturm und Schnee: Problematische Straßenverhältnisse,,https://orf.at/mojo/1_4_1/storyserver//news/common/images/og-fallback-news.png,2023-02-04T13:43:47Z,,"Die Wetterlage hat österreichweit für schwierige Straßenverhältnisse gesorgt, meldete der ÖAMTC. Derzeit ist z. B. die Tauern-Autobahn wegen eines hängen gebliebenen Lkw bei Zederhaus gesperrt. Auch … [+1660 chars]",,de,'Schnee'
https://www.diepresse.com/6247179/neuschnee-sorgt-fuer-lawinengefahr-und-problematische-strassenverhaeltnisse,https://www.diepresse.com/6247179/neuschnee-sorgt-fuer-lawinengefahr-und-problematische-strassenverhaeltnisse,0,www.diepresse.com,Neuschnee sorgt für Lawinengefahr und problematische Straßenverhältnisse,"Im Laufe des Wochenendes sollen die Schneefälle langsam abklingen, die Verhältnisse abseits der Pisten seien aber weiter heikel, warnen Experten. Auch die Straßenverhältnisse sind problematisch.",https://media.diepresse.com/social_diepresse_nachrichten/images/uploads_1200/3/0/b/6247179/1EFB6AE6-5DBF-4173-A4D6-50724F8E5659_v0_l.jpg,2023-02-04T13:53:00Z,,"Im Laufe des Wochenendes sollen die Schneefälle langsam abklingen, die Verhältnisse abseits der Pisten seien aber weiter heikel, warnen Experten. Auch die Straßenverhältnisse sind problematisch.
Int… [+5604 chars]",,de,'Wind'
https://www.diepresse.com/6247223/lawinen-abgang-zwei-tote-zwei-verschuettete-in-tirol-und-vorarlberg,https://www.diepresse.com/6247223/lawinen-abgang-zwei-tote-zwei-verschuettete-in-tirol-und-vorarlberg,0,www.diepresse.com,"Lawinen-Abgang: Zwei Tote, zwei Verschüttete in Tirol und Vorarlberg",Intensive Schneefälle und Wind haben in Tirol und Vorarlberg die Lawinengefahr gefährlich ansteigen lassen.,https://media.diepresse.com/social_diepresse_nachrichten/images/uploads_1200/3/3/7/6247223/1C3395D1-4791-4622-B421-36D3BCE3998D_v0_l.jpg,2023-02-04T14:11:00Z,,"Intensive Schneefälle und Wind haben in Tirol und Vorarlberg die Lawinengefahr gefährlich ansteigen lassen.
In Kaltenbach (Zillertal) ist am Samstag ein Wintersportler bei einem Lawinenabgang ums Le… [+3028 chars]",,de,'Schnee'
https://www.diepresse.com/6247223/zwei-tote-nach-lawinenabgaengen-in-tirol-und-vorarlberg,https://www.diepresse.com/6247223/zwei-tote-nach-lawinenabgaengen-in-tirol-und-vorarlberg,0,www.diepresse.com,Zwei Tote nach Lawinenabgängen in Tirol und Vorarlberg,"Intensive Schneefälle und Wind haben in Tirol und Vorarlberg die Lawinengefahr gefährlich ansteigen lassen. Eine Bergungsaktion in St. Anton am Arlberg, wo zwei Verschüttete vermutet werden, musste wetterbedingt zunächst unterbrochen werden.",https://media.diepresse.com/social_diepresse_nachrichten/images/uploads_1200/3/3/7/6247223/1C3395D1-4791-4622-B421-36D3BCE3998D_v0_l.jpg,2023-02-04T14:11:00Z,,"Intensive Schneefälle und Wind haben in Tirol und Vorarlberg die Lawinengefahr gefährlich ansteigen lassen. Eine Bergungsaktion in St. Anton am Arlberg, wo zwei Verschüttete vermutet werden, musste w… [+3162 chars]",,de,'Wind'
https://www.focus.de/reisen/urlaubs-check/baden-im-februar-das-sind-die-schoensten-strandziele-um-dem-winter-adieu-zu-sagen_id_183911972.html,https://www.focus.de/reisen/urlaubs-check/baden-im-februar-das-sind-die-schoensten-strandziele-um-dem-winter-adieu-zu-sagen_id_183911972.html,0,www.focus.de,"Baden im Februar - Die fünf besten Reiseziele, um dem Winter zu entfliehen","Keine Lust mehr auf Schnee, Eis und Kälte? Dann ganz schnell ab in wärmere Gefilde! Wir stellen fünf Urlaubsziele vor, an denen das Thermometer mindestens 30 Grad anzeigt und Sie Sonne, Strand und Meer in vollen Zügen genießen können. So können Sie dem Winter…",https://p6.focus.de/img/fotos/id_183913289/gettyimages-83629122.jpg?im=Crop%3D%280%2C0%2C2148%2C1073%29%3BResize%3D%281200%2C627%29&impolicy=perceptual&quality=medium&hash=2c0321c47261e4e41b9686cc034d178ada5179f1b893de086cb4519eba7ad96f,2023-02-04T15:00:37Z,https://web.archive.org/web/20230204160047/https://www.focus.de/reisen/urlaubs-check/baden-im-februar-das-sind-die-schoensten-strandziele-um-dem-winter-adieu-zu-sagen_id_183911972.html,"Keine Lust mehr auf Schnee, Eis und Kälte? Dann ganz schnell ab in wärmere Gefilde! Wir stellen fünf Urlaubsziele vor, an denen das Thermometer mindestens 30 Grad anzeigt und Sie Sonne, Strand und Me… [+7270 chars]",,de,'Kälte'
https://www.focus.de/finanzen/das-ist-neu-ab-februar-2023-bierpreis-steigt-maskenpflicht-entfaellt-energiesparlampen-alle-aenderungen-im-februar-auf-einen-blick_id_183815992.html,https://www.focus.de/finanzen/das-ist-neu-ab-februar-2023-bierpreis-steigt-maskenpflicht-entfaellt-energiesparlampen-alle-aenderungen-im-februar-auf-einen-blick_id_183815992.html,0,www.focus.de,"Großer Überblick - Bierpreis, Windkraft-Gesetz, Maskenpflicht - das ändert sich im Februar","Alle wichtigen Änderungen und Neuerungen ab Februar 2023 im Überblick: Die Bierpreise steigen, die Maskenpflicht in den öffentlichen Verkehrsmitteln fällt, Energiesparlampen dürfen nicht mehr hergestellt werden und auch im Verbandskasten ändert sich etwas.",https://p6.focus.de/img/regional/thueringen/id_184264193/windkraftanlagen-stehen-bei-winterlichem-wetter-vor-dem-abendhimmel..jpg?im=Crop%3D%280%2C324%2C2048%2C1024%29%3BResize%3D%281200%2C627%29&impolicy=perceptual&quality=medium&hash=9479810f29ffd608f0bf6cab1b85179c065869cf485c4b5bd5d77b78977d1ea2,2023-02-04T15:08:48Z,,"Alle wichtigen Änderungen und Neuerungen ab Februar 2023 im Überblick: Die Bierpreise steigen, die Maskenpflicht in den öffentlichen Verkehrsmitteln fällt, Energiesparlampen dürfen nicht mehr hergest… [+5735 chars]",,de,'Gas'
https://noe.orf.at/stories/3193386/,https://noe.orf.at/stories/3193386/,0,noe.orf.at,Skigebiete starten gut gebucht in die Ferien,Für die Schülerinnen und Schüler aus Niederösterreich und Wien haben am Wochenende die Semesterferien gestartet – größtenteils mit starkem Wind. Ab Montag wird aber ideales Skiwetter erwartet. Tickets und Unterkünfte  sind dementsprechend gefragt.,https://ibs.orf.at/noe?image=https%3A%2F%2Foekastatic.orf.at%2Fmims%2F2019%2F20%2F81%2Fcrops%2Fw%3D1200%2Ch%3D627%2Cq%3D75%2F152213_master_37181_skigebiet_st._corona_c_orf_felix_novak_55.jpg%3Fs%3Dd52d9fcbd33dc75f10ddfe7cb6e17f5502f6c84c,2023-02-04T16:14:23Z,,"Der Schnee hat lange auf sich warten lassen, doch jetzt ist er da. Ein idealer Zeitpunkt, denn vor allem Familien gehen in den Semesterferien gerne Skifahren oder Snowboarden. In Mönichkirchen-Marien… [+3097 chars]",,de,'Wind'
https://www.n-tv.de/wirtschaft/Wir-sollten-ueber-aktive-Preisbeobachtung-nachdenken-article23891143.html,https://www.n-tv.de/wirtschaft/Wir-sollten-ueber-aktive-Preisbeobachtung-nachdenken-article23891143.html,0,www.n-tv.de,"Frühwarnsystem für Inflation: ""Wir sollten über aktive Preisbeobachtung nachdenken""","Die Volkswirtin Isabella Weber gilt als Erfinderin des Gaspreisdeckels. Sie sucht aber auch nach Lösungen im Kampf gegen steigende Preise. Der Staat sollte die ""systemisch relevanten"" Preistreiber am Markt finden, plädiert sie. Dann könne er ""zielgenau interv…",https://bilder1.n-tv.de/img/incoming/crop23891220/0981324884-cImg_16_9-w1200/382134380.jpg,2023-02-04T17:35:07Z,,Die Volkswirtin Isabella Weber gilt als Erfinderin des Gaspreisdeckels. Darüber hinaus sucht sie aber auch nach Lösungen im Kampf gegen steigende Preise. Bei der aktuellen Inflation handelt es sich i… [+9997 chars],,de,'Gas'
https://orf.at/stories/3303933/,https://orf.at/stories/3303933/,0,orf.at,Rettungskräfte im Dauereinsatz,Das Winterwetter hat Österreich am Samstag fest im Griff gehabt. Insbesondere im Westen und Süden des Landes wurden zahlreiche Einsätze gemeldet. Viele Straßen mussten aufgrund von Schnee und stürmischen Windböen gesperrt werden. Die Lawinengefahr war in Tiro…,https://ibs.orf.at/news?image=https%3A%2F%2Fassets.orf.at%2Fmims%2F2023%2F05%2F06%2Fcrops%2Fw%3D1200%2Ch%3D630%2Cq%3D75%2F1665430_master_613006_sturm_schnee_oesterreich_a.jpg%3Fs%3Ddaf4299bb2ae9480f97f4673dc66db4a0f5e679d,2023-02-04T18:09:23Z,,"In Kaltenbach (Tirol) ist ein Wintersportler bei einem Lawinenabgang ums Leben gekommen. Es soll sich um einen 17-jährigen neuseeländischen Touristen handeln, der Variantenfahrer war offenbar allein … [+4575 chars]",,de,'Wind'
https://www.faz.net/aktuell/wirtschaft/klima-nachhaltigkeit/scholz-will-mehr-ausbau-bei-windkraft-18654823.html,https://www.faz.net/aktuell/wirtschaft/klima-nachhaltigkeit/scholz-will-mehr-ausbau-bei-windkraft-18654823.html,0,www.faz.net,Scholz plant bos 2030 Tag für Tag mit mindestens vier neuen Windrädern,"Damit bis 2030 die Ziele bei der Onshore-Windenergie erreicht werden, will der Bundeskanzler die Länder jeden Monat zum Gespräch bitten – und wenn nötig zum Nachholen verpflichten. Scholz spricht von einem „Deutschland-Tempo“.",https://media0.faz.net/ppmedia/aktuell/politik/100535998/1.8654840/facebook_teaser/windraeder-stehen-auf-huegeln.jpg,2023-02-05T02:58:44Z,,"Bundeskanzler Olaf Scholz (SPD) will den Ausbau der Windkraft in Deutschland deutlich vorantreiben. Bis 2030 werden das an Land im Schnitt vier bis fünf Windräder jeden Tag sein, sagte er der Bild am… [+1800 chars]",,de,'Gas'
https://www.dw.com/de/kanzler-scholz-will-vier-bis-f%C3%BCnf-neue-windr%C3%A4der-t%C3%A4glich/a-64614458,https://www.dw.com/de/kanzler-scholz-will-vier-bis-f%C3%BCnf-neue-windr%C3%A4der-t%C3%A4glich/a-64614458,0,www.dw.com,Kanzler Scholz will vier bis fünf neue Windräder täglich,"Bundeskanzler Olaf Scholz will beim Ausbau der Windkraft in Deutschland Gas geben. Die Bundesländer sollten künftig monatlich über die Fortschritte berichten, kündigt der Regierungschef an. Bundeskanzler Olaf Scholz hat einen bundesweiten Plan zum Ausbau der …",https://static.dw.com/image/64614701_6.jpg,2023-02-05T07:08:00Z,,"Bundeskanzler Olaf Scholz hat einen bundesweiten Plan zum Ausbau der Windkraft angekündigt. ""Den Ausbau gehen wir generalstabsmäßig an: Gerade erstellen wir einen Fahrplan, was bis wann an neuen Anla… [+1391 chars]",,de,'Gas'
https://www.welt.de/politik/deutschland/article243605655/Scholz-kuendigt-Plan-zum-Ausbau-der-Windkraft-an.html,https://www.welt.de/politik/deutschland/article243605655/Scholz-kuendigt-Plan-zum-Ausbau-der-Windkraft-an.html,0,www.welt.de,Scholz will bis 2030 „im Schnitt vier bis fünf Windräder jeden Tag“ an Land bauen lassen,Bundeskanzler Olaf Scholz will den Ausbau der Windkraft an Land massiv beschleunigen. Es müsse mehr Schwung bei Innovationen und für die Modernisierung der Industrie folgen – damit 2045 klimaneutral gewirtschaftet werden könne.,https://img.welt.de/img/politik/deutschland/mobile243605663/0821354517-ci16x9-w1200/Scholz-besucht-Windpark-Luckau.jpg,2023-02-05T08:59:09Z,http://archive.md/20230205100826/https://www.welt.de/politik/deutschland/article243605655/Scholz-kuendigt-Plan-zum-Ausbau-der-Windkraft-an.html,"Bundeskanzler Olaf Scholz, SPD, hat einen bundesweiten Plan zum Ausbau der Windkraft angekündigt. Bis 2030 werden das an Land im Schnitt vier bis fünf Windräder jeden Tag sein, sagte Scholz in einem … [+1358 chars]",,de,'Gas'
https://www.diepresse.com/6247489/in-bach-eingebrochen-mann-nach-45-minuten-aus-eiskaltem-gewaesser-gerettet,https://www.diepresse.com/6247489/in-bach-eingebrochen-mann-nach-45-minuten-aus-eiskaltem-gewaesser-gerettet,0,www.diepresse.com,In Bach eingebrochen: Mann nach 45 Minuten aus eiskaltem Gewässer gerettet,Ein 69-Jähriger ist auf einer Schneeschuhwanderung im Eis eingebrochen. Eine Dreiviertelstunde harrte er im kalten Wasser aus.,https://www.diepresse.com/assets_v2/images/diepresse_nachrichten.png,2023-02-05T10:45:00Z,https://web.archive.org/web/20230205152133/https://www.diepresse.com/6247489/in-bach-eingebrochen-mann-nach-45-minuten-aus-eiskaltem-gewaesser-gerettet,"Ein 69-Jähriger ist auf einer Schneeschuhwanderung im Eis eingebrochen. Eine Dreiviertelstunde harrte er im kalten Wasser aus.
Ein Mann ist am Samstagnachmittag im Kleinwalsertal in ein vereistes Ge… [+1118 chars]",,de,'Tau'
