index,url,valid,domain,title,description,image,published,archive,content,quote,language,keyword
https://www.zeit.de/news/2023-07/01/cannabis-freigabe-anbau-fuer-hessens-landwirte-kaum-option,https://www.zeit.de/news/2023-07/01/cannabis-freigabe-anbau-fuer-hessens-landwirte-kaum-option,0,www.zeit.de,Landwirtschaft: Cannabis-Freigabe: Anbau für Hessens Landwirte kaum Option,,,2023-07-01T06:11:48Z,,"When browsing with ads:
We collect personal data and also transmit it to third-party providers
 that help us improve and finance our digital content. Some of the information stored on your device, … [+821 chars]",,de,'Landwirtschaft'
https://www.stern.de/gesellschaft/regional/rheinland-pfalz-saarland/landwirtschaft--fast-alle-ahr-winzer-machen-nach-der-flutkatastrophe-weiter-33610526.html,https://www.stern.de/gesellschaft/regional/rheinland-pfalz-saarland/landwirtschaft--fast-alle-ahr-winzer-machen-nach-der-flutkatastrophe-weiter-33610526.html,0,www.stern.de,Landwirtschaft: Fast alle Ahr-Winzer machen nach der Flutkatastrophe weiter,Steillagenweinbau und Tourismus sind im idyllischen Ahrtal für viele Lebensgrundlage. Die Winzer bauen nach der tödlichen Flut wieder auf und legen sich bei der Weinproduktion ins Zeug.,https://image.stern.de/33610528/t/Tw/v1/w1440/r1.7778/-/01--urnnewsmldpacom2009010123070199250358v3w800h600l640t425r1920b1275jpeg---a0155b929aff0b3d.jpg,2023-07-01T06:15:53Z,https://web.archive.org/web/20230701063621/https://www.stern.de/gesellschaft/regional/rheinland-pfalz-saarland/landwirtschaft--fast-alle-ahr-winzer-machen-nach-der-flutkatastrophe-weiter-33610526.html,"Steillagenweinbau und Tourismus sind im idyllischen Ahrtal für viele Lebensgrundlage. Die Winzer bauen nach der tödlichen Flut wieder auf und legen sich bei der Weinproduktion ins Zeug.
Zwei Jahre n… [+2282 chars]",,de,'Wein'
https://www.zeit.de/news/2023-07/01/fast-alle-ahr-winzer-machen-nach-der-flutkatastrophe-weiter,https://www.zeit.de/news/2023-07/01/fast-alle-ahr-winzer-machen-nach-der-flutkatastrophe-weiter,0,www.zeit.de,Landwirtschaft: Fast alle Ahr-Winzer machen nach der Flutkatastrophe weiter,,,2023-07-01T06:15:53Z,,"When browsing with ads:
We collect personal data and also transmit it to third-party providers
 that help us improve and finance our digital content. Some of the information stored on your device, … [+821 chars]",,de,'Landwirtschaft'
https://www.faz.net/aktuell/rhein-main/die-kleine-gemeinde-kefenrod-nimmt-ohne-notunterkunft-mehr-fluechtlinge-auf-18998898.html,https://www.faz.net/aktuell/rhein-main/die-kleine-gemeinde-kefenrod-nimmt-ohne-notunterkunft-mehr-fluechtlinge-auf-18998898.html,0,www.faz.net,Aufnahme ohne Notunterkunft: Wie das kleine Kefenrod mehr Flüchtlinge aufnehmen will,Das kleine Kefenrod nimmt bisher zu wenige Flüchtlinge auf. Deshalb gab es Überlegungen für eine große Notunterkunft. Das ist jetzt jedoch Geschichte.,https://media1.faz.net/ppmedia/aktuell/rhein-main/2445148071/1.8998897/facebook_teaser_fplus/zuversicht-kefenrod-hier-die.jpg,2023-07-01T06:43:55Z,https://web.archive.org/web/20230701072207/https://www.faz.net/aktuell/rhein-main/die-kleine-gemeinde-kefenrod-nimmt-ohne-notunterkunft-mehr-fluechtlinge-auf-18998898.html,An jene Tage im November vergangenen Jahres erinnern sich so manche im Örtchen Bindsachsen und im Rathaus nicht gern. Bürgermeisterin Kirsten Frömel sagt im Rückblick: Die Situation haben wir abgearb… [+700 chars],,de,'Notunterkunft'
https://www.dw.com/de/d%C3%BCrre-in-uruguay-das-trinkwasser-wird-knapp/a-66068540,https://www.dw.com/de/d%C3%BCrre-in-uruguay-das-trinkwasser-wird-knapp/a-66068540,0,www.dw.com,Dürre in Uruguay: Das Trinkwasser wird knapp,"In Montevideo herrscht die schlimmste Trockenheit seit mehr als 70 Jahren. Wasser-Hamsterkäufe in Supermärkten verschärfen die Lage zusätzlich. Ähnliche Szenarien könnten auf viele Städte der Welt zukommen. In dem Land, das als erstes weltweit 2004 das Recht …",https://static.dw.com/image/66061034_6.jpg,2023-07-01T14:19:00Z,https://web.archive.org/web/20230701172441/https://www.dw.com/de/d%C3%BCrre-in-uruguay-das-trinkwasser-wird-knapp/a-66068540,"In dem Land, das als erstes weltweit 2004 das Recht auf sauberes Trinkwasser in der Verfassung verankerte, hilft jetzt nur noch Hilfe von ganz oben. Deswegen fasste sich Kardinal Daniel Sturla, der E… [+5419 chars]",,de,'Dürre'
https://www.faz.net/aktuell/feuilleton/debatten/von-der-biodiversitaet-im-boden-haengt-das-leben-ab-19001529.html,https://www.faz.net/aktuell/feuilleton/debatten/von-der-biodiversitaet-im-boden-haengt-das-leben-ab-19001529.html,0,www.faz.net,Von der Biodiversität im Boden hängt das Leben ab,"Vom Boden ist nur die Rede, wenn er mal wieder zu trocken ist. Dabei hängt alles Leben von der Artenvielfalt unter der Erde ab. Und die wird nicht nur von der Dürre bedroht.",https://media0.faz.net/ppmedia/aktuell/gesellschaft/3098592232/1.9001600/facebook_teaser_fplus/wie-wichtig-der-regenwurm-fuer.jpg,2023-07-01T14:52:02Z,https://web.archive.org/web/20230701150623/https://www.faz.net/aktuell/feuilleton/debatten/von-der-biodiversitaet-im-boden-haengt-das-leben-ab-19001529.html,"Es hat geregnet, mancherorts auch viel, doch auf der Deutschlandkarte des Dürremonitors sind die Böden immer noch gelb (ungewöhnlich trocken) bis dunkelrot (außergewöhnliche Dürre). Ein paar Regentag… [+972 chars]",,de,'Dürre'
https://taz.de/Heizungsgesetz-der-Ampelkoalition/!5941520/,https://taz.de/Heizungsgesetz-der-Ampelkoalition/!5941520/,0,taz.de,Heizungsgesetz der Ampelkoalition: Kein Schnäppchen für jederman,"70 Prozent Rabatt ist ein tolles Angebot. Nur dumm, dass man für die neue Heizung auch eine passende Immobilie braucht.",https://taz.de/picture/6362971/948/26077483-1.jpeg,2023-07-01T17:09:00Z,https://web.archive.org/web/20230701175529/https://taz.de/Heizungsgesetz-der-Ampelkoalition/!5941520/,"70 Prozent Rabatt ist ein tolles Angebot. Nur dumm, dass man für die neue Heizung auch eine passende Immobilie braucht.
Motiv aus der Schnäppchenrepublik Foto: Stefan Boness
Die Minderjährige, die … [+3887 chars]",,de,'Heizung'
https://www.n-tv.de/ratgeber/Was-bei-Bienen-und-Wespenstichen-zu-tun-ist-article24201355.html,https://www.n-tv.de/ratgeber/Was-bei-Bienen-und-Wespenstichen-zu-tun-ist-article24201355.html,0,www.n-tv.de,Das ist zu beachten: Was bei Bienen- und Wespenstichen zu tun ist,Nach einem Bienen- oder Wespenstich ist die Haut gereizt - und womöglich steckt sogar noch der Stachel fest. Bei Allergikern kann ein Stich zu schweren Reaktionen führen. Was gibt es im Notfall zu beachten?,https://bilder4.n-tv.de/img/Bilder_dpa_Import/crop21803075/6771322410-cImg_16_9-w1200/Eine-Wespe-fliegt-vor-einer-Fensterscheibe.jpg,2023-07-01T17:33:35Z,https://web.archive.org/web/20230701183606/https://www.n-tv.de/ratgeber/Was-bei-Bienen-und-Wespenstichen-zu-tun-ist-article24201355.html,Nach einem Bienen- oder Wespenstich ist die Haut gereizt - und womöglich steckt sogar noch der Stachel fest. Bei Allergikern kann ein Stich zu schweren Reaktionen führen. Was gibt es im Notfall zu be… [+3180 chars],,de,'Kälte'
https://www.n-tv.de/politik/08-01-Kretschmer-Weg-zu-russischem-Gas-nicht-versperren--article23143824.html,https://www.n-tv.de/politik/08-01-Kretschmer-Weg-zu-russischem-Gas-nicht-versperren--article23143824.html,0,www.n-tv.de,Ukraine-Krieg im Liveticker: +++ 08:01 Kretschmer: Weg zu russischem Gas nicht versperren +++,"Berlin, Washington, Br\u00fcssel - \u00fcberall. n-tv berichtet von allen wichtigen Schaupl\u00e4tzen der Innen- und Au\u00dfenpolitik.",https://bilder2.n-tv.de/img/incoming/crop23332537/9041326157-cImg_16_9-w1200/Liveticker1-grau-1-Kopie.jpg,2023-07-01T22:10:00Z,,"Der sächsische Ministerpräsident Michael Kretschmer dringt auf eine diplomatische Lösung für die Ukraine und will den Weg zu russischem Gas nicht auf Dauer versperrt sehen. ""Wir müssen viel stärker a… [+9096 chars]",,de,'Gas'
https://www.handelsblatt.com/politik/international/liveblog-zum-ukraine-krieg-polen-verstaerkt-grenzschutz-richtung-belarus-prigoschins-medienkonzern-wird-nach-soeldner-rebellion-geschlossen/27982126.html,https://www.handelsblatt.com/politik/international/liveblog-zum-ukraine-krieg-polen-verstaerkt-grenzschutz-richtung-belarus-prigoschins-medienkonzern-wird-nach-soeldner-rebellion-geschlossen/27982126.html,0,www.handelsblatt.com,+++ Ukraine-Krieg +++: Polen verstärkt Grenzschutz Richtung Belarus – Prigoschins Medienkonzern wird nach Söldner-Rebellion geschlossen,Kretschmer: „Dürfen uns Weg zu russischem Gas nicht für alle Zeiten versperren“ +++ Deutscher Russland-Botschafter Lambsdorff erteilt Friedensgesprächen derzeit Absage +++ Der Newsblog.,https://www.handelsblatt.com/images/grenzzaun-zu-belarus/29235234/2-format2003.jpg,2023-07-02T00:31:52Z,https://web.archive.org/web/20230702134417/https://www.handelsblatt.com/politik/international/liveblog-zum-ukraine-krieg-polen-verstaerkt-grenzschutz-richtung-belarus-prigoschins-medienkonzern-wird-nach-soeldner-rebellion-geschlossen/27982126.html,"<li>Frau Susanne Heitzler30.06.2023, 09:23 Uhr
In der EU wird über die Modalitäten der Unterstützung (Sicherungszusagen) der Ukraine ""diskutiert""? Die Zurückhaltung ist vielleicht auch den Verhandlu… [+4732 chars]",,de,'Gas'
https://www.handelsblatt.com/politik/international/liveblog-zum-ukraine-krieg-erster-luftangriff-auf-kiew-seit-zwoelf-tagen-kretschmer-duerfen-uns-weg-zu-russischem-gas-nicht-fuer-alle-zeiten-versperren/27982126.html,https://www.handelsblatt.com/politik/international/liveblog-zum-ukraine-krieg-erster-luftangriff-auf-kiew-seit-zwoelf-tagen-kretschmer-duerfen-uns-weg-zu-russischem-gas-nicht-fuer-alle-zeiten-versperren/27982126.html,0,www.handelsblatt.com,+++ Ukraine-Krieg +++: Erster Luftangriff auf Kiew seit zwölf Tagen – Kretschmer: „Dürfen uns Weg zu russischem Gas nicht für alle Zeiten versperren“,Deutscher Russland-Botschafter Lambsdorff erteilt Friedensgesprächen derzeit Absage +++ Russische Medienaufsicht blockiert Seiten von Prigoschin-Medien +++ Der Newsblog,https://www.handelsblatt.com/images/michael-kretschmer/29235054/2-format2003.jpg,2023-07-02T00:31:52Z,,"<li>Frau Susanne Heitzler30.06.2023, 09:23 Uhr
In der EU wird über die Modalitäten der Unterstützung (Sicherungszusagen) der Ukraine ""diskutiert""? Die Zurückhaltung ist vielleicht auch den Verhandlu… [+4732 chars]",,de,'Gas'
https://www.nzz.ch/zuerich/zuerich-das-strandbad-mythenquai-wird-oekologischer-ld.1745110,https://www.nzz.ch/zuerich/zuerich-das-strandbad-mythenquai-wird-oekologischer-ld.1745110,0,www.nzz.ch,In Zürichs ältestem Strandbad wird das Wasser immer noch mit Gas erwärmt. Jetzt soll die Badi Mythenquai ökologischer werden,Nach dem Ende der Badesaison wird am Mythenquai gebaut.,"https://img.nzz.ch/2022/06/14/abb343e4-9b74-4141-84ec-c55f96218935.jpeg?width=1200&height=674&fit=bound&quality=75&auto=webp&crop=3801,2135,x0,y199&wmark=nzz",2023-07-02T03:00:00Z,https://web.archive.org/web/20230703093114/https://www.nzz.ch/zuerich/zuerich-das-strandbad-mythenquai-wird-oekologischer-ld.1745110,"Im Sommer 2024 soll das Seebad Mythenquai ökologischer sein.
Das Strandbad Mythenquai ist 101 Jahre alt. Die letzte Frischekur erhielt es vor knapp zehn Jahren: Damals wurde das 1976 erbaute Restaur… [+4183 chars]",,de,'Gas'
https://taz.de/Landwirtschaft-und-Klima-im-Irak/!5934092/,https://taz.de/Landwirtschaft-und-Klima-im-Irak/!5934092/,0,taz.de,Landwirtschaft und Klima im Irak: Wen trifft die Klimakrise am meisten?,"Kurz gesagt: Frauen, denn sie sind oft abhängiger von der Natur für ihren Lebensunterhalt. Wie Bäuerin Umm Hassan, deren Büffel unter der Hitze leiden.",https://taz.de/picture/6363556/948/32975731-1.jpeg,2023-07-02T11:41:00Z,,"Kurz gesagt: Frauen, denn sie sind oft abhängiger von der Natur für ihren Lebensunterhalt. Wie Bäuerin Umm Hassan, deren Büffel unter der Hitze leiden.
Ein toter Büffel liegt auf einem ausgetrocknet… [+2355 chars]",,de,'Landwirtschaft'
https://www.morgenpost.de/web-wissen/article238845749/Landwirte-wollen-die-Erde-vor-Duerre-schuetzen.html,https://www.morgenpost.de/web-wissen/article238845749/Landwirte-wollen-die-Erde-vor-Duerre-schuetzen.html,0,www.morgenpost.de,Klima: Landwirte wollen die Erde vor Dürre schützen,"Klimakrise, Dürresommer - Zukunftssorgen belasten die Landwirtschaft. Gerade in einer der trockensten Regionen Deutschlands will ein Öko-Bauer den Boden retten, er macht Ackerland zum Versuchslabor.",https://img.morgenpost.de/img/web-wissen/crop238845747/0252606720-w820-cv16_9-q85/Benedikt-Boesel.jpg,2023-07-03T04:55:45Z,,Berlin/Briesen. Auf seinem Hof deckt Benedikt Bösel den Tisch im Sommer gerne mal mitten auf der Weide. Daneben grast die Rinderherde. Der 38-Jährige hat ein Landgut und eine große Farm in Brandenbur… [+5848 chars],,de,'Dürre'
https://www.bild.de/regional/muenchen/muenchen-aktuell/muenchen-alfons-schuhbeck-der-fc-bayern-steht-zu-mir-84504298.bild.html,https://www.bild.de/regional/muenchen/muenchen-aktuell/muenchen-alfons-schuhbeck-der-fc-bayern-steht-zu-mir-84504298.bild.html,0,www.bild.de,Verurteilter Starkoch fährt jeden Tag zur Säbener - Alfons Schuhbeck: „Der FC Bayern steht zu mir“,Der FC Bayern als Stütze: Alfons Schuhbeck muss bald seine Haft im Gefängnis antreten. Doch der Starkoch gibt weiter Gas –seine Pläne.,"https://images.bild.de/649d3adb358fca06e5b5e114/f5677d2dccbe7261345bbfc960354d66,43e0cfb2?w=1280",2023-07-03T05:16:57Z,,"München Die Ladung zum Haftantritt wegen Steuerhinterziehung rückt immer näher. Aber Starkoch Alfons Schuhbeck (74), der sein Imperium verlor, gibt nicht auf.
Ich gebe ganz normal Gas. Es gibt viel … [+3844 chars]",,de,'Gas'
https://www.morgenpost.de/politik/article238845533/heizung-kritik-heizungsgesetz-bundestag-ampel-waermeplan.html,https://www.morgenpost.de/politik/article238845533/heizung-kritik-heizungsgesetz-bundestag-ampel-waermeplan.html,0,www.morgenpost.de,Wärmeplanung & Co.: Heizungsgesetz: Kommunen nennen etliche offene Fragen,"Das Heizungsgesetz soll bis Ende der Woche vom Bundestag verabschiedet werden. Das sorgt für viel Kritik, unter anderem in den Kommunen.",https://img.morgenpost.de/img/frontpage/crop238845529/2972605058-w820-cv16_9-q85/Heizung.jpg,2023-07-03T05:43:47Z,,Berlin. Showdown für das Heizungsgesetz: Noch vor Beginn der Sommerpause wollen die Parteien der Ampel-Koalition den Entwurf des Gebäudeenergiegesetzes (GEG) durch den Bundestag bringen. Doch auch na… [+1653 chars],,de,'Gas'
https://www.welt.de/politik/deutschland/article246185580/Heizungsgesetz-Kommunen-kritisieren-fehlende-Planungssicherheit.html,https://www.welt.de/politik/deutschland/article246185580/Heizungsgesetz-Kommunen-kritisieren-fehlende-Planungssicherheit.html,0,www.welt.de,Kommunen kritisieren fehlende Planungssicherheit beim Heizungsgesetz,"Ein hastig verabschiedetes Gesetz, das hinterher wiederholt massiv nachgebessert werden muss: Genau davor fürchtet sich der Städte- und Gemeindebund. Beim Gebäudeenergiegesetz müsste zudem dringend auch über Finanzierungsfragen gesprochen werden.",https://img.welt.de/img/politik/deutschland/mobile246185576/5791350457-ci16x9-w1200/Fernwaerme.jpg,2023-07-03T05:47:19Z,,"Der Deutsche Städte- und Gemeindebund warnt vor einer schnellen Verabschiedung des Heizungsgesetzes noch vor der Sommerpause. Das Ziel einer Wärmewende sei richtig, aber eine sorgfältige Planung, Fin… [+2191 chars]",,de,'Gas'
https://www.wiwo.de/politik/deutschland/iw-analyse-wo-die-inflations-entlastungspakete-ueberkompensierten/29235550.html,https://www.wiwo.de/politik/deutschland/iw-analyse-wo-die-inflations-entlastungspakete-ueberkompensierten/29235550.html,0,www.wiwo.de,IW-Analyse: Wo die Inflations-Entlastungspakete überkompensierten,"Gaspreisbremse, Kinderbonus, 9-Euro-Ticket – mit zahlreichen Maßnahmen hat die Bundesregierung die Verbraucher von den hohen Preisen entlastet. Teils war es wohl zu viel des Guten.",https://www.wiwo.de/images/9-euro-ticket/29235548/2-format11240.jpg,2023-07-03T06:10:21Z,,Die drei Entlastungspakete der Bundesregierung zur Abfederung der hohen Energiepreise haben einer Analyse zufolge einige Haushalte finanziell mehr unterstützt als nötig gewesen wäre. Das ergab eine U… [+3385 chars],,de,'Gas'
https://www.bild.de/regional/duesseldorf/duesseldorf-aktuell/a1-bei-remscheid-seit-stunden-gesperrt-gas-laster-legt-autobahn-lahm-84544386.bild.html,https://www.bild.de/regional/duesseldorf/duesseldorf-aktuell/a1-bei-remscheid-seit-stunden-gesperrt-gas-laster-legt-autobahn-lahm-84544386.bild.html,0,www.bild.de,A 1 bei Remscheid lange gesperrt - Gas-Laster legte Autobahn lahm,"Ein Reifen-Platzer reichte, um die A 1 für Stunden lahmzulegen... Seit kurz nach Mitternacht ist die Autobahn in Richtung Köln gesperrt.","https://images.bild.de/64a2590bb4296d67994fe782/c3e4f2ffbf3b7d5271767712f38fc5bd,51177014?w=1280",2023-07-03T06:23:20Z,https://web.archive.org/web/20230703063922/https://www.bild.de/regional/duesseldorf/duesseldorf-aktuell/a1-bei-remscheid-seit-stunden-gesperrt-gas-laster-legt-autobahn-lahm-84544386.bild.html,"Remscheid (NRW) Ein Reifen-Platzer reichte, um die A1 für Stunden lahmzulegen ...
Seit kurz nach Mitternacht war die Autobahn bei Remscheid in Fahrtrichtung Köln gesperrt. In Höhe der Raststätte Rem… [+932 chars]",,de,'Gas'
https://www.focus.de/politik/deutschland/die-focus-kolumne-von-jan-fleischhauer-nach-der-waermepumpe-steht-schon-naechsten-haus-hammer-an-wollt-ihr-die-revolte_id_197819973.html,https://www.focus.de/politik/deutschland/die-focus-kolumne-von-jan-fleischhauer-nach-der-waermepumpe-steht-schon-naechsten-haus-hammer-an-wollt-ihr-die-revolte_id_197819973.html,0,www.focus.de,Die FOCUS-Kolumne von Jan Fleischhauer - Nach der Wärmepumpe kommt schon der nächste Haus-Hammer: Wollt Ihr die Revolte?,"Falls Sie dachten, mit der Verschiebung des Gasheizungsverbots kehre jetzt Ruhe ein: zu früh gefreut. Der wirkliche Energie-Hammer kommt erst noch. In Brüssel haben sie da etwas Schönes für Sie vorbereitet.Von Focus Magazin-Jan Fleischhauer",https://p6.focus.de/img/fotos/id_197903861/fleischhauer-lang-und-habeck.png?im=Crop%3D%280%2C0%2C3930%2C1963%29%3BResize%3D%281200%2C627%29&impolicy=perceptual&quality=mediumHigh&hash=030da810535fef13f0b07ebb82a22b6006f3ad2dd84b1401da4eb687cd768be9,2023-07-03T06:41:22Z,,"Falls Sie dachten, mit der Verschiebung des Gasheizungsverbots kehre jetzt Ruhe ein: zu früh gefreut. Der wirkliche Energie-Hammer kommt erst noch. In Brüssel haben sie da etwas Schönes für Sie vorbe… [+9117 chars]",,de,'Gas'
https://www.horizont.net/medien/tvquoten/der-tv-markt-im-juni-neue-jahresbestwerte-fuer-sat-1-und-kabel-eins-213006,https://www.horizont.net/medien/tvquoten/der-tv-markt-im-juni-neue-jahresbestwerte-fuer-sat-1-und-kabel-eins-213006,0,www.horizont.net,Der TV-Markt im Juni: Neue Jahresbestwerte für Sat 1 und Kabel Eins,"Im Juni drehte der Sommer erstmals auf und hinterließ nicht nur in vielen Regionen Deutschlands verdorrte Landschaften, auch im TV-Programm machte sich  bereits sommerliche Dürre breit. Vor allem beim Marktführer RTL herrschte teilweise Flaute im Programm, wä…",https://www.horizont.net/news/media/42/Ran-Bundesliga-Sat-1-412020.jpeg,2023-07-03T08:25:00Z,,"Im Juni drehte der Sommer erstmals auf und hinterließ nicht nur in vielen Regionen Deutschlands verdorrte Landschaften, auch im TV-Programm machte sich hier und da bereits sommerliche Dürre breit. Vo… [+464 chars]",,de,'Dürre'
https://www.stern.de/politik/deutschland/entlastungspakete--das-haben-sie-fuer-singles-und-familien-gebracht-33614016.html,https://www.stern.de/politik/deutschland/entlastungspakete--das-haben-sie-fuer-singles-und-familien-gebracht-33614016.html,0,www.stern.de,"Studie zu Hilfen der Bundesregierung: Wer profitiert, wer zahlt trotzdem drauf? So wirkten die Entlastungspakete für Singles und Familien","Gaspreisbremse, Kinderbonus, 9-Euro-Ticket – mit zahlreichen Entlastungspaketen hat die Bundesregierung die Verbraucher von den hohen Preisen entlastet. Was haben die Maßnahmen gebracht? Für einige eine ganze Menge, für andere dagegen nicht viel, zeigt eine S…",https://image.stern.de/33614086/t/Nb/v3/w1440/r1.7778/-/entlastungspaket.jpg,2023-07-03T09:01:00Z,,"Gaspreisbremse, Kinderbonus, 9-Euro-Ticket mit zahlreichen Entlastungspaketen hat die Bundesregierung die Verbraucher von den hohen Preisen entlastet. Was haben die Maßnahmen gebracht? Für einige ein… [+3838 chars]",,de,'Gas'
https://www.morgenpost.de/lifestyle/wohnen/article238847779/So-lassen-sich-Wachsreste-entfernen.html,https://www.morgenpost.de/lifestyle/wohnen/article238847779/So-lassen-sich-Wachsreste-entfernen.html,0,www.morgenpost.de,Haushaltstipp: So lassen sich Wachsreste entfernen,Von der Kerze getropftes Wachs ist ganz schön hartnäckig - ob auf dem Kerzenständer selbst oder auf der Tischdecke. Mit der richtigen Dosis Hitze oder Kälte bekommt man sie leichter wieder ab.,https://img.morgenpost.de/img/wohnen/crop238847777/3572607742-w820-cv16_9-q85/Wachsreste-am-Kerzenstaender.jpg,2023-07-03T09:33:41Z,,Stuttgart (dpa/tmn) -. Wachsreste an Metall-Kerzenständern lassen sich mit Hilfe des Backofens entfernen. Bei 100 Grad Ofentemperatur schmilzt das Wachs und lässt sich dann einfach mit einem Lappen v… [+1158 chars],,de,'Kälte'
https://www.tagesspiegel.de/wirtschaft/verbraucher-starker-entlastet-als-belastet-iw-der-staat-hat-mit-hilfen-teils-uberkompensiert-10084597.html,https://www.tagesspiegel.de/wirtschaft/verbraucher-starker-entlastet-als-belastet-iw-der-staat-hat-mit-hilfen-teils-uberkompensiert-10084597.html,0,www.tagesspiegel.de,Verbraucher stärker entlastet als belastet: IW: Der Staat hat mit Hilfen teils überkompensiert,"Gaspreisbremse, Kinderbonus, 9-Euro-Ticket - mit zahlreichen Maßnahmen hat die Bundesregierung die Verbraucher von den hohen Preisen entlastet. Teils war es wohl zu viel des Guten.",https://www.tagesspiegel.de/images/heizung6/alternates/BASE_16_9_W1400/heizung.jpeg,2023-07-03T09:56:17Z,,Die drei Entlastungspakete der Bundesregierung zur Abfederung der hohen Energiepreise haben einer Analyse zufolge einige Haushalte finanziell mehr unterstützt als nötig gewesen wäre. Das ergab eine U… [+3129 chars],,de,'Gas'
https://www.diepresse.com/13438746/nach-gasexplosion-weitere-haeuser-freigegeben,https://www.diepresse.com/13438746/nach-gasexplosion-weitere-haeuser-freigegeben,0,www.diepresse.com,Nach Gasexplosion: Weitere Häuser freigegeben,"Die Bewohner von sieben Objekten müssen noch warten, bevor sie in ihre Häuser zurückkehren können. Die Innenräume sind völlig frei von Gas, in manchen Außenbereichen ist aber noch erhöhte Konzentrationen gemessen worden.",https://img.diepresse.com/public/incoming/usgjlh-kein-Titel/alternates/DPR_SOCIAL_NACHRICHTEN/%28kein%20Titel%29,2023-07-03T10:08:47Z,,"Die Bewohner von sieben Objekten müssen noch warten, bevor sie in ihre Häuser zurückkehren können. Die Innenräume sind völlig frei von Gas, in manchen Außenbereichen ist aber noch erhöhte Konzentrati… [+1754 chars]",,de,'Gas'
https://www.stern.de/wirtschaft/news/fatih-birol---iea-chef-warnt-vor-steigenden-energiepreisen-im-winter-33615350.html,https://www.stern.de/wirtschaft/news/fatih-birol---iea-chef-warnt-vor-steigenden-energiepreisen-im-winter-33615350.html,0,www.stern.de,Fatih Birol : IEA-Chef warnt vor steigenden Energiepreisen im Winter,"Noch gilt in Deutschland die Energiepreisbremse. Doch in Großbritannien beispielsweise lief die Energiepreisgarantie für Gas und Strom jüngst aus. Ein kalter Winter könnte da Probleme bereiten, warnt die IEA.",https://image.stern.de/33615352/t/4K/v1/w1440/r1.7778/-/03--urnnewsmldpacom2009010123070399267684v3w800h600l640t205r1920b1083jpeg---812b1ff446607849.jpg,2023-07-03T10:09:22Z,,"Noch gilt in Deutschland die Energiepreisbremse. Doch in Großbritannien beispielsweise lief die Energiepreisgarantie für Gas und Strom jüngst aus. Ein kalter Winter könnte da Probleme bereiten, warnt… [+1004 chars]",,de,'Gas'
https://www.morgenpost.de/wirtschaft/article238848213/IEA-Chef-warnt-vor-steigenden-Energiepreisen-im-Winter.html,https://www.morgenpost.de/wirtschaft/article238848213/IEA-Chef-warnt-vor-steigenden-Energiepreisen-im-Winter.html,0,www.morgenpost.de,Fatih Birol : IEA-Chef warnt vor steigenden Energiepreisen im Winter,"Noch gilt in Deutschland die Energiepreisbremse. Doch in Großbritannien beispielsweise lief die Energiepreisgarantie für Gas und Strom jüngst aus. Ein kalter Winter könnte da  Probleme bereiten, warnt die IEA.",https://img.morgenpost.de/img/wirtschaft/crop238848211/2232604092-w820-cv16_9-q85/Fatih-Birol.jpg,2023-07-03T10:09:22Z,,"London. Der Chef der Internationalen Energie-Agentur IEA hat vor einem erneuten Anstieg der Energiepreise im kommenden Winter gewarnt. In einem Szenario, in dem die chinesische Wirtschaft sehr stark … [+792 chars]",,de,'Gas'
https://ooe.orf.at/stories/3214331/,https://ooe.orf.at/stories/3214331/,0,ooe.orf.at,Ansfelden: Weitere Häuser freigegeben,Nach der Gasexplosion in Ansfelden (Bezirk Linz-Land) konnten am Montag acht weitere Häuser in der evakuierten Siedlung freigegeben werden. Die Bewohnerinnen und Bewohner von sieben Gebäuden müssen allerdings noch warten.,https://ibs.orf.at/ooe?image=https%3A%2F%2Foekastatic.orf.at%2Fmims%2F2023%2F26%2F79%2Fcrops%2Fw%3D1200%2Ch%3D627%2Cq%3D75%2F1845175_master_689579_230628_ooeh_explosion_ansfelden_00_01_59_15.jpg%3Fs%3D3e5ee7a5d40daf299770708fa7ad36a171d2e439,2023-07-03T10:23:00Z,,"Die gemessenen Gaswerte seien weiter stark gesunken, berichtete Bürgermeister Christian Partoll (FPÖ) nach einer Lagebesprechung Montagvormittag. Die Innenräume seien völlig frei von Gas, in manchen … [+1387 chars]",,de,'Gas'
