index,url,valid,domain,title,description,image,published,archive,content,quote,language,keyword
https://www.nzz.ch/panorama/paerchen-stiehlt-weine-im-wert-von-16-millionen-euro-haftstrafen-fuer-filmreifen-coup-ld.1729204,https://www.nzz.ch/panorama/paerchen-stiehlt-weine-im-wert-von-16-millionen-euro-haftstrafen-fuer-filmreifen-coup-ld.1729204,0,www.nzz.ch,"Pärchen stiehlt Weine im Wert von 1,6 Millionen Euro: Haftstrafen für filmreifen Coup",Eine ehemalige mexikanische Schönheitskönigin und ihr Partner sind in Spanien verurteilt worden. Das Paar soll in einem Restaurant wertvolle Weinflaschen gestohlen haben.,"https://img.nzz.ch/2023/03/07/3dbaa27a-f4b5-4324-8b12-0d51c0349cae.jpeg?width=1200&height=675&fit=bound&quality=75&auto=webp&crop=2497,1405,x746,y476&wmark=nzz",2023-03-07T09:24:27Z,https://web.archive.org/web/20230307154116/https://www.nzz.ch/panorama/paerchen-stiehlt-weine-im-wert-von-16-millionen-euro-haftstrafen-fuer-filmreifen-coup-ld.1729204,"Eine ehemalige mexikanische Schönheitskönigin und ihr Partner sind in Spanien wegen des Diebstahls von wertvollem Wein verurteilt worden.
(dpa)/wek. Es war ein Raub, der weltweit für Schlagzeilen so… [+3468 chars]",,de,'Wein'
https://www.focus.de/finanzen/news/gastbeitrag-von-josef-reitberger-warum-ich-mich-ueber-fdp-kritik-an-habecks-heizungs-plan-aufgeregt-habe_id_187670837.html,https://www.focus.de/finanzen/news/gastbeitrag-von-josef-reitberger-warum-ich-mich-ueber-fdp-kritik-an-habecks-heizungs-plan-aufgeregt-habe_id_187670837.html,0,www.focus.de,Gastbeitrag von Josef Reitberger - Warum ich mich über FDP-Kritik an Habecks Heizungs-Plan so aufgeregt habe,EFahrer-Chefredakteur Reitberger empört sich über einen Gastbeitrag des FDP-Politikers Kruse bei FOCUS Online. Der Technik-Experte wirft Kruse Verkehrung der Wahrheit an. Auch Kruses Aussagen zum Betrieb von Heizungen mit reinem Wasserstoff hält er für Unsinn…,https://p6.focus.de/img/politik/deutschland/id_187330228/wirtschaftsminister-robert-habeck-betont-im-bundesrat-die-notwendigkeit-der-beschleunigung..jpg?im=Crop%3D%280%2C162%2C2048%2C1024%29%3BResize%3D%281200%2C627%29&impolicy=perceptual&quality=medium&hash=eefc4d407b233e83cf2bf71106ff3c7b6873516ef43cde15ca6b61e80e7de1be,2023-03-07T09:48:09Z,https://web.archive.org/web/20230307110859/https://www.focus.de/finanzen/news/gastbeitrag-von-josef-reitberger-warum-ich-mich-ueber-fdp-kritik-an-habecks-heizungs-plan-aufgeregt-habe_id_187670837.html,EFahrer-Chefredakteur Reitberger empört sich über einen Gastbeitrag des FDP-Politikers Kruse bei FOCUS Online. Der Technik-Experte wirft Kruse Verkehrung der Wahrheit an. Auch Kruses Aussagen zum Bet… [+4190 chars],,de,'Gas'
https://www.bild.de/regional/berlin/berlin-aktuell/berlin-erst-bricht-das-rohr-dann-muss-die-ampel-dran-glauben-83121130.bild.html,https://www.bild.de/regional/berlin/berlin-aktuell/berlin-erst-bricht-das-rohr-dann-muss-die-ampel-dran-glauben-83121130.bild.html,0,www.bild.de,"Ungewöhnlicher Feuerwehr-Einsatz in Berlin - Erst Rohrbruch, dann Ampel-Fällung",Am Montagabend platzte genau unter einer Ampel in Berlin eine Frischwasserleitung. Das hatte Folgen – für die Ampel!,"https://images.bild.de/6406f4a010133a20a2dce0ec/c86af2d7d19c7289b2863543391687ff,6d515413?w=1280",2023-03-07T10:07:11Z,https://web.archive.org/web/20230307113611/https://www.bild.de/regional/berlin/berlin-aktuell/berlin-erst-bricht-das-rohr-dann-muss-die-ampel-dran-glauben-83121130.bild.html,"Berlin Am Montagabend gegen 21.10 Uhr platzte genau unter einer Ampel an der Kreuzung Sterndamm/Königsheideweg im Bezirk Treptow-Köpenick eine Frischwasserleitung.
Das Wasser sprudelte langsam auf d… [+579 chars]",,de,'Rohrbruch'
https://www.bild.de/regional/stuttgart/stuttgart-aktuell/mehrere-verletzte-kohlenmonoxid-in-schwarzwald-hotel-83123188.bild.html,https://www.bild.de/regional/stuttgart/stuttgart-aktuell/mehrere-verletzte-kohlenmonoxid-in-schwarzwald-hotel-83123188.bild.html,0,www.bild.de,Mehrere Verletzte - Kohlenmonoxid in Schwarzwald-Hotel,Eine Pellet-Heizung hatte eine Fehlfunktion. Kohlenmonoxid trat aus.Foto: picture alliance / photothek,"https://images.bild.de/64070d7f1b230d43975f3a0a/ceb7cafc0e0dfd86adbab8cae72293aa,2a9ac985?w=1280",2023-03-07T10:15:52Z,https://web.archive.org/web/20230307160352/https://www.bild.de/regional/stuttgart/stuttgart-aktuell/mehrere-verletzte-kohlenmonoxid-in-schwarzwald-hotel-83123188.bild.html,"Freiburg Eine Pelletheizung in einem Schwarzwaldhotel ist kaputt gegangen. Dabei trat giftiges Kohlenmonoxid aus.
Die Polizei wurde am Dienstagmorgen, um 8.15 Uhr benachrichtig, dass es in dem Hotel… [+281 chars]",,de,'Heizung'
https://www.zeit.de/news/2023-03/07/schnee-in-nordbayern-dwd-rechnet-mit-verkehrsbehinderungen,https://www.zeit.de/news/2023-03/07/schnee-in-nordbayern-dwd-rechnet-mit-verkehrsbehinderungen,0,www.zeit.de,Wetterprognose: Schnee in Nordbayern: DWD rechnet mit Verkehrsbehinderungen,,,2023-03-07T10:54:18Z,,"When browsing with ads:
We collect personal data and also transmit it to third-party providers
 that help us improve and finance our digital content. Some of the information stored on your device, … [+732 chars]",,de,'Schnee'
https://www.zeit.de/news/2023-03/07/streik-kaum-zugverkehr-zwischen-frankreich-und-deutschland,https://www.zeit.de/news/2023-03/07/streik-kaum-zugverkehr-zwischen-frankreich-und-deutschland,0,www.zeit.de,ÖPNV: Streik: Kaum Zugverkehr zwischen Frankreich und Deutschland,,,2023-03-07T14:05:40Z,,"When browsing with ads:
We collect personal data and also transmit it to third-party providers
 that help us improve and finance our digital content. Some of the information stored on your device, … [+732 chars]",,de,'ÖPNV'
https://www.sueddeutsche.de/bayern/streik-kita-personalnot-bayern-1.5764223,https://www.sueddeutsche.de/bayern/streik-kita-personalnot-bayern-1.5764223,0,www.sueddeutsche.de,Streik: Die Not mit der Betreuung,"An diesem Mittwoch gehen bayernweit viele Erzieherinnen und Beschäftigte von Kitas in den Ausstand. Sie fordern 10,5 Prozent mehr Gehalt. Und die Eltern haben auch ein paar dringende Wünsche.",https://www.sueddeutsche.de/image/sz.1.5764224/1200x675?v=1678199775,2023-03-07T14:36:24Z,https://web.archive.org/web/20230307155010/https://www.sueddeutsche.de/bayern/streik-kita-personalnot-bayern-1.5764223,"An diesem Mittwoch gehen bayernweit viele Erzieherinnen und Beschäftigte von Kitas in den Ausstand. Sie fordern 10,5 Prozent mehr Gehalt. Und die Eltern haben auch ein paar dringende Wünsche.Im Febru… [+6069 chars]",,de,'Not'
https://www.faz.net/aktuell/finanzen/f-a-z-finanzen-podcast-verbot-von-oel-und-gasheizungen-18730395.html,https://www.faz.net/aktuell/finanzen/f-a-z-finanzen-podcast-verbot-von-oel-und-gasheizungen-18730395.html,0,www.faz.net,F.A.Z. Finanzen Podcast: Was kostet uns „Habecks Heizungshammer“?,"Das Wirtschaftsministerium will Öl- und Gasheizungen bis 2045 abschaffen, hieß es in der Vorwoche. Was kommt auf Mieter und Eigenheimbesitzer zu? Im Gespräch: FAS-Redakteur Marcus Theurer.",https://media0.faz.net/ppmedia/aktuell/finanzen/995316041/1.8730440/facebook_teaser/gasheizung-soll-nicht-mehr.jpg,2023-03-07T15:10:25Z,,"F.A.Z. Finanzen Podcast: Was kostet uns Habecks Heizungshammer?
F.A.Z. Finanzen Podcast
Heizen ohne Gas und Öl was kostet uns Habecks Hammer?
Von Martin Hock und Dennis KremerDas Wirtschaftsminist… [+232 chars]",,de,'Gas'
https://www.sueddeutsche.de/wirtschaft/umfrage-gfk-waschlappen-energiesparen-1.5764421,https://www.sueddeutsche.de/wirtschaft/umfrage-gfk-waschlappen-energiesparen-1.5764421,0,www.sueddeutsche.de,Energiekosten: Der Waschlappen wirkt,Die Deutschen verändern wegen der hohen Inflation ihr Einkaufsverhalten - und sie duschen weniger. Die Italiener gehen sogar noch einen Schritt weiter.,https://www.sueddeutsche.de/image/sz.1.5764422/1200x675?v=1678203077,2023-03-07T15:31:22Z,https://web.archive.org/web/20230307165445/https://www.sueddeutsche.de/wirtschaft/umfrage-gfk-waschlappen-energiesparen-1.5764421,Die Deutschen verändern wegen der hohen Inflation ihr Einkaufsverhalten - und sie duschen weniger. Die Italiener gehen sogar noch einen Schritt weiter.Hahn auf und genießen. Unter der Dusche entspann… [+3027 chars],,de,'Energiekosten'
https://www.sueddeutsche.de/muenchen/fuerstenfeldbruck/oepnv-dynamische-fahrgastinformation-mvv-bushaltestelle-thomas-karmasin-1.5764486,https://www.sueddeutsche.de/muenchen/fuerstenfeldbruck/oepnv-dynamische-fahrgastinformation-mvv-bushaltestelle-thomas-karmasin-1.5764486,0,www.sueddeutsche.de,ÖPNV: Bushaltestellen mit digitalen Fahrplänen,Neuer Service soll den Umstieg auf Bus und Bahn erleichtern.,https://www.sueddeutsche.de/image/sz.1.5764487/1200x675?v=1678203729,2023-03-07T15:42:14Z,,Neuer Service soll den Umstieg auf Bus und Bahn erleichtern.Wann kommt der nächste Bus? Und wie komme ich am schnellsten ans Ziel? Fragen dieser Art können sich Fahrgäste nun über digitale Anzeigen a… [+1313 chars],,de,'ÖPNV'
https://www.sueddeutsche.de/bayern/schneesturm-bayern-bjoern-regionen-1.5764451,https://www.sueddeutsche.de/bayern/schneesturm-bayern-bjoern-regionen-1.5764451,0,www.sueddeutsche.de,"Wetter in Bayern: Ungemütlicher Wintereinbruch durch Sturmtief ""Björn""","Der Winter kommt nochmal zurück. In Bayern bringt das Tiefdruckgebiet ""Björn"" Sturm, Schnee und Kälte. Allerdings nur in einigen Teilen.",https://www.sueddeutsche.de/image/sz.1.5764478/1200x675?v=1678204674,2023-03-07T15:55:48Z,https://web.archive.org/web/20230307195214/https://www.sueddeutsche.de/bayern/schneesturm-bayern-bjoern-regionen-1.5764451,"Neuschnee, kräftiger Wind: In den nächsten Tage rechnen Meteorologen in einigen Teilen Bayerns mit schwierigen Wetterbedingungen.Der Winter kommt nochmal nach Bayern zurück. Das Tiefdruckgebiet ""Björ… [+1697 chars]",,de,'Wind'
https://bildblog.de/137829/bild-de-schiebt-oezdemir-radikales-werbeverbot-fuer-milch-unter/,https://bildblog.de/137829/bild-de-schiebt-oezdemir-radikales-werbeverbot-fuer-milch-unter/,0,bildblog.de,Bild.de schiebt Özdemir radikales Werbeverbot für Milch unter,"Cem Özdemir und sein Bundesministerium für Ernährung und Landwirtschaft wollen an Kinder gerichtete “Werbung für Lebensmittel mit hohem Zucker-, Fett- oder Salzgehalt in allen relevanten Medien” verbieten. So soll es im Fernsehen und Radio zwischen 6 und 23 U…",,2023-03-07T16:01:13Z,https://web.archive.org/web/20230308090332/https://bildblog.de/137829/bild-de-schiebt-oezdemir-radikales-werbeverbot-fuer-milch-unter/,"Cem Özdemir und sein Bundesministerium für Ernährung und Landwirtschaft wollen an Kinder gerichtete “Werbung für Lebensmittel mit hohem Zucker-, Fett- oder Salzgehalt in allen relevanten Medien” verb… [+5319 chars]",,de,'Landwirtschaft'
https://www.sueddeutsche.de/muenchen/landkreismuenchen/unterschleissheim-buergerhaus-restaurant-la-solana-1.5764564,https://www.sueddeutsche.de/muenchen/landkreismuenchen/unterschleissheim-buergerhaus-restaurant-la-solana-1.5764564,0,www.sueddeutsche.de,Gastronomie: Für alle etwas dabei,"Das Restaurant ""La Solana"" im Bürgerhaus bereichert seit kurzem die Stadtmitte Unterschleißheims mit italienisch-mediterraner Küche.",https://www.sueddeutsche.de/image/sz.1.5764566/1200x675?v=1678209799,2023-03-07T17:21:31Z,,"Das Restaurant ""La Solana"" im Bürgerhaus bereichert seit kurzem die Stadtmitte Unterschleißheims mit italienisch-mediterraner Küche.Nach drei Jahren Leerstand hat die Gastronomie im Bürgerhaus in Unt… [+362 chars]",,de,'Gas'
https://www.morgenpost.de/wirtschaft/article237831787/habeck-waermepumpen-geld-unterstuetzung-deutschland.html,https://www.morgenpost.de/wirtschaft/article237831787/habeck-waermepumpen-geld-unterstuetzung-deutschland.html,0,www.morgenpost.de,Heizung: Wärmepumpen: Habeck verspricht finanzielle Unterstützung,Die Ampel-Koalition will ab 2024 den Einbau neuer Öl- und Gasheizungen untersagen. Doch Wärmepumpen sind teuer. Habeck sagt Hilfe zu.,https://img.morgenpost.de/img/wirtschaft/crop237831785/498260889-w820-cv16_9-q85/ec780470-bced-11ed-ad69-3cd2c0215623.jpg,2023-03-07T17:40:25Z,https://web.archive.org/web/20230307183905/https://www.morgenpost.de/wirtschaft/article237831787/habeck-waermepumpen-geld-unterstuetzung-deutschland.html,"Berlin. Als er beim Thema Heizungen ankommt, ist Bundeswirtschaftsminister Robert Habeck (Grüne) in seinem Element. Zuvor hatte er den rund 1.000 geladenen Vertretern kommunaler Unternehmen, etwa Sta… [+3217 chars]",,de,'Heizung'
https://stadt-bremerhaven.de/app-fuer-das-49-euro-ticket-vorgestellt-dein-deutschlandticket/,https://stadt-bremerhaven.de/app-fuer-das-49-euro-ticket-vorgestellt-dein-deutschlandticket/,0,stadt-bremerhaven.de,App für das 49-Euro-Ticket vorgestellt: Dein-Deutschlandticket,"Das bundesweite 49-Euro-Ticket für den ÖPNV soll am 1. Mai 2023 starten. Jetzt wurde die App vorgestellt, für die sich Mobility Inside verantwortlich zeigt. Die stehen unter anderem hinter den gemeinsamen ÖPNV-Apps der Verbünde. Hinter Mobility inside stehen …",https://stadt-bremerhaven.de/wp-content/uploads/2023/03/deutschlandticket_.jpg,2023-03-07T17:53:13Z,,"Das bundesweite 49-Euro-Ticket für den ÖPNV soll am 1. Mai 2023 starten. Jetzt wurde die App vorgestellt, für die sich Mobility Inside verantwortlich zeigt. Die stehen unter anderem hinter den gemein… [+2002 chars]",,de,'ÖPNV'
https://www.wissenschaft.de/erde-umwelt/bessere-boeden/,https://www.wissenschaft.de/erde-umwelt/bessere-boeden/,0,www.wissenschaft.de,Bessere Böden,"Weniger Chemie bei vergleichbaren Erträgen: Brasilien arbeitet mit der sogenannten regenerativen Landwirtschaft auf riesigen Flächen.
Der Beitrag Bessere Böden erschien zuerst auf wissenschaft.de.",https://www.wissenschaft.de/wp-content/uploads/S/c/Scheffer_Sojafeld1_7293F1B2-9D51-4D95-B2E8-ED7B5B209F9A-e1675693434791.jpg,2023-03-07T23:00:00Z,,"Weniger Chemie bei vergleichbaren Erträgen: Während Deutschland noch im Kleinen mit der sogenannten regenerativen Landwirtschaft experimentiert, arbeitet man in Brasilien schon auf riesigen Flächen a… [+523 chars]",,de,'Landwirtschaft'
https://www.n-tv.de/wirtschaft/Haelfte-der-Gebaeude-fuer-Waermepumpe-untauglich-article23968312.html,https://www.n-tv.de/wirtschaft/Haelfte-der-Gebaeude-fuer-Waermepumpe-untauglich-article23968312.html,0,www.n-tv.de,Studie: Kosten höher als mit Gas: Hälfte der Gebäude für Wärmepumpe untauglich,"Wirtschaftsminister Habeck will gegen den Widerstand der FDP fossile Heizungsformen zurückdrängen und den Einbau von Wärmepumpen forcieren. Eine Studie kommt zu dem Ergebnis, dass die Physik dabei im Wege steht: Nur die Hälfte der Häuser sei dafür geeignet.",https://bilder1.n-tv.de/img/incoming/crop23968320/7541323844-cImg_16_9-w1200/imago0238697285h.jpg,2023-03-08T00:11:58Z,https://web.archive.org/web/20230308001545/https://www.n-tv.de/wirtschaft/Haelfte-der-Gebaeude-fuer-Waermepumpe-untauglich-article23968312.html,"Wirtschaftsminister Habeck will gegen den Widerstand der FDP fossile Heizungsformen zurückdrängen und den Einbau von Wärmepumpen forcieren. Eine Studie kommt zu dem Ergebnis, dass die Physik dabei im… [+3898 chars]",,de,'Gas'
https://wien.orf.at/stories/3197180/,https://wien.orf.at/stories/3197180/,0,wien.orf.at,Sanierung als Bedingung für Gasausstieg,"Viel wird über den Gasausstieg geschrieben und wie die Gasthermen aus den Gebäuden kommen sollen. Fast noch wichtiger ist aber die thermische Sanierung. Denn um die gesteckten Klimaziele zu erreichen, muss der Energieverbrauch kräftig gesenkt werden.",https://ibs.orf.at/wie?image=https%3A%2F%2Foekastatic.orf.at%2Fmims%2F2023%2F10%2F72%2Fcrops%2Fw%3D1200%2Ch%3D627%2Cq%3D75%2F1705584_master_630172_20230307_110843.jpg%3Fs%3D1baa03f6a09b08718727e9cc74f59988b529600e,2023-03-08T04:00:00Z,https://web.archive.org/web/20230308050630/https://wien.orf.at/stories/3197180/,"Die Rechnung ist eigentlich ganz einfach: Ein thermisch saniertes Haus verbraucht weniger Energie fürs Heizen. Damit können dezentrale Systeme wie die Fernwärme mehr Gebäude mit Wärme versorgen, Wärm… [+7107 chars]",,de,'Gas'
https://www.zeit.de/news/2023-03/08/autofahrer-aufgepasst-glatteis-und-schnee-am-mittwochmorgen,https://www.zeit.de/news/2023-03/08/autofahrer-aufgepasst-glatteis-und-schnee-am-mittwochmorgen,0,www.zeit.de,Wintereinbruch: Autofahrer aufgepasst: Glatteis und Schnee am Mittwochmorgen,,,2023-03-08T05:29:27Z,https://web.archive.org/web/20230309143211/https://www.zeit.de/news/2023-03/08/autofahrer-aufgepasst-glatteis-und-schnee-am-mittwochmorgen,"When browsing with ads:
We collect personal data and also transmit it to third-party providers
 that help us improve and finance our digital content. Some of the information stored on your device, … [+732 chars]",,de,'Schnee'
https://www.welt.de/politik/ausland/article244164691/Ukraine-News-Ukraine-weist-Berichte-ueber-Beteiligung-an-Nord-Stream-Sprengungen-zurueck.html,https://www.welt.de/politik/ausland/article244164691/Ukraine-News-Ukraine-weist-Berichte-ueber-Beteiligung-an-Nord-Stream-Sprengungen-zurueck.html,0,www.welt.de,Ukraine weist Berichte über Beteiligung an Nord-Stream-Sprengungen zurück,"Der ukrainische Präsidentenberater dementiert Medienberichte, wonach womöglich eine proukrainische Gruppe für den Sprengstoffanschlag auf Nord-Stream-Gaspipelines in der Ostsee verantwortlich sei. Die Ukraine habe „nichts mit dem Vorfall in der Ostsee zu tun“…",https://img.welt.de/img/bildergalerien/mobile244164701/1541351067-ci16x9-w1200/Nord-Stream-Explosionen.jpg,2023-03-08T05:29:28Z,https://web.archive.org/web/20230308062950/https://www.welt.de/politik/ausland/article244164691/Ukraine-News-Ukraine-weist-Berichte-ueber-Beteiligung-an-Nord-Stream-Sprengungen-zurueck.html,Die Ukraine hat Berichte über eine mögliche Beteiligung an der Sprengung der Nord-Stream-Gaspipelines in der Ostsee im September zurückgewiesen. Die Ukraine habe nichts mit dem Vorfall in der Ostsee … [+5498 chars],,de,'Gas'
https://www.zeit.de/news/2023-03/08/glaette-und-leichter-schnee-in-berlin-und-brandenburg,https://www.zeit.de/news/2023-03/08/glaette-und-leichter-schnee-in-berlin-und-brandenburg,0,www.zeit.de,Wintereinbruch: Glätte und leichter Schnee in Berlin und Brandenburg,,,2023-03-08T05:52:00Z,https://web.archive.org/web/20230308060956/https://www.zeit.de/news/2023-03/08/glaette-und-leichter-schnee-in-berlin-und-brandenburg,"When browsing with ads:
We collect personal data and also transmit it to third-party providers
 that help us improve and finance our digital content. Some of the information stored on your device, … [+732 chars]",,de,'Schnee'
https://www.focus.de/finanzen/news/gastbeitrag-von-fdp-politiker-michael-kruse-fdp-politiker-sicher-wir-koennen-ihre-heizung-vor-habecks-waermepumpen-ideologie-retten_id_187581398.html,https://www.focus.de/finanzen/news/gastbeitrag-von-fdp-politiker-michael-kruse-fdp-politiker-sicher-wir-koennen-ihre-heizung-vor-habecks-waermepumpen-ideologie-retten_id_187581398.html,0,www.focus.de,Gastbeitrag von FDP-Politiker Kruse - „Wir können Ihre Heizung vor Habecks Wärmepumpen-Ideologie retten“,Die FDP läuft Sturm gegen Habecks Heizungspläne. Ihr energiepolitischer Sprecher Michael Kruse schreibt in einem Gastbeitrag von einer „Wärmepumpen-Ideologie“ der Grünen und macht den Bürgern auch ein Versprechen.Von Gastautor Michael Kruse,https://p6.focus.de/img/fotos/id_187239938/lindner-habeck.jpg?im=Crop%3D%280%2C242%2C3163%2C1581%29%3BResize%3D%281200%2C627%29&impolicy=perceptual&quality=medium&hash=72186e52ed313eb63ed53d2fb5020eb13200e7a56a6a21d2150a85ae6379231f,2023-03-08T05:57:52Z,https://web.archive.org/web/20230308063728/https://www.focus.de/finanzen/news/gastbeitrag-von-fdp-politiker-michael-kruse-fdp-politiker-sicher-wir-koennen-ihre-heizung-vor-habecks-waermepumpen-ideologie-retten_id_187581398.html,"<ul><li>
Kommentare</li><li>
E-Mail</li><li>
Teilen</li><li>
Mehr</li><li>
Twitter</li><li>
Drucken</li><li>
Feedback</li><li>
Fehler meldenSie haben einen Fehler gefunden?
Bitte markieren S… [+4876 chars]",,de,'Gas'
https://www.focus.de/immobilien/wohnen/verbot-von-neuen-gas-und-oelheizungen-77-jaehriger-ruhestaendler-sauer-fuer-rentner-ist-habecks-heiztauschpflicht-enteignung-durch-die-hintertuer_id_187244794.html,https://www.focus.de/immobilien/wohnen/verbot-von-neuen-gas-und-oelheizungen-77-jaehriger-ruhestaendler-sauer-fuer-rentner-ist-habecks-heiztauschpflicht-enteignung-durch-die-hintertuer_id_187244794.html,0,www.focus.de,77-jähriger Ruheständler sauer - „Für Millionen Rentner ist Habecks Heiztauschpflicht eine Enteignung durch die Hintertür“,"Wer angesichts der geplanten Quasi-Heiztauschpflicht vom Gas- oder Ölkessel weg will, braucht eine Menge Geld. Aber für Rentner und Rentnerinnen ist es im Alter oft schwierig, einen Kredit aufzunehmen. Die Entrüstung über das geplante Heiz-Gesetz ist deswegen…",https://p6.focus.de/img/fotos/id_187048837/habeck1.jpg?im=Crop%3D%280%2C72%2C3467%2C1736%29%3BResize%3D%281200%2C627%29&impolicy=perceptual&quality=medium&hash=46c9e4171cb1bd6ad24f5710ee62869d85bb26367e2aeb53835b97256cb9bee0,2023-03-08T06:19:13Z,https://web.archive.org/web/20230308063757/https://www.focus.de/immobilien/wohnen/verbot-von-neuen-gas-und-oelheizungen-77-jaehriger-ruhestaendler-sauer-fuer-rentner-ist-habecks-heiztauschpflicht-enteignung-durch-die-hintertuer_id_187244794.html,"<ul><li>
Kommentare</li><li>
E-Mail</li><li>
Teilen</li><li>
Mehr</li><li>
Twitter</li><li>
Drucken</li><li>
Feedback</li><li>
Fehler meldenSie haben einen Fehler gefunden?
Bitte markieren S… [+10623 chars]",,de,'Gas'
https://www.bild.de/bild-plus/regional/stuttgart/stuttgart-aktuell/feuerball-nach-gas-explosion-in-der-nacht-oma-herta-85-starb-bei-haus-explosion-83129290.bild.html,https://www.bild.de/bild-plus/regional/stuttgart/stuttgart-aktuell/feuerball-nach-gas-explosion-in-der-nacht-oma-herta-85-starb-bei-haus-explosion-83129290.bild.html,0,www.bild.de,*** BILDplus Inhalt *** Feuerball nach Gas-Explosion in der Nacht - Oma Herta (85) starb bei Haus-Explosion,"Oma Herta P. (85) liebte ihren Garten in Stuttgart, hielt oft Schwätzle über den Zaun. Jetzt ist sie tot.","https://images.bild.de/64076aebada7701438499437/a5981555576dd8fcbc95cbcc5d014ba0,cb1122ff?w=1280",2023-03-08T06:23:55Z,https://web.archive.org/web/20230308094931/https://www.bild.de/bild-plus/regional/stuttgart/stuttgart-aktuell/feuerball-nach-gas-explosion-in-der-nacht-oma-herta-85-starb-bei-haus-explosion-83129290.bild.html,"Oma Herta P. (85) liebte ihren Garten im Stuttgarter Westen, hielt oft Schwätzle über den Zaun. Jetzt ist sie tot!
Was die Nachbarn sagen und wie es der Familie geht, lesen Sie mit BILDPlus",,de,'Gas'
https://www.stern.de/gesellschaft/regional/sachsen/schneefall--erneuter-wintereinbruch-in-sachsen--autofahrer-aufgepasst-33261890.html,https://www.stern.de/gesellschaft/regional/sachsen/schneefall--erneuter-wintereinbruch-in-sachsen--autofahrer-aufgepasst-33261890.html,0,www.stern.de,Schneefall: Erneuter Wintereinbruch in Sachsen: Autofahrer aufgepasst,"Die Menschen in Sachsen müssen sich am Mittwoch örtlich auf Glätte und Schnee einstellen. Am Morgen bleibt es bedeckt mit zeitweise Schneefällen und einigen Zentimeter Neuschnee, wie der Deutsche Wetterdienst (DWD) am Mittwochmorgen mitteilte.",https://image.stern.de/33261892/t/Lk/v1/w1440/r1.7778/-/08--urnnewsmldpacom2009010123030899870652v3w800h600l814t240r2094b1055jpeg---7cb86122dd189c08.jpg,2023-03-08T06:35:36Z,https://web.archive.org/web/20230308070051/https://www.stern.de/gesellschaft/regional/sachsen/schneefall--erneuter-wintereinbruch-in-sachsen--autofahrer-aufgepasst-33261890.html,"Die Menschen in Sachsen müssen sich am Mittwoch örtlich auf Glätte und Schnee einstellen. Am Morgen bleibt es bedeckt mit zeitweise Schneefällen und einigen Zentimeter Neuschnee, wie der Deutsche Wet… [+1146 chars]",,de,'Schnee'
https://www.zeit.de/news/2023-03/08/autofahrer-aufgepasst-glaette-und-leichter-schnee,https://www.zeit.de/news/2023-03/08/autofahrer-aufgepasst-glaette-und-leichter-schnee,0,www.zeit.de,Wintereinbruch: Autofahrer aufgepasst: Glätte und leichter Schnee,,,2023-03-08T06:38:23Z,https://web.archive.org/web/20230309103250/https://www.zeit.de/news/2023-03/08/autofahrer-aufgepasst-glaette-und-leichter-schnee,"When browsing with ads:
We collect personal data and also transmit it to third-party providers
 that help us improve and finance our digital content. Some of the information stored on your device, … [+732 chars]",,de,'Schnee'
https://www.handelsblatt.com/finanzen/immobilien/heizungsverbot-fuer-gas-und-oel-was-bedeutet-es-fuer-den-immobilienmarkt/29013892.html,https://www.handelsblatt.com/finanzen/immobilien/heizungsverbot-fuer-gas-und-oel-was-bedeutet-es-fuer-den-immobilienmarkt/29013892.html,0,www.handelsblatt.com,Immobilien: Heizungsverbot für Öl und Gas: So mischt der Plan den Immobilienmarkt auf,Das Bundeswirtschaftsministerium will die Vorschriften für Wärmeerzeugung in Gebäuden ab 2024 verschärfen. Was auf Eigentümer zukommt.,https://www.handelsblatt.com/images/heizoel/29014024/2-format2003.jpg,2023-03-08T07:04:40Z,https://web.archive.org/web/20230308080916/https://www.handelsblatt.com/finanzen/immobilien/heizungsverbot-fuer-gas-und-oel-was-bedeutet-es-fuer-den-immobilienmarkt/29013892.html,"HeizölEin Mitarbeiter befüllt den Tank eines Hauses mit Heizöl vor. Geht es nach den Plänen des Bundeswirtschaftsministeriums, wird die Zahl der Kundschaft bald kleiner. 
(Foto: dpa)
Frankfurt Die … [+1344 chars]",,de,'Heizung'
