index,url,valid,domain,title,description,image,published,archive,content,quote,language,keyword
https://www.n-tv.de/politik/13-47-Kiew-bestellt-100-gepanzerte-Fahrzeuge-in-Polen--article23143824.html,https://www.n-tv.de/politik/13-47-Kiew-bestellt-100-gepanzerte-Fahrzeuge-in-Polen--article23143824.html,0,www.n-tv.de,Ukraine-Krieg im Liveticker: +++ 13:22 Russische Angriffe bei Bachmut ausgebremst - auch durch Schnee +++,"Berlin, Washington, Br\u00fcssel - \u00fcberall. n-tv berichtet von allen wichtigen Schaupl\u00e4tzen der Innen- und Au\u00dfenpolitik.",https://bilder2.n-tv.de/img/incoming/crop23332537/9041326157-cImg_16_9-w1200/Liveticker1-grau-1-Kopie.jpg,2023-04-01T00:13:00Z,,"Ein Rosomak im polnischen Werk Siemianowice Slaskie.
(Foto: imago/ZUMA Press)
Die Ukraine hat nach polnischen Angaben 100 gepanzerte Militärfahrzeuge des in Polen hergestellten Typs Rosomak bestell… [+19832 chars]",,de,'Schnee'
https://www.zeit.de/news/2023-04/01/kritik-an-einbauverbot-neuer-gas-und-oelheizungen,https://www.zeit.de/news/2023-04/01/kritik-an-einbauverbot-neuer-gas-und-oelheizungen,0,www.zeit.de,Ampel-Pläne: Kritik an Einbauverbot neuer Gas- und Ölheizungen,,,2023-04-01T03:38:23Z,,"When browsing with ads:
We collect personal data and also transmit it to third-party providers
 that help us improve and finance our digital content. Some of the information stored on your device, … [+732 chars]",,de,'Gas'
https://de.catholicnewsagency.com/article/2101/zwischen-deutscher-und-norwegisch-nordischer-literatur-friedenspreistrager-max-tau,https://de.catholicnewsagency.com/article/2101/zwischen-deutscher-und-norwegisch-nordischer-literatur-friedenspreistrager-max-tau,0,de.catholicnewsagency.com,Zwischen deutscher und norwegisch-nordischer Literatur: Friedenspreisträger Max Tau,"Tau beschrieb vor aller Welt das andere Deutschland, das bessere, dasjenige, das berechtigt war, nicht nur zu existieren, sondern auch als Partner und Freund anderer Staaten w&uuml;rdig zu sein.",https://de.catholicnewsagency.com/image/maxtau_1680262751.jpg?w=1200,2023-04-01T06:00:00Z,https://web.archive.org/web/20230402050644/https://de.catholicnewsagency.com/article/2101/zwischen-deutscher-und-norwegisch-nordischer-literatur-friedenspreistrager-max-tau,"Von Lothar C. Rilinger (*)
1. April 2023
Das verbrecherische System des Dritten Reiches war ein Kulturbruch, der Deutschland aus der Weltgemeinschaft herauskatapultiert hatte. Deutschland, das Land… [+7684 chars]",,de,'Tau'
https://www.autobild.de/artikel/ferrari-f8-tributo-test-reifen-eis-schnee-driften-22587773.html,https://www.autobild.de/artikel/ferrari-f8-tributo-test-reifen-eis-schnee-driften-22587773.html,0,www.autobild.de,Fire on Ice: So ein Ferrari ist bei jedem Wetter ein Genuss,"Im Rahmen der Passione Ferrari Club Challenge ""on Ice"" mit Spikes auf Winterreifen in einem Ferrari über Schnee und Eis. Was für ein Spaß!",https://i.auto-bild.de/ir_img/3/2/1/4/9/3/3/Ferrari_F8_16_9-cb6f5f83cb010f38.jpg?impolicy=og_images,2023-04-01T06:00:00Z,https://web.archive.org/web/20230401174028/https://www.autobild.de/artikel/ferrari-f8-tributo-test-reifen-eis-schnee-driften-22587773.html,"Auto ganz einfach zum Bestpreis online verkaufen
Top-Preise durch geprüfte Käufer persönliche Beratung stressfreie Abwicklung durch kostenlose Abholung!",,de,'Schnee'
https://www.wiwo.de/politik/deutschland/ampel-plaene-opposition-kritisiert-einbauverbot-neuer-gas-und-oelheizungen/29073438.html,https://www.wiwo.de/politik/deutschland/ampel-plaene-opposition-kritisiert-einbauverbot-neuer-gas-und-oelheizungen/29073438.html,0,www.wiwo.de,Ampel-Pläne: Opposition kritisiert Einbauverbot neuer Gas- und Ölheizungen,Die schlimmsten Befürchtungen von Hausbesitzern für das künftige Heizen treten nun doch nicht ein. Die Ampel-Koalition hat ihre Pläne für ein Verbot des Einbaus neuer Gas- und Ölheizungen modifiziert.,https://www.wiwo.de/images/gasheizung/29073436/2-format11240.jpg,2023-04-01T08:10:57Z,,Trotz der geplanten Ausnahme- und Übergangsregelungen für das Einbauverbot neuer Gas- und Ölheizungen ab Anfang 2024 kommt von der Opposition weiter Kritik am Vorhaben der Ampel-Koalition. Der klimas… [+4447 chars],,de,'Energiekosten'
https://consent.google.com/ml?continue=https://news.google.com/rss/articles/CBMidmh0dHBzOi8vd3d3LmJyLmRlL25hY2hyaWNodGVuL2RldXRzY2hsYW5kLXdlbHQvZWluYmF1dmVyYm90LW5ldWVyLWdhcy11bmQtb2VsaGVpenVuZ2VuLWtyaXRpay1hbi1hbXBlbC1wbGFlbmVuLFRhOWVHWkPSAXpodHRwczovL3d3dy5ici5kZS9uYWNocmljaHRlbi9hbXAvZGV1dHNjaGxhbmQtd2VsdC9laW5iYXV2ZXJib3QtbmV1ZXItZ2FzLXVuZC1vZWxoZWl6dW5nZW4ta3JpdGlrLWFuLWFtcGVsLXBsYWVuZW4sVGE5ZUdaQw?oc%3D5&gl=FR&hl=en-US&cm=2&pc=n&src=1,https://consent.google.com/ml?continue=https://news.google.com/rss/articles/CBMidmh0dHBzOi8vd3d3LmJyLmRlL25hY2hyaWNodGVuL2RldXRzY2hsYW5kLXdlbHQvZWluYmF1dmVyYm90LW5ldWVyLWdhcy11bmQtb2VsaGVpenVuZ2VuLWtyaXRpay1hbi1hbXBlbC1wbGFlbmVuLFRhOWVHWkPSAXpodHRwczovL3d3dy5ici5kZS9uYWNocmljaHRlbi9hbXAvZGV1dHNjaGxhbmQtd2VsdC9laW5iYXV2ZXJib3QtbmV1ZXItZ2FzLXVuZC1vZWxoZWl6dW5nZW4ta3JpdGlrLWFuLWFtcGVsLXBsYWVuZW4sVGE5ZUdaQw?oc%3D5&gl=FR&hl=en-US&cm=2&pc=n&src=1,0,consent.google.com,Einbauverbot neuer Gas- und Ölheizungen: Kritik an Ampel-Plänen - BR24,"<ol><li>Einbauverbot neuer Gas- und Ölheizungen: Kritik an Ampel-Plänen  BR24
</li><li>Ampel einigt sich nach Koalitionsausschuss : Das Heizungsgesetz ist fertig! | Politik  BILD
</li><li>Ampel einigt sich auf Heiz-Gesetz - das sind die Details  FOCUS Onlin…",,2023-04-01T09:18:25Z,,"We use cookies and data to<ul><li>Deliver and maintain Google services</li><li>Track outages and protect against spam, fraud, and abuse</li><li>Measure audience engagement and site statistics to unde… [+1131 chars]",,de,'Gas'
https://www.stern.de/gesellschaft/regional/nordrhein-westfalen/essen--reizgas-auf-abi-party-versprueht--16-verletzte-33339280.html,https://www.stern.de/gesellschaft/regional/nordrhein-westfalen/essen--reizgas-auf-abi-party-versprueht--16-verletzte-33339280.html,0,www.stern.de,Essen: Reizgas auf Abi-Party versprüht: 16 Verletzte,"Bei einer Party von Abiturienten in Essen sind 16 junge Leute durch Reizgas verletzt worden. Sechs von ihnen seien anschließend im Krankenhaus behandelt worden, sagte ein Polizeisprecher am Samstag. Ein Unbekannter soll demnach das Gas in der Nacht zu Freitag…",https://image.stern.de/33339282/t/Ct/v1/w1440/r1.7778/-/01--urnnewsmldpacom2009010123040199171117v1w800h600l1464t272r3272b2418jpeg---9809c5736f93f032.jpg,2023-04-01T09:19:46Z,,"Bei einer Party von Abiturienten in Essen sind 16 junge Leute durch Reizgas verletzt worden. Sechs von ihnen seien anschließend im Krankenhaus behandelt worden, sagte ein Polizeisprecher am Samstag. … [+1013 chars]",,de,'Gas'
https://www.welt.de/wirtschaft/plus244554238/Oel-und-Gasheizung-Nur-noch-Waermepumpe-Ein-Wort-macht-Eigentuemern-wieder-Hoffnung.html,https://www.welt.de/wirtschaft/plus244554238/Oel-und-Gasheizung-Nur-noch-Waermepumpe-Ein-Wort-macht-Eigentuemern-wieder-Hoffnung.html,0,www.welt.de,Nur noch Wärmepumpe? Ein Wort macht Eigentümern wieder Hoffnung,Auch die Novelle des Gebäude-Energie-Gesetzes ist im Koalitionsausschuss gelandet. Darin werden die neuen Heizungsregeln festgelegt. Hält die Regierung an der 65-Prozent-Pflicht fest? Darf man ab Januar reine Gas- oder Ölheizung einbauen? WELT beantwortet die…,https://img.welt.de/img/wirtschaft/mobile244558260/5081354247-ci16x9-w1200-fnov-fpotl-fpi157750653/396587890.jpg,2023-04-01T10:09:00Z,,"Die WELT als ePaper: Die vollständige Ausgabe steht Ihnen bereits am Vorabend zur Verfügung so sind Sie immer hochaktuell informiert. Weitere Informationen: http://epaper.welt.de 
 Der Kurz-Link die… [+49 chars]",,de,'Heizung'
https://www.focus.de/finanzen/die-focus-kolumne-von-jan-fleischhauer-lernen-sie-deutschlands-gefaehrlichsten-beamten-kennen_id_189831468.html,https://www.focus.de/finanzen/die-focus-kolumne-von-jan-fleischhauer-lernen-sie-deutschlands-gefaehrlichsten-beamten-kennen_id_189831468.html,0,www.focus.de,Die FOCUS-Kolumne von Jan Fleischhauer - Habecks Schattenmann: Lernen Sie Deutschlands gefährlichsten Beamten kennen,Die Energiewende ist ins Stadium der Torheit eingetreten. Auch nach dem Krisengipfel gilt: Ab Januar 2024 sollen keine neuen Öl- und Gasheizungen zugelassen werden. Dabei sind viele Häuser für Alternativen ungeeignet.Von Focus Magazin-Jan Fleischhauer,https://p6.focus.de/img/fotos/id_189907722/fleischhauer-habeck-schattenmann-01.jpg?im=Crop%3D%2874%2C0%2C3926%2C1963%29%3BResize%3D%281200%2C627%29&hash=0ff7782a4cbdd3cfe1264cd62a1d0a5967f8e4fcfbfaad5f138a302505f57cf7,2023-04-01T10:16:37Z,,"<ul><li>
Kommentare</li><li>
E-Mail</li><li>
Teilen</li><li>
Mehr</li><li>
Twitter</li><li>
Drucken</li><li>
Feedback</li><li>
Fehler meldenSie haben einen Fehler gefunden?
Bitte markieren S… [+9519 chars]",,de,'Gas'
https://www.focus.de/finanzen/news/schlampige-planung-und-vergessene-kosten-habeck-kauft-suendhaft-teures-fluessiggas-und-davon-viel-zu-viel_id_189743734.html,https://www.focus.de/finanzen/news/schlampige-planung-und-vergessene-kosten-habeck-kauft-suendhaft-teures-fluessiggas-und-davon-viel-zu-viel_id_189743734.html,0,www.focus.de,Schlampige Planung und vergessene Kosten - Deutschland ertrinkt bald in Flüssiggas - und das wird sündhaft teuer,"Als die Krise auf den Gasmärkten groß war und kein russisches Erdgas mehr ankam, schwenkte Deutschland um und setzt seither auf Flüssiggas. Doch jetzt zeichnet sich ab: Deutschland baut eine überdimensionierte Flüssiggas-Infrastruktur auf. Und das wird sündha…",https://p6.focus.de/img/regional/mecklenburg-vorpommern/id_188745089/das-spezialschiff-hoeegh-esperanza-liegt-waehrend-der-eroeffnung-des-lng-terminals-in-wilhelmshaven-vor-anker..jpg?im=Crop%3D%280%2C17%2C2048%2C1023%29%3BResize%3D%281200%2C627%29&hash=5a92b34968206ea32e340667d407bbbb9e0ad6c12e74d255442afd7e05a474f3,2023-04-01T10:27:02Z,,"Als die Krise auf den Gasmärkten groß war und kein russisches Erdgas mehr ankam, schwenkte Deutschland um und setzt seither auf Flüssiggas. Doch jetzt zeichnet sich ab: Deutschland baut eine überdime… [+6947 chars]",,de,'Gas'
https://www.stern.de/news/ampel-kompromiss--ende-von-gas--und-oelheizungen-am-horizont-sichtbar----33339474.html,https://www.stern.de/news/ampel-kompromiss--ende-von-gas--und-oelheizungen-am-horizont-sichtbar----33339474.html,0,www.stern.de,Ampel-Kompromiss: Ende von Gas- und Ölheizungen am Horizont sichtbar,"Hausbesitzer können erst einmal aufatmen, was ihre Heizung angeht. Ihre schlimmsten Befürchtungen treten nicht ein. Sie müssen ihre Öl- und Gaskessel nicht sofort rauswerfen. Trotzdem ist deren Ende absehbar.",https://image.stern.de/33339476/t/A5/v1/w1440/r1.7778/-/01--urnnewsmldpacom2009010123040199171751v3w800h600l640t399r1920b1201jpeg---67c310f89790f6e1.jpg,2023-04-01T10:37:54Z,,"Hausbesitzer können erst einmal aufatmen, was ihre Heizung angeht. Ihre schlimmsten Befürchtungen treten nicht ein. Sie müssen ihre Öl- und Gaskessel nicht sofort rauswerfen. Trotzdem ist deren Ende … [+4418 chars]",,de,'Gas'
https://www.zeit.de/news/2023-04/01/ende-von-gas-und-oelheizungen-am-horizont-sichtbar,https://www.zeit.de/news/2023-04/01/ende-von-gas-und-oelheizungen-am-horizont-sichtbar,0,www.zeit.de,Ampel-Kompromiss: Ende von Gas- und Ölheizungen am Horizont sichtbar,,,2023-04-01T10:37:54Z,,"When browsing with ads:
We collect personal data and also transmit it to third-party providers
 that help us improve and finance our digital content. Some of the information stored on your device, … [+732 chars]",,de,'Gas'
https://www.morgenpost.de/wirtschaft/article238048489/Ende-von-Gas-und-Oelheizungen-am-Horizont-sichtbar.html,https://www.morgenpost.de/wirtschaft/article238048489/Ende-von-Gas-und-Oelheizungen-am-Horizont-sichtbar.html,0,www.morgenpost.de,Ampel-Kompromiss: Ende von Gas- und Ölheizungen am Horizont sichtbar,"Hausbesitzer können erst einmal aufatmen, was ihre Heizung angeht. Ihre schlimmsten Befürchtungen treten nicht ein. Sie müssen ihre Öl- und Gaskessel nicht sofort rauswerfen. Trotzdem ist deren Ende absehbar.",https://img.morgenpost.de/img/wirtschaft/crop238048487/9802606945-w820-cv16_9-q85/Frostiger-Morgen.jpg,2023-04-01T10:37:54Z,,"Berlin. Mit dem Kompromiss der Ampel-Koalition zum lange Zeit umstrittenen Gebäudeenergiegesetz kommt das Ende von Öl- und Gasheizungen in Deutschland. Es wird allerdings ein Ende auf Raten sein, wei… [+4219 chars]",,de,'Gas'
https://www.stern.de/politik/deutschland/austausch-von-oel--und-gasheizungen--was-man-dazu-wissen-sollte-33339420.html,https://www.stern.de/politik/deutschland/austausch-von-oel--und-gasheizungen--was-man-dazu-wissen-sollte-33339420.html,0,www.stern.de,Ampel einigt sich: Austausch von Öl- und Gasheizungen: Was man jetzt dazu wissen sollte,"Hausbesitzer können erst einmal aufatmen, was ihre Heizung angeht. Ihre schlimmsten Befürchtungen treten nicht ein. Sie müssen ihre Öl- und Gaskessel nicht sofort rauswerfen. Trotzdem ist deren Ende absehbar. Das soll nun gelten.",https://image.stern.de/33339422/t/tM/v1/w1440/r1.7778/-/heizung.jpg,2023-04-01T10:39:00Z,,"Hausbesitzer können erst einmal aufatmen, was ihre Heizung angeht. Ihre schlimmsten Befürchtungen treten nicht ein. Sie müssen ihre Öl- und Gaskessel nicht sofort rauswerfen. Trotzdem ist deren Ende … [+5007 chars]",,de,'Gas'
https://consent.google.com/ml?continue=https://news.google.com/rss/articles/CBMibmh0dHBzOi8vd3d3LmJyLmRlL25hY2hyaWNodGVuL2RldXRzY2hsYW5kLXdlbHQvZW5kZS12b24tZ2FzLXVuZC1vZWxoZWl6dW5nZW4tZGllLXdpY2h0aWdzdGVuLWVja3B1bmt0ZSxUYUFacGFK0gFyaHR0cHM6Ly93d3cuYnIuZGUvbmFjaHJpY2h0ZW4vYW1wL2RldXRzY2hsYW5kLXdlbHQvZW5kZS12b24tZ2FzLXVuZC1vZWxoZWl6dW5nZW4tZGllLXdpY2h0aWdzdGVuLWVja3B1bmt0ZSxUYUFacGFK?oc%3D5&gl=FR&hl=en-US&cm=2&pc=n&src=1,https://consent.google.com/ml?continue=https://news.google.com/rss/articles/CBMibmh0dHBzOi8vd3d3LmJyLmRlL25hY2hyaWNodGVuL2RldXRzY2hsYW5kLXdlbHQvZW5kZS12b24tZ2FzLXVuZC1vZWxoZWl6dW5nZW4tZGllLXdpY2h0aWdzdGVuLWVja3B1bmt0ZSxUYUFacGFK0gFyaHR0cHM6Ly93d3cuYnIuZGUvbmFjaHJpY2h0ZW4vYW1wL2RldXRzY2hsYW5kLXdlbHQvZW5kZS12b24tZ2FzLXVuZC1vZWxoZWl6dW5nZW4tZGllLXdpY2h0aWdzdGVuLWVja3B1bmt0ZSxUYUFacGFK?oc%3D5&gl=FR&hl=en-US&cm=2&pc=n&src=1,0,consent.google.com,Ende von Gas- und Ölheizungen – Die wichtigsten Eckpunkte - BR24,"<ol><li>Ende von Gas- und Ölheizungen – Die wichtigsten Eckpunkte  BR24
</li><li>Verbot für Öl- und Gasheizungen: Welche Änderungen nun kommen  fr.de
</li><li>Austausch von Heizungen ab 2024: Regierung einigt sich auf Details im Heizungsstreit  tagesschau
…",,2023-04-01T10:48:08Z,,"We use cookies and data to<ul><li>Deliver and maintain Google services</li><li>Track outages and protect against spam, fraud, and abuse</li><li>Measure audience engagement and site statistics to unde… [+1131 chars]",,de,'Gas'
https://www.wiwo.de/unternehmen/energie/gebaeudeenergiegesetz-aus-fuer-gas-und-oelheizungen-was-bedeutet-das-fuer-hausbesitzer/29073576.html,https://www.wiwo.de/unternehmen/energie/gebaeudeenergiegesetz-aus-fuer-gas-und-oelheizungen-was-bedeutet-das-fuer-hausbesitzer/29073576.html,0,www.wiwo.de,Gebäudeenergiegesetz: Aus für Gas- und Ölheizungen – was bedeutet das für Hausbesitzer?,"Hausbesitzer können erst einmal aufatmen, was ihre Heizung angeht: Sie müssen Öl- und Gaskessel nicht sofort rauswerfen. Trotzdem ist deren Ende nun absehbar: Die wichtigsten Fragen und Antworten.",https://www.wiwo.de/images/100-pro-imago-life-2-152638372-highres/29016150/2-format11240.jpg,2023-04-01T10:59:20Z,,"Mit dem Kompromiss der Ampel-Koalition zum lange Zeit umstrittenen Gebäudeenergiegesetz kommt das Ende von Öl- und Gasheizungen in Deutschland. Es wird allerdings ein Ende auf Raten sein, weil es Übe… [+4846 chars]",,de,'Heizung'
https://www.faz.net/aktuell/wirtschaft/ende-von-gas-und-oelheizungen-was-hausbesitzer-jetzt-wissen-muessen-18793863.html,https://www.faz.net/aktuell/wirtschaft/ende-von-gas-und-oelheizungen-was-hausbesitzer-jetzt-wissen-muessen-18793863.html,0,www.faz.net,Ende von Gas- und Ölheizungen: Was Hausbesitzer wissen müssen,Muss es künftig eine Wärmepumpe sein? Oder lohnt sich noch schnell der Einbau einer neuen Gasheizung? Was auf Hausbesitzer und ihre Heizungen zukommt – und welche Alternativen es gibt.,https://media0.faz.net/ppmedia/aktuell/2151091199/1.8793882/facebook_teaser/hausbesitzer-haben-fuers-erste.jpg,2023-04-01T11:23:41Z,,"Mit dem Kompromiss der Ampel-Koalition zum lange Zeit umstrittenen Gebäudeenergiegesetz kommt das Ende von Öl- und Gasheizungen in Deutschland. Es wird allerdings ein Ende auf Raten sein, weil es Übe… [+4223 chars]",,de,'Gas'
https://www.sueddeutsche.de/wirtschaft/gasheizung-oelheizung-alternativen-ausnahmen-1.5779848,https://www.sueddeutsche.de/wirtschaft/gasheizung-oelheizung-alternativen-ausnahmen-1.5779848,0,www.sueddeutsche.de,Heizung mit erneuerbarer Energie: Was Hausbesitzer jetzt wissen müssen,Der Heizungsstreit ist beigelegt: Nächstes Jahr dürfen keine reinen Gas- und Ölheizungen mehr eingebaut werden. Kommt jetzt die Wärmepumpe für alle? Welche Ausnahmen gelten? Fragen und Antworten zum Ampel-Kompromiss.,https://www.sueddeutsche.de/image/sz.1.5779849/1200x675?v=1680350794,2023-04-01T12:02:15Z,,Der Heizungsstreit ist beigelegt: Nächstes Jahr dürfen keine reinen Gas- und Ölheizungen mehr eingebaut werden. Kommt jetzt die Wärmepumpe für alle? Welche Ausnahmen gelten? Fragen und Antworten zum … [+5277 chars],,de,'Gas'
https://www.tagesschau.de/inland/heizung-einigung-opposition-kritik-101.html,https://www.tagesschau.de/inland/heizung-einigung-opposition-kritik-101.html,0,www.tagesschau.de,Opposition kritisiert Pläne zu Öl- und Gasheizungen,"Die Ampel-Regierung will Hausbesitzer beim Umrüsten auf klimafreundliche Heizungen unterstützen. Doch die Opposition sieht die Pläne skeptisch. Unklar sei, wie der Umbau bezahlt werden soll - von einem ""Verarmungsprogramm"" ist gar die Rede.",https://www.tagesschau.de/multimedia/bilder/gasheizung-107~_v-original.jpg,2023-04-01T12:04:22Z,,"Die Ampel-Regierung will Hausbesitzer beim Umrüsten auf klimafreundliche Heizungen unterstützen. Doch die Opposition sieht die Pläne skeptisch. Unklar sei, wie der Umbau bezahlt werden soll - von ein… [+5816 chars]",,de,'Gas'
https://www.morgenpost.de/politik/article238048633/gas-oelheizung-verbot-austauschpflicht-robert-habeck-foerderung-ampel-koalition.html,https://www.morgenpost.de/politik/article238048633/gas-oelheizung-verbot-austauschpflicht-robert-habeck-foerderung-ampel-koalition.html,0,www.morgenpost.de,Öl- und Gasheizungen: Heizungsverbot: Darauf hat sich die Koalition geeinigt,"Der Plan, neue Gas- und Ölheizungen zu verbieten, sorgte in der Ampel für Streit. Nun hat sie sich geeinigt. Die Beschlüsse auf einen Blick.",https://img.morgenpost.de/img/frontpage/crop237779147/7862605159-w820-cv16_9-q85/imago0238044110h.jpg,2023-04-01T12:47:07Z,,"Berlin. Der Aufschrei war groß, als die Pläne von Wirtschaftsminister Robert Habeck (Grüne), neue Gas- und Ölheizungen ab 2024 zu verbieten, durchsickerten. Habecks öffentlicher Vorwurf, der Gesetzen… [+8030 chars]",,de,'Gas'
https://consent.google.com/ml?continue=https://news.google.com/rss/articles/CBMib2h0dHBzOi8vd3d3LnRhZ2Vzc3BpZWdlbC5kZS9wb2xpdGlrL3ZlcmJvdGVuLW51ci1laW4td2VuaWctYW1wZWwta29tcHJvbWlzcy1uaW1tdC1kcnVjay12b20ta2Vzc2VsLTk1OTkxMTEuaHRtbNIBAA?oc%3D5&gl=FR&hl=en-US&cm=2&pc=n&src=1,https://consent.google.com/ml?continue=https://news.google.com/rss/articles/CBMib2h0dHBzOi8vd3d3LnRhZ2Vzc3BpZWdlbC5kZS9wb2xpdGlrL3ZlcmJvdGVuLW51ci1laW4td2VuaWctYW1wZWwta29tcHJvbWlzcy1uaW1tdC1kcnVjay12b20ta2Vzc2VsLTk1OTkxMTEuaHRtbNIBAA?oc%3D5&gl=FR&hl=en-US&cm=2&pc=n&src=1,0,consent.google.com,Verbot neuer Öl- und Gasheizungen aufgeweicht: Wer vom Ampel-Kompromiss profitiert – und wer nicht - Tagesspiegel,"<ol><li>Verbot neuer Öl- und Gasheizungen aufgeweicht: Wer vom Ampel-Kompromiss profitiert – und wer nicht  Tagesspiegel
</li><li>Ampel einigt sich nach Koalitionsausschuss : Das Heizungsgesetz ist fertig! | Politik  BILD
</li><li>Austausch von Heizungen ab…",,2023-04-01T12:53:41Z,,"We use cookies and data to<ul><li>Deliver and maintain Google services</li><li>Track outages and protect against spam, fraud, and abuse</li><li>Measure audience engagement and site statistics to unde… [+1131 chars]",,de,'Heizung'
https://www.tagesspiegel.de/politik/verboten-nur-ein-wenig-ampel-kompromiss-nimmt-druck-vom-kessel-9599111.html,https://www.tagesspiegel.de/politik/verboten-nur-ein-wenig-ampel-kompromiss-nimmt-druck-vom-kessel-9599111.html,0,www.tagesspiegel.de,"Verboten, nur ein wenig: Ampel-Kompromiss nimmt Druck vom Kessel","Kein Öl und Gas mehr zur Wärmeversorgung von Häusern ab 2024? Nun ja, niemand muss Anlagen rausreißen und es gibt viele Ausnahmen.",https://www.tagesspiegel.de/images/wirtschaftsminister-habeck-in-danemark2/alternates/BASE_16_9_W1400/wirtschaftsminister-habeck-in-daenemark.jpeg,2023-04-01T12:53:41Z,,"Wohnungen und Häuser können in Deutschland in vielen Fällen auch künftig mit Öl und Gas geheizt werden. Das generelle Verbot, das fossile Brennstoffe zur Erzeugung von Wärme im Gebäudebestand ab dem … [+5064 chars]",,de,'Gas'
https://www.stern.de/news/koalition-legt-neue-vorgaben-fuer-heizungen-ab-anfang-2024-fest-33339140.html,https://www.stern.de/news/koalition-legt-neue-vorgaben-fuer-heizungen-ab-anfang-2024-fest-33339140.html,0,www.stern.de,Koalition legt neue Vorgaben für Heizungen ab Anfang 2024 fest,"Die Koalition hat sich nach heftigem Streit auf klimafreundliche Vorgaben für neue Heizungen ab kommendem Jahr geeinigt. Die Einigung sieht Ausnahmeregelungen, Übergangsfristen und Förderungen vor. Das FDP-geführte Bundesfinanzministerium hob am Samstag hervo…",https://image.stern.de/33339710/t/mX/v1/w1440/r1.7778/-/01--heizungsregler---2c7eaaf06231486d.jpg,2023-04-01T13:19:02Z,,"Die Koalition hat sich nach heftigem Streit auf klimafreundliche Vorgaben für neue Heizungen ab kommendem Jahr geeinigt. Die Einigung sieht Ausnahmeregelungen, Übergangsfristen und Förderungen vor. D… [+4125 chars]",,de,'Heizung'
https://www.morgenpost.de/ratgeber/article238048805/gas-oelheizung-verbot-heizungsgesetz-ausnahmen-verbraucher-energiekrise.html,https://www.morgenpost.de/ratgeber/article238048805/gas-oelheizung-verbot-heizungsgesetz-ausnahmen-verbraucher-energiekrise.html,0,www.morgenpost.de,Diskussion über Ausnahmen: Ampel einigt sich auf Heizungsgesetz: Für wen es teuer wird,"Die Ampel hat sich auf ein Heizungsgesetz geeinigt. Es trifft Eigentümer mit einer Gas- oder Ölheizung. Wer nicht aufpasst, könnte viel Geld verlieren.",https://img.morgenpost.de/img/incoming/crop238049221/1202601393-w820-cv16_9-q85/Ampel-einigt-sich-auf-umstrittenes-Heizungsgesetz-ab-2024.jpg,2023-04-01T14:02:29Z,,Berlin. Die Heizungspläne von Wirtschaftsminister Robert Habeck und Bauministerin Klara Geywitz für Gas- und Ölheizungen in Deutschland ab 2024 bedeuten für viele Verbraucher große Veränderungen. Nac… [+5371 chars],,de,'Heizung'
https://www.stern.de/wirtschaft/news/energie--streit-um-oel--und-gasheizungen--union-und-linke-gegen-ampel-33338732.html,https://www.stern.de/wirtschaft/news/energie--streit-um-oel--und-gasheizungen--union-und-linke-gegen-ampel-33338732.html,0,www.stern.de,Energie: Streit um Öl- und Gasheizungen: Union und Linke gegen Ampel,Die schlimmsten Befürchtungen von Hausbesitzern für das künftige Heizen treten nun doch nicht ein. Die Ampel hat ihre Pläne für ein Verbot des Einbaus neuer Gas- und Ölheizungen geändert. Kritik gibt es trotzdem.,https://image.stern.de/33339956/t/kO/v1/w1440/r1.7778/-/01--urnnewsmldpacom2009010123040199174031v3w800h600l890t527r1978b1467jpeg---99826bc6e5eda4bc.jpg,2023-04-01T15:10:14Z,,Die schlimmsten Befürchtungen von Hausbesitzern für das künftige Heizen treten nun doch nicht ein. Die Ampel hat ihre Pläne für ein Verbot des Einbaus neuer Gas- und Ölheizungen geändert. Kritik gibt… [+4433 chars],,de,'Gas'
https://www.n-tv.de/politik/Union-und-Linke-aetzen-gegen-Heizungsplaene-der-Ampel-article24028076.html,https://www.n-tv.de/politik/Union-und-Linke-aetzen-gegen-Heizungsplaene-der-Ampel-article24028076.html,0,www.n-tv.de,"Linke: ""Verarmungsprogramm"": Union und Linke ätzen gegen Heizungspläne der Ampel","Obwohl die Ampelkoalition ihre Pläne zum Heizungswechsel bereits deutlich abgeschwächt hat, verstummt die Kritik nicht. Union und Linkspartei werfen der Regierung Überforderung und Verarmung von Hausbesitzern vor. Grünen-Vorsitzende Lang sieht dagegen einen ""…",https://bilder3.n-tv.de/img/incoming/crop24028086/8641327240-cImg_16_9-w1200/397636024.jpg,2023-04-01T15:24:22Z,,"Obwohl die Ampelkoalition ihre Pläne zum Heizungswechsel bereits deutlich abgeschwächt hat, verstummt die Kritik nicht. Union und Linkspartei werfen der Regierung Überforderung und Verarmung von Haus… [+4359 chars]",,de,'Gas'
https://stadt-bremerhaven.de/umfrage-april-2023-planst-du-ein-balkonkraftwerk-zu-kaufen/,https://stadt-bremerhaven.de/umfrage-april-2023-planst-du-ein-balkonkraftwerk-zu-kaufen/,0,stadt-bremerhaven.de,"Umfrage April 2023: Planst du, ein Balkonkraftwerk zu kaufen?",Der russische Angriffskrieg auf die Ukraine hat die Bevölkerung des Landes am heftigsten getroffen. Indirekt haben sich aber in ganz Europa Auswirkungen gezeigt. Deutschland etwa machte sich über die Jahre immer abhängiger von günstigen russischen Gaslieferun…,https://stadt-bremerhaven.de/wp-content/uploads/2023/02/Anker-Solix-Premium-Balkonkraftwerk_4.jpg,2023-04-01T15:30:47Z,,Der russische Angriffskrieg auf die Ukraine hat die Bevölkerung des Landes am heftigsten getroffen. Indirekt haben sich aber in ganz Europa Auswirkungen gezeigt. Deutschland etwa machte sich über die… [+2784 chars],,de,'Gas'
