index,url,valid,domain,title,description,image,published,archive,content,quote,language,keyword
https://www.stern.de/news/reiche-will-gasfoerderung-in-deutschland-ankurbeln---gruene-verurteilen-vorstoss-37178544.html,https://www.stern.de/news/reiche-will-gasfoerderung-in-deutschland-ankurbeln---gruene-verurteilen-vorstoss-37178544.html,0,www.stern.de,Reiche will Gasförderung in Deutschland ankurbeln - Grüne verurteilen Vorstoß,"Bundeswirtschaftsministerin Katherina Reiche (CDU) will die Förderung von heimischem Gas ausweiten. ""Wir haben eigene Reserven in Deutschland"", sagte Reiche den Zeitungen der Funke Mediengruppe vom Samstag. Die Bundesregierung wolle die Gasförderung ""nicht we…",https://image.stern.de/37180896/t/eH/v1/w1440/r1.7778/-/01--ministerin-reiche---751256177868011c.jpg,2026-03-01T10:35:13Z,,"Kopiere den aktuellen Link
Zur Merkliste hinzufügen
Bundeswirtschaftsministerin Katherina Reiche (CDU) will die Förderung von heimischem Gas ausweiten. ""Wir haben eigene Reserven in Deutschland"", s… [+3049 chars]",,de,'Gas'
https://www.welt.de/wirtschaft/plus69a2f2ef7c787f6a1cef21cb/heizungsgesetz-strom-gas-bio-quoten-diese-fragen-muessen-sich-hausbesitzer-jetzt-stellen.html,https://www.welt.de/wirtschaft/plus69a2f2ef7c787f6a1cef21cb/heizungsgesetz-strom-gas-bio-quoten-diese-fragen-muessen-sich-hausbesitzer-jetzt-stellen.html,0,www.welt.de,"Strom, Gas und Bio-Quoten – Diese Grundsatzfragen müssen sich Hausbesitzer jetzt stellen","Die Eckpunkte des neuen Heizungsgesetzes sind bekannt, auf den zweiten Blick aber sind viele Punkte noch offen – auch für Eigentümer, die gerade erst eine neue Heizung eingebaut haben. Für alle Hausbesitzer, die ans Gasnetz angeschlossen sind, stellt sich ein…",https://images.welt.de/69a2f2ef7c787f6a1cef21cb/395851dcae45244ae0bae2040d302c00-master/ci16x9-w1200/gettyimages-1359726676-jpg,2026-03-01T14:37:23Z,,"Die Eckpunkte des neuen Heizungsgesetzes sind bekannt, auf den zweiten Blick aber sind viele Punkte noch offen auch für Eigentümer, die gerade erst eine neue Heizung eingebaut haben. Für alle Hausbes… [+92 chars]",,de,'Gas'
https://www.sueddeutsche.de/wirtschaft/krieg-nahost-iran-auswirkungen-welthandel-reisen-li.3396176,https://www.sueddeutsche.de/wirtschaft/krieg-nahost-iran-auswirkungen-welthandel-reisen-li.3396176,0,www.sueddeutsche.de,Nahostkonflikt: Was der Krieg für den Welthandel und Reisende bedeutet,"Am Persischen Golf kreuzen sich wichtige Handels- und Reiserouten: Öl und Gas, Container, Flugpassagiere – die Region ist eine zentrale Drehscheibe. Und die könnte mit dem Angriff auf Iran zum Stillstand kommen.",https://www.sueddeutsche.de/2026/03/01/b3dfeebf-8d0c-4bd6-a9df-d8f5bd70f9d1.jpg?q=60&fm=webp&width=1200&rect=0%2C209%2C4000%2C2250,2026-03-01T14:38:28Z,,"Dass im Nahen Osten Krieg droht, war seit einigen Wochen immer deutlicher zu sehen: Zwar wurde noch verhandelt zwischen Teheran und Washington, zugleich aber verlegten die USA immer mehr Kriegsschiff… [+270 chars]",,de,'Gas'
https://www.n-tv.de/politik/Ministerin-Reiche-erwartet-trotz-Nahost-Konflikt-keine-Gasknappheit-id30419258.html,https://www.n-tv.de/politik/Ministerin-Reiche-erwartet-trotz-Nahost-Konflikt-keine-Gasknappheit-id30419258.html,0,www.n-tv.de,Höhere Energiepreise drohen: Ministerin Reiche erwartet trotz Nahost-Konflikt keine Gasknappheit,"Nach den amerikanisch-israelischen Angriffen auf den Iran sorgt die Lage an der Straße von Hormus für Unruhe. Das Bundeswirtschaftsministerium rechnet zwar mit höheren Energiepreisen, aber nicht mit Engpässen.",https://www.n-tv.de/img/30419269/1772394718/Img_16_9/1200/Katherina-Reiche-CDU-Bundesministerin-fuer-Wirtschaft-und-Energie-stellt-in-der-Bundespressekonferenz-den-Jahreswirtschaftsbericht-2026-vor-Berlin-28-01-2026.jpg,2026-03-01T19:37:47Z,,"Katherina Reiche sieht Deutschland bei Gas- und Öl-Lieferanten breit aufgestellt. (Foto: picture alliance / photothek.de)
Nach den amerikanisch-israelischen Angriffen auf den Iran sorgt die Lage an … [+1304 chars]",,de,'Gas'
