index,url,valid,domain,title,description,image,published,archive,content,quote,language,keyword
"https://www.gamestar.de/artikel/spotify-neue-funktion-mond-halbmond-icon-button,3432663.html","https://www.gamestar.de/artikel/spotify-neue-funktion-mond-halbmond-icon-button,3432663.html",0,www.gamestar.de,News: Spotify - Der Streamingdienst bekommt wohl einen neuen Button – und der bringt frischen Wind in eure Playlists,"Auf Spotify seht ihr bald einen Halbmond. Was der bedeutet, erfahrt ihr hier.",https://images.cgames.de/images/gamestar/293/spotify-mond-teaser_6353103.jpg,2025-05-09T11:00:00Z,"https://web.archive.org/web/20250509112830/https://www.gamestar.de/artikel/spotify-neue-funktion-mond-halbmond-icon-button,3432663.html","Das Mond-Symbol dürfte euch bald auf Spotify auffallen hier erfahrt ihr, wofür der steht. (Symbol: Solayman, Adobe Stock
Auf Spotify gibt es über 100.000.000 Songs, aber ihr hört immer wieder diesel… [+2122 chars]",,de,'Wind'
https://www.zeit.de/wirtschaft/2025-05/ostsee-pipeline-nord-stream-2,https://www.zeit.de/wirtschaft/2025-05/ostsee-pipeline-nord-stream-2,0,www.zeit.de,Ostsee-Gaspipeline: Betreiber von Nord Stream 2 wendet Pleite vorerst ab,Vor einem Schweizer Kantonsgericht hat der Betreiber Pipeline Nord Stream 2 mit seinen Gläubigern geeinigt. Die Firma kann somit weiter nach neuen Investoren suchen.,https://img.zeit.de/wirtschaft/2025-05/ostsee-pipeline-nord-stream-2-bild/wide__1300x731,2025-05-09T11:01:58Z,,Der Betreiber der defekten Ostsee-Gaspipeline Nord Stream 2 hat nach Verhandlungen mit seinen Gläubigern eine Pleite vorerst abgewendet. Das Kantonsgericht in Zug in der Schweiz bestätigte einen zwis… [+900 chars],,de,'Gas'
https://www.stern.de/gesellschaft/regional/bayern/baerenverdacht--schafrisse-und-spuren-im-schnee--baer-in-tirol-vermutet-35709294.html,https://www.stern.de/gesellschaft/regional/bayern/baerenverdacht--schafrisse-und-spuren-im-schnee--baer-in-tirol-vermutet-35709294.html,0,www.stern.de,Bärenverdacht: Schafrisse und Spuren im Schnee: Bär in Tirol vermutet,Einmal mehr scheint ein Bär im österreichischen Ötztal nicht allzu weit von der bayerischen Grenze unterwegs zu sein. Darauf lassen gerissene Tiere und Spuren schließen.,https://image.stern.de/35709296/t/Ns/v1/w1440/r1.7778/-/09--6je5cbuldlv1axs2048jpeg---33ac04b897928319.jpg,2025-05-09T11:11:12Z,https://web.archive.org/web/20250509115210/https://www.stern.de/gesellschaft/regional/bayern/baerenverdacht--schafrisse-und-spuren-im-schnee--baer-in-tirol-vermutet-35709294.html,"Kopiere den aktuellen Link
Zur Merkliste hinzufügen
Einmal mehr scheint ein Bär im österreichischen Ötztal nicht allzu weit von der bayerischen Grenze unterwegs zu sein. Darauf lassen gerissene Tie… [+1931 chars]",,de,'Schnee'
https://www.zeit.de/news/2025-05/09/schafrisse-und-spuren-im-schnee-baer-in-tirol-vermutet,https://www.zeit.de/news/2025-05/09/schafrisse-und-spuren-im-schnee-baer-in-tirol-vermutet,0,www.zeit.de,Bärenverdacht: Schafrisse und Spuren im Schnee: Bär in Tirol vermutet,Hier finden Sie Informationen zu dem Thema „Bärenverdacht“. Lesen Sie jetzt „Schafrisse und Spuren im Schnee: Bär in Tirol vermutet“.,https://img.zeit.de/news/2025-05/09/schafrisse-und-spuren-im-schnee-baer-in-tirol-vermutet-image-group/wide__1300x731,2025-05-09T11:11:12Z,https://web.archive.org/web/20250511000312/https://www.zeit.de/news/2025-05/09/schafrisse-und-spuren-im-schnee-baer-in-tirol-vermutet,"In einem Almgebiet bei der Gemeinde Umhausen in Tirol, rund 60 Kilometer von der bayerischen Grenze entfernt, sind Bärenspuren im Schnee entdeckt worden. Außerdem wurden zwei tote Schafe sowie zwei t… [+1745 chars]",,de,'Schnee'
https://www.focus.de/reisen/camping/gastbeitrag-jenny-krutzinna-campinglust-ohne-lange-anfahrt-das-sind-die-ultimativen-geheimtipps_c11e0e14-6d75-43b2-94eb-18d475594a54.html,https://www.focus.de/reisen/camping/gastbeitrag-jenny-krutzinna-campinglust-ohne-lange-anfahrt-das-sind-die-ultimativen-geheimtipps_c11e0e14-6d75-43b2-94eb-18d475594a54.html,0,www.focus.de,Gastbeitrag Jenny Krutzinna: Campinglust ohne lange Anfahrt: Das sind die ultimativen Geheimtipps,"Einfach abschalten und die Natur genießen – Camping direkt vor den Toren der Großstadt macht es möglich. Camping-Spezialistin Jenny Krutzinna verrät, wo Sie rund um Berlin, Hamburg, München, Frankfurt und das Ruhrgebiet die besten Plätze für Erholung finden.",https://quadro.burda-forward.de/ctf/faf697a5-9b9f-4681-b291-d0b8e3bea39a.42f1e81c-abff-4fe0-8343-7dc9cd1d1a57.jpg?im=RegionOfInterestCrop%3D%281200%2C630%29%2CregionOfInterest%3D%28960%2C772%29&hash=83e8df05441b3a9a873a9c413509f88e7e3e42c185e0d8aa2424df2985c29794,2025-05-09T12:34:53Z,,"Welche sind die besten Campingplätze in der Nähe von Berlin, die man leicht erreichen kann?
Berlin bietet weit mehr als urbanes Großstadtflair nur wenige Kilometer außerhalb der Stadtgrenzen finden … [+7873 chars]",,de,'Gas'
https://www.welt.de/politik/deutschland/article256091092/Neue-Bundesregierung-Es-gibt-hier-keinen-deutschen-Alleingang-sagt-Merz-zu-den-Grenzkontrollen-Liveticker.html,https://www.welt.de/politik/deutschland/article256091092/Neue-Bundesregierung-Es-gibt-hier-keinen-deutschen-Alleingang-sagt-Merz-zu-den-Grenzkontrollen-Liveticker.html,0,www.welt.de,"„Es gibt hier keinen deutschen Alleingang“, sagt Merz zu den Grenzkontrollen",Bundeskanzler Friedrich Merz verteidigt das deutsche Vorgehen an der Grenze. Beim Thema „nationale Notlage“ spricht er von „Irritationen“. Wirtschaftsministerin Reiche umreißt indes ihren Plan für die deutsche Wirtschaft. Alle Entwicklungen im Liveticker.,https://img.welt.de/img/politik/deutschland/mobile256094282/9857939977-ci16x9-w1200/New-German-Chancellor-Friedrich-Merz-Meets-With-EU-And-Nato-Leaders-In-Brussels.jpg,2025-05-09T12:43:00Z,https://web.archive.org/web/20250509130813/https://www.welt.de/politik/deutschland/article256091092/Neue-Bundesregierung-Es-gibt-hier-keinen-deutschen-Alleingang-sagt-Merz-zu-den-Grenzkontrollen-Liveticker.html,Bundeskanzler Friedrich Merz verteidigt das deutsche Vorgehen an der Grenze. Beim Thema nationale Notlage spricht er von Irritationen. Wirtschaftsministerin Reiche umreißt indes ihren Plan für die de… [+10460 chars],,de,'Not'
https://www.diepresse.com/19663097/laender-mit-einem-hohen-anteil-an-erneuerbaren-werden-sich-wirtschaftlich-besser-entwickeln,https://www.diepresse.com/19663097/laender-mit-einem-hohen-anteil-an-erneuerbaren-werden-sich-wirtschaftlich-besser-entwickeln,0,www.diepresse.com,„Länder mit einem hohen Anteil an Erneuerbaren werden sich wirtschaftlich besser entwickeln“,"Die Vorstände der Energie Steiermark, Martin Graf und Werner Ressi, sprechen über den spanischen Blackout, die Rückkehr des russischen Gases und fordern eine gerechtere Aufteilung der Netzkosten.",https://img.diepresse.com/public/incoming/edconc-kein-Titel/alternates/DPR_SOCIAL_MAGAZIN/kein%20Titel,2025-05-09T12:47:33Z,,"Die Vorstände der Energie Steiermark, Martin Graf und Werner Ressi, sprechen über den spanischen Blackout, die Rückkehr des russischen Gases und fordern eine gerechtere Aufteilung der Netzkosten.
Di… [+6169 chars]",,de,'Wind'
https://www.abendblatt.de/podcast/article408970888/vier-flaschen-spargel-und-wein-mit-heinz-wehmann-vom-landhaus-scherrer.html,https://www.abendblatt.de/podcast/article408970888/vier-flaschen-spargel-und-wein-mit-heinz-wehmann-vom-landhaus-scherrer.html,0,www.abendblatt.de,Vier Flaschen: Spargel und Wein mit Heinz Wehmann vom Landhaus Scherrer,"Welcher Wein zu welchem Spargelgericht? Und wie bereitet man Spargel richtig zu? Sterne-Koch Heinz Wehmann vom Landhaus Scherrer bringt uns ein kleines Spargelmenü mit und wir erleben, was “gutes Pairing“ bedeutet und wie das Essen den Wein am Gaumen noch bes…",,2025-05-09T14:00:00Z,https://web.archive.org/web/20250509140614/https://www.abendblatt.de/podcast/article408970888/vier-flaschen-spargel-und-wein-mit-heinz-wehmann-vom-landhaus-scherrer.html,"Welcher Wein zu welchem Spargelgericht? Und wie bereitet man Spargel richtig zu? Sterne-Koch Heinz Wehmann vom Landhaus Scherrer bringt uns ein kleines Spargelmenü mit und wir erleben, was gutes Pair… [+992 chars]",,de,'Wein'
https://www.tagesspiegel.de/berlin/deutschlands-grosste-gefluchtetenunterkunft-berliner-senat-will-standort-in-tegel-auch-nach-2025-erhalten-13657345.html,https://www.tagesspiegel.de/berlin/deutschlands-grosste-gefluchtetenunterkunft-berliner-senat-will-standort-in-tegel-auch-nach-2025-erhalten-13657345.html,0,www.tagesspiegel.de,Deutschlands größte Geflüchtetenunterkunft: Berliner Senat will Standort in Tegel auch nach 2025 erhalten,Bis Ende 2025 gilt derzeit der Beschluss für die Notunterkunft in Tegel. Der Senat will das Gelände weiter nutzen – aber in veränderter Form.,https://www.tagesspiegel.de/images/12872143/alternates/BASE_16_9_W1400/1734094132000/tegel013-gefluchtetenunterkunft-tegel.jpeg,2025-05-09T16:05:00Z,http://archive.md/20250511061057/https://www.tagesspiegel.de/berlin/deutschlands-grosste-gefluchtetenunterkunft-berliner-senat-will-standort-in-tegel-auch-nach-2025-erhalten-13657345.html,"Das ehemalige Flughafengelände in Tegel soll auch über 2025 hinaus zur Versorgung und Unterbringung geflüchteter Menschen genutzt werden. Nach Tagesspiegel-Informationen plant der Senat, zeitnah eine… [+79 chars]",,de,'Not'
https://www.tagesspiegel.de/kultur/funf-spielfilmtipps-zum-wochenende-die-schone-agentin-und-der-schuchterne-taucher-13646266.html,https://www.tagesspiegel.de/kultur/funf-spielfilmtipps-zum-wochenende-die-schone-agentin-und-der-schuchterne-taucher-13646266.html,0,www.tagesspiegel.de,Fünf Spielfilmtipps zum Wochenende: Die schöne Agentin und der schüchterne Taucher,"Die Faszination der Tiefseefilme zieht immer, genauso wie Superhelden und Nicole Kidman, auch wenn man die Schauspielerin in „The Hours“ kaum wieder erkennt.",https://www.tagesspiegel.de/images/13646641/alternates/BASE_16_9_W1400/1746529831000/im-rausch-der-tiefe.jpeg,2025-05-09T16:22:51Z,https://web.archive.org/web/20250509165814/http://www.tagesspiegel.de/kultur/funf-spielfilmtipps-zum-wochenende-die-schone-agentin-und-der-schuchterne-taucher-13646266.html,Nur zwei Free-TV-Premieren an diesem Wochenende mit Black Adam und Dwayne Johnson sowie der grandiosen Schauspielerin Ísold Halldórudóttir in ihrem Filmdebüt Touched. Der spektakulärste Film läuft am… [+9152 chars],,de,'Schnee'
https://www.bild.de/leben-wissen/diphtherie-warnung-des-rki-so-wichtig-ist-eine-impfung-681da6cd0592585716091c7b,https://www.bild.de/leben-wissen/diphtherie-warnung-des-rki-so-wichtig-ist-eine-impfung-681da6cd0592585716091c7b,0,www.bild.de,War eigentlich nahezu ausgerottet - RKI warnt vor Diphterie-Ausbruch,"Das RKI warnt vor Diphtherie-Ausbruch in Deutschland. Besonders gefährdet sind Geflüchtete, Wohnungslose und ältere Personen.","https://images.bild.de/681da6cd0592585716091c7b/25810fa991c16d2fd717ea7ee7b75487,afc6bb24?w=1280",2025-05-09T18:35:53Z,,"Um den TTS Player darzustellen, brauchen wir deine Zustimmung. 
 externen Inhalt aktivieren Um eingebettete Inhalte anzuzeigen, ist Ihre jederzeit widerrufliche Einwilligung (über den Schalter oder … [+2863 chars]",,de,'Wohnungslose'
https://www.faz.net/aktuell/politik/ausland/rio-grande-duerre-verschaerft-usa-mexiko-wasserkonflikt-110464252.html,https://www.faz.net/aktuell/politik/ausland/rio-grande-duerre-verschaerft-usa-mexiko-wasserkonflikt-110464252.html,0,www.faz.net,Trockene Grenzflüsse: Jetzt streiten die USA und Mexiko auch noch ums Wasser,"Eine Dürre in Mexiko verschärft den Wasserkonflikt mit den USA. Ein Vertrag von 1944, der die Verteilung regelt, gerät durch Trumps Drohungen unter Druck.",https://media0.faz.net/ppmedia/aktuell/politik/ausland/2905075287/1.10464306/facebook_teaser_fplus/aus-dem-lake-meade-bekommt.jpg,2025-05-09T20:40:55Z,http://archive.md/20250509205827/https://www.faz.net/aktuell/politik/ausland/rio-grande-duerre-verschaerft-usa-mexiko-wasserkonflikt-110464252.html,"Es ist zu trocken am Rio Grande. Viel zu trocken. Seit Längerem kämpft Mexiko mit einer ernsthaften Dürre, die laut Daten der Regierung mehr als 60 Prozent des Territoriums erfasst hat. Die landwirts… [+513 chars]",,de,'Dürre'
https://www.faz.net/aktuell/rhein-main/region-und-hessen/oepnv-im-rheingau-taunus-kreis-setzt-auf-kleinbusse-110464711.html,https://www.faz.net/aktuell/rhein-main/region-und-hessen/oepnv-im-rheingau-taunus-kreis-setzt-auf-kleinbusse-110464711.html,0,www.faz.net,Wie Kleinbusse den ÖPNV auf dem Land flexibler machen,"Der Rheingau-Taunus-Kreis wagt einen Neuanfang im ländlichen Nahverkehr: Mit einer eigenen Gesellschaft, On-Demand-Kleinbussen und einem Pilotprojekt soll Mobilität künftig effizienter, günstiger und bürgernäher werden.",https://media1.faz.net/ppmedia/aktuell/2590408185/1.10464709/facebook_teaser/flexibel-der-on-demand.jpg,2025-05-10T05:00:00Z,,"Der Rheingau-Taunus organisiert seinen öffentlichen Nahverkehr in Teilen neu und beginnt noch in diesem Jahr ein Pilotprojekt in Bad Schwalbach und Heidenrod. Im Kern geht es darum, die Mobilität im … [+6026 chars]",,de,'ÖPNV'
https://www.tagesschau.de/ausland/slowakei-proteste-fico-besuch-russland-100.html,https://www.tagesschau.de/ausland/slowakei-proteste-fico-besuch-russland-100.html,0,www.tagesschau.de,Protest gegen Moskau-Reise von slowakischem Regierungschef Fico,"Schon oft hat der pro-russische Kurs von Regierungschefs Fico in der Slowakei zu Protesten geführt. Auch seine Reise nach Moskau zum Kriegsgedenken trieb Tausende auf die Straße. ""Helden sind in Kiew, Mörder in Moskau"", hieß es auf Plakaten.",https://images.tagesschau.de/image/617a2dd6-9f5d-4db1-bde0-1f3d8e88b58e/AAABlrkuWbU/AAABkZLhkrw/16x9-1280/slowakei-bratislava-protest-fico-100.jpg,2025-05-10T07:52:25Z,https://web.archive.org/web/20250510075923/https://www.tagesschau.de/ausland/slowakei-proteste-fico-besuch-russland-100.html,"Stand: 10.05.2025 09:52 Uhr
Schon oft hat der pro-russische Kurs von Regierungschefs Fico in der Slowakei zu Protesten geführt. Auch seine Reise nach Moskau zum Kriegsgedenken trieb Tausende auf die… [+3449 chars]",,de,'Tau'
https://www.welt.de/politik/deutschland/article256091092/Neue-Bundesregierung-Bau-neuer-Gaskraftwerke-Gruene-warnen-Reiche-vor-Erpressbarkeiten-Liveticker.html,https://www.welt.de/politik/deutschland/article256091092/Neue-Bundesregierung-Bau-neuer-Gaskraftwerke-Gruene-warnen-Reiche-vor-Erpressbarkeiten-Liveticker.html,0,www.welt.de,Bau neuer Gaskraftwerke – Grüne warnen Reiche vor „Erpressbarkeiten“,"Die neue Arbeitsministerin fordert, dass auch Beamte in die gesetzliche Rente einzahlen sollen. Unterdessen hat Außenminister Johann Wadephul mit seinem Amtskollegen in Washington telefoniert. Das Gespräch lief offenbar gut. Alle Entwicklungen im Liveticker.",https://img.welt.de/img/politik/deutschland/mobile256097430/1487930417-ci16x9-w1200/Ludwig-Erhard-Gipfel.jpg,2025-05-10T08:30:00Z,https://web.archive.org/web/20250510090709/https://www.welt.de/politik/deutschland/article256091092/Neue-Bundesregierung-Bau-neuer-Gaskraftwerke-Gruene-warnen-Reiche-vor-Erpressbarkeiten-Liveticker.html,Eine seiner ersten Reisen als Bundeskanzler verschlägt Friedrich Merz mit Emmanuel Macron und Keir Starmer nach Kiew. Die Grünen antworten Wirtschaftsministerin Reiche auf ihre Energiepläne. Alle Ent… [+21761 chars],,de,'Wind'
https://www.zeit.de/news/2025-05/10/mv-minister-blank-energiewende-wirtschaftlich-und-sozial,https://www.zeit.de/news/2025-05/10/mv-minister-blank-energiewende-wirtschaftlich-und-sozial,0,www.zeit.de,Windkraft-Ausbau: MV-Minister Blank: Energiewende wirtschaftlich und sozial,Hier finden Sie Informationen zu dem Thema „Windkraft-Ausbau“. Lesen Sie jetzt „MV-Minister Blank: Energiewende wirtschaftlich und sozial“.,https://img.zeit.de/news/2025-05/10/mv-minister-blank-energiewende-wirtschaftlich-und-sozial-image-group/wide__1300x731,2025-05-10T09:49:22Z,,"Als Vorsitzender der Energieministerkonferenz in diesem Jahr sieht sich Mecklenburg-Vorpommerns Ressortchef Wolfgang Blank (parteilos) besonders in der Pflicht, den Ausbau der erneuerbaren Energien i… [+4190 chars]",,de,'Wind'
https://www.stern.de/gesellschaft/regional/mecklenburg-vorpommern/windkraft-ausbau--mv-minister-blank--energiewende-wirtschaftlich-und-sozial-35711558.html,https://www.stern.de/gesellschaft/regional/mecklenburg-vorpommern/windkraft-ausbau--mv-minister-blank--energiewende-wirtschaftlich-und-sozial-35711558.html,0,www.stern.de,Windkraft-Ausbau: MV-Minister Blank: Energiewende wirtschaftlich und sozial,Im Norden drehen sich besonders viele Windräder. Doch der regionale Nutzen der Ökostrom-Produktion ist nach Ansicht von Mecklenburg-Vorpommerns Energieminister Blank noch zu gering.,https://image.stern.de/35711560/t/uz/v1/w1440/r1.7778/-/10--ievu2tyejtv32axs2048jpeg---a398aadd641542f7.jpg,2025-05-10T09:49:22Z,https://web.archive.org/web/20250510105008/https://www.stern.de/gesellschaft/regional/mecklenburg-vorpommern/windkraft-ausbau--mv-minister-blank--energiewende-wirtschaftlich-und-sozial-35711558.html,"Kopiere den aktuellen Link
Zur Merkliste hinzufügen
Im Norden drehen sich besonders viele Windräder. Doch der regionale Nutzen der Ökostrom-Produktion ist nach Ansicht von Mecklenburg-Vorpommerns E… [+4391 chars]",,de,'Wind'
https://www.golem.de/sonstiges/zustimmung/auswahl.html?from=https://www.golem.de/news/keine-zugriffsrechte-bremer-online-meldeportal-war-jahrelang-kaputt-2505-196082.html&referer=https://t.co/e759a22c98,https://www.golem.de/sonstiges/zustimmung/auswahl.html?from=https://www.golem.de/news/keine-zugriffsrechte-bremer-online-meldeportal-war-jahrelang-kaputt-2505-196082.html&referer=https://t.co/e759a22c98,0,www.golem.de,Keine Zugriffsrechte: Bremer Online-Meldeportal war jahrelang kaputt,"Die Programmierer der Behörde hatten niemandem die Zugriffsrechte auf die Meldungen von Menschen in Not erteilt. Das blieb lange unentdeckt. (Software, Politik)",,2025-05-10T13:01:01Z,,"Besuchen Sie Golem.de wie gewohnt mit Werbung und Tracking,
 indem Sie der Nutzung aller Cookies zustimmen.
 Details zum Tracking finden Sie im Privacy Center.
Skript wurde nicht geladen. Informat… [+607 chars]",,de,'Not'
https://stadt-bremerhaven.de/frieren-statt-heizen-laut-umfrage-in-deutschland-fuer-viele-eine-option/,https://stadt-bremerhaven.de/frieren-statt-heizen-laut-umfrage-in-deutschland-fuer-viele-eine-option/,0,stadt-bremerhaven.de,Frieren statt Heizen: Laut Umfrage in Deutschland für viele eine Option,"Wir erinnern uns: Als der russische Angriffskrieg auf die Ukraine begann, gerieten natürlich direkt die Beziehungen zwischen Deutschland und Russland ins Wanken. Als Folge kam es auch zu allerlei Hin und Her um russische Gaslieferungen an Deutschland. Zwische…",https://stadt-bremerhaven.de/wp-content/uploads/2025/05/Heizung.jpg,2025-05-10T15:00:22Z,https://web.archive.org/web/20250511153340/https://stadt-bremerhaven.de/frieren-statt-heizen-laut-umfrage-in-deutschland-fuer-viele-eine-option/,"Wir erinnern uns: Als der russische Angriffskrieg auf die Ukraine begann, gerieten natürlich direkt die Beziehungen zwischen Deutschland und Russland ins Wanken. Als Folge kam es auch zu allerlei Hin… [+2090 chars]",,de,'Heizung'
https://www.bild.de/leben-wissen/digital/chat-gpt-hoeflichkeit-gegenueber-der-ki-kostet-millionen-681f84167e01bb474a0e0e66,https://www.bild.de/leben-wissen/digital/chat-gpt-hoeflichkeit-gegenueber-der-ki-kostet-millionen-681f84167e01bb474a0e0e66,0,www.bild.de,"Es kann Millionen kosten - Überlegen Sie gut, ob Sie sich bei der KI bedanken",Der Informationsaustausch mit der künstlichen Intelligenz verursacht enorme Energiekosten.,"https://images.bild.de/681f84167e01bb474a0e0e66/a810c1604c4881dbae7883325c89e7f9-landscape,5befc739?w=1280",2025-05-10T17:19:29Z,https://web.archive.org/web/20250510172924/https://www.bild.de/leben-wissen/digital/chat-gpt-hoeflichkeit-gegenueber-der-ki-kostet-millionen-681f84167e01bb474a0e0e66,"Um den TTS Player darzustellen, brauchen wir deine Zustimmung. 
 externen Inhalt aktivieren Um eingebettete Inhalte anzuzeigen, ist Ihre jederzeit widerrufliche Einwilligung (über den Schalter oder … [+2985 chars]",,de,'Energiekosten'
https://www.nzz.ch/nzz-am-sonntag-magazin/zartmann-von-tiktok-an-die-spitze-der-charts-der-saenger-liefert-den-soundtrack-fuer-eine-jugend-zwischen-hedonismus-und-depression-ld.1883279,https://www.nzz.ch/nzz-am-sonntag-magazin/zartmann-von-tiktok-an-die-spitze-der-charts-der-saenger-liefert-den-soundtrack-fuer-eine-jugend-zwischen-hedonismus-und-depression-ld.1883279,0,www.nzz.ch,Von TikTok an die Spitze der Charts: Sänger Zartmann liefert den Soundtrack für eine Jugend zwischen Hedonismus und Depression,"Mit Songs wie «Tau mich auf» holt Zartmann die weltenmüde Jugend ab. Ein Treffen mit dem Berliner Musiker, der gerade Konzerthallen füllt – und sich dabei nicht zu verlieren versucht.","https://img.nzz.ch/2025/05/07/f69fa772-a05e-4fab-94b3-fad8b77746d3.jpeg?width=1200&height=674&fit=bounds&quality=75&auto=webp&crop=3544,1993,x0,y1432&wmark=nzz",2025-05-10T19:45:00Z,http://archive.md/20250511060238/https://www.nzz.ch/nzz-am-sonntag-magazin/zartmann-von-tiktok-an-die-spitze-der-charts-der-saenger-liefert-den-soundtrack-fuer-eine-jugend-zwischen-hedonismus-und-depression-ld.1883279,"Optimieren Sie Ihre Browsereinstellungen
NZZ.ch benötigt JavaScript für wichtige Funktionen. Ihr Browser oder Adblocker verhindert dies momentan.
Bitte passen Sie die Einstellungen an.
Klatsch-Kla… [+16059 chars]",,de,'Tau'
https://www.zeit.de/news/2025-05/11/dos-and-don-ts-in-biergarten-caf-co,https://www.zeit.de/news/2025-05/11/dos-and-don-ts-in-biergarten-caf-co,0,www.zeit.de,"Verhalten in der Gastronomie: Dos and Don'ts in Biergarten, Café & Co.","Hier finden Sie Informationen zu dem Thema „Verhalten in der Gastronomie“. Lesen Sie jetzt „Dos and Don'ts in Biergarten, Café & Co.“.",https://img.zeit.de/news/2025-05/11/dos-and-don-ts-in-biergarten-caf-co-image-group/wide__1300x731,2025-05-11T02:00:42Z,,"Die Sonne scheint, das Café ruft: Kaum wird es wärmer, sind die Stühle vor Cafés, Biergärten und Restaurants gefüllt. Doch welche Regeln gelten? Ein paar (teils weniger ernst gemeinte) Ratschläge.
S… [+3279 chars]",,de,'Gas'
https://www.welt.de/geschichte/article256009024/Stadion-Katastrophe-1985-Zwei-Maenner-blieben-einfach-sitzen-und-verbrannten.html,https://www.welt.de/geschichte/article256009024/Stadion-Katastrophe-1985-Zwei-Maenner-blieben-einfach-sitzen-und-verbrannten.html,0,www.welt.de,„Zwei Männer blieben einfach sitzen und verbrannten“,"An sich hatte das Spiel in der dritten englischen Liga am 11. Mai 1985 keine Bedeutung, denn Gastgeber Bradford City war bereits aufgestiegen. Trotzdem saßen 12.000 Menschen im Stadion. Plötzlich geriet die älteste der Tribünen in Brand. Binnen Minuten starbe…",https://img.welt.de/img/geschichte/mobile256010150/8707934537-ci16x9-w1200/Fussball-Die-abgebrannte-Tribuene-in-Bradford-1985.jpg,2025-05-11T05:32:38Z,https://web.archive.org/web/20250512012808/https://www.welt.de/geschichte/article256009024/Stadion-Katastrophe-1985-Zwei-Maenner-blieben-einfach-sitzen-und-verbrannten.html,"An sich hatte das Spiel in der dritten englischen Liga am 11. Mai 1985 keine Bedeutung, denn Gastgeber Bradford City war bereits aufgestiegen. Trotzdem saßen 12.000 Menschen im Stadion. Plötzlich ger… [+7433 chars]",,de,'Wind'
https://www.kino.de/news/bridgerton-fans-aufgepasst-neue-serie-ab-sofort-auf-netflix-und-die-verspricht-jede-menge-royalen-spass/,https://www.kino.de/news/bridgerton-fans-aufgepasst-neue-serie-ab-sofort-auf-netflix-und-die-verspricht-jede-menge-royalen-spass/,0,www.kino.de,„Bridgerton“-Fans aufgepasst: Neue Serie ab sofort auf Netflix – und die verspricht jede Menge royalen Spaß,"Party-Thronerbe trifft auf selbstbewusste Unternehmerin, um sein bröckliges Königreich zu retten – diese Serie bringt frischen Wind in die royale Serienwelt.",https://crops.giga.de/b6/40/65/24fe0a632f9dd1f26a6f860c3f_YyAxODk1eDk5MCsxMysxMwJyZSAxMjAwIDYyNwNiMDJlNmZkMjY2Mw==.jpg,2025-05-11T06:33:29Z,,"Party-Thronerbe trifft auf selbstbewusste Unternehmerin, um sein bröckliges Königreich zu retten – diese Serie bringt frischen Wind in die royale Serienwelt.
Opulente Kulissen, prickelnde Romanze un… [+3645 chars]",,de,'Wind'
https://www.ibiza-heute.de/notbehausung-auf-ibiza-geht-in-flammen-auf/,https://www.ibiza-heute.de/notbehausung-auf-ibiza-geht-in-flammen-auf/,0,www.ibiza-heute.de,Notbehausung auf Ibiza geht in Flammen auf,"Ein 56-jähriger Mann hat am Samstag nur knapp einen Brand in seiner provisorischen Unterkunft in Ibizas Inselhauptstadt Eivissa überlebt. Medienberichten […]
Der Beitrag Notbehausung auf Ibiza geht in Flammen auf erschien zuerst auf Ibiza Heute.",https://www.ibiza-heute.de/wp-content/uploads/2025/05/GpiiA2SWIAA0k0K.jpeg,2025-05-11T07:00:28Z,,Feuerwehrleute beim Löscheinsatz. Foto: Bombers d’Eivissa Ein 56-jähriger Mann hat am Samstag nur knapp einen Brand in seiner provisorischen Unterkunft in Ibizas Inselhauptstadt Eivissa überlebt. Med… [+1268 chars],,de,'Notunterkunft'
