index,url,valid,domain,title,description,image,published,archive,content,quote,language,keyword
https://www.stern.de/familie/tiere/hundemantel-fuer-den-winter--so-bleibt-ihr-vierbeiner-warm-und-gesund-36109188.html,https://www.stern.de/familie/tiere/hundemantel-fuer-den-winter--so-bleibt-ihr-vierbeiner-warm-und-gesund-36109188.html,0,www.stern.de,Kälteschutz: Hundemantel für den Winter: So kommt Ihr Vierbeiner durch die kalte Jahreszeit,"Ein Hundemantel schützt vor Kälte, Nässe und Wind – doch nicht jeder braucht ihn. Wann ein Mantel sinnvoll ist und welche Modelle besonders empfehlenswert...",https://image.stern.de/36109190/t/sF/v2/w1440/r1.7778/-/hundemantel-fuer-den-winter.jpg,2025-10-07T09:11:00Z,,"Kopiere den aktuellen Link
Zur Merkliste hinzufügen
Viele Hunde frieren im Winter, doch nicht jeder braucht gleich einen Mantel. Wann er sinnvoll ist und worauf man bei Auswahl und Passform achten … [+5818 chars]",,de,'Kälte'
https://www.fitforfun.de/wissen/wird-wein-wirklich-immer-besser-wenn-er-lange-reift-773188.html,https://www.fitforfun.de/wissen/wird-wein-wirklich-immer-besser-wenn-er-lange-reift-773188.html,0,www.fitforfun.de,"""Frischer"" versus Lagenwein: Wird Wein wirklich immer besser, wenn er lange reift?","Discounter-Weine sind selten zum Lagern geeignet, da sie oft nicht die nötige Qualität besitzen. Ein gut gereifter Riesling kann hingegen ein besonderes Geschmackserlebnis bieten.","https://www.fitforfun.de/files/images/202510/0/weinflaschen-stehen-im-regal-eines-supermarktes,773192_3x2_n.jpg",2025-10-07T09:12:00Z,,"Hast du schon einmal Wein- oder Schaumweinflaschen gekauft und über Jahre im Keller vergessen? Dann erinnerst du dich bestimmt noch an den unangenehmen Duft, der dir schon beim Öffnen entgegenschlägt… [+361 chars]",,de,'Wein'
https://www.brigitte.de/leben/nicht-entsorgen--darum-solltest-du-im-herbst-einen-weinkorken-ins-auto-legen-14034966.html,https://www.brigitte.de/leben/nicht-entsorgen--darum-solltest-du-im-herbst-einen-weinkorken-ins-auto-legen-14034966.html,0,www.brigitte.de,Nicht entsorgen!: Darum solltest du im Herbst einen Weinkorken ins Auto legen,Nach dem Entkorken einer Wein- oder Sektflasche landet der Korken meist schnell im Müll. Doch tatsächlich sollten wir ihn lieber ins Auto legen.,https://image.brigitte.de/14034940/t/yv/v1/w1440/r1.7778/-/weinkorken-im-auto.jpg,2025-10-07T09:16:00Z,,"Nach dem Entkorken einer Wein- oder Sektflasche landet der Korken meist schnell im Müll. Doch tatsächlich sollten wir ihn lieber ins Auto legen.
Ob Weiß, Rot oder Rosé viele Weinflaschen kommen mit … [+535 chars]",,de,'Wein'
https://www.bild.de/regional/nordrhein-westfalen/aachen-diebstahl-mit-waffe-am-hauptbahnhof-entdeckt-68e4e97dc9fcb483178ba524,https://www.bild.de/regional/nordrhein-westfalen/aachen-diebstahl-mit-waffe-am-hauptbahnhof-entdeckt-68e4e97dc9fcb483178ba524,0,www.bild.de,Aachen - Mann (21) klaut Wein und wird gefasst,Am Aachener Hauptbahnhof wurde ein Mann (21) mit einem Tetrapack Wein und einer Geflügelschere festgenommen. Die Ermittlungen laufen.,"https://images.bild.de/68e4e97dc9fcb483178ba524/59d377925f6ee44d50fb178f9dffdf97-landscape,29c59ff9?w=1280",2025-10-07T10:21:43Z,,"Aachen Ein 21-jähriger marokkanischer Mann wurde am Aachener Hauptbahnhof beim Diebstahl eines Tetrapacks Wein im Wert von 1,89 Euro erwischt.
Die Bundespolizei hatte den jungen Mann auf Überwachung… [+594 chars]",,de,'Wein'
https://www.tagesspiegel.de/gesellschaft/panorama/tochter-des-schraubenkonigs-marion-wurth-im-alter-von-66-jahren-gestorben-14497688.html,https://www.tagesspiegel.de/gesellschaft/panorama/tochter-des-schraubenkonigs-marion-wurth-im-alter-von-66-jahren-gestorben-14497688.html,0,www.tagesspiegel.de,Tochter des „Schraubenkönigs“: Marion Würth im Alter von 66 Jahren gestorben,"Die Tochter des baden-württembergischen Unternehmers Reinhold Würth ist überraschend gestorben. Sie war nicht Teil des Familienunternehmens, sondern widmete sich der Demeter-Landwirtschaft.",https://www.tagesspiegel.de/images/14497901/alternates/BASE_16_9_W1400/1759840435000/marion-wurth.jpeg,2025-10-07T12:32:31Z,,Der baden-württembergische Unternehmer Reinhold Würth trauert um seine Tochter Marion Würth. Die 66-Jährige sei völlig unerwartet und auch für sie nicht vorhersehbar nach einem gesundheitlichen Schic… [+1139 chars],,de,'Landwirtschaft'
https://www.bild.de/leben-wissen/teuer-schock-so-sparen-sie-beim-heizen-bares-geld-68e4e67f453c0752a42df376,https://www.bild.de/leben-wissen/teuer-schock-so-sparen-sie-beim-heizen-bares-geld-68e4e67f453c0752a42df376,0,www.bild.de,Teuer-Schock - So sparen Sie beim Heizen bares Geld,"Wird es draußen wieder kälter, hält sie uns warm: die Heizung! Doch wie vermeidet man den Heizkosten-Schock, ohne auf Wärme zu verzichten?","https://images.bild.de/68e4e67f453c0752a42df376/16d7ccb81a7ec6ad50fbd084d040f38c,5d32d482?w=1280",2025-10-07T14:01:28Z,,"Mehr zum Video anzeigen 
Wird es draußen wieder kälter, hält sie uns warm: die Heizung! Doch wie vermeidet man den Heizkosten-Schock, ohne auf Wärme zu verzichten? Mit DIESEN Tipps geht's ganz einfa… [+51 chars]",,de,'Heizung'
https://www.bild.de/politik/inland/alt-kanzler-wieder-unterwegs-scholz-bueffelt-in-brandenburg-68e52a9989973cba61e84bf1,https://www.bild.de/politik/inland/alt-kanzler-wieder-unterwegs-scholz-bueffelt-in-brandenburg-68e52a9989973cba61e84bf1,0,www.bild.de,Alt-Kanzler wieder unterwegs - Scholz büffelt in Brandenburg,Olaf Scholz besucht Projekt für nachhaltige Landwirtschaft mit Wasserbüffeln und Schafen bei Werder an der Havel.,"https://images.bild.de/68e52a9989973cba61e84bf1/06ee4a7b7332fcaffd089d334a04e6a5,90da8d27?w=1280",2025-10-07T17:21:06Z,,"Werder an der Havel Was macht eigentlich Alt-Kanzler Olaf Scholz (67)? Jetzt tauchte der Mann, der einst Deutschland an der Spitze der Ampel-Koalition regierte, wieder auf zwischen Wasser, Weide und … [+1614 chars]",,de,'Landwirtschaft'
https://www.discountfan.de/artikel/news/prime-deal-days-wein-whisky-mit-rabatt,https://www.discountfan.de/artikel/news/prime-deal-days-wein-whisky-mit-rabatt,0,www.discountfan.de,Prime Deal Days: Wein & Whisky mit Rabatt,"Anzeige*Prozente auf Hochprozentiges: Am ersten Abend der Prime Deal Days lohnt sich auch ein Blick auf die Schnäppchen im Bereich „Bier, Wein & Spirituosen“ – Discountfans können sich Glühwein, Rotwein, Whisky und mehr mit Rabatt sichern. Die hochprozentigen…",,2025-10-07T18:13:00Z,,"Prime Deal Days: Wein &amp; Whisky mit Rabatt (Bild: Amazon.de) 
Die hochprozentigen Schnäppchen zu den Prime Deal Days gelten noch bis Mittwoch Abend. Wer sich jetzt schon auf die Weihnachtszeit vo… [+1200 chars]",,de,'Wein'
https://www.stern.de/gesellschaft/regional/bayern/umstrittene-rohstoffsuche--ergebnisse-von-gasbohrung-fruehestens-anfang-2026-36113388.html,https://www.stern.de/gesellschaft/regional/bayern/umstrittene-rohstoffsuche--ergebnisse-von-gasbohrung-fruehestens-anfang-2026-36113388.html,0,www.stern.de,Umstrittene Rohstoffsuche: Ergebnisse von Gasbohrung frühestens Anfang 2026,"Auch wenn die Bohrung in Reichling am Ammersee schon beendet ist, ist noch nicht klar, ob das dort vermutete Erdgas wirklich gefördert werden kann. Wer auf das Ergebnis wartet, braucht Geduld.",https://image.stern.de/36113390/t/IW/v1/w1440/r1.7778/-/08--fmt5uwfmldv2axs2048jpeg---d8a7dd96541d4b2e.jpg,2025-10-08T02:00:24Z,,"Kopiere den aktuellen Link
Zur Merkliste hinzufügen
Auch wenn die Bohrung in Reichling am Ammersee schon beendet ist, ist noch nicht klar, ob das dort vermutete Erdgas wirklich gefördert werden kan… [+2098 chars]",,de,'Gas'
https://www.zeit.de/news/2025-10/08/ergebnisse-von-gasbohrung-fruehestens-anfang-2026,https://www.zeit.de/news/2025-10/08/ergebnisse-von-gasbohrung-fruehestens-anfang-2026,0,www.zeit.de,Umstrittene Rohstoffsuche: Ergebnisse von Gasbohrung frühestens Anfang 2026,Hier finden Sie Informationen zu dem Thema „Umstrittene Rohstoffsuche“. Lesen Sie jetzt „Ergebnisse von Gasbohrung frühestens Anfang 2026“.,https://img.zeit.de/news/2025-10/08/ergebnisse-von-gasbohrung-fruehestens-anfang-2026-image-group/wide__1300x731,2025-10-08T02:00:24Z,,"Frühestens im ersten Quartal 2026 sollen die Ergebnisse der Gasbohrung in Reichling am Ammersee vorliegen. «Mit Analyseergebnissen rechnen wir erst in einigen Monaten, erstes oder zweites Quartal 202… [+1890 chars]",,de,'Gas'
https://www.stern.de/news/bundesverwaltungsgericht-verkuendet-urteil-zu-nitratbelastung-36113416.html,https://www.stern.de/news/bundesverwaltungsgericht-verkuendet-urteil-zu-nitratbelastung-36113416.html,0,www.stern.de,Bundesverwaltungsgericht verkündet Urteil zu Nitratbelastung,"Das Bundesverwaltungsgericht in Leipzig entscheidet am Mittwoch (10.00 Uhr) über eine Klage der Deutschen Umwelthilfe gegen die Bundesrepublik. Es geht um den Schutz des Grundwassers vor Nitrat aus der Landwirtschaft, vor allem der Tierhaltung. Die Umwelthilf…",https://image.stern.de/36113418/t/tr/v1/w1440/r1.7778/-/08--ein-feld-wird-geduengt---fc706db19d42dc8a.jpg,2025-10-08T02:03:51Z,,"Kopiere den aktuellen Link
Zur Merkliste hinzufügen
Das Bundesverwaltungsgericht in Leipzig entscheidet am Mittwoch (10.00 Uhr) über eine Klage der Deutschen Umwelthilfe gegen die Bundesrepublik. E… [+753 chars]",,de,'Landwirtschaft'
https://www.stern.de/wirtschaft/news/oepnv--weniger-fahrgaeste-im-nahverkehr-als-vor-corona-36113822.html,https://www.stern.de/wirtschaft/news/oepnv--weniger-fahrgaeste-im-nahverkehr-als-vor-corona-36113822.html,0,www.stern.de,ÖPNV: Weniger Fahrgäste im Nahverkehr als vor Corona,"Das Deutschlandticket hat viele in Busse und Bahnen gelockt, doch der Boom ist vorbei. Fahrgastverbände und Verbraucherschützer befürchten, dass die Preiserhöhung die Nutzerzahlen weiter drücken wird.",https://image.stern.de/36113824/t/m0/v1/w1440/r1.7778/-/08--idpf3yz35kv5axs2048jpeg---26bddef5941a5d38.jpg,2025-10-08T07:01:20Z,,"Kopiere den aktuellen Link
Zur Merkliste hinzufügen
Das Deutschlandticket hat viele in Busse und Bahnen gelockt, doch der Boom ist vorbei. Fahrgastverbände und Verbraucherschützer befürchten, dass … [+1827 chars]",,de,'ÖPNV'
https://www.zeit.de/news/2025-10/08/weniger-fahrgaeste-im-nahverkehr-als-vor-corona,https://www.zeit.de/news/2025-10/08/weniger-fahrgaeste-im-nahverkehr-als-vor-corona,0,www.zeit.de,ÖPNV: Weniger Fahrgäste im Nahverkehr als vor Corona,Hier finden Sie Informationen zu dem Thema „ÖPNV“. Lesen Sie jetzt „Weniger Fahrgäste im Nahverkehr als vor Corona“.,https://img.zeit.de/news/2025-10/08/weniger-fahrgaeste-im-nahverkehr-als-vor-corona-image-group/wide__1300x731,2025-10-08T07:01:20Z,,"In Deutschland fahren weniger Menschen mit Bussen und Bahnen als vor der Corona-Pandemie. 11,5 Milliarden Fahrgäste waren 2024 im Liniennahverkehr unterwegs und damit zwei Prozent weniger als im Vor-… [+1611 chars]",,de,'ÖPNV'
https://www.tagesspiegel.de/wirtschaft/opnv-weniger-fahrgaste-im-nahverkehr-als-vor-corona-14502713.html,https://www.tagesspiegel.de/wirtschaft/opnv-weniger-fahrgaste-im-nahverkehr-als-vor-corona-14502713.html,0,www.tagesspiegel.de,ÖPNV: Weniger Fahrgäste im Nahverkehr als vor Corona,"Das Deutschlandticket hat viele in Busse und Bahnen gelockt, doch der Boom ist vorbei. Fahrgastverbände und Verbraucherschützer befürchten, dass die Preiserhöhung die Nutzerzahlen weiter drücken wird.",https://www.tagesspiegel.de/images/14502710/alternates/BASE_16_9_W1400/1759906946000/linienbusse.jpeg,2025-10-08T07:02:27Z,,"In Deutschland fahren weniger Menschen mit Bussen und Bahnen als vor der Corona-Pandemie. 11,5 Milliarden Fahrgäste waren 2024 im Liniennahverkehr unterwegs und damit zwei Prozent weniger als im Vor-… [+1667 chars]",,de,'ÖPNV'
https://www.faz.net/aktuell/rhein-main/frankfurt/flughafen-frankfurt-terminal-3-geht-im-april-2026-an-den-start-accg-110721711.html,https://www.faz.net/aktuell/rhein-main/frankfurt/flughafen-frankfurt-terminal-3-geht-im-april-2026-an-den-start-accg-110721711.html,0,www.faz.net,Flughafen Frankfurt: Terminal 3 geht im April 2026 an den Start,Fraport setzt ein Zeichen: Am 22. April 2026 öffnet das neue Terminal 3 am Frankfurter Flughafen. Das Milliardenprojekt bringt Platz für Millionen zusätzliche Passagiere und sorgt für frischen Wind am größten deutschen Airport.,https://media1.faz.net/ppmedia/w1200/aktuell/2403583067/1.10721735/facebook_teaser/der-ankunftsbereich-von.jpg.webp,2025-10-08T07:36:38Z,,Der Frankfurter Flughafenbetreiber Fraport will das neue Terminal 3 am größten deutschen Flughafen am 22. April 2026 eröffnen. Fraport-Chef Stefan Schulte kündigte den Termin für die Inbetriebnahme a… [+1610 chars],,de,'Wind'
https://www.stern.de/capital/trump-klemmt-die-usa-von-erneuerbaren-energien-ab-36112596.html,https://www.stern.de/capital/trump-klemmt-die-usa-von-erneuerbaren-energien-ab-36112596.html,0,www.stern.de,Erneuerbare Energien: Trump klemmt die USA vom grünen Strom ab,Der neue Bericht der Internationalen Energieagentur zeigt: Die Stromproduktion aus Sonne und Wind boomt weltweit. Nur die Amerikaner unter Präsident Trump verabschieden sich.,https://image.stern.de/36112594/t/-V/v5/w1440/r1.7778/-/trump-solarindien.jpg,2025-10-08T07:55:00Z,,"Kopiere den aktuellen Link
Zur Merkliste hinzufügen
Der neue Bericht der Internationalen Energieagentur zeigt: Die Stromproduktion aus Sonne und Wind boomt weltweit. Nur die Amerikaner unter Präsid… [+4175 chars]",,de,'Wind'
https://www.zeit.de/mobilitaet/2025-10/weniger-personen-oeffentlicher-nahverkehr,https://www.zeit.de/mobilitaet/2025-10/weniger-personen-oeffentlicher-nahverkehr,0,www.zeit.de,ÖPNV: Weniger Fahrgäste im Nahverkehr als vor Corona,Günstigere Tickets hatten dem Nahverkehr nach der Pandemie mehr Kunden beschert. Das scheint vorbei zu sein. Mittlerweile fahren weniger Menschen mit Bussen und Bahnen.,https://img.zeit.de/mobilitaet/2025-10/weniger-personen-oeffentlicher-nahverkehr-bild/wide__1300x731,2025-10-08T08:15:29Z,,"Schließen
Artikelzusammenfassung
Der ÖPNV in Deutschland verliert Fahrgäste: Laut Statistischem Bundesamt waren im vergangenen Jahr 11,5 Milliarden Menschen mit dem Liniennahverkehr unterwegs, zwei… [+659 chars]",,de,'ÖPNV'
https://www.golem.de/sonstiges/zustimmung/auswahl.html?from=https://www.golem.de/news/anzeige-smartes-heizkoerperthermostat-am-prime-day-zum-tiefstpreis-2510-200927.html&referer=https://t.co/2b648f0785,https://www.golem.de/sonstiges/zustimmung/auswahl.html?from=https://www.golem.de/news/anzeige-smartes-heizkoerperthermostat-am-prime-day-zum-tiefstpreis-2510-200927.html&referer=https://t.co/2b648f0785,0,www.golem.de,Anzeige: Smartes Heizkörperthermostat am Prime Day zum Tiefstpreis,"Mit dem Heizkörperthermostat Fritz!Dect 302 lässt sich die Heizung intelligent steuern. Am Prime Day ist der Bestseller günstig wie nie. (Technik/Hardware, AVM)",,2025-10-08T09:04:01Z,,"Besuchen Sie Golem.de wie gewohnt mit Werbung und Tracking,
 indem Sie der Nutzung aller Cookies zustimmen.
 Details zum Tracking finden Sie im Privacy Center.
Skript wurde nicht geladen. Informat… [+607 chars]",,de,'Heizung'
https://stadt-bremerhaven.de/elgato-wave-link-3-0-public-beta-startet-am-16-oktober-2025/,https://stadt-bremerhaven.de/elgato-wave-link-3-0-public-beta-startet-am-16-oktober-2025/,0,stadt-bremerhaven.de,Elgato: Wave Link 3.0 Public Beta startet am 16. Oktober 2025,"Die Audio-Software Wave Link von Elgato erscheint am 16. Oktober in einer grundlegend überarbeiteten Version 3.0. Die Software wurde von Grund auf neu entwickelt und bringt frischen Wind in die Audio-Steuerung. Das moderne Interface verspricht, die Bedienung …",https://stadt-bremerhaven.de/wp-content/uploads/2025/10/elgato-wave-link.jpg,2025-10-08T12:15:01Z,,Die Audio-Software Wave Link von Elgato erscheint am 16. Oktober in einer grundlegend überarbeiteten Version 3.0. Die Software wurde von Grund auf neu entwickelt und bringt frischen Wind in die Audio… [+1604 chars],,de,'Wind'
https://www.diepresse.com/20182807/wer-mehr-in-das-system-eingezahlt-hat-soll-einen-mehrwert-haben,https://www.diepresse.com/20182807/wer-mehr-in-das-system-eingezahlt-hat-soll-einen-mehrwert-haben,0,www.diepresse.com,"Anton Mattle: „Wer mehr in das System eingezahlt hat, soll einen Mehrwert haben“","Landeshauptmann Anton Mattle (ÖVP) über die mangelnden Baufortschritte in Deutschland beim Brenner-Basistunnel, über den Overtourism, zu wenig Schnee, teure Liftkarten, Windräder und den Pensionsabschluss.",https://img.diepresse.com/public/incoming/8mfdja-Anton-Mattle/alternates/DPR_SOCIAL_MAGAZIN/Anton%20Mattle,2025-10-08T12:45:43Z,,"Landeshauptmann Anton Mattle (ÖVP) über die mangelnden Baufortschritte in Deutschland beim Brenner-Basistunnel, über den Overtourism, zu wenig Schnee, teure Liftkarten, Windräder und den Pensionsabsc… [+12973 chars]",,de,'Wind'
https://www.basicthinking.de/blog/2025/10/08/beliebtesten-automarken-im-september-2025/,https://www.basicthinking.de/blog/2025/10/08/beliebtesten-automarken-im-september-2025/,0,www.basicthinking.de,Die beliebtesten Automarken im September 2025 – laut Kraftfahrt-Bundesamt,"Der Beitrag Die beliebtesten Automarken im September 2025 – laut Kraftfahrt-Bundesamt erschien zuerst beim Online-Magazin BASIC thinking. Über unseren Newsletter UPDATE startest du jeden Morgen bestens informiert in den Tag.
Der Herbst bringt frischen Wind in…",https://www.basicthinking.de/blog/wp-content/uploads/2025/10/beliebtesten-automarken-september-2025.jpg,2025-10-08T18:44:37Z,,"Der Herbst bringt frischen Wind in den deutschen Automarkt, und die Zahl der Neuanmeldungen steigt wieder an. Die im September 2025 am häufigsten zugelassen Automarken, listen wir in diesem Ranking.… [+2124 chars]",,de,'Wind'
https://www.tagesschau.de/ausland/amerika/brandstifter-losangeles-pacificpalisades-100.html,https://www.tagesschau.de/ausland/amerika/brandstifter-losangeles-pacificpalisades-100.html,0,www.tagesschau.de,Mutmaßlicher Pacific-Palisades-Brandstifter festgenommen,Neun Monate nach dem verheerenden Feuer bei Los Angeles haben die Behörden einen mutmaßlichen Brandstifter festgenommen. Bei dem Feuer in Pacific Palisades waren zwölf Menschen ums Leben gekommen und Tausende Häuser zerstört worden.,https://images.tagesschau.de/image/3e54fbfc-0d1e-4a8c-9033-528edf4a11a3/AAABmcVQsvg/AAABmKJZ-0g/16x9-big/palisades-brand-102.jpg?width=1280,2025-10-08T19:34:27Z,,"Stand: 08.10.2025 21:34 Uhr
Neun Monate nach dem verheerenden Feuer bei Los Angeles haben die Behörden einen mutmaßlichen Brandstifter festgenommen. Bei dem Feuer in Pacific Palisades waren zwölf Me… [+1918 chars]",,de,'Wind'
https://www.morgenpost.de/wirtschaft/article410181967/gasheizung-stilllegen-experten-warnen-vor-explosionsgefahr.html,https://www.morgenpost.de/wirtschaft/article410181967/gasheizung-stilllegen-experten-warnen-vor-explosionsgefahr.html,0,www.morgenpost.de,Gasheizung stilllegen: Experten warnen vor Explosionsgefahr,"Immer mehr Hausbesitzer lassen ihre alten Gasheizungen stilllegen, um kostengünstiger zu heizen. Warum das lebensgefährlich werden kann.",https://img.sparknews.funkemedien.de/408844042/408844042_1745399266_v16_9_1600.jpeg,2025-10-08T19:55:42Z,,"Mit der Kostensteigerung für Gasheizungen und den staatlichen Förderungen für den Umstieg auf klimafreundliche Alternativen steigt die Zahl der Gasanlagen, die derzeit abgeschaltet werden. Doch Fachl… [+2155 chars]",,de,'Gas'
https://www.perlentaucher.de/wo-wir-nicht-sind/buchkritik-zu-hemley-boums-roman-wind-der-uns-heimtraegt.html,https://www.perlentaucher.de/wo-wir-nicht-sind/buchkritik-zu-hemley-boums-roman-wind-der-uns-heimtraegt.html,0,www.perlentaucher.de,WO WIR NICHT SIND: Keinen Rückzieher machen,"Die kamerunische Schriftstellerin Hemley Boum erzählt in ihrem mit dem Grand Prix Afrique ausgezeichneten Roman ""Wind, der uns heimträgt"" melancholisch wie ein Blues von zwei Männern, einem Fischer in Kamerun und seinem Enkel, einem Psychologen in Paris, die …",https://www.perlentaucher.de/cdata/tpic/12108.jpg,2025-10-08T20:00:00Z,,"Ein Fischer an der Küste Kameruns bäumt sich gegen die Moderne, Armut und Ausbeutung auf, sein Enkel lebt als Psychologe in Paris und wird zu einem Meister der Verdrängung. Die kamerunische Schriftst… [+8315 chars]",,de,'Wind'
https://www.n-tv.de/leute/tv/Guenther-Jauch-lacht-ueber-Chris-Talls-Witze-Schreiber-article26079817.html,https://www.n-tv.de/leute/tv/Guenther-Jauch-lacht-ueber-Chris-Talls-Witze-Schreiber-article26079817.html,0,www.n-tv.de,"""Wer wird Millionär?"": Günther Jauch lacht über Chris Talls Witze-Schreiber","In der ""3-Millionen-Euro-Woche"" geht es um viel Geld - so viel steht fest. Manchmal ist die Fallhöhe auch immens. Bei allem Ernst darf aber auch der Spaß nicht zu kurz kommen. Für Letzteres ist genau der richtige Kandidat zu Gast.",https://www.n-tv.de/img/incoming/crop26079841/2021327453-cImg_16_9-w1200/Stimmungskanone-Sascha-Korf-hat-jede-Menge-gute-Laune-im-Gepack-Quelle-RTL-Stefan-Gregorowius.jpg,2025-10-08T22:03:02Z,,"In der ""3-Millionen-Euro-Woche"" geht es um viel Geld - so viel steht fest. Manchmal ist die Fallhöhe auch immens. Bei allem Ernst darf aber auch der Spaß nicht zu kurz kommen. Für Letzteres ist genau… [+5201 chars]",,de,'Gas'
https://www.nzz.ch/wirtschaft/neue-spekulationen-um-einen-gas-deal-mit-der-trump-regierung-der-ehemalige-us-botschafter-ed-mcmullen-aeussert-sich-zu-seiner-rolle-ld.1906177,https://www.nzz.ch/wirtschaft/neue-spekulationen-um-einen-gas-deal-mit-der-trump-regierung-der-ehemalige-us-botschafter-ed-mcmullen-aeussert-sich-zu-seiner-rolle-ld.1906177,0,www.nzz.ch,Neue Spekulationen um einen Gas-Deal mit der Trump-Regierung: Der ehemalige US-Botschafter Ed McMullen äussert sich zu seiner Rolle,"Laut Berichten haben Partners Group und Mercuria zugesichert, Milliarden in den amerikanischen Energiesektor zu investieren. Ex-Botschafter McMullen sitzt im Advisory-Board einer involvierten Pipelinebetreiberin.","https://img.nzz.ch/2025/10/08/f00adf2e-a6f1-4964-87c5-a5e6f220b40d.jpg?width=1200&height=675&fit=bounds&quality=75&auto=webp&crop=2133,1200,x88,y66&wmark=nzz",2025-10-09T03:30:00Z,,"Laut Berichten haben Partners Group und Mercuria zugesichert, Milliarden in den amerikanischen Energiesektor zu investieren. Ex-Botschafter McMullen sitzt im Advisory-Board einer involvierten Pipelin… [+7051 chars]",,de,'Gas'
https://www.welt.de/politik/ausland/video68e7393adaea3e0002fb3e8a/infrastruktur-im-visier-russische-angriffe-auf-ukrainische-erdoelraffinerie.html,https://www.welt.de/politik/ausland/video68e7393adaea3e0002fb3e8a/infrastruktur-im-visier-russische-angriffe-auf-ukrainische-erdoelraffinerie.html,0,www.welt.de,Russische Angriffe auf ukrainische Erdölraffinerie,Russland hat mit Drohnen ein Öldepot in der ukrainischen Stadt Tschernihiw angegriffen. Die Energieinfrastruktur rückt für die Russen immer mehr ins Visier der Angriffe. Die Folge: Das Gas für den Winter wird knapp in der Ukraine. Korrespondent Christoph Wann…,https://images.welt.de/68e7393adaea3e0002fb3e8a/1a72a8e69cc140e9fc5e25f269901aad-master/ci16x9-w1200/welttv-ukraine,2025-10-09T05:35:19Z,,Die WELT als ePaper: Die vollständige Ausgabe steht Ihnen bereits am Vorabend zur Verfügung so sind Sie immer hochaktuell informiert. Weitere Informationen https://epaper.welt.de,,de,'Gas'
https://www.tagesschau.de/inland/gesellschaft/wohnungslosigkeit-frauen-100.html,https://www.tagesschau.de/inland/gesellschaft/wohnungslosigkeit-frauen-100.html,0,www.tagesschau.de,Wie ein Berliner Projekt wohnungslosen Frauen hilft,"Zuerst kommt die Wohnung, dann der Rest: ""Housing First"" hilft Menschen unkompliziert beim Neuanfang. Ein Berliner Projekt nimmt Wohnungslose in den Blick, die oft übersehen werden: Frauen mit Kindern. Von Andre Kartschall.",https://images.tagesschau.de/image/bb2862c0-b291-4e34-8a54-d2d1f088beac/AAABmMx-kYc/AAABmKJZ-0g/16x9-big/wohnungssuche-zettel-102.jpg?width=1280,2025-10-09T05:55:40Z,,"Stand: 09.10.2025 07:55 Uhr
Zuerst kommt die Wohnung, dann der Rest: ""Housing First"" hilft Menschen unkompliziert beim Neuanfang. Ein Berliner Projekt nimmt Wohnungslose in den Blick, die oft überse… [+6054 chars]",,de,'Wohnungslose'
https://www.tagesspiegel.de/wissen/leere-grune-versprechen-fossilindustrie-investiert-kaum-in-erneuerbare-14504393.html,https://www.tagesspiegel.de/wissen/leere-grune-versprechen-fossilindustrie-investiert-kaum-in-erneuerbare-14504393.html,0,www.tagesspiegel.de,Leere grüne Versprechen: Fossilindustrie investiert kaum in Erneuerbare,"Öl- und Gasunternehmen geben sich als Gestalter der Energiewende. An ihren Beteiligungen an Erneuerbaren-Projekten bemessen, bleiben sie aber weit hinter diesem Anspruch zurück.",https://www.tagesspiegel.de/images/14504225/alternates/BASE_16_9_W1400/1759921339000/burning-chimney.jpeg,2025-10-09T06:31:58Z,,"Es sind Namen wie Gazprom, ExxonMobil, Total und BP: Nach außen geben sich viele Öl- und Gasunternehmen klimabewusst. Doch bislang beteiligen sie sich kaum am Klimaschutz und machen ihr Hauptgeschäft… [+3251 chars]",,de,'Gas'
