index,url,valid,domain,title,description,image,published,archive,content,quote,language,keyword
https://www.bild.de/bild-plus/ratgeber/2023/ratgeber/gas-anbieter-wechseln-manche-sparen-bis-zu-3000-euro-100-staedte-im-vergleich-84879210.bild.html,https://www.bild.de/bild-plus/ratgeber/2023/ratgeber/gas-anbieter-wechseln-manche-sparen-bis-zu-3000-euro-100-staedte-im-vergleich-84879210.bild.html,0,www.bild.de,"Manche sparen mehr als 3000 Euro - Was es bringt, jetzt den Gas-Anbieter zu wechseln","Das Vergleichsportal Check24 hat jetzt exklusiv für BILD untersucht, wie groß die Ersparnis in den 100 größten deutschen Städten ausfallen könnte.","https://images.bild.de/64c77f4ee98fa73a8ae22787/937c2dbab8ccb66a2732821374d5da8d,ec942f39?w=1280",2023-08-02T14:44:28Z,,"Dass sich ein Anbieterwechsel finanziell oft richtig lohnt, ist längst kein Geheimnis mehr. Und das gilt nicht nur für den Strom, sondern auch für Handy-, Öl- oder Gasverträge. 
Auch wenn die Preise… [+286 chars]",,de,'Gas'
https://www.morgenpost.de/wirtschaft/article239050541/heizung-energetische-sanierung-altbau-waermepumpe-erfahrung-kosten.html,https://www.morgenpost.de/wirtschaft/article239050541/heizung-energetische-sanierung-altbau-waermepumpe-erfahrung-kosten.html,0,www.morgenpost.de,Heizung und Co.: Familie soll für Altbau-Sanierung 150.000 Euro zahlen,"Wärmepumpe, Gebäudedämmung, dreifach verglaste Fenster: Ein Reihenmittelhaus wird energetisch saniert. Was der Energieberater rät.",https://img.morgenpost.de/img/wirtschaft/crop239050531/7262601304-w820-cv16_9-q85/276517ac-2bad-11ee-88bc-a91e88feefb2.jpg,2023-08-02T14:49:00Z,,"Stuttgart/Berlin. <ul><li>Viele Hausbesitzer stehen vor der Entscheidung, ihre Immobilie energetisch zu sanieren</li><li>Doch wie viele Kosten fallen für die Modernisierung der Heizung, Fenster, Dämm… [+9460 chars]",,de,'Heizung'
https://www.zeit.de/news/2023-08/02/deo-gas-als-wasserstoffspeicher-kreislaufsystem-entwicklung,https://www.zeit.de/news/2023-08/02/deo-gas-als-wasserstoffspeicher-kreislaufsystem-entwicklung,0,www.zeit.de,Energie: Deo-Gas als Wasserstoffspeicher: Kreislaufsystem Entwicklung,,,2023-08-02T14:52:38Z,,"When browsing with ads:
We collect personal data and also transmit it to third-party providers
 that help us improve and finance our digital content. Some of the information stored on your device, … [+821 chars]",,de,'Gas'
https://www.stern.de/gesellschaft/regional/nordrhein-westfalen/energie--deo-gas-als-wasserstoffspeicher--kreislaufsystem-entwicklung-33704550.html,https://www.stern.de/gesellschaft/regional/nordrhein-westfalen/energie--deo-gas-als-wasserstoffspeicher--kreislaufsystem-entwicklung-33704550.html,0,www.stern.de,Energie: Deo-Gas als Wasserstoffspeicher: Kreislaufsystem Entwicklung,"Für die Energiewende sind auch Wasserstoffimporte nötig. Nicht alles kann per Pipeline kommen, auch Schiffe werden Wasserstoffverbindungen um den halben Erdball transportieren. Forscher aus Deutschland bringen dafür jetzt einen neuen Stoff ins Spiel.",https://image.stern.de/33704552/t/7t/v1/w1440/r1.7778/-/02--urnnewsmldpacom2009010123080299667587v3w800h600l640t425r1920b1278jpeg---de73b5f091dbd10c.jpg,2023-08-02T14:52:38Z,,"Für die Energiewende sind auch Wasserstoffimporte nötig. Nicht alles kann per Pipeline kommen, auch Schiffe werden Wasserstoffverbindungen um den halben Erdball transportieren. Forscher aus Deutschla… [+2409 chars]",,de,'Gas'
https://www.wiwo.de/unternehmen/energie/wasserstoff-mit-quoten-wird-gas-endlich-gruen/29293222.html,https://www.wiwo.de/unternehmen/energie/wasserstoff-mit-quoten-wird-gas-endlich-gruen/29293222.html,0,www.wiwo.de,Wasserstoff: Mit Quoten wird Gas endlich grün,"Mehr Wasserstoff, mehr Biogas – und das Schritt für Schritt mit klaren Zielen. Diesen guten Vorschlag sollte die Regierung in die Tat umsetzen. Ein Kommentar.",https://www.wiwo.de/images/chemcoastpark-brunsbuettel-hier-entsteht-ein-lng-terminal-fuer-die-gasversorgung-in-deutschland-chemcoastpark-brunsbuet/29293232/3-format11240.jpg,2023-08-02T17:04:49Z,,Für Nachrichtenseiten wie WirtschaftsWoche Online sind Anzeigen eine wichtige Einnahmequelle. Mit den Werbeerlösen können wir die Arbeit unserer Redaktion bezahlen und Qualitätsartikel kostenfrei ver… [+173 chars],,de,'Gas'
https://www.wiwo.de/unternehmen/energie/energiewende-gibt-es-bald-wasserstoff-aus-deo-gasen/29293054.html,https://www.wiwo.de/unternehmen/energie/energiewende-gibt-es-bald-wasserstoff-aus-deo-gasen/29293054.html,0,www.wiwo.de,Energiewende: Gibt es bald Wasserstoff aus Deo-Gasen?,"Seit der Energiekrise ist Wasserstoff wichtiger denn je – doch der wird teilweise um die halbe Welt transportiert. Nun machen Forscher aus Deutschland auf einen Stoff aufmerksam, der mehr Nachhaltigkeit ermöglicht.",https://www.wiwo.de/images/deo/29293094/3-format11240.jpg,2023-08-02T17:06:42Z,,"Wasserstoff insbesondere grüner Wasserstoff könnte eine Lösung für Deutschlands Energiewende und eine nachhaltigere Industrie sein. Allerdings ist es nach wie vor eine große Herausforderung, Wasserst… [+3031 chars]",,de,'Gas'
https://www.bild.de/bild-plus/politik/inland/politik-inland/grundsteuer-heizung-sanierung-eigentuemern-droht-der-kosten-schock-84909604.bild.html,https://www.bild.de/bild-plus/politik/inland/politik-inland/grundsteuer-heizung-sanierung-eigentuemern-droht-der-kosten-schock-84909604.bild.html,0,www.bild.de,"Grundsteuer, Heizung, Sanierung - Eigentümern droht der Kosten-Schock",DAS sind keine guten Nachrichten für Immobilien-Eigentümer... Eigenheimbesitzer droht der dreifache Kosten-Hammer.,"https://images.bild.de/64ca514197f8bb6b2ff1f984/3b395bbdde7646472e947040e540cf99,412389e0?w=1280",2023-08-03T03:27:40Z,,"Grundsteuer, Heiz-Hammer und EU-Sanierungszwang: Für Immobilien-Eigentümer kann es richtig teuer werden. 
Lesen Sie mit BILDplus, welche Kosten für ein Ein-, Zwei- und Mehrfamilienhaus entstehen kön… [+23 chars]",,de,'Heizung'
https://www.diepresse.com/13769029/strom-und-gasverbrauch-im-juni-deutlich-gesunken,https://www.diepresse.com/13769029/strom-und-gasverbrauch-im-juni-deutlich-gesunken,0,www.diepresse.com,Strom- und Gasverbrauch im Juni deutlich gesunken,"Die E-Control meldet einen Rückgang gegenüber dem Vorjahresmonat von 8,4 Prozent bei Strom und 10,4 Prozent bei Gas. Die Stromproduktion liegt nahezu auf Vorjahresniveau.",https://img.diepresse.com/public/incoming/a9kim7-imago-77328161/alternates/DPR_SOCIAL_NACHRICHTEN/imago%2077328161,2023-08-03T04:16:57Z,,"Die E-Control meldet einen Rückgang gegenüber dem Vorjahresmonat von 8,4 Prozent bei Strom und 10,4 Prozent bei Gas. Die Stromproduktion liegt nahezu auf Vorjahresniveau.
Der Energieverbrauch in Öst… [+2155 chars]",,de,'Gas'
https://www.wiwo.de/politik/konjunktur/konjunktur-erzeugerpreise-im-euroraum-sinken-weiter-signal-fuer-abebben-der-inflation/29295344.html,https://www.wiwo.de/politik/konjunktur/konjunktur-erzeugerpreise-im-euroraum-sinken-weiter-signal-fuer-abebben-der-inflation/29295344.html,0,www.wiwo.de,Konjunktur: Erzeugerpreise im Euroraum sinken weiter – Signal für Abebben der Inflation,Die sinkenden Energiekosten haben die Produzentenpreise stärker eingedämmt als erwartet. Diese Entwicklung stellt ein Abflauen der Inflationsrate in Aussicht.,https://www.wiwo.de/images/erzeugerpreise/29295294/2-format11240.jpg,2023-08-03T09:08:18Z,https://web.archive.org/web/20230803120741/https://www.wiwo.de/politik/konjunktur/konjunktur-erzeugerpreise-im-euroraum-sinken-weiter-signal-fuer-abebben-der-inflation/29295344.html,Die Preise der Hersteller im Euroraum sinken und lassen damit auf ein Nachlassen des Inflationsschubs schließen. Die Produzentenpreise in der Industrie fielen im Juni den zweiten Monat in Folge und z… [+1447 chars],,de,'Energiekosten'
https://www.handelsblatt.com/politik/konjunktur/nachrichten/konjunktur-erzeugerpreise-im-euro-raum-sinken-weiter/29295162.html,https://www.handelsblatt.com/politik/konjunktur/nachrichten/konjunktur-erzeugerpreise-im-euro-raum-sinken-weiter/29295162.html,0,www.handelsblatt.com,Konjunktur: Erzeugerpreise im Euroraum fallen weiter – Inflationsdruck lässt nach,Die sinkenden Energiekosten haben die Produzentenpreise stärker eingedämmt als erwartet. Diese Entwicklung stellt ein Nachlassen der Inflation in Aussicht.,https://www.handelsblatt.com/images/erzeugerpreise/29295294/2-format2003.jpg,2023-08-03T09:08:18Z,,"ErzeugerpreiseDie Energiekosten sind gegenüber dem Vorjahr stark gesunkenen.
(Foto: dpa)
Berlin/Brüssel Die Preise der Hersteller im Euro-Raum sinken und lassen damit auf ein Nachlassen des Inflati… [+783 chars]",,de,'Energiekosten'
https://www.focus.de/politik/deutschland/union-sieht-klaerungsbedarf-bei-90-fragen-zum-geplanten-heizungsgesetz_id_200801702.html,https://www.focus.de/politik/deutschland/union-sieht-klaerungsbedarf-bei-90-fragen-zum-geplanten-heizungsgesetz_id_200801702.html,0,www.focus.de,Gebäudeenergiegesetz - Diese 90 Heizungs-Fragen hat die Union jetzt an Minister Habeck,Die Ampel-Koalition will nach der Sommerpause über das sogenannte Heizungsgesetz entscheiden. Bei der Union sind aber noch nicht alle Fragen zum Gesetztes-Entwurf geklärt. In einer Anfrage an die Bundesregierung stellte die Fraktion 90 Fragen rund um die Förd…,https://p6.focus.de/img/regional/hamburg/id_200630874/robert-habeck-buendnis-90-die-gruenen-steht-zwischen-palmen-vor-dem-helmut-schmidt-haus..jpg?im=Crop%3D%280%2C139%2C2048%2C1024%29%3BResize%3D%281200%2C627%29&impolicy=perceptual&quality=mediumHigh&hash=8712279ad2ea79b5a28b525842fc28a4d13ecd534ad5cf02c92062b184f92dfb,2023-08-03T09:26:04Z,,Die Ampel-Koalition will nach der Sommerpause über das sogenannte Heizungsgesetz entscheiden. Bei der Union sind aber noch nicht alle Fragen zum Gesetztes-Entwurf geklärt. In einer Anfrage an die Bun… [+17268 chars],,de,'Heizung'
https://www.stern.de/panorama/tuerkei-nach-den-erdbeben---leben-in-truemmern-und-ringen-um-normalitaet-33709212.html,https://www.stern.de/panorama/tuerkei-nach-den-erdbeben---leben-in-truemmern-und-ringen-um-normalitaet-33709212.html,0,www.stern.de,Mehr als 50.000 Todesopfer: Türkei nach den Erdbeben – Leben in Trümmern und Ringen um Normalität,Notunterkünfte in der Hitze und Trümmerfelder – sechs Monate nach den Erdbeben in der Türkei leiden die Menschen noch immer unter den Folgen. Mit Containerstädten und Neubauten im Rekordtempo will die Regierung Abhilfe schaffen. Doch viele wollen ihr altes Vi…,https://image.stern.de/33709306/t/Zp/v2/w1440/r1.7778/-/tuerkei-erdbeben-hatay.jpg,2023-08-04T08:57:00Z,https://web.archive.org/web/20230804092242/https://www.stern.de/panorama/tuerkei-nach-den-erdbeben---leben-in-truemmern-und-ringen-um-normalitaet-33709212.html,Notunterkünfte in der Hitze und Trümmerfelder  sechs Monate nach den Erdbeben in der Türkei leiden die Menschen noch immer unter den Folgen. Mit Containerstädten und Neubauten im Rekordtempo will die… [+7384 chars],,de,'Notunterkunft'
https://www.morgenpost.de/wirtschaft/article239050541/heizung-energetische-sanierung-altbau-kosten-erfahrung-familie.html,https://www.morgenpost.de/wirtschaft/article239050541/heizung-energetische-sanierung-altbau-kosten-erfahrung-familie.html,0,www.morgenpost.de,Heizung und Co.: Familie soll horrende Summe für Altbau-Sanierung zahlen,"Zehntausende Euro soll eine Familie für die energetische Altbau-Sanierung bezahlen. ""Und Sie haben Glück"", sagt ein Energieberater.",https://img.morgenpost.de/img/wirtschaft/crop239050531/7262601304-w820-cv16_9-q85/276517ac-2bad-11ee-88bc-a91e88feefb2.jpg,2023-08-04T14:05:00Z,,Stuttgart/Berlin. <ul><li>Nicht nur das vorerst vom Bundesverfassungsgericht gestoppte Heizungsgesetz macht vielen Hausbesitzern das Leben schwer</li><li>Denn durch den CO2-Preis dürfte der Betrieb v… [+9561 chars],,de,'Heizung'
https://www.stern.de/gesellschaft/regional/mecklenburg-vorpommern/wetter--boeen-und-schauer-zum-wochenstart-in-mecklenburg-vorpommern-33713910.html,https://www.stern.de/gesellschaft/regional/mecklenburg-vorpommern/wetter--boeen-und-schauer-zum-wochenstart-in-mecklenburg-vorpommern-33713910.html,0,www.stern.de,Wetter: Böen und Schauer zum Wochenstart in Mecklenburg-Vorpommern,"Die neue Woche beginnt in Mecklenburg-Vorpommern mit Schauern und starkem Wind mit Sturmböen. Am Sonntag ist es bewölkt, am Nachmittag kommt es in Südwestmecklenburg zu schauerartigem Regen, Gewittern und Starkregen, wie der Deutsche Wetterdienst (DWD) am Son…",https://image.stern.de/33713912/t/FA/v1/w1440/r1.7778/-/06--urnnewsmldpacom2009010123080699731437v1w800h600l1500t279r3691b2855jpeg---27377e2f8047af1f.jpg,2023-08-06T11:53:16Z,https://web.archive.org/web/20230806122228/https://www.stern.de/gesellschaft/regional/mecklenburg-vorpommern/wetter--boeen-und-schauer-zum-wochenstart-in-mecklenburg-vorpommern-33713910.html,"Die neue Woche beginnt in Mecklenburg-Vorpommern mit Schauern und starkem Wind mit Sturmböen. Am Sonntag ist es bewölkt, am Nachmittag kommt es in Südwestmecklenburg zu schauerartigem Regen, Gewitter… [+1578 chars]",,de,'Wind'
