index,url,valid,domain,title,description,image,published,archive,content,quote,language,keyword
https://consent.google.com/ml?continue=https://news.google.com/rss/articles/CBMihAFodHRwczovL3d3dy5mYXoubmV0L2FrdHVlbGwvd2lydHNjaGFmdC93b2huZW4vaGF1cy9laW5iYXV2ZXJib3Qtdm9uLW9lbC11bmQtZ2FzaGVpenVuZ2VuLW9wcG9zaXRpb24tZ2VnZW4tYW1wZWwtcGxhZW5lLTE4Nzk0MjI1Lmh0bWzSAYYBaHR0cHM6Ly9tLmZhei5uZXQvYWt0dWVsbC93aXJ0c2NoYWZ0L3dvaG5lbi9oYXVzL2VpbmJhdXZlcmJvdC12b24tb2VsLXVuZC1nYXNoZWl6dW5nZW4tb3Bwb3NpdGlvbi1nZWdlbi1hbXBlbC1wbGFlbmUtMTg3OTQyMjUuYW1wLmh0bWw?oc%3D5&gl=FR&hl=en-US&cm=2&pc=n&src=1,https://consent.google.com/ml?continue=https://news.google.com/rss/articles/CBMihAFodHRwczovL3d3dy5mYXoubmV0L2FrdHVlbGwvd2lydHNjaGFmdC93b2huZW4vaGF1cy9laW5iYXV2ZXJib3Qtdm9uLW9lbC11bmQtZ2FzaGVpenVuZ2VuLW9wcG9zaXRpb24tZ2VnZW4tYW1wZWwtcGxhZW5lLTE4Nzk0MjI1Lmh0bWzSAYYBaHR0cHM6Ly9tLmZhei5uZXQvYWt0dWVsbC93aXJ0c2NoYWZ0L3dvaG5lbi9oYXVzL2VpbmJhdXZlcmJvdC12b24tb2VsLXVuZC1nYXNoZWl6dW5nZW4tb3Bwb3NpdGlvbi1nZWdlbi1hbXBlbC1wbGFlbmUtMTg3OTQyMjUuYW1wLmh0bWw?oc%3D5&gl=FR&hl=en-US&cm=2&pc=n&src=1,0,consent.google.com,Streit um Gebäudeenergiegesetz: Union und Linke wettern gegen Ampel-Pläne für Gas- und Ölheizungen - FAZ - Frankfurter Allgemeine Zeitung,"<ol><li>Streit um Gebäudeenergiegesetz: Union und Linke wettern gegen Ampel-Pläne für Gas- und Ölheizungen  FAZ - Frankfurter Allgemeine Zeitung
</li><li>Ampel einigt sich nach Koalitionsausschuss : Das Heizungsgesetz ist fertig!  BILD
</li><li>Austausch vo…",,2023-04-01T16:34:00Z,,"We use cookies and data to<ul><li>Deliver and maintain Google services</li><li>Track outages and protect against spam, fraud, and abuse</li><li>Measure audience engagement and site statistics to unde… [+1131 chars]",,de,'Gas'
https://www.faz.net/aktuell/wirtschaft/wohnen/haus/einbauverbot-von-oel-und-gasheizungen-opposition-gegen-ampel-plaene-18794225.html,https://www.faz.net/aktuell/wirtschaft/wohnen/haus/einbauverbot-von-oel-und-gasheizungen-opposition-gegen-ampel-plaene-18794225.html,0,www.faz.net,Trotz Kompromiss: Union und Linke schießen gegen Ampel-Pläne für Gas- und Ölheizungen,Die Ampel-Koalition hat ihre Pläne für ein Einbauverbot neuer Gas- und Ölheizungen modifiziert. Union und Linke laufen auch gegen die angepasst Version Sturm.,https://media1.faz.net/ppmedia/aktuell/wirtschaft/2306788883/1.8794305/facebook_teaser/installation-einer-gastherme.jpg,2023-04-01T16:34:48Z,,Das Einbauverbot neuer Gas- und Ölheizungen ab Anfang 2024 stößt trotz der geplanten Ausnahme- und Übergangsregelungen bei der Opposition auf scharfe Kritik. CSU-Generalsekretär Martin Huber warf der… [+4099 chars],,de,'Gas'
https://consent.google.com/ml?continue=https://news.google.com/rss/articles/CBMiYGh0dHBzOi8vd3d3LmJlcmxpbmVyLXplaXR1bmcuZGUvbmV3cy9lbmRlLXZvbi1nYXMtdW5kLW9saGVpenVuZ2VuLWFtLWhvcml6b250LXNpY2h0YmFyLWxpLjMzNDAwONIBAA?oc%3D5&gl=FR&hl=en-US&cm=2&pc=n&src=1,https://consent.google.com/ml?continue=https://news.google.com/rss/articles/CBMiYGh0dHBzOi8vd3d3LmJlcmxpbmVyLXplaXR1bmcuZGUvbmV3cy9lbmRlLXZvbi1nYXMtdW5kLW9saGVpenVuZ2VuLWFtLWhvcml6b250LXNpY2h0YmFyLWxpLjMzNDAwONIBAA?oc%3D5&gl=FR&hl=en-US&cm=2&pc=n&src=1,0,consent.google.com,Verbot neuer Gas- und Ölheizungen: Das müssen Hausbesitzer jetzt wissen - Berliner Zeitung,"<ol><li>Verbot neuer Gas- und Ölheizungen: Das müssen Hausbesitzer jetzt wissen  Berliner Zeitung
</li><li>Austausch von Heizungen ab 2024: Regierung einigt sich auf Details im Heizungsstreit  tagesschau
</li><li>Gebäude-Energie-Gesetz: „Wir versuchen nun, …",,2023-04-01T19:08:35Z,,"We use cookies and data to<ul><li>Deliver and maintain Google services</li><li>Track outages and protect against spam, fraud, and abuse</li><li>Measure audience engagement and site statistics to unde… [+1131 chars]",,de,'Gas'
https://www.faz.net/aktuell/wirtschaft/rettet-wasserstoff-die-gasheizung-und-den-verbrenner-18791439.html,https://www.faz.net/aktuell/wirtschaft/rettet-wasserstoff-die-gasheizung-und-den-verbrenner-18791439.html,0,www.faz.net,Hoffnung für die Energiewende: Die Wette auf den Wasserstoff,Kann klimaschonender Wasserstoff die Gasheizung und den Verbrennungsmotor retten? Er hat jedenfalls einige Nachteile.,https://media0.faz.net/ppmedia/aktuell/357588412/1.8795086/facebook_teaser/wasserstofftankstelle-am.jpg,2023-04-02T11:19:35Z,,"Es geht um die beiden heißesten Eisen der Energiewende: Ab 2035 soll in Europa der Verkauf von Neuwagen mit Verbrennungsmotor verboten werden, was in Berlin und Brüssel zu einem wochenlangen politisc… [+3260 chars]",,de,'Gas'
https://www.tagesschau.de/wirtschaft/verbraucher/bio-lebensmittel-105.html,https://www.tagesschau.de/wirtschaft/verbraucher/bio-lebensmittel-105.html,0,www.tagesschau.de,Landwirtschaft: Absatzschwund bringt Biobauern in Grübeln,Erstmals seit Jahren sinken die Umsätze von Bioprodukten. Manche Bauern kehren der Öko-Landwirtschaft den Rücken und setzen wieder auf konventionelle Erzeugung. Gerät die Erfolgsgeschichte ins Stocken? <em>Von Barbara Berne</em><em>r.</em>,https://www.tagesschau.de/multimedia/bilder/oekologische-landwirtschaft-103~_v-original.jpg,2023-04-02T12:10:17Z,,Erstmals seit Jahren sinken die Umsätze von Bioprodukten. Manche Bauern kehren der Öko-Landwirtschaft den Rücken und setzen wieder auf konventionelle Erzeugung. Gerät die Erfolgsgeschichte ins Stocke… [+4146 chars],,de,'Landwirtschaft'
https://www.zeit.de/2023/14/landwirtschaft-oman-trockenheit-wassermangel,https://www.zeit.de/2023/14/landwirtschaft-oman-trockenheit-wassermangel,0,www.zeit.de,Landwirtschaft im Oman: Hüter des Wassers,"Im Oman haben Menschen über zwei Jahrtausende eine Überlebenstechnik perfektioniert, von der auch Deutschland lernen kann: In extremer Trockenheit zu wirtschaften.",,2023-04-02T15:02:13Z,,"When browsing with ads:
We collect personal data and also transmit it to third-party providers
 that help us improve and finance our digital content. Some of the information stored on your device, … [+732 chars]",,de,'Landwirtschaft'
https://www.faz.net/aktuell/wirtschaft/in-der-heizungsbuerokratie-18795810.html,https://www.faz.net/aktuell/wirtschaft/in-der-heizungsbuerokratie-18795810.html,0,www.faz.net,In der Heizungsbürokratie,"Millionen deutscher Haushalte sind wegen Habecks Kompromissvorlage beunruhigt. Diese dürfte viele Betroffene hoffen lassen, es handele sich um einen schlechten Aprilscherz.",https://media1.faz.net/ppmedia/aktuell/4153308450/1.8795797/facebook_teaser/offenbar-kein-aprilscherz-die.jpg,2023-04-02T19:42:58Z,,"Scheibchenweise rückt die Ampelkoalition die Details zur Wärmewende heraus, die Millionen Haushalte beunruhigt zum kritischen Blick auf ihre fossilen Heizungen zwingt. Drei Viertel heizen schließlich… [+1801 chars]",,de,'Heizung'
https://consent.google.com/ml?continue=https://news.google.com/rss/articles/CBMingFodHRwczovL3d3dy5zcGllZ2VsLmRlL3dpcnRzY2hhZnQvc296aWFsZXMvaGVpenVuZy11bmQtc2FuaWVydW5nLXNvLXZpZWxlLWhhdXNlaWdlbnR1ZW1lci1rb2VubmVuLWVzLXNpY2gtbmljaHQtbGVpc3Rlbi1hLWIxNDgwZjhmLTcwNGMtNGJmMy1iOWExLWJlOGFlMGZlNDczYdIBAA?oc%3D5&gl=FR&hl=en-US&cm=2&pc=n&src=1,https://consent.google.com/ml?continue=https://news.google.com/rss/articles/CBMingFodHRwczovL3d3dy5zcGllZ2VsLmRlL3dpcnRzY2hhZnQvc296aWFsZXMvaGVpenVuZy11bmQtc2FuaWVydW5nLXNvLXZpZWxlLWhhdXNlaWdlbnR1ZW1lci1rb2VubmVuLWVzLXNpY2gtbmljaHQtbGVpc3Rlbi1hLWIxNDgwZjhmLTcwNGMtNGJmMy1iOWExLWJlOGFlMGZlNDczYdIBAA?oc%3D5&gl=FR&hl=en-US&cm=2&pc=n&src=1,0,consent.google.com,(S+) Heizung und Sanierung: So viele Hauseigentümer können es sich nicht leisten - DER SPIEGEL,(S+) Heizung und Sanierung: So viele Hauseigentümer können es sich nicht leisten  DER SPIEGEL,,2023-04-03T06:08:45Z,,"We use cookies and data to<ul><li>Deliver and maintain Google services</li><li>Track outages and protect against spam, fraud, and abuse</li><li>Measure audience engagement and site statistics to unde… [+1131 chars]",,de,'Heizung'
https://www.handelsblatt.com/unternehmen/energie/gasheizung-lohnt-sich-das-heizen-mit-gas-kuenftig-noch/29058054.html,https://www.handelsblatt.com/unternehmen/energie/gasheizung-lohnt-sich-das-heizen-mit-gas-kuenftig-noch/29058054.html,0,www.handelsblatt.com,Energiewende: Lohnt sich jetzt noch eine Gasheizung?,Eine Gasheizung ist in der Anschaffung günstiger als eine Wärmepumpe. Aber Gas ist teuer – und könnte sich künftig noch deutlich verteuern. Was sich über 20 Jahre rechnet.,https://www.handelsblatt.com/images/gaszaehler-im-keller/29058176/3-format2003.jpg,2023-04-03T06:10:12Z,https://web.archive.org/web/20230403071731/https://www.handelsblatt.com/unternehmen/energie/gasheizung-lohnt-sich-das-heizen-mit-gas-kuenftig-noch/29058054.html,"Gaszähler im KellerGasheizung oder Wärmepumpe? Was verursacht höhere Kosten?
Düsseldorf Ein Gesetzesentwurf der Bundesregierung löst dieser Tage bei Verbrauchern viele Sorgen aus: Ab dem kommenden J… [+1243 chars]",,de,'Heizung'
https://oesterreich.orf.at/stories/3201432/,https://oesterreich.orf.at/stories/3201432/,0,oesterreich.orf.at,Winter traf arme Familien besonders hart,"Eine Befragung von Volkshilfe und Gesundheit Österreich GmbH (GÖG) unter armutsbetroffenen Eltern zeigt, dass diese im Winter von der Teuerung besonders hart getroffen wurden. Wegen der Kälte in der eigenen Wohnung suchten sie teils Schutz im öffentlichen Rau…",https://ibs.orf.at/oes?image=https%3A%2F%2Foekastatic.orf.at%2Fmojo%2F1_4_1%2Fstoryserver%2Foeka%2Fcommon%2Fimages%2Fog-fallback-oes.png%3Fs%3Dec233e47ded343c91da59ce7aee601c044282ef3,2023-04-03T06:23:20Z,https://web.archive.org/web/20230403081254/https://oesterreich.orf.at/stories/3201432/,"Der Winter der Teuerung, wie wir ihn nennen, ist besonders dramatisch gewesen, sagte Andrea Schmidt von der GÖG als eine der Studienautorinnen. Die Inflationsrate des Vorjahres betrug 8,6 Prozent, di… [+3296 chars]",,de,'Heizung'
https://www.kino.de/serie/gute-zeiten-schlechte-zeiten/news/babyfrage-bei-gzsz-bringt-naechste-niederlage-fuer-laura-zweifelt-sie-jetzt-an-johns-liebe/,https://www.kino.de/serie/gute-zeiten-schlechte-zeiten/news/babyfrage-bei-gzsz-bringt-naechste-niederlage-fuer-laura-zweifelt-sie-jetzt-an-johns-liebe/,0,www.kino.de,Babyfrage bei GZSZ bringt nächste Niederlage für Laura: Zweifelt sie jetzt an Johns Liebe?,"Bei GZSZ weht frischer Wind durch den Kiez. Auf einen der düstersten Momente in Lauras Leben folgt ein gewaltiges Hoch. Was sie zum Anlass nimmt, um Nägel mit Köpfen zu machen.",https://crops.giga.de/d2/3c/95/b604dc079e995815908eaa4931_YyAyNTY0eDE0NDIrMTcrMTM1AnJlIDE5MjAgMTA4MANkY2I0MGU1NThhMw==.jpg,2023-04-03T06:56:18Z,,"Bei GZSZ weht frischer Wind durch den Kiez. Auf einen der düstersten Momente in Lauras Leben folgt ein gewaltiges Hoch. Was sie zum Anlass nimmt, um Nägel mit Köpfen zu machen. Achtung, es folgen Spo… [+2666 chars]",,de,'Wind'
https://www.n-tv.de/politik/Die-Kindergrundsicherung-wird-kommen-article24030119.html,https://www.n-tv.de/politik/Die-Kindergrundsicherung-wird-kommen-article24030119.html,0,www.n-tv.de,"Kevin Kühnert im ""ntv Frühstart"": ""Die Kindergrundsicherung wird kommen""","Kaum scheint der Heizungsstreit halbwegs gelöst, bekommt sich die Ampel wegen der Kindergrundsicherung in die Haare. Im ""ntv Frühstart"" macht Generalsekretär Kühnert die Haltung seiner SPD klar: Die Kindergrundsicherung soll kommen. Beim Heizungsgesetz stimmt…",https://bilder1.n-tv.de/img/incoming/crop24029956/0221322571-cImg_16_9-w1200/Kuhnert.jpg,2023-04-03T08:28:05Z,https://web.archive.org/web/20230403170031/https://www.n-tv.de/politik/Die-Kindergrundsicherung-wird-kommen-article24030119.html,"Kaum scheint der Heizungsstreit halbwegs gelöst, bekommt sich die Ampel wegen der Kindergrundsicherung in die Haare. Im ""ntv Frühstart"" macht Generalsekretär Kühnert die Haltung seiner SPD klar: Die … [+2642 chars]",,de,'Heizung'
https://scilogs.spektrum.de/meertext/wale-sterben-nicht-an-windkraft/,https://scilogs.spektrum.de/meertext/wale-sterben-nicht-an-windkraft/,0,scilogs.spektrum.de,Wale sterben nicht an Windkraft,"Nein, Wale sterben nicht an Windkraft. Ein absurder Fake behauptet das jedoch. In den USA häufen sich in den letzten Jahren Meldungen zu Großwal-Strandungen an der US-Küste, ich hatte in anderen Artikeln schon darüber berichtet. …",https://www.volksverpetzer.de/wp-content/uploads/2023/03/image-79.png.pagespeed.ce.UtC7GEnLE4.png,2023-04-03T08:33:40Z,https://web.archive.org/web/20230403114528/https://scilogs.spektrum.de/meertext/wale-sterben-nicht-an-windkraft/,"Nein, Wale sterben nicht an Windkraft. Ein absurder Fake behauptet das jedoch. In den USA häufen sich in den letzten Jahren Meldungen zu Großwal-Strandungen an der US-Küste, ich hatte in anderen Arti… [+28215 chars]",,de,'Wind'
https://www.focus.de/finanzen/news/gas-und-oel-was-ueber-die-austauschpflicht-bei-heizungen-bekannt-ist-und-was-nicht_id_189655086.html,https://www.focus.de/finanzen/news/gas-und-oel-was-ueber-die-austauschpflicht-bei-heizungen-bekannt-ist-und-was-nicht_id_189655086.html,0,www.focus.de,Gas und Öl - Was über die Austauschpflicht bei Heizungen bekannt ist - und was nicht,"Gilt jetzt ein Heizungsverbot für Gas und Öl ab 2024 – oder nicht? Viele Haushalte haben mit Spannung auf die Ergebnisse des Ampel-Gipfels gewartet. Nun gibt es erste Erkenntnisse. Aber leider keine festen Vorgaben. FOCUS online sagt, was wir über die Heizung…",https://p6.focus.de/img/fotos/id_156492790/gettyimages-1388212943.jpg?im=Crop%3D%280%2C0%2C3463%2C1732%29%3BResize%3D%281200%2C627%29&hash=8f4d1a2ff2378f1754d4e55222ca71c99f274a44554391f6ecc37e52bde39cb7,2023-04-03T08:38:23Z,https://web.archive.org/web/20230403225335/https://www.focus.de/finanzen/news/gas-und-oel-was-ueber-die-austauschpflicht-bei-heizungen-bekannt-ist-und-was-nicht_id_189655086.html,Gilt jetzt ein Heizungsverbot für Gas und Öl ab 2024 oder nicht? Viele Haushalte haben mit Spannung auf die Ergebnisse des Ampel-Gipfels gewartet. Nun gibt es erste Erkenntnisse. Aber leider keine fe… [+4224 chars],,de,'Heizung'
"https://www.cio.de/a/tanken-und-heizen-wird-guenstiger,3708779?utm_source=Seiten_3932&utm_medium=RSS&utm_campaign=RSS-Feeds","https://www.cio.de/a/tanken-und-heizen-wird-guenstiger,3708779?utm_source=Seiten_3932&utm_medium=RSS&utm_campaign=RSS-Feeds",0,www.cio.de,Energiekosten: Tanken und Heizen wird günstiger,Erstmals seit Kriegsbeginn in der Ukraine liegen die Spritpreise im Monatsdurchschnitt wieder unter dem Vorjahreszeitraum. Auch Heizen ist günstiger geworden - aus unterschiedlichen Gründen.,https://images.cio.de/bdb/3264413/640x360.jpg,2023-04-03T09:32:00Z,,"Kraftstoffpreise: So teuer wir im Jahr 2022 ist es in diesem Jahr nicht mehr.Foto: Framalicious - shutterstock.com
Nach teils drastischen Preisaufschlägen für Energie werden für die Haushalte leicht… [+2712 chars]",,de,'Energiekosten'
https://www.handelsblatt.com/unternehmen/energie/waermepumpe-warum-der-umstieg-in-anderen-laendern-besser-klappt/29061892.html,https://www.handelsblatt.com/unternehmen/energie/waermepumpe-warum-der-umstieg-in-anderen-laendern-besser-klappt/29061892.html,0,www.handelsblatt.com,Heizung: Warum der Wärmepumpen-Umstieg in anderen Ländern schneller geht,Deutschland kämpft bei der Wärmewende mit zahlreichen Problemen. Italien und Frankreich haben 2022 deutlich mehr neue Geräte verkauft. Was dort anders läuft.,https://www.handelsblatt.com/images/einbau-einer-waermepumpe/29063782/3-format2003.jpg,2023-04-03T09:50:49Z,https://web.archive.org/web/20230403124130/https://www.handelsblatt.com/unternehmen/energie/waermepumpe-warum-der-umstieg-in-anderen-laendern-besser-klappt/29061892.html,"Einbau einer WärmepumpeAuch in anderen europäischen Ländern werden Wärmepumpen teils massiv durch den Staat gefördert.
(Foto: In Pictures/Getty Images)
Düsseldorf, Wien, Paris, RomDeutschland kämpf… [+983 chars]",,de,'Heizung'
https://www.morgenpost.de/wirtschaft/article238062015/Waermewende-Haus-Grund-warnt-vor-finanzieller-Ueberlastung.html,https://www.morgenpost.de/wirtschaft/article238062015/Waermewende-Haus-Grund-warnt-vor-finanzieller-Ueberlastung.html,0,www.morgenpost.de,Energie: Wärmewende: Haus & Grund warnt vor finanzieller Überlastung,"Der Gesetzesentwurf der Ampel, der das Ende der Öl- und Gasheizungen einleiten soll, stößt auf Widerstand. Für private Hauseigentümer seien mögliche Hybrid-Lösungen sehr kostspielig.",https://img.morgenpost.de/img/wirtschaft/crop238062013/9632603553-w820-cv16_9-q85/Heizung.jpg,2023-04-03T10:10:52Z,https://web.archive.org/web/20230403231420/https://www.morgenpost.de/wirtschaft/article238062015/Waermewende-Haus-Grund-warnt-vor-finanzieller-Ueberlastung.html,Berlin. Der Eigentümerverband Haus &amp; Grund warnt bei dem geplanten Gebäudeenergiegesetz vor einer finanziellen Überlastung von Eigentümern. Für die meisten Immobilien bietet das Gebäudeenergieges… [+2003 chars],,de,'Heizung'
https://www.welt.de/politik/deutschland/article244630590/Gebaeudeenergiegesetz-Gruene-fordern-Milliarden-Programm-fuer-Heizungsaustausch.html,https://www.welt.de/politik/deutschland/article244630590/Gebaeudeenergiegesetz-Gruene-fordern-Milliarden-Programm-fuer-Heizungsaustausch.html,0,www.welt.de,Grüne fordern „Milliarden-Programm“ für Heizungsaustausch,"Ab 2024 sollen neu eingebaute Heizungen bis auf wenige Ausnahmen zu mindestens 65 Prozent aus erneuerbaren Energien betrieben werden. Die Grünen widersprechen dem Finanzminister, der Erwartungen an staatliche Förderungen zuletzt gedämpft hatte und stellen ein…",https://img.welt.de/img/politik/deutschland/mobile244630734/9041359797-ci16x9-w1200/Winterwetter-in-Sachsen.jpg,2023-04-03T10:18:24Z,https://web.archive.org/web/20230403112457/http://welt.de/politik/deutschland/article244630590/Gebaeudeenergiegesetz-Gruene-fordern-Milliarden-Programm-fuer-Heizungsaustausch.html,"Beim geplanten Förderprogramm für den Heizungstausch pochen die Grünen auf umfassende Unterstützung der Verbraucher. Bei der Umstellung werden wir darauf achten, dass niemand mit den Investitionskost… [+2938 chars]",,de,'Heizung'
https://www.stern.de/wirtschaft/news/energie--waermewende--haus---grund-warnt-vor-finanzieller-ueberlastung-33343606.html,https://www.stern.de/wirtschaft/news/energie--waermewende--haus---grund-warnt-vor-finanzieller-ueberlastung-33343606.html,0,www.stern.de,Energie: Wärmewende: Haus & Grund warnt vor finanzieller Überlastung,"Der Gesetzesentwurf der Ampel, der das Ende der Öl- und Gasheizungen einleiten soll, stößt auf Widerstand. Für private Hauseigentümer seien mögliche Hybrid-Lösungen sehr kostspielig.",https://image.stern.de/33343608/t/_G/v1/w1440/r1.7778/-/03--urnnewsmldpacom2009010123040399193162v3w800h600l589t156r2389b1478jpeg---bc7781abb73c3583.jpg,2023-04-03T10:27:00Z,https://web.archive.org/web/20230403134625/https://www.stern.de/wirtschaft/news/energie--waermewende--haus---grund-warnt-vor-finanzieller-ueberlastung-33343606.html,"Der Gesetzesentwurf der Ampel, der das Ende der Öl- und Gasheizungen einleiten soll, stößt auf Widerstand. Für private Hauseigentümer seien mögliche Hybrid-Lösungen sehr kostspielig.
Der Eigentümerv… [+2190 chars]",,de,'Gas'
https://www.tagesspiegel.de/politik/energie-klima/gesetzentwurf-veroffentlicht-ministerium-rechnet-mit-neun-milliarden-kosten-fur-neue-heizungen-9606107.html,https://www.tagesspiegel.de/politik/energie-klima/gesetzentwurf-veroffentlicht-ministerium-rechnet-mit-neun-milliarden-kosten-fur-neue-heizungen-9606107.html,0,www.tagesspiegel.de,Gesetzentwurf veröffentlicht: Ministerium rechnet mit neun Milliarden Kosten für neue Heizungen,Die Heizwende kostet Bürger in Deutschland mehrere Milliarden Euro. Dem sollen auf der anderen Seite erhebliche Einsparungen gegenüberstehen.,https://www.tagesspiegel.de/politik/images/schornstein-einer-gasheizung/alternates/BASE_16_9_W1400/schornstein-einer-gasheizung.jpeg,2023-04-03T10:42:35Z,https://web.archive.org/web/20230403143011/https://www.tagesspiegel.de/politik/energie-klima/gesetzentwurf-veroffentlicht-ministerium-rechnet-mit-neun-milliarden-kosten-fur-neue-heizungen-9606107.html,Für den Einbau klimafreundlicherer Heizungen müssen Bürgerinnen und Bürger nach Einschätzung des Wirtschaftsministeriums bis 2028 jährlich mehr als neun Milliarden Euro in die Hand nehmen. Das geht a… [+2028 chars],,de,'Heizung'
https://www.stern.de/news/angaben-zu-foerderung-bei-heizungsumtausch-fehlen-noch-33343828.html,https://www.stern.de/news/angaben-zu-foerderung-bei-heizungsumtausch-fehlen-noch-33343828.html,0,www.stern.de,Angaben zu Förderung bei Heizungsumtausch fehlen noch,"Nach der Einigung über die Vorgaben für Heizungen ab 2024 streitet die Koalition nun über begleitende Förderprogramme. Offen ist weiterhin, wie eine finanzielle Förderung für Verbraucherinnen und Verbraucher aussehen und wie hoch sie ausfallen könnte. SPD-Gen…",https://image.stern.de/33343830/t/bo/v1/w1440/r1.7778/-/03--produktion-von-waermepumpen---7fba96784d8e2668.jpg,2023-04-03T11:03:42Z,https://web.archive.org/web/20230403234920/https://www.stern.de/news/angaben-zu-foerderung-bei-heizungsumtausch-fehlen-noch-33343828.html,"Nach der Einigung über die Vorgaben für Heizungen ab 2024 streitet die Koalition nun über begleitende Förderprogramme. Offen ist weiterhin, wie eine finanzielle Förderung für Verbraucherinnen und Ver… [+3669 chars]",,de,'Heizung'
https://www.tagesschau.de/wirtschaft/verbraucher/gas-strom-preise-verivox-bestandskunden-tarife-101.html,https://www.tagesschau.de/wirtschaft/verbraucher/gas-strom-preise-verivox-bestandskunden-tarife-101.html,0,www.tagesschau.de,Energiekosten: Viele Bestandskunden zahlen zu viel,Nach Monaten steigender Preise fallen die Energiekosten wieder. Doch die gesunkenen Strom- und Gaspreise kommen oftmals nicht bei den Haushalten an. Vor allem Kunden in Grundversorgungs-Tarifen zahlen häufig mehr als sie müssten.,https://www.tagesschau.de/multimedia/bilder/gashahn-101~_v-original.jpg,2023-04-03T11:15:48Z,,Nach Monaten steigender Preise fallen die Energiekosten wieder. Doch die gesunkenen Strom- und Gaspreise kommen oftmals nicht bei den Haushalten an. Vor allem Kunden in Grundversorgungs-Tarifen zahle… [+4371 chars],,de,'Energiekosten'
https://www.wiwo.de/politik/deutschland/energie-haus-und-grund-warnt-vor-finanzieller-ueberlastung-bei-der-energiewende/29075292.html,https://www.wiwo.de/politik/deutschland/energie-haus-und-grund-warnt-vor-finanzieller-ueberlastung-bei-der-energiewende/29075292.html,0,www.wiwo.de,Energie: Haus & Grund warnt vor finanzieller Überlastung bei der Energiewende,"Der Gesetzesentwurf zum Ende der Öl- und Gasheizungen, stößt auf Widerstand. Für Hauseigentümer seien mögliche Hybrid-Lösungen zu kostspielig. Der Eigentümerverband fordert deshalb die Überarbeitung des Entwurfes.",https://www.wiwo.de/images/heizung/29075290/1-format11240.jpg,2023-04-03T11:16:49Z,https://web.archive.org/web/20230403131743/http://www.wiwo.de/politik/deutschland/energie-haus-und-grund-warnt-vor-finanzieller-ueberlastung-bei-der-energiewende/29075292.html,Der Eigentümerverband Haus &amp; Grund warnt bei dem geplanten Gebäudeenergiegesetz vor einer finanziellen Überlastung von Eigentümern. Für die meisten Immobilien bietet das Gebäudeenergiegesetz wede… [+2529 chars],,de,'Gas'
https://www.handelsblatt.com/politik/deutschland/waermewende-ministerium-rechnet-mit-neun-milliarden-kosten-fuer-neue-heizungen/29075436.html,https://www.handelsblatt.com/politik/deutschland/waermewende-ministerium-rechnet-mit-neun-milliarden-kosten-fuer-neue-heizungen/29075436.html,0,www.handelsblatt.com,Wärmewende: Ministerium rechnet mit neun Milliarden Kosten für neue Heizungen,Das Gesetz bedeutet ein Ende auf Raten für konventionelle Öl- und Gasheizungen in Deutschland. Dafür soll die bestehende Förderung für den Umstieg angepasst werden.,https://www.handelsblatt.com/images/schornstein-einer-gasheizung/29075442/2-format2003.jpg,2023-04-03T11:19:22Z,https://web.archive.org/web/20230403233433/https://www.handelsblatt.com/politik/deutschland/waermewende-ministerium-rechnet-mit-neun-milliarden-kosten-fuer-neue-heizungen/29075436.html,"Schornstein einer GasheizungBestehende Öl- und Gasheizungen können weiter betrieben werden, kaputte Heizungen dürfen repariert werden.
(Foto: dpa)
Berlin Für den Einbau klimafreundlicherer Heizunge… [+1839 chars]",,de,'Gas'
https://www.n-tv.de/wirtschaft/Waermewende-soll-Buerger-neun-Milliarden-pro-Jahr-kosten-article24030590.html,https://www.n-tv.de/wirtschaft/Waermewende-soll-Buerger-neun-Milliarden-pro-Jahr-kosten-article24030590.html,0,www.n-tv.de,Gesetzentwurf veröffentlicht: Wärmewende soll Bürger neun Milliarden pro Jahr kosten,Klimafreundlichere Heizungen sollen konventionelle Öl- und Gasheizungen in Deutschland bis 2028 ersetzen. Für die Umstellung müssen Bürgerinnen und Bürger tiefer in die Tasche greifen. Doch die Investition zahlt sich auf lange Sicht aus - auch finanziell.,https://bilder2.n-tv.de/img/incoming/crop24030633/8451325168-cImg_16_9-w1200/imago0239409317h.jpg,2023-04-03T12:15:40Z,https://web.archive.org/web/20230403121911/https://www.n-tv.de/wirtschaft/Waermewende-soll-Buerger-neun-Milliarden-pro-Jahr-kosten-article24030590.html,Klimafreundlichere Heizungen sollen konventionelle Öl- und Gasheizungen in Deutschland bis 2028 ersetzen. Für die Umstellung müssen Bürgerinnen und Bürger tiefer in die Tasche greifen. Doch die Inves… [+1812 chars],,de,'Heizung'
