index,url,valid,domain,title,description,image,published,archive,content,quote,language,keyword
https://www.tagesschau.de/wirtschaft/verbraucher/oeffentlicher-nahverkehr-kosten-leistungen-100.html,https://www.tagesschau.de/wirtschaft/verbraucher/oeffentlicher-nahverkehr-kosten-leistungen-100.html,0,www.tagesschau.de,Studie: ÖPNV leistet wirtschaftlich viel mehr als er kostet,"Jeder Euro, der in Busse, Regionalzüge oder Straßenbahnen investiert wird, bringt der deutschen Volkswirtschaft einen Nutzen von drei Euro - so das Ergebnis einer Studie. Dieses Geld schaffe Jobs und sorge für Umsätze anderswo.",https://images.tagesschau.de/image/823f2c0c-23bf-4c79-9150-2b441ef8f0c8/AAABlhSUAgg/AAABkZLhkrw/16x9-1280/strassenbahn-124.jpg,2025-05-15T09:37:44Z,,"Stand: 15.05.2025 11:37 Uhr
Jeder Euro, der in Busse, Regionalzüge oder Straßenbahnen investiert wird, bringt der deutschen Volkswirtschaft einen Nutzen von drei Euro - so das Ergebnis einer Studie.… [+3639 chars]",,de,'ÖPNV'
https://www.bild.de/news/ausland/riesenfontaene-nach-rohrbruch-hier-geht-ein-haus-baden-68258fd26ebf7d29dc9281cf,https://www.bild.de/news/ausland/riesenfontaene-nach-rohrbruch-hier-geht-ein-haus-baden-68258fd26ebf7d29dc9281cf,0,www.bild.de,Riesenfontäne nach Rohrbruch - Hier geht ein Haus baden,"Gloucester, England: Durch eine geplatzte Wasserleitung werden Tausende Liter Wasser in die Luft geschleudert, unglücklicherweise direkt auf ein Pracht-H...","https://images.bild.de/68258fd26ebf7d29dc9281cf/52d4dc97a996719f73198ece8b5fd144-landscape,31fdf4d4?w=1280",2025-05-15T09:55:45Z,https://web.archive.org/web/20250515112656/https://www.bild.de/news/ausland/riesenfontaene-nach-rohrbruch-hier-geht-ein-haus-baden-68258fd26ebf7d29dc9281cf,"Europäische Kommission: Tiktok verstößt gegen EU-Recht
Europäische Kommission: Tiktok verstößt gegen EU-Recht
Europäische Kommission: Tiktok verstößt gegen EU-Recht
Europäische Kommission: Tiktok … [+358 chars]",,de,'Rohrbruch'
https://www.golem.de/sonstiges/zustimmung/auswahl.html?from=https://www.golem.de/news/hitzeschild-raumfahrzeuge-sollen-beim-wiedereintritt-schwitzen-2505-196225.html&referer=https://t.co/7ff491982e,https://www.golem.de/sonstiges/zustimmung/auswahl.html?from=https://www.golem.de/news/hitzeschild-raumfahrzeuge-sollen-beim-wiedereintritt-schwitzen-2505-196225.html&referer=https://t.co/7ff491982e,0,www.golem.de,Hitzeschild: Raumfahrzeuge sollen beim Wiedereintritt schwitzen,"Eine Forschungsgruppe testet gerade ein neues Material, das für Hitzeschilde in der Raumfahrt zum Einsatz kommen und ein Gas zur Kühlung freisetzen soll. (Raumfahrt, Wissenschaft)",,2025-05-15T10:30:02Z,,"Besuchen Sie Golem.de wie gewohnt mit Werbung und Tracking,
 indem Sie der Nutzung aller Cookies zustimmen.
 Details zum Tracking finden Sie im Privacy Center.
Skript wurde nicht geladen. Informat… [+607 chars]",,de,'Gas'
https://www.zeit.de/news/2025-05/15/gasleitung-augusta-verbessert-versorgung-in-sueddeutschland,https://www.zeit.de/news/2025-05/15/gasleitung-augusta-verbessert-versorgung-in-sueddeutschland,0,www.zeit.de,"Neue Pipeline in Schwaben: Gasleitung ""Augusta"" verbessert Versorgung in Süddeutschland","Hier finden Sie Informationen zu dem Thema „Neue Pipeline in Schwaben“. Lesen Sie jetzt „Gasleitung ""Augusta"" verbessert Versorgung in Süddeutschland“.",https://img.zeit.de/news/2025-05/15/gasleitung-augusta-verbessert-versorgung-in-sueddeutschland-image-group/wide__1300x731,2025-05-15T12:10:06Z,,"Eine neue knapp 41 Kilometer lange Gaspipeline in Schwaben soll künftig die Erdgasversorgung in Bayern und Baden-Württemberg sicherstellen. Wie der Betreiber, die Bayernets GmbH, zum offiziellen Baub… [+1650 chars]",,de,'Gas'
https://www.zeit.de/news/2025-05/15/tod-in-erntehelfer-unterkunft-hausbesitzer-unter-verdacht,https://www.zeit.de/news/2025-05/15/tod-in-erntehelfer-unterkunft-hausbesitzer-unter-verdacht,0,www.zeit.de,Notfälle: Tod in Erntehelfer-Unterkunft - Hausbesitzer unter Verdacht,Hier finden Sie Informationen zu dem Thema „Notfälle“. Lesen Sie jetzt „Tod in Erntehelfer-Unterkunft - Hausbesitzer unter Verdacht“.,https://img.zeit.de/news/2025-05/15/tod-in-erntehelfer-unterkunft-hausbesitzer-unter-verdacht-image-group/wide__1300x731,2025-05-15T12:11:36Z,,Eine Woche nach dem Tod von zwei Erntehelfern nach dem Gasaustritt in einer Unterkunft in Ostwestfalen ermittelt die Polizei nun gegen den Hauseigentümer wegen fahrlässiger Tötung. In Höxter waren in… [+1381 chars],,de,'Gas'
https://www.zeit.de/news/2025-05/15/bbc-ex-unioner-awoniyi-nach-not-op-aus-koma-erwacht,https://www.zeit.de/news/2025-05/15/bbc-ex-unioner-awoniyi-nach-not-op-aus-koma-erwacht,0,www.zeit.de,Premier League: BBC: Ex-Unioner Awoniyi nach Not-OP aus Koma erwacht,Hier finden Sie Informationen zu dem Thema „Premier League“. Lesen Sie jetzt „BBC: Ex-Unioner Awoniyi nach Not-OP aus Koma erwacht“.,https://img.zeit.de/news/2025-05/15/bbc-ex-unioner-awoniyi-nach-not-op-aus-koma-erwacht-image-group/wide__1300x731,2025-05-15T12:40:09Z,,Der ehemalige Bundesliga-Stürmer Taiwo Awoniyi ist laut der englischen BBC am Mittwochabend aus dem künstlichen Koma erwacht. In dieses war der 27-Jährige von Nottingham Forest nach einer Not-Operati… [+2050 chars],,de,'Not'
https://www.bild.de/news/ausland/riesen-rohrbruch-in-kleinstadt-6824ea4c3c693e42400aee77,https://www.bild.de/news/ausland/riesen-rohrbruch-in-kleinstadt-6824ea4c3c693e42400aee77,0,www.bild.de,Wasser schoss 30 Meter hoch - Riesen-Rohrbruch in Kleinstadt,"In Matson, Vorort von Gloucester in England, ist eine Hauptwasserleitung geplatzt. Bei dem Rohrbruch entstand eine riesige Fontäne.","https://images.bild.de/6824ea4c3c693e42400aee77/5e6aef92c18487801893a1bea07ed75d,34873d5a?w=1280",2025-05-15T12:52:54Z,https://web.archive.org/web/20250515130305/https://www.bild.de/news/ausland/riesen-rohrbruch-in-kleinstadt-6824ea4c3c693e42400aee77,Gloucester (Großbritannien) Die gewaltigen Wassermassen schossen mehr als 30 Meter hoch in die Luft. Binnen weniger Minuten verwandelten sie die angrenzenden Grundstücke in eine schlammige Matschland… [+1477 chars],,de,'Rohrbruch'
https://www.tagesspiegel.de/wirtschaft/mobilitaet/starkt-einzelhandel-tourismus-und-entlastet-pendler-studie-belegt-hohen-volkswirtschaftlichen-nutzen-von-opnv-angeboten-13698313.html,https://www.tagesspiegel.de/wirtschaft/mobilitaet/starkt-einzelhandel-tourismus-und-entlastet-pendler-studie-belegt-hohen-volkswirtschaftlichen-nutzen-von-opnv-angeboten-13698313.html,0,www.tagesspiegel.de,"„Stärkt Einzelhandel, Tourismus und entlastet Pendler“: Studie belegt hohen volkswirtschaftlichen Nutzen von ÖPNV-Angeboten","ÖPNV-Investitionen zahlen sich aus, wie eine aktuelle Studie im Auftrag der Bahn zeigt. Jeder investierte Euro bringt demnach einen dreifachen Nutzen für die deutsche Volkswirtschaft.",https://www.tagesspiegel.de/images/13537693/alternates/BASE_16_9_W1400/1744622229000/bahnsteige-am-ostbahnhof-wieder-frei.jpeg,2025-05-15T13:07:11Z,https://web.archive.org/web/20250515132801/https://www.tagesspiegel.de/wirtschaft/mobilitaet/starkt-einzelhandel-tourismus-und-entlastet-pendler-studie-belegt-hohen-volkswirtschaftlichen-nutzen-von-opnv-angeboten-13698313.html,"Der öffentliche Personennahverkehr ist einer Studie zufolge seine hohen Kosten wert: Jeder in Busse, Regionalzüge sowie U- und Straßenbahnen investierte Euro bringt der deutschen Volkswirtschaft demn… [+4048 chars]",,de,'ÖPNV'
https://www.focus.de/immobilien/gastbeitrag-von-timo-leukefeld-10-000-wohnungen-wie-der-kapitalmarkt-zum-gamechanger-wird_8d74dece-dd67-43d1-bf4f-63fedf81cae8.html,https://www.focus.de/immobilien/gastbeitrag-von-timo-leukefeld-10-000-wohnungen-wie-der-kapitalmarkt-zum-gamechanger-wird_8d74dece-dd67-43d1-bf4f-63fedf81cae8.html,0,www.focus.de,Gastbeitrag von Timo Leukefeld: 10.000 Wohnungen: Wie der Kapitalmarkt zum Gamechanger wird,"Der Wohnungsbau in Deutschland steht vor einer neuen Ära: Energieexperte Timo Leukefeld erklärt, wie der Kapitalmarkt ohne staatliche Förderung bezahlbaren Wohnraum schaffen kann – und warum Eigentümer jetzt Teil der Lösung werden sollten.",https://quadro.burda-forward.de/ctf/bd2879e4-66b0-4c1d-b6ff-4e4a49b20280.76790101-38f9-4552-bc3f-427afb9d6410.jpg?im=RegionOfInterestCrop%3D%281200%2C630%29%2CregionOfInterest%3D%281713%2C984%29&hash=088db37d866662b5aa42a63e257d357bd90f6ff54b21a14161cffee5b24a23b1,2025-05-15T14:42:18Z,https://web.archive.org/web/20250515175100/https://www.focus.de/immobilien/gastbeitrag-von-timo-leukefeld-10-000-wohnungen-wie-der-kapitalmarkt-zum-gamechanger-wird_8d74dece-dd67-43d1-bf4f-63fedf81cae8.html,"Kein Staat. Kein Keller. Kein Problem.
In Deutschland fehlen über eine Million Wohnungen und noch immer drehen sich die Diskussionen vor allem um Förderprogramme, Förderrichtlinien, Förderengpässe u… [+6164 chars]",,de,'Gas'
https://www.bild.de/regional/sachsen/insolvenz-beliebter-weinhaendler-steht-vor-dem-aus-682577cb6ebf7d29dc92808b,https://www.bild.de/regional/sachsen/insolvenz-beliebter-weinhaendler-steht-vor-dem-aus-682577cb6ebf7d29dc92808b,0,www.bild.de,Sächsisches Unternehmen pleite - Beliebter Weinhändler steht vor dem Aus,Der Online-Händler Ebrosia aus Delitzsch in Sachsen ist pleite. Das Unternehmen vertreibt über 2000 Produkte – vor allem Wein.,"https://images.bild.de/682577cb6ebf7d29dc92808b/7ad7aa1e80255e88495013425b08b923,b157360?w=1280",2025-05-15T17:22:32Z,http://archive.md/20250515215314/https://www.bild.de/regional/sachsen/insolvenz-beliebter-weinhaendler-steht-vor-dem-aus-682577cb6ebf7d29dc92808b,"Delitzsch (Sachsen) Über 28 Jahre entwickelte sich der Betrieb von einem Hobby-Projekt zu einem beliebten Online-Shop für Weinliebhaber, der deutschlandweit bis zu 200.000 Kunden zählte. Doch nun dro… [+2058 chars]",,de,'Wein'
https://www.zeit.de/news/2025-05/16/stoffaustritt-in-wohnhaus-vier-menschen-im-krankenhaus,https://www.zeit.de/news/2025-05/16/stoffaustritt-in-wohnhaus-vier-menschen-im-krankenhaus,0,www.zeit.de,Notfälle: Stoffaustritt in Wohnhaus - vier Menschen im Krankenhaus,Hier finden Sie Informationen zu dem Thema „Notfälle“. Lesen Sie jetzt „Stoffaustritt in Wohnhaus - vier Menschen im Krankenhaus“.,https://img.zeit.de/news/2025-05/16/stoffaustritt-in-wohnhaus-vier-menschen-im-krankenhaus-image-group/wide__1300x731,2025-05-16T07:18:05Z,,Nach dem Austritt eines unbekannten Stoffs sind in Schaafheim (Landkreis Darmstadt-Dieburg) vier Menschen ins Krankenhaus gebracht worden. Am frühen Donnerstagabend hätten in einem Wohnhaus fünf Mens… [+607 chars],,de,'Not'
https://www.tagesspiegel.de/berlin/schauer-und-kalte-regenreicher-start-ins-wochenende-in-berlin-und-brandenburg-13702240.html,https://www.tagesspiegel.de/berlin/schauer-und-kalte-regenreicher-start-ins-wochenende-in-berlin-und-brandenburg-13702240.html,0,www.tagesspiegel.de,Schauer und Kälte: Regenreicher Start ins Wochenende in Berlin und Brandenburg,"Frischer Wind, Regenschauer und kühle Temperaturen bestimmen das Wetter zum Wochenende. Auch Gewitter sind nicht ausgeschlossen.",https://www.tagesspiegel.de/images/13702237/alternates/BASE_16_9_W1400/1747380335000/wolken-uber-berlin-und-brandenburg.jpeg,2025-05-16T07:25:35Z,,Zum Start ins Wochenende erwartet die Menschen in der Hauptstadtregion Regenwetter. Nach einem teils freundlichen Morgen ziehen dem Deutschen Wetterdienst (DWD) zufolge zunehmend dichte Wolken auf. I… [+1615 chars],,de,'Kälte'
https://www.focus.de/panorama/welt/duerre-auf-mallorca-urlauber-muessen-sich-auf-drastisches-pool-verbot-einstellen_8f8fac5c-ead5-472c-949c-a5570157de49.html,https://www.focus.de/panorama/welt/duerre-auf-mallorca-urlauber-muessen-sich-auf-drastisches-pool-verbot-einstellen_8f8fac5c-ead5-472c-949c-a5570157de49.html,0,www.focus.de,Dürre auf Mallorca: Urlauber müssen sich auf drastisches Pool-Verbot einstellen,Die Prognosen für die Wasserreserven Mallorcas in den Sommermonaten sehen düster aus. Strenge Verbote sollen die Situation im Kampf gegen den Mangel entspannen.,https://quadro.burda-forward.de/ctf/46bef558-b484-44b7-91cb-eeb519853e87.68754ea2-f6ef-42cf-817a-d33000485aaa.jpg?im=RegionOfInterestCrop%3D%281200%2C630%29%2CregionOfInterest%3D%281043%2C586%29&hash=a78f80685dc753c2905d5e738d66bd24ded77d4ca7a1c93e3a4174f3b0155818,2025-05-16T10:23:29Z,,"Mallorca leidet unter Wasserknappheit. Erste Gemeinden verbieten bereits das Befüllen von Pools und das Bewässern von Gärten. Aber auch das Bauen von Pools wurde in einigen Orten bereits untersagt.
… [+3119 chars]",,de,'Bewässerung'
https://www.stern.de/gesellschaft/regional/mecklenburg-vorpommern/gaslieferung--debatte-um-nord-stream---afd-vorstoss-im-landtag-abgelehnt-35730030.html,https://www.stern.de/gesellschaft/regional/mecklenburg-vorpommern/gaslieferung--debatte-um-nord-stream---afd-vorstoss-im-landtag-abgelehnt-35730030.html,0,www.stern.de,Gaslieferung: Debatte um Nord Stream - AfD-Vorstoß im Landtag abgelehnt,Jahrelang bezog Deutschland russisches Erdgas auch über die Ostsee-Pipeline Nord Stream. Ungeachtet des fortwährenden Ukraine-Kriegs will die AfD dahin zurück. Nicht aber die Mehrheit im MV-Landtag.,https://image.stern.de/35730032/t/Sd/v1/w1440/r1.7778/-/16--izsi73psk4v1axs2048jpeg---e507d6dbb3d5b128.jpg,2025-05-16T10:57:21Z,https://web.archive.org/web/20250516122219/https://www.stern.de/gesellschaft/regional/mecklenburg-vorpommern/gaslieferung--debatte-um-nord-stream---afd-vorstoss-im-landtag-abgelehnt-35730030.html,"Kopiere den aktuellen Link
Zur Merkliste hinzufügen
Jahrelang bezog Deutschland russisches Erdgas auch über die Ostsee-Pipeline Nord Stream. Ungeachtet des fortwährenden Ukraine-Kriegs will die AfD… [+1539 chars]",,de,'Gas'
https://www.dw.com/de/zu-wenig-regen-was-tun-gegen-d%C3%BCrre-in-deutschland/a-72555373,https://www.dw.com/de/zu-wenig-regen-was-tun-gegen-d%C3%BCrre-in-deutschland/a-72555373,0,www.dw.com,Zu wenig Regen: Was tun gegen Dürre in Deutschland?,"Selten war es im Frühjahr so trocken wie 2025. Landwirtschaft, Grundwasser und sogar Verbraucherpreise leiden darunter, Pflanzen und Ökosysteme geraten frühzeitig unter Stress. Was kann man dagegen tun?",https://static.dw.com/image/72556904_6.jpg,2025-05-16T11:26:00Z,,"Eine alte Bauernweisheit besagt: ""Ist der Mai kühl und nass, füllt's dem Bauern Scheun' und Fass"". Aber der Regen, der dafür nötig wäre, ist nicht in Sicht. Im Gegenteil: Es ist deutlich zu trocken. … [+7179 chars]",,de,'Landwirtschaft'
https://www.morgenpost.de/ratgeber-wissen/article407517108/waermepumpen-kosten-heizung-foerderung.html,https://www.morgenpost.de/ratgeber-wissen/article407517108/waermepumpen-kosten-heizung-foerderung.html,0,www.morgenpost.de,Wärmepumpe günstiger als Ölheizung? Diese Zahlen überraschen,"Die Kosten für eine Wärmepumpe gleichen sich der eine neuen Gas- oder Ölheizung an. Wie teuer die Systeme im Vergleich sind, erklärt ein Experte.",https://img.sparknews.funkemedien.de/408099843/408099843_1742029022_v16_9_1600.jpeg,2025-05-16T11:50:00Z,,"Eine Wärmepumpe ist kaum noch teurer als eine neue Gas- oder Ölheizung. Aus Sicht eines Experten liegt das primär an zwei Punkten.
<ul><li>Die staatliche Förderung kann die Kosten einer Wärmepumpe d… [+10908 chars]",,de,'Gas'
https://www.faz.net/aktuell/wirtschaft/unternehmen/glyphosat-bayer-spielt-jetzt-den-monsanto-konkurs-durch-110480605.html,https://www.faz.net/aktuell/wirtschaft/unternehmen/glyphosat-bayer-spielt-jetzt-den-monsanto-konkurs-durch-110480605.html,0,www.faz.net,"Muss Monsanto sterben, damit Bayer überlebt?","In Amerika droht dem Dax-Konzern neues Unheil – ausgerechnet aus der Trump-Regierung. Bayer will die Klagen eindämmen, zur Not mit zwei drastischen Maßnahmen.",https://media1.faz.net/ppmedia/aktuell/3488260604/1.10387057/facebook_teaser/die-rechtsstreitigkeiten-um.jpg,2025-05-16T11:57:13Z,,"Bill Anderson, der Vorstandsvorsitzende von Bayer, ist in diesen Tagen in Washington unterwegs, um in einer existenziellen Frage für den Pharma- und Agrarchemiekonzern für seine Position zu werben: W… [+7377 chars]",,de,'Not'
https://www.stern.de/gesellschaft/regional/rheinland-pfalz-saarland/zwischen-koblenz-und-mainz--einschraenkungen-im-linksrheinischen-regionalverkehr-35730592.html,https://www.stern.de/gesellschaft/regional/rheinland-pfalz-saarland/zwischen-koblenz-und-mainz--einschraenkungen-im-linksrheinischen-regionalverkehr-35730592.html,0,www.stern.de,Zwischen Koblenz und Mainz: Einschränkungen im linksrheinischen Regionalverkehr,Mainz (lrs) - Auf der wichtigen Rheinstrecke zwischen Koblenz und Mainz wird an mehreren Stellen dem Zweckverband ÖPNV Rheinland-Pfalz-Süd zufolge,https://image.stern.de/35730594/t/qX/v1/w1440/r1.7778/-/16--yubbvkouqbv9axs2048jpeg---1e3515801073bc76.jpg,2025-05-16T12:51:02Z,https://web.archive.org/web/20250516163152/https://www.stern.de/gesellschaft/regional/rheinland-pfalz-saarland/zwischen-koblenz-und-mainz--einschraenkungen-im-linksrheinischen-regionalverkehr-35730592.html,"Kopiere den aktuellen Link
Zur Merkliste hinzufügen
Bauarbeiten an mehreren Abschnitten führen zu Änderungen bei Zugverbindungen. Auch Richtung Frankfurt läuft es nicht wie gewohnt.
Auf der wichti… [+974 chars]",,de,'ÖPNV'
https://www.zeit.de/news/2025-05/16/debatte-um-nord-stream-afd-vorstoss-im-landtag-abgelehnt,https://www.zeit.de/news/2025-05/16/debatte-um-nord-stream-afd-vorstoss-im-landtag-abgelehnt,0,www.zeit.de,Gaslieferung: Debatte um Nord Stream – AfD-Vorstoß im Landtag abgelehnt,Hier finden Sie Informationen zu dem Thema „Gaslieferung“. Lesen Sie jetzt „Debatte um Nord Stream – AfD-Vorstoß im Landtag abgelehnt“.,https://img.zeit.de/news/2025-05/16/debatte-um-nord-stream-afd-vorstoss-im-landtag-abgelehnt-image-group/wide__1300x731,2025-05-16T12:53:59Z,https://web.archive.org/web/20250517092642/https://www.zeit.de/news/2025-05/16/debatte-um-nord-stream-afd-vorstoss-im-landtag-abgelehnt,Eine Reaktivierung der Erdgasleitungen Nord Stream 1 und Nord Stream 2 für den Import russischen Erdgases nach Deutschland trifft bei der großen Mehrheit im Landtag Mecklenburg-Vorpommerns auf entsch… [+4174 chars],,de,'Energiekosten'
https://www.stern.de/wirtschaft/steigen-die-lebensmittelpreise-wegen-des-erwarteten-hitzesommers--35727030.html,https://www.stern.de/wirtschaft/steigen-die-lebensmittelpreise-wegen-des-erwarteten-hitzesommers--35727030.html,0,www.stern.de,﻿﻿Hitzesommer vorhergesagt: Steigen die Lebensmittelpreise jetzt immer weiter?,"Die Lebensmittelpreise sind schon hoch. Nun sorgen sich Landwirte wegen der Dürre, Experten erwarten einen sehr heißen Sommer. Welche Produkte noch teurer werden könnten.",https://image.stern.de/35729808/t/F4/v2/w1440/r1.7778/-/gettyimages-1407743229.gif,2025-05-16T13:03:00Z,https://web.archive.org/web/20250516134334/https://www.stern.de/wirtschaft/steigen-die-lebensmittelpreise-wegen-des-erwarteten-hitzesommers--35727030.html,"Kopiere den aktuellen Link
Zur Merkliste hinzufügen
Die Lebensmittelpreise sind schon hoch. Nun sorgen sich Landwirte wegen der Dürre, Experten erwarten einen sehr heißen Sommer. Welche Produkte no… [+4394 chars]",,de,'Dürre'
https://www.morgenpost.de/ratgeber-wissen/article407560283/waermepumpe-stromverbrauch-tarif-kosten.html,https://www.morgenpost.de/ratgeber-wissen/article407560283/waermepumpe-stromverbrauch-tarif-kosten.html,0,www.morgenpost.de,Heizung gegen Wärmepumpe: Wie hoch ist der Stromverbrauch?,"Der Stromverbrauch einer Wärmepumpe pro Jahr lässt sich über zwei Wege berechnen. Ein Experte erklärt, wie sich die Kosten senken lassen.",https://img.sparknews.funkemedien.de/407672667/407672667_1731431008_v16_9_1600.jpeg,2025-05-16T13:35:00Z,https://web.archive.org/web/20250518050043/https://www.morgenpost.de/ratgeber-wissen/article407560283/waermepumpe-stromverbrauch-tarif-kosten.html,"Wer eine Wärmepumpe neu einbaut, sollte vorher den Stromverbrauch berechnen. Dafür gibt es zwei Wege, ein Experte erklärt das Vorgehen.
<ul><li>Der Stromverbrauch einer Wärmepumpe pro Jahr beträgt n… [+10106 chars]",,de,'Heizung'
https://www.stern.de/geo/junko-tabei--die-frau--die-den-mount-everest-bezwang-35731110.html,https://www.stern.de/geo/junko-tabei--die-frau--die-den-mount-everest-bezwang-35731110.html,0,www.stern.de,"Junko Tabei: Die Frau, die den höchsten Berg der Welt bezwang",Vor 50 Jahren steht eine Japanerin auf dem höchsten Gipfel der Erde. Ein Foto von ihr im Schnee belegt ihre nie da gewesene Leistung – und symbolisiert einen Durchbruch für Frauen.,https://image.stern.de/35731106/t/32/v4/w1440/r1.7778/-/junkotabei-everest-1975-pa-116852143.jpg,2025-05-16T14:25:00Z,,"Kopiere den aktuellen Link
Zur Merkliste hinzufügen
Vor 50 Jahren steht eine Japanerin auf dem höchsten Gipfel der Erde. Ein Foto von ihr im Schnee belegt ihre nie da gewesene Leistung und symbolis… [+3488 chars]",,de,'Schnee'
https://www.kino.de/news/fuer-bridgerton-fans-diese-neue-netflix-serie-verspricht-jede-menge-royalen-spass/,https://www.kino.de/news/fuer-bridgerton-fans-diese-neue-netflix-serie-verspricht-jede-menge-royalen-spass/,0,www.kino.de,Für „Bridgerton“-Fans: Diese neue Netflix-Serie verspricht jede Menge royalen Spaß,Eine neue Serie bringt frischen Wind in die royale Serienwelt und gehört auf die Watchlist von „Bridgerton“-Liebhaber*innen...,https://crops.giga.de/b6/40/65/24fe0a632f9dd1f26a6f860c3f_YyAxODk1eDk5MCsxMysxMwJyZSAxMjAwIDYyNwNiMDJlNmZkMjY2Mw==.jpg,2025-05-16T16:15:30Z,,"Eine neue Serie bringt frischen Wind in die royale Serienwelt und gehört auf die Watchlist von „Bridgerton“-Liebhaber*innen.
Opulente Kulissen, prickelnde Romanze und eine royale Familie, die sich i… [+3795 chars]",,de,'Wind'
https://www.stern.de/panorama/wissen/nach-wasser-lechzende-pflanzen--monate-fast-ohne-regen---droht-ein-schlimmer-duerresommer--35731900.html,https://www.stern.de/panorama/wissen/nach-wasser-lechzende-pflanzen--monate-fast-ohne-regen---droht-ein-schlimmer-duerresommer--35731900.html,0,www.stern.de,Nach Wasser lechzende Pflanzen: Monate fast ohne Regen - Droht ein schlimmer Dürresommer?,"Selten hielt eine Dürrephase so lange an wie aktuell. Jungpflanzen haben schwer zu kämpfen. Droht eine Milliardenschäden verursachende Dürrephase, wie sie vor sieben Jahren ihren Lauf nahm?",https://image.stern.de/35731902/t/3C/v1/w1440/r1.7778/-/17--umv7vj6ziov3axs2048jpeg---ae11c37aed0a3d4a.jpg,2025-05-17T02:00:49Z,https://web.archive.org/web/20250517034749/https://www.stern.de/panorama/wissen/nach-wasser-lechzende-pflanzen--monate-fast-ohne-regen---droht-ein-schlimmer-duerresommer--35731900.html,"Kopiere den aktuellen Link
Zur Merkliste hinzufügen
Selten hielt eine Dürrephase so lange an wie aktuell. Jungpflanzen haben schwer zu kämpfen. Droht eine Milliardenschäden verursachende Dürrephase… [+6738 chars]",,de,'Dürre'
https://www.zeit.de/news/2025-05/17/monate-fast-ohne-regen-droht-ein-schlimmer-duerresommer,https://www.zeit.de/news/2025-05/17/monate-fast-ohne-regen-droht-ein-schlimmer-duerresommer,0,www.zeit.de,Nach Wasser lechzende Pflanzen: Monate fast ohne Regen - Droht ein schlimmer Dürresommer?,Hier finden Sie Informationen zu dem Thema „Nach Wasser lechzende Pflanzen“. Lesen Sie jetzt „Monate fast ohne Regen - Droht ein schlimmer Dürresommer?“.,https://img.zeit.de/news/2025-05/17/monate-fast-ohne-regen-droht-ein-schlimmer-duerresommer-image-group/wide__1300x731,2025-05-17T02:00:49Z,,"Die anhaltende Dürre hat zunehmend Folgen für Wald und Landwirtschaft. Beim Anfang April gesäten Mais könnten die Jungpflanzen regional kaum noch Wasser aus dem Boden ziehen und blieben mickrig, erkl… [+6533 chars]",,de,'Dürre'
https://www.tagesspiegel.de/wissen/nach-wasser-lechzende-pflanzen-monate-fast-ohne-regen-droht-ein-schlimmer-durresommer-13708318.html,https://www.tagesspiegel.de/wissen/nach-wasser-lechzende-pflanzen-monate-fast-ohne-regen-droht-ein-schlimmer-durresommer-13708318.html,0,www.tagesspiegel.de,Nach Wasser lechzende Pflanzen: Monate fast ohne Regen - Droht ein schlimmer Dürresommer?,"Selten hielt eine Dürrephase so lange an wie aktuell. Jungpflanzen haben schwer zu kämpfen. Droht eine Milliardenschäden verursachende Dürrephase, wie sie vor sieben Jahren ihren Lauf nahm?",https://www.tagesspiegel.de/images/13708315/alternates/BASE_16_9_W1400/1747447403000/trockenheit.jpeg,2025-05-17T02:03:23Z,,"Die anhaltende Dürre hat zunehmend Folgen für Wald und Landwirtschaft. Beim Anfang April gesäten Mais könnten die Jungpflanzen regional kaum noch Wasser aus dem Boden ziehen und blieben mickrig, erkl… [+7251 chars]",,de,'Dürre'
https://www.stern.de/gesellschaft/regional/bayern/obstanbau--der-regen-fehlt--nur-kleine-kirschen-aus-franken--35731926.html,https://www.stern.de/gesellschaft/regional/bayern/obstanbau--der-regen-fehlt--nur-kleine-kirschen-aus-franken--35731926.html,0,www.stern.de,Obstanbau: Der Regen fehlt: nur kleine Kirschen aus Franken?,"Wochenlang kaum Niederschlag - das lässt auch die Kirschbauern in Franken bangen. Denn je kleiner die Kirsche, desto niedriger der Preis. Braucht es künstliche Bewässerung in großem Stil?",https://image.stern.de/35731928/t/XE/v1/w1440/r1.7778/-/17--x2rk6foz2ov10axs2048jpeg---ebb172743abf56fe.jpg,2025-05-17T02:30:41Z,https://web.archive.org/web/20250517035026/https://www.stern.de/gesellschaft/regional/bayern/obstanbau--der-regen-fehlt--nur-kleine-kirschen-aus-franken--35731926.html,"Kopiere den aktuellen Link
Zur Merkliste hinzufügen
Wochenlang kaum Niederschlag - das lässt auch die Kirschbauern in Franken bangen. Denn je kleiner die Kirsche, desto niedriger der Preis. Braucht… [+2177 chars]",,de,'Bewässerung'
