index,url,valid,domain,title,description,image,published,archive,content,quote,language,keyword
https://www.fitforfun.de/sex-soul/partnerschaft/sexleben-auffrischen-besserer-sex-in-7-tagen-mit-diesem-plan-kann-es-klappen-526381.html,https://www.fitforfun.de/sex-soul/partnerschaft/sexleben-auffrischen-besserer-sex-in-7-tagen-mit-diesem-plan-kann-es-klappen-526381.html,0,www.fitforfun.de,Sexleben auffrischen: Wie Kommunikation für besseren Sex sorgt,"Du möchtest dein Sexleben auffrischen, aber weißt nicht genau wie. Wir haben die wichtigsten Tipps für dich, damit du endlich wieder frischen Wind in dein Schlafzimmer bringst.","https://www.fitforfun.de/files/images/202106/1/welche-sexstellung-verbrennt-am-meisten-kalorien,483406_3x2_n.jpg",2023-04-03T12:24:00Z,,"Lesetipp
Das schafft Vertrauen. Vermeide abwertend auf die Wünsche deines Partners zu reagieren. Werden bei der Fantasie deines Partners deine Grenzen überschritten, muss das allerdings auch deutlic… [+33 chars]",,de,'Wind'
https://www.wiwo.de/finanzen/immobilien/immobilien-finden-sie-wohnen-auch-ziemlich-anstrengend/29075024.html,https://www.wiwo.de/finanzen/immobilien/immobilien-finden-sie-wohnen-auch-ziemlich-anstrengend/29075024.html,0,www.wiwo.de,Immobilien: Finden Sie Wohnen auch ziemlich anstrengend?,"Immobilienbesitzer erleben einen Zangenangriff: Zinsen und Auflagen für Heizung und Dämmung steigen. Manche Details der Pläne erinnern an die Corona-Regeln. Besser also, man macht sich einen eigenen Plan. Ein Kommentar.",https://www.wiwo.de/images/imago0240101880h/29075594/2-format11240.jpg,2023-04-03T12:50:43Z,https://web.archive.org/web/20230403231155/https://www.wiwo.de/finanzen/immobilien/immobilien-finden-sie-wohnen-auch-ziemlich-anstrengend/29075024.html,"Vor einiger Zeit kam mir ein seltsamer Satz unter. Ich glaube es war auf einer jener Home-Warming-Partys, auf denen man drinnen über die Farbtöne von Farrow &amp; Ball spricht und draußen auf der Ter… [+6358 chars]",,de,'Heizung'
https://www.n-tv.de/ratgeber/Ol-und-Gasheizungsverbot-kommt-aber--article24030861.html,https://www.n-tv.de/ratgeber/Ol-und-Gasheizungsverbot-kommt-aber--article24030861.html,0,www.n-tv.de,"Viele Ausnahmen vorgesehen: Öl- und Gasheizungsverbot kommt, aber ...","Neu eingebaute Heizungen sollen nach den Plänen der Regierung ab dem Jahr 2024 zu 65 Prozent mit erneuerbaren Energien betrieben werden müssen. Das erfreut nicht jeden. Zudem ist auch nicht jedem klar, was die Reform des Gebäudeenergiegesetzes konkret bedeute…",https://bilder3.n-tv.de/img/incoming/crop23958422/172132778-cImg_16_9-w1200/imago0238226576h.jpg,2023-04-03T13:23:40Z,https://web.archive.org/web/20230403175121/https://www.n-tv.de/ratgeber/Ol-und-Gasheizungsverbot-kommt-aber--article24030861.html,Neu eingebaute Heizungen sollen nach den Plänen der Regierung ab dem Jahr 2024 zu 65 Prozent mit erneuerbaren Energien betrieben werden müssen. Das erfreut nicht jeden. Zudem ist auch nicht jedem kla… [+5378 chars],,de,'Gas'
https://www.stern.de/wirtschaft/news/energie--waermewende-soll-buerger-jaehrlich-neun-milliarden-euro-kosten-33343606.html,https://www.stern.de/wirtschaft/news/energie--waermewende-soll-buerger-jaehrlich-neun-milliarden-euro-kosten-33343606.html,0,www.stern.de,Energie: Wärmewende soll Bürger jährlich neun Milliarden Euro kosten,Wie viele Kosten kommen auf die Bürger bei dem geplanten Gebäudeenergiegesetz zu? Ein Entwurf dazu nennt erstmals Zahlen. Kritik gibt es an den geplanten staatlichen Hilfen bei neuen Heizungen.,https://image.stern.de/33344738/t/MP/v1/w1440/r1.7778/-/03--urnnewsmldpacom2009010123040399195754v3w800h600l706t289r1986b1564jpeg---93c874ce5f2a8346.jpg,2023-04-03T13:31:35Z,https://web.archive.org/web/20230403173352/https://www.stern.de/wirtschaft/news/energie--waermewende-soll-buerger-jaehrlich-neun-milliarden-euro-kosten-33343606.html,"Wie viele Kosten kommen auf die Bürger bei dem geplanten Gebäudeenergiegesetz zu? Ein Entwurf dazu nennt erstmals Zahlen. Kritik gibt es an den geplanten staatlichen Hilfen bei neuen Heizungen.
Für … [+4063 chars]",,de,'Heizung'
https://taz.de/Geplanter-Austausch-fossiler-Heizungen/!5923526/,https://taz.de/Geplanter-Austausch-fossiler-Heizungen/!5923526/,0,taz.de,Geplanter Austausch fossiler Heizungen: Wärmewende überfordert Häuslebauer,Der Wohlfahrtsverband Der Paritätische fordert beim Heizungsaustausch eine Förderung nach Vermögenslage. Viele Hausbesitzer haben keine Rücklagen.,https://taz.de/picture/6188804/948/Heizungsumbau-1.jpeg,2023-04-03T15:12:00Z,https://web.archive.org/web/20230403191237/https://taz.de/Geplanter-Austausch-fossiler-Heizungen/!5923526/,"Der Wohlfahrtsverband Der Paritätische fordert beim Heizungsaustausch eine Förderung nach Vermögenslage. Viele Hausbesitzer haben keine Rücklagen.
Eine Wärmepumpe als Ersatz für eine Öl- oder Gashei… [+3054 chars]",,de,'Heizung'
https://taz.de/Soziale-Abfederung-des-Heizungsaustauschs/!5923532/,https://taz.de/Soziale-Abfederung-des-Heizungsaustauschs/!5923532/,0,taz.de,Soziale Abfederung des Heizungsaustauschs: Angst vor Überforderung nehmen,"Dass für das Klima fossile Heizungen ausgetauscht werden sollen, ist richtig. Doch das darf nicht auf Kosten derer gehen, die sich das nicht leisten können.",https://taz.de/picture/6188606/948/Heizung-Fossil-Erneuerung-Klima-Energie-1.jpeg,2023-04-03T16:00:00Z,https://web.archive.org/web/20230403171855/https://taz.de/Soziale-Abfederung-des-Heizungsaustauschs/!5923532/,"Dass für das Klima fossile Heizungen ausgetauscht werden sollen, ist richtig. Doch das darf nicht auf Kosten derer gehen, die sich das nicht leisten können.
Eine Wohnsiedlung während der Heizperiode… [+2109 chars]",,de,'Heizung'
https://www.focus.de/finanzen/news/erstmals-rechnet-habecks-ministerium-vor-was-der-heizungs-hammer-kostet_id_190120847.html,https://www.focus.de/finanzen/news/erstmals-rechnet-habecks-ministerium-vor-was-der-heizungs-hammer-kostet_id_190120847.html,0,www.focus.de,Ministerium legt Zahlen vor - Was uns Habecks Heizungs-Hammer kostet - und wie viel wir sparen,Wie viele Kosten kommen auf die Bürger bei dem geplanten Gebäudeenergiegesetz zu? Ein am Montag veröffentlichter Entwurf dazu nennt erstmals Zahlen. Kritik gibt es an den geplanten staatlichen Hilfen bei neuen Heizungen.,https://p6.focus.de/img/fotos/id_189858363/habeck.jpg?im=Crop%3D%280%2C0%2C3389%2C1693%29%3BResize%3D%281200%2C627%29&hash=179e81898e55f7f3c6f0f4f7006493b0b88ec2b107e42af1f3e13dadf50148be,2023-04-03T16:20:03Z,https://web.archive.org/web/20230403234100/https://www.focus.de/finanzen/news/erstmals-rechnet-habecks-ministerium-vor-was-der-heizungs-hammer-kostet_id_190120847.html,Für den Einbau klimafreundlicherer Heizungen müssen Bürgerinnen und Bürger nach Einschätzung des Wirtschaftsministeriums bis 2028 jährlich mehr als neun Milliarden Euro in die Hand nehmen. Das geht a… [+4688 chars],,de,'Heizung'
https://www.faz.net/aktuell/wirtschaft/65-prozent-erneuerbare-9-milliarden-fuer-die-heizwende-18797953.html,https://www.faz.net/aktuell/wirtschaft/65-prozent-erneuerbare-9-milliarden-fuer-die-heizwende-18797953.html,0,www.faz.net,9 Milliarden Euro im Jahr für die Heizungswende,"Vor allem auf private Hauseigentümer kommen hohe Ausgaben zu. Die Regierung sagt, unter dem Strich seien die Ersparnisse höher als die Kosten. Doch das sieht nicht jeder so.",https://media0.faz.net/ppmedia/aktuell/4206555150/1.8797952/facebook_teaser/alles-im-lot-fuer-viele.jpg,2023-04-03T17:18:29Z,https://web.archive.org/web/20230403174849/https://www.faz.net/aktuell/wirtschaft/65-prozent-erneuerbare-9-milliarden-fuer-die-heizwende-18797953.html,"In der ersten Fassung des Gesetzentwurfs hatten das Wirtschafts- und das Bauministerium den Punkt Erfüllungsaufwand noch offengelassen. Jetzt aber zeichnet sich ab, wie viel die von der Bundesregieru… [+4332 chars]",,de,'Heizung'
